id	conversation_id	created_at	date	time	timezone	user_id	username	name	place	tweet	language	mentions	urls	photos	replies_count	retweets_count	likes_count	hashtags	cashtags	link	retweet	quote_url	video	thumbnail	near	geo	source	user_rt_id	user_rt	retweet_id	reply_to	retweet_date	translate	trans_src	trans_dest
1336729385668403213	1336729385668403213	2020-12-09 12:48:15 EST	2020-12-09	12:48:15	-0400	1086316494450032640	repjimbaird	Congressman Jim Baird		Congratulations to Ashwin Sivakumar for being Purdue’s University first graduate to become a Space Force officer. Space Force presents new and exciting opportunities for our nation and I’m glad to see Purdue students helping lead this venture.  https://t.co/cXIAAQKiBW	en	[]	['https://www.jconline.com/story/news/2020/12/08/purdue-student-become-first-university-join-space-force/3855933001/']	[]	10	1	9	[]	[]	https://twitter.com/RepJimBaird/status/1336729385668403213	False		0								[]				
1336415854804803588	1336415816221413393	2020-12-08 16:02:23 EST	2020-12-08	16:02:23	-0400	1086316494450032640	repjimbaird	Congressman Jim Baird		The American economy needs water infrastructure to be reliable, well maintained, and cost-effective –today’s bill achieves that.	en	[]	[]	[]	4	0	3	[]	[]	https://twitter.com/RepJimBaird/status/1336415854804803588	False		0								[]				
1336415816221413393	1336415816221413393	2020-12-08 16:02:14 EST	2020-12-08	16:02:14	-0400	1086316494450032640	repjimbaird	Congressman Jim Baird		Today, I voted to pass the Water Resources Development Act. Our nation’s lock and dam system and deep water ports are critical to the competitiveness of Hoosier farmers and manufacturing.	en	[]	[]	[]	7	2	6	[]	[]	https://twitter.com/RepJimBaird/status/1336415816221413393	False		0								[]				
1336370890129494019	1336370890129494019	2020-12-08 13:03:43 EST	2020-12-08	13:03:43	-0400	1086316494450032640	repjimbaird	Congressman Jim Baird		If you’re a farmer or rancher who has been affected by the COVID-19 pandemic, the deadline to file for the Coronavirus Food Assistance Program is this Thursday, December 11.   To find more information and apply, click here:  https://t.co/kdQUbxt2gx	en	[]	['https://www.farmers.gov/cfap']	[]	4	3	4	[]	[]	https://twitter.com/RepJimBaird/status/1336370890129494019	False		0								[]				
1336328297043513347	1336328297043513347	2020-12-08 10:14:28 EST	2020-12-08	10:14:28	-0400	1086316494450032640	repjimbaird	Congressman Jim Baird		I am a proud supporter of the Pro-Life movement and that is why I will oppose any effort from Democrats to strip the Hyde Amendment, which prohibits federal funds from paying for abortion. #SaveHyde	en	[]	[]	[]	7	2	7	['savehyde']	[]	https://twitter.com/RepJimBaird/status/1336328297043513347	False	https://twitter.com/rosadelauro/status/1333538158433214465	0								[]				
1335982914379583488	1335982914379583488	2020-12-07 11:22:02 EST	2020-12-07	11:22:02	-0400	1086316494450032640	repjimbaird	Congressman Jim Baird		Seventy-nine years ago today, our nation was attacked in a day that lives in infamy. On this day, we remember the 2,403 brave men and women who lost their lives at Pearl Harbor. #PearlHarborRemembranceDay  https://t.co/ZVWi9fGGyq	en	[]	[]	['https://pbs.twimg.com/media/EopdTgAWMAAL6ci.jpg']	5	9	39	['pearlharborremembranceday']	[]	https://twitter.com/RepJimBaird/status/1335982914379583488	False		1	https://pbs.twimg.com/media/EopdTgAWMAAL6ci.jpg							[]				
1335003451177095169	1335003451177095169	2020-12-04 18:30:00 EST	2020-12-04	18:30:00	-0400	1086316494450032640	repjimbaird	Congressman Jim Baird		I’m truly sadden to hear about the loss of Kevin Page. I’ve had the pleasure of meeting Kevin several times and he was always cheerful. He was a great friend to the community and will be sorely missed. My sincere sympathies to his family and friends.   https://t.co/2Gf9uFo1L3	en	[]	['https://www.wlfi.com/content/news/White-County-Commissioner-elect-Kevin-Page-passes-away-573281451.html']	[]	1	1	1	[]	[]	https://twitter.com/RepJimBaird/status/1335003451177095169	False		0								[]				
1334970974052241414	1334970974052241414	2020-12-04 16:20:57 EST	2020-12-04	16:20:57	-0400	1086316494450032640	repjimbaird	Congressman Jim Baird		I went on the House floor today on behalf of the residents surrounding Lake Freeman &amp; Shafer to let them know I will continue to work so the catastrophe at Lake Freeman is never repeated.  https://t.co/wVE3LzSMza	en	[]	[]	[]	1	2	5	[]	[]	https://twitter.com/RepJimBaird/status/1334970974052241414	False		1	https://pbs.twimg.com/ext_tw_video_thumb/1334970897782935555/pu/img/bBujrasTojITJ2ZF.jpg							[]				
1334503811344424963	1334503811344424963	2020-12-03 09:24:37 EST	2020-12-03	09:24:37	-0400	1086316494450032640	repjimbaird	Congressman Jim Baird		Great news for Morgan County!   Nice-Pak announced they will invest $165 million in a new facility in Mooresville that will create 250 new jobs for the community.   https://t.co/nrdT5LG8Ze	en	[]	['https://www.hoosiertimes.com/reporter_times/mdt/nice-pak-to-bring-250-new-jobs-to-morgan-county/article_1335be92-33f5-11eb-9a77-1f5826571a4c.html']	[]	0	1	0	[]	[]	https://twitter.com/RepJimBaird/status/1334503811344424963	False		0								[]				
1333890057560862721	1333890057560862721	2020-12-01 16:45:46 EST	2020-12-01	16:45:46	-0400	1086316494450032640	repjimbaird	Congressman Jim Baird		Our communities always come through for a friend and neighbor! Mr. Cottrell’s longstanding tradition of spreading the Christmas spirit continues.   A Merry Christmas and a speedy recovery to Mr. Cottrell!    https://t.co/yIPlRHktJi	en	[]	['https://www.jconline.com/story/news/2020/12/01/christmas-lights-abc-rossville-indiana-family-friends-help-decorate/6475465002/']	[]	0	1	1	[]	[]	https://twitter.com/RepJimBaird/status/1333890057560862721	False		0								[]				
1333813363999174660	1333813294126292993	2020-12-01 11:41:01 EST	2020-12-01	11:41:01	-0400	1086316494450032640	repjimbaird	Congressman Jim Baird		Along his journey to success, he made sure to always give back to the community and offer a helping hand to those in need.   His legacy of unbridled optimism and compassion will live on in the community and by those who knew him.   https://t.co/DW7zsQ4Cz9	en	[]	['https://www.pharostribune.com/news/article_d87f0194-3356-11eb-b64e-9f564d714061.html']	[]	1	0	1	[]	[]	https://twitter.com/RepJimBaird/status/1333813363999174660	False		0								[]				
1333813294126292993	1333813294126292993	2020-12-01 11:40:45 EST	2020-12-01	11:40:45	-0400	1086316494450032640	repjimbaird	Congressman Jim Baird		My deepest condolences to Mr. Cole’s family on his passing. Mr. Cole personified the American dream. He came from humble beginnings and through hard work, he became a successful businessman.	en	[]	[]	[]	1	1	2	[]	[]	https://twitter.com/RepJimBaird/status/1333813294126292993	False		0								[]				
1333480207936851973	1333480207936851973	2020-11-30 13:37:11 EST	2020-11-30	13:37:11	-0400	1086316494450032640	repjimbaird	Congressman Jim Baird		The Indiana Dept. of Health announced free COVID-19 testing for Jasper County. Those in Jasper County who wish to get tested can go to the Rensselaer Fire Station on 1060 W. Clark St.   For more information on other available testing sites, please visit:  https://t.co/TRMM5DvfVZ	en	[]	['https://www.coronavirus.in.gov/']	[]	3	1	3	[]	[]	https://twitter.com/RepJimBaird/status/1333480207936851973	False		0								[]				
1331968454643970055	1331968454643970055	2020-11-26 09:30:01 EST	2020-11-26	09:30:01	-0400	1086316494450032640	repjimbaird	Congressman Jim Baird		Enjoy each and every moment of this wonderful day and be grateful to God for all the blessings. Happy Thanksgiving to you and your family.  https://t.co/4FbAvKk5Jk	en	[]	[]	['https://pbs.twimg.com/media/Enr_sKjW4AspRlT.jpg']	4	3	5	[]	[]	https://twitter.com/RepJimBaird/status/1331968454643970055	False		1	https://pbs.twimg.com/media/Enr_sKjW4AspRlT.jpg							[]				
1329870083162779649	1329870083162779649	2020-11-20 14:31:50 EST	2020-11-20	14:31:50	-0400	1086316494450032640	repjimbaird	Congressman Jim Baird		While negotiations continue for additional COVID-19 relief, there is more than $138 billion existing unused PPP funds that should be released.   I signed a discharge petition to allow these funds to be used for small businesses. I implore the Speaker to bring this to a vote.	en	[]	[]	[]	5	1	4	[]	[]	https://twitter.com/RepJimBaird/status/1329870083162779649	False		0								[]				
1329527558883434503	1329527558883434503	2020-11-19 15:50:46 EST	2020-11-19	15:50:46	-0400	1086316494450032640	repjimbaird	Congressman Jim Baird		Thanks to @SecArmy for reversing the decision to cancel the annual Wreaths Across America event.   This tradition serves as a reminder that the freedom we enjoy comes with a heavy price.   https://t.co/W8c1aS4mu4	en	[{'screen_name': 'secarmy', 'name': 'secarmy', 'id': '814367737342328833'}]	['https://apnews.com/article/donald-trump-army-media-social-media-coronavirus-pandemic-fb4bc69c33bf6fc78c0469d406cd0275']	[]	4	1	8	[]	[]	https://twitter.com/RepJimBaird/status/1329527558883434503	False		0								[]				
1329445692557889543	1329445692557889543	2020-11-19 10:25:27 EST	2020-11-19	10:25:27	-0400	1086316494450032640	repjimbaird	Congressman Jim Baird		This #NationalRuralHealthDay, we celebrate the power and resilience of our rural health care providers. Thanks to those who stepped up and continue to help Hoosiers in our rural communities amid a global pandemic!  https://t.co/97D0zIfghl	en	[]	[]	['https://pbs.twimg.com/media/EnMjzjOWMAMPHFJ.jpg']	5	2	4	['nationalruralhealthday']	[]	https://twitter.com/RepJimBaird/status/1329445692557889543	False		1	https://pbs.twimg.com/media/EnMjzjOWMAMPHFJ.jpg							[]				
1329168836596281350	1329168836596281350	2020-11-18 16:05:20 EST	2020-11-18	16:05:20	-0400	1086316494450032640	repjimbaird	Congressman Jim Baird		November is Military Family Appreciation Month!  We thank and show our appreciation to the families of those who wear the uniform. Each day they share in the sacrifice so that our nation can be protected and free. To all military families, thank you for all that you do!  https://t.co/acogBfmKM5	en	[]	[]	['https://pbs.twimg.com/media/EnImhrXXEAEUyOm.jpg']	2	3	6	[]	[]	https://twitter.com/RepJimBaird/status/1329168836596281350	False		1	https://pbs.twimg.com/media/EnImhrXXEAEUyOm.jpg							[]				
1328761818383310848	1328761818383310848	2020-11-17 13:07:59 EST	2020-11-17	13:07:59	-0400	1086316494450032640	repjimbaird	Congressman Jim Baird		“This illustrates a practical solution that comes out of the agricultural community. It’s an opportunity to see government and private, public partnerships function like this.”  https://t.co/EeHcMr1PRj?	en	[]	['https://www.newsbug.info/rensselaer_republican/news/ceres-solutions-countrymark-announce-e15-usda-grant/article_9817143a-fc91-5bd6-8af4-b6af8b231f8c.html']	[]	2	1	0	[]	[]	https://twitter.com/RepJimBaird/status/1328761818383310848	False		0								[]				
1328382322958360578	1328382322958360578	2020-11-16 12:00:00 EST	2020-11-16	12:00:00	-0400	1086316494450032640	repjimbaird	Congressman Jim Baird		Fantastic news! Operation Warp Speed has proven to be a great success and because of it, we will be able to deliver a safe and effective vaccine to the American people.   https://t.co/kcDUbWGNr6	en	[]	['https://www.foxnews.com/politics/trump-coronavirus-vaccine-moderna-operation-warp-speed']	[]	5	2	3	[]	[]	https://twitter.com/RepJimBaird/status/1328382322958360578	False		0								[]				
1327374430649999360	1327374430649999360	2020-11-13 17:15:00 EST	2020-11-13	17:15:00	-0400	1086316494450032640	repjimbaird	Congressman Jim Baird		Today, the USDA announced a grant to expand biofuel infrastructure for Jasper County today. Biofuel is a key component of America’s energy future by helping secure energy independence, reduces air pollution, and provides an important market for our agriculture producers.  https://t.co/644RkTYUaG	en	[]	[]	['https://pbs.twimg.com/media/EmvA9K0W8AEZarU.jpg', 'https://pbs.twimg.com/media/EmvA9K2XcAAcSoV.jpg', 'https://pbs.twimg.com/media/EmvA9K1W8AIexjn.jpg']	3	2	6	[]	[]	https://twitter.com/RepJimBaird/status/1327374430649999360	False		1	https://pbs.twimg.com/media/EmvA9K0W8AEZarU.jpg							[]				
1327312437943656459	1327312437943656459	2020-11-13 13:08:40 EST	2020-11-13	13:08:40	-0400	1086316494450032640	repjimbaird	Congressman Jim Baird		After celebrating Veterans Day this week, it's important we don’t forget that there is still work in helping our nation’s veterans.   Thanks to events like Stand Down, we can ensure veterans and their families are aware of the resources available to them.   https://t.co/p3FA4UZDXG	en	[]	['https://www.kokomotribune.com/news/helping-heroes-fair-provides-resources-for-vets/article_e0e77ab4-2523-11eb-8d8c-0b8e3f162909.html']	[]	2	2	1	[]	[]	https://twitter.com/RepJimBaird/status/1327312437943656459	False		0								[]				
1326528125824602112	1326528125824602112	2020-11-11 09:12:05 EST	2020-11-11	09:12:05	-0400	1086316494450032640	repjimbaird	Congressman Jim Baird		On #VeteransDay, we reflect on the service of all those who have ever worn a military uniform. We use this day to express our gratitude and appreciation for their efforts to preserve our freedoms. They don’t consider themselves heroes but they certainly feel they are patriots.  https://t.co/qPm9224HS2	en	[]	[]	['https://pbs.twimg.com/media/EmjE3VFWMAEZCxz.jpg']	2	2	9	['veteransday']	[]	https://twitter.com/RepJimBaird/status/1326528125824602112	False		1	https://pbs.twimg.com/media/EmjE3VFWMAEZCxz.jpg							[]				
1326158871744876545	1326158871744876545	2020-11-10 08:44:48 EST	2020-11-10	08:44:48	-0400	1086316494450032640	repjimbaird	Congressman Jim Baird		Happy Birthday to the U.S. Marines! For 245 years, the Marine Corps has proudly defended our nation and upheld our nation’s greatest values. To all the marines, you have the gratitude of a thankful nation.  https://t.co/WvaJrzA8on	en	[]	[]	['https://pbs.twimg.com/media/Emd2buRW8AENnRm.jpg']	3	2	8	[]	[]	https://twitter.com/RepJimBaird/status/1326158871744876545	False		1	https://pbs.twimg.com/media/Emd2buRW8AENnRm.jpg							[]				
1325854277722640385	1325854277722640385	2020-11-09 12:34:27 EST	2020-11-09	12:34:27	-0400	1086316494450032640	repjimbaird	Congressman Jim Baird		This weekend I had the honor of speaking at the bridge dedication ceremony for Frankfort native, Staff Sergeant Jamie Jarboe. Let us never forget his sacrifice and the memory of so many others in defense of freedom and our nation.   https://t.co/Un6yyoNv0Q  https://t.co/5PPP8Yp5Hw	en	[]	['https://www.jconline.com/story/news/2020/11/05/frankfort-remember-jamie-jarboe-downtown-bridge-dedicated-fallen-soldier/6172252002/']	['https://pbs.twimg.com/media/EmZhEvDXMAQAS4T.jpg', 'https://pbs.twimg.com/media/EmZhIwAWMAQ7bWO.jpg']	1	1	2	[]	[]	https://twitter.com/RepJimBaird/status/1325854277722640385	False		1	https://pbs.twimg.com/media/EmZhEvDXMAQAS4T.jpg							[]				
1321890333161115648	1321890333161115648	2020-10-29 15:03:09 EDT	2020-10-29	15:03:09	-0400	1086316494450032640	repjimbaird	Congressman Jim Baird		I spoke with the Brownsburg Rotary Club and shared an update on my work in Indiana and Washington.  Thanks for having me Rotarians!  https://t.co/eFT3pbnTdL	en	[]	[]	['https://pbs.twimg.com/media/ElhMPf0XIAEVOhb.jpg']	11	1	3	[]	[]	https://twitter.com/RepJimBaird/status/1321890333161115648	False		1	https://pbs.twimg.com/media/ElhMPf0XIAEVOhb.jpg							[]				
1321461338812653568	1321461338812653568	2020-10-28 10:38:29 EDT	2020-10-28	10:38:29	-0400	1086316494450032640	repjimbaird	Congressman Jim Baird		As a member of the Congressional Veterans Caucus, Baird brings the team-first mentality he first learned in cooperative housing at Purdue and later in the US Army to bear in his work still today.   https://t.co/JaCMUcDCm4	en	[]	['https://www.purduealumnus.org/alumni/a-life-of-service/']	[]	5	2	1	[]	[]	https://twitter.com/RepJimBaird/status/1321461338812653568	False		0								[]				
1321135451634368521	1321135451634368521	2020-10-27 13:03:31 EDT	2020-10-27	13:03:31	-0400	1086316494450032640	repjimbaird	Congressman Jim Baird		NASA confirmed the discovery of water on the surface of the moon. This discovery could be a game changing development for the Artemis exploration plans.   https://t.co/zutAYwLhVW	en	[]	['https://www.npr.org/2020/10/26/927869069/water-on-the-moon-nasa-confirms-water-molecules-on-our-neighbors-sunny-surface']	[]	3	2	5	[]	[]	https://twitter.com/RepJimBaird/status/1321135451634368521	False		0								[]				
1320884184311877633	1320884184311877633	2020-10-26 20:25:05 EDT	2020-10-26	20:25:05	-0400	1086316494450032640	repjimbaird	Congressman Jim Baird		Justice Barrett is an excellent addition to the Supreme Court. She will be an exemplary jurist who will be impartial and rule in accordance to the Constitution.  https://t.co/AegBDTapyD	en	[]	[]	['https://pbs.twimg.com/media/ElS5AdAXgAQcKId.jpg']	14	4	18	[]	[]	https://twitter.com/RepJimBaird/status/1320884184311877633	False		1	https://pbs.twimg.com/media/ElS5AdAXgAQcKId.jpg							[]				
1320782690828853250	1320782690828853250	2020-10-26 13:41:47 EDT	2020-10-26	13:41:47	-0400	1086316494450032640	repjimbaird	Congressman Jim Baird		Representatives from SBA's Great Lakes Region, the USDA and IN State Department of Agriculture will gather for a virtual event on Oct. 29 to provide rural entrepreneurs and ag producers information on available resources and programs.  Learn more here:   https://t.co/DG3ZBSRyjU	en	[]	['https://www.eventbrite.com/e/resources-and-capital-for-your-indiana-rural-business-tickets-126258296965']	[]	3	2	1	[]	[]	https://twitter.com/RepJimBaird/status/1320782690828853250	False		0								[]				
1319749315976450050	1319749315976450050	2020-10-23 17:15:31 EDT	2020-10-23	17:15:31	-0400	1086316494450032640	repjimbaird	Congressman Jim Baird		The Trump Administration has brokered another peace agreement in the Middle East. This is another huge step towards an era of peace and prosperity.  https://t.co/QgU8V8pGdF	en	[]	['https://www.foxnews.com/politics/trump-sudan-to-join-uae-bahrain-in-recognizing-israel']	[]	28	4	9	[]	[]	https://twitter.com/RepJimBaird/status/1319749315976450050	False		0								[]				
1319670619487768578	1319670619487768578	2020-10-23 12:02:48 EDT	2020-10-23	12:02:48	-0400	1086316494450032640	repjimbaird	Congressman Jim Baird		Earlier this month, myself and several lawmakers asked President Trump to take action on behalf of former Delphi Salaried Retirees. I am happy the President has begun to take steps to intervene and resolve the problem.   https://t.co/xBdfCvBcp3	en	[]	['https://www.whitehouse.gov/presidential-actions/memorandum-president-pensions-delphi-corporation-retirees-retirees-covered-vulnerable-pension-plans/']	[]	1	4	7	[]	[]	https://twitter.com/RepJimBaird/status/1319670619487768578	False		0								[]				
1319306835678167041	1319306835678167041	2020-10-22 11:57:15 EDT	2020-10-22	11:57:15	-0400	1086316494450032640	repjimbaird	Congressman Jim Baird		The Senate Judiciary Committee gave Amy Coney Barrett unanimous approval. I look forward to the Senate confirming her to the Supreme Court next week Monday.  https://t.co/kST5clfQC9	en	[]	[]	['https://pbs.twimg.com/media/Ek8egAUW0AEeg-x.jpg']	9	2	6	[]	[]	https://twitter.com/RepJimBaird/status/1319306835678167041	False		1	https://pbs.twimg.com/media/Ek8egAUW0AEeg-x.jpg							[]				
1319020043070558208	1319020043070558208	2020-10-21 16:57:39 EDT	2020-10-21	16:57:39	-0400	1086316494450032640	repjimbaird	Congressman Jim Baird		I am humbled to be awarded the Friend of Farm Bureau Award by the American Farm Bureau Federation. We’re putting farmers first and providing resources to help keep the world fed. It is a honor and privilege to be a voice for farmers and rural communities in Washington.  https://t.co/L8pgxl1kTv	en	[]	[]	['https://pbs.twimg.com/media/Ek4ZmIYXYAEkKFI.jpg', 'https://pbs.twimg.com/media/Ek4Zm7iXYAET5eJ.jpg']	7	6	14	[]	[]	https://twitter.com/RepJimBaird/status/1319020043070558208	False		1	https://pbs.twimg.com/media/Ek4ZmIYXYAEkKFI.jpg							[]				
1318974640132362242	1318974640132362242	2020-10-21 13:57:14 EDT	2020-10-21	13:57:14	-0400	1086316494450032640	repjimbaird	Congressman Jim Baird		With this donation, Purdue will continue to be a leader in hypersonic research and deliver new technologies.  https://t.co/lxLoaSVLI7	en	[]	['https://www.purdue.edu/newsroom/releases/2020/Q4/purdue-hypersonics-receives-boost-from-northrop-grumman-shock-tunnel-donation.html']	[]	1	1	4	[]	[]	https://twitter.com/RepJimBaird/status/1318974640132362242	False		0								[]				
1318315683210473473	1318315683210473473	2020-10-19 18:18:46 EDT	2020-10-19	18:18:46	-0400	1086316494450032640	repjimbaird	Congressman Jim Baird		Indiana University Health White Memorial Hospital was recently recognized nationally for their work to end the wait for life-saving organ transplants. Congratulations to the hardworking doctors, nurses, and staff. Well deserved!   https://t.co/SQGgZnbz8Y	en	[]	['https://www.newsbug.info/monticello_herald_journal/news/local/monticello-hospital-earns-recognition-for-efforts-to-end-wait-for-lifesaving-transplants/article_fc6aeb12-68f8-5153-900d-b782271952fe.html']	[]	1	2	4	[]	[]	https://twitter.com/RepJimBaird/status/1318315683210473473	False		0								[]				
1318212398709395456	1318212398709395456	2020-10-19 11:28:21 EDT	2020-10-19	11:28:21	-0400	1086316494450032640	repjimbaird	Congressman Jim Baird		My condolences to the family and friends of Rob Hays.   He was dedicated to service and passionate about helping guide young people into agricultural careers. Rob’s positive attitude and devotion to helping others will always be remembered.    https://t.co/UPEfp0wly6	en	[]	['https://www.agrinews-pubs.com/2020/10/11/indiana-ffa-mourns-sudden-loss-of-executive-director/axuelgb/']	[]	0	1	4	[]	[]	https://twitter.com/RepJimBaird/status/1318212398709395456	False		0								[]				
1317217729083047936	1317217729083047936	2020-10-16 17:35:53 EDT	2020-10-16	17:35:53	-0400	1086316494450032640	repjimbaird	Congressman Jim Baird		The Main Street Lending Program is holding an information session on October 21. They will address questions about the program and help current and potential borrowers.    For more information, visit:  https://t.co/Kh674ZJJhF	en	[]	['https://www.webcaster4.com/Webcast/Page/583/38145']	[]	1	0	1	[]	[]	https://twitter.com/RepJimBaird/status/1317217729083047936	False		0								[]				
1317147580384661505	1317147580384661505	2020-10-16 12:57:09 EDT	2020-10-16	12:57:09	-0400	1086316494450032640	repjimbaird	Congressman Jim Baird		I want to share with the community about our office’s work on finding a solution to the low water levels in Lake Freeman &amp; Shafer.   Read my op-ed here:  https://t.co/oCVZGpOv8j	en	[]	['https://www.jconline.com/story/news/opinion/letters/2020/10/15/rep-baird-lake-freeman-drains-confident-we-can-find-solution/3673323001/']	[]	3	2	1	[]	[]	https://twitter.com/RepJimBaird/status/1317147580384661505	False		0								[]				
1316458119875178496	1316458119875178496	2020-10-14 15:17:29 EDT	2020-10-14	15:17:29	-0400	1086316494450032640	repjimbaird	Congressman Jim Baird		Agricultural producers can now make elections and enroll in the Agriculture Risk Coverage and Price Loss Coverage programs for the 2021 crop year.  For more information, please visit:  https://t.co/CHwUBOtAfN	en	[]	['https://www.fsa.usda.gov/programs-and-services/arcplc_program/index']	[]	1	3	4	[]	[]	https://twitter.com/RepJimBaird/status/1316458119875178496	False		0								[]				
1316148580407799809	1316148580407799809	2020-10-13 18:47:29 EDT	2020-10-13	18:47:29	-0400	1086316494450032640	repjimbaird	Congressman Jim Baird		At today’s hearing, Judge Amy Coney Barrett displayed a deep understanding of the Constitution and the temperament needed to be an excellent Supreme Court Justice.  https://t.co/UROlv7MLLF  https://t.co/ej5G3mXnzH	en	[]	['https://www.indystar.com/story/news/politics/2020/10/13/supreme-court-nominee-amy-coney-barrett-face-questions-senators/5968194002/']	['https://pbs.twimg.com/media/EkPmJ7zXYAEEkOT.jpg']	4	2	7	[]	[]	https://twitter.com/RepJimBaird/status/1316148580407799809	False		1	https://pbs.twimg.com/media/EkPmJ7zXYAEEkOT.jpg							[]				
1316093930044354560	1316093930044354560	2020-10-13 15:10:19 EDT	2020-10-13	15:10:19	-0400	1086316494450032640	repjimbaird	Congressman Jim Baird		Happy 245th Birthday to the U.S. Navy!  Here’s to 245 more years of upholding the long cherished U.S. Navy tradition of “Victory at Sea.”  https://t.co/DFfYaaHML8	en	[]	[]	['https://pbs.twimg.com/media/EkO0bYkWsAIcART.jpg']	0	2	2	[]	[]	https://twitter.com/RepJimBaird/status/1316093930044354560	False		1	https://pbs.twimg.com/media/EkO0bYkWsAIcART.jpg							[]				
1316053517744902144	1316053517744902144	2020-10-13 12:29:44 EDT	2020-10-13	12:29:44	-0400	1086316494450032640	repjimbaird	Congressman Jim Baird		REMINDER --&gt; This Friday staff will be hosting mobile office hours in Wolcott. If you or know someone who needs assistance with a federal agency, I encourage you to call and schedule an appointment.  https://t.co/JBQJshPGRy	en	[]	['https://baird.house.gov/news/documentsingle.aspx?DocumentID=116']	[]	1	1	2	[]	[]	https://twitter.com/RepJimBaird/status/1316053517744902144	False		0								[]				
