id	conversation_id	created_at	date	time	timezone	user_id	username	name	place	tweet	language	mentions	urls	photos	replies_count	retweets_count	likes_count	hashtags	cashtags	link	retweet	quote_url	video	thumbnail	near	geo	source	user_rt_id	user_rt	retweet_id	reply_to	retweet_date	translate	trans_src	trans_dest
1395382252226424839	1395382252226424839	2021-05-20 10:13:48 EDT	2021-05-20	10:13:48	-0400	1086316494450032640	repjimbaird	Congressman Jim Baird		Purdue University will be home to over 10,000 freshman next fall. This is a reflection of the excellent education Purdue offers that attracts so many young and bright minds. Boiler Up!   https://t.co/TVngW2SO37	en	[]	['https://www.jconline.com/story/news/2021/05/17/purdue-boilermakers-largest-freshman-class-university-history/5137795001/']	[]	6	1	6	[]	[]	https://twitter.com/RepJimBaird/status/1395382252226424839	False		0								[]				
1395081657263218694	1395081657263218694	2021-05-19 14:19:21 EDT	2021-05-19	14:19:21	-0400	1086316494450032640	repjimbaird	Congressman Jim Baird		This is great news! I can’t wait to see what these future leaders are able to accomplish.   https://t.co/4cir3xUKZq	en	[]	['https://www.wthr.com/article/news/local/ffa-announced-national-convention-will-be-in-person-for-2021/531-35ee3968-f8c1-4383-9d97-3fd775bced45']	[]	6	2	3	[]	[]	https://twitter.com/RepJimBaird/status/1395081657263218694	False		0								[]				
1394750368370806787	1394750368370806787	2021-05-18 16:22:55 EDT	2021-05-18	16:22:55	-0400	1086316494450032640	repjimbaird	Congressman Jim Baird		Glad to volunteer with  Operation Gratitude to help prepare care packages for our troops serving abroad!  https://t.co/xg8skfJhI8	en	[]	['https://www.foxnews.com/us/veteran-members-congress-operation-gratitude-care-packages']	[]	1	1	2	[]	[]	https://twitter.com/RepJimBaird/status/1394750368370806787	False		0								[]				
1394727568910213121	1394727568910213121	2021-05-18 14:52:19 EDT	2021-05-18	14:52:19	-0400	1086316494450032640	repjimbaird	Congressman Jim Baird		Today, I shared my vision on how the Agriculture Committee should tackle climate change with policies that incentivize innovation.   To watch my full remarks, click here:  https://t.co/Z9T4i7Ith8  https://t.co/tJUE1SxhjI	en	[]	['https://www.youtube.com/watch?v=fJjLB7Ip8_M']	[]	4	1	5	[]	[]	https://twitter.com/RepJimBaird/status/1394727568910213121	False		1	https://pbs.twimg.com/ext_tw_video_thumb/1394727289259282441/pu/img/Xpa6PeyJtpMKz1z_.jpg							[]				
1394341065025536001	1394341065025536001	2021-05-17 13:16:30 EDT	2021-05-17	13:16:30	-0400	1086316494450032640	repjimbaird	Congressman Jim Baird		Congratulations to all 2021 graduates! I wish you all the success in your future endeavors.  https://t.co/GQudFG4veb	en	[]	['https://www.jconline.com/story/news/2021/05/15/purdue-university-graduation-2021-commencement/5109556001/']	[]	0	2	6	[]	[]	https://twitter.com/RepJimBaird/status/1394341065025536001	False		0								[]				
1393275087529418758	1393275087529418758	2021-05-14 14:40:41 EDT	2021-05-14	14:40:41	-0400	1086316494450032640	repjimbaird	Congressman Jim Baird		For #NationalPoliceWeek, it is important we speak out against any efforts to defund our police departments.  https://t.co/EqY4fa43Pk	en	[]	[]	[]	11	2	5	['nationalpoliceweek']	[]	https://twitter.com/RepJimBaird/status/1393275087529418758	False		1	https://pbs.twimg.com/ext_tw_video_thumb/1393275039672377350/pu/img/MW8nJQwLtYn6EBT_.jpg							[]				
1392840093434630144	1392840093434630144	2021-05-13 09:52:10 EDT	2021-05-13	09:52:10	-0400	1086316494450032640	repjimbaird	Congressman Jim Baird		Thank you to the Carroll County Economic Development Corporation and the White County Economic Development for leading a study to reveal the economic impact of Lake Freeman’s reduced water levels.   https://t.co/p870rW5iAL	en	[]	['https://www.wlfi.com/content/news/Low-water-levels-on-Lake-Freeman-spur-economic-impact-study-574406601.html']	[]	4	1	1	[]	[]	https://twitter.com/RepJimBaird/status/1392840093434630144	False		0								[]				
1392591645489643523	1392591645489643523	2021-05-12 17:24:56 EDT	2021-05-12	17:24:56	-0400	1086316494450032640	repjimbaird	Congressman Jim Baird		I’m concerned by the growing violence against our ally Israel. The launching of rocket attacks with the goal of hurting innocent civilians is reprehensible and should be denounced by everyone. I will always stand by Israel and their right to self-defense.  https://t.co/R6fwiIzwrC	en	[]	['https://www.foxnews.com/world/hamas-lobs-hundreds-of-rockets-in-24-hours-israel-responds-by-attacking-targets-in-gaza-idf-says']	[]	43	7	28	[]	[]	https://twitter.com/RepJimBaird/status/1392591645489643523	False		0								[]				
1392534833457475588	1392534833457475588	2021-05-12 13:39:10 EDT	2021-05-12	13:39:10	-0400	1086316494450032640	repjimbaird	Congressman Jim Baird		In honor of #NationalPoliceWeek, I spoke on the House floor to highlight a few examples of law enforcement working to make our communities a safer place.  https://t.co/szuqWzuTsb	en	[]	[]	[]	10	4	20	['nationalpoliceweek']	[]	https://twitter.com/RepJimBaird/status/1392534833457475588	False		1	https://pbs.twimg.com/ext_tw_video_thumb/1392534759415468043/pu/img/Bql4aqHRRNWMeJL0.jpg							[]				
1392119125640728578	1392119125640728578	2021-05-11 10:07:18 EDT	2021-05-11	10:07:18	-0400	1086316494450032640	repjimbaird	Congressman Jim Baird		Congratulations to Kyle Albertson on receiving Purdue University’s Tyler Trent Courage and Resilience Award. Through hard work and determination, Kyle persevered and was able to start his own small agriculture drone business.  https://t.co/usSb1cMRm5	en	[]	['https://www.purdue.edu/newsroom/releases/2021/Q2/newest-tyler-trent-scholarship-recipient-a-success-story-in-overcoming-lifes-obstacles.html']	[]	5	3	11	[]	[]	https://twitter.com/RepJimBaird/status/1392119125640728578	False		0								[]				
1391377413184135181	1391377413184135181	2021-05-09 09:00:00 EDT	2021-05-09	09:00:00	-0400	1086316494450032640	repjimbaird	Congressman Jim Baird		Happy Mother’s Day! Thank you to mothers everywhere for your unconditional love and dedication to your families.  https://t.co/UhcS3ZZyHr	en	[]	[]	['https://pbs.twimg.com/media/E03JMPkXMAAjLrB.jpg']	3	3	10	[]	[]	https://twitter.com/RepJimBaird/status/1391377413184135181	False		1	https://pbs.twimg.com/media/E03JMPkXMAAjLrB.jpg							[]				
1391015028485144576	1391015028485144576	2021-05-08 09:00:01 EDT	2021-05-08	09:00:01	-0400	1086316494450032640	repjimbaird	Congressman Jim Baird		Today we celebrate the 76th anniversary of V-E Day and remember those who answered the call of duty and helped bring freedom and hope to a continent. God Bless those who served!  https://t.co/kZorP9fn1k	en	[]	[]	['https://pbs.twimg.com/media/E03JBcoWUAQ9zJN.jpg']	4	2	11	[]	[]	https://twitter.com/RepJimBaird/status/1391015028485144576	False		1	https://pbs.twimg.com/media/E03JBcoWUAQ9zJN.jpg							[]				
1390696296474988548	1390696296474988548	2021-05-07 11:53:29 EDT	2021-05-07	11:53:29	-0400	1086316494450032640	repjimbaird	Congressman Jim Baird		This is great news! We need to reopen up, get people back to work, and move the economy forward.   https://t.co/9EcqRP9Ue9	en	[]	['https://www.wlfi.com/content/news/Storefronts-continue-to-fill-up-in-downtown-Lafayette-574367461.html']	[]	3	1	4	[]	[]	https://twitter.com/RepJimBaird/status/1390696296474988548	False		0								[]				
1390353486857052160	1390353486857052160	2021-05-06 13:11:17 EDT	2021-05-06	13:11:17	-0400	1086316494450032640	repjimbaird	Congressman Jim Baird		Thank you to the Frankfort community for inviting me to speak on National Day of Prayer.  https://t.co/l3oKtH1fvN	en	[]	[]	['https://pbs.twimg.com/media/E0uGzbVWUAQyfCO.jpg', 'https://pbs.twimg.com/media/E0uGzbYXoAIsfaB.jpg', 'https://pbs.twimg.com/media/E0uG_kCXoAIMcGL.jpg']	4	1	9	[]	[]	https://twitter.com/RepJimBaird/status/1390353486857052160	False		1	https://pbs.twimg.com/media/E0uGzbVWUAQyfCO.jpg							[]				
1389937749998936064	1389937749998936064	2021-05-05 09:39:18 EDT	2021-05-05	09:39:18	-0400	1086316494450032640	repjimbaird	Congressman Jim Baird		The BIO Act is a small step in creating a larger and long-term strategy for investment in critical research and infrastructure for the United States.  https://t.co/X9dom7ZEZE	en	[]	['https://baird.house.gov/news/documentsingle.aspx?DocumentID=163']	[]	2	2	3	[]	[]	https://twitter.com/RepJimBaird/status/1389937749998936064	False		0								[]				
1389592257066639363	1389592257066639363	2021-05-04 10:46:26 EDT	2021-05-04	10:46:26	-0400	1086316494450032640	repjimbaird	Congressman Jim Baird		Last week, I met with Hoosier farmers and they shared concerns about President Biden’s vision of growing the federal government and what that means for them.  https://t.co/5iBwreRMFB	en	[]	[]	['https://pbs.twimg.com/media/E0jSuwuXoAkT7Xd.jpg', 'https://pbs.twimg.com/media/E0jSvabWEAQln0_.jpg']	9	1	7	[]	[]	https://twitter.com/RepJimBaird/status/1389592257066639363	False		1	https://pbs.twimg.com/media/E0jSuwuXoAkT7Xd.jpg							[]				
1389311138869952524	1389311138869952524	2021-05-03 16:09:22 EDT	2021-05-03	16:09:22	-0400	1086316494450032640	repjimbaird	Congressman Jim Baird		There are some good things in President Biden’s proposal, BUT there are many unnecessary and expensive items that have nothing to do with infrastructure. This proposal balloons the cost that the American taxpayer will have to pay.   https://t.co/aKp5QBJLgQ	en	[]	['https://www.jconline.com/story/opinion/2021/04/30/rep-baird-massive-infrastructure-plan-contains-unnecessary-items/7409167002/']	[]	14	1	3	[]	[]	https://twitter.com/RepJimBaird/status/1389311138869952524	False		0								[]				
1389251291923296258	1389251291923296258	2021-05-03 12:11:33 EDT	2021-05-03	12:11:33	-0400	1086316494450032640	repjimbaird	Congressman Jim Baird		ICYMI: Watch my response to President Biden’s speech to Congress.   https://t.co/vehZuXqCVm	en	[]	['https://www.wishtv.com/news/allindianapolitics/all-indiana-politics-reaction-to-bidens-address-to-congress/']	[]	8	1	2	[]	[]	https://twitter.com/RepJimBaird/status/1389251291923296258	False		0								[]				
1387811336214745089	1387810869556482052	2021-04-29 12:49:41 EDT	2021-04-29	12:49:41	-0400	1086316494450032640	repjimbaird	Congressman Jim Baird		One resulted in job loss for thousands of Americans and the other fomented a humanitarian crisis along our southern border. If President Biden was serious about uniting the country, he would show it through action, not just words.	en	[]	[]	[]	6	1	3	[]	[]	https://twitter.com/RepJimBaird/status/1387811336214745089	False		0								[]				
1387811253498880000	1387810869556482052	2021-04-29 12:49:21 EDT	2021-04-29	12:49:21	-0400	1086316494450032640	repjimbaird	Congressman Jim Baird		Judging by his actions, he has no interest in working across the aisle. He’s using executive orders at a record pace to reverse common sense projects like the Keystone pipeline and the border wall. Both decisions having disastrous consequences.	en	[]	[]	[]	2	1	3	[]	[]	https://twitter.com/RepJimBaird/status/1387811253498880000	False		0								[]				
1387810957821349888	1387810869556482052	2021-04-29 12:48:11 EDT	2021-04-29	12:48:11	-0400	1086316494450032640	repjimbaird	Congressman Jim Baird		His administration is proposing an astronomical amount of $6 trillion in additional spending on top of a $4 trillion federal budget.   President Biden talked on the campaign trail about being a moderate and would govern to unite the country.	en	[]	[]	[]	1	0	0	[]	[]	https://twitter.com/RepJimBaird/status/1387810957821349888	False		0								[]				
1387810869556482052	1387810869556482052	2021-04-29 12:47:50 EDT	2021-04-29	12:47:50	-0400	1086316494450032640	repjimbaird	Congressman Jim Baird		Last night, President Biden declared the era of big government is here. He asked Americans to place their faith and hope not in themselves, but in the power of the federal government.	en	[]	[]	[]	7	1	4	[]	[]	https://twitter.com/RepJimBaird/status/1387810869556482052	False		0								[]				
1387523868454162435	1387523868454162435	2021-04-28 17:47:23 EDT	2021-04-28	17:47:23	-0400	1086316494450032640	repjimbaird	Congressman Jim Baird		Congratulations to Michael Escobedo for this remarkable achievement.   https://t.co/jmi1GsUR5f	en	[]	['https://www.jconline.com/story/news/2021/04/28/lafayette-jeff-cello-player-earns-spot-sphinx-performance-academy/4856224001/']	[]	2	1	2	[]	[]	https://twitter.com/RepJimBaird/status/1387523868454162435	False		0								[]				
1387416713180979203	1387416713180979203	2021-04-28 10:41:36 EDT	2021-04-28	10:41:36	-0400	1086316494450032640	repjimbaird	Congressman Jim Baird		Glad to hear the VA clinic is still on schedule to open this fall. This new clinic will serve veterans in Cass and Howard Counties.  https://t.co/XnGbeQUFWE	en	[]	['https://www.kokomotribune.com/news/new-va-clinic-still-set-for-fall-opening-despite-covid-obstacles/article_39574a8a-a788-11eb-89e4-e7924d2169b7.html']	[]	1	2	4	[]	[]	https://twitter.com/RepJimBaird/status/1387416713180979203	False		0								[]				
1386706474764836869	1386706474764836869	2021-04-26 11:39:22 EDT	2021-04-26	11:39:22	-0400	1086316494450032640	repjimbaird	Congressman Jim Baird		Don’t forget, the deadline for the Congressional Art Competition is this Friday.   https://t.co/7UXBaYRiyI	en	[]	['https://baird.house.gov/services/art-competition.htm']	[]	3	1	2	[]	[]	https://twitter.com/RepJimBaird/status/1386706474764836869	False		0								[]				
1385677345860767747	1385677345860767747	2021-04-23 15:29:58 EDT	2021-04-23	15:29:58	-0400	1086316494450032640	repjimbaird	Congressman Jim Baird		Read my interview with the Frankfort Times. Where I share my thoughts on the infrastructure bill that is being debated, with my views on several other issues.  https://t.co/uWQizWWqnH	en	[]	['https://www.ftimes.com/news/baird-shares-concerns-with-american-jobs-plan/article_a834687a-8fee-50c7-b878-f7f1e2ca1bbe.html']	[]	6	2	3	[]	[]	https://twitter.com/RepJimBaird/status/1385677345860767747	False		0								[]				
1385652336182321153	1385652336182321153	2021-04-23 13:50:35 EDT	2021-04-23	13:50:35	-0400	1086316494450032640	repjimbaird	Congressman Jim Baird		“These droughts cause the lake to be almost completely drained, and result in devastation to the natural ecology, and the local economy. Businesses, homes, property, both real and personal, tax revenue, and the lost family time are all impacted.”  https://t.co/cSD4dDZyN4	en	[]	['https://baird.house.gov/news/documentsingle.aspx?DocumentID=160']	[]	3	1	1	[]	[]	https://twitter.com/RepJimBaird/status/1385652336182321153	False		0								[]				
1385601759947722755	1385601759947722755	2021-04-23 10:29:37 EDT	2021-04-23	10:29:37	-0400	1086316494450032640	repjimbaird	Congressman Jim Baird		Good News! Our office has extended the deadline for submissions for the Congressional Art Competition to April 30th.    Visit our website for more information.  https://t.co/7UXBaYRiyI	en	[]	['https://baird.house.gov/services/art-competition.htm']	[]	2	1	4	[]	[]	https://twitter.com/RepJimBaird/status/1385601759947722755	False		0								[]				
1385344834303574019	1385344834303574019	2021-04-22 17:28:41 EDT	2021-04-22	17:28:41	-0400	1086316494450032640	repjimbaird	Congressman Jim Baird		The challenges Lakes Freeman &amp; Shafer face due to low water levels must be addressed. This starts by bringing attention to the problem.   Watch my entire speech on the House floor below:  https://t.co/sBXXjx51pK	en	[]	['https://www.youtube.com/watch?v=Akjif3kfMWM&feature=youtu.be']	[]	2	2	2	[]	[]	https://twitter.com/RepJimBaird/status/1385344834303574019	False		0								[]				
1385227046008283141	1385227046008283141	2021-04-22 09:40:38 EDT	2021-04-22	09:40:38	-0400	1086316494450032640	repjimbaird	Congressman Jim Baird		Yesterday, I spoke on the House floor to share my concerns about President Biden’s infrastructure bill. How can we call it an infrastructure bill when less than 13% goes to our roads, bridges, broadband, waterways?  https://t.co/iI5lC64eGi	en	[]	[]	[]	11	12	36	[]	[]	https://twitter.com/RepJimBaird/status/1385227046008283141	False		1	https://pbs.twimg.com/ext_tw_video_thumb/1385226977574113280/pu/img/BWUPyVzYG3P7SS9n.jpg							[]				
1385022872607932417	1385022872607932417	2021-04-21 20:09:19 EDT	2021-04-21	20:09:19	-0400	1086316494450032640	repjimbaird	Congressman Jim Baird		This evening, as a united Indiana Congressional delegation and along with our Senators, we stood together for a moment of silence to remember the lives lost in the recent tragedy at the FedEx facility.  https://t.co/DhVRBiWTMv	en	[]	[]	[]	3	3	14	[]	[]	https://twitter.com/RepJimBaird/status/1385022872607932417	False		1	https://pbs.twimg.com/ext_tw_video_thumb/1385022570509045760/pu/img/O5wspSUImMzTSTU8.jpg							[]				
1384941745482477578	1384941745482477578	2021-04-21 14:46:57 EDT	2021-04-21	14:46:57	-0400	1086316494450032640	repjimbaird	Congressman Jim Baird		REMINDER  On Saturday, May 8th, my office will be hosting a U.S. Service Academy Information Day. Students can come and learn more about each academy and the admission process.  https://t.co/BqFRa7kah8	en	[]	[]	['https://pbs.twimg.com/media/EzhNE9bXsAQ7IyM.jpg']	1	1	2	[]	[]	https://twitter.com/RepJimBaird/status/1384941745482477578	False		1	https://pbs.twimg.com/media/EzhNE9bXsAQ7IyM.jpg							[]				
1384885079189688323	1384885079189688323	2021-04-21 11:01:47 EDT	2021-04-21	11:01:47	-0400	1086316494450032640	repjimbaird	Congressman Jim Baird		It was great to meet everyone and hear about all the great things Hoosier principals are doing to keep our schools open and safe.	en	[]	[]	[]	1	3	5	[]	[]	https://twitter.com/RepJimBaird/status/1384885079189688323	False	https://twitter.com/AvonHSPrincipal/status/1384864196605747200	0								[]				
1384518622471675907	1384518622471675907	2021-04-20 10:45:37 EDT	2021-04-20	10:45:37	-0400	1086316494450032640	repjimbaird	Congressman Jim Baird		Today the Ag Committee is discussing the importance of rural broadband.   The pandemic has proven yet again, that reliable and high-speed broadband connectivity is essential to everyday life and a robust rural economy. #EndTheDigitalDivide  https://t.co/xmpeoC7hnW	en	[]	[]	['https://pbs.twimg.com/media/EzbMRDiXEAElMTd.jpg']	9	4	7	['endthedigitaldivide']	[]	https://twitter.com/RepJimBaird/status/1384518622471675907	False		1	https://pbs.twimg.com/media/EzbMRDiXEAElMTd.jpg							[]				
1384217794707738627	1384217754333372420	2021-04-19 14:50:14 EDT	2021-04-19	14:50:14	-0400	1086316494450032640	repjimbaird	Congressman Jim Baird		"""We're to the point of changing the definition of what infrastructure is. I mean, we're throwing everything in except the kitchen table and the kitchen sink and calling it infrastructure, and I think that's irrational and irresponsible.""  https://t.co/0VGb5mm8sx"	en	[]	['https://www.wlfi.com/content/news/US-Rep-Jim-Baird-opposes-Bidens-federal-infrastructure-program-574213801.html']	[]	12	2	6	[]	[]	https://twitter.com/RepJimBaird/status/1384217794707738627	False		0								[]				
1384217754333372420	1384217754333372420	2021-04-19 14:50:04 EDT	2021-04-19	14:50:04	-0400	1086316494450032640	repjimbaird	Congressman Jim Baird		Here is my response to Democrats trying to include the Green New Deal and packing the Supreme Court as part of infrastructure legislation...	en	[]	[]	[]	9	3	7	[]	[]	https://twitter.com/RepJimBaird/status/1384217754333372420	False		0								[]				
1383774359131545601	1383774359131545601	2021-04-18 09:28:11 EDT	2021-04-18	09:28:11	-0400	1086316494450032640	repjimbaird	Congressman Jim Baird		Here is a short video update on what happened in Washington, D.C. last week and my work in representing you.  https://t.co/lQPhf0PhKw	en	[]	[]	[]	7	1	2	[]	[]	https://twitter.com/RepJimBaird/status/1383774359131545601	False		1	https://pbs.twimg.com/ext_tw_video_thumb/1383773917857206278/pu/img/zXOhBeFJnA0xoNfS.jpg							[]				
1383065393099591686	1383065336950456325	2021-04-16 10:31:00 EDT	2021-04-16	10:31:00	-0400	1086316494450032640	repjimbaird	Congressman Jim Baird		Thank you to the first responders who were quick to respond and provide medical assistance to the victims and to the law enforcement who are working tirelessly to protect us and provide the community answers on this senseless act of violence.	en	[]	[]	[]	2	1	5	[]	[]	https://twitter.com/RepJimBaird/status/1383065393099591686	False		0								[]				
1383065336950456325	1383065336950456325	2021-04-16 10:30:47 EDT	2021-04-16	10:30:47	-0400	1086316494450032640	repjimbaird	Congressman Jim Baird		Like all Hoosiers, I am saddened to hear about the horrific shooting at the FedEx Ground facility in Indianapolis. My prayers go out to the victims, the families, and all those affected by this terrible tragedy.	en	[]	[]	[]	12	3	8	[]	[]	https://twitter.com/RepJimBaird/status/1383065336950456325	False		0								[]				
1382785924346548226	1382785924346548226	2021-04-15 16:00:29 EDT	2021-04-15	16:00:29	-0400	1086316494450032640	repjimbaird	Congressman Jim Baird		Democrats continue their power grab by introducing legislation to pack the Supreme Court. This is why I’m a proud supporter of a constitutional amendment to keep the Supreme Court at nine justices.  https://t.co/F3c53IugeA	en	[]	[]	['https://pbs.twimg.com/media/EzCkZj8XEAAk7iC.png']	8	4	9	[]	[]	https://twitter.com/RepJimBaird/status/1382785924346548226	False		1	https://pbs.twimg.com/media/EzCkZj8XEAAk7iC.png							[]				
1382750336037879809	1382750336037879809	2021-04-15 13:39:05 EDT	2021-04-15	13:39:05	-0400	1086316494450032640	repjimbaird	Congressman Jim Baird		Thank you to @RepRickCrawford for leading on this! I'm proud to support this effort.   It’s imperative the United States take seriously the threat posed by the Chinese Communist Party.  https://t.co/VWCoI88Etu	en	[{'screen_name': 'reprickcrawford', 'name': 'rep rick crawford', 'id': '233693291'}]	['https://crawford.house.gov/news/documentsingle.aspx?DocumentID=399426']	[]	4	1	4	[]	[]	https://twitter.com/RepJimBaird/status/1382750336037879809	False		0								[]				
1382696420797464580	1382696420797464580	2021-04-15 10:04:50 EDT	2021-04-15	10:04:50	-0400	1086316494450032640	repjimbaird	Congressman Jim Baird		My @housesciencegop colleagues and I are live now on getting back our edge➡️  https://t.co/x4SjORZ4L9	en	[{'screen_name': 'housesciencegop', 'name': 'sci, space, & tech gop', 'id': '23103488'}]	['https://republicans-science.house.gov/legislation/hearings/reimagining-our-innovation-future']	[]	2	2	4	[]	[]	https://twitter.com/RepJimBaird/status/1382696420797464580	False		0								[]				
1382691237044625408	1382691237044625408	2021-04-15 09:44:14 EDT	2021-04-15	09:44:14	-0400	1086316494450032640	repjimbaird	Congressman Jim Baird		I spoke before the Republic Study Committee yesterday, advocating for conservative policies and to limit the federal government’s role in the lives of Americans. I also really enjoyed having the opportunity to meet with Governor Chris Christie.  https://t.co/NdO44ksODB	en	[]	[]	['https://pbs.twimg.com/media/EzBOHdPWUAcF-Gj.jpg', 'https://pbs.twimg.com/media/EzBOIHTXAAw73qK.jpg']	7	4	17	[]	[]	https://twitter.com/RepJimBaird/status/1382691237044625408	False		1	https://pbs.twimg.com/media/EzBOHdPWUAcF-Gj.jpg							[]				
1382432508168527872	1382432508168527872	2021-04-14 16:36:08 EDT	2021-04-14	16:36:08	-0400	1086316494450032640	repjimbaird	Congressman Jim Baird		Today, I signed the discharge petition to force a vote on H.R. 619, the Born-Alive Abortion Survivors Protection Act. The extreme views of some should not overwhelm the commonsense majority of millions of Americans when it comes to the sanctity of life.  https://t.co/cjJeh26Jlc	en	[]	[]	['https://pbs.twimg.com/media/Ey9i-dVXEAUAl_w.jpg']	9	1	7	[]	[]	https://twitter.com/RepJimBaird/status/1382432508168527872	False		1	https://pbs.twimg.com/media/Ey9i-dVXEAUAl_w.jpg							[]				
1382328064340848641	1382328064340848641	2021-04-14 09:41:07 EDT	2021-04-14	09:41:07	-0400	1086316494450032640	repjimbaird	Congressman Jim Baird		This is good news! With more data and information, we can make better decisions that will help protect the local economy and the environment.   https://t.co/enECAtZ0bU	en	[]	['https://www.wlfi.com/content/news/Economic-impact-survey-for-Lake-Freeman-water-levels-coming-574166851.html']	[]	5	1	3	[]	[]	https://twitter.com/RepJimBaird/status/1382328064340848641	False		0								[]				
1382087114121183236	1382087114121183236	2021-04-13 17:43:40 EDT	2021-04-13	17:43:40	-0400	1086316494450032640	repjimbaird	Congressman Jim Baird		Saddened to hear about the passing of Bobby 'Slick' Leonard. He was a Hoosier icon.   https://t.co/uRk0UHs2Fj	en	[]	['https://www.indystar.com/story/sports/nba/pacers/2021/04/13/bobby-slick-leonard-hoosiers-and-pacers-icon-dies-88/4624895002/']	[]	2	2	6	[]	[]	https://twitter.com/RepJimBaird/status/1382087114121183236	False		0								[]				
1382004064091799557	1382004064091799557	2021-04-13 12:13:39 EDT	2021-04-13	12:13:39	-0400	1086316494450032640	repjimbaird	Congressman Jim Baird		Don’t forget, the deadline to submit artwork for the Congressional Art Competition is this Friday!  https://t.co/iHxhvrrshh	en	[]	['https://baird.house.gov/news/documentsingle.aspx?DocumentID=146']	[]	0	1	2	[]	[]	https://twitter.com/RepJimBaird/status/1382004064091799557	False		0								[]				
1381639030928990212	1381639030928990212	2021-04-12 12:03:09 EDT	2021-04-12	12:03:09	-0400	1086316494450032640	repjimbaird	Congressman Jim Baird		Small businesses in Benton, Jasper, and Newton counties that were affected by the heavy rainfall and flooding on June 27 of last year, still have time to apply for disaster loans from the SBA. The deadline is May 11.   For information, please visit  https://t.co/LBNepNAnaz	en	[]	['https://disasterloanassistance.sba.gov/']	[]	2	1	2	[]	[]	https://twitter.com/RepJimBaird/status/1381639030928990212	False		0								[]				
