id	conversation_id	created_at	date	time	timezone	user_id	username	name	place	tweet	language	mentions	urls	photos	replies_count	retweets_count	likes_count	hashtags	cashtags	link	retweet	quote_url	video	thumbnail	near	geo	source	user_rt_id	user_rt	retweet_id	reply_to	retweet_date	translate	trans_src	trans_dest
1275183567555919873	1275183567555919873	2020-06-22 17:47:08 EDT	2020-06-22	17:47:08	-0400	1086316494450032640	repjimbaird	Congressman Jim Baird		Today is the 75th anniversary of the GI Bill. This program provides so many deserving opportunities to our heroes.  One such opportunity available is the Edith Nourse Rogers STEM Scholarship. Learn more at:  https://t.co/XsdxEjXC7K  https://t.co/4D1ccQnk2l	en	[]	['https://www.va.gov/education/apply-for-education-benefits/application/1995/introduction']	['https://pbs.twimg.com/media/EbJcos_XgAYURmx.jpg']	1	1	2	[]	[]	https://twitter.com/RepJimBaird/status/1275183567555919873	False		1	https://pbs.twimg.com/media/EbJcos_XgAYURmx.jpg							[]				
1275091574330982400	1275091574330982400	2020-06-22 11:41:36 EDT	2020-06-22	11:41:36	-0400	1086316494450032640	repjimbaird	Congressman Jim Baird		Reminder to Farmers --&gt; The last day to complete enrollment in the Agriculture Risk Coverage (ARC) or Price Loss Coverage (PLC) programs is June 30. Contact your local FSA office to sign a 2020 enrollment contract.   Learn more here:  https://t.co/1EdNcfrTs4	en	[]	['https://www.farmers.gov/arc-plc']	[]	0	4	5	[]	[]	https://twitter.com/RepJimBaird/status/1275091574330982400	False		0								[]				
1274696760913526784	1274696760913526784	2020-06-21 09:32:45 EDT	2020-06-21	09:32:45	-0400	1086316494450032640	repjimbaird	Congressman Jim Baird		"When people say, ""the apple doesn’t fall far from the tree,"" I tell them that’s the best compliment I could ever get. Fathers have an enormous duty in providing guidance and wisdom to their children while serving as a role model. Have a great father’s day!  https://t.co/CzNJQctnMj"	en	[]	[]	['https://pbs.twimg.com/media/EbCh3K4XQAATTfj.jpg']	2	4	6	[]	[]	https://twitter.com/RepJimBaird/status/1274696760913526784	False		1	https://pbs.twimg.com/media/EbCh3K4XQAATTfj.jpg							[]				
1273997320426848257	1273997320426848257	2020-06-19 11:13:25 EDT	2020-06-19	11:13:25	-0400	1086316494450032640	repjimbaird	Congressman Jim Baird		Recent events have shown the importance of having a strategy to invest in American research and technology.   This is why I have cosponsored H.R. 5685 the Securing American Leadership in Science and Technology Act.  https://t.co/KnwAL4IJTx	en	[]	['https://republicans-science.house.gov/news/press-releases/restarting-american-research']	[]	2	2	1	[]	[]	https://twitter.com/RepJimBaird/status/1273997320426848257	False		0								[]				
1273619004616314881	1273619004616314881	2020-06-18 10:10:08 EDT	2020-06-18	10:10:08	-0400	1086316494450032640	repjimbaird	Congressman Jim Baird		I recently supported improvements to the Paycheck Protection Program to help Hoosier businesses during these unprecedented times. The changes made provide additional flexibility for forgiveness and how the loans can be utilized.  https://t.co/gJt5b3kmqC	en	[]	[]	[]	4	2	1	[]	[]	https://twitter.com/RepJimBaird/status/1273619004616314881	False		1	https://pbs.twimg.com/ext_tw_video_thumb/1273618944272842752/pu/img/Pb18IDuT7vPZWHCd.jpg							[]				
1273352568987582464	1273352568987582464	2020-06-17 16:31:24 EDT	2020-06-17	16:31:24	-0400	1086316494450032640	repjimbaird	Congressman Jim Baird		“My congratulations to Dr. Charles R. Santerre on his appointment to the FRRCC. He will be a valuable addition to the committee, bringing his expertise and his desire to use scientific evidence to best serve the public.  https://t.co/UWq3xVtxsZ	en	[]	['https://www.epa.gov/newsreleases/epa-administrator-wheeler-appoints-new-member-purdue-university-farm-ranch-and-rural']	[]	0	0	0	[]	[]	https://twitter.com/RepJimBaird/status/1273352568987582464	False		0								[]				
1272581573045600259	1272581573045600259	2020-06-15 13:27:45 EDT	2020-06-15	13:27:45	-0400	1086316494450032640	repjimbaird	Congressman Jim Baird		Congratulations to all of these exceptional young men &amp; women. I can’t wait to see what these 27 outstanding students will achieve.  https://t.co/gok8I6DYzt	en	[]	[]	['https://pbs.twimg.com/media/EakeK8eWsAAt_Zv.jpg']	3	1	1	[]	[]	https://twitter.com/RepJimBaird/status/1272581573045600259	False		1	https://pbs.twimg.com/media/EakeK8eWsAAt_Zv.jpg							[]				
1272242260248313859	1272242260248313859	2020-06-14 14:59:26 EDT	2020-06-14	14:59:26	-0400	1086316494450032640	repjimbaird	Congressman Jim Baird		Happy 245th Birthday to the U.S. Army! #ArmyStrong  https://t.co/PgK4cguiHt	en	[]	[]	['https://pbs.twimg.com/media/EafpYOcWAAc9s6Z.jpg']	3	2	0	['armystrong']	[]	https://twitter.com/RepJimBaird/status/1272242260248313859	False		1	https://pbs.twimg.com/media/EafpYOcWAAc9s6Z.jpg							[]				
1272165206186131456	1272165206186131456	2020-06-14 09:53:15 EDT	2020-06-14	09:53:15	-0400	1086316494450032640	repjimbaird	Congressman Jim Baird		The flag of the United States of America is the representation of our nation’s ideals. When we hoist our country’s flag we feel a sense of pride in those ideals and do our best to uphold them.  https://t.co/w1JXRajSgx	en	[]	[]	['https://pbs.twimg.com/media/Eaejf9hXsAMDycX.jpg']	7	3	3	[]	[]	https://twitter.com/RepJimBaird/status/1272165206186131456	False		1	https://pbs.twimg.com/media/Eaejf9hXsAMDycX.jpg							[]				
1271538642520092680	1271538642520092680	2020-06-12 16:23:31 EDT	2020-06-12	16:23:31	-0400	1086316494450032640	repjimbaird	Congressman Jim Baird		It was great to participate in today’s Science, Space, &amp; Technology Committee hearing and ask about my concerns about ensuring our rural fire departments have the resources they need.  https://t.co/c7Sq0gy66E	en	[]	[]	[]	3	2	3	[]	[]	https://twitter.com/RepJimBaird/status/1271538642520092680	False		1	https://pbs.twimg.com/ext_tw_video_thumb/1271538444867690497/pu/img/hYLWtWjhvpqOIlSa.jpg							[]				
1270774396270100482	1270774396270100482	2020-06-10 13:46:40 EDT	2020-06-10	13:46:40	-0400	1086316494450032640	repjimbaird	Congressman Jim Baird		As your representative it is my honor to nominate exceptional young people to our United States Military Academies. For those interested in applying, I encourage you to check out our website and learn more about the military academy nomination process.   https://t.co/d0dAUzfZIh	en	[]	['https://baird.house.gov/services/military-academy-nominations.htm']	[]	1	2	1	[]	[]	https://twitter.com/RepJimBaird/status/1270774396270100482	False		0								[]				
1270350812254859265	1270350812254859265	2020-06-09 09:43:30 EDT	2020-06-09	09:43:30	-0400	1086316494450032640	repjimbaird	Congressman Jim Baird		It has been a privilege for me to bring the livestock producers, farmers and ranchers their concerns and sharing those with Sonny Perdue, the Secretary of Agriculture.  https://t.co/CgGLFImxc4	en	[]	['https://www.ftimes.com/news/baird-promotes-use-of-cfap/article_978190f4-383e-5e73-b42c-a6837d02f78e.html']	[]	3	1	1	[]	[]	https://twitter.com/RepJimBaird/status/1270350812254859265	False		0								[]				
1270013953830260737	1270013953830260737	2020-06-08 11:24:56 EDT	2020-06-08	11:24:56	-0400	1086316494450032640	repjimbaird	Congressman Jim Baird		June is Alzheimer’s and Brain Awareness Month. Let’s all join together and help #ENDALZ for the 5.8 million Americans suffering from Alzheimer’s.   Learn more at:  https://t.co/PGPzQCqMAK	en	[]	['http://alz.org/abam/overview.asp']	[]	2	1	1	['endalz']	[]	https://twitter.com/RepJimBaird/status/1270013953830260737	False		0								[]				
1269262288038625281	1269262288038625281	2020-06-06 09:38:05 EDT	2020-06-06	09:38:05	-0400	1086316494450032640	repjimbaird	Congressman Jim Baird		We remember the courage, patriotism, and selflessness of the brave men, who 76 years ago liberated a continent from oppression and tyranny. May we all learn from their extraordinary valor &amp; heroism on #DDay.  https://t.co/NoJ6lEMBUP	en	[]	[]	['https://pbs.twimg.com/media/EZ1TOnAXQAE7Rgn.jpg']	1	1	4	['dday']	[]	https://twitter.com/RepJimBaird/status/1269262288038625281	False		1	https://pbs.twimg.com/media/EZ1TOnAXQAE7Rgn.jpg							[]				
1268994888542097409	1268994888542097409	2020-06-05 15:55:32 EDT	2020-06-05	15:55:32	-0400	1086316494450032640	repjimbaird	Congressman Jim Baird		Today’s announcement is exciting for the Lafayette community. This is a continued commitment to America’s food supply chain and sustainability. We compliment the company for being such an excellent member in the agricultural and manufacturing community.   https://t.co/FQfwFwLngb	en	[]	['https://www.tateandlyle.com/news/tate-lyle-announces-major-sustainability-investment-its-facility-lafayette-south-indiana-us']	[]	2	1	1	[]	[]	https://twitter.com/RepJimBaird/status/1268994888542097409	False		0								[]				
1268907268021653506	1268907268021653506	2020-06-05 10:07:22 EDT	2020-06-05	10:07:22	-0400	1086316494450032640	repjimbaird	Congressman Jim Baird		Purdue University has a rich history of providing the world with medical breakthroughs. This award reflects the confidence the NSF has in Purdue’s ability to continue to produce valuable and needed research.  https://t.co/coTgHwNbWC	en	[]	['https://baird.house.gov/news/documentsingle.aspx?DocumentID=97']	[]	1	1	4	[]	[]	https://twitter.com/RepJimBaird/status/1268907268021653506	False		0								[]				
1268692399431262210	1268692399431262210	2020-06-04 19:53:33 EDT	2020-06-04	19:53:33	-0400	1086316494450032640	repjimbaird	Congressman Jim Baird		"“It goes back to listening to businesses and feedback from them.""   https://t.co/En4VfPCdH9"	en	[]	['https://www.ftimes.com/news/baird-optimistic-on-ppp-flexibility-act/article_c7759169-c6e3-5d3d-bbcc-f1b295e8f648.html?fbclid=IwAR2DAgvU2tY_oOSdEvLq6Bl_r51N1bHpozk7e30K743CtfJmJ0xV66yiJ5Y']	[]	2	1	2	[]	[]	https://twitter.com/RepJimBaird/status/1268692399431262210	False		0								[]				
1268569147140694018	1268569147140694018	2020-06-04 11:43:48 EDT	2020-06-04	11:43:48	-0400	1086316494450032640	repjimbaird	Congressman Jim Baird		Wonderful news! U.S. Navy veteran Michael White has been released from an Iranian prison and is on his way home. Thank you to the State Department who worked tirelessly for four months to secure his release.   https://t.co/kGQkDIwiep	en	[]	['https://www.foxnews.com/politics/us-navy-veteran-detained-in-iran-is-freed']	[]	3	1	1	[]	[]	https://twitter.com/RepJimBaird/status/1268569147140694018	False		0								[]				
1268564764592091137	1268564764592091137	2020-06-04 11:26:23 EDT	2020-06-04	11:26:23	-0400	1086316494450032640	repjimbaird	Congressman Jim Baird		Read Purdue University President Mitch Daniel’s testimony to the U.S. Senate on how Purdue is leading the way on bringing students back to campus this fall, while keeping everyone safe from COVID-19.   https://t.co/mMW5inXXyV	en	[]	['https://mailchi.mp/36cb2086027b/purdue-president-daniels-testifies-before-the-senate-on-college-reopening?e=5609259600']	[]	1	1	1	[]	[]	https://twitter.com/RepJimBaird/status/1268564764592091137	False		0								[]				
1267835456332365824	1267835388154036232	2020-06-02 11:08:22 EDT	2020-06-02	11:08:22	-0400	1086316494450032640	repjimbaird	Congressman Jim Baird		Learn how to participate here:  https://t.co/dIoWor7OY2	en	[]	['https://calendar.in.gov/site/isda/event/photo-contest-highlights-indiana-agriculture/']	[]	0	0	0	[]	[]	https://twitter.com/RepJimBaird/status/1267835456332365824	False		0								[]				
1267835388154036232	1267835388154036232	2020-06-02 11:08:06 EDT	2020-06-02	11:08:06	-0400	1086316494450032640	repjimbaird	Congressman Jim Baird		📷  PICTURE PERFECT  📷  The @ISDAgov is accepting submissions for the 13th annual Indiana Agriculture Photo Contest. This is a chance for you to share your photos that recognize the hard work of Hoosier farmers and the natural beauty of the state’s agricultural landscape.  https://t.co/v7L5Ghe2Dy	en	[{'screen_name': 'isdagov', 'name': 'indiana dept of ag', 'id': '26143624'}]	[]	['https://pbs.twimg.com/media/EZhA3e7WoAEGFYF.jpg']	4	1	3	[]	[]	https://twitter.com/RepJimBaird/status/1267835388154036232	False		1	https://pbs.twimg.com/media/EZhA3e7WoAEGFYF.jpg							[]				
1267633480579584001	1267633401768611841	2020-06-01 21:45:47 EDT	2020-06-01	21:45:47	-0400	1086316494450032640	repjimbaird	Congressman Jim Baird		Peaceful protests have a significant role in our history, it is important Americans use their right, peacefully and respectfully. Rioting and looting have no place in our communities and must stop.	en	[]	[]	[]	2	1	3	[]	[]	https://twitter.com/RepJimBaird/status/1267633480579584001	False		0								[]				
1267633401768611841	1267633401768611841	2020-06-01 21:45:29 EDT	2020-06-01	21:45:29	-0400	1086316494450032640	repjimbaird	Congressman Jim Baird		The senseless death of George Floyd should outrage us all. We must unite as a country to find solutions to end racism and injustice.	en	[]	[]	[]	2	2	8	[]	[]	https://twitter.com/RepJimBaird/status/1267633401768611841	False		0								[]				
1267550731265019904	1267550731265019904	2020-06-01 16:16:58 EDT	2020-06-01	16:16:58	-0400	1086316494450032640	repjimbaird	Congressman Jim Baird		Congratulations to Jackson Szczerbik of Cloverdale for graduating from West Point Military Academy.  https://t.co/QY7a4RpfVq	en	[]	['https://www.bannergraphic.com/story/2814037.html']	[]	0	1	2	[]	[]	https://twitter.com/RepJimBaird/status/1267550731265019904	False		0								[]				
1266803176424030209	1266803176424030209	2020-05-30 14:46:27 EDT	2020-05-30	14:46:27	-0400	1086316494450032640	repjimbaird	Congressman Jim Baird		Congratulations to Mr. Baker for receiving the School Specialty Crystal Apple Award. Well deserved!   https://t.co/bpnfbNQSyP	en	[]	['https://www.reporter.net/news/local_news/unconventional-elementary-teacher-earns-national-award/article_083e48a6-a0fc-11ea-885e-47efd5abe207.html?utm_source=dlvr.it&utm_medium=twitter']	[]	0	1	2	[]	[]	https://twitter.com/RepJimBaird/status/1266803176424030209	False		0								[]				
1266479401732096002	1266479401732096002	2020-05-29 17:19:54 EDT	2020-05-29	17:19:54	-0400	1086316494450032640	repjimbaird	Congressman Jim Baird		“This legislation will give Hoosier small businesses additional flexibility in designing their plan for successful reopening and long term recovery.”    https://t.co/Hh5MiJI8Rr	en	[]	['https://baird.house.gov/news/documentsingle.aspx?DocumentID=96']	[]	1	1	0	[]	[]	https://twitter.com/RepJimBaird/status/1266479401732096002	False		0								[]				
1266421175988690950	1266421175988690950	2020-05-29 13:28:31 EDT	2020-05-29	13:28:31	-0400	1086316494450032640	repjimbaird	Congressman Jim Baird		Grants allocated from the CARES Act will help local cultural institutions like the Friends of the Frankfort Public Library remain open and serve the community.   https://t.co/92PiflWZ4o	en	[]	['https://indianahumanities.org/wp-content/uploads/2020/05/CARES-Grant-Announcement-4.pdf']	[]	0	1	1	[]	[]	https://twitter.com/RepJimBaird/status/1266421175988690950	False		0								[]				
1266365769656532993	1266365769656532993	2020-05-29 09:48:22 EDT	2020-05-29	09:48:22	-0400	1086316494450032640	repjimbaird	Congressman Jim Baird		Great news for Hoosiers!	en	[]	[]	[]	1	1	1	[]	[]	https://twitter.com/RepJimBaird/status/1266365769656532993	False	https://twitter.com/GovHolcomb/status/1266186406038208513	0								[]				
1265751352283672579	1265751352283672579	2020-05-27 17:06:53 EDT	2020-05-27	17:06:53	-0400	1086316494450032640	repjimbaird	Congressman Jim Baird		Keep up the great work Asijah!   https://t.co/VlMTsQhvag	en	[]	['https://www.kokomotribune.com/news/local_news/its-something-special-kokomo-high-school-senior-juggles-e-learning-with-new-job-building-ventilators/article_5febdd2c-9c72-11ea-b23f-f799890baa9e.html']	[]	1	0	2	[]	[]	https://twitter.com/RepJimBaird/status/1265751352283672579	False		0								[]				
1265683903710453763	1265683903710453763	2020-05-27 12:38:52 EDT	2020-05-27	12:38:52	-0400	1086316494450032640	repjimbaird	Congressman Jim Baird		Today’s space shuttle launch from @SpaceX and @NASA will be the first time humans fly to the space station from U.S. soil since 2011. The U.S. is again leading the world in space exploration.    Watch this historic launch at 4:33PM ET.   https://t.co/CPC3ejoEJ9	en	[{'screen_name': 'spacex', 'name': 'spacex', 'id': '34743251'}, {'screen_name': 'nasa', 'name': 'nasa', 'id': '11348282'}]	['https://www.youtube.com/watch?v=Aymrnzianf0&feature=emb_title']	[]	0	1	1	[]	[]	https://twitter.com/RepJimBaird/status/1265683903710453763	False		0								[]				
1265632309815971840	1265632309815971840	2020-05-27 09:13:51 EDT	2020-05-27	09:13:51	-0400	1086316494450032640	repjimbaird	Congressman Jim Baird		Teachers across the country are working extra hard to find new and engaging ways to teach our kids during this time of physical separation. One resource teachers can utilize is the Library of Congress.   Check out all their amazing resources at  https://t.co/I6uGYRucgq.	en	[]	['http://www.loc.gov/teachers']	[]	0	1	3	[]	[]	https://twitter.com/RepJimBaird/status/1265632309815971840	False		0								[]				
1265336259989458944	1265336259989458944	2020-05-26 13:37:27 EDT	2020-05-26	13:37:27	-0400	1086316494450032640	repjimbaird	Congressman Jim Baird		The application for the Coronavirus Food Assistance Program (CFAP) is now available. Hoosiers can find the application here:  https://t.co/iCDtDVWG4m   Individuals applying should contact their local FSA office for guidance on submitting their application.	en	[]	['https://www.farmers.gov/sites/default/files/documents/AD3114_200519V01%20%20FINAL.pdf']	[]	1	3	4	[]	[]	https://twitter.com/RepJimBaird/status/1265336259989458944	False		0								[]				
1265300405300363268	1265300405300363268	2020-05-26 11:14:59 EDT	2020-05-26	11:14:59	-0400	1086316494450032640	repjimbaird	Congressman Jim Baird		This is welcome news. Purdue has put forth a plan to continue the education of students while keeping everyone on campus safe from COVID-19.   https://t.co/fwtprCresx	en	[]	['https://www.washingtonpost.com/opinions/why-we-have-a-responsibility-to-open-purdue-university-this-fall/2020/05/25/da3b615c-9c62-11ea-ac72-3841fcc9b35f_story.html#comments-wrapper']	[]	0	1	5	[]	[]	https://twitter.com/RepJimBaird/status/1265300405300363268	False		0								[]				
1264890149101592578	1264890149101592578	2020-05-25 08:04:46 EDT	2020-05-25	08:04:46	-0400	1086316494450032640	repjimbaird	Congressman Jim Baird		Memorial Day is a day to reflect and remember the incredible sacrifices made by our men and women who served our country. We will never forget what they did for us, to protect our freedom and keep us safe.  https://t.co/QsaDbtv5Ln	en	[]	[]	['https://pbs.twimg.com/media/EY3K0NmWsAAJWEn.jpg']	0	3	13	[]	[]	https://twitter.com/RepJimBaird/status/1264890149101592578	False		1	https://pbs.twimg.com/media/EY3K0NmWsAAJWEn.jpg							[]				
1263891107559112704	1263891107559112704	2020-05-22 13:54:56 EDT	2020-05-22	13:54:56	-0400	1086316494450032640	repjimbaird	Congressman Jim Baird		REMINDER: You can find updated information and helpful resources related to COVID-19 on our website.  https://t.co/TWEvbQtQpk	en	[]	['https://baird.house.gov/covid-19/']	[]	0	1	0	[]	[]	https://twitter.com/RepJimBaird/status/1263891107559112704	False		0								[]				
1263554619906588672	1263554619906588672	2020-05-21 15:37:51 EDT	2020-05-21	15:37:51	-0400	1086316494450032640	repjimbaird	Congressman Jim Baird		.@AmericaMakes is working with @ENERGY National Labs, academia, and American manufacturing leveraging 3d printing tech to deliver PPE to front line COVID-19 workers.   READ →  https://t.co/A1YyNQ8FeV	en	[{'screen_name': 'americamakes', 'name': 'america makes', 'id': '1260468481'}, {'screen_name': 'energy', 'name': 'u.s. department of energy', 'id': '166252256'}]	['https://www.americamakes.us/statement-on-covid-19/']	[]	0	2	3	[]	[]	https://twitter.com/RepJimBaird/status/1263554619906588672	False		0								[]				
1263116865284575232	1263116865284575232	2020-05-20 10:38:22 EDT	2020-05-20	10:38:22	-0400	1086316494450032640	repjimbaird	Congressman Jim Baird		Here is a helpful video for our agriculture community, explaining how to begin the CFAP application with the USDA. Your local FSA agent is also ready to help you through this process.   https://t.co/I1taRo1DTQ	en	[]	['https://www.youtube.com/watch?v=Rne7_cIVeFU&feature=youtu.be']	[]	1	4	5	[]	[]	https://twitter.com/RepJimBaird/status/1263116865284575232	False		0								[]				
1262778265644736512	1262778265644736512	2020-05-19 12:12:54 EDT	2020-05-19	12:12:54	-0400	1086316494450032640	repjimbaird	Congressman Jim Baird		The IRS now has a dedicated hotline to help answer questions and provide additional assistance for Economic Impact Payments. Please call 800-919-9835 or visit their website:   https://t.co/BQWorNfMDb	en	[]	['https://www.irs.gov/coronavirus-tax-relief-and-economic-impact-payments']	[]	0	1	1	[]	[]	https://twitter.com/RepJimBaird/status/1262778265644736512	False		0								[]				
1262487200043798528	1262487200043798528	2020-05-18 16:56:19 EDT	2020-05-18	16:56:19	-0400	1086316494450032640	repjimbaird	Congressman Jim Baird		I am happy to work with President Trump and my colleagues in Congress to ensure Hoosiers are well-equipped to combat COVID-19. While we’ve made progress, there is more work to be done. I will continue to work and make sure Indiana has the resources it needs.  https://t.co/ud0qzIFVJt	en	[]	[]	['https://pbs.twimg.com/media/EYVBYK8X0AUMrmQ.jpg']	2	2	3	[]	[]	https://twitter.com/RepJimBaird/status/1262487200043798528	False		1	https://pbs.twimg.com/media/EYVBYK8X0AUMrmQ.jpg							[]				
1261286099697184768	1261286099697184768	2020-05-15 09:23:34 EDT	2020-05-15	09:23:34	-0400	1086316494450032640	repjimbaird	Congressman Jim Baird		My colleagues and I asked FEMA to fulfill Indiana’s request for assistance and clarity on depopulation activities for our livestock industry. COVID-19 has caused severe supply chain issues and our agriculture industry needs help.    https://t.co/6LJ6JLlWe7	en	[]	['https://baird.house.gov/news/documentsingle.aspx?DocumentID=93']	[]	3	3	3	[]	[]	https://twitter.com/RepJimBaird/status/1261286099697184768	False		0								[]				
1260655319820038144	1260655319820038144	2020-05-13 15:37:04 EDT	2020-05-13	15:37:04	-0400	1086316494450032640	repjimbaird	Congressman Jim Baird		This story is another example of how our educators continue to go above and beyond for their students during the COVID-19 pandemic. Thank you to these amazing teachers and congratulations to the graduating class of 2020!  https://t.co/HZNSQBV5V1	en	[]	['https://www.jconline.com/story/news/2020/05/12/coronavirus-indiana-harrison-teachers-personally-deliver-graduation-caps-and-gowns-seniors-stuck-hom/3110224001/']	[]	1	1	1	[]	[]	https://twitter.com/RepJimBaird/status/1260655319820038144	False		0								[]				
1260329698351026180	1260329698351026180	2020-05-12 18:03:10 EDT	2020-05-12	18:03:10	-0400	1086316494450032640	repjimbaird	Congressman Jim Baird		The VA has launched the COVID Coach app to help both Veterans and civilians cope with feelings of stress and anxiety during the COVID-19 pandemic. May is #MentalHealthAwarenessMonth and it’s important we all take time to care for ourselves and one another.  https://t.co/6e7ubyc1G3	en	[]	['https://mobile.va.gov/app/covid-coach']	[]	1	1	1	['mentalhealthawarenessmonth']	[]	https://twitter.com/RepJimBaird/status/1260329698351026180	False		0								[]				
1260256464217702401	1260256464217702401	2020-05-12 13:12:10 EDT	2020-05-12	13:12:10	-0400	1086316494450032640	repjimbaird	Congressman Jim Baird		Congratulations to Purdue graduate student Bethany Rutherford on being selected for the Science Graduate Student Research Program. This grant program prepares students for STEM careers important to the advancement of American science and technology.  https://t.co/bIshuOzGcO	en	[]	['https://science.osti.gov/WDTS/SCGSR/SCGSR-Awards']	[]	1	0	3	[]	[]	https://twitter.com/RepJimBaird/status/1260256464217702401	False		0								[]				
1259930452028272647	1259930452028272647	2020-05-11 15:36:42 EDT	2020-05-11	15:36:42	-0400	1086316494450032640	repjimbaird	Congressman Jim Baird		The Blue Angels will fly over Indianapolis at 2 p.m. tomorrow to salute the heroes who have worked tirelessly to save and protect us from the COVID-19 epidemic.   Check out their flight path here:  https://t.co/l7sQX7lveJ	en	[]	['https://www.wthr.com/article/blue-angels-fly-over-indianapolis-tuesday']	[]	1	1	3	[]	[]	https://twitter.com/RepJimBaird/status/1259930452028272647	False		0								[]				
1259474317181665285	1259474317181665285	2020-05-10 09:24:11 EDT	2020-05-10	09:24:11	-0400	1086316494450032640	repjimbaird	Congressman Jim Baird		Thank you to all the mothers for all the ways you go above and beyond every day for your families. Your love and dedication as mothers bring immense joy to this world. Happy Mothers Day!  https://t.co/3a1czGGlQ4	en	[]	[]	['https://pbs.twimg.com/media/EXqNLG9XgAAjVF6.jpg']	1	2	4	[]	[]	https://twitter.com/RepJimBaird/status/1259474317181665285	False		1	https://pbs.twimg.com/media/EXqNLG9XgAAjVF6.jpg							[]				
1258872365045383168	1258872365045383168	2020-05-08 17:32:15 EDT	2020-05-08	17:32:15	-0400	1086316494450032640	repjimbaird	Congressman Jim Baird		Read how our Indiana National Guard parachute riggers are helping out in the fight against COVID-19.   https://t.co/fXa2IlxtRM	en	[]	['https://www.army.mil/article/235363/indiana_guard_soldiers_trade_parachutes_for_sewing_machines']	[]	2	3	4	[]	[]	https://twitter.com/RepJimBaird/status/1258872365045383168	False		0								[]				
