id	conversation_id	created_at	date	time	timezone	user_id	username	name	place	tweet	language	mentions	urls	photos	replies_count	retweets_count	likes_count	hashtags	cashtags	link	retweet	quote_url	video	thumbnail	near	geo	source	user_rt_id	user_rt	retweet_id	reply_to	retweet_date	translate	trans_src	trans_dest
1145785859859501058	1145785859859501058	2019-07-01 16:06:51 EDT	2019-07-01	16:06:51	-0400	1086316494450032640	repjimbaird	Congressman Jim Baird		It’s a privilege to honor Dorothy Brown in Congress for her dedication to Greencastle and to thousands of students at DePauw University. Our community is better because of her selflessness and I’m proud to call her a fellow Hoosier.  https://t.co/wR1j6DSkWy	en	[]	['https://www.bannergraphic.com/story/2618681.html']	[]	0	5	20	[]	[]	https://twitter.com/RepJimBaird/status/1145785859859501058	False		0								[]				
1143683639357689856	1143683639357689856	2019-06-25 20:53:22 EDT	2019-06-25	20:53:22	-0400	1086316494450032640	repjimbaird	Congressman Jim Baird		Great turnout in Lafayette at our second Veterans History Project training workshop! Thank you to all who joined us this evening. Looking forward to hearing the stories of our 4th District Hoosier veterans.  https://t.co/dxKnDfVCLF	en	[]	[]	['https://pbs.twimg.com/media/D98uMzlXsAEpQip.jpg', 'https://pbs.twimg.com/media/D98uMzmXkAAgAEK.jpg', 'https://pbs.twimg.com/media/D98uMzmXoAAB4UH.jpg']	0	2	4	[]	[]	https://twitter.com/RepJimBaird/status/1143683639357689856	False		1	https://pbs.twimg.com/media/D98uMzlXsAEpQip.jpg							[]				
1143623280827469824	1143623280827469824	2019-06-25 16:53:32 EDT	2019-06-25	16:53:32	-0400	1086316494450032640	repjimbaird	Congressman Jim Baird		Thank you to @SecretaryPerry for emphasizing the return on investment that R&amp;D programs provide to keep us at the forefront of scientific innovation. As a Hoosier farmer &amp; scientist, it's vitally important to emphasize the necessity of these programs in our bioproducts industry.  https://t.co/y8tufSlRIZ	en	[{'screen_name': 'secretaryperry', 'name': 'rick perry', 'id': '830128820447539208'}]	[]	[]	0	2	7	[]	[]	https://twitter.com/RepJimBaird/status/1143623280827469824	False		1	https://pbs.twimg.com/ext_tw_video_thumb/1143616050648571906/pu/img/1_dXWjsaqnNGe_Z2.jpg							[]				
1143519402568093696	1143519402568093696	2019-06-25 10:00:45 EDT	2019-06-25	10:00:45	-0400	1086316494450032640	repjimbaird	Congressman Jim Baird		Great to have @SecretaryPerry with us in @housesciencegop this morning taking a look at DOE’s priorities and the role R&amp;D can play in diversifying our biofuel and bioproducts industry. Tune in:  https://t.co/xnA0pZkzmO.  https://t.co/8NxKtiKPfl	en	[{'screen_name': 'secretaryperry', 'name': 'rick perry', 'id': '830128820447539208'}, {'screen_name': 'housesciencegop', 'name': 'sci, space, & tech gop', 'id': '23103488'}]	['https://bit.ly/1ImJN1h']	['https://pbs.twimg.com/media/D96VI6iXoAEWRXP.png']	0	2	6	[]	[]	https://twitter.com/RepJimBaird/status/1143519402568093696	False		1	https://pbs.twimg.com/media/D96VI6iXoAEWRXP.png							[]				
1143270021365456896	1143270021365456896	2019-06-24 17:29:48 EDT	2019-06-24	17:29:48	-0400	1086316494450032640	repjimbaird	Congressman Jim Baird		It’s an honor to welcome #IN04 2019 Congressional Art Competition winner Catherine Caes to our nation’s capital. Her creativity demonstrates what this competition is all about, and I am proud to showcase her work over the next year in Washington.  https://t.co/Y9o8ZxHtT5	en	[]	[]	['https://pbs.twimg.com/media/D922BZwXYAAI4IE.jpg', 'https://pbs.twimg.com/media/D922BZrWkAMiIqW.jpg']	0	2	5	['in04']	[]	https://twitter.com/RepJimBaird/status/1143270021365456896	False		1	https://pbs.twimg.com/media/D922BZwXYAAI4IE.jpg							[]				
1143238828272115712	1143238828272115712	2019-06-24 15:25:51 EDT	2019-06-24	15:25:51	-0400	1086316494450032640	repjimbaird	Congressman Jim Baird		I’m honored to recognize Dorothy “Mom” Brown in Congress for her selfless dedication to our community and her 26 years of service to the Phi Kappa Psi house.  https://t.co/v9veGYsqzS	en	[]	[]	[]	0	1	5	[]	[]	https://twitter.com/RepJimBaird/status/1143238828272115712	False		1	https://pbs.twimg.com/ext_tw_video_thumb/1143238758403325952/pu/img/Xvdt74Zzz6VA190_.jpg							[]				
1142162641298874369	1142162641298874369	2019-06-21 16:09:28 EDT	2019-06-21	16:09:28	-0400	1086316494450032640	repjimbaird	Congressman Jim Baird		The opioid epidemic does not discriminate and has tragically destroyed the lives of many Hoosiers – this devastating crisis must come to an end. I’m proud that my bill with @RepWexton to research addiction will be brought before the House for a vote.  https://t.co/y2odVmfcGj	en	[{'screen_name': 'repwexton', 'name': 'rep. jennifer wexton', 'id': '1017819745880543238'}]	[]	[]	0	4	9	[]	[]	https://twitter.com/RepJimBaird/status/1142162641298874369	False		1	https://pbs.twimg.com/ext_tw_video_thumb/1142162302126440451/pu/img/nuaVasEZt8xVhU8J.jpg							[]				
1142143019711455243	1142143019711455243	2019-06-21 14:51:30 EDT	2019-06-21	14:51:30	-0400	1086316494450032640	repjimbaird	Congressman Jim Baird		Congratulations to the new @IndianaFFA State Officer Team!	en	[{'screen_name': 'indianaffa', 'name': 'indiana ffa', 'id': '128881957'}]	[]	[]	0	2	45	[]	[]	https://twitter.com/RepJimBaird/status/1142143019711455243	False	https://twitter.com/IndianaFFA/status/1142093547484700672	0								[]				
1142096089786589184	1142096089786589184	2019-06-21 11:45:01 EDT	2019-06-21	11:45:01	-0400	1086316494450032640	repjimbaird	Congressman Jim Baird		Our office is now accepting internship applications for the fall 2019 semester. Internships are open to qualified undergraduate and graduate students with ties to #IN04, and are due no later than July 12th. Click below to learn more:  https://t.co/aoPRk2GOM6	en	[]	['https://bit.ly/2LciD2O']	[]	0	1	3	['in04']	[]	https://twitter.com/RepJimBaird/status/1142096089786589184	False		0								[]				
1141814033974214663	1141814033974214663	2019-06-20 17:04:14 EDT	2019-06-20	17:04:14	-0400	1086316494450032640	repjimbaird	Congressman Jim Baird		The opioid crisis has devastated communities across the nation. I’m proud to see my bipartisan bill with @RepWexton pass through @housesciencegop, and I look forward to supporting the EFFORT Act as it goes before the House for a vote.  https://t.co/2nrS0Qxfid	en	[{'screen_name': 'repwexton', 'name': 'rep. jennifer wexton', 'id': '1017819745880543238'}, {'screen_name': 'housesciencegop', 'name': 'sci, space, & tech gop', 'id': '23103488'}]	['https://bit.ly/2FmCj0m']	[]	0	5	6	[]	[]	https://twitter.com/RepJimBaird/status/1141814033974214663	False		0								[]				
1141766241700515841	1141766241700515841	2019-06-20 13:54:19 EDT	2019-06-20	13:54:19	-0400	1086316494450032640	repjimbaird	Congressman Jim Baird		By responsibly increasing funding for USDA’s DLT grant program, we can provide educational opportunities &amp; improved healthcare without additional cost to taxpayers. I’m proud to support @RepGregPence's amendment ensuring all Hoosier communities have access to adequate broadband.  https://t.co/1o26Xeq0MB	en	[{'screen_name': 'repgregpence', 'name': 'rep. greg pence', 'id': '1082369392229400576'}]	[]	[]	0	1	4	[]	[]	https://twitter.com/RepJimBaird/status/1141766241700515841	False		1	https://pbs.twimg.com/ext_tw_video_thumb/1141765444732407809/pu/img/G6B-6GN-B7pwNzin.jpg							[]				
1141693532916342785	1141693532916342785	2019-06-20 09:05:24 EDT	2019-06-20	09:05:24	-0400	1086316494450032640	repjimbaird	Congressman Jim Baird		.@INFarmBureau works daily to serve Hoosier farmers and producers. Enjoyed meeting with them this week to discuss #IN04 agriculture and broadband issues.  https://t.co/vZLnTUa4pP	en	[{'screen_name': 'infarmbureau', 'name': 'indiana farm bureau', 'id': '35673815'}]	[]	['https://pbs.twimg.com/media/D9gcNVmXYAEoqQ3.jpg']	0	8	20	['in04']	[]	https://twitter.com/RepJimBaird/status/1141693532916342785	False		1	https://pbs.twimg.com/media/D9gcNVmXYAEoqQ3.jpg							[]				
1141342910455136256	1141342910455136256	2019-06-19 09:52:09 EDT	2019-06-19	09:52:09	-0400	1086316494450032640	repjimbaird	Congressman Jim Baird		Morgan, Molly, and Tommy have been a great help serving #IN04 in my Washington, D.C. office over the past couple of months. Thank you for all of your work on behalf of 4th District Hoosiers!  https://t.co/mR95ULHy0r	en	[]	[]	['https://pbs.twimg.com/media/D9bdUOQWwAAP1yl.jpg']	0	5	15	['in04']	[]	https://twitter.com/RepJimBaird/status/1141342910455136256	False		1	https://pbs.twimg.com/media/D9bdUOQWwAAP1yl.jpg							[]				
1141106550167298057	1141106550167298057	2019-06-18 18:12:56 EDT	2019-06-18	18:12:56	-0400	1086316494450032640	repjimbaird	Congressman Jim Baird		Enjoyed speaking this afternoon with the @IndianaEC Youth Tour, including 39 exceptional students representing #IN04. @YouthTourDC is vital in elevating success in our future leaders.  https://t.co/FnCUw1sTXI	en	[{'screen_name': 'indianaec', 'name': 'indiana electric cooperatives', 'id': '63465133'}, {'screen_name': 'youthtourdc', 'name': 'youthtourdc', 'id': '296252743'}]	[]	['https://pbs.twimg.com/media/D9YGT0AWkAA_E0I.jpg']	0	4	12	['in04']	[]	https://twitter.com/RepJimBaird/status/1141106550167298057	False		1	https://pbs.twimg.com/media/D9YGT0AWkAA_E0I.jpg							[]				
1140987950127337473	1140987950127337473	2019-06-18 10:21:40 EDT	2019-06-18	10:21:40	-0400	1086316494450032640	repjimbaird	Congressman Jim Baird		Our office will be holding mobile office hours today from 11am-2pm ET at the Logansport-Cass County Public Library, and in other locations throughout the month of June. Stop by and say hello!  https://t.co/aCJAP2MBIR	en	[]	[]	['https://pbs.twimg.com/media/D9WadrdXkAAdX5W.jpg']	0	2	3	[]	[]	https://twitter.com/RepJimBaird/status/1140987950127337473	False		1	https://pbs.twimg.com/media/D9WadrdXkAAdX5W.jpg							[]				
1140658812942241792	1140658812942241792	2019-06-17 12:33:48 EDT	2019-06-17	12:33:48	-0400	1086316494450032640	repjimbaird	Congressman Jim Baird		Trey and Jared are fantastic interns currently serving in our Danville office. Thank you for all of your hard work on behalf of the 4th District.  https://t.co/BxjoV2BUpW	en	[]	[]	['https://pbs.twimg.com/media/D9RvIyQWwAE0uYG.jpg']	0	0	5	[]	[]	https://twitter.com/RepJimBaird/status/1140658812942241792	False		1	https://pbs.twimg.com/media/D9RvIyQWwAE0uYG.jpg							[]				
1139649304929476610	1139649304929476610	2019-06-14 17:42:22 EDT	2019-06-14	17:42:22	-0400	1086316494450032640	repjimbaird	Congressman Jim Baird		Today we celebrate the freedom and liberty that our flag symbolizes. Happy #FlagDay!  https://t.co/2YtYVNbnHb	en	[]	[]	['https://pbs.twimg.com/media/D9DZAITXsAECYx3.jpg']	0	1	5	['flagday']	[]	https://twitter.com/RepJimBaird/status/1139649304929476610	False		1	https://pbs.twimg.com/media/D9DZAITXsAECYx3.jpg							[]				
1139552487638228992	1139552487638228992	2019-06-14 11:17:39 EDT	2019-06-14	11:17:39	-0400	1086316494450032640	repjimbaird	Congressman Jim Baird		.@SusanWBrooks has been a champion of Hoosier values and will be greatly missed in the U.S. House of Representatives. It has been a pleasure to serve with her and I wish her the very best.  https://t.co/flKQfcnAeQ	en	[{'screen_name': 'susanwbrooks', 'name': 'susan w. brooks', 'id': '1074101017'}]	['https://baird.house.gov/media/press-releases/congressman-baird-statement-congresswoman-susan-brooks-retirement']	[]	1	2	9	[]	[]	https://twitter.com/RepJimBaird/status/1139552487638228992	False		0								[]				
1139529248711069696	1139529248711069696	2019-06-14 09:45:18 EDT	2019-06-14	09:45:18	-0400	1086316494450032640	repjimbaird	Congressman Jim Baird		Happy 244th birthday to the @USArmy!	en	[{'screen_name': 'usarmy', 'name': 'u.s. army', 'id': '8775672'}]	[]	[]	0	1	3	[]	[]	https://twitter.com/RepJimBaird/status/1139529248711069696	False	https://twitter.com/USArmy/status/1139487649008242688	0								[]				
1139278534315315200	1139278534315315200	2019-06-13 17:09:04 EDT	2019-06-13	17:09:04	-0400	1086316494450032640	repjimbaird	Congressman Jim Baird		Great to speak with @AllAgAllDay about our Hoosier farmers and the crucial role agriculture plays in our economy.  https://t.co/C5e4jASRDo	en	[{'screen_name': 'allagallday', 'name': 'tony st. james', 'id': '80703645'}]	[]	['https://pbs.twimg.com/media/D8-Hw8GXkAk06PX.jpg']	0	4	7	[]	[]	https://twitter.com/RepJimBaird/status/1139278534315315200	False		1	https://pbs.twimg.com/media/D8-Hw8GXkAk06PX.jpg							[]				
1138793674643509249	1138793674643509249	2019-06-12 09:02:24 EDT	2019-06-12	09:02:24	-0400	1086316494450032640	repjimbaird	Congressman Jim Baird		Our staff will be holding mobile office hours today at the West Lafayette Public Library from 12-4pm ET. Stop by and say hello!  208 W. Columbia St., West Lafayette, IN 47906	en	[]	[]	[]	0	1	1	[]	[]	https://twitter.com/RepJimBaird/status/1138793674643509249	False		0								[]				
1138457820687478784	1138457820687478784	2019-06-11 10:47:50 EDT	2019-06-11	10:47:50	-0400	1086316494450032640	repjimbaird	Congressman Jim Baird		We're just two weeks away from the Veterans History Project training workshop! Our veterans deserve to have their stories told and we need you to help collect and submit the oral histories of their selfless service. Please click on the link below to RSVP:  https://t.co/LiZ6DwKpj5	en	[]	['https://bit.ly/2wQfD3K']	[]	0	1	2	[]	[]	https://twitter.com/RepJimBaird/status/1138457820687478784	False		0								[]				
1138184281233285123	1138184281233285123	2019-06-10 16:40:53 EDT	2019-06-10	16:40:53	-0400	1086316494450032640	repjimbaird	Congressman Jim Baird		With 56,800 operational farms, The Hoosier State is one of the top agriculture producing states in the country. Read my op-ed with @SenatorBraun on why Indiana is the best choice for @USDA as they look to move ERS &amp; NIFA closer to the farmers they serve.  https://t.co/QKkwbSwhMu	en	[{'screen_name': 'senatorbraun', 'name': 'senator mike braun', 'id': '1080870981877534720'}, {'screen_name': 'usda', 'name': 'dept. of agriculture', 'id': '61853389'}]	['https://bit.ly/2XrtZDo']	[]	2	3	10	[]	[]	https://twitter.com/RepJimBaird/status/1138184281233285123	False		0								[]				
1138111567885721600	1138111567885721600	2019-06-10 11:51:57 EDT	2019-06-10	11:51:57	-0400	1086316494450032640	repjimbaird	Congressman Jim Baird		Our office will be holding mobile office hours throughout #IN04 during the month of June. If you need assistance with a federal agency or would like to share an opinion, we encourage you to visit us!  https://t.co/n6DTswFL7H	en	[]	['https://baird.house.gov/media/press-releases/districtwide-mobile-office-hours-announced-june']	[]	0	0	0	['in04']	[]	https://twitter.com/RepJimBaird/status/1138111567885721600	False		0								[]				
1136699527942086656	1136699527942086656	2019-06-06 14:21:00 EDT	2019-06-06	14:21:00	-0400	1086316494450032640	repjimbaird	Congressman Jim Baird		The opioid crisis does not discriminate and has tragically destroyed lives in our Hoosier communities. I’m proud to introduce the EFFORT Act with my colleague @RepWexton to help prevent addiction before it begins.  https://t.co/lRTuL1cyzq	en	[{'screen_name': 'repwexton', 'name': 'rep. jennifer wexton', 'id': '1017819745880543238'}]	['https://bit.ly/2Kvprsc']	[]	2	5	7	[]	[]	https://twitter.com/RepJimBaird/status/1136699527942086656	False		0								[]				
1136636389834010624	1136636389834010624	2019-06-06 10:10:07 EDT	2019-06-06	10:10:07	-0400	1086316494450032640	repjimbaird	Congressman Jim Baird		Today we remember the heroism and sacrifice of the soldiers who landed in the unknown and fought to protect freedom. #DDay75years  https://t.co/kdYqkWbzuI	en	[]	[]	['https://pbs.twimg.com/media/D8YkxV1XYAE-hkG.jpg']	0	2	8	['dday75years']	[]	https://twitter.com/RepJimBaird/status/1136636389834010624	False		1	https://pbs.twimg.com/media/D8YkxV1XYAE-hkG.jpg							[]				
1136021594755743744	1136021594755743744	2019-06-04 17:27:09 EDT	2019-06-04	17:27:09	-0400	1086316494450032640	repjimbaird	Congressman Jim Baird		Indiana is the best choice for @USDA as they look to move ERS and NIFA closer to our farmers and growers. Read my op-ed with @SenatorBraun below as we write why they should call The Hoosier State home.  https://t.co/QKkwbSwhMu	en	[{'screen_name': 'usda', 'name': 'dept. of agriculture', 'id': '61853389'}, {'screen_name': 'senatorbraun', 'name': 'senator mike braun', 'id': '1080870981877534720'}]	['https://bit.ly/2XrtZDo']	[]	6	7	20	[]	[]	https://twitter.com/RepJimBaird/status/1136021594755743744	False		0								[]				
1135562799453802496	1135562799453802496	2019-06-03 11:04:03 EDT	2019-06-03	11:04:03	-0400	1086316494450032640	repjimbaird	Congressman Jim Baird		It's an honor to continue serving my country in Congress with @RepDanCrenshaw and @RepBrianMast. Check out our interview with @foxandfriends this morning in New York City.  https://t.co/KdGSAgjc9P	en	[{'screen_name': 'repdancrenshaw', 'name': 'rep. dan crenshaw', 'id': '1080894931311431682'}, {'screen_name': 'repbrianmast', 'name': 'rep. brian mast', 'id': '814103950404239360'}, {'screen_name': 'foxandfriends', 'name': 'fox & friends', 'id': '15513604'}]	[]	[]	4	10	18	[]	[]	https://twitter.com/RepJimBaird/status/1135562799453802496	False		1	https://pbs.twimg.com/ext_tw_video_thumb/1135560502195752960/pu/img/XVkRU-kiqgwMtGD0.jpg							[]				
1135354567493849088	1135354567493849088	2019-06-02 21:16:37 EDT	2019-06-02	21:16:37	-0400	1086316494450032640	repjimbaird	Congressman Jim Baird		I’ll be joining my friends @RepDanCrenshaw and @RepBrianMast tomorrow at 6:20am ET/5:20am CT on @foxandfriends talking about the privilege we have to continue serving our country as veterans in Congress. Be sure to tune in!	en	[{'screen_name': 'repdancrenshaw', 'name': 'rep. dan crenshaw', 'id': '1080894931311431682'}, {'screen_name': 'repbrianmast', 'name': 'rep. brian mast', 'id': '814103950404239360'}, {'screen_name': 'foxandfriends', 'name': 'fox & friends', 'id': '15513604'}]	[]	[]	6	5	17	[]	[]	https://twitter.com/RepJimBaird/status/1135354567493849088	False		0								[]				
1134877853378629633	1134877853378629633	2019-06-01 13:42:19 EDT	2019-06-01	13:42:19	-0400	1086316494450032640	repjimbaird	Congressman Jim Baird		It was great to tour @EvonikN_America in Lafayette this week. Thank you for investing in our community and for your continued state of the art research to improve lives.  https://t.co/sGiaRalrZE	en	[{'screen_name': 'evonikn_america', 'name': 'evonik north america', 'id': '482262246'}]	[]	['https://pbs.twimg.com/media/D7_lY81WkAAC18M.jpg']	0	1	5	[]	[]	https://twitter.com/RepJimBaird/status/1134877853378629633	False		1	https://pbs.twimg.com/media/D7_lY81WkAAC18M.jpg							[]				
1134465878869848064	1134465878869848064	2019-05-31 10:25:17 EDT	2019-05-31	10:25:17	-0400	1086316494450032640	repjimbaird	Congressman Jim Baird		Thank you to the Greencastle Rotary Club for the invitation to join you this week! Always enjoy these discussions about the great things happening in our community.  https://t.co/x2HFYm7riN	en	[]	[]	['https://pbs.twimg.com/media/D75urVRWkAAoBRI.jpg', 'https://pbs.twimg.com/media/D75urU8XYAAPh_W.jpg', 'https://pbs.twimg.com/media/D75urU4WkAAcUVP.jpg']	1	1	2	[]	[]	https://twitter.com/RepJimBaird/status/1134465878869848064	False		1	https://pbs.twimg.com/media/D75urVRWkAAoBRI.jpg							[]				
1134144388978925578	1134144388978925578	2019-05-30 13:07:48 EDT	2019-05-30	13:07:48	-0400	1086316494450032640	repjimbaird	Congressman Jim Baird		Enjoyed touring Amazon’s impressive fulfillment facility in Plainfield and meeting many hardworking members of our #IN04 community.  https://t.co/RY265lCVsl	en	[]	[]	['https://pbs.twimg.com/media/D71KS-JWkAEdwKp.jpg']	2	2	5	['in04']	[]	https://twitter.com/RepJimBaird/status/1134144388978925578	False		1	https://pbs.twimg.com/media/D71KS-JWkAEdwKp.jpg							[]				
1134083046477619201	1134083046477619201	2019-05-30 09:04:03 EDT	2019-05-30	09:04:03	-0400	1086316494450032640	repjimbaird	Congressman Jim Baird		Honored to recognize my alma mater on @LifeAtPurdue's 150th Anniversary! It was a privilege to present this congressional record to @purduemitch celebrating a century and a half of excellence. #BoilerUp  https://t.co/D1cxGIvfwK	en	[{'screen_name': 'lifeatpurdue', 'name': 'purdue university', 'id': '16134525'}, {'screen_name': 'purduemitch', 'name': 'mitch daniels', 'id': '1119798144'}]	[]	['https://pbs.twimg.com/media/D70SSqIXkAA1Ohx.jpg']	0	4	15	['boilerup']	[]	https://twitter.com/RepJimBaird/status/1134083046477619201	False		1	https://pbs.twimg.com/media/D70SSqIXkAA1Ohx.jpg							[]				
1133796227517157387	1133796227517157387	2019-05-29 14:04:20 EDT	2019-05-29	14:04:20	-0400	1086316494450032640	repjimbaird	Congressman Jim Baird		Thank you to @HomeDepotGR for an excellent tour in Lafayette! Their investment in families and small businesses plays an integral role in our #IN04 community.  https://t.co/vglFVXtjF6	en	[{'screen_name': 'homedepotgr', 'name': 'the home depot government relations', 'id': '573916220'}]	[]	['https://pbs.twimg.com/media/D7wNmjEWwAENlK4.jpg', 'https://pbs.twimg.com/media/D7wNmjDW4AAWzWa.jpg', 'https://pbs.twimg.com/media/D7wNmjFXYAA4awH.jpg']	0	6	16	['in04']	[]	https://twitter.com/RepJimBaird/status/1133796227517157387	False		1	https://pbs.twimg.com/media/D7wNmjEWwAENlK4.jpg							[]				
1133481127065341953	1133481127065341953	2019-05-28 17:12:14 EDT	2019-05-28	17:12:14	-0400	1086316494450032640	repjimbaird	Congressman Jim Baird		The Tippecanoe County Veterans Treatment Court utilizes unique aspects of military culture to provide hope and healing through mentorships, treatment, and supervision. Thanks for letting us join you today.  https://t.co/kyAce6fsEV	en	[]	[]	['https://pbs.twimg.com/media/D7ru-i3X4AMSv5Q.jpg', 'https://pbs.twimg.com/media/D7rvBCpXkAYM6WF.jpg']	0	1	7	[]	[]	https://twitter.com/RepJimBaird/status/1133481127065341953	False		1	https://pbs.twimg.com/media/D7ru-i3X4AMSv5Q.jpg							[]				
1133017746139176960	1133017746139176960	2019-05-27 10:30:55 EDT	2019-05-27	10:30:55	-0400	1086316494450032640	repjimbaird	Congressman Jim Baird		Today we remember all of those who have paid the ultimate sacrifice in defense of our nation and the rights that we hold dear. We are free because of their bravery.  https://t.co/ttFU1620WE	en	[]	[]	['https://pbs.twimg.com/media/D7lJoj8W4AAu274.jpg']	3	5	14	[]	[]	https://twitter.com/RepJimBaird/status/1133017746139176960	False		1	https://pbs.twimg.com/media/D7lJoj8W4AAu274.jpg							[]				
1131992399377567747	1131992399377567747	2019-05-24 14:36:34 EDT	2019-05-24	14:36:34	-0400	1086316494450032640	repjimbaird	Congressman Jim Baird		"Fascinating to learn how @NOAA's Gulfstream IV-SP ""hurricane hunter"" and the Beechcraft King Air 350 assist in emergency responses. These unique aircrafts save lives and help us better prepare for natural disasters.  https://t.co/MhvzR3OBoS"	en	[{'screen_name': 'noaa', 'name': 'noaa', 'id': '14342564'}]	[]	['https://pbs.twimg.com/media/D7Wkr45WkAIdz33.jpg', 'https://pbs.twimg.com/media/D7WksqMWkAAGkJZ.jpg', 'https://pbs.twimg.com/media/D7WktYeXYAEWcXT.jpg']	1	1	1	[]	[]	https://twitter.com/RepJimBaird/status/1131992399377567747	False		1	https://pbs.twimg.com/media/D7Wkr45WkAIdz33.jpg							[]				
1131674613044396032	1131674613044396032	2019-05-23 17:33:47 EDT	2019-05-23	17:33:47	-0400	1086316494450032640	repjimbaird	Congressman Jim Baird		I’m pleased to see that President Trump and Secretary Perdue are taking action to provide relief for our farmers and ranchers. Looking forward to working with my colleagues to find a long term solution for Hoosiers.  https://t.co/KshF86BglT	en	[]	['https://www.usda.gov/media/press-releases/2019/05/23/usda-announces-support-farmers-impacted-unjustified-retaliation-and']	[]	4	3	6	[]	[]	https://twitter.com/RepJimBaird/status/1131674613044396032	False		0								[]				
1131644676174487553	1131644676174487553	2019-05-23 15:34:50 EDT	2019-05-23	15:34:50	-0400	1086316494450032640	repjimbaird	Congressman Jim Baird		The SECURE Act enables everyone to save better for their future – I’m proud to support bipartisan legislation that makes it easier for our Hoosier families to keep more of their money.  https://t.co/7Zsla1nL5j	en	[]	['https://bit.ly/2JAkMp7']	[]	0	0	3	[]	[]	https://twitter.com/RepJimBaird/status/1131644676174487553	False		0								[]				
1131615610989875200	1131615610989875200	2019-05-23 13:39:20 EDT	2019-05-23	13:39:20	-0400	1086316494450032640	repjimbaird	Congressman Jim Baird		Enjoyed seeing some cutting-edge inventions and breakthrough technology on the Hill this week. Thanks to Intellectual Ventures for stopping by!  https://t.co/7O9wIkcJ7Q	en	[]	[]	['https://pbs.twimg.com/media/D7RMp5pWwAAjHil.jpg']	1	1	3	[]	[]	https://twitter.com/RepJimBaird/status/1131615610989875200	False		1	https://pbs.twimg.com/media/D7RMp5pWwAAjHil.jpg							[]				
1131286081054363652	1131286081054363652	2019-05-22 15:49:54 EDT	2019-05-22	15:49:54	-0400	1086316494450032640	repjimbaird	Congressman Jim Baird		Great to visit with reigning Indy 500 champion, Will Power! We’re just a few days away from The Greatest Spectacle in Racing! Looking forward to an exciting and safe 103rd running of the Indy 500.  https://t.co/IcwlqtD531	en	[]	[]	['https://pbs.twimg.com/media/D7MisTrXYAIcqKK.jpg']	0	0	3	[]	[]	https://twitter.com/RepJimBaird/status/1131286081054363652	False		1	https://pbs.twimg.com/media/D7MisTrXYAIcqKK.jpg							[]				
