id	conversation_id	created_at	date	time	timezone	user_id	username	name	place	tweet	language	mentions	urls	photos	replies_count	retweets_count	likes_count	hashtags	cashtags	link	retweet	quote_url	video	thumbnail	near	geo	source	user_rt_id	user_rt	retweet_id	reply_to	retweet_date	translate	trans_src	trans_dest
355704899293548544	355704899293548544	2013-07-12 11:07:11 EDT	2013-07-12	11:07:11	-0400	15442036	senatorboxer	Sen. Barbara Boxer		Congratulations to Janet Napolitano on becoming the first-ever female President of the University of California system	en	[]	[]	[]	14	50	7	[]	[]	https://twitter.com/SenatorBoxer/status/355704899293548544	False		0								[]				
355407134365712384	355407134365712384	2013-07-11 15:23:58 EDT	2013-07-11	15:23:58	-0400	15442036	senatorboxer	Sen. Barbara Boxer		Today @SenatorHarkin &amp; I called for an investigation of whether “debt relief” firms are defrauding students.  http://t.co/5t0GjJHQn3	en	[{'screen_name': 'senatorharkin', 'name': 'tom harkin', 'id': '115733549'}]	['http://1.usa.gov/155ZaCN']	[]	5	9	1	[]	[]	https://twitter.com/SenatorBoxer/status/355407134365712384	False		0								[]				
355091921460412416	355091921460412416	2013-07-10 18:31:26 EDT	2013-07-10	18:31:26	-0400	15442036	senatorboxer	Sen. Barbara Boxer		Today we missed a chance to protect students from an interest rate hike they can’t afford. The fight goes on. #DontDoubleMyRate	en	[]	[]	[]	9	28	8	['dontdoublemyrate']	[]	https://twitter.com/SenatorBoxer/status/355091921460412416	False		0								[]				
355081500301070336	355081500301070336	2013-07-10 17:50:01 EDT	2013-07-10	17:50:01	-0400	15442036	senatorboxer	Sen. Barbara Boxer		Why does the party that says it wants govt out of our lives put govt in our lives @ our most personal, excruciating moments?#StandWithWomen	en	[]	[]	[]	32	152	59	['standwithwomen']	[]	https://twitter.com/SenatorBoxer/status/355081500301070336	False		0								[]				
355080809062998018	355080809062998018	2013-07-10 17:47:16 EDT	2013-07-10	17:47:16	-0400	15442036	senatorboxer	Sen. Barbara Boxer		Our message today: GOP’s extreme abortion ban isn't going ANYWHERE in Senate. Not on our watch. @PPAct @ReproDocs  http://t.co/IYyelLdLtY	en	[{'screen_name': 'ppact', 'name': 'planned parenthood action', 'id': '22162854'}, {'screen_name': 'reprodocs', 'name': 'reprodocs', 'id': '903427221628612609'}]	[]	['https://pbs.twimg.com/media/BO2AHVNCIAIit78.jpg']	17	46	18	[]	[]	https://twitter.com/SenatorBoxer/status/355080809062998018	False		1	https://pbs.twimg.com/media/BO2AHVNCIAIit78.jpg							[]				
354690156994895872	354690156994895872	2013-07-09 15:54:57 EDT	2013-07-09	15:54:57	-0400	15442036	senatorboxer	Sen. Barbara Boxer		Are you one of the 550,000+ CA students affected by the student loan interest rate increase? Share your story here:  http://t.co/mpvoonR3qA	en	[]	['http://www.boxer.senate.gov/dontdoublemyrate/']	[]	7	7	1	[]	[]	https://twitter.com/SenatorBoxer/status/354690156994895872	False		0								[]				
354687417413943296	354687417413943296	2013-07-09 15:44:04 EDT	2013-07-09	15:44:04	-0400	15442036	senatorboxer	Sen. Barbara Boxer		I want to know how student loan interest rate increases will affect you:  http://t.co/mpvoonR3qA #DontDoubleMyRate	en	[]	['http://www.boxer.senate.gov/dontdoublemyrate/']	[]	6	3	0	['dontdoublemyrate']	[]	https://twitter.com/SenatorBoxer/status/354687417413943296	False		0								[]				
354682573559037952	354682573559037952	2013-07-09 15:24:49 EDT	2013-07-09	15:24:49	-0400	15442036	senatorboxer	Sen. Barbara Boxer		.@SenateDems have a plan to bring back rates to 3.4% for 1 year &amp; apply that rate to all loans made since 7/1 #DontDoubleMyRate	en	[{'screen_name': 'senatedems', 'name': 'senate democrats', 'id': '73238146'}]	[]	[]	5	7	2	['dontdoublemyrate']	[]	https://twitter.com/SenatorBoxer/status/354682573559037952	False		0								[]				
354682464314204160	354682464314204160	2013-07-09 15:24:23 EDT	2013-07-09	15:24:23	-0400	15442036	senatorboxer	Sen. Barbara Boxer		In CA, 51% percent of the class of '11 graduated w/ debt, let’s not make things worse by increasing loan interest rates #DontDoubleMyRate	en	[]	[]	[]	8	3	2	['dontdoublemyrate']	[]	https://twitter.com/SenatorBoxer/status/354682464314204160	False		0								[]				
354679096132898818	354679096132898818	2013-07-09 15:11:00 EDT	2013-07-09	15:11:00	-0400	15442036	senatorboxer	Sen. Barbara Boxer		Some stories need more than 140 characters.  Share your #DontDoubleMyRate story here:  http://t.co/mpvoonR3qA	en	[]	['http://www.boxer.senate.gov/dontdoublemyrate/']	[]	1	7	5	['dontdoublemyrate']	[]	https://twitter.com/SenatorBoxer/status/354679096132898818	False		0								[]				
354678112241459200	354678112241459200	2013-07-09 15:07:06 EDT	2013-07-09	15:07:06	-0400	15442036	senatorboxer	Sen. Barbara Boxer		Congress must keep student loan rates low: in 2011, the average graduate in CA had debt totaling over $19k #DontDoubleMyRate	en	[]	[]	[]	1	13	1	['dontdoublemyrate']	[]	https://twitter.com/SenatorBoxer/status/354678112241459200	False		0								[]				
354677277583343617	354677277583343617	2013-07-09 15:03:47 EDT	2013-07-09	15:03:47	-0400	15442036	senatorboxer	Sen. Barbara Boxer		Tell me your story on why affordable student loans are so important here:  http://t.co/mpvoonR3qA #DontDoubleMyRate	en	[]	['http://www.boxer.senate.gov/dontdoublemyrate/']	[]	5	7	0	['dontdoublemyrate']	[]	https://twitter.com/SenatorBoxer/status/354677277583343617	False		0								[]				
354667654235176960	354667654235176960	2013-07-09 14:25:32 EDT	2013-07-09	14:25:32	-0400	15442036	senatorboxer	Sen. Barbara Boxer		I’ll talk w/@EspuelasVox live at 2:35 ET/11:35 PT about stopping the rate hike on students. Listen:  http://t.co/HlKhjvS9Ng #dontdoublemyrate	en	[{'screen_name': 'espuelasvox', 'name': 'fernando espuelas', 'id': '51520631'}]	['http://radioespuelas.com']	[]	2	4	1	['dontdoublemyrate']	[]	https://twitter.com/SenatorBoxer/status/354667654235176960	False		0								[]				
353720277999419392	353720277999419392	2013-07-06 23:41:00 EDT	2013-07-06	23:41:00	-0400	15442036	senatorboxer	Sen. Barbara Boxer		I have spoken to @SecretaryFoxx &amp; @NTSB Chairman &amp; I am confident that there will be a complete &amp; thorough investigation.	en	[{'screen_name': 'secretaryfoxx', 'name': 'sec. anthony foxx', 'id': '43920155'}, {'screen_name': 'ntsb', 'name': 'ntsb', 'id': '161023696'}]	[]	[]	4	9	1	[]	[]	https://twitter.com/SenatorBoxer/status/353720277999419392	False		0								[]				
353720225788727296	353720225788727296	2013-07-06 23:40:48 EDT	2013-07-06	23:40:48	-0400	15442036	senatorboxer	Sen. Barbara Boxer		My deepest sympathies go out to those who lost loved ones in today's tragic SFO crash. My thoughts &amp; prayers are with the injured.	en	[]	[]	[]	0	20	6	[]	[]	https://twitter.com/SenatorBoxer/status/353720225788727296	False		0								[]				
352506989580001280	352506989580001280	2013-07-03 15:19:50 EDT	2013-07-03	15:19:50	-0400	15442036	senatorboxer	Sen. Barbara Boxer		CA students: share your stories of how you will be personally affected by the student loan interest rate increase  http://t.co/Rpw2SR0WAZ	en	[]	['http://1.usa.gov/165EkT8']	[]	11	13	1	[]	[]	https://twitter.com/SenatorBoxer/status/352506989580001280	False		0								[]				
352462207453368321	352462207453368321	2013-07-03 12:21:53 EDT	2013-07-03	12:21:53	-0400	15442036	senatorboxer	Sen. Barbara Boxer		More than 550,000 students in CA are affected by the student loan interest rate increase, share your story here:  http://t.co/Rpw2SR0WAZ	en	[]	['http://1.usa.gov/165EkT8']	[]	7	10	1	[]	[]	https://twitter.com/SenatorBoxer/status/352462207453368321	False		0								[]				
351829917203312641	351829917203312641	2013-07-01 18:29:23 EDT	2013-07-01	18:29:23	-0400	15442036	senatorboxer	Sen. Barbara Boxer		Bangladesh should allow @grameenbank to operate with respect and autonomy. Read my op-ed w/@SenatorDurbin:  http://t.co/sU3scqI3Re	en	[{'screen_name': 'grameenbank', 'name': 'grameen bank', 'id': '43691239'}, {'screen_name': 'senatordurbin', 'name': 'senator dick durbin', 'id': '247334603'}]	['http://huff.to/1awan5s']	[]	1	1	0	[]	[]	https://twitter.com/SenatorBoxer/status/351829917203312641	False		0								[]				
351796775545344000	351796775545344000	2013-07-01 16:17:42 EDT	2013-07-01	16:17:42	-0400	15442036	senatorboxer	Sen. Barbara Boxer		We should freeze current student loan rates. The last thing we should be doing is making college more expensive #DontDoubleMyRate	en	[]	[]	[]	17	60	16	['dontdoublemyrate']	[]	https://twitter.com/SenatorBoxer/status/351796775545344000	False		0								[]				
351780182731919360	351780182731919360	2013-07-01 15:11:45 EDT	2013-07-01	15:11:45	-0400	15442036	senatorboxer	Sen. Barbara Boxer		The Republican plan makes a profit from students, but when more students can attend college we all prosper. #DontDoubleMyRate	en	[]	[]	[]	4	11	3	['dontdoublemyrate']	[]	https://twitter.com/SenatorBoxer/status/351780182731919360	False		0								[]				
351773408134049793	351773408134049793	2013-07-01 14:44:50 EDT	2013-07-01	14:44:50	-0400	15442036	senatorboxer	Sen. Barbara Boxer		More than 500,000 students in CA could be hit by a devastating student loan rate hike if Congress fails to act. #DontDoubleMyRate	en	[]	[]	[]	9	19	4	['dontdoublemyrate']	[]	https://twitter.com/SenatorBoxer/status/351773408134049793	False		0								[]				
351736692346085376	351736692346085376	2013-07-01 12:18:57 EDT	2013-07-01	12:18:57	-0400	15442036	senatorboxer	Sen. Barbara Boxer		Notice anything missing? Another all-male GOP photo-op celebrating the latest attack on women’s health.  http://t.co/XCO2fgOT5T	en	[]	[]	['https://pbs.twimg.com/media/BOGeqHpCYAAqS6A.jpg']	19	37	9	[]	[]	https://twitter.com/SenatorBoxer/status/351736692346085376	False		1	https://pbs.twimg.com/media/BOGeqHpCYAAqS6A.jpg							[]				
350370190069993472	350370190069993472	2013-06-27 17:48:57 EDT	2013-06-27	17:48:57	-0400	15442036	senatorboxer	Sen. Barbara Boxer		Country is ready &amp; waiting for reform. House GOP shouldn't block progress on legislation that will benefit our nation  http://t.co/uPaBOlf4OX	en	[]	['http://1.usa.gov/14d1xV7']	[]	17	13	4	[]	[]	https://twitter.com/SenatorBoxer/status/350370190069993472	False		0								[]				
350349942809837569	350349942809837569	2013-06-27 16:28:30 EDT	2013-06-27	16:28:30	-0400	15442036	senatorboxer	Sen. Barbara Boxer		America has always been a nation of immigrants &amp; welcoming immigrants is what helps to make us the greatest country in the world #CIR	en	[]	[]	[]	15	27	11	['cir']	[]	https://twitter.com/SenatorBoxer/status/350349942809837569	False		0								[]				
350349092775407618	350349092775407618	2013-06-27 16:25:07 EDT	2013-06-27	16:25:07	-0400	15442036	senatorboxer	Sen. Barbara Boxer		As the daughter &amp; grand-daughter of immigrants, I am so pleased that the Senate passed #CIR that includes a path to citizenship.	en	[]	[]	[]	14	27	7	['cir']	[]	https://twitter.com/SenatorBoxer/status/350349092775407618	False		0								[]				
350004582673432576	350004582673432576	2013-06-26 17:36:09 EDT	2013-06-26	17:36:09	-0400	15442036	senatorboxer	Sen. Barbara Boxer		Just had the chance to personally thank @WendyDavisTexas for courageously standing up for women's health. #StandWithWendy	en	[{'screen_name': 'wendydavistexas', 'name': 'wendy davis', 'id': '2336902850'}]	[]	[]	19	30	31	['standwithwendy']	[]	https://twitter.com/SenatorBoxer/status/350004582673432576	False		0								[]				
349914258567475201	349914258567475201	2013-06-26 11:37:14 EDT	2013-06-26	11:37:14	-0400	15442036	senatorboxer	Sen. Barbara Boxer		Millions of Californians will now be able to marry the person they love, with all the rights &amp; responsibilities that go with it. #Prop8	en	[]	[]	[]	19	88	34	['prop8']	[]	https://twitter.com/SenatorBoxer/status/349914258567475201	False		0								[]				
349912787557949445	349912787557949445	2013-06-26 11:31:24 EDT	2013-06-26	11:31:24	-0400	15442036	senatorboxer	Sen. Barbara Boxer		I was proud to have voted against #DOMA in 1996 &amp; it's so heartening to see that the fed gov't will now treat all marriages equally.	en	[]	[]	[]	9	53	36	['doma']	[]	https://twitter.com/SenatorBoxer/status/349912787557949445	False		0								[]				
349911826257022979	349911826257022979	2013-06-26 11:27:35 EDT	2013-06-26	11:27:35	-0400	15442036	senatorboxer	Sen. Barbara Boxer		Today my spirits are soaring because the Supreme Court reaffirmed the promise of America. #DOMA #Prop8	en	[]	[]	[]	9	63	27	['doma', 'prop8']	[]	https://twitter.com/SenatorBoxer/status/349911826257022979	False		0								[]				
349618441004646400	349618441004646400	2013-06-25 16:01:46 EDT	2013-06-25	16:01:46	-0400	15442036	senatorboxer	Sen. Barbara Boxer		Please thank @WendyDavisTexas for standing up against the GOP's War on Women and protecting the lives and health of women in Texas. #txlege	en	[{'screen_name': 'wendydavistexas', 'name': 'wendy davis', 'id': '2336902850'}]	[]	[]	23	83	29	['txlege']	[]	https://twitter.com/SenatorBoxer/status/349618441004646400	False		0								[]				
349559908296953856	349559908296953856	2013-06-25 12:09:11 EDT	2013-06-25	12:09:11	-0400	15442036	senatorboxer	Sen. Barbara Boxer		Today's decision on #VRA flies in the face of clear evidence of efforts to suppress the vote in minority communities.  http://t.co/TNq19dBAoE	en	[]	['http://1.usa.gov/121aD4b']	[]	13	29	1	['vra']	[]	https://twitter.com/SenatorBoxer/status/349559908296953856	False		0								[]				
349556352785448961	349556352785448961	2013-06-25 11:55:03 EDT	2013-06-25	11:55:03	-0400	15442036	senatorboxer	Sen. Barbara Boxer		I’ll be working with my Senate colleagues to ensure that every American can participate fully in our democracy. #SCOTUS #VRA	en	[]	[]	[]	15	26	12	['scotus', 'vra']	[]	https://twitter.com/SenatorBoxer/status/349556352785448961	False		0								[]				
348555777226723328	348555777226723328	2013-06-22 17:39:07 EDT	2013-06-22	17:39:07	-0400	15442036	senatorboxer	Sen. Barbara Boxer		So glad to have had the chance to discuss the issues with @Netroots_Nation  #nn13	en	[{'screen_name': 'netroots_nation', 'name': 'netroots nation', 'id': '14426645'}]	[]	[]	8	7	3	['nn13']	[]	https://twitter.com/SenatorBoxer/status/348555777226723328	False		0								[]				
348185252096786432	348185252096786432	2013-06-21 17:06:47 EDT	2013-06-21	17:06:47	-0400	15442036	senatorboxer	Sen. Barbara Boxer		It’s working: over 1,400,000 Californians will benefit from $65 million in health insurance rebates this summer thanks to #ObamaCare	en	[]	[]	[]	17	45	13	['obamacare']	[]	https://twitter.com/SenatorBoxer/status/348185252096786432	False		0								[]				
347411963065794561	347411963065794561	2013-06-19 13:54:01 EDT	2013-06-19	13:54:01	-0400	15442036	senatorboxer	Sen. Barbara Boxer		Watch my floor speech on the House Republicans’ extreme and dangerous attack on women’s health:  http://t.co/MrIkEt6cpx #HR1797	en	[]	['http://www.boxer.senate.gov/en/press/videos/061913.cfm']	[]	15	28	10	['hr1797']	[]	https://twitter.com/SenatorBoxer/status/347411963065794561	False		0								[]				
347371121244508160	347371121244508160	2013-06-19 11:11:43 EDT	2013-06-19	11:11:43	-0400	15442036	senatorboxer	Sen. Barbara Boxer		Joining @PattyMurray now on the floor to discuss House Republicans' bill that endangers women and criminalizes doctors. #HR1797	en	[{'screen_name': 'pattymurray', 'name': 'senator patty murray', 'id': '293131808'}]	[]	[]	14	29	6	['hr1797']	[]	https://twitter.com/SenatorBoxer/status/347371121244508160	False		0								[]				
347056257477251073	347056257477251073	2013-06-18 14:20:34 EDT	2013-06-18	14:20:34	-0400	15442036	senatorboxer	Sen. Barbara Boxer		House GOP’s biggest priority: Pass a bill that would endanger women, throw doctors in jail and violate the Constitution. #HR1797	en	[]	[]	[]	25	95	24	['hr1797']	[]	https://twitter.com/SenatorBoxer/status/347056257477251073	False		0								[]				
345288806481682432	345288806481682432	2013-06-13 17:17:21 EDT	2013-06-13	17:17:21	-0400	15442036	senatorboxer	Sen. Barbara Boxer		.@NYTimes editorial: A Failure on Military Sexual Assaults:  http://t.co/9PlkbewfOG  #MJIA	en	[{'screen_name': 'nytimes', 'name': 'the new york times', 'id': '807095'}]	['http://bit.ly/1bxKbUd']	[]	4	28	4	['mjia']	[]	https://twitter.com/SenatorBoxer/status/345288806481682432	False		0								[]				
345285958398275585	345285958398275585	2013-06-13 17:06:02 EDT	2013-06-13	17:06:02	-0400	15442036	senatorboxer	Sen. Barbara Boxer		.@USAToday editorial: Military Sex Assault Victims Get Aspirin:  http://t.co/B0fJGBHGSH  #MJIA	en	[{'screen_name': 'usatoday', 'name': 'usa today', 'id': '15754281'}]	['http://bit.ly/ZKCQyu']	[]	6	10	0	['mjia']	[]	https://twitter.com/SenatorBoxer/status/345285958398275585	False		0								[]				
345259269249196032	345259269249196032	2013-06-13 15:19:59 EDT	2013-06-13	15:19:59	-0400	15442036	senatorboxer	Sen. Barbara Boxer		Last night I went All In w/@chrislhayes to talk about sexual assault in our military:  http://t.co/z04tcWdgFk	en	[{'screen_name': 'chrislhayes', 'name': 'chris hayes', 'id': '4207961'}]	['http://1.usa.gov/176aYub']	[]	2	6	2	[]	[]	https://twitter.com/SenatorBoxer/status/345259269249196032	False		0								[]				
345251927392657408	345251927392657408	2013-06-13 14:50:48 EDT	2013-06-13	14:50:48	-0400	15442036	senatorboxer	Sen. Barbara Boxer		Glad Pres. Election Commission is following our advice ( http://t.co/f8k5pH6zrs) to visit areas w/long lines to vote:  http://t.co/kf2IHJHPeM	en	[]	['http://1.usa.gov/170579E', 'http://hrld.us/11YncvQ']	[]	2	10	2	[]	[]	https://twitter.com/SenatorBoxer/status/345251927392657408	False		0								[]				
345243595109969920	345243595109969920	2013-06-13 14:17:42 EDT	2013-06-13	14:17:42	-0400	15442036	senatorboxer	Sen. Barbara Boxer		Read this powerful statement from the women defending human rights in Russia:  http://t.co/jkEhI4NowZ	en	[]	['http://1.usa.gov/16ji7Ue']	[]	4	7	4	[]	[]	https://twitter.com/SenatorBoxer/status/345243595109969920	False		0								[]				
345185288198434820	345185288198434820	2013-06-13 10:26:00 EDT	2013-06-13	10:26:00	-0400	15442036	senatorboxer	Sen. Barbara Boxer		They're even putting musicians in jail in #Russia. Watch the hearing I am chairing:  http://t.co/aNUuDzaKAX	en	[]	['http://1.usa.gov/1buc0g2']	[]	5	6	0	['russia']	[]	https://twitter.com/SenatorBoxer/status/345185288198434820	False		0								[]				
344908905723342848	344908905723342848	2013-06-12 16:07:45 EDT	2013-06-12	16:07:45	-0400	15442036	senatorboxer	Sen. Barbara Boxer		Instead of embracing the victims, the majority of the Senate Armed Services Committee is embracing the status quo. #MST #MJIA	en	[]	[]	[]	7	34	5	['mst', 'mjia']	[]	https://twitter.com/SenatorBoxer/status/344908905723342848	False		0								[]				
344902797168369665	344902797168369665	2013-06-12 15:43:29 EDT	2013-06-12	15:43:29	-0400	15442036	senatorboxer	Sen. Barbara Boxer		If Congress fails to raise the debt ceiling and lets America become a deadbeat nation, we should not be paid.  http://t.co/gsOZDJ3CdX	en	[]	['http://1.usa.gov/18y1Wqi']	[]	66	26	7	[]	[]	https://twitter.com/SenatorBoxer/status/344902797168369665	False		0								[]				
344585763108827136	344585763108827136	2013-06-11 18:43:42 EDT	2013-06-11	18:43:42	-0400	15442036	senatorboxer	Sen. Barbara Boxer		I’m alarmed that the new #SASC proposal on military sexual assault largely embraces the status quo.  http://t.co/NBHaeOHnB2 #MJIA	en	[]	['http://1.usa.gov/12Ea3zr']	[]	17	34	5	['sasc', 'mjia']	[]	https://twitter.com/SenatorBoxer/status/344585763108827136	False		0								[]				
344478158604619776	344478158604619776	2013-06-11 11:36:07 EDT	2013-06-11	11:36:07	-0400	15442036	senatorboxer	Sen. Barbara Boxer		Read our letter to the Presidential Commission on Election Administration here:  http://t.co/f8k5pH6zrs	en	[]	['http://1.usa.gov/170579E']	[]	3	2	1	[]	[]	https://twitter.com/SenatorBoxer/status/344478158604619776	False		0								[]				
344478086835863552	344478086835863552	2013-06-11 11:35:50 EDT	2013-06-11	11:35:50	-0400	15442036	senatorboxer	Sen. Barbara Boxer		Today @ChrisCoons, @MarkWarner, @SenBillNelson and I called on Pres. Election Commission to hold hearings in states w/ long lines in 2012.	en	[{'screen_name': 'chriscoons', 'name': 'senator chris coons', 'id': '15324851'}, {'screen_name': 'markwarner', 'name': 'mark warner', 'id': '7429102'}, {'screen_name': 'senbillnelson', 'name': 'bill nelson', 'id': '20597460'}]	[]	[]	4	9	5	[]	[]	https://twitter.com/SenatorBoxer/status/344478086835863552	False		0								[]				
343773158421196800	343773158421196800	2013-06-09 12:54:42 EDT	2013-06-09	12:54:42	-0400	15442036	senatorboxer	Sen. Barbara Boxer		Enjoyed being the very first guest yesterday on @finneyk's great new MSNBC show @msnbcDisrupt	en	[{'screen_name': 'finneyk', 'name': 'karen finney', 'id': '45671898'}, {'screen_name': 'msnbcdisrupt', 'name': 'disrupt with karen', 'id': '1485928500'}]	[]	[]	3	1	0	[]	[]	https://twitter.com/SenatorBoxer/status/343773158421196800	False		0								[]				
343064071102406658	343064071102406658	2013-06-07 13:57:03 EDT	2013-06-07	13:57:03	-0400	15442036	senatorboxer	Sen. Barbara Boxer		By creating a real path to citizenship, we will lift families out of poverty and boost our economy. Watch my speech:  http://t.co/aBfThb5ny3	en	[]	['http://1.usa.gov/18TOQ3l']	[]	9	12	2	[]	[]	https://twitter.com/SenatorBoxer/status/343064071102406658	False		0								[]				
343021231441862657	343021231441862657	2013-06-07 11:06:49 EDT	2013-06-07	11:06:49	-0400	15442036	senatorboxer	Sen. Barbara Boxer		Pleased to welcome President Obama to California, where Obamacare will bring affordable healthcare to millions #ACA	en	[]	[]	[]	16	26	8	['aca']	[]	https://twitter.com/SenatorBoxer/status/343021231441862657	False		0								[]				
341950975466172416	341950975466172416	2013-06-04 12:14:00 EDT	2013-06-04	12:14:00	-0400	15442036	senatorboxer	Sen. Barbara Boxer		Thank you @SenGillibrand for making a strong case for our bill in today’s #SASC hearing on military sexual assault.	en	[{'screen_name': 'sengillibrand', 'name': 'kirsten gillibrand', 'id': '72198806'}]	[]	[]	4	17	3	['sasc']	[]	https://twitter.com/SenatorBoxer/status/341950975466172416	False		0								[]				
341942628893458432	341942628893458432	2013-06-04 11:40:50 EDT	2013-06-04	11:40:50	-0400	15442036	senatorboxer	Sen. Barbara Boxer		Bottom line: Decisions on prosecuting heinous crimes like sexual assault must be taken outside the chain of command. #MJIA	en	[]	[]	[]	11	52	23	['mjia']	[]	https://twitter.com/SenatorBoxer/status/341942628893458432	False		0								[]				
341603511735312384	341603511735312384	2013-06-03 13:13:18 EDT	2013-06-03	13:13:18	-0400	15442036	senatorboxer	Sen. Barbara Boxer		Senator Lautenberg went into politics for all the right reasons &amp; spent a lifetime giving a voice to the powerless. I'll miss him greatly.	en	[]	[]	[]	6	23	12	[]	[]	https://twitter.com/SenatorBoxer/status/341603511735312384	False		0								[]				
340566333148262400	340566333148262400	2013-05-31 16:31:55 EDT	2013-05-31	16:31:55	-0400	15442036	senatorboxer	Sen. Barbara Boxer		It’s time to pass strong legislation to protect victims of sexual assault in the military. #MJIA	en	[]	[]	[]	13	22	8	['mjia']	[]	https://twitter.com/SenatorBoxer/status/340566333148262400	False		0								[]				
340561872082305024	340561872082305024	2013-05-31 16:14:12 EDT	2013-05-31	16:14:12	-0400	15442036	senatorboxer	Sen. Barbara Boxer		Proud to stand w/ Stacey Thompson- Marine, mom &amp; #MST survivor- to help end the epidemic of military sexual assault  http://t.co/lQ8FkjT84z	en	[]	['http://bit.ly/18CgyE8']	[]	1	18	4	['mst']	[]	https://twitter.com/SenatorBoxer/status/340561872082305024	False		0								[]				
339779714862419970	339779714862419970	2013-05-29 12:26:11 EDT	2013-05-29	12:26:11	-0400	15442036	senatorboxer	Sen. Barbara Boxer		There’s no court-packing by Obama, there’s court-rigging by Republicans.  http://t.co/zEMhyPTrQ4	en	[]	['http://on.msnbc.com/17swd9x']	[]	13	71	14	[]	[]	https://twitter.com/SenatorBoxer/status/339779714862419970	False		0								[]				
337327473979162624	337327473979162624	2013-05-22 18:01:51 EDT	2013-05-22	18:01:51	-0400	15442036	senatorboxer	Sen. Barbara Boxer		I was proud to accept the 2012 Humane Legislator of the Year award from the @HumaneSociety tonight!	en	[{'screen_name': 'humanesociety', 'name': 'the humane society of the united states', 'id': '15769327'}]	[]	[]	15	16	18	[]	[]	https://twitter.com/SenatorBoxer/status/337327473979162624	False		0								[]				
337314192111591424	337314192111591424	2013-05-22 17:09:05 EDT	2013-05-22	17:09:05	-0400	15442036	senatorboxer	Sen. Barbara Boxer		Today I met with delegates from the University of California (@UCNewsroom) to discuss the importance of graduate education &amp; research.	en	[{'screen_name': 'ucnewsroom', 'name': 'getting bank', 'id': '2187276110'}]	[]	[]	6	5	0	[]	[]	https://twitter.com/SenatorBoxer/status/337314192111591424	False		0								[]				
337234006091395072	337234006091395072	2013-05-22 11:50:27 EDT	2013-05-22	11:50:27	-0400	15442036	senatorboxer	Sen. Barbara Boxer		A path to citizenship would result in 25,000 new jobs and $3 billion in spending a year in California alone.	en	[]	[]	[]	25	32	8	[]	[]	https://twitter.com/SenatorBoxer/status/337234006091395072	False		0								[]				
336961439615029248	336961439615029248	2013-05-21 17:47:22 EDT	2013-05-21	17:47:22	-0400	15442036	senatorboxer	Sen. Barbara Boxer		Commanders should not be allowed to serve as judge, jury and appeals court in sexual assault cases.  http://t.co/R0UY6LRbpM	en	[]	['http://1.usa.gov/1a1HpWD']	[]	10	22	2	[]	[]	https://twitter.com/SenatorBoxer/status/336961439615029248	False		0								[]				
