id	conversation_id	created_at	date	time	timezone	user_id	username	name	place	tweet	language	mentions	urls	photos	replies_count	retweets_count	likes_count	hashtags	cashtags	link	retweet	quote_url	video	thumbnail	near	geo	source	user_rt_id	user_rt	retweet_id	reply_to	retweet_date	translate	trans_src	trans_dest
570289863167238144	570289863167238144	2015-02-24 13:31:13 EST	2015-02-24	13:31:13	-0400	15442036	senatorboxer	Sen. Barbara Boxer		This is a self-inflicted crisis made up by the #GOP. It is dangerous, unnecessary &amp; the height of irresponsibility. #DontShutDownOurSecurity	en	[]	[]	[]	16	50	25	['gop', 'dontshutdownoursecurity']	[]	https://twitter.com/SenatorBoxer/status/570289863167238144	False		0								[]				
569184655292928000	569184655292928000	2015-02-21 12:19:31 EST	2015-02-21	12:19:31	-0400	15442036	senatorboxer	Sen. Barbara Boxer		I'm grateful to President Obama and @LaborSec Perez for their efforts to help the parties resolve their differences. #ports	en	[]	[]	[]	12	32	22	['ports']	[]	https://twitter.com/SenatorBoxer/status/569184655292928000	False		0								[]				
569184230602878976	569184230602878976	2015-02-21 12:17:50 EST	2015-02-21	12:17:50	-0400	15442036	senatorboxer	Sen. Barbara Boxer		The tentative agreement in the West Coast #ports labor dispute is great news for our economy and a huge relief to businesses and workers.	en	[]	[]	[]	1	13	5	['ports']	[]	https://twitter.com/SenatorBoxer/status/569184230602878976	False		0								[]				
568185566426238977	568185566426238977	2015-02-18 18:09:30 EST	2015-02-18	18:09:30	-0400	15442036	senatorboxer	Sen. Barbara Boxer		We must protect our children from diseases like measles that were once eradicated. Follow science, immunize your kids  http://t.co/w2yvYv3ZRG	en	[]	[]	['https://pbs.twimg.com/media/B-KZwv2CMAAGjUB.jpg']	53	34	37	[]	[]	https://twitter.com/SenatorBoxer/status/568185566426238977	False		1	https://pbs.twimg.com/media/B-KZwv2CMAAGjUB.jpg							[]				
568084717754564609	568084717754564609	2015-02-18 11:28:45 EST	2015-02-18	11:28:45	-0400	15442036	senatorboxer	Sen. Barbara Boxer		Please RT and share my letter to @McConnellPress after the TX ruling on the President's exec actions on immigration:  http://t.co/C933NvCEYT	en	[{'screen_name': 'mcconnellpress', 'name': 'senator mcconnell press', 'id': '339822881'}]	['http://www.boxer.senate.gov/press/release/senator-boxer-writes-to-majority-leader-mcconnell-urging-action-on-immigration-in-the-wake-of-texas-court-ruling/']	[]	8	23	5	[]	[]	https://twitter.com/SenatorBoxer/status/568084717754564609	False		0								[]				
566616120510406656	566616120510406656	2015-02-14 10:13:05 EST	2015-02-14	10:13:05	-0400	15442036	senatorboxer	Sen. Barbara Boxer		Forgot a #ValentinesDay gift? Sign your loved ones up for health care today!  http://t.co/sAzNkDp7h1 #GetCovered	en	[]	['http://go.wh.gov/get-covered']	[]	4	15	7	['valentinesday', 'getcovered']	[]	https://twitter.com/SenatorBoxer/status/566616120510406656	False		0								[]				
566377714949820416	566377714949820416	2015-02-13 18:25:44 EST	2015-02-13	18:25:44	-0400	15442036	senatorboxer	Sen. Barbara Boxer		Two days left! #FF @CoveredCa	en	[{'screen_name': 'coveredca', 'name': 'covered california', 'id': '915514734'}]	[]	[]	1	10	3	['ff']	[]	https://twitter.com/SenatorBoxer/status/566377714949820416	False		0								[]				
566377211541090305	566377211541090305	2015-02-13 18:23:44 EST	2015-02-13	18:23:44	-0400	15442036	senatorboxer	Sen. Barbara Boxer		DEADLINE SUNDAY: Just 2 days left to sign up for health coverage. #GetCovered by Feb. 15 →  http://t.co/sAzNkDp7h1  http://t.co/2N1l4Ff68R	en	[]	['http://go.wh.gov/get-covered']	['https://pbs.twimg.com/media/B9wtEn-IMAALx3f.jpg']	25	85	75	['getcovered']	[]	https://twitter.com/SenatorBoxer/status/566377211541090305	False		1	https://pbs.twimg.com/media/B9wtEn-IMAALx3f.jpg							[]				
566341674851631104	566341674851631104	2015-02-13 16:02:32 EST	2015-02-13	16:02:32	-0400	15442036	senatorboxer	Sen. Barbara Boxer		My @HuffingtonPost op-ed on the #AUMF debate – “Confronting Terrorism Without Another American Ground War”  http://t.co/iqrJg6hvqV	en	[{'screen_name': 'huffingtonpost', 'name': 'huffpost', 'id': '854402779879804928'}]	['http://huff.to/1Ak8lnb']	[]	5	7	4	['aumf']	[]	https://twitter.com/SenatorBoxer/status/566341674851631104	False		0								[]				
565945978440933378	565945978440933378	2015-02-12 13:50:10 EST	2015-02-12	13:50:10	-0400	15442036	senatorboxer	Sen. Barbara Boxer		More than 90 percent of Americans say they want to know if the foods they eat are #GMO.  http://t.co/bkg8LIG5OR #justlabelit	en	[]	['http://1.usa.gov/1A0Rrqj']	[]	11	18	15	['gmo', 'justlabelit']	[]	https://twitter.com/SenatorBoxer/status/565945978440933378	False		0								[]				
565941627777466368	565941627777466368	2015-02-12 13:32:53 EST	2015-02-12	13:32:53	-0400	15442036	senatorboxer	Sen. Barbara Boxer		Thank you @tomcolicchio, @SenBlumenthal &amp; @RepPeterDeFazio for speaking out in support the GMO Right-to-Know Act  http://t.co/0LmrTsOon6	en	[{'screen_name': 'tomcolicchio', 'name': 'tom colicchio', 'id': '103130238'}, {'screen_name': 'senblumenthal', 'name': 'richard blumenthal', 'id': '278124059'}, {'screen_name': 'reppeterdefazio', 'name': 'rep peter defazio', 'id': '252249233'}]	[]	['https://pbs.twimg.com/media/B9qg6V3IAAEdYJN.jpg']	4	21	26	[]	[]	https://twitter.com/SenatorBoxer/status/565941627777466368	False		1	https://pbs.twimg.com/media/B9qg6V3IAAEdYJN.jpg							[]				
565582892936740865	565582892936740865	2015-02-11 13:47:24 EST	2015-02-11	13:47:24	-0400	15442036	senatorboxer	Sen. Barbara Boxer		Kudos to 7-year-old Rhett Krawitt of Corte Madera for speaking out on the importance of getting vaccinated.  http://t.co/TxbSCuqXeo	en	[]	['http://bit.ly/1EYI3YH']	[]	20	8	10	[]	[]	https://twitter.com/SenatorBoxer/status/565582892936740865	False		0								[]				
565236748020908032	565236748020908032	2015-02-10 14:51:56 EST	2015-02-10	14:51:56	-0400	15442036	senatorboxer	Sen. Barbara Boxer		It’s only taken Senate Rs a month in power to threaten a shutdown – the shutdown of the Dept. of Homeland Security.  http://t.co/HbEsfZtyRJ	en	[]	[]	['https://pbs.twimg.com/media/B9gf073IQAUxHia.png']	17	19	4	[]	[]	https://twitter.com/SenatorBoxer/status/565236748020908032	False		1	https://pbs.twimg.com/media/B9gf073IQAUxHia.png							[]				
565188147731251201	565188147731251201	2015-02-10 11:38:49 EST	2015-02-10	11:38:49	-0400	15442036	senatorboxer	Sen. Barbara Boxer		Kayla Mueller selflessly devoted her life to serving those in need. Her death is heartbreaking. My thoughts &amp; prayers go out to her family.	en	[]	[]	[]	5	53	44	[]	[]	https://twitter.com/SenatorBoxer/status/565188147731251201	False		0								[]				
563821031316795392	563821031316795392	2015-02-06 17:06:23 EST	2015-02-06	17:06:23	-0400	15442036	senatorboxer	Sen. Barbara Boxer		Thanks to the hard work of the American people and President Obama's leadership, we've had the best 3 months of job growth in 17 years.	en	[]	[]	[]	11	28	27	[]	[]	https://twitter.com/SenatorBoxer/status/563821031316795392	False		0								[]				
563100021982527488	563100021982527488	2015-02-04 17:21:21 EST	2015-02-04	17:21:21	-0400	15442036	senatorboxer	Sen. Barbara Boxer		The Republican Party’s refusal to #FundDHS threatens the security of Americans. #DontShutDownOurSecurity  http://t.co/idiCkvwTkz	en	[]	[]	['https://pbs.twimg.com/media/B9CIfHHCMAAkSGH.png']	11	28	11	['funddhs', 'dontshutdownoursecurity']	[]	https://twitter.com/SenatorBoxer/status/563100021982527488	False		1	https://pbs.twimg.com/media/B9CIfHHCMAAkSGH.png							[]				
563089738748661760	563089738748661760	2015-02-04 16:40:30 EST	2015-02-04	16:40:30	-0400	15442036	senatorboxer	Sen. Barbara Boxer		Today @SenFeinstein &amp; I urged @CHHSAgency Sec. Dooley &amp; CA leaders to revisit the state’s vaccination policy.  http://t.co/qHYVkjxfPL	en	[{'screen_name': 'senfeinstein', 'name': 'senator dianne feinstein', 'id': '476256944'}, {'screen_name': 'chhsagency', 'name': 'ca health and human services', 'id': '36807767'}]	['http://1.usa.gov/1EH2Ob4']	[]	5	11	7	[]	[]	https://twitter.com/SenatorBoxer/status/563089738748661760	False		0								[]				
562715483758419968	562715483758419968	2015-02-03 15:53:20 EST	2015-02-03	15:53:20	-0400	15442036	senatorboxer	Sen. Barbara Boxer		We send our deepest condolences to the family of Lt. Moaz al-Kasasbeh &amp; our thoughts are with the people of Jordan.	en	[]	[]	[]	1	21	18	[]	[]	https://twitter.com/SenatorBoxer/status/562715483758419968	False		0								[]				
562715287192358912	562715287192358912	2015-02-03 15:52:33 EST	2015-02-03	15:52:33	-0400	15442036	senatorboxer	Sen. Barbara Boxer		This barbaric killing shows once again that ISIL’s brutality and cruelty knows no bounds. The world must unite against this threat.	en	[]	[]	[]	5	12	9	[]	[]	https://twitter.com/SenatorBoxer/status/562715287192358912	False		0								[]				
562632515568283648	562632515568283648	2015-02-03 10:23:39 EST	2015-02-03	10:23:39	-0400	15442036	senatorboxer	Sen. Barbara Boxer		It is long past time to abandon our failed policy in #Cuba. That’s why I strongly support President Obama’s decision to chart a new course.	en	[]	[]	[]	4	19	18	['cuba']	[]	https://twitter.com/SenatorBoxer/status/562632515568283648	False		0								[]				
562631459870359552	562631459870359552	2015-02-03 10:19:27 EST	2015-02-03	10:19:27	-0400	15442036	senatorboxer	Sen. Barbara Boxer		How is our country well served by a policy that doesn't even allow us to engage with the very people we seek to empower? #Cuba	en	[]	[]	[]	1	8	12	['cuba']	[]	https://twitter.com/SenatorBoxer/status/562631459870359552	False		0								[]				
562629769721049088	562629769721049088	2015-02-03 10:12:44 EST	2015-02-03	10:12:44	-0400	15442036	senatorboxer	Sen. Barbara Boxer		For more than 50 years, the U.S. has pursued a #Cuba policy designed to undermine the Castro regime &amp; promote human rights. It has failed.	en	[]	[]	[]	3	6	11	['cuba']	[]	https://twitter.com/SenatorBoxer/status/562629769721049088	False		0								[]				
562361077250658305	562361077250658305	2015-02-02 16:25:03 EST	2015-02-02	16:25:03	-0400	15442036	senatorboxer	Sen. Barbara Boxer		So pleased @SenatorReid is supporting my “W21: Water for the 21st Century” bill to better conserve, recycle &amp; manage our water supply.	en	[{'screen_name': 'senatorreid', 'name': 'senator harry reid', 'id': '16789970'}]	[]	[]	5	9	12	[]	[]	https://twitter.com/SenatorBoxer/status/562361077250658305	False		0								[]				
560842364466769921	560842364466769921	2015-01-29 11:50:14 EST	2015-01-29	11:50:14	-0400	15442036	senatorboxer	Sen. Barbara Boxer		Today @SenRandPaul &amp; I announced our bipartisan bill to grow the economy, create jobs &amp; extend the Highway Trust Fund  http://t.co/L3OFPDCdJg	en	[{'screen_name': 'senrandpaul', 'name': 'senator rand paul', 'id': '1298624375692894210'}]	['http://1.usa.gov/1uFnuHT']	[]	10	23	14	[]	[]	https://twitter.com/SenatorBoxer/status/560842364466769921	False		0								[]				
560564503348518912	560564503348518912	2015-01-28 17:26:07 EST	2015-01-28	17:26:07	-0400	15442036	senatorboxer	Sen. Barbara Boxer		Thank you @SFBART for moving to prohibit the use of e-cigarettes in BART trains and stations.  http://t.co/aArnZLnWFB	en	[{'screen_name': 'sfbart', 'name': 'sfbart', 'id': '15640533'}]	['http://1.usa.gov/1ttfkHh']	[]	8	22	24	[]	[]	https://twitter.com/SenatorBoxer/status/560564503348518912	False		0								[]				
560551009257541632	560551009257541632	2015-01-28 16:32:29 EST	2015-01-28	16:32:29	-0400	15442036	senatorboxer	Sen. Barbara Boxer		BREAKING: California Department of Public Health releases report declaring e-cigarettes a “community health threat”  http://t.co/U8mR9lBPI3	en	[]	['http://bit.ly/1zdgpCk']	[]	48	44	23	[]	[]	https://twitter.com/SenatorBoxer/status/560551009257541632	False		0								[]				
559861940491943938	559861940491943938	2015-01-26 18:54:23 EST	2015-01-26	18:54:23	-0400	15442036	senatorboxer	Sen. Barbara Boxer		It’s not too late to #GetCovered for 2015. California residents have until February 15 to buy health insurance on  http://t.co/6hBVszI4vh.	en	[]	['http://CoveredCA.com']	[]	1	15	5	['getcovered']	[]	https://twitter.com/SenatorBoxer/status/559861940491943938	False		0								[]				
559017028598890497	559017028598890497	2015-01-24 10:57:00 EST	2015-01-24	10:57:00	-0400	15442036	senatorboxer	Sen. Barbara Boxer		“So Much for a More Open, Respectful GOP Senate” - my @HuffingtonPost op-ed  http://t.co/rqeIeEdI2R	en	[{'screen_name': 'huffingtonpost', 'name': 'huffpost', 'id': '854402779879804928'}]	['http://www.huffingtonpost.com/sen-barbara-boxer/so-much-for-a-more-open-r_b_6535936.html']	[]	12	26	16	[]	[]	https://twitter.com/SenatorBoxer/status/559017028598890497	False		0								[]				
558706089471266816	558706089471266816	2015-01-23 14:21:26 EST	2015-01-23	14:21:26	-0400	15442036	senatorboxer	Sen. Barbara Boxer		VIDEO:  Republicans’ idea of the “greatest deliberative body” – shut down the Democrats.  http://t.co/xnONgm280w	en	[]	['http://youtu.be/yl4neFHnk84']	[]	17	35	17	[]	[]	https://twitter.com/SenatorBoxer/status/558706089471266816	False		0								[]				
558705826870091777	558705826870091777	2015-01-23 14:20:24 EST	2015-01-23	14:20:24	-0400	15442036	senatorboxer	Sen. Barbara Boxer		Shocking example of McConnell’s new leadership: Stopping five Democrats from getting just one minute to explain their amendments.	en	[]	[]	[]	49	98	50	[]	[]	https://twitter.com/SenatorBoxer/status/558705826870091777	False		0								[]				
558398066727067648	558398066727067648	2015-01-22 17:57:28 EST	2015-01-22	17:57:28	-0400	15442036	senatorboxer	Sen. Barbara Boxer		Proud to stand w/ women &amp; my Dem colleagues to say: We're not going to turn back the clock on women's health! #Roe42  http://t.co/OOBbfku4T1	en	[]	['http://www.boxer.senate.gov/press/release/boxer-murray-degette-slaughter-colleagues-introduce-resolution-supporting-womens-reproductive-health']	[]	3	35	40	['roe42']	[]	https://twitter.com/SenatorBoxer/status/558398066727067648	False		0								[]				
558335676836773890	558335676836773890	2015-01-22 13:49:33 EST	2015-01-22	13:49:33	-0400	15442036	senatorboxer	Sen. Barbara Boxer		The GOP is trying to take women back to the last century. Why don't they join us in this one? VIDEO:  http://t.co/QXgH9IElrS #7in10forRoe	en	[]	['http://bit.ly/1Cjetuc']	[]	23	84	61	['7in10forroe']	[]	https://twitter.com/SenatorBoxer/status/558335676836773890	False		0								[]				
558291077460148224	558291077460148224	2015-01-22 10:52:20 EST	2015-01-22	10:52:20	-0400	15442036	senatorboxer	Sen. Barbara Boxer		House GOP leaders pull their extreme anti-woman bill only to replace it with another extreme anti-woman bill:  http://t.co/7jUxsvUQGc #Roe42	en	[]	['http://talkingpointsmemo.com/dc/rape-clause-abortion-bill-republicans']	[]	16	67	18	['roe42']	[]	https://twitter.com/SenatorBoxer/status/558291077460148224	False		0								[]				
558003404170342400	558003404170342400	2015-01-21 15:49:13 EST	2015-01-21	15:49:13	-0400	15442036	senatorboxer	Sen. Barbara Boxer		No child should ever die because a police officer or anyone else mistakes a toy gun for a real weapon.  http://t.co/TQ2deQKkXu	en	[]	['http://bit.ly/1ysOdwm']	[]	9	28	30	[]	[]	https://twitter.com/SenatorBoxer/status/558003404170342400	False		0								[]				
558001166693703680	558001166693703680	2015-01-21 15:40:19 EST	2015-01-21	15:40:19	-0400	15442036	senatorboxer	Sen. Barbara Boxer		Punishing Americans for mistakes made by @SocialSecurity decades ago is just plain wrong. Our bill will stop this.  http://t.co/KjiBtkeU32	en	[{'screen_name': 'socialsecurity', 'name': 'social security', 'id': '39580052'}]	['http://bit.ly/183TIHY']	[]	10	16	8	[]	[]	https://twitter.com/SenatorBoxer/status/558001166693703680	False		0								[]				
557757454084493312	557757454084493312	2015-01-20 23:31:54 EST	2015-01-20	23:31:54	-0400	15442036	senatorboxer	Sen. Barbara Boxer		I applaud Obama for standing up to GOP threats to repeal Obamacare, repeal Wall Street reform &amp; repeal his immigration exec actions. #SOTU	en	[]	[]	[]	10	125	134	['sotu']	[]	https://twitter.com/SenatorBoxer/status/557757454084493312	False		0								[]				
557755201999093763	557755201999093763	2015-01-20 23:22:57 EST	2015-01-20	23:22:57	-0400	15442036	senatorboxer	Sen. Barbara Boxer		President Obama clearly understands we must #ActOnClimate now to protect our families &amp; future generations. #SOTU  http://t.co/FoblX6Lj2Z	en	[]	[]	['https://pbs.twimg.com/media/B72LZocCIAAwmYu.jpg']	7	77	55	['actonclimate', 'sotu']	[]	https://twitter.com/SenatorBoxer/status/557755201999093763	False		1	https://pbs.twimg.com/media/B72LZocCIAAwmYu.jpg							[]				
557753884605960192	557753884605960192	2015-01-20 23:17:43 EST	2015-01-20	23:17:43	-0400	15442036	senatorboxer	Sen. Barbara Boxer		I agree with the President we should set our sights higher than helping Canadian special interests build the #KXL tar sands pipeline. #SOTU	en	[]	[]	[]	8	97	84	['kxl', 'sotu']	[]	https://twitter.com/SenatorBoxer/status/557753884605960192	False		0								[]				
557752852589064192	557752852589064192	2015-01-20 23:13:37 EST	2015-01-20	23:13:37	-0400	15442036	senatorboxer	Sen. Barbara Boxer		I strongly support his plan to boost the middle class, #RaiseTheWage, expand the child care tax credit &amp; invest in infrastructure. #SOTU	en	[]	[]	[]	9	55	76	['raisethewage', 'sotu']	[]	https://twitter.com/SenatorBoxer/status/557752852589064192	False		0								[]				
557751811441164289	557751811441164289	2015-01-20 23:09:29 EST	2015-01-20	23:09:29	-0400	15442036	senatorboxer	Sen. Barbara Boxer		The President had reason to be confident tonight – unemployment = 5.6 %, a record streak of private-sector job gains &amp; deficit cut by 2/3.	en	[]	[]	[]	9	41	58	[]	[]	https://twitter.com/SenatorBoxer/status/557751811441164289	False		0								[]				
557288600963153921	557288600963153921	2015-01-19 16:28:51 EST	2015-01-19	16:28:51	-0400	15442036	senatorboxer	Sen. Barbara Boxer		On #mlkday let us remember that we cannot, we must not stop fighting until every American can count on equal justice under the law.	en	[]	[]	[]	9	49	47	['mlkday']	[]	https://twitter.com/SenatorBoxer/status/557288600963153921	False		0								[]				
555829982346641410	555829982346641410	2015-01-15 15:52:49 EST	2015-01-15	15:52:49	-0400	15442036	senatorboxer	Sen. Barbara Boxer		Congratulations to @tommycaldwell1 &amp; @kjorgeson on their historic free climb of Yosemite’s #DawnWall.  http://t.co/jiq6CtYwmZ	en	[{'screen_name': 'tommycaldwell1', 'name': 'tommy caldwell', 'id': '246124588'}, {'screen_name': 'kjorgeson', 'name': 'kevin jorgeson', 'id': '20655960'}]	[]	['https://pbs.twimg.com/media/B7a0bG0CIAALNsv.jpg']	2	13	22	['dawnwall']	[]	https://twitter.com/SenatorBoxer/status/555829982346641410	False		1	https://pbs.twimg.com/media/B7a0bG0CIAALNsv.jpg							[]				
555463395005444096	555463395005444096	2015-01-14 15:36:08 EST	2015-01-14	15:36:08	-0400	15442036	senatorboxer	Sen. Barbara Boxer		Instead of fixing our broken #immigration system, House #GOP wants to deport millions of hard-working students &amp; split apart loving families	en	[]	[]	[]	25	51	20	['immigration', 'gop']	[]	https://twitter.com/SenatorBoxer/status/555463395005444096	False		0								[]				
555463007061688321	555463007061688321	2015-01-14 15:34:35 EST	2015-01-14	15:34:35	-0400	15442036	senatorboxer	Sen. Barbara Boxer		House Republicans made clear today that their answer to #immigration reform is to deport everyone.	en	[]	[]	[]	11	53	26	['immigration']	[]	https://twitter.com/SenatorBoxer/status/555463007061688321	False		0								[]				
555055506637987841	555055506637987841	2015-01-13 12:35:19 EST	2015-01-13	12:35:19	-0400	15442036	senatorboxer	Sen. Barbara Boxer		On behalf of my state of California, we send our deepest sympathies to the people of France. We stand with you.  http://t.co/Do8LB0y24C	en	[]	[]	['https://pbs.twimg.com/media/B7P0CsUIIAAKvK9.jpg']	5	14	29	[]	[]	https://twitter.com/SenatorBoxer/status/555055506637987841	False		1	https://pbs.twimg.com/media/B7P0CsUIIAAKvK9.jpg							[]				
553224915223322624	553224915223322624	2015-01-08 11:21:12 EST	2015-01-08	11:21:12	-0400	15442036	senatorboxer	Sen. Barbara Boxer		I will never retire from fighting for the issues that matter, but I will not be running for the Senate in 2016.	en	[]	[]	[]	221	550	279	[]	[]	https://twitter.com/SenatorBoxer/status/553224915223322624	False		0								[]				
552956575707824129	552956575707824129	2015-01-07 17:34:55 EST	2015-01-07	17:34:55	-0400	15442036	senatorboxer	Sen. Barbara Boxer		I applaud the President &amp; @SecretaryCastro for helping make the dream of home ownership a reality for more families.  http://t.co/O3uEMkw4fD	en	[{'screen_name': 'secretarycastro', 'name': 'julián castro', 'id': '2695663285'}]	['http://1.usa.gov/1AGS21M']	[]	5	21	19	[]	[]	https://twitter.com/SenatorBoxer/status/552956575707824129	False		0								[]				
552852868395724800	552852868395724800	2015-01-07 10:42:49 EST	2015-01-07	10:42:49	-0400	15442036	senatorboxer	Sen. Barbara Boxer		My thoughts and prayers are with the injured and the families of those killed in this heinous and cowardly act of terror. #CharlieHebdo	en	[]	[]	[]	7	19	25	['charliehebdo']	[]	https://twitter.com/SenatorBoxer/status/552852868395724800	False		0								[]				
552852801827930112	552852801827930112	2015-01-07 10:42:34 EST	2015-01-07	10:42:34	-0400	15442036	senatorboxer	Sen. Barbara Boxer		This was a barbaric attack on innocent French citizens and on our shared belief in the fundamental right of free expression. #CharlieHebdo	en	[]	[]	[]	3	29	24	['charliehebdo']	[]	https://twitter.com/SenatorBoxer/status/552852801827930112	False		0								[]				
550330091801415680	550330091801415680	2014-12-31 11:38:13 EST	2014-12-31	11:38:13	-0400	15442036	senatorboxer	Sen. Barbara Boxer		Read my latest blog post @HuffingtonPost: A New Chapter in U.S.-Cuba Relations  http://t.co/yKDhxivFo6	en	[{'screen_name': 'huffingtonpost', 'name': 'huffpost', 'id': '854402779879804928'}]	['http://www.huffingtonpost.com/sen-barbara-boxer/a-new-chapter-in-us-cuba_b_6400580.html']	[]	4	2	5	[]	[]	https://twitter.com/SenatorBoxer/status/550330091801415680	False		0								[]				
545724124652666880	545724124652666880	2014-12-18 18:35:45 EST	2014-12-18	18:35:45	-0400	15442036	senatorboxer	Sen. Barbara Boxer		Thanks to #Obamacare, America’s uninsured rate is near a historic low! #ACAworks  http://t.co/SQjh22Mrqq  http://t.co/h73r96dzOS	en	[]	['http://time.com/3639785/uninsured-obamacare-record/']	['https://pbs.twimg.com/media/B5LNMxXCAAAxfBb.png']	22	41	20	['obamacare', 'acaworks']	[]	https://twitter.com/SenatorBoxer/status/545724124652666880	False		1	https://pbs.twimg.com/media/B5LNMxXCAAAxfBb.png							[]				
545342931847372801	545342931847372801	2014-12-17 17:21:01 EST	2014-12-17	17:21:01	-0400	15442036	senatorboxer	Sen. Barbara Boxer		As I learned during a 2002 trip to Cuba w/ Ag community from CA, we will have enormous economic opportunities because of this action.	en	[]	[]	[]	15	16	26	[]	[]	https://twitter.com/SenatorBoxer/status/545342931847372801	False		0								[]				
545342809256251392	545342809256251392	2014-12-17 17:20:32 EST	2014-12-17	17:20:32	-0400	15442036	senatorboxer	Sen. Barbara Boxer		Today opens a new chapter in U.S.-Cuba relations that rejects the failed policies of the past &amp; embraces a new future for both countries.	en	[]	[]	[]	9	50	50	[]	[]	https://twitter.com/SenatorBoxer/status/545342809256251392	False		0								[]				
545342748103303168	545342748103303168	2014-12-17 17:20:17 EST	2014-12-17	17:20:17	-0400	15442036	senatorboxer	Sen. Barbara Boxer		After 5 long years, the release of Alan Gross is a joyous moment for his family, friends &amp; all Americans who worked &amp; prayed for this day.	en	[]	[]	[]	1	6	13	[]	[]	https://twitter.com/SenatorBoxer/status/545342748103303168	False		0								[]				
544935842717134848	544935842717134848	2014-12-16 14:23:23 EST	2014-12-16	14:23:23	-0400	15442036	senatorboxer	Sen. Barbara Boxer		I’m heartbroken by this brutal attack on innocent children in Peshawar. These heinous acts of terror have no place in the civilized world.	en	[]	[]	[]	9	32	28	[]	[]	https://twitter.com/SenatorBoxer/status/544935842717134848	False		0								[]				
544933081053138945	544933081053138945	2014-12-16 14:12:25 EST	2014-12-16	14:12:25	-0400	15442036	senatorboxer	Sen. Barbara Boxer		It is past time for the FDA to finalize strong rules to ban sales to minors and prevent e-cigarette makers from marketing to our kids.	en	[]	[]	[]	9	15	13	[]	[]	https://twitter.com/SenatorBoxer/status/544933081053138945	False		0								[]				
544913962719272960	544913962719272960	2014-12-16 12:56:27 EST	2014-12-16	12:56:27	-0400	15442036	senatorboxer	Sen. Barbara Boxer		This alarming increase in teen use of e-cigarettes demands action.  http://t.co/UMfIZoZot1	en	[]	['http://www.usnews.com/news/articles/2014/12/16/teen-e-cigarette-use-steams-past-smoking-survey-finds']	[]	30	6	6	[]	[]	https://twitter.com/SenatorBoxer/status/544913962719272960	False		0								[]				
544518370939654144	544518370939654144	2014-12-15 10:44:30 EST	2014-12-15	10:44:30	-0400	15442036	senatorboxer	Sen. Barbara Boxer		This holiday season, give your family the gift of health. Visit  http://t.co/6hBVszI4vh TODAY to #getcovered by Jan 1.	en	[]	['http://CoveredCA.com']	[]	15	15	9	['getcovered']	[]	https://twitter.com/SenatorBoxer/status/544518370939654144	False		0								[]				
543884056849829888	543884056849829888	2014-12-13 16:43:58 EST	2014-12-13	16:43:58	-0400	15442036	senatorboxer	Sen. Barbara Boxer		Senators shouldn't scapegoat. Read my op-ed:  http://t.co/BcVhoymHUw	en	[]	['http://huff.to/1AuXIsW']	[]	9	19	9	[]	[]	https://twitter.com/SenatorBoxer/status/543884056849829888	False		0								[]				
