id	conversation_id	created_at	date	time	timezone	user_id	username	name	place	tweet	language	mentions	urls	photos	replies_count	retweets_count	likes_count	hashtags	cashtags	link	retweet	quote_url	video	thumbnail	near	geo	source	user_rt_id	user_rt	retweet_id	reply_to	retweet_date	translate	trans_src	trans_dest
1241012642237558785	1241012642237558785	2020-03-20 10:44:05 EDT	2020-03-20	10:44:05	-0400	1028854804087492613	reptimburchett	Rep. Tim Burchett		Important announcement for taxpayers. Tax Day this year is now July 15, not April 15. Please take note of this important change.	en	[]	[]	[]	1	6	26	[]	[]	https://twitter.com/RepTimBurchett/status/1241012642237558785	False	https://twitter.com/stevenmnuchin1/status/1241002750483324930	0								[]				
1240797396742950913	1240797396742950913	2020-03-19 20:28:46 EDT	2020-03-19	20:28:46	-0400	1028854804087492613	reptimburchett	Rep. Tim Burchett		I will be hosting a #COVID19 telephone town hall tomorrow at 3:35 PM. A representative from @TNDeptofHealth will be joining me to provide a #Coronavirus update, as well as answer questions about how to stay healthy and receive assistance. Sign up here:  https://t.co/ZLhDa07NNI	en	[{'screen_name': 'tndeptofhealth', 'name': 'tn dept. of health', 'id': '84678363'}]	['https://burchett.house.gov/live']	[]	4	2	13	['covid19', 'coronavirus']	[]	https://twitter.com/RepTimBurchett/status/1240797396742950913	False		0								[]				
1240665060973912064	1240665060973912064	2020-03-19 11:42:55 EDT	2020-03-19	11:42:55	-0400	1028854804087492613	reptimburchett	Rep. Tim Burchett		Younger Americans are at less risk of contracting #COVID19, but nobody is immune. Even if you do not have #Coronavirus symptoms and aren't at-risk, you still have an important role to play in preventing others from getting sick. Please practice social distancing! #FlattenTheCurve  https://t.co/F7UJFM4m9f	en	[]	[]	['https://pbs.twimg.com/media/ETe5_ZfWsAEJBNv.jpg', 'https://pbs.twimg.com/media/ETe5_ZgWoAcbgvt.jpg']	10	20	76	['covid19', 'coronavirus', 'flattenthecurve']	[]	https://twitter.com/RepTimBurchett/status/1240665060973912064	False		1	https://pbs.twimg.com/media/ETe5_ZfWsAEJBNv.jpg							[]				
1240648420798468103	1240648420798468103	2020-03-19 10:36:48 EDT	2020-03-19	10:36:48	-0400	1028854804087492613	reptimburchett	Rep. Tim Burchett		#COVID19 has impacted our daily lives but the public health and safety community is working around the clock to combat the Coronavirus pandemic. Thank you to all the folks out there who are keeping Americans healthy and safe!  https://t.co/FBIVOI298U	en	[]	[]	['https://pbs.twimg.com/media/ETerEV3XsAITM7T.png']	1	3	18	['covid19']	[]	https://twitter.com/RepTimBurchett/status/1240648420798468103	False		1	https://pbs.twimg.com/media/ETerEV3XsAITM7T.png							[]				
1240373947973218304	1240373947973218304	2020-03-18 16:26:08 EDT	2020-03-18	16:26:08	-0400	1028854804087492613	reptimburchett	Rep. Tim Burchett		Our local blood banks are experiencing a donation shortage. If you’re feeling well, consider stopping by one of the @MEDICblood locations in our community.  https://t.co/9Ofi7pn9tt	en	[{'screen_name': 'medicblood', 'name': 'medic blood center', 'id': '15146480'}]	[]	['https://pbs.twimg.com/media/ETaxhPrXgAU4kc9.jpg']	3	4	26	[]	[]	https://twitter.com/RepTimBurchett/status/1240373947973218304	False		1	https://pbs.twimg.com/media/ETaxhPrXgAU4kc9.jpg							[]				
1240334172251664387	1240334172251664387	2020-03-18 13:48:05 EDT	2020-03-18	13:48:05	-0400	1028854804087492613	reptimburchett	Rep. Tim Burchett		Remember to do your part in flattening the #COVID19 curve by following these tips to slow the spread. Practice social distancing, use good hygiene, and avoid unnecessary travel. It will make a positive impact in combating the Coronavirus!  https://t.co/cVG79fDcI4	en	[]	[]	['https://pbs.twimg.com/media/ETaNP3zWsAAC0B-.jpg', 'https://pbs.twimg.com/media/ETaNP3zWkAkOuNo.jpg']	2	10	18	['covid19']	[]	https://twitter.com/RepTimBurchett/status/1240334172251664387	False		1	https://pbs.twimg.com/media/ETaNP3zWsAAC0B-.jpg							[]				
1240306454126567424	1240306454126567424	2020-03-18 11:57:57 EDT	2020-03-18	11:57:57	-0400	1028854804087492613	reptimburchett	Rep. Tim Burchett		Encouraging to hear @stevenmnuchin1 say on @CNBC small business will be emphasized in the upcoming stimulus package. Small businesses and their employees need financial relief just as much as our corporations. @senatemajldr, please include small businesses in the stimulus bill.	en	[{'screen_name': 'stevenmnuchin1', 'name': 'steven mnuchin', 'id': '799764016885329921'}, {'screen_name': 'cnbc', 'name': 'cnbc', 'id': '20402945'}]	[]	[]	5	2	17	[]	[]	https://twitter.com/RepTimBurchett/status/1240306454126567424	False		0								[]				
1240267156660551680	1240266869489242112	2020-03-18 09:21:47 EDT	2020-03-18	09:21:47	-0400	1028854804087492613	reptimburchett	Rep. Tim Burchett		You can read my full letter to @GovBillLee here:  https://t.co/WZ1z2QGOSg	en	[{'screen_name': 'govbilllee', 'name': 'gov. bill lee', 'id': '1084924525232513025'}]	['https://burchett.house.gov/sites/burchett.house.gov/files/2020-03-17-SIGNED%20Letter%20to%20Gov.%20Lee-SBA%20Disaster%20Relief.pdf']	[]	0	0	7	[]	[]	https://twitter.com/RepTimBurchett/status/1240267156660551680	False		0								[]				
1240266869489242112	1240266869489242112	2020-03-18 09:20:39 EDT	2020-03-18	09:20:39	-0400	1028854804087492613	reptimburchett	Rep. Tim Burchett		Glad to see the @SBAgov make this announcement. Tennessee small businesses economically impacted by #COVID19 can benefit from disaster assistance loans. I've urged @GovBillLee to declare Tennessee a disaster area, which makes small businesses in Tennessee eligible for relief.	en	[{'screen_name': 'sbagov', 'name': 'sba', 'id': '153149305'}, {'screen_name': 'govbilllee', 'name': 'gov. bill lee', 'id': '1084924525232513025'}]	[]	[]	2	3	22	['covid19']	[]	https://twitter.com/RepTimBurchett/status/1240266869489242112	False	https://twitter.com/SBAgov/status/1239994794534940677	0								[]				
1239967642758156293	1239967642758156293	2020-03-17 13:31:38 EDT	2020-03-17	13:31:38	-0400	1028854804087492613	reptimburchett	Rep. Tim Burchett		Changes announced for the operating status of the Great Smoky Mountains National Park. Visitor Centers are closed until further notice.	en	[]	[]	[]	3	4	17	[]	[]	https://twitter.com/RepTimBurchett/status/1239967642758156293	False	https://twitter.com/987news/status/1239966435230625793	0								[]				
1239935853893496832	1239935853893496832	2020-03-17 11:25:19 EDT	2020-03-17	11:25:19	-0400	1028854804087492613	reptimburchett	Rep. Tim Burchett		My official website now includes a resource page for small businesses impacted by #COVID19. East Tennessee small business owners can check this page for updates, learn about what resources are available, and how to apply for financial assistance.  https://t.co/y698lH690Z	en	[]	['https://burchett.house.gov/covid-19-resources-businesses-and-employers']	[]	6	13	29	['covid19']	[]	https://twitter.com/RepTimBurchett/status/1239935853893496832	False		0								[]				
1239923460308111360	1239923460308111360	2020-03-17 10:36:04 EDT	2020-03-17	10:36:04	-0400	1028854804087492613	reptimburchett	Rep. Tim Burchett		Every American has a role to play in slowing down the #COVID19 pandemic, and changing your daily activities can have a positive impact on the current public health situation. Follow these guidelines to keep yourself and others healthy and safe.  https://t.co/RmkA3GgeJg	en	[]	[]	['https://pbs.twimg.com/media/ETUXtPtXsAUEDyp.jpg', 'https://pbs.twimg.com/media/ETUXtPpXsAIBCDp.jpg']	1	7	20	['covid19']	[]	https://twitter.com/RepTimBurchett/status/1239923460308111360	False		1	https://pbs.twimg.com/media/ETUXtPtXsAUEDyp.jpg							[]				
1239645827695628288	1239645827695628288	2020-03-16 16:12:51 EDT	2020-03-16	16:12:51	-0400	1028854804087492613	reptimburchett	Rep. Tim Burchett		The Small Business Administration is ready to assist small businesses impacted by #COVID19. Small businesses should visit the SBA's official website to learn more about the available resources. @SBAgov  https://t.co/4WL3TYZQrO	en	[{'screen_name': 'sbagov', 'name': 'sba', 'id': '153149305'}]	['https://www.sba.gov/page/guidance-businesses-employers-plan-respond-coronavirus-disease-2019-covid-19']	[]	1	6	15	['covid19']	[]	https://twitter.com/RepTimBurchett/status/1239645827695628288	False		0								[]				
1239624539019120640	1239624539019120640	2020-03-16 14:48:15 EDT	2020-03-16	14:48:15	-0400	1028854804087492613	reptimburchett	Rep. Tim Burchett		The following Mobile Office Hours have been cancelled:  - Rockford Mobile Office Hours: March 24, 10 AM to 2 PM at Rockford Town Hall, 3719 Little River Road, Rockford - Rutledge Mobile Office Hours: March 31,10 AM to 2 PM at the Rutledge Library, 8030 Rutledge Pike, Rutledge	en	[]	[]	[]	0	4	8	[]	[]	https://twitter.com/RepTimBurchett/status/1239624539019120640	False		0								[]				
1239618942710116352	1239618942710116352	2020-03-16 14:26:01 EDT	2020-03-16	14:26:01	-0400	1028854804087492613	reptimburchett	Rep. Tim Burchett		Stay up to date with #COVID19 developments using  @CDCgov's official website. Their homepage has tips for staying healthy, mitigating community spread, and what to do if you are sick. Please continue to follow their guidance.  https://t.co/TM3l8niPwt	en	[{'screen_name': 'cdcgov', 'name': 'cdc', 'id': '146569971'}]	['https://www.cdc.gov/coronavirus/2019-ncov/index.html?fbclid=IwAR245FlKDBPBOlNuwitDrPpQpsYwFvPF3HCYc0_z-rHxi32vUHJ63f57Z7Q']	[]	9	8	26	['covid19']	[]	https://twitter.com/RepTimBurchett/status/1239618942710116352	False		0								[]				
1238823813741260801	1238823813741260801	2020-03-14 09:46:28 EDT	2020-03-14	09:46:28	-0400	1028854804087492613	reptimburchett	Rep. Tim Burchett		My statement on the Families First Coronavirus Response Act ⬇️  https://t.co/xztt5okwhY	en	[]	[]	['https://pbs.twimg.com/media/ETEvsRgWsAEm136.jpg']	17	9	32	[]	[]	https://twitter.com/RepTimBurchett/status/1238823813741260801	False		1	https://pbs.twimg.com/media/ETEvsRgWsAEm136.jpg							[]				
1238637714918060043	1238637714918060043	2020-03-13 21:26:58 EDT	2020-03-13	21:26:58	-0400	1028854804087492613	reptimburchett	Rep. Tim Burchett		The Coronavirus relief bill Congress votes on cannot be used as a political tool to advance the majority's agenda. We still have not seen the full text, and I hope it is free of partisan poison pills. Congress needs to stay in Washington until this gets done and gets done right.  https://t.co/HykSNW0oW4	en	[]	[]	[]	13	19	98	[]	[]	https://twitter.com/RepTimBurchett/status/1238637714918060043	False		1	https://pbs.twimg.com/amplify_video_thumb/1238637196149690368/img/VbhJUVSdbgoVvVqz.jpg							[]				
1238617969854423040	1238617969854423040	2020-03-13 20:08:31 EDT	2020-03-13	20:08:31	-0400	1028854804087492613	reptimburchett	Rep. Tim Burchett		In the last 48 hours, @realDonaldTrump:   ✅announced billions in emergency relief ✅acted to protect against further spread from outside our borders ✅declared a nat’l emergency in the face of Democrats inaction Meanwhile, on House floor, this is the @SpeakerPelosi ‘s message...  https://t.co/zXZsaSOtV3	en	[{'screen_name': 'realdonaldtrump', 'name': 'donald j. trump', 'id': '25073877'}, {'screen_name': 'speakerpelosi', 'name': 'nancy pelosi', 'id': '15764644'}]	[]	['https://pbs.twimg.com/media/ETB0eglXQAE87iM.jpg']	18	16	52	[]	[]	https://twitter.com/RepTimBurchett/status/1238617969854423040	False		1	https://pbs.twimg.com/media/ETB0eglXQAE87iM.jpg							[]				
1238610741114163200	1238610741114163200	2020-03-13 19:39:47 EDT	2020-03-13	19:39:47	-0400	1028854804087492613	reptimburchett	Rep. Tim Burchett		Proud to join @repkevinhern urging @SpeakerPelosi to take this pandemic seriously and bring a relief bill that is clean and can actually pass the Senate and signed by @realDonaldTrump. We should stay here and work until we get the job done.	en	[{'screen_name': 'repkevinhern', 'name': 'kevin hern', 'id': '1067818539179024386'}, {'screen_name': 'speakerpelosi', 'name': 'nancy pelosi', 'id': '15764644'}, {'screen_name': 'realdonaldtrump', 'name': 'donald j. trump', 'id': '25073877'}]	[]	[]	12	8	38	[]	[]	https://twitter.com/RepTimBurchett/status/1238610741114163200	False	https://twitter.com/repkevinhern/status/1238566418599337991	0								[]				
1238580182958702593	1238580182958702593	2020-03-13 17:38:21 EDT	2020-03-13	17:38:21	-0400	1028854804087492613	reptimburchett	Rep. Tim Burchett		My statement on @realDonaldTrump's national disaster declaration and additional response to the Coronavirus. I am glad the administration is expanding public-private partnerships, as well as breaking down bureaucratic barriers, to help improve and expedite testing.  https://t.co/DMSMpuJkvt	en	[{'screen_name': 'realdonaldtrump', 'name': 'donald j. trump', 'id': '25073877'}]	[]	['https://pbs.twimg.com/media/ETBQ6vQXkAA5BzK.png']	5	4	33	[]	[]	https://twitter.com/RepTimBurchett/status/1238580182958702593	False		1	https://pbs.twimg.com/media/ETBQ6vQXkAA5BzK.png							[]				
1238516487373152257	1238516487373152257	2020-03-13 13:25:15 EDT	2020-03-13	13:25:15	-0400	1028854804087492613	reptimburchett	Rep. Tim Burchett		Coronavirus has impacted public tours and popular attractions in Washington DC. If you are visiting our nation's capital soon or planning a future visit, please use this resource page to stay up to date with the operating status of tours and attractions.  https://t.co/SRC3mU1ron	en	[]	['https://burchett.house.gov/washington-dc-tours-public-buildings-operating-status?fbclid=IwAR1RXZnOE5TAKyZtbA5se-7JDZYRs3c_z6ugnsYKeNvM1lOQkkSbLQzsQpU']	[]	0	1	8	[]	[]	https://twitter.com/RepTimBurchett/status/1238516487373152257	False		0								[]				
1238241266997002240	1238241266997002240	2020-03-12 19:11:38 EDT	2020-03-12	19:11:38	-0400	1028854804087492613	reptimburchett	Rep. Tim Burchett		I've heard the concerns from constituents about the recent outbreak of Coronavirus in Tennessee. It is important during this time to look out for the health and safety of our communities, families, and friends. Please stay safe and remember we are all in this together.  https://t.co/RZFKzj1An2	en	[]	[]	[]	13	8	74	[]	[]	https://twitter.com/RepTimBurchett/status/1238241266997002240	False		1	https://pbs.twimg.com/amplify_video_thumb/1238237450553753600/img/Zmxlz6KYB-voflsd.jpg							[]				
1238157996343078912	1238157996343078912	2020-03-12 13:40:44 EDT	2020-03-12	13:40:44	-0400	1028854804087492613	reptimburchett	Rep. Tim Burchett		@SpeakerPelosi and @HouseDemocrats using Coronavirus to permanently expand welfare and grow the size of the federal government is a new low. The American people deserve a much better bill that actually addresses the economic impact of COVID-19 on workers and businesses.	en	[{'screen_name': 'housedemocrats', 'name': 'house democrats', 'id': '43963249'}]	[]	[]	2	0	1	[]	[]	https://twitter.com/RepTimBurchett/status/1238157996343078912	False		0								[]				
1238149142473474048	1238149142473474048	2020-03-12 13:05:33 EDT	2020-03-12	13:05:33	-0400	1028854804087492613	reptimburchett	Rep. Tim Burchett		If you scheduled a US Capitol tour through my office during March, unfortunately it is cancelled. All Capitol tours have been stopped through at least the end of the month. My staff is reaching out to folks to let them know, as well.	en	[]	[]	[]	2	5	19	[]	[]	https://twitter.com/RepTimBurchett/status/1238149142473474048	False		0								[]				
1237865775047659525	1237865775047659525	2020-03-11 18:19:33 EDT	2020-03-11	18:19:33	-0400	1028854804087492613	reptimburchett	Rep. Tim Burchett		My statement on the USA FREEDOM Reauthorization Act ⬇️⬇️⬇️  https://t.co/6ZtTi7XApH	en	[]	[]	['https://pbs.twimg.com/media/ES3IXB8UYAEfDLj.jpg']	1	4	11	[]	[]	https://twitter.com/RepTimBurchett/status/1237865775047659525	False		1	https://pbs.twimg.com/media/ES3IXB8UYAEfDLj.jpg							[]				
1237824862632251392	1237818970918596608	2020-03-11 15:36:59 EDT	2020-03-11	15:36:59	-0400	1028854804087492613	reptimburchett	Rep. Tim Burchett		You can learn more about the Microloan Transparency and Accountability Act bill here:  https://t.co/wGUHJGtUsu	en	[]	['https://burchett.house.gov/media/press-releases/reps-burchett-kim-introduce-bill-aimed-boosting-use-small-business-microloans']	[]	0	0	2	[]	[]	https://twitter.com/RepTimBurchett/status/1237824862632251392	False		0								[]				
1237818970918596608	1237818970918596608	2020-03-11 15:13:34 EDT	2020-03-11	15:13:34	-0400	1028854804087492613	reptimburchett	Rep. Tim Burchett		The Microloan Transparency and Accountability Act advanced out of the Small Business Committee today and is headed to the House floor! Small businesses deserve equal access to microloans, regardless of their proximity to urban areas. Proud to author this bill with @RepAndyKimNJ.  https://t.co/MFDqFVBriX	en	[{'screen_name': 'repandykimnj', 'name': 'repandykim', 'id': '1078771848882593793'}]	[]	[]	1	3	11	[]	[]	https://twitter.com/RepTimBurchett/status/1237818970918596608	False		1	https://pbs.twimg.com/amplify_video_thumb/1237818854094639106/img/8VWL-w1fSQGOhTd3.jpg							[]				
1237785341211422721	1237785341211422721	2020-03-11 12:59:56 EDT	2020-03-11	12:59:56	-0400	1028854804087492613	reptimburchett	Rep. Tim Burchett		Continuing resolutions are an ineffective way to govern and Congress needs to get back to setting long-term budgets. I wasn't surprised to hear Defense Deputy Secretary Norquist say continuing resolutions create uncertainty at the DOD during yesterday's @housebudgetGOP hearing.  https://t.co/UZiUjlHi91	en	[{'screen_name': 'housebudgetgop', 'name': 'house budget gop', 'id': '778700700696010754'}]	[]	[]	1	4	15	[]	[]	https://twitter.com/RepTimBurchett/status/1237785341211422721	False		1	https://pbs.twimg.com/amplify_video_thumb/1237776988632502275/img/yOVpKeTWvhmiygVP.jpg							[]				
1237494389116678144	1237494389116678144	2020-03-10 17:43:48 EDT	2020-03-10	17:43:48	-0400	1028854804087492613	reptimburchett	Rep. Tim Burchett		Carbon is food for trees, anyone in our scientific community will tell you that, and more trees means less carbon in our atmosphere. Proud to join @RepWesterman, @GOPLeader, and several of my colleagues in front of the Capitol to unveil the Trillion Trees Act!  https://t.co/RQ2LTx32kq	en	[{'screen_name': 'repwesterman', 'name': 'rep. bruce westerman', 'id': '2852998461'}, {'screen_name': 'gopleader', 'name': 'kevin mccarthy', 'id': '19739126'}]	[]	['https://pbs.twimg.com/media/ESx1bbqXkAY_J9J.jpg', 'https://pbs.twimg.com/media/ESx1he6WsAEW3IG.jpg', 'https://pbs.twimg.com/media/ESx1hfiXsAEsYM5.jpg']	4	10	44	[]	[]	https://twitter.com/RepTimBurchett/status/1237494389116678144	False		1	https://pbs.twimg.com/media/ESx1bbqXkAY_J9J.jpg							[]				
1237371117897203713	1237371117897203713	2020-03-10 09:33:58 EDT	2020-03-10	09:33:58	-0400	1028854804087492613	reptimburchett	Rep. Tim Burchett		Avoid contracting or spreading COVID-19 by following these hygiene rules from the CDC. Paying close attention to your personal health and hygiene helps keep yourself and others safe!  https://t.co/X92we7ORVY	en	[]	[]	['https://pbs.twimg.com/media/ESwGIDWWsAAfjPv.jpg']	8	8	22	[]	[]	https://twitter.com/RepTimBurchett/status/1237371117897203713	False		1	https://pbs.twimg.com/media/ESwGIDWWsAAfjPv.jpg							[]				
1237036818157232129	1237036818157232129	2020-03-09 11:25:35 EDT	2020-03-09	11:25:35	-0400	1028854804087492613	reptimburchett	Rep. Tim Burchett		It was my honor to recognize Marilyn Childress as the Tennessee Second District's Veteran of the Month for February 2020. Congratulations and thank you for your service, Marilyn!  https://t.co/9GBPx9TxwM	en	[]	[]	[]	3	5	26	[]	[]	https://twitter.com/RepTimBurchett/status/1237036818157232129	False		1	https://pbs.twimg.com/amplify_video_thumb/1237035291698958336/img/VG_UERmCkBjtlvoD.jpg							[]				
1236293579015966720	1236293579015966720	2020-03-07 09:12:13 EST	2020-03-07	09:12:13	-0400	1028854804087492613	reptimburchett	Rep. Tim Burchett		Stopped by the monthly free veterans breakfast at Knoxville Elks Lodge #160 to surprise Marilyn Childress with a copy of the congressional record recognizing her as the Tennessee Second District February Veteran of the Month.  https://t.co/fK5eoVrfEA	en	[]	[]	['https://pbs.twimg.com/media/ESgyczKXkAAmOLb.jpg', 'https://pbs.twimg.com/media/ESgyczKXQAglFsL.jpg']	2	6	32	[]	[]	https://twitter.com/RepTimBurchett/status/1236293579015966720	False		1	https://pbs.twimg.com/media/ESgyczKXkAAmOLb.jpg							[]				
1236019193193156608	1236019193193156608	2020-03-06 15:01:54 EST	2020-03-06	15:01:54	-0400	1028854804087492613	reptimburchett	Rep. Tim Burchett		ICYMI: Earlier this week, I remembered the life of Sami Natour on the House floor. Sami's life story is a reminder that anyone willing to work hard and follow their dreams can be successful in our great nation. He will be missed in the Knoxville community.  https://t.co/JubX6pwiKx	en	[]	[]	[]	1	13	60	[]	[]	https://twitter.com/RepTimBurchett/status/1236019193193156608	False		1	https://pbs.twimg.com/ext_tw_video_thumb/1236019131524186113/pu/img/mVLXd5GQZAJy5SCH.jpg							[]				
1235925875130085376	1235925875130085376	2020-03-06 08:51:05 EST	2020-03-06	08:51:05	-0400	1028854804087492613	reptimburchett	Rep. Tim Burchett		Always a fun time flipping pancakes at the annual O’Connor Senior Center Pancake Fest.  https://t.co/G22War5Y0l	en	[]	[]	[]	1	2	86	[]	[]	https://twitter.com/RepTimBurchett/status/1235925875130085376	False		1	https://pbs.twimg.com/ext_tw_video_thumb/1235925855660060673/pu/img/k0YCKWGR38-vpLHv.jpg							[]				
1235695895334682624	1235695894017736706	2020-03-05 17:37:14 EST	2020-03-05	17:37:14	-0400	1028854804087492613	reptimburchett	Rep. Tim Burchett		Additional Coronavirus resources are available on my official website:  https://t.co/Ri0qTNVzOp	en	[]	['https://burchett.house.gov/covid-19-resources?fbclid=IwAR3h6Va1rwOgSvp4C7gqF-41edLqnfehI1h0YbObwwfFiUKSv812jjOHobY']	[]	0	0	5	[]	[]	https://twitter.com/RepTimBurchett/status/1235695895334682624	False		0								[]				
1235695894017736706	1235695894017736706	2020-03-05 17:37:13 EST	2020-03-05	17:37:13	-0400	1028854804087492613	reptimburchett	Rep. Tim Burchett		Tennessee’s state and local health departments are well prepared to handle Coronavirus cases. It's important to follow guidance from health authorities to keep yourself and others safe during this time. Please take the appropriate steps if you think you have contracted the virus.	en	[]	[]	[]	5	4	29	[]	[]	https://twitter.com/RepTimBurchett/status/1235695894017736706	False		0								[]				
1235688045862674432	1235688045862674432	2020-03-05 17:06:02 EST	2020-03-05	17:06:02	-0400	1028854804087492613	reptimburchett	Rep. Tim Burchett		Continuing to pray for our neighbors in Middle Tennessee struck by this week's deadly tornadoes. Proud to join my fellow colleagues from the Tennessee congressional delegation in urging @realDonaldTrump to approve @GovBillLee's major disaster declaration request.	en	[{'screen_name': 'realdonaldtrump', 'name': 'donald j. trump', 'id': '25073877'}, {'screen_name': 'govbilllee', 'name': 'gov. bill lee', 'id': '1084924525232513025'}]	[]	[]	0	13	68	[]	[]	https://twitter.com/RepTimBurchett/status/1235688045862674432	False	https://twitter.com/SenAlexander/status/1235685228506738688	0								[]				
1235327657321123842	1235327657321123842	2020-03-04 17:13:59 EST	2020-03-04	17:13:59	-0400	1028854804087492613	reptimburchett	Rep. Tim Burchett		Glad House Leadership did the right thing and put forward a Coronavirus response package free of partisan poison pills. Policy riders don’t have any business in a bill our country needs to protect public health. I voted yes.  https://t.co/OgLrYZru89	en	[]	[]	['https://pbs.twimg.com/media/ESTD1-YWsAk5aiT.jpg']	6	5	34	[]	[]	https://twitter.com/RepTimBurchett/status/1235327657321123842	False		1	https://pbs.twimg.com/media/ESTD1-YWsAk5aiT.jpg							[]				
1235319851855622147	1235319851855622147	2020-03-04 16:42:58 EST	2020-03-04	16:42:58	-0400	1028854804087492613	reptimburchett	Rep. Tim Burchett		Being located away from an urban center shouldn't prevent any small business from receiving an @SBAgov microloan. Proud to introduce the Microloan Transparency and Accountability Act with @RepAndyKimNJ to increase microloans to rural small businesses.  https://t.co/wGUHJGtUsu	en	[{'screen_name': 'sbagov', 'name': 'sba', 'id': '153149305'}, {'screen_name': 'repandykimnj', 'name': 'repandykim', 'id': '1078771848882593793'}]	['https://burchett.house.gov/media/press-releases/reps-burchett-kim-introduce-bill-aimed-boosting-use-small-business-microloans']	[]	1	4	14	[]	[]	https://twitter.com/RepTimBurchett/status/1235319851855622147	False		0								[]				
1234919607951032322	1234919607951032322	2020-03-03 14:12:32 EST	2020-03-03	14:12:32	-0400	1028854804087492613	reptimburchett	Rep. Tim Burchett		The United States has a strong Middle East ally in Israel. Maintaining the US-Israel relationship is important for so many reasons, and I am proud to support our Israeli friends.   Thanks for stopping by @AIPAC!  https://t.co/KXdbpSGcRO	en	[{'screen_name': 'aipac', 'name': 'aipac', 'id': '15987296'}]	[]	['https://pbs.twimg.com/media/ESNQvRHWsAYsKVn.jpg']	0	7	11	[]	[]	https://twitter.com/RepTimBurchett/status/1234919607951032322	False		1	https://pbs.twimg.com/media/ESNQvRHWsAYsKVn.jpg							[]				
1234901267949989888	1234900393617960963	2020-03-03 12:59:40 EST	2020-03-03	12:59:40	-0400	1028854804087492613	reptimburchett	Rep. Tim Burchett		Listen here:  https://t.co/WV1ANEALTC	en	[]	['https://youtu.be/8Esw3BAbJ54']	[]	1	0	1	[]	[]	https://twitter.com/RepTimBurchett/status/1234901267949989888	False		0								[]				
