id	conversation_id	created_at	date	time	timezone	user_id	username	name	place	tweet	language	mentions	urls	photos	replies_count	retweets_count	likes_count	hashtags	cashtags	link	retweet	quote_url	video	thumbnail	near	geo	source	user_rt_id	user_rt	retweet_id	reply_to	retweet_date	translate	trans_src	trans_dest
1398702993562902533	1398702993562902533	2021-05-29 14:09:14 EDT	2021-05-29	14:09:14	-0400	1028854804087492613	reptimburchett	Rep. Tim Burchett		My next stop this weekend was at RIO Revolution Church for Blount County’s annual Memorial Day program. Thank you Blount County veterans for your service!  https://t.co/yfsgZqo7y4	en	[]	[]	['https://pbs.twimg.com/media/E2kw9S5WUAMEoLF.jpg', 'https://pbs.twimg.com/media/E2kw9S6XEAYdJ5v.jpg']	3	5	26	[]	[]	https://twitter.com/RepTimBurchett/status/1398702993562902533	False		1	https://pbs.twimg.com/media/E2kw9S5WUAMEoLF.jpg							[]				
1398682878112841728	1398682878112841728	2021-05-29 12:49:19 EDT	2021-05-29	12:49:19	-0400	1028854804087492613	reptimburchett	Rep. Tim Burchett		I started this Memorial Day weekend by speaking at the East Tennessee State Veterans Cemetery flag placement ceremony. Many local veterans, including my momma and daddy, are laid to rest here.  https://t.co/Z7Qov0KpLs	en	[]	[]	['https://pbs.twimg.com/media/E2kenp5WEAU9WRi.jpg', 'https://pbs.twimg.com/media/E2kenqBXoAQzKdp.jpg', 'https://pbs.twimg.com/media/E2kenqMX0AEuLhQ.jpg', 'https://pbs.twimg.com/media/E2kenqlXwAk4wyl.jpg']	3	7	32	[]	[]	https://twitter.com/RepTimBurchett/status/1398682878112841728	False		1	https://pbs.twimg.com/media/E2kenp5WEAU9WRi.jpg							[]				
1398385859364261895	1398385859364261895	2021-05-28 17:09:04 EDT	2021-05-28	17:09:04	-0400	1028854804087492613	reptimburchett	Rep. Tim Burchett		I was in Lenoir City today checking out @CompanyFoley’s operation in the area. With multiple locations across the southeast, Foley Products Company is helping meet our region’s concrete needs while providing quality jobs in manufacturing.  https://t.co/FO96TsXPe8	en	[{'screen_name': 'companyfoley', 'name': 'foley products company', 'id': '1359642918580084740'}]	[]	['https://pbs.twimg.com/media/E2gQg0cXIAALkcp.jpg', 'https://pbs.twimg.com/media/E2gQg0kXEAYzG1y.jpg', 'https://pbs.twimg.com/media/E2gQg0vXwAcliGR.jpg', 'https://pbs.twimg.com/media/E2gQg1DXoAQ9bb0.jpg']	3	3	12	[]	[]	https://twitter.com/RepTimBurchett/status/1398385859364261895	False		1	https://pbs.twimg.com/media/E2gQg0cXIAALkcp.jpg							[]				
1397989697440333840	1397989697440333840	2021-05-27 14:54:51 EDT	2021-05-27	14:54:51	-0400	1028854804087492613	reptimburchett	Rep. Tim Burchett		During the National Association of Insurance and Financial Advisors, Knoxville chapter monthly meeting this morning, I discussed my economic opportunity agenda, the situation in Israel, and my efforts to return the House to regular official business operations.  https://t.co/qAaltQOJzu	en	[]	[]	['https://pbs.twimg.com/media/E2aoOIlXEAI9OZw.jpg']	4	1	11	[]	[]	https://twitter.com/RepTimBurchett/status/1397989697440333840	False		1	https://pbs.twimg.com/media/E2aoOIlXEAI9OZw.jpg							[]				
1397582016745517059	1397582016745517059	2021-05-26 11:54:53 EDT	2021-05-26	11:54:53	-0400	1028854804087492613	reptimburchett	Rep. Tim Burchett		My local team will staff Mobile Office Hours in Bean Station, Cumberland Gap, Jellico and Dandridge next month. These meetings are helpful for East Tennesseans who need help with a federal agency or want to share opinions. You do not need an appointment.  https://t.co/7HE5rGK5Pa	en	[]	['https://burchett.house.gov/media/press-releases/rep-burchett-announces-mobile-office-hours-june-2021']	[]	5	5	11	[]	[]	https://twitter.com/RepTimBurchett/status/1397582016745517059	False		0								[]				
1396853886854512641	1396853886854512641	2021-05-24 11:41:33 EDT	2021-05-24	11:41:33	-0400	1028854804087492613	reptimburchett	Rep. Tim Burchett		This morning, I spoke at the ribbon cutting ceremony for FirstBank’s new location on Kingston Pike.  https://t.co/vRDiG2xE0u	en	[]	[]	['https://pbs.twimg.com/media/E2KfNK7WYAIKO3Q.jpg']	5	2	16	[]	[]	https://twitter.com/RepTimBurchett/status/1396853886854512641	False		1	https://pbs.twimg.com/media/E2KfNK7WYAIKO3Q.jpg							[]				
1395868199204397059	1395868199204397059	2021-05-21 18:24:47 EDT	2021-05-21	18:24:47	-0400	1028854804087492613	reptimburchett	Rep. Tim Burchett		While in Claiborne County, I also got the opportunity to visit Giles Industries, a @claytonhomes production facility. We learned about the company’s affordable housing products and got a firsthand look at the manufacturing process.  https://t.co/K9qdra93e4	en	[{'screen_name': 'claytonhomes', 'name': 'clayton', 'id': '479055631'}]	[]	['https://pbs.twimg.com/media/E18euCAXsAAHgd7.jpg', 'https://pbs.twimg.com/media/E18euB-WEAM0hzB.jpg', 'https://pbs.twimg.com/media/E18euB-XsAEyQKv.jpg', 'https://pbs.twimg.com/media/E18euB_X0AMw2Op.jpg']	3	3	10	[]	[]	https://twitter.com/RepTimBurchett/status/1395868199204397059	False		1	https://pbs.twimg.com/media/E18euCAXsAAHgd7.jpg							[]				
1395818218602831873	1395818218602831873	2021-05-21 15:06:11 EDT	2021-05-21	15:06:11	-0400	1028854804087492613	reptimburchett	Rep. Tim Burchett		I joined @SchmittNYC to discuss the Biden Administration flying illegal immigrants to Tennessee in the dead of night. They're putting these kids at risk, and @VP Harris needs to stop avoiding responsibility and start addressing our southern border crisis.  https://t.co/T9EfkQSbdx	en	[{'screen_name': 'schmittnyc', 'name': 'rob schmitt', 'id': '22869693'}, {'screen_name': 'vp', 'name': 'vice president kamala harris', 'id': '803694179079458816'}]	['https://www.youtube.com/watch?v=KvQxXsSwlWs']	[]	26	10	50	[]	[]	https://twitter.com/RepTimBurchett/status/1395818218602831873	False		0								[]				
1395762776509923328	1395762776509923328	2021-05-21 11:25:52 EDT	2021-05-21	11:25:52	-0400	1028854804087492613	reptimburchett	Rep. Tim Burchett		I’m in Claiborne County today meeting with constituents and touring local manufacturing plants. Spent some time at Homesteader Trailer, the world’s largest single site manufacturing plant for enclosed cargo trailers.  https://t.co/EX8GqjWdSI	en	[]	[]	['https://pbs.twimg.com/media/E16-2DmXMAQ0f_e.jpg', 'https://pbs.twimg.com/media/E16-2DlWYAM77SF.jpg', 'https://pbs.twimg.com/media/E16-2DmXsAE87TW.jpg']	8	3	25	[]	[]	https://twitter.com/RepTimBurchett/status/1395762776509923328	False		1	https://pbs.twimg.com/media/E16-2DmXMAQ0f_e.jpg							[]				
1395492518796607495	1395492518796607495	2021-05-20 17:31:58 EDT	2021-05-20	17:31:58	-0400	1028854804087492613	reptimburchett	Rep. Tim Burchett		On @FoxBusiness with @cvpayne this afternoon, I discussed Speaker Pelosi's refusal to lift COVID-19 rules, the hypocrisy of House Democrats' Capitol security funding bill, and the ongoing attacks against Israel.  https://t.co/Avibl9MXS4	en	[{'screen_name': 'foxbusiness', 'name': 'fox business', 'id': '56413858'}, {'screen_name': 'cvpayne', 'name': 'charles v payne', 'id': '19400611'}]	['https://www.youtube.com/watch?v=EX3c6TlnsMI']	[]	18	22	102	[]	[]	https://twitter.com/RepTimBurchett/status/1395492518796607495	False		0								[]				
1395142848358584323	1395142848358584323	2021-05-19 18:22:30 EDT	2021-05-19	18:22:30	-0400	1028854804087492613	reptimburchett	Rep. Tim Burchett		It was an honor to recognize Corporal Rollen Delano Bradshaw on the House floor as Tennessee's Second Congressional District Veteran of the Month. He is an American hero who bravely served his country during the Korean War.  https://t.co/q6vYQFe7tA	en	[]	[]	[]	9	4	19	[]	[]	https://twitter.com/RepTimBurchett/status/1395142848358584323	False		1	https://pbs.twimg.com/ext_tw_video_thumb/1395142781035757568/pu/img/DK5e8-orF2tCOhLj.jpg							[]				
1395129076105494530	1395129076105494530	2021-05-19 17:27:46 EDT	2021-05-19	17:27:46	-0400	1028854804087492613	reptimburchett	Rep. Tim Burchett		Today on the House floor, I wished Julia Tucker a very happy 90th birthday. I’ve known Julia since I was a kid. She’s an amazing woman who serves her community every chance she gets, including through her AIDS advocacy and fundraising efforts.  https://t.co/uvTYUYPUCZ	en	[]	[]	[]	4	2	15	[]	[]	https://twitter.com/RepTimBurchett/status/1395129076105494530	False		1	https://pbs.twimg.com/ext_tw_video_thumb/1395127991903178753/pu/img/7r9bXVthhMIyCaXj.jpg							[]				
1394686846085570568	1394686846085570568	2021-05-18 12:10:30 EDT	2021-05-18	12:10:30	-0400	1028854804087492613	reptimburchett	Rep. Tim Burchett		Hamas and PIJ use Palestinians as human shields for the sake of vilifying Israel. The members of Congress and media blaming Israel alone for the recent violence are being nothing more than useful idiots and publicity tools for two terrorist organizations.  https://t.co/NMlNL6J1go	en	[]	['https://www.youtube.com/watch?v=O1y7J8_0cuw']	[]	22	30	87	[]	[]	https://twitter.com/RepTimBurchett/status/1394686846085570568	False		0								[]				
1394354157411311617	1394354157411311617	2021-05-17 14:08:31 EDT	2021-05-17	14:08:31	-0400	1028854804087492613	reptimburchett	Rep. Tim Burchett		50% of all polysilicon used in solar panels is produced in the Xinjiang Province by Uyghurs enslaved in #ChineseCommunistParty internment camps.  https://t.co/GTS3WwA8uc	en	[]	[]	['https://pbs.twimg.com/media/E1m9t3cXsAMD28I.jpg']	13	8	27	['chinesecommunistparty']	[]	https://twitter.com/RepTimBurchett/status/1394354157411311617	False		1	https://pbs.twimg.com/media/E1m9t3cXsAMD28I.jpg							[]				
1393274568312246272	1393274568312246272	2021-05-14 14:38:37 EDT	2021-05-14	14:38:37	-0400	1028854804087492613	reptimburchett	Rep. Tim Burchett		This week, I led a bipartisan letter with @repsusanwild calling for funds from the American Rescue Plan to be invested in the United States' public health research and development. Innovation is key to ending COVID-19 and can help prevent future pandemics.  https://t.co/Xq8uWsCfdU	en	[{'screen_name': 'repsusanwild', 'name': 'rep. susan wild', 'id': '1069636653353000962'}]	['https://burchett.house.gov/media/press-releases/reps-burchett-wild-urge-biden-administration-fund-public-health-innovations']	[]	6	4	13	[]	[]	https://twitter.com/RepTimBurchett/status/1393274568312246272	False		0								[]				
1393253978788569091	1393253978788569091	2021-05-14 13:16:48 EDT	2021-05-14	13:16:48	-0400	1028854804087492613	reptimburchett	Rep. Tim Burchett		I’m joining @JohnFBachman live on @newsmax! Tune in now!  https://t.co/ou7hM0hHSB	en	[{'screen_name': 'johnfbachman', 'name': 'john bachman', 'id': '425134612'}, {'screen_name': 'newsmax', 'name': 'newsmax', 'id': '20545835'}]	['https://www.newsmaxtv.com']	[]	11	3	6	[]	[]	https://twitter.com/RepTimBurchett/status/1393253978788569091	False		0								[]				
1393253447533834246	1393253447533834246	2021-05-14 13:14:41 EDT	2021-05-14	13:14:41	-0400	1028854804087492613	reptimburchett	Rep. Tim Burchett		My dear friend Steve Rose passed away in December. He was a loving husband and father who served our country in the Marine Corps. He will be missed by all who knew him, and earlier this week I honored Steve's memory on the House floor.  https://t.co/vRFNpQhPHr	en	[]	[]	[]	0	2	26	[]	[]	https://twitter.com/RepTimBurchett/status/1393253447533834246	False		1	https://pbs.twimg.com/ext_tw_video_thumb/1393252269056008196/pu/img/vZ9ntXxs1JuqoXEo.jpg							[]				
1392953510552031234	1392953509654450182	2021-05-13 17:22:51 EDT	2021-05-13	17:22:51	-0400	1028854804087492613	reptimburchett	Rep. Tim Burchett		Read my full letter to the Speaker of the House below.  https://t.co/vP8llet3cY	en	[]	[]	['https://pbs.twimg.com/media/E1TDvoEWYAAqyTw.jpg']	5	3	18	[]	[]	https://twitter.com/RepTimBurchett/status/1392953510552031234	False		1	https://pbs.twimg.com/media/E1TDvoEWYAAqyTw.jpg							[]				
1392953509654450182	1392953509654450182	2021-05-13 17:22:51 EDT	2021-05-13	17:22:51	-0400	1028854804087492613	reptimburchett	Rep. Tim Burchett		In light of new CDC guidance, I'm calling for an end to @SpeakerPelosi's unnecessarily strict COVID-19 precautionary measures in the House of Representatives. It's time for the House to resume normal operations and get back to work for the American people.  https://t.co/zArCe0gX0d	en	[{'screen_name': 'speakerpelosi', 'name': 'nancy pelosi', 'id': '15764644'}]	['https://burchett.house.gov/media/press-releases/burchett-speaker-pelosi-remove-all-house-covid-19-restrictions']	[]	8	7	39	[]	[]	https://twitter.com/RepTimBurchett/status/1392953509654450182	False		0								[]				
1392593154918989826	1392593154918989826	2021-05-12 17:30:55 EDT	2021-05-12	17:30:55	-0400	1028854804087492613	reptimburchett	Rep. Tim Burchett		I will be live on the @HowieCarrShow in a few minutes, listen live below!  https://t.co/Zt9EjWvv32	en	[{'screen_name': 'howiecarrshow', 'name': 'howie carr', 'id': '1326005070'}]	['https://howiecarrshow.com/listen/']	[]	4	1	3	[]	[]	https://twitter.com/RepTimBurchett/status/1392593154918989826	False		0								[]				
1392588738337902592	1392588738337902592	2021-05-12 17:13:22 EDT	2021-05-12	17:13:22	-0400	1028854804087492613	reptimburchett	Rep. Tim Burchett		The #ChineseCommunistParty already doesn’t honor climate agreements and they aren’t about to start. During today’s @HouseForeignGOP hearing, I cautioned Climate Czar Kerry against trusting the CCP like he did the Iranians with the 2015 nuclear deal.  https://t.co/h1sFc2IZmE	en	[{'screen_name': 'houseforeigngop', 'name': 'house foreign affairs gop', 'id': '75367781'}]	[]	[]	9	11	25	['chinesecommunistparty']	[]	https://twitter.com/RepTimBurchett/status/1392588738337902592	False		1	https://pbs.twimg.com/ext_tw_video_thumb/1392588667936514048/pu/img/vuSeebI1Wwt78eLx.jpg							[]				
1392569275299373056	1392569275299373056	2021-05-12 15:56:02 EDT	2021-05-12	15:56:02	-0400	1028854804087492613	reptimburchett	Rep. Tim Burchett		The State Department already has several offices focused on the environment. So why does the Office of the Special Presidential Envoy for Climate even exist? The current head of the office admits it’s a “fair question.”  https://t.co/qijsyp0xRU	en	[]	[]	[]	13	8	22	[]	[]	https://twitter.com/RepTimBurchett/status/1392569275299373056	False		1	https://pbs.twimg.com/ext_tw_video_thumb/1392569178519973889/pu/img/uHNzcHXy6msvrQUV.jpg							[]				
1392500155455246340	1392500155455246340	2021-05-12 11:21:23 EDT	2021-05-12	11:21:23	-0400	1028854804087492613	reptimburchett	Rep. Tim Burchett		Hamas is launching missiles into Israel hoping to hit locations populated with children and the elderly. This aggression towards our ally Israel is evil and needs to stop. I discussed with @FinnertyUSA on @newsmax this morning.  https://t.co/JHGc3JdVJw	en	[{'screen_name': 'finnertyusa', 'name': 'rob finnerty', 'id': '195773944'}, {'screen_name': 'newsmax', 'name': 'newsmax', 'id': '20545835'}]	[]	[]	11	5	20	[]	[]	https://twitter.com/RepTimBurchett/status/1392500155455246340	False		1	https://pbs.twimg.com/ext_tw_video_thumb/1392499981647556609/pu/img/_LGgaS-Si17ozRsa.jpg							[]				
1392455543986524167	1392455543986524167	2021-05-12 08:24:06 EDT	2021-05-12	08:24:06	-0400	1028854804087492613	reptimburchett	Rep. Tim Burchett		I will be on @newsmax in a few minutes, watch live below!  https://t.co/ou7hM0hHSB	en	[{'screen_name': 'newsmax', 'name': 'newsmax', 'id': '20545835'}]	['https://www.newsmaxtv.com']	[]	3	2	6	[]	[]	https://twitter.com/RepTimBurchett/status/1392455543986524167	False		0								[]				
1392263383785816065	1392263383785816065	2021-05-11 19:40:32 EDT	2021-05-11	19:40:32	-0400	1028854804087492613	reptimburchett	Rep. Tim Burchett		We need to get to the bottom of John Kerry's dealings with the untrustworthy #ChineseCommunistParty.	en	[]	[]	[]	32	9	73	['chinesecommunistparty']	[]	https://twitter.com/RepTimBurchett/status/1392263383785816065	False	https://twitter.com/nypost/status/1392243385835085827	0								[]				
1392244486625976326	1392244486625976326	2021-05-11 18:25:26 EDT	2021-05-11	18:25:26	-0400	1028854804087492613	reptimburchett	Rep. Tim Burchett		There is a record number of job openings right now. Paying folks more to stay at home than to go to work is increasing consumer prices and hurting the entire economy. We have to get people back to work and that’s what @GovBillLee's decision to opt out of this program will do.	en	[{'screen_name': 'govbilllee', 'name': 'gov. bill lee', 'id': '1084924525232513025'}]	[]	[]	30	20	237	[]	[]	https://twitter.com/RepTimBurchett/status/1392244486625976326	False	https://twitter.com/GovBillLee/status/1392201843099504646	0								[]				
1392240855436644353	1392240855436644353	2021-05-11 18:11:01 EDT	2021-05-11	18:11:01	-0400	1028854804087492613	reptimburchett	Rep. Tim Burchett		Businesses need more employees, but the federal government is cutting big unemployment checks that incentivize people to stay home. I'm proud to cosponsor the Get Americans Back to Work Act, which will encourage folks to re-enter the workforce and get our economy back on track.	en	[]	[]	[]	19	13	40	[]	[]	https://twitter.com/RepTimBurchett/status/1392240855436644353	False	https://twitter.com/RepDustyJohnson/status/1392205957753622541	0								[]				
1392208589129928707	1392208589129928707	2021-05-11 16:02:48 EDT	2021-05-11	16:02:48	-0400	1028854804087492613	reptimburchett	Rep. Tim Burchett		During #NationalPoliceWeek, we honor the officers who lost their lives in the line of duty and are reminded why we shouldn't defund the police. The brave men and women of law enforcement who made the ultimate sacrifice will never be forgotten and will always be honored.  https://t.co/D9GsigJGUF	en	[]	[]	[]	12	7	40	['nationalpoliceweek']	[]	https://twitter.com/RepTimBurchett/status/1392208589129928707	False		1	https://pbs.twimg.com/ext_tw_video_thumb/1392208436960632841/pu/img/w-jEiB_LPsObtSAu.jpg							[]				
1392147059323674624	1392147059323674624	2021-05-11 11:58:18 EDT	2021-05-11	11:58:18	-0400	1028854804087492613	reptimburchett	Rep. Tim Burchett		Our ally Israel always has the right to defend itself from terrorism. Hamas must end its gutless targeting of civilian population centers. I pray for calm in the region.	en	[]	[]	[]	18	24	118	[]	[]	https://twitter.com/RepTimBurchett/status/1392147059323674624	False		0								[]				
1391862939024494593	1391862939024494593	2021-05-10 17:09:18 EDT	2021-05-10	17:09:18	-0400	1028854804087492613	reptimburchett	Rep. Tim Burchett		Today's ransomware attack on the Colonial Pipeline will harm the oil and gas industry and raise prices for consumers. This attack on America's energy infrastructure shows we need to improve our nation's cybersecurity, and the criminals responsible must face serious consequences.	en	[]	[]	[]	41	23	135	[]	[]	https://twitter.com/RepTimBurchett/status/1391862939024494593	False		0								[]				
1391427145541603331	1391427145541603331	2021-05-09 12:17:37 EDT	2021-05-09	12:17:37	-0400	1028854804087492613	reptimburchett	Rep. Tim Burchett		Happy Mother’s Day!  https://t.co/QUD8Sr1ij2	en	[]	[]	['https://pbs.twimg.com/media/E09XnGeXIAIZLfW.jpg']	0	6	19	[]	[]	https://twitter.com/RepTimBurchett/status/1391427145541603331	False		1	https://pbs.twimg.com/media/E09XnGeXIAIZLfW.jpg							[]				
1390807558542270472	1390807558542270472	2021-05-07 19:15:36 EDT	2021-05-07	19:15:36	-0400	1028854804087492613	reptimburchett	Rep. Tim Burchett		Congratulations Carter High class of 2021. I remember when the new Carter Elementary opened back in 2013 - that project was one of my proudest achievements as mayor. Some of these kids were there when we cut the school’s ribbon, and it’s amazing to see how far they’ve come 🎓🎉  https://t.co/OVLN78lN8J	en	[]	[]	['https://pbs.twimg.com/media/E00kGYKXoAEbIZS.jpg', 'https://pbs.twimg.com/media/E00kGYKWUAA4FoB.jpg']	3	2	34	[]	[]	https://twitter.com/RepTimBurchett/status/1390807558542270472	False		1	https://pbs.twimg.com/media/E00kGYKXoAEbIZS.jpg							[]				
1390774892216397824	1390774892216397824	2021-05-07 17:05:48 EDT	2021-05-07	17:05:48	-0400	1028854804087492613	reptimburchett	Rep. Tim Burchett		"Joe Biden told Congress last week, ""America is on the move again.""   Based on today's jobs report, it looks like Americans are still at home.   The Democrats' last coronavirus stimulus bill is keeping too many folks on the sidelines with overly generous unemployment benefits."	en	[]	[]	[]	18	9	30	[]	[]	https://twitter.com/RepTimBurchett/status/1390774892216397824	False	https://twitter.com/CNBC/status/1390752386378051588	0								[]				
1390745489730068480	1390745489730068480	2021-05-07 15:08:58 EDT	2021-05-07	15:08:58	-0400	1028854804087492613	reptimburchett	Rep. Tim Burchett		It's pathetic John Kerry is excusing the #ChineseCommunistParty’s enslavement and murder of the Uyghurs to make a slimy climate arrangement. We shouldn't get involved in a disastrous climate plan the CCP won’t follow and that will weaken any economic leverage we have with China.	en	[]	[]	[]	15	213	207	['chinesecommunistparty']	[]	https://twitter.com/RepTimBurchett/status/1390745489730068480	False	https://twitter.com/nypost/status/1390468706573201410	0								[]				
1390726529794125826	1390726529794125826	2021-05-07 13:53:37 EDT	2021-05-07	13:53:37	-0400	1028854804087492613	reptimburchett	Rep. Tim Burchett		This week, I sent a letter to the DOJ urging an investigation into pharmaceutical companies for potentially fixing insulin prices. High insulin costs hurt Tennesseans living with diabetes who need this life-saving medication.  https://t.co/P9D7s8jgTR	en	[]	['https://burchett.house.gov/media/press-releases/burchett-renews-call-doj-investigate-insulin-price-fixing']	[]	14	28	117	[]	[]	https://twitter.com/RepTimBurchett/status/1390726529794125826	False		0								[]				
1390700259458826242	1390700259458826242	2021-05-07 12:09:14 EDT	2021-05-07	12:09:14	-0400	1028854804087492613	reptimburchett	Rep. Tim Burchett		.@ToddPiro asked me on @FoxFriendsFirst this morning if our costly efforts on climate change matter if China isn't going to do anything.  My response: heck no.  Our country should not negotiate with the #ChineseCommunistParty on environmental issues.  https://t.co/kjhG8A9cAP	en	[{'screen_name': 'toddpiro', 'name': 'todd piro', 'id': '33125742'}, {'screen_name': 'foxfriendsfirst', 'name': 'fox & friends first', 'id': '488679352'}]	['https://video.foxnews.com/v/6253058777001#sp=show-clips']	[]	1	2	5	['chinesecommunistparty']	[]	https://twitter.com/RepTimBurchett/status/1390700259458826242	False		0								[]				
1390339055087460353	1390339055087460353	2021-05-06 12:13:56 EDT	2021-05-06	12:13:56	-0400	1028854804087492613	reptimburchett	Rep. Tim Burchett		Big tech’s “oversight boards” consistently silence views they disagree with. This is a slippery slope and anybody could be targeted by these speech police next. I joined @FinnertyUSA this morning on @newsmax to discuss.  https://t.co/HzM0gM6caR	en	[{'screen_name': 'finnertyusa', 'name': 'rob finnerty', 'id': '195773944'}, {'screen_name': 'newsmax', 'name': 'newsmax', 'id': '20545835'}]	[]	[]	23	7	21	[]	[]	https://twitter.com/RepTimBurchett/status/1390339055087460353	False		1	https://pbs.twimg.com/ext_tw_video_thumb/1390338809662001152/pu/img/7PIcOWuJZzI8z1s5.jpg							[]				
1390025155884240909	1390025155884240909	2021-05-05 15:26:37 EDT	2021-05-05	15:26:37	-0400	1028854804087492613	reptimburchett	Rep. Tim Burchett		.@USDA_NIFA has awarded a grant to the University of Tennessee to expand its food engineering program.  https://t.co/FzwN7QyuBO	en	[{'screen_name': 'usda_nifa', 'name': 'nifa', 'id': '20050047'}]	['https://cris.nifa.usda.gov/cgi-bin/starfinder/0?path=fastlink1.txt&id=anon&pass=&search=R=92490&format=WEBLINK']	[]	2	3	5	[]	[]	https://twitter.com/RepTimBurchett/status/1390025155884240909	False		0								[]				
1389966538267054082	1389966538267054082	2021-05-05 11:33:41 EDT	2021-05-05	11:33:41	-0400	1028854804087492613	reptimburchett	Rep. Tim Burchett		.@elotouch might be a global company, but it's coming home to East Tennessee. Our best asset is our people, that's what attracts great companies to our region and state. This exciting development will create economic opportunities for hard-working folks in our communities.	en	[{'screen_name': 'elotouch', 'name': 'elo', 'id': '3642645794'}]	[]	[]	8	4	16	[]	[]	https://twitter.com/RepTimBurchett/status/1389966538267054082	False	https://twitter.com/WVLTCasey/status/1389885482918715392	0								[]				
1389664869541195781	1389664869541195781	2021-05-04 15:34:58 EDT	2021-05-04	15:34:58	-0400	1028854804087492613	reptimburchett	Rep. Tim Burchett		Knox County Mayor Glenn Jacobs gave his budget address this morning. It was an honor to attend and introduce him.  https://t.co/UhhWBiGEER	en	[]	[]	['https://pbs.twimg.com/media/E0kU1HTXsAIfZzu.jpg']	7	4	84	[]	[]	https://twitter.com/RepTimBurchett/status/1389664869541195781	False		1	https://pbs.twimg.com/media/E0kU1HTXsAIfZzu.jpg							[]				
1389368495197011969	1389368495197011969	2021-05-03 19:57:17 EDT	2021-05-03	19:57:17	-0400	1028854804087492613	reptimburchett	Rep. Tim Burchett		I appreciate the Jefferson County Livestock Association inviting me to give a legislative update at tonight’s meeting. Last year, I traveled to farms across TN02, including several livestock farms, where I got to see firsthand the hard work that goes into feeding our nation.  https://t.co/7MVih9vfGB	en	[]	[]	['https://pbs.twimg.com/media/E0gHRN_WUAAS7Fa.jpg', 'https://pbs.twimg.com/media/E0gHROAXMAAAc2O.jpg', 'https://pbs.twimg.com/media/E0gHRN_XsAA4Tb4.jpg', 'https://pbs.twimg.com/media/E0gHRN_WYAEMsXc.jpg']	5	4	15	[]	[]	https://twitter.com/RepTimBurchett/status/1389368495197011969	False		1	https://pbs.twimg.com/media/E0gHRN_WUAAS7Fa.jpg							[]				
