id	conversation_id	created_at	date	time	timezone	user_id	username	name	place	tweet	language	mentions	urls	photos	replies_count	retweets_count	likes_count	hashtags	cashtags	link	retweet	quote_url	video	thumbnail	near	geo	source	user_rt_id	user_rt	retweet_id	reply_to	retweet_date	translate	trans_src	trans_dest
1171471035390025729	1171471035390025729	2019-09-10 13:10:34 EDT	2019-09-10	13:10:34	-0400	1028854804087492613	reptimburchett	Rep. Tim Burchett		I heard from East Tennessee small businesses and farmers during August recess and their message was simple: pass the #USMCA. The USMCA ensures American small businesses and products are more competitive. House leadership must put America first and schedule a vote on the USMCA.  https://t.co/CNxuvFp7ws	en	[]	[]	[]	67	242	1141	['usmca']	[]	https://twitter.com/RepTimBurchett/status/1171471035390025729	False		1	https://pbs.twimg.com/ext_tw_video_thumb/1171470740450725888/pu/img/IedMkWFn_5fDk3oy.jpg							[]				
1170347343834730496	1170347343834730496	2019-09-07 10:45:25 EDT	2019-09-07	10:45:25	-0400	1028854804087492613	reptimburchett	Rep. Tim Burchett		Appreciate the local Myasthenia Gravis support group inviting me to this morning’s event. I appreciate all you do. Your support makes a difference to our friends and neighbors with MG.  https://t.co/K73ZRj51BW	en	[]	[]	['https://pbs.twimg.com/media/ED3otBJXYAEYNHU.jpg', 'https://pbs.twimg.com/media/ED3otBJXYAIx51q.jpg']	1	1	10	[]	[]	https://twitter.com/RepTimBurchett/status/1170347343834730496	False		1	https://pbs.twimg.com/media/ED3otBJXYAEYNHU.jpg							[]				
1170103577303560192	1170103577303560192	2019-09-06 18:36:46 EDT	2019-09-06	18:36:46	-0400	1028854804087492613	reptimburchett	Rep. Tim Burchett		Congratulations to the City of Friendsville for receiving a U.S. Economic Development Administration grant. I was honored to join Mayor Andy Lawhorn and City Commissioners for the announcement. The nearly half-million dollar grant will help the City build its first sewer system.  https://t.co/QiwxheXYpE	en	[]	[]	['https://pbs.twimg.com/media/ED0K_oTWsAERqLn.jpg']	1	1	20	[]	[]	https://twitter.com/RepTimBurchett/status/1170103577303560192	False		1	https://pbs.twimg.com/media/ED0K_oTWsAERqLn.jpg							[]				
1170080422686011392	1170080422686011392	2019-09-06 17:04:46 EDT	2019-09-06	17:04:46	-0400	1028854804087492613	reptimburchett	Rep. Tim Burchett		It was my honor to introduce @SenAlexander at today’s @TNValleyFair luncheon.  https://t.co/EDYjuz0KZm	en	[{'screen_name': 'senalexander', 'name': 'lamar alexander', 'id': '76649729'}, {'screen_name': 'tnvalleyfair', 'name': 'tennessee valley fair', 'id': '20543008'}]	[]	['https://pbs.twimg.com/media/EDz18NKWsAEPPUg.jpg', 'https://pbs.twimg.com/media/EDz18NMXsAImuO0.jpg']	0	1	32	[]	[]	https://twitter.com/RepTimBurchett/status/1170080422686011392	False		1	https://pbs.twimg.com/media/EDz18NKWsAEPPUg.jpg							[]				
1169965187333611520	1169965187333611520	2019-09-06 09:26:52 EDT	2019-09-06	09:26:52	-0400	1028854804087492613	reptimburchett	Rep. Tim Burchett		Great seeing Tennessee House Speaker Cameron Sexton this morning at the Knoxville Chamber.  https://t.co/ecAJcGceQc	en	[]	[]	['https://pbs.twimg.com/media/EDyNIidXYAIOkfP.jpg']	1	4	41	[]	[]	https://twitter.com/RepTimBurchett/status/1169965187333611520	False		1	https://pbs.twimg.com/media/EDyNIidXYAIOkfP.jpg							[]				
1169260011110973440	1169260011110973440	2019-09-04 10:44:45 EDT	2019-09-04	10:44:45	-0400	1028854804087492613	reptimburchett	Rep. Tim Burchett		Over the next month, my local team will staff Mobile Office Hours in Harrogate, Blaine and New Market. Stop by to get federal agency assistance or pass on a concern or opinion. You do not need an appointment.  https://t.co/GxIgBdr62n	en	[]	['https://burchett.house.gov/media/press-releases/rep-burchett-announces-mobile-office-hours-sept-2019']	[]	0	7	21	[]	[]	https://twitter.com/RepTimBurchett/status/1169260011110973440	False		0								[]				
1168567220361990144	1168567220361990144	2019-09-02 12:51:50 EDT	2019-09-02	12:51:50	-0400	1028854804087492613	reptimburchett	Rep. Tim Burchett		Have a safe and happy Labor Day!  https://t.co/WIlGHQ8QY9	en	[]	[]	['https://pbs.twimg.com/media/EDeVsTFX4AEhcq5.jpg']	2	2	19	[]	[]	https://twitter.com/RepTimBurchett/status/1168567220361990144	False		1	https://pbs.twimg.com/media/EDeVsTFX4AEhcq5.jpg							[]				
1168315984899452928	1168315984899452928	2019-09-01 20:13:31 EDT	2019-09-01	20:13:31	-0400	1028854804087492613	reptimburchett	Rep. Tim Burchett		My latest newsletter includes an August recess recap and a list of upcoming Mobile Office Hours in Harrogate, Blaine and New Market. If you aren't receiving the newsletter, be sure to sign up at  https://t.co/1aiU0rHQ82  https://t.co/gZwNpn9Cns	en	[]	['https://burchett.house.gov', 'https://iqconnect.lmhostediq.com/iqextranet/view_newsletter.aspx?id=100577&c=TN02TB']	[]	0	4	16	[]	[]	https://twitter.com/RepTimBurchett/status/1168315984899452928	False		0								[]				
1167829079380414464	1167829079380414464	2019-08-31 11:58:44 EDT	2019-08-31	11:58:44	-0400	1028854804087492613	reptimburchett	Rep. Tim Burchett		My family and I are praying for everyone potentially affected by Hurricane Dorian. The storm is strengthening and could make Labor Day travel and evacuation conditions dangerous. Please stay safe as the storm approaches the mainland.	en	[]	[]	[]	3	0	31	[]	[]	https://twitter.com/RepTimBurchett/status/1167829079380414464	False		0								[]				
1167798127417597953	1167798127417597953	2019-08-31 09:55:44 EDT	2019-08-31	09:55:44	-0400	1028854804087492613	reptimburchett	Rep. Tim Burchett		It’s football time in Tennessee. GBO!	en	[]	[]	[]	1	0	8	[]	[]	https://twitter.com/RepTimBurchett/status/1167798127417597953	False	https://twitter.com/Vol_Football/status/1167769001943916544	0								[]				
1167594333660430337	1167594333660430337	2019-08-30 20:25:56 EDT	2019-08-30	20:25:56	-0400	1028854804087492613	reptimburchett	Rep. Tim Burchett		Appreciate the Tennessee Bankers Association inviting me to give a quick legislative update at its luncheon this afternoon.  https://t.co/tcmmkDAF2L	en	[]	[]	['https://pbs.twimg.com/media/EDQg2FaWkAAPprl.jpg']	2	2	10	[]	[]	https://twitter.com/RepTimBurchett/status/1167594333660430337	False		1	https://pbs.twimg.com/media/EDQg2FaWkAAPprl.jpg							[]				
1167505447378718721	1167505447378718721	2019-08-30 14:32:44 EDT	2019-08-30	14:32:44	-0400	1028854804087492613	reptimburchett	Rep. Tim Burchett		Proud to join reps from the Regions Foundation today as they presented a $100,000 grant to Pellissippi State Community College. Having good jobs is the foundation for a strong economy, and I appreciate everything @ps does to advance workforce development in East Tennessee.  https://t.co/abMvaruqpl	en	[{'screen_name': 'ps', 'name': 'pellissippi state', 'id': '54291567'}]	[]	['https://pbs.twimg.com/media/EDPQA0kWkAEOI5R.jpg']	1	8	34	[]	[]	https://twitter.com/RepTimBurchett/status/1167505447378718721	False		1	https://pbs.twimg.com/media/EDPQA0kWkAEOI5R.jpg							[]				
1167238902190694401	1167238902190694401	2019-08-29 20:53:35 EDT	2019-08-29	20:53:35	-0400	1028854804087492613	reptimburchett	Rep. Tim Burchett		It was a beautiful day in Tennessee’s Second District. After an informative tour of DENSO Manufacturing, I joined the Blount County Chamber of Commerce for a legislative update at McGhee Tyson Airport. Then, I…  https://t.co/QHMeawjY0z	en	[]	['https://www.instagram.com/p/B1xMqCoAGGC/?igshid=quv1xw9nt1sf']	[]	2	0	24	[]	[]	https://twitter.com/RepTimBurchett/status/1167238902190694401	False		0								[]				
1167150485243092994	1167150485243092994	2019-08-29 15:02:14 EDT	2019-08-29	15:02:14	-0400	1028854804087492613	reptimburchett	Rep. Tim Burchett		Throwing out the first pitch at last night’s Gresham Middle softball game.  https://t.co/CnAH1X8S1V	en	[]	[]	['https://pbs.twimg.com/media/EDKNLO9XUAEILNd.jpg']	0	1	21	[]	[]	https://twitter.com/RepTimBurchett/status/1167150485243092994	False		1	https://pbs.twimg.com/media/EDKNLO9XUAEILNd.jpg							[]				
1166880945938620424	1166880945938620424	2019-08-28 21:11:11 EDT	2019-08-28	21:11:11	-0400	1028854804087492613	reptimburchett	Rep. Tim Burchett		Joined @ltgovmcnally and @Rep_Russell for a tour of Malibu Boats in Loudon. Appreciate CEO Jack Springer taking the time to show us around.  https://t.co/RMwlEgzJh8	en	[{'screen_name': 'ltgovmcnally', 'name': 'randy mcnally', 'id': '818524048888131584'}]	[]	['https://pbs.twimg.com/media/EDGYB9HXoAETXoi.jpg']	1	3	35	[]	[]	https://twitter.com/RepTimBurchett/status/1166880945938620424	False		1	https://pbs.twimg.com/media/EDGYB9HXoAETXoi.jpg							[]				
1166806008460644352	1166806004908134400	2019-08-28 16:13:25 EDT	2019-08-28	16:13:25	-0400	1028854804087492613	reptimburchett	Rep. Tim Burchett		My legislation, the Unmasking Antifa Act, cracks down on these cowards. Nobody should escape justice by anonymously targeting their political opponents with violence.	en	[]	[]	[]	5	0	14	[]	[]	https://twitter.com/RepTimBurchett/status/1166806008460644352	False		0								[]				
1166806007290507267	1166806004908134400	2019-08-28 16:13:25 EDT	2019-08-28	16:13:25	-0400	1028854804087492613	reptimburchett	Rep. Tim Burchett		Worse, members of Antifa cowardly hide behind masks when attacking those exercising their Constitutional rights. Antifa and others committing political violence must be held accountable for their disgusting actions.	en	[]	[]	[]	5	0	8	[]	[]	https://twitter.com/RepTimBurchett/status/1166806007290507267	False		0								[]				
1166806006258708481	1166806004908134400	2019-08-28 16:13:24 EDT	2019-08-28	16:13:24	-0400	1028854804087492613	reptimburchett	Rep. Tim Burchett		The bottom line is that political discourse between opposing sides must never turn violent, but, whenever Antifa is involved, encounters often turn into violent attacks against those with whom they disagree.	en	[]	[]	[]	3	0	3	[]	[]	https://twitter.com/RepTimBurchett/status/1166806006258708481	False		0								[]				
1166806004908134400	1166806004908134400	2019-08-28 16:13:24 EDT	2019-08-28	16:13:24	-0400	1028854804087492613	reptimburchett	Rep. Tim Burchett		A college professor affiliated with Antifa resigned after making aggressive and violent comments directed at the President, Christians, and other groups he disagreed with.  https://t.co/eo1HJXycON	en	[]	['https://www.foxnews.com/us/iowa-professor-antifa-resigns-bash-trump-baseball-bat']	[]	2	2	15	[]	[]	https://twitter.com/RepTimBurchett/status/1166806004908134400	False		0								[]				
1166461211237593088	1166461211237593088	2019-08-27 17:23:19 EDT	2019-08-27	17:23:19	-0400	1028854804087492613	reptimburchett	Rep. Tim Burchett		Enjoyed touring Eagle Distributing in Knoxville today.  https://t.co/CDvKJmvzhQ	en	[]	[]	['https://pbs.twimg.com/media/EDAaSTHXoAAxwO-.jpg', 'https://pbs.twimg.com/media/EDAaSTFXsAEYg-2.jpg']	5	1	37	[]	[]	https://twitter.com/RepTimBurchett/status/1166461211237593088	False		1	https://pbs.twimg.com/media/EDAaSTHXoAAxwO-.jpg							[]				
1166113984010960902	1166113984010960902	2019-08-26 18:23:33 EDT	2019-08-26	18:23:33	-0400	1028854804087492613	reptimburchett	Rep. Tim Burchett		Appreciate all the veterans who came out for tonight’s public forum.  https://t.co/iNR8zWerm3	en	[]	[]	['https://pbs.twimg.com/media/EC7efCNXYAAHwcK.jpg']	4	2	10	[]	[]	https://twitter.com/RepTimBurchett/status/1166113984010960902	False		1	https://pbs.twimg.com/media/EC7efCNXYAAHwcK.jpg							[]				
1165975351928991744	1165975351928991744	2019-08-26 09:12:41 EDT	2019-08-26	09:12:41	-0400	1028854804087492613	reptimburchett	Rep. Tim Burchett		Join me and representatives from the U.S. Department of Veterans Affairs this evening from 6 to 7 p.m. at Christenberry Community Center as we discuss issues facing the veteran community and hear updates from the VA.  https://t.co/KuKN0D4lrS	en	[]	['https://burchett.house.gov/media/press-releases/congressman-burchett-hosting-veterans-forum-aug-26']	[]	0	2	8	[]	[]	https://twitter.com/RepTimBurchett/status/1165975351928991744	False		0								[]				
1165408574559928320	1165408574559928320	2019-08-24 19:40:31 EDT	2019-08-24	19:40:31	-0400	1028854804087492613	reptimburchett	Rep. Tim Burchett		Happy 25th Anniversary, @EinsteinImprov! Thanks for a quarter century of laughs.  https://t.co/jFSgtXvkp9	en	[{'screen_name': 'einsteinimprov', 'name': 'einstein simplified', 'id': '70738913'}]	[]	['https://pbs.twimg.com/media/ECxc55pXsAMuK7H.jpg', 'https://pbs.twimg.com/media/ECxc559WsAAQH8_.jpg', 'https://pbs.twimg.com/media/ECxc55lW4AgLno5.jpg']	2	5	12	[]	[]	https://twitter.com/RepTimBurchett/status/1165408574559928320	False		1	https://pbs.twimg.com/media/ECxc55pXsAMuK7H.jpg							[]				
1165000848620961792	1165000848620961792	2019-08-23 16:40:21 EDT	2019-08-23	16:40:21	-0400	1028854804087492613	reptimburchett	Rep. Tim Burchett		Another busy day in Tennessee’s Second District. Got to welcome students on High Five (fist bump) Friday at Whittle Springs Middle School, take tours of Scapa Healthcare and Southeastern Carpenters Training Facility,…  https://t.co/pwiUEkVV8M	en	[]	['https://www.instagram.com/p/B1hSTDHAAlQ/?igshid=p14np533bfuf']	[]	2	2	14	[]	[]	https://twitter.com/RepTimBurchett/status/1165000848620961792	False		0								[]				
1164673356970561536	1164673356970561536	2019-08-22 18:59:01 EDT	2019-08-22	18:59:01	-0400	1028854804087492613	reptimburchett	Rep. Tim Burchett		Happy 10th anniversary Morning Pointe of Lenoir City! Thanks for inviting me to be a part of the celebration.  https://t.co/GCUZcgDr0n	en	[]	[]	['https://pbs.twimg.com/media/ECnAPQXWkAIsYQt.jpg']	0	1	10	[]	[]	https://twitter.com/RepTimBurchett/status/1164673356970561536	False		1	https://pbs.twimg.com/media/ECnAPQXWkAIsYQt.jpg							[]				
1164584770409553920	1164584770409553920	2019-08-22 13:07:00 EDT	2019-08-22	13:07:00	-0400	1028854804087492613	reptimburchett	Rep. Tim Burchett		Hosted a Small Business Roundtable  this morning in Knoxville. We discussed workforce development, regulations, taxes and other issues that impact our local business owners. Got some great information to take back to the Small Business Committee in September.  https://t.co/g8aBtHWige	en	[]	[]	['https://pbs.twimg.com/media/EClvrDTWsAEfZ7v.jpg']	1	2	15	[]	[]	https://twitter.com/RepTimBurchett/status/1164584770409553920	False		1	https://pbs.twimg.com/media/EClvrDTWsAEfZ7v.jpg							[]				
1164252404872880132	1164252404872880132	2019-08-21 15:06:18 EDT	2019-08-21	15:06:18	-0400	1028854804087492613	reptimburchett	Rep. Tim Burchett		Spent some time in Jefferson County today visiting the @oshkoshcorp facility and going on a site visit with @aecinsta (they even let me go up in the bucket truck)  https://t.co/F9fyFpBYBz	en	[{'screen_name': 'oshkoshcorp', 'name': 'oshkosh corporation', 'id': '824630721893507072'}]	[]	['https://pbs.twimg.com/media/EChBY0GWkAEe2vf.jpg', 'https://pbs.twimg.com/media/EChBY0IXUAA_eQg.jpg', 'https://pbs.twimg.com/media/EChBY0HWwAIgPuc.jpg', 'https://pbs.twimg.com/media/EChBY0JWwAIyIt3.jpg']	1	1	14	[]	[]	https://twitter.com/RepTimBurchett/status/1164252404872880132	False		1	https://pbs.twimg.com/media/EChBY0GWkAEe2vf.jpg							[]				
1163911295525146624	1163911295525146624	2019-08-20 16:30:51 EDT	2019-08-20	16:30:51	-0400	1028854804087492613	reptimburchett	Rep. Tim Burchett		Had a great afternoon in Claiborne County touring @homesteadertrl and @deroyal  https://t.co/vSwl3Q3UqE	en	[{'screen_name': 'homesteadertrl', 'name': 'homesteader', 'id': '475934139'}, {'screen_name': 'deroyal', 'name': 'deroyal industries, inc.', 'id': '1389755827'}]	[]	['https://pbs.twimg.com/media/ECcLJkBXYAAhghE.jpg', 'https://pbs.twimg.com/media/ECcLJj9WsAMecBA.jpg', 'https://pbs.twimg.com/media/ECcLJj_XUAAZ4g9.jpg', 'https://pbs.twimg.com/media/ECcLJj-XsAECLd_.jpg']	1	3	16	[]	[]	https://twitter.com/RepTimBurchett/status/1163911295525146624	False		1	https://pbs.twimg.com/media/ECcLJkBXYAAhghE.jpg							[]				
1163817189750657028	1163817189750657028	2019-08-20 10:16:55 EDT	2019-08-20	10:16:55	-0400	1028854804087492613	reptimburchett	Rep. Tim Burchett		Stopped by the Knoxville Entrepreneur Center this morning for a talk with local entrepreneurs who are managing and starting up new businesses in #TN02.  https://t.co/qBw16sJU2I	en	[]	[]	['https://pbs.twimg.com/media/ECa1j2vU8AE4wsw.jpg']	2	1	13	['tn02']	[]	https://twitter.com/RepTimBurchett/status/1163817189750657028	False		1	https://pbs.twimg.com/media/ECa1j2vU8AE4wsw.jpg							[]				
1163532906796670976	1163532906796670976	2019-08-19 15:27:17 EDT	2019-08-19	15:27:17	-0400	1028854804087492613	reptimburchett	Rep. Tim Burchett		Appreciate the warm welcome at today’s tour of the McGhee Tyson Air Traffic Control Tower.  https://t.co/IOhtrBstiW	en	[]	[]	['https://pbs.twimg.com/media/ECWzAjSX4AED4HV.jpg']	1	1	16	[]	[]	https://twitter.com/RepTimBurchett/status/1163532906796670976	False		1	https://pbs.twimg.com/media/ECWzAjSX4AED4HV.jpg							[]				
1163045412586102787	1163045412586102787	2019-08-18 07:10:09 EDT	2019-08-18	07:10:09	-0400	1028854804087492613	reptimburchett	Rep. Tim Burchett		Catch me this morning on @wbir’s Inside Tennessee. @JohnBeckerWBIR  https://t.co/PoEavFI8vC	en	[{'screen_name': 'wbir', 'name': 'wbir channel 10', 'id': '6892002'}, {'screen_name': 'johnbeckerwbir', 'name': 'john becker', 'id': '14390486'}]	[]	['https://pbs.twimg.com/media/ECP3oRSXUAAlmCC.jpg']	1	1	8	[]	[]	https://twitter.com/RepTimBurchett/status/1163045412586102787	False		1	https://pbs.twimg.com/media/ECP3oRSXUAAlmCC.jpg							[]				
1162461424674910208	1162461424674910208	2019-08-16 16:29:35 EDT	2019-08-16	16:29:35	-0400	1028854804087492613	reptimburchett	Rep. Tim Burchett		Join me for a Veterans Forum on Monday, Aug 26 from 6-7pm at the Christenberry Community Center in Knoxville, 931 Oglewood Ave. We'll discuss issues facing the veteran community, hear updates from the VA and provide federal agency assistance. More info at:  https://t.co/KuKN0D4lrS	en	[]	['https://burchett.house.gov/media/press-releases/congressman-burchett-hosting-veterans-forum-aug-26']	[]	0	2	11	[]	[]	https://twitter.com/RepTimBurchett/status/1162461424674910208	False		0								[]				
1162417076251844608	1162417076251844608	2019-08-16 13:33:22 EDT	2019-08-16	13:33:22	-0400	1028854804087492613	reptimburchett	Rep. Tim Burchett		Appreciate Moon Capital Management inviting me to speak at today’s luncheon.  https://t.co/vYAfsuN7gM	en	[]	[]	['https://pbs.twimg.com/media/ECG8KZPXsAESaCZ.jpg']	0	1	7	[]	[]	https://twitter.com/RepTimBurchett/status/1162417076251844608	False		1	https://pbs.twimg.com/media/ECG8KZPXsAESaCZ.jpg							[]				
1162398457405038598	1162398457405038598	2019-08-16 12:19:23 EDT	2019-08-16	12:19:23	-0400	1028854804087492613	reptimburchett	Rep. Tim Burchett		Toured the Emergency Department at @utmedicalcenter, the area’s only designated Level I Trauma Center.  https://t.co/kiydaFDk78	en	[{'screen_name': 'utmedicalcenter', 'name': 'utmedicalcenter', 'id': '15530618'}]	[]	['https://pbs.twimg.com/media/ECGrOGXW4AA2oWe.jpg', 'https://pbs.twimg.com/media/ECGrOGaXsAEEI1y.jpg', 'https://pbs.twimg.com/media/ECGrOGZW4AA9QXJ.jpg']	2	1	21	[]	[]	https://twitter.com/RepTimBurchett/status/1162398457405038598	False		1	https://pbs.twimg.com/media/ECGrOGXW4AA2oWe.jpg							[]				
1162339774352506882	1162339774352506882	2019-08-16 08:26:12 EDT	2019-08-16	08:26:12	-0400	1028854804087492613	reptimburchett	Rep. Tim Burchett		Live on @TalkRadio923 talking recent legislation and taking questions.  https://t.co/8Wkv5zeDjM	en	[{'screen_name': 'talkradio923', 'name': 'talk radio 92.3 wetr', 'id': '3313238811'}]	[]	['https://pbs.twimg.com/media/ECF13BsWwAAnki3.jpg']	0	1	6	[]	[]	https://twitter.com/RepTimBurchett/status/1162339774352506882	False		1	https://pbs.twimg.com/media/ECF13BsWwAAnki3.jpg							[]				
1162098386696380417	1162098386696380417	2019-08-15 16:27:00 EDT	2019-08-15	16:27:00	-0400	1028854804087492613	reptimburchett	Rep. Tim Burchett		Another busy day in Blount County that included lunch at Becky’s Grocery and Grill.  https://t.co/eFvS9OwhW4	en	[]	['https://www.instagram.com/p/B1Mq7VJg-qH/?igshid=1s5y6w9s709lk']	[]	3	1	12	[]	[]	https://twitter.com/RepTimBurchett/status/1162098386696380417	False		0								[]				
1161731707978027009	1161731707978027009	2019-08-14 16:09:57 EDT	2019-08-14	16:09:57	-0400	1028854804087492613	reptimburchett	Rep. Tim Burchett		Can’t miss an opportunity to grab lunch at Wright’s Cafeteria.  https://t.co/5rFSxUBDad	en	[]	[]	['https://pbs.twimg.com/media/EB9M1CcXkAI4ogY.jpg']	2	2	48	[]	[]	https://twitter.com/RepTimBurchett/status/1161731707978027009	False		1	https://pbs.twimg.com/media/EB9M1CcXkAI4ogY.jpg							[]				
1161374665312538626	1161374665312538626	2019-08-13 16:31:12 EDT	2019-08-13	16:31:12	-0400	1028854804087492613	reptimburchett	Rep. Tim Burchett		Spent the day in Blount County visiting local businesses and speaking at the Kiwanis Club of Maryville.  https://t.co/udc7sZjdoP	en	[]	[]	['https://pbs.twimg.com/media/EB4IGK8WkAEwhlz.jpg', 'https://pbs.twimg.com/media/EB4IGK6XYAMkcfp.jpg', 'https://pbs.twimg.com/media/EB4IGK8XoAAqFve.jpg', 'https://pbs.twimg.com/media/EB4IGK7W4AEBkf-.jpg']	2	2	18	[]	[]	https://twitter.com/RepTimBurchett/status/1161374665312538626	False		1	https://pbs.twimg.com/media/EB4IGK8WkAEwhlz.jpg							[]				
1161027092252954626	1161027092252954626	2019-08-12 17:30:04 EDT	2019-08-12	17:30:04	-0400	1028854804087492613	reptimburchett	Rep. Tim Burchett		Cancer is a terrible disease that’s impacted us all. I appreciate the work @ACSCANTennessee and @utmedicalcenter are doing to fight cancer and take care of patients in Tennessee’s Second District.  https://t.co/AoROf1WNVc	en	[{'screen_name': 'acscantennessee', 'name': 'acscantennessee', 'id': '155989606'}, {'screen_name': 'utmedicalcenter', 'name': 'utmedicalcenter', 'id': '15530618'}]	[]	['https://pbs.twimg.com/media/EBzL-9dW4AASrF6.jpg']	9	6	43	[]	[]	https://twitter.com/RepTimBurchett/status/1161027092252954626	False		1	https://pbs.twimg.com/media/EBzL-9dW4AASrF6.jpg							[]				
1159481248118714369	1159481248118714369	2019-08-08 11:07:26 EDT	2019-08-08	11:07:26	-0400	1028854804087492613	reptimburchett	Rep. Tim Burchett		ICYMI: My August newsletter came out last week. Not receiving the newsletters? Sign up at  https://t.co/uVBgHW3LeO  https://t.co/QkYMc3R6qG	en	[]	['http://burchett.house.gov', 'https://iqconnect.lmhostediq.com/iqextranet/view_newsletter.aspx?id=100552&c=TN02TB']	[]	0	1	10	[]	[]	https://twitter.com/RepTimBurchett/status/1159481248118714369	False		0								[]				
1158796054692868097	1158796054692868097	2019-08-06 13:44:43 EDT	2019-08-06	13:44:43	-0400	1028854804087492613	reptimburchett	Rep. Tim Burchett		Enjoyed speaking at Club VIBES and learning more about the great work this nonprofit is doing to assist blind and visually impaired young folks in our community.  https://t.co/TlJkwMsjAa	en	[]	[]	['https://pbs.twimg.com/media/EBTe3iBX4AA3t_j.jpg']	0	0	7	[]	[]	https://twitter.com/RepTimBurchett/status/1158796054692868097	False		1	https://pbs.twimg.com/media/EBTe3iBX4AA3t_j.jpg							[]				
1157422373307592704	1157422373307592704	2019-08-02 18:46:12 EDT	2019-08-02	18:46:12	-0400	1028854804087492613	reptimburchett	Rep. Tim Burchett		Toured @NisusCorp in Rockford and learned more about its sustainable pest control and wood preservative products.  https://t.co/BWXPVMltLr	en	[{'screen_name': 'nisuscorp', 'name': 'nisus', 'id': '419555391'}]	[]	['https://pbs.twimg.com/media/EA_9gkaXkAImvUK.jpg', 'https://pbs.twimg.com/media/EA_9gkcXsAA3b7O.jpg', 'https://pbs.twimg.com/media/EA_9gkdX4AEsdre.jpg', 'https://pbs.twimg.com/media/EA_9gkdXUAEMx-K.jpg']	0	1	9	[]	[]	https://twitter.com/RepTimBurchett/status/1157422373307592704	False		1	https://pbs.twimg.com/media/EA_9gkaXkAImvUK.jpg							[]				
1156942443922767873	1156942443922767873	2019-08-01 10:59:08 EDT	2019-08-01	10:59:08	-0400	1028854804087492613	reptimburchett	Rep. Tim Burchett		Appreciate the New York Life Knoxville office inviting me to speak at its conference kick off.  https://t.co/vwB8ZA9aWR	en	[]	[]	['https://pbs.twimg.com/media/EA5JA87XsAIsAek.jpg', 'https://pbs.twimg.com/media/EA5JA87XYAAcPLs.jpg']	0	0	11	[]	[]	https://twitter.com/RepTimBurchett/status/1156942443922767873	False		1	https://pbs.twimg.com/media/EA5JA87XsAIsAek.jpg							[]				
1156643657795194881	1156643657795194881	2019-07-31 15:11:52 EDT	2019-07-31	15:11:52	-0400	1028854804087492613	reptimburchett	Rep. Tim Burchett		It was my honor to recognize Clayton Narveson, an American hero and WWII combat veteran, as the #TN02 Veteran of the Month.  https://t.co/W5KeeOFJ6e	en	[]	[]	['https://pbs.twimg.com/media/EA05PX4XsAUBmib.jpg']	3	3	31	['tn02']	[]	https://twitter.com/RepTimBurchett/status/1156643657795194881	False		1	https://pbs.twimg.com/media/EA05PX4XsAUBmib.jpg							[]				
1155955004458455040	1155955004458455040	2019-07-29 17:35:24 EDT	2019-07-29	17:35:24	-0400	1028854804087492613	reptimburchett	Rep. Tim Burchett		Kicking off August recess in Jefferson County.  https://t.co/vF1Upqb9Ye	en	[]	['https://www.instagram.com/p/B0hBUaKAD1k/?igshid=6fkj93j1lv95']	[]	3	0	5	[]	[]	https://twitter.com/RepTimBurchett/status/1155955004458455040	False		0								[]				
1155878416626999296	1155878416626999296	2019-07-29 12:31:04 EDT	2019-07-29	12:31:04	-0400	1028854804087492613	reptimburchett	Rep. Tim Burchett		Hey Jay, it’s gettin crowded in this dadgum truck.  https://t.co/NMZGxeoBvR	en	[]	[]	['https://pbs.twimg.com/media/EAqBSHtXkAUnPF-.jpg']	1	5	54	[]	[]	https://twitter.com/RepTimBurchett/status/1155878416626999296	False		1	https://pbs.twimg.com/media/EAqBSHtXkAUnPF-.jpg							[]				
