id	conversation_id	created_at	date	time	timezone	user_id	username	name	place	tweet	language	mentions	urls	photos	replies_count	retweets_count	likes_count	hashtags	cashtags	link	retweet	quote_url	video	thumbnail	near	geo	source	user_rt_id	user_rt	retweet_id	reply_to	retweet_date	translate	trans_src	trans_dest
1326193053502205955	1326193053502205955	2020-11-10 11:00:38 EST	2020-11-10	11:00:38	-0400	1028854804087492613	reptimburchett	Rep. Tim Burchett		Today marks the United States Marine Corps' 245th year of service. My dad - a Marine - served in the Pacific in World War II, and his stories stay with me to this day. Thank you to all brave Marines for defending our country and values.  https://t.co/2c7z91d0Zy	en	[]	[]	['https://pbs.twimg.com/media/EmeVjaTXUAY1q99.jpg']	3	3	49	[]	[]	https://twitter.com/RepTimBurchett/status/1326193053502205955	False		1	https://pbs.twimg.com/media/EmeVjaTXUAY1q99.jpg							[]				
1325943564216438790	1325943564216438790	2020-11-09 18:29:15 EST	2020-11-09	18:29:15	-0400	1028854804087492613	reptimburchett	Rep. Tim Burchett		Glad I got the opportunity to stop by the Tennessee Veterans Business Association’s Veterans Day event. We appreciate all TVBA does to support our veteran-owned businesses.  https://t.co/5XGhjHw4mX	en	[]	[]	['https://pbs.twimg.com/media/EmaymTsXMAYCPlz.jpg', 'https://pbs.twimg.com/media/EmaymTtWMA01ynC.jpg', 'https://pbs.twimg.com/media/EmaymTsXYAkNwgz.jpg', 'https://pbs.twimg.com/media/EmaymTuXUAUWyAi.jpg']	3	1	29	[]	[]	https://twitter.com/RepTimBurchett/status/1325943564216438790	False		1	https://pbs.twimg.com/media/EmaymTsXMAYCPlz.jpg							[]				
1324752923897831424	1324752923897831424	2020-11-06 11:38:04 EST	2020-11-06	11:38:04	-0400	1028854804087492613	reptimburchett	Rep. Tim Burchett		My statement on the current situation with the 2020 Presidential Election. Every legal ballot must be counted through a transparent process.  https://t.co/WF1DU6UKXJ	en	[]	[]	['https://pbs.twimg.com/media/EmJ2BUUX0AEmQC3.jpg']	74	45	213	[]	[]	https://twitter.com/RepTimBurchett/status/1324752923897831424	False		1	https://pbs.twimg.com/media/EmJ2BUUX0AEmQC3.jpg							[]				
1323321807907262468	1323321807907262468	2020-11-02 12:51:19 EST	2020-11-02	12:51:19	-0400	1028854804087492613	reptimburchett	Rep. Tim Burchett		Responsible action on #COVID19 has been delayed for months while @SpeakerPelosi plays politics and obstructs Paycheck Protection Program legislation. Congress needs to get back to work and leave political agendas at home. My latest opinion in @knoxnews ⬇️  https://t.co/dyIphB5R2m	en	[{'screen_name': 'speakerpelosi', 'name': 'nancy pelosi', 'id': '15764644'}, {'screen_name': 'knoxnews', 'name': 'knoxnews', 'id': '1018921'}]	['https://www.knoxnews.com/story/opinion/2020/10/29/officials-must-set-aside-agendas-work-together-covid-19-response/6047011002/']	[]	50	26	126	['covid19']	[]	https://twitter.com/RepTimBurchett/status/1323321807907262468	False		0								[]				
1321575851822108672	1321575851822108672	2020-10-28 18:13:31 EDT	2020-10-28	18:13:31	-0400	1028854804087492613	reptimburchett	Rep. Tim Burchett		Visited my alma mater today for lunch with my friend Clay Spencer. I was really impressed with the great job our teachers and school administrators are doing during this pandemic. Thanks for all you do for our kids.  https://t.co/pCqVkepj6L	en	[]	[]	['https://pbs.twimg.com/media/ElcuOoTWoAAQGB_.jpg']	10	4	110	[]	[]	https://twitter.com/RepTimBurchett/status/1321575851822108672	False		1	https://pbs.twimg.com/media/ElcuOoTWoAAQGB_.jpg							[]				
1321246582503854086	1321246582503854086	2020-10-27 20:25:07 EDT	2020-10-27	20:25:07	-0400	1028854804087492613	reptimburchett	Rep. Tim Burchett		Enjoyed spending time in Claiborne County today touring Thompson Farms. Farmers do important work, and I appreciate these folks taking time out of their busy day to show me around.  https://t.co/9TnR5D9hWO	en	[]	[]	['https://pbs.twimg.com/media/ElYCwTtXgAcQE-n.jpg']	8	6	48	[]	[]	https://twitter.com/RepTimBurchett/status/1321246582503854086	False		1	https://pbs.twimg.com/media/ElYCwTtXgAcQE-n.jpg							[]				
1319358759530016772	1319358759530016772	2020-10-22 15:23:35 EDT	2020-10-22	15:23:35	-0400	1028854804087492613	reptimburchett	Rep. Tim Burchett		Join me in congratulating Avery Burnham, South Doyle U.S. Army JROTC Cadet Battalion Commander, for being awarded the Legion of Valor Bronze Cross for Achievement. I’m proud of the positive role model Avery is in our community and all hard work he put into this accomplishment.  https://t.co/3vKjGeF9Kr	en	[]	[]	['https://pbs.twimg.com/media/Ek9Nx9hWkAM3SBv.jpg', 'https://pbs.twimg.com/media/Ek9Nx9gW0AAlKv3.jpg']	5	3	44	[]	[]	https://twitter.com/RepTimBurchett/status/1319358759530016772	False		1	https://pbs.twimg.com/media/Ek9Nx9hWkAM3SBv.jpg							[]				
1319012287085203457	1319012287085203457	2020-10-21 16:26:49 EDT	2020-10-21	16:26:49	-0400	1028854804087492613	reptimburchett	Rep. Tim Burchett		I appreciate the Financial Executives International Knoxville Chapter inviting me to be the guest speaker at its October meeting. I enjoyed sharing a legislative update and taking questions from the crowd.  https://t.co/XdLzh5QQQB	en	[]	[]	['https://pbs.twimg.com/media/Ek4SrlTWkAMVbF9.jpg']	11	3	17	[]	[]	https://twitter.com/RepTimBurchett/status/1319012287085203457	False		1	https://pbs.twimg.com/media/Ek4SrlTWkAMVbF9.jpg							[]				
1318655497810137088	1318655497810137088	2020-10-20 16:49:04 EDT	2020-10-20	16:49:04	-0400	1028854804087492613	reptimburchett	Rep. Tim Burchett		As a state legislator, county mayor, and now as a Congressman, the success of small business owners and their employees has always been a top priority of mine. I am honored to receive @NFIB's Guardian of Small Business award for the 116th Congress!  https://t.co/TWwgOGzn1F	en	[{'screen_name': 'nfib', 'name': 'nfib', 'id': '14587949'}]	[]	['https://pbs.twimg.com/media/EkzNvn6XIAIfW0V.png']	3	3	34	[]	[]	https://twitter.com/RepTimBurchett/status/1318655497810137088	False		1	https://pbs.twimg.com/media/EkzNvn6XIAIfW0V.png							[]				
1318322525747675141	1318322525747675141	2020-10-19 18:45:58 EDT	2020-10-19	18:45:58	-0400	1028854804087492613	reptimburchett	Rep. Tim Burchett		From a political science class at William Blount High School to a Webelos meeting in east Knox County, it was great visiting with young folks who want to learn more about civics and how our government works.  https://t.co/QsDuqyM5rz	en	[]	[]	['https://pbs.twimg.com/media/EkufWJhW0AE6BxO.jpg', 'https://pbs.twimg.com/media/EkufWJhXEAMH634.jpg']	7	5	42	[]	[]	https://twitter.com/RepTimBurchett/status/1318322525747675141	False		1	https://pbs.twimg.com/media/EkufWJhW0AE6BxO.jpg							[]				
1316836270178525186	1316836270178525186	2020-10-15 16:20:07 EDT	2020-10-15	16:20:07	-0400	1028854804087492613	reptimburchett	Rep. Tim Burchett		The Trump Administration recently announced it will form the United States One Trillion Trees Interagency Council. As an original cosponsor of @RepWesterman's Trillion Trees Act, it's good to know Congress has this administration's support in this effort.   https://t.co/bYeUzQ37Id	en	[{'screen_name': 'repwesterman', 'name': 'rep. bruce westerman', 'id': '2852998461'}]	['https://westerman.house.gov/media-center/press-releases/what-they-are-saying-trillion-trees-executive-order']	[]	2	8	22	[]	[]	https://twitter.com/RepTimBurchett/status/1316836270178525186	False		0								[]				
1316767621644247050	1316767621644247050	2020-10-15 11:47:20 EDT	2020-10-15	11:47:20	-0400	1028854804087492613	reptimburchett	Rep. Tim Burchett		Social media is for sharing different ideas and opinions. By censoring @PressSec and the @nypost article, @Twitter is biased against views they disagree with.  https://t.co/deyDtWyCue	en	[{'screen_name': 'presssec', 'name': 'jen psaki', 'id': '1349170292564905988'}, {'screen_name': 'nypost', 'name': 'new york post', 'id': '17469289'}, {'screen_name': 'twitter', 'name': 'twitter', 'id': '783214'}]	['https://burchett.house.gov/media/press-releases/burchett-blasts-twitter-censorship-bias-against-trump-administration-officials']	[]	17	8	41	[]	[]	https://twitter.com/RepTimBurchett/status/1316767621644247050	False		0								[]				
1316490215477964801	1316490215477964801	2020-10-14 17:25:01 EDT	2020-10-14	17:25:01	-0400	1028854804087492613	reptimburchett	Rep. Tim Burchett		It was an honor to join Acting Deputy Secretary of Homeland Security Ken Cuccinelli at TVA headquarters this afternoon to recognize the Administration’s recent efforts to prioritize American jobs.  https://t.co/GC6SBCZyni	en	[]	[]	['https://pbs.twimg.com/media/EkUcyf-WAAUFBus.jpg', 'https://pbs.twimg.com/media/EkUcygaXsAERaWf.jpg']	6	6	45	[]	[]	https://twitter.com/RepTimBurchett/status/1316490215477964801	False		1	https://pbs.twimg.com/media/EkUcyf-WAAUFBus.jpg							[]				
1316120167211032579	1316120167211032579	2020-10-13 16:54:34 EDT	2020-10-13	16:54:34	-0400	1028854804087492613	reptimburchett	Rep. Tim Burchett		Fall is usually a busy time for Capitol tours in my Washington office. Although we cannot host in-person Capitol building tours for families and students this fall, East Tennesseans can still experience the Capitol by taking my virtual tour!  https://t.co/w2X4FytAqb	en	[]	['https://www.youtube.com/watch?v=pmOLOkihJ2I']	[]	4	3	21	[]	[]	https://twitter.com/RepTimBurchett/status/1316120167211032579	False		0								[]				
1314592971526938625	1314592971526938625	2020-10-09 11:46:03 EDT	2020-10-09	11:46:03	-0400	1028854804087492613	reptimburchett	Rep. Tim Burchett		Today, I introduced a resolution to require the cost of all bills to be read on the House Floor before members cast their votes. The American public deserves to know how much of their money Congress is spending, especially if a bill drafted in secret.  https://t.co/5ZRB8I9IO6	en	[]	['https://burchett.house.gov/media/press-releases/burchett-introduces-resolution-require-cost-estimate-legislation-be-read-house']	[]	48	332	822	[]	[]	https://twitter.com/RepTimBurchett/status/1314592971526938625	False		0								[]				
1314282184459649027	1314282184459649027	2020-10-08 15:11:05 EDT	2020-10-08	15:11:05	-0400	1028854804087492613	reptimburchett	Rep. Tim Burchett		Attention East Tennessee veterans: TRICARE open season starts November 9. Remember, if you want to keep your TRICARE Select Group A coverage, you must take action to set up a monthly payment plan or you will be disenrolled from TRICARE. Learn more below.   https://t.co/baMhI6EQv2	en	[]	['https://tricare.mil/CoveredServices/BenefitUpdates/Archives/09_30_2020_TRICARE_Select_Enrollment_Fees_Group_A_Retirees_Coming_January_2021']	[]	5	3	12	[]	[]	https://twitter.com/RepTimBurchett/status/1314282184459649027	False		0								[]				
1314196938447880193	1314196938447880193	2020-10-08 09:32:21 EDT	2020-10-08	09:32:21	-0400	1028854804087492613	reptimburchett	Rep. Tim Burchett		Yesterday, I spoke with Postmaster General DeJoy about my concerns with @USPS operational changes this summer and the need for more transparency in the future. The Postmaster General agreed that better communication with Congress is necessary. Read more ⬇️  https://t.co/xVvVUarwnQ	en	[{'screen_name': 'usps', 'name': 'u.s. postal service', 'id': '386507775'}]	['https://burchett.house.gov/media/press-releases/congressman-burchett-discusses-usps-operational-changes-postmaster-general']	[]	6	3	14	[]	[]	https://twitter.com/RepTimBurchett/status/1314196938447880193	False		0								[]				
1313572609510998018	1313572609510998018	2020-10-06 16:11:29 EDT	2020-10-06	16:11:29	-0400	1028854804087492613	reptimburchett	Rep. Tim Burchett		Great move by @USDOL to issue this ruling on work visa programs. This decision protects American jobs and wages.  https://t.co/HMX1M2zZaN	en	[{'screen_name': 'usdol', 'name': 'us labor department', 'id': '20179628'}]	['https://www.dol.gov/newsroom/releases/eta/eta20201006']	[]	4	1	13	[]	[]	https://twitter.com/RepTimBurchett/status/1313572609510998018	False		0								[]				
1313210954092613633	1313210954092613633	2020-10-05 16:14:24 EDT	2020-10-05	16:14:24	-0400	1028854804087492613	reptimburchett	Rep. Tim Burchett		My monthly eNewsletter covers recent developments in Congress and how I am engaging with East Tennesseans. Want to subscribe? Click the link below to receive my eNewsletter at the beginning of each month! ⬇️  https://t.co/lz9S6XNYGi	en	[]	['https://burchett.house.gov/contact/newsletter?zip5=37902&zip4=&time=1601928696157312054']	[]	6	2	11	[]	[]	https://twitter.com/RepTimBurchett/status/1313210954092613633	False		0								[]				
1312096755455004672	1312096755455004672	2020-10-02 14:26:58 EDT	2020-10-02	14:26:58	-0400	1028854804087492613	reptimburchett	Rep. Tim Burchett		I joined @6News to react to President Trump testing positive for COVID-19.  I'm praying for President Trump and the First Lady and wish them both a speedy recovery. Along with the rest of the nation, I'm hoping for positive news in the coming days about the First Family’s health.  https://t.co/Ixtt745lz6	en	[{'screen_name': '6news', 'name': 'wate 6 on your side', 'id': '17121146'}]	[]	['https://pbs.twimg.com/media/EjWBCamWkAA2VnZ.jpg']	16	9	106	[]	[]	https://twitter.com/RepTimBurchett/status/1312096755455004672	False		1	https://pbs.twimg.com/media/EjWBCamWkAA2VnZ.jpg							[]				
1312086108075782144	1312086108075782144	2020-10-02 13:44:40 EDT	2020-10-02	13:44:40	-0400	1028854804087492613	reptimburchett	Rep. Tim Burchett		The HEROES Act 2.0 is so irresponsible 18 House Democrats voted against it. Responding to COVID-19 needs to be for small businesses, workers and families, not advancing political agendas.  https://t.co/Jhg4RcQaIJ	en	[]	[]	['https://pbs.twimg.com/media/EjVz-VIXkAIKGYj.jpg']	19	27	113	[]	[]	https://twitter.com/RepTimBurchett/status/1312086108075782144	False		1	https://pbs.twimg.com/media/EjVz-VIXkAIKGYj.jpg							[]				
1311393598181642243	1311393598181642243	2020-09-30 15:52:52 EDT	2020-09-30	15:52:52	-0400	1028854804087492613	reptimburchett	Rep. Tim Burchett		I just signed onto Rep. @HerreraBeutler's bipartisan discharge petition to bring a #PaycheckProtectionProgram extension bill to the floor for a vote and bypass obstruction from @SpeakerPelosi. Congress needs to deliver for small businesses and workers, not play political games.	en	[{'screen_name': 'herrerabeutler', 'name': 'jaime herrera beutler', 'id': '242926427'}, {'screen_name': 'speakerpelosi', 'name': 'nancy pelosi', 'id': '15764644'}]	[]	[]	5	19	73	['paycheckprotectionprogram']	[]	https://twitter.com/RepTimBurchett/status/1311393598181642243	False		0								[]				
1310599558607581186	1310599558607581186	2020-09-28 11:17:39 EDT	2020-09-28	11:17:39	-0400	1028854804087492613	reptimburchett	Rep. Tim Burchett		Joined Mayor @GlennJacobsTN and @LegacyParks Director Carol Evans for an exciting announcement. Plans are in the works to build a veterans memorial park that will overlook the East Tenn State Veterans Cemetery. I appreciate all the partners working to make this project a reality.  https://t.co/R40AvAdlS1	en	[{'screen_name': 'glennjacobstn', 'name': 'glenn jacobs', 'id': '734096443561148416'}, {'screen_name': 'legacyparks', 'name': 'legacyparks', 'id': '2612324498'}]	[]	['https://pbs.twimg.com/media/EjAvWK7XYAUWVgo.jpg', 'https://pbs.twimg.com/media/EjAvWK7XYAYMj84.jpg']	11	6	35	[]	[]	https://twitter.com/RepTimBurchett/status/1310599558607581186	False		1	https://pbs.twimg.com/media/EjAvWK7XYAUWVgo.jpg							[]				
1309537180499542016	1309537180499542016	2020-09-25 12:56:08 EDT	2020-09-25	12:56:08	-0400	1028854804087492613	reptimburchett	Rep. Tim Burchett		Asian Carp must be stopped from entering East Tennessee waterways. Great move by @GovBillLee to form the Asian Carp Advisory Commission.  https://t.co/Lq7W90P0WP	en	[{'screen_name': 'govbilllee', 'name': 'gov. bill lee', 'id': '1084924525232513025'}]	['https://www.wate.com/news/tennessee-forms-commission-to-halt-invasive-asian-carp/']	[]	23	7	87	[]	[]	https://twitter.com/RepTimBurchett/status/1309537180499542016	False		0								[]				
1309246368658214914	1309246368658214914	2020-09-24 17:40:33 EDT	2020-09-24	17:40:33	-0400	1028854804087492613	reptimburchett	Rep. Tim Burchett		Clean energy shouldn't come at the expense of the energy jobs many Americans currently rely on. The bill House Democrats put on the floor today would create more energy problems than energy solutions.  https://t.co/5M3FXAS1G1	en	[]	[]	['https://pbs.twimg.com/media/EitgZGJXYAA2ewz.jpg']	7	2	20	[]	[]	https://twitter.com/RepTimBurchett/status/1309246368658214914	False		1	https://pbs.twimg.com/media/EitgZGJXYAA2ewz.jpg							[]				
1308807596187553792	1308807596187553792	2020-09-23 12:37:02 EDT	2020-09-23	12:37:02	-0400	1028854804087492613	reptimburchett	Rep. Tim Burchett		I'm proud to serve on @HSBCgop and stand up for East Tennessee small businesses in Congress. Please join me in celebrating the American entrepreneurial spirit during Small Business Week!  https://t.co/qQGz4Afkyy	en	[{'screen_name': 'hsbcgop', 'name': 'house committee on small business republicans', 'id': '2978291435'}]	[]	['https://pbs.twimg.com/media/EinRfA0XgAI39JP.png']	3	4	16	[]	[]	https://twitter.com/RepTimBurchett/status/1308807596187553792	False		1	https://pbs.twimg.com/media/EinRfA0XgAI39JP.png							[]				
1308771602457333762	1308771602457333762	2020-09-23 10:14:00 EDT	2020-09-23	10:14:00	-0400	1028854804087492613	reptimburchett	Rep. Tim Burchett		40 minutes. That's how long members had to read the text of the 115-page continuing resolution before being called to the House Floor to vote. You can't vote for a bill when you don't know what's in it.  My full statement on last night's continuing resolution ⬇️⬇️⬇️  https://t.co/bC4dh5Nuxt	en	[]	[]	['https://pbs.twimg.com/media/Eims-eoWsAIQkCy.png']	29	26	156	[]	[]	https://twitter.com/RepTimBurchett/status/1308771602457333762	False		1	https://pbs.twimg.com/media/Eims-eoWsAIQkCy.png							[]				
1308501881421955074	1308501881421955074	2020-09-22 16:22:13 EDT	2020-09-22	16:22:13	-0400	1028854804087492613	reptimburchett	Rep. Tim Burchett		I just voted to prohibit Chinese goods made with Uyghur forced labor from being imported into the United States. Products created in work camps to enrich the Chinese Communist Party are not welcome here. I stand with the Uyghurs and all ethnic minorities persecuted by the CCP.	en	[]	[]	[]	50	425	1165	[]	[]	https://twitter.com/RepTimBurchett/status/1308501881421955074	False		0								[]				
1308109484968075264	1308109484968075264	2020-09-21 14:22:59 EDT	2020-09-21	14:22:59	-0400	1028854804087492613	reptimburchett	Rep. Tim Burchett		Clover Meadow Farm was the final stop on my East Tennessee Farm Tours! Opened in 2015, Clover Meadow Farm utilizes 50 acres to responsibly care for and curate their grass-fed cattle. Thank you for showing me around!  https://t.co/1HkwrjgeEg	en	[]	[]	['https://pbs.twimg.com/media/EidWkmNXYAAtJtW.jpg']	2	1	27	[]	[]	https://twitter.com/RepTimBurchett/status/1308109484968075264	False		1	https://pbs.twimg.com/media/EidWkmNXYAAtJtW.jpg							[]				
1307057479524724737	1307057479524724737	2020-09-18 16:42:41 EDT	2020-09-18	16:42:41	-0400	1028854804087492613	reptimburchett	Rep. Tim Burchett		Joined NAIFA-Knoxville, the local affiliate of the National Association of Insurance and Financial Advisors, for its monthly meeting. I appreciate the opportunity to attend and give a legislative update.  https://t.co/RYfacl80FE	en	[]	[]	['https://pbs.twimg.com/media/EiOZ2TlXsAI6jbl.jpg']	3	2	6	[]	[]	https://twitter.com/RepTimBurchett/status/1307057479524724737	False		1	https://pbs.twimg.com/media/EiOZ2TlXsAI6jbl.jpg							[]				
1306673885623001088	1306673885623001088	2020-09-17 15:18:25 EDT	2020-09-17	15:18:25	-0400	1028854804087492613	reptimburchett	Rep. Tim Burchett		On this Constitution Day, we reflect upon the unique freedoms we enjoy as Americans and thank all the folks who bravely defended our nation’s values.  https://t.co/EW3L5k01P7	en	[]	[]	[]	8	4	37	[]	[]	https://twitter.com/RepTimBurchett/status/1306673885623001088	False		1	https://pbs.twimg.com/ext_tw_video_thumb/1306673849820479489/pu/img/urABVsnjX8NdrSsT.jpg							[]				
1306648941832871936	1306648941832871936	2020-09-17 13:39:18 EDT	2020-09-17	13:39:18	-0400	1028854804087492613	reptimburchett	Rep. Tim Burchett		Today, I sent a letter to Department of Homeland Security Inspector General Cuffari urging him to thoroughly investigate the allegations of medical misconduct and forced hysterectomies at the Irwin County, GA ICE facility.  https://t.co/Qjrb8IAD0M	en	[]	['https://burchett.house.gov/media/press-releases/burchett-reports-forced-hysterectomies-ice-facility-are-disturbing']	[]	4	6	26	[]	[]	https://twitter.com/RepTimBurchett/status/1306648941832871936	False		0								[]				
1306277094347898880	1306277094347898880	2020-09-16 13:01:43 EDT	2020-09-16	13:01:43	-0400	1028854804087492613	reptimburchett	Rep. Tim Burchett		ICYMI: Microloans are an important tool used by small businesses to innovate and grow. My legislation, the Microloan Transparency and Accountability Act, will increase access to these loans for rural small businesses.  I spoke about my bill before it passed the House on Monday⬇️  https://t.co/kj0onX98ZX	en	[]	[]	[]	7	9	52	[]	[]	https://twitter.com/RepTimBurchett/status/1306277094347898880	False		1	https://pbs.twimg.com/ext_tw_video_thumb/1306273273299300352/pu/img/YWwTM1IKeAONiemS.jpg							[]				
1306239151294087171	1306239151294087171	2020-09-16 10:30:57 EDT	2020-09-16	10:30:57	-0400	1028854804087492613	reptimburchett	Rep. Tim Burchett		Reports of abuse and medical malpractice at the ICE facility in Irwin County, GA are extremely disturbing. Congress needs to get to the bottom of what happened at this facility and hold ICE officials accountable if these reports are true.	en	[]	[]	[]	5	7	54	[]	[]	https://twitter.com/RepTimBurchett/status/1306239151294087171	False		0								[]				
1305953856468193280	1305953856468193280	2020-09-15 15:37:17 EDT	2020-09-15	15:37:17	-0400	1028854804087492613	reptimburchett	Rep. Tim Burchett		Today was a historic day towards peace and prosperity in the Middle East.	en	[]	[]	[]	43	107	392	[]	[]	https://twitter.com/RepTimBurchett/status/1305953856468193280	False	https://twitter.com/WhiteHouse45/status/1305941077032079361	0								[]				
1305891636774342659	1305891635176275968	2020-09-15 11:30:03 EDT	2020-09-15	11:30:03	-0400	1028854804087492613	reptimburchett	Rep. Tim Burchett		Click the link below to watch the tour, enjoy!  https://t.co/w2X4FytAqb	en	[]	['https://www.youtube.com/watch?v=pmOLOkihJ2I']	[]	14	14	58	[]	[]	https://twitter.com/RepTimBurchett/status/1305891636774342659	False		0								[]				
1305891635931287552	1305891635176275968	2020-09-15 11:30:02 EDT	2020-09-15	11:30:02	-0400	1028854804087492613	reptimburchett	Rep. Tim Burchett		Today, I am proud to launch the Virtual Capitol Tour Experience, a video guided tour of the United States Capitol Building. I hope East Tennesseans will use the Virtual Capitol Tour Experience for tourism and educational purposes until my office can host in-person tours again.	en	[]	[]	[]	3	0	10	[]	[]	https://twitter.com/RepTimBurchett/status/1305891635931287552	False		0								[]				
1305891635176275968	1305891635176275968	2020-09-15 11:30:02 EDT	2020-09-15	11:30:02	-0400	1028854804087492613	reptimburchett	Rep. Tim Burchett		Hosting East Tennesseans for guided Capitol tours is one of the most important services provided by my office. With the Capitol closed to in-person tours for the time being, we needed to find ways to continue providing this important service.	en	[]	[]	[]	4	3	16	[]	[]	https://twitter.com/RepTimBurchett/status/1305891635176275968	False		0								[]				
1305618197727641600	1305618197727641600	2020-09-14 17:23:30 EDT	2020-09-14	17:23:30	-0400	1028854804087492613	reptimburchett	Rep. Tim Burchett		The Microloan Transparency and Accountability Act is my first piece of legislation to pass the House of Representatives! I am proud of this legislation that will help more rural small businesses access the Small Business Administration's microloan program.  https://t.co/h4NglRd7dQ	en	[]	['https://burchett.house.gov/media/press-releases/first-bill-authored-rep-burchett-advances-out-house-representatives']	[]	2	4	22	[]	[]	https://twitter.com/RepTimBurchett/status/1305618197727641600	False		0								[]				
1305520368229265409	1305520368229265409	2020-09-14 10:54:45 EDT	2020-09-14	10:54:45	-0400	1028854804087492613	reptimburchett	Rep. Tim Burchett		It was an honor to receive the Defender of Housing Award from the National Association of Homebuilders. I appreciate @HBAGK nominating me for the award, which recognizes federal legislators who have demonstrated strong support for the housing industry.  https://t.co/3HGLgYKgA8	en	[{'screen_name': 'hbagk', 'name': 'home builders', 'id': '365648250'}]	[]	['https://pbs.twimg.com/media/Eh4j2llWkAM6cXJ.jpg', 'https://pbs.twimg.com/media/Eh4j2llWsAAlRzG.jpg']	1	3	9	[]	[]	https://twitter.com/RepTimBurchett/status/1305520368229265409	False		1	https://pbs.twimg.com/media/Eh4j2llWkAM6cXJ.jpg							[]				
1304496485694951425	1304496485694951425	2020-09-11 15:06:13 EDT	2020-09-11	15:06:13	-0400	1028854804087492613	reptimburchett	Rep. Tim Burchett		On the 19th anniversary of the 9/11 attacks, it is important to remember the world is still working towards peace and stability in the Middle East. Today’s announcement that Bahrain and Israel are normalizing relations is progress towards peacefully achieving this goal.	en	[]	[]	[]	7	3	43	[]	[]	https://twitter.com/RepTimBurchett/status/1304496485694951425	False		0								[]				
