id	conversation_id	created_at	date	time	timezone	user_id	username	name	place	tweet	language	mentions	urls	photos	replies_count	retweets_count	likes_count	hashtags	cashtags	link	retweet	quote_url	video	thumbnail	near	geo	source	user_rt_id	user_rt	retweet_id	reply_to	retweet_date	translate	trans_src	trans_dest
1397988429149974538	1397988429149974538	2021-05-27 14:49:49 EDT	2021-05-27	14:49:49	-0400	815952318487298048	drnealdunnfl2	Dr. Neal Dunn		UF/IFAS has an impressive operation &amp; continuously churns out great work. I’m grateful to the @FlaFarmBureau &amp; @nfrec_sv for hosting me. I will continue to work closely with them to advance the interests of Florida’s farmers, ranchers, &amp; foresters. #FL02  https://t.co/daGRVTsYYo	en	[{'screen_name': 'flafarmbureau', 'name': 'florida farm bureau', 'id': '2674845103'}, {'screen_name': 'nfrec_sv', 'name': 'nfrec-sv', 'id': '147650965'}]	[]	['https://pbs.twimg.com/media/E2amECnXIAIo2VE.jpg', 'https://pbs.twimg.com/media/E2amJPWWUAAHpu1.jpg', 'https://pbs.twimg.com/media/E2amJvaX0AQujLo.jpg', 'https://pbs.twimg.com/media/E2amRBDXIAQRM84.jpg']	2	2	13	['fl02']	[]	https://twitter.com/DrNealDunnFL2/status/1397988429149974538	False		1	https://pbs.twimg.com/media/E2amECnXIAIo2VE.jpg							[]				
1396938454102052867	1396938454102052867	2021-05-24 17:17:35 EDT	2021-05-24	17:17:35	-0400	815952318487298048	drnealdunnfl2	Dr. Neal Dunn		Too many businesses, especially in the hospitality industry, cannot compete with our unemployment program. Many have had to close their doors or reduce hours. This is the right choice if we want to keep bolstering Florida's economy. Let's get back to work. #FL02	en	[]	[]	[]	8	1	3	['fl02']	[]	https://twitter.com/DrNealDunnFL2/status/1396938454102052867	False	https://twitter.com/FLDEO/status/1396821302044938243	0								[]				
1395483793797132288	1395483793797132288	2021-05-20 16:57:17 EDT	2021-05-20	16:57:17	-0400	815952318487298048	drnealdunnfl2	Dr. Neal Dunn		The #digitaldivide has become even more apparent during the pandemic &amp; it's crucial that we help our country stay connected - especially our rural communities. Happy to be a part of the team leading the way on broadband access for all. #FL02	en	[]	[]	[]	3	5	5	['digitaldivide', 'fl02']	[]	https://twitter.com/DrNealDunnFL2/status/1395483793797132288	False	https://twitter.com/HouseCommerce/status/1395476925376647171	0								[]				
1395085808781119488	1395085808781119488	2021-05-19 14:35:50 EDT	2021-05-19	14:35:50	-0400	815952318487298048	drnealdunnfl2	Dr. Neal Dunn		"Yesterday, I shared w/ @EnergyCommerce info about a bill I introduced called the Safe Alternative Vehicle Endorsement Act. This legislation would reclassify a vehicle “exemption” as an “alternate safety endorsement."" #FL02  https://t.co/82GYAlUb3p"	en	[{'screen_name': 'energycommerce', 'name': 'energy and commerce committee', 'id': '30929600'}]	[]	[]	0	2	3	['fl02']	[]	https://twitter.com/DrNealDunnFL2/status/1395085808781119488	False		1	https://pbs.twimg.com/ext_tw_video_thumb/1395085395025711104/pu/img/lhndwgnv0ebG9Qy_.jpg							[]				
1394734975392624642	1394734975392624642	2021-05-18 15:21:45 EDT	2021-05-18	15:21:45	-0400	815952318487298048	drnealdunnfl2	Dr. Neal Dunn		Thanks for having me! It was a pleasure chatting with you all. #ENDALZ	en	[]	[]	[]	4	10	29	['endalz']	[]	https://twitter.com/DrNealDunnFL2/status/1394734975392624642	False	https://twitter.com/Holler4Alz/status/1394733420798955526	0								[]				
1393724879418105868	1393724879418105868	2021-05-15 20:28:00 EDT	2021-05-15	20:28:00	-0400	815952318487298048	drnealdunnfl2	Dr. Neal Dunn		Happy #ArmedForcesDay to those serving in the military, their spouses, and their families! Thank you for your service! #FL02  https://t.co/WXAkuYXIZm	en	[]	[]	['https://pbs.twimg.com/media/E1eBQf_WEAEnBJN.jpg']	2	3	3	['armedforcesday', 'fl02']	[]	https://twitter.com/DrNealDunnFL2/status/1393724879418105868	False		1	https://pbs.twimg.com/media/E1eBQf_WEAEnBJN.jpg							[]				
1392973836384079877	1392973836384079877	2021-05-13 18:43:37 EDT	2021-05-13	18:43:37	-0400	815952318487298048	drnealdunnfl2	Dr. Neal Dunn		#Israel is right to defend itself. Hamas is a terrorist org that is motivated by destruction &amp; hate. Israel can't stand by &amp; watch their civilians be killed, nor should they be expected to. The US must continue to support our long-standing ally against these Hamas attacks. #FL02  https://t.co/dJL8jwlhut	en	[]	[]	['https://pbs.twimg.com/media/E1TV_LMWEAMZzrb.jpg']	44	21	65	['israel', 'fl02']	[]	https://twitter.com/DrNealDunnFL2/status/1392973836384079877	False		1	https://pbs.twimg.com/media/E1TV_LMWEAMZzrb.jpg							[]				
1392290563936985096	1392290563936985096	2021-05-11 21:28:32 EDT	2021-05-11	21:28:32	-0400	815952318487298048	drnealdunnfl2	Dr. Neal Dunn		I am watching this situation closely and I've been assured that Colonial Pipeline will be back up in a few days. For now, it's important to remain calm and only purchase gas when you need to. Please do not hoard gas. #FL02  https://t.co/SFb83vKlFV	en	[]	['https://weartv.com/news/local/florida-gov-desantis-declares-state-of-emergency-due-to-colonial-pipeline-shutdown?fbclid=IwAR207iySnjSeY-lOdWbzzvrQbVqFsYMjUTLwTVvSW_17R3SSZDXcKA-re-A']	[]	8	5	10	['fl02']	[]	https://twitter.com/DrNealDunnFL2/status/1392290563936985096	False		0								[]				
1391445509659889665	1391445509659889665	2021-05-09 13:30:35 EDT	2021-05-09	13:30:35	-0400	815952318487298048	drnealdunnfl2	Dr. Neal Dunn		Happy #MothersDay to all of those celebrating today!  It takes a truly special individual to take on motherhood. The job is far from easy. Thank you to all of the selfless and loving mothers out there! #FL02  https://t.co/3Qw3MhKXqO	en	[]	[]	['https://pbs.twimg.com/media/E09oUIWXMAA4P3A.jpg']	2	1	7	['mothersday', 'fl02']	[]	https://twitter.com/DrNealDunnFL2/status/1391445509659889665	False		1	https://pbs.twimg.com/media/E09oUIWXMAA4P3A.jpg							[]				
1388182332461535239	1388182332461535239	2021-04-30 13:23:53 EDT	2021-04-30	13:23:53	-0400	815952318487298048	drnealdunnfl2	Dr. Neal Dunn		May is Mental Health Awareness Month. Check out my video below for information on where to get the support you or a loved one may need. #FL02 #itsgonnabemay #MentalHealthMatters  https://t.co/aLFUBsqE3t	en	[]	[]	[]	7	6	9	['fl02', 'itsgonnabemay', 'mentalhealthmatters']	[]	https://twitter.com/DrNealDunnFL2/status/1388182332461535239	False		1	https://pbs.twimg.com/ext_tw_video_thumb/1388182057050939395/pu/img/niisdsucQJshRcGg.jpg							[]				
1387870702645268482	1387870702645268482	2021-04-29 16:45:35 EDT	2021-04-29	16:45:35	-0400	815952318487298048	drnealdunnfl2	Dr. Neal Dunn		For those who missed it, @SenatorTimScott gave an outstanding &amp; impactful speech last night. Here's the link if you would like to watch -  https://t.co/4k9aIVAOdc #FL02 #JointAddress	en	[{'screen_name': 'senatortimscott', 'name': 'tim scott', 'id': '217543151'}]	['https://www.c-span.org/video/?511326-1/senator-tim-scott-delivers-republican-response']	[]	6	1	3	['fl02', 'jointaddress']	[]	https://twitter.com/DrNealDunnFL2/status/1387870702645268482	False	https://twitter.com/SenatorTimScott/status/1387597260628844563	0								[]				
1387844563985965056	1387844563985965056	2021-04-29 15:01:43 EDT	2021-04-29	15:01:43	-0400	815952318487298048	drnealdunnfl2	Dr. Neal Dunn		Welcome back, @RepDanCrenshaw! Glad to see you're on the mend!	en	[{'screen_name': 'repdancrenshaw', 'name': 'rep. dan crenshaw', 'id': '1080894931311431682'}]	[]	[]	1	1	4	[]	[]	https://twitter.com/DrNealDunnFL2/status/1387844563985965056	False	https://twitter.com/HouseCommerce/status/1387810753441411078	0								[]				
1387600645541306372	1387600645541306372	2021-04-28 22:52:28 EDT	2021-04-28	22:52:28	-0400	815952318487298048	drnealdunnfl2	Dr. Neal Dunn		President Biden’s first 100 days in office were purely focused on pushing the Left’s radical agenda.   Read my FULL statement here:  https://t.co/dOxuYOJIzz #FL02 #JointSession	en	[]	['https://dunn.house.gov/press-releases?ID=68803C20-A4DC-4866-A6D4-9CE9491CDCDE']	[]	14	2	4	['fl02', 'jointsession']	[]	https://twitter.com/DrNealDunnFL2/status/1387600645541306372	False		0								[]				
1387585069246730240	1387585069246730240	2021-04-28 21:50:35 EDT	2021-04-28	21:50:35	-0400	815952318487298048	drnealdunnfl2	Dr. Neal Dunn		Berg Pipe in Panama City, FL was forced to lay off, furlough, or reduce the hours of over 100 employees as a result of President Joe Biden’s short-sighted decision to revoke the permit for construction of the Keystone XL oil pipeline. #FL02 #JointSession	en	[]	[]	[]	15	4	12	['fl02', 'jointsession']	[]	https://twitter.com/DrNealDunnFL2/status/1387585069246730240	False		0								[]				
1387582521232265216	1387582521232265216	2021-04-28 21:40:27 EDT	2021-04-28	21:40:27	-0400	815952318487298048	drnealdunnfl2	Dr. Neal Dunn		Companies and workers in #FL02 were affected, as well.	en	[]	[]	[]	5	0	8	['fl02']	[]	https://twitter.com/DrNealDunnFL2/status/1387582521232265216	False	https://twitter.com/RepArmstrongND/status/1387579533394644994	0								[]				
1387449635745193984	1387449635745193984	2021-04-28 12:52:25 EDT	2021-04-28	12:52:25	-0400	815952318487298048	drnealdunnfl2	Dr. Neal Dunn		Whether you're a medical professional, a scientist, a first responder, a teacher, a caregiver, or an essential employee, THANK YOU! I'm incredibly grateful for all you've done throughout this pandemic. #NationalSuperheroDay #FL02  https://t.co/1DYUbpxNaB	en	[]	[]	['https://pbs.twimg.com/media/E0E1txxXoAU8Syq.jpg']	4	2	8	['nationalsuperheroday', 'fl02']	[]	https://twitter.com/DrNealDunnFL2/status/1387449635745193984	False		1	https://pbs.twimg.com/media/E0E1txxXoAU8Syq.jpg							[]				
1385670325015400455	1385670325015400455	2021-04-23 15:02:04 EDT	2021-04-23	15:02:04	-0400	815952318487298048	drnealdunnfl2	Dr. Neal Dunn		April is Stress Management Month. Check out my video below to learn some helpful tips to help you manage stress. #FL02  https://t.co/KrZbypy3La	en	[]	[]	[]	4	1	1	['fl02']	[]	https://twitter.com/DrNealDunnFL2/status/1385670325015400455	False		1	https://pbs.twimg.com/ext_tw_video_thumb/1385670116570972160/pu/img/YN5cH8xRyu0qk7n9.jpg							[]				
1385271629169713155	1385271629169713155	2021-04-22 12:37:48 EDT	2021-04-22	12:37:48	-0400	815952318487298048	drnealdunnfl2	Dr. Neal Dunn		The Founding Fathers intended for D.C. to be a city independent of any one state. This is just another unconstitutional power grab by the Democrats to help them enact radical policies.#FL02  https://t.co/wPjCPORQ11	en	[]	[]	['https://pbs.twimg.com/media/Ezl3tfxWUAQAMOv.jpg']	13	2	14	['fl02']	[]	https://twitter.com/DrNealDunnFL2/status/1385271629169713155	False		1	https://pbs.twimg.com/media/Ezl3tfxWUAQAMOv.jpg							[]				
1384637859152465923	1384637859152465923	2021-04-20 18:39:25 EDT	2021-04-20	18:39:25	-0400	815952318487298048	drnealdunnfl2	Dr. Neal Dunn		Today, justice was served. Derek Chauvin broke the law, and now, he is being held accountable for his actions. I believe the jury made the right decision based on the evidence presented.   Read my FULL statement here:  https://t.co/8Wvsy4XdpD #FL02	en	[]	['https://dunn.house.gov/press-releases?id=C8E19E1D-06BE-46CA-9C0B-4FA941EB26E1']	[]	2	5	12	['fl02']	[]	https://twitter.com/DrNealDunnFL2/status/1384637859152465923	False		0								[]				
1383916458997030920	1383916458997030920	2021-04-18 18:52:50 EDT	2021-04-18	18:52:50	-0400	815952318487298048	drnealdunnfl2	Dr. Neal Dunn		After Hurricane Michael, lineworkers from across the country worked around the clock to restore power to communities across #FL02. I'm grateful for each &amp; every one of them. Thank you! #thankalineworker #thankalineman	en	[]	[]	[]	0	4	8	['fl02', 'thankalineworker', 'thankalineman']	[]	https://twitter.com/DrNealDunnFL2/status/1383916458997030920	False	https://twitter.com/FLDFS/status/1383759202053591045	0								[]				
1383152407694180356	1383152407694180356	2021-04-16 16:16:46 EDT	2021-04-16	16:16:46	-0400	815952318487298048	drnealdunnfl2	Dr. Neal Dunn		I've known @GwenGraham for a number of years and know she and her family have long been passionate about education. President Biden's nomination is well-considered and I know she will do a great job putting the education of the nation's children first. #FL02	en	[{'screen_name': 'gwengraham', 'name': 'gwen graham', 'id': '1283359081'}]	[]	[]	1	3	18	['fl02']	[]	https://twitter.com/DrNealDunnFL2/status/1383152407694180356	False	https://twitter.com/TDOnline/status/1383121816672079878	0								[]				
1383133336835608577	1383133336835608577	2021-04-16 15:00:59 EDT	2021-04-16	15:00:59	-0400	815952318487298048	drnealdunnfl2	Dr. Neal Dunn		This past week, the @EnergyCommerce's Subcommittee on Health met to discuss the rise of Fentanyl. Just a very small amount of this deadly drug is enough to kill thousands.   Check out my video below for more about the hearing. #FL02 @GOPDoctors @HouseCommerce  https://t.co/uwsuUmvM2h	en	[{'screen_name': 'energycommerce', 'name': 'energy and commerce committee', 'id': '30929600'}, {'screen_name': 'gopdoctors', 'name': 'gop doctors caucus', 'id': '1358501532090703874'}, {'screen_name': 'housecommerce', 'name': 'energy & commerce gop', 'id': '114756202'}]	[]	[]	2	5	9	['fl02']	[]	https://twitter.com/DrNealDunnFL2/status/1383133336835608577	False		1	https://pbs.twimg.com/ext_tw_video_thumb/1383132965882974216/pu/img/pV2iXchnTaTvyRSP.jpg							[]				
1382731096249540608	1382731096249540608	2021-04-15 12:22:37 EDT	2021-04-15	12:22:37	-0400	815952318487298048	drnealdunnfl2	Dr. Neal Dunn		As a father, grandfather, and doctor, I am proud to support and cosponsor the Born-Alive Abortion Survivors Protection Act. Read my full statement here:  https://t.co/1C4XDUIvZp #FL02 #prolife  https://t.co/KE6RpEBUYD	en	[]	['https://dunn.house.gov/press-releases?ID=8826403B-2679-4442-B5BE-F5ED4995BA7D']	['https://pbs.twimg.com/media/EzByQwtWgAMmljB.jpg']	5	1	3	['fl02', 'prolife']	[]	https://twitter.com/DrNealDunnFL2/status/1382731096249540608	False		1	https://pbs.twimg.com/media/EzByQwtWgAMmljB.jpg							[]				
1382005143038787588	1382005143038787588	2021-04-13 12:17:57 EDT	2021-04-13	12:17:57	-0400	815952318487298048	drnealdunnfl2	Dr. Neal Dunn		"Today, Officer William ""Billy"" Evans, who was tragically killed on April 2nd, lies in the Capitol Rotunda as we honor him for his dedication to his country. Please keep Officer Evans' family &amp; the Capitol PD in your prayers. It's been a difficult few months for all of them. #FL02  https://t.co/OeXHNa2ijZ"	en	[]	[]	['https://pbs.twimg.com/media/Ey3dS0PXMAQrLGh.jpg']	6	4	3	['fl02']	[]	https://twitter.com/DrNealDunnFL2/status/1382005143038787588	False		1	https://pbs.twimg.com/media/Ey3dS0PXMAQrLGh.jpg							[]				
1381650732693225473	1381650732693225473	2021-04-12 12:49:39 EDT	2021-04-12	12:49:39	-0400	815952318487298048	drnealdunnfl2	Dr. Neal Dunn		It's that time of year again! My office is now accepting submissions for the 2021 Congressional Art Competition.  Click here for more about the rules and how to submit:  https://t.co/NMYj89iWqv #FL02  https://t.co/hUnPhIQ3Ka	en	[]	['https://dunn.house.gov/art-competition']	['https://pbs.twimg.com/media/EyycAmBWUAATOhp.jpg']	0	1	3	['fl02']	[]	https://twitter.com/DrNealDunnFL2/status/1381650732693225473	False		1	https://pbs.twimg.com/media/EyycAmBWUAATOhp.jpg							[]				
1381031954016047107	1381031954016047107	2021-04-10 19:50:50 EDT	2021-04-10	19:50:50	-0400	815952318487298048	drnealdunnfl2	Dr. Neal Dunn		Wishing my friend &amp; colleague, @RepDanCrenshaw, a speedy recovery!   Rep. Crenshaw is no stranger to overcoming obstacles and I have no doubt that he’ll get through this. That said, please keep him in your prayers.	en	[{'screen_name': 'repdancrenshaw', 'name': 'rep. dan crenshaw', 'id': '1080894931311431682'}]	[]	[]	2	3	6	[]	[]	https://twitter.com/DrNealDunnFL2/status/1381031954016047107	False	https://twitter.com/DanCrenshawTX/status/1380900479786496009	0								[]				
1379548536354844673	1379548536354844673	2021-04-06 17:36:16 EDT	2021-04-06	17:36:16	-0400	815952318487298048	drnealdunnfl2	Dr. Neal Dunn		I’m saddened by the passing of my colleague @RepHastingsFL. Rep. Hastings was a dedicated public servant with a deep love for the state of Florida. He will be missed. My prayers are with his family and staff at this time. #FL02 #FL20	en	[{'screen_name': 'rephastingsfl', 'name': 'alcee l. hastings', 'id': '2433737761'}]	[]	[]	1	3	5	['fl02', 'fl20']	[]	https://twitter.com/DrNealDunnFL2/status/1379548536354844673	False		0								[]				
1378779834235621378	1378779834235621378	2021-04-04 14:41:43 EDT	2021-04-04	14:41:43	-0400	815952318487298048	drnealdunnfl2	Dr. Neal Dunn		Wishing you all a happy &amp; blessed #Easter! And to my friends celebrating the final day of Passover, Chag Sameach! #FL02  https://t.co/qiOKoG1n60	en	[]	[]	['https://pbs.twimg.com/media/EyJnyvlWUAEAsbf.jpg']	1	2	10	['easter', 'fl02']	[]	https://twitter.com/DrNealDunnFL2/status/1378779834235621378	False		1	https://pbs.twimg.com/media/EyJnyvlWUAEAsbf.jpg							[]				
1378104681344421890	1378104681344421890	2021-04-02 17:58:54 EDT	2021-04-02	17:58:54	-0400	815952318487298048	drnealdunnfl2	Dr. Neal Dunn		Happy Friday! Beginning Monday, April 5th, Floridians 18  &amp; over (16 &amp; over for the Pfizer vaccine) will be eligible for the Moderna &amp; Johnson &amp; Johnson #COVID19 vaccines.  You can find a vaccine location here:  https://t.co/WvHmk48tEY #FL02  https://t.co/tAuvayaFWY	en	[]	['https://floridahealthcovid19.gov/vaccines/vaccine-locator/']	[]	2	2	2	['covid19', 'fl02']	[]	https://twitter.com/DrNealDunnFL2/status/1378104681344421890	False		1	https://pbs.twimg.com/ext_tw_video_thumb/1378104000583766018/pu/img/YY3RGy5-RTlB6KYK.jpg							[]				
1378045521227579395	1378045521227579395	2021-04-02 14:03:49 EDT	2021-04-02	14:03:49	-0400	815952318487298048	drnealdunnfl2	Dr. Neal Dunn		Please join me in praying for the safety of Capitol PD &amp; the Guardsmen protecting our Capitol, as well as everyone on campus today. We do not have all of the details at this time, but I am incredibly thankful for these brave men &amp; women. #CapitolHill #FL02	en	[]	[]	[]	3	1	5	['capitolhill', 'fl02']	[]	https://twitter.com/DrNealDunnFL2/status/1378045521227579395	False		0								[]				
1375861782594654210	1375861782594654210	2021-03-27 13:26:25 EDT	2021-03-27	13:26:25	-0400	815952318487298048	drnealdunnfl2	Dr. Neal Dunn		May all of our Jewish friends across the world have a blessed #Passover. #FL02  https://t.co/2f98TvCk26	en	[]	[]	['https://pbs.twimg.com/media/ExgK_slWEAIf_t-.jpg']	0	1	4	['passover', 'fl02']	[]	https://twitter.com/DrNealDunnFL2/status/1375861782594654210	False		1	https://pbs.twimg.com/media/ExgK_slWEAIf_t-.jpg							[]				
1375647707197493248	1375647707197493248	2021-03-26 23:15:46 EDT	2021-03-26	23:15:46	-0400	815952318487298048	drnealdunnfl2	Dr. Neal Dunn		Happy Friday! One of my goals is to help increase your access to health care. Watch the video below to find out more. #FL02 #telehealth  https://t.co/cI12Q52OSK	en	[]	[]	[]	5	2	3	['fl02', 'telehealth']	[]	https://twitter.com/DrNealDunnFL2/status/1375647707197493248	False		1	https://pbs.twimg.com/ext_tw_video_thumb/1375646879141269504/pu/img/GRX9UvIXMO8gzjQ_.jpg							[]				
1375182656409890820	1375182656409890820	2021-03-25 16:27:49 EDT	2021-03-25	16:27:49	-0400	815952318487298048	drnealdunnfl2	Dr. Neal Dunn		In case you missed it -	en	[]	[]	[]	1	3	7	[]	[]	https://twitter.com/DrNealDunnFL2/status/1375182656409890820	False	https://twitter.com/matthewstoller/status/1375172856909299714	0								[]				
1375097540186628101	1375097540186628101	2021-03-25 10:49:36 EDT	2021-03-25	10:49:36	-0400	815952318487298048	drnealdunnfl2	Dr. Neal Dunn		This is outstanding news! #FL02 #COVID19	en	[]	[]	[]	0	3	6	['fl02', 'covid19']	[]	https://twitter.com/DrNealDunnFL2/status/1375097540186628101	False	https://twitter.com/GovRonDeSantis/status/1375071335076990987	0								[]				
1374482968622686213	1374482968622686213	2021-03-23 18:07:31 EDT	2021-03-23	18:07:31	-0400	815952318487298048	drnealdunnfl2	Dr. Neal Dunn		Thank you to all of the farmers and ranchers in Florida's Second Congressional District who work hard to provide for our communities and our nation! #AgDay #NationalAgricultureDay #FL02  https://t.co/YtSjgDsi3A	en	[]	[]	['https://pbs.twimg.com/media/ExMk-O1VEAsCiKp.jpg']	3	4	9	['agday', 'nationalagricultureday', 'fl02']	[]	https://twitter.com/DrNealDunnFL2/status/1374482968622686213	False		1	https://pbs.twimg.com/media/ExMk-O1VEAsCiKp.jpg							[]				
1372951815906541575	1372951815906541575	2021-03-19 12:43:15 EDT	2021-03-19	12:43:15	-0400	815952318487298048	drnealdunnfl2	Dr. Neal Dunn		Happy Friday! This week, I had the opportunity to speak with Dr. Fauci during a Subcommittee on Oversight and Investigations hearing. Watch my video below to learn more. #FL02 #COVID19 @HouseCommerce  https://t.co/Kz9mF7PFwr	en	[{'screen_name': 'housecommerce', 'name': 'energy & commerce gop', 'id': '114756202'}]	[]	[]	7	3	1	['fl02', 'covid19']	[]	https://twitter.com/DrNealDunnFL2/status/1372951815906541575	False		1	https://pbs.twimg.com/ext_tw_video_thumb/1372951543096430611/pu/img/SAZn8rMocd0J9x7M.jpg							[]				
1372705948045819904	1372705946858881024	2021-03-18 20:26:16 EDT	2021-03-18	20:26:16	-0400	815952318487298048	drnealdunnfl2	Dr. Neal Dunn		Farmers need long-term wage rate relief &amp; accessibility to workers in the H-2A program to compete internationally. This bill fails to meet those needs. If we want the agriculture industry to thrive, Congress must put our farmers ahead of the radical left. (2.2) #FL02	en	[]	[]	[]	3	1	1	['fl02']	[]	https://twitter.com/DrNealDunnFL2/status/1372705948045819904	False		0								[]				
1372705946858881024	1372705946858881024	2021-03-18 20:26:16 EDT	2021-03-18	20:26:16	-0400	815952318487298048	drnealdunnfl2	Dr. Neal Dunn		Instead of supporting our nation’s farmers with commonsense reform, Speaker Pelosi and House Democrats are pushing mass amnesty to over one million illegal immigrants. (1/2) #FL02	en	[]	[]	[]	7	4	4	['fl02']	[]	https://twitter.com/DrNealDunnFL2/status/1372705946858881024	False		0								[]				
1372650754041860100	1372602436410560514	2021-03-18 16:46:57 EDT	2021-03-18	16:46:57	-0400	815952318487298048	drnealdunnfl2	Dr. Neal Dunn		@FLASCO_ORG @FDA @SenRickScott Thank you for bringing this to my attention! Early detection is the key to defeating this deadly adversary.	en	[]	[]	[]	0	0	1	[]	[]	https://twitter.com/DrNealDunnFL2/status/1372650754041860100	False		0								[{'screen_name': 'FLASCO_ORG', 'name': 'FLASCO', 'id': '3664556061'}, {'screen_name': 'FDA', 'name': 'FDA', 'id': '1255526396807561217'}, {'screen_name': 'SenRickScott', 'name': 'Rick Scott', 'id': '131546062'}]				
1372309826852827137	1372309824600469507	2021-03-17 18:12:13 EDT	2021-03-17	18:12:13	-0400	815952318487298048	drnealdunnfl2	Dr. Neal Dunn		This is why I am proud to co-sponsor @RepStefanik's Violence Against Women Extension Act of 2021, which provides a clean extension of funding for Violence Against Women Act programs for the upcoming fiscal year. #FL02	en	[{'screen_name': 'repstefanik', 'name': 'rep. elise stefanik', 'id': '2962813893'}]	[]	[]	3	1	1	['fl02']	[]	https://twitter.com/DrNealDunnFL2/status/1372309826852827137	False		0								[]				
1372309825812582410	1372309824600469507	2021-03-17 18:12:13 EDT	2021-03-17	18:12:13	-0400	815952318487298048	drnealdunnfl2	Dr. Neal Dunn		I support reauthorizing programs &amp; life-saving resources to help women fight back. However, I cannot support measures that put their well-being at risk. (2/2) #FL02	en	[]	[]	[]	2	0	1	['fl02']	[]	https://twitter.com/DrNealDunnFL2/status/1372309825812582410	False		0								[]				
1372309824600469507	1372309824600469507	2021-03-17 18:12:13 EDT	2021-03-17	18:12:13	-0400	815952318487298048	drnealdunnfl2	Dr. Neal Dunn		House Democrats have made clear that their priority is not ensuring the safety of our wives, sisters, &amp; daughters; their priority is pushing their radical agenda. (1/2) #FL02	en	[]	[]	[]	8	1	3	['fl02']	[]	https://twitter.com/DrNealDunnFL2/status/1372309824600469507	False		0								[]				
1372271002563055625	1372271002563055625	2021-03-17 15:37:57 EDT	2021-03-17	15:37:57	-0400	815952318487298048	drnealdunnfl2	Dr. Neal Dunn		Bay County is holding a 3-day, indoor vaccination event beginning Thursday. Click here for more information --  https://t.co/MfbMK79iYZ #FL02 #COVID19 #vaccine	en	[]	['https://www.wjhg.com/2021/03/17/bay-county-to-host-single-shot-vaccine-event/?utm_source=facebook&utm_medium=social&utm_campaign=snd&utm_content=wjhg&fbclid=IwAR2KhksCzcvw27v2xweAOtPVkKwZcGUIBhxc9D6IW4Qie9DDEnh_7gan-ZE']	[]	1	0	0	['fl02', 'covid19', 'vaccine']	[]	https://twitter.com/DrNealDunnFL2/status/1372271002563055625	False		0								[]				
1372218346922508288	1372218346922508288	2021-03-17 12:08:43 EDT	2021-03-17	12:08:43	-0400	815952318487298048	drnealdunnfl2	Dr. Neal Dunn		We have severe weather hitting a portion of #FL02 today. Please use caution and have a plan in place in case you need to seek shelter.	en	[]	[]	[]	0	0	1	['fl02']	[]	https://twitter.com/DrNealDunnFL2/status/1372218346922508288	False	https://twitter.com/NWSTallahassee/status/1372139205292404737	0								[]				
