id	conversation_id	created_at	date	time	timezone	user_id	username	name	place	tweet	language	mentions	urls	photos	replies_count	retweets_count	likes_count	hashtags	cashtags	link	retweet	quote_url	video	thumbnail	near	geo	source	user_rt_id	user_rt	retweet_id	reply_to	retweet_date	translate	trans_src	trans_dest
1214921638250242055	1214921633288183809	2020-01-08 09:47:45 EST	2020-01-08	09:47:45	-0400	815952318487298048	drnealdunnfl2	Dr. Neal Dunn		In January 2019 @baymedicalctr reopened the hospital with 75 beds following the damages from Hurricane Michael. They have since added an additional 144 beds to bring their total beds to 219, which is full capacity. 2/2  https://t.co/8hlAVOIHtA	en	[{'screen_name': 'baymedicalctr', 'name': 'ascension sacred heart bay', 'id': '167493748'}]	[]	['https://pbs.twimg.com/media/ENxEylOX0AEZV1N.jpg']	0	1	1	[]	[]	https://twitter.com/DrNealDunnFL2/status/1214921638250242055	False		1	https://pbs.twimg.com/media/ENxEylOX0AEZV1N.jpg							[]				
1214921633288183809	1214921633288183809	2020-01-08 09:47:44 EST	2020-01-08	09:47:44	-0400	815952318487298048	drnealdunnfl2	Dr. Neal Dunn		On Monday, I toured @baymedicalctr  in Panama City with the CEO, Heath Evans to see all of the progress that the hospital has made recovering from Hurricane Michael. 1/2  https://t.co/Wg8PRa97Qq	en	[{'screen_name': 'baymedicalctr', 'name': 'ascension sacred heart bay', 'id': '167493748'}]	[]	['https://pbs.twimg.com/media/ENxEyK_W4AE-cXr.jpg']	1	2	5	[]	[]	https://twitter.com/DrNealDunnFL2/status/1214921633288183809	False		1	https://pbs.twimg.com/media/ENxEyK_W4AE-cXr.jpg							[]				
1214732775020015617	1214732775020015617	2020-01-07 21:17:16 EST	2020-01-07	21:17:16	-0400	815952318487298048	drnealdunnfl2	Dr. Neal Dunn		We are monitoring the situation in Iraq tonight as new information comes to light. Please keep our men and women in uniform in your prayers. We have many heroes who are currently keeping us safe while in harms way in the Middle East.	en	[]	[]	[]	1	10	25	[]	[]	https://twitter.com/DrNealDunnFL2/status/1214732775020015617	False		0								[]				
1214202475034677248	1214202475034677248	2020-01-06 10:10:03 EST	2020-01-06	10:10:03	-0400	815952318487298048	drnealdunnfl2	Dr. Neal Dunn		I was honored to meet w/ Col Travis Leighton &amp; Col Brian Laidlaw at @TeamTyndall last week. As we enter 2020 w/ full funding for the reconstruction of the base, I was excited to hear about future operations, news of approval for additional job hires &amp; plans to restore housing.  https://t.co/rL4rWFtcOe	en	[{'screen_name': 'teamtyndall', 'name': 'tyndall afb', 'id': '781921149508804608'}]	[]	['https://pbs.twimg.com/media/ENm2tZ6U0AEI3sK.jpg', 'https://pbs.twimg.com/media/ENm2tZ7UcAEned7.jpg', 'https://pbs.twimg.com/media/ENm2tZ6U4AAtVJm.jpg', 'https://pbs.twimg.com/media/ENm2tZ9VAAU09Dw.jpg']	0	3	3	[]	[]	https://twitter.com/DrNealDunnFL2/status/1214202475034677248	False		1	https://pbs.twimg.com/media/ENm2tZ6U0AEI3sK.jpg							[]				
1213157551522680838	1213157549937233925	2020-01-03 12:57:54 EST	2020-01-03	12:57:54	-0400	815952318487298048	drnealdunnfl2	Dr. Neal Dunn		We will continue to work with @realDonaldTrump to ensure our military has the tools to root out terrorism both at home and abroad.	en	[{'screen_name': 'realdonaldtrump', 'name': 'donald j. trump', 'id': '25073877'}]	[]	[]	0	1	6	[]	[]	https://twitter.com/DrNealDunnFL2/status/1213157551522680838	False		0								[]				
1213157550717390848	1213157549937233925	2020-01-03 12:57:54 EST	2020-01-03	12:57:54	-0400	815952318487298048	drnealdunnfl2	Dr. Neal Dunn		The strikes led to the death of Qassem Soleimani, the known terrorist leader of the Islamic Revolutionary Guard Corps-Quds Force. Soleimani was responsible for the deaths of hundreds of Americans and thousands of Syrians. His reign of terror is now over.	en	[]	[]	[]	1	0	2	[]	[]	https://twitter.com/DrNealDunnFL2/status/1213157550717390848	False		0								[]				
1213157549937233925	1213157549937233925	2020-01-03 12:57:53 EST	2020-01-03	12:57:53	-0400	815952318487298048	drnealdunnfl2	Dr. Neal Dunn		@realDonaldTrump's  decisive actions in the Middle East sent a clear message to the world that the United States will not let attacks against our country go unpunished.	en	[]	[]	[]	3	3	5	[]	[]	https://twitter.com/DrNealDunnFL2/status/1213157549937233925	False		0								[]				
1212840253100302350	1212840253100302350	2020-01-02 15:57:04 EST	2020-01-02	15:57:04	-0400	815952318487298048	drnealdunnfl2	Dr. Neal Dunn		Congratulations to Jake and Tiffany Sache on being awarded the State Young Farmer and Rancher Achievement in Agriculture by the Florida Farm Bureau.  https://t.co/Rq5tp5gOMu	en	[]	[]	['https://pbs.twimg.com/media/ENTfyDYWoAUKHc_.png']	2	2	4	[]	[]	https://twitter.com/DrNealDunnFL2/status/1212840253100302350	False		1	https://pbs.twimg.com/media/ENTfyDYWoAUKHc_.png							[]				
1211659089798934528	1211659089798934528	2019-12-30 09:43:33 EST	2019-12-30	09:43:33	-0400	815952318487298048	drnealdunnfl2	Dr. Neal Dunn		Recently, I honored the life of Mexico Beach City Manager Andy Anderson. Just months ago, Mr. Anderson &amp; I met to discuss the rebuild of Mexico Beach following Hurricane Michael. He was dedicated &amp; reflected the resiliency of Mexico Beach. It was an honor to know &amp; work with him.  https://t.co/q1WKky2t7g	en	[]	[]	['https://pbs.twimg.com/media/ENCtf_XXYAQQxPS.jpg', 'https://pbs.twimg.com/media/ENCtf_aXkAAYuzr.jpg']	2	3	10	[]	[]	https://twitter.com/DrNealDunnFL2/status/1211659089798934528	False		1	https://pbs.twimg.com/media/ENCtf_XXYAQQxPS.jpg							[]				
1208915524740091905	1208915524740091905	2019-12-22 20:01:36 EST	2019-12-22	20:01:36	-0400	815952318487298048	drnealdunnfl2	Dr. Neal Dunn		Happy #Hanukkah to all those celebrating Florida’s Second District!  https://t.co/uhdVNJzvuO	en	[]	[]	['https://pbs.twimg.com/media/EMbuQsmWoAAd1l4.jpg']	2	4	7	['hanukkah']	[]	https://twitter.com/DrNealDunnFL2/status/1208915524740091905	False		1	https://pbs.twimg.com/media/EMbuQsmWoAAd1l4.jpg							[]				
1208037668975730688	1208037668975730688	2019-12-20 09:53:19 EST	2019-12-20	09:53:19	-0400	815952318487298048	drnealdunnfl2	Dr. Neal Dunn		This week, I honored the life of James Montgomery on the House floor. Mr. Mont will be my missed by his entire community, but his legacy and the impact he has made will never be forgotten.  https://t.co/i4j1duPvc4	en	[]	[]	[]	1	2	2	[]	[]	https://twitter.com/DrNealDunnFL2/status/1208037668975730688	False		1	https://pbs.twimg.com/ext_tw_video_thumb/1208037499156779008/pu/img/R0jhKY0XLnT7AjXV.jpg							[]				
1207468082119229440	1207468082119229440	2019-12-18 20:09:59 EST	2019-12-18	20:09:59	-0400	815952318487298048	drnealdunnfl2	Dr. Neal Dunn		Heading to the House floor to vote against both articles of impeachment.  https://t.co/hnP6qWlLrX	en	[]	[]	[]	130	88	535	[]	[]	https://twitter.com/DrNealDunnFL2/status/1207468082119229440	False		1	https://pbs.twimg.com/ext_tw_video_thumb/1207468043309371392/pu/img/mfUIjza6wzOgtGxr.jpg							[]				
1207420755350302726	1207420755350302726	2019-12-18 17:01:55 EST	2019-12-18	17:01:55	-0400	815952318487298048	drnealdunnfl2	Dr. Neal Dunn		We were told this investigation was going to be bipartisan and transparent. Instead these proceedings were held in secret behind closed doors with no attempt at a fair hearing. All this was done deliberately in an effort to undo the results of the 2016 election.  https://t.co/MjDshkoddy	en	[]	[]	[]	20	10	20	[]	[]	https://twitter.com/DrNealDunnFL2/status/1207420755350302726	False		1	https://pbs.twimg.com/ext_tw_video_thumb/1207420561925820417/pu/img/OQcUS49h_9tt-e2z.jpg							[]				
1207334891031015425	1207334891031015425	2019-12-18 11:20:43 EST	2019-12-18	11:20:43	-0400	815952318487298048	drnealdunnfl2	Dr. Neal Dunn		The shameful vote today to impeach @POTUS @realDonaldTrump  will be a lasting stain on the House.	en	[{'screen_name': 'potus', 'name': 'president biden', 'id': '1349149096909668363'}, {'screen_name': 'realdonaldtrump', 'name': 'donald j. trump', 'id': '25073877'}]	[]	[]	175	118	467	[]	[]	https://twitter.com/DrNealDunnFL2/status/1207334891031015425	False		0								[]				
1207036784670052352	1207036782266789890	2019-12-17 15:36:09 EST	2019-12-17	15:36:09	-0400	815952318487298048	drnealdunnfl2	Dr. Neal Dunn		We still have a lot of rebuilding to do in the Panhandle, but the passage of this tax relief is an important part of the process.	en	[]	[]	[]	1	0	0	[]	[]	https://twitter.com/DrNealDunnFL2/status/1207036784670052352	False		0								[]				
1207036783558643714	1207036782266789890	2019-12-17 15:36:09 EST	2019-12-17	15:36:09	-0400	815952318487298048	drnealdunnfl2	Dr. Neal Dunn		This important legislation allows disaster victims to access money they have saved over the years without facing penalties and temporarily suspends limitations on charitable contributions to our area that are associated with hurricane relief.	en	[]	[]	[]	1	1	1	[]	[]	https://twitter.com/DrNealDunnFL2/status/1207036783558643714	False		0								[]				
1207036782266789890	1207036782266789890	2019-12-17 15:36:09 EST	2019-12-17	15:36:09	-0400	815952318487298048	drnealdunnfl2	Dr. Neal Dunn		The passage of these crucial tax extenders is a big win for Hurricane Michael victims who are still picking up the pieces more than a year later. We finally got routine disaster tax relief across the finish line.   https://t.co/UNAy0rVhdJ	en	[]	['https://dunn.house.gov/press-releases?id=C6FD1B7B-F5CF-4C21-B0AC-CE4B7C53E7F6']	[]	3	2	7	[]	[]	https://twitter.com/DrNealDunnFL2/status/1207036782266789890	False		0								[]				
1205317400549363712	1205317398146027520	2019-12-12 21:43:56 EST	2019-12-12	21:43:56	-0400	815952318487298048	drnealdunnfl2	Dr. Neal Dunn		I trust that the Supreme Court will stand by their previous acknowledgment and ensure Florida gets its fair share of water.	en	[]	[]	[]	5	0	4	[]	[]	https://twitter.com/DrNealDunnFL2/status/1205317400549363712	False		0								[]				
1205317399496577024	1205317398146027520	2019-12-12 21:43:56 EST	2019-12-12	21:43:56	-0400	815952318487298048	drnealdunnfl2	Dr. Neal Dunn		Last year, the Supreme Court recognized that Florida has been harmed as a result of decreased water flow to the ACF River Basin. They established that Georgia’s unchecked and excessive water usage has harmed Florida and cost us jobs, particularly in our oyster industry.	en	[]	[]	[]	2	0	1	[]	[]	https://twitter.com/DrNealDunnFL2/status/1205317399496577024	False		0								[]				
1205317398146027520	1205317398146027520	2019-12-12 21:43:56 EST	2019-12-12	21:43:56	-0400	815952318487298048	drnealdunnfl2	Dr. Neal Dunn		Judge Kelly’s recommendation is very disappointing and completely ignores the decades of damage that Georgia’s water use has had on families and the ecosystem in Florida.    https://t.co/jTrOF10G8j	en	[]	['https://apnews.com/e666b246a5bdc5e059a280190efbdb80']	[]	2	3	2	[]	[]	https://twitter.com/DrNealDunnFL2/status/1205317398146027520	False		0								[]				
1205205268906348544	1205205268906348544	2019-12-12 14:18:22 EST	2019-12-12	14:18:22	-0400	815952318487298048	drnealdunnfl2	Dr. Neal Dunn		Just joined several of my colleagues in the House in a moment of silence to honor the lives lost in the terrible attack at Naval Air Station Pensacola last week. We continue to pray for the families and friends of the three sailors who were tragically killed.  https://t.co/weDALjAUmX	en	[]	[]	['https://pbs.twimg.com/media/ELm_zXwWoAIIzNR.png']	8	6	73	[]	[]	https://twitter.com/DrNealDunnFL2/status/1205205268906348544	False		1	https://pbs.twimg.com/media/ELm_zXwWoAIIzNR.png							[]				
1204928919364870150	1204928917288767489	2019-12-11 20:00:15 EST	2019-12-11	20:00:15	-0400	815952318487298048	drnealdunnfl2	Dr. Neal Dunn		Our men and women in uniform repeatedly suffer the consequences of a divided Congress and are forced to keep us safe with outdated equipment and technology. This important legislation works to reverse years of underfunding.	en	[]	[]	[]	1	1	1	[]	[]	https://twitter.com/DrNealDunnFL2/status/1204928919364870150	False		0								[]				
1204928918408646656	1204928917288767489	2019-12-11 20:00:15 EST	2019-12-11	20:00:15	-0400	815952318487298048	drnealdunnfl2	Dr. Neal Dunn		It also gives certainty to the Panhandle that Tyndall Air Force Base will be fully rebuilt and includes my legislation requiring the Secretary of Defense to provide a report to Congress on the future of Artificial Intelligence in DoD.	en	[]	[]	[]	2	1	1	[]	[]	https://twitter.com/DrNealDunnFL2/status/1204928918408646656	False		0								[]				
1204928917288767489	1204928917288767489	2019-12-11 20:00:15 EST	2019-12-11	20:00:15	-0400	815952318487298048	drnealdunnfl2	Dr. Neal Dunn		While the passage of this vital legislation to support our military is long overdue, I am pleased that we could get this done before Christmas.   https://t.co/8X7Zv1U2fb	en	[]	['https://dunn.house.gov/index.cfm?p=press-releases&id=E8B68089-7D7C-47CA-AB93-9CAFE851B918']	[]	2	4	5	[]	[]	https://twitter.com/DrNealDunnFL2/status/1204928917288767489	False		0								[]				
1204500248158187520	1204500225907404805	2019-12-10 15:36:52 EST	2019-12-10	15:36:52	-0400	815952318487298048	drnealdunnfl2	Dr. Neal Dunn		Jeff Jones, Azucena Gonzalez, Amber Thompson, Selena Perez, Courtney Anderson, Tobie Peterson, Taryn O'Hara, Kassidy High, Jake Wooley, and Tiffany Fields for sharing your gifts with us to admire. 3/3  https://t.co/QN9zGmHJ42	en	[]	[]	['https://pbs.twimg.com/media/ELc-lhmWwAAIOwE.jpg', 'https://pbs.twimg.com/media/ELc-ljCWwAE3Kr9.jpg', 'https://pbs.twimg.com/media/ELc-ljiXkAA-wmj.jpg', 'https://pbs.twimg.com/media/ELc-lkeWsAUaXTu.jpg']	0	0	1	[]	[]	https://twitter.com/DrNealDunnFL2/status/1204500248158187520	False		1	https://pbs.twimg.com/media/ELc-lhmWwAAIOwE.jpg							[]				
1204500236225396736	1204500225907404805	2019-12-10 15:36:49 EST	2019-12-10	15:36:49	-0400	815952318487298048	drnealdunnfl2	Dr. Neal Dunn		These students’ display is a testament to their special talent. Thank you to students James Howard, Karen Arreguin, Ava Forehand, Padyn Chaney, Kelsey Little, Paige Smith, Kaylee Medina, Addison Elliott, Alana Combs, Tori Lane, Christina Taylor, Lucy Jolicoeur, Kersten Dye, 2/3  https://t.co/A5M2GpuK4m	en	[]	[]	['https://pbs.twimg.com/media/ELc-k83X0AAs1Ao.jpg', 'https://pbs.twimg.com/media/ELc-k9rW4Ac9cNm.jpg', 'https://pbs.twimg.com/media/ELc-k_lWoAMTwSu.jpg', 'https://pbs.twimg.com/media/ELc-k-3W4AAJXFu.jpg']	1	0	0	[]	[]	https://twitter.com/DrNealDunnFL2/status/1204500236225396736	False		1	https://pbs.twimg.com/media/ELc-k83X0AAs1Ao.jpg							[]				
1204500225907404805	1204500225907404805	2019-12-10 15:36:47 EST	2019-12-10	15:36:47	-0400	815952318487298048	drnealdunnfl2	Dr. Neal Dunn		Congratulations to Suwannee High School for being recognized for the ornaments they decorated. Art students in Mrs. Pamela Williams' class carefully crafted the ornaments' designs &amp; the National Park Service chose them to be displayed on the Florida tree at the White House. 1/3  https://t.co/mRjJDJhYHM	en	[]	[]	['https://pbs.twimg.com/media/ELc-kISX0AEMerz.jpg', 'https://pbs.twimg.com/media/ELc-kISWoAMmiPf.jpg', 'https://pbs.twimg.com/media/ELc-kIUWsAIq8sg.jpg', 'https://pbs.twimg.com/media/ELc-kISXUAMeTXT.jpg']	3	3	4	[]	[]	https://twitter.com/DrNealDunnFL2/status/1204500225907404805	False		1	https://pbs.twimg.com/media/ELc-kISX0AEMerz.jpg							[]				
1203012693554343936	1203012692782583809	2019-12-06 13:05:51 EST	2019-12-06	13:05:51	-0400	815952318487298048	drnealdunnfl2	Dr. Neal Dunn		Thank you to our first responders, law enforcement, and the U.S. Navy for your quick response. Your bravery saved countless lives.	en	[]	[]	[]	0	2	4	[]	[]	https://twitter.com/DrNealDunnFL2/status/1203012693554343936	False		0								[]				
1203012692782583809	1203012692782583809	2019-12-06 13:05:51 EST	2019-12-06	13:05:51	-0400	815952318487298048	drnealdunnfl2	Dr. Neal Dunn		Today, the Naval Air Station Pensacola community experienced a tragic shooting. We are continuing to monitor the situation and we are praying for all who were affected by this tragedy. Violence of any kind is never acceptable.	en	[]	[]	[]	3	4	6	[]	[]	https://twitter.com/DrNealDunnFL2/status/1203012692782583809	False		0								[]				
1202287232318689284	1202287232318689284	2019-12-04 13:03:08 EST	2019-12-04	13:03:08	-0400	815952318487298048	drnealdunnfl2	Dr. Neal Dunn		It was an honor to join the @RedCross today &amp; send holiday cards to our service members. Many in our military miss spending the holidays with loved ones because they are fighting for our freedoms at home &amp; abroad. Thank you to all who work to keep us safe!  https://t.co/gxNtChOgnC	en	[{'screen_name': 'redcross', 'name': 'american red cross', 'id': '6519522'}]	[]	['https://pbs.twimg.com/media/EK9h2wZWkAETI-8.jpg', 'https://pbs.twimg.com/media/EK9h2wYWsAEE5Ex.jpg', 'https://pbs.twimg.com/media/EK9h2wcXkAAiqZx.jpg', 'https://pbs.twimg.com/media/EK9h2wVXsAEKDi2.jpg']	1	3	4	[]	[]	https://twitter.com/DrNealDunnFL2/status/1202287232318689284	False		1	https://pbs.twimg.com/media/EK9h2wZWkAETI-8.jpg							[]				
1200171060886474753	1200171059334565891	2019-11-28 16:54:13 EST	2019-11-28	16:54:13	-0400	815952318487298048	drnealdunnfl2	Dr. Neal Dunn		This Thanksgiving, Leah and I served meals at Tyndall Air Force Base. Thank you, Colonel Laidlaw, for the opportunity to express my sincere appreciation for our airmen and those who support the base.	en	[]	[]	[]	0	2	5	[]	[]	https://twitter.com/DrNealDunnFL2/status/1200171060886474753	False		0								[]				
1200171059334565891	1200171059334565891	2019-11-28 16:54:13 EST	2019-11-28	16:54:13	-0400	815952318487298048	drnealdunnfl2	Dr. Neal Dunn		Happy Thanksgiving! Thanksgiving is an opportunity to recognize and appreciate all that we hold dear. I am especially grateful for all of our troops as they have dedicated their lives to ensure our safety and the ability to enjoy our most basic freedoms.	en	[]	[]	[]	4	4	16	[]	[]	https://twitter.com/DrNealDunnFL2/status/1200171059334565891	False		0								[]				
1199718932711661568	1199718928467013634	2019-11-27 10:57:37 EST	2019-11-27	10:57:37	-0400	815952318487298048	drnealdunnfl2	Dr. Neal Dunn		We discussed the future of USAF &amp; USCG projects in the district &amp; challenges the two services expect in the coming years. We also discussed different ways we could do more to help mitigate future challenges. Thank you, Mr. Hyden &amp; Rear Admiral Schofield for a great discussion.	en	[]	[]	[]	2	0	1	[]	[]	https://twitter.com/DrNealDunnFL2/status/1199718932711661568	False		0								[]				
1199718928467013634	1199718928467013634	2019-11-27 10:57:36 EST	2019-11-27	10:57:36	-0400	815952318487298048	drnealdunnfl2	Dr. Neal Dunn		Our communities are still recovering from the devastation of Hurricane Michael. The Air Force &amp; Coast Guard face specific challenges when attempting to rebuild their bases. Last week, I hosted a roundtable with Mr. Brent Hyden with USAF &amp; Rear Admiral Doug Schofield with USCG.  https://t.co/JQYQmdRZUl	en	[]	[]	['https://pbs.twimg.com/media/EKZCAPjWwAANG-S.jpg']	2	2	2	[]	[]	https://twitter.com/DrNealDunnFL2/status/1199718928467013634	False		1	https://pbs.twimg.com/media/EKZCAPjWwAANG-S.jpg							[]				
1197505539388903424	1197505538650771460	2019-11-21 08:22:23 EST	2019-11-21	08:22:23	-0400	815952318487298048	drnealdunnfl2	Dr. Neal Dunn		I want to hear your thoughts on our health care system. Take my survey --&gt;  https://t.co/ATbNqHcWnU 2/2	en	[]	['https://dunn.house.gov/health-care-survey']	[]	2	1	1	[]	[]	https://twitter.com/DrNealDunnFL2/status/1197505539388903424	False		0								[]				
1197505538650771460	1197505538650771460	2019-11-21 08:22:23 EST	2019-11-21	08:22:23	-0400	815952318487298048	drnealdunnfl2	Dr. Neal Dunn		As a surgeon with more than 30 years of experience, I have seen first-hand the challenges in our health care system. I believe we must enact reforms to lower the costs of health care &amp; ensure medical decisions are a matter between you &amp; your doctor. 1/2	en	[]	[]	[]	7	5	6	[]	[]	https://twitter.com/DrNealDunnFL2/status/1197505538650771460	False		0								[]				
1196890326885122049	1196890326885122049	2019-11-19 15:37:45 EST	2019-11-19	15:37:45	-0400	815952318487298048	drnealdunnfl2	Dr. Neal Dunn		I had a great time meeting with Swift Creek Middle School Students before they toured the Capitol today. These 8th grade students from Tallahassee are spending the week exploring Washington and putting all of their US history knowledge to the test!  https://t.co/CW3pAmNwkb	en	[]	[]	['https://pbs.twimg.com/media/EJw1Zz_W4AUymPb.jpg', 'https://pbs.twimg.com/media/EJw1Z0BWkAAgvNK.jpg', 'https://pbs.twimg.com/media/EJw1Z0CXkAA2ji0.jpg', 'https://pbs.twimg.com/media/EJw1Z0FW4AIKzBk.jpg']	0	2	6	[]	[]	https://twitter.com/DrNealDunnFL2/status/1196890326885122049	False		1	https://pbs.twimg.com/media/EJw1Zz_W4AUymPb.jpg							[]				
1195376356177174534	1195376356177174534	2019-11-15 11:21:46 EST	2019-11-15	11:21:46	-0400	815952318487298048	drnealdunnfl2	Dr. Neal Dunn		The American people deserve transparency and the truth. Instead, Democrats in the House are wasting time and money with their partisan politics.	en	[]	[]	[]	80	156	518	[]	[]	https://twitter.com/DrNealDunnFL2/status/1195376356177174534	False	https://twitter.com/SteveScalise/status/1195373079830155264	0								[]				
1193994290847989760	1193994286368514050	2019-11-11 15:49:56 EST	2019-11-11	15:49:56	-0400	815952318487298048	drnealdunnfl2	Dr. Neal Dunn		As the son of a veteran, the father of a veteran, and a veteran myself, I am committed to ensuring our veterans are getting the care they need and deserve. Thank you to America's veterans.  https://t.co/qWQiCL3wYA	en	[]	['https://youtu.be/NfIo7r8NBqA']	[]	3	1	7	[]	[]	https://twitter.com/DrNealDunnFL2/status/1193994290847989760	False		0								[]				
1193994286368514050	1193994286368514050	2019-11-11 15:49:55 EST	2019-11-11	15:49:55	-0400	815952318487298048	drnealdunnfl2	Dr. Neal Dunn		On Veterans Day we honor every individual who has dedicated themselves to serving our nation during wartime and during peace. Though this day is a remembrance, it should also serve as a reminder to honor the veterans in our lives and our communities every day.	en	[]	[]	[]	3	5	14	[]	[]	https://twitter.com/DrNealDunnFL2/status/1193994286368514050	False		0								[]				
1192895091268050949	1192895091268050949	2019-11-08 15:02:07 EST	2019-11-08	15:02:07	-0400	815952318487298048	drnealdunnfl2	Dr. Neal Dunn		Happy 90th Birthday to Bobby Bowden, who led FSU to victory in two national championships and twelve ACC titles during his coaching career. He is a legendary Nole! #GoNoles	en	[]	[]	[]	2	3	4	['gonoles']	[]	https://twitter.com/DrNealDunnFL2/status/1192895091268050949	False		0								[]				
1192847279977353218	1192847279222349825	2019-11-08 11:52:08 EST	2019-11-08	11:52:08	-0400	815952318487298048	drnealdunnfl2	Dr. Neal Dunn		These block grants will provide much-needed relief. I was happy to work with colleagues in Congress and Secretary Perdue to ensure that the necessary resources flow to North Florida to revitalize our timber industry.  https://t.co/b8T8mNTW8H	en	[]	['https://dunn.house.gov/index.cfm?p=press-releases&id=9840DA68-165E-46CD-B22C-FE70D362A04A']	[]	1	1	4	[]	[]	https://twitter.com/DrNealDunnFL2/status/1192847279977353218	False		0								[]				
1192847279222349825	1192847279222349825	2019-11-08 11:52:08 EST	2019-11-08	11:52:08	-0400	815952318487298048	drnealdunnfl2	Dr. Neal Dunn		The timber industry is vital to North Florida and unfortunately it took a hard-hit last year. Secretary Perdue’s announcement is welcome news. Our Florida foresters are our best environmental stewards and their livelihood depends on smart and sustainable conservation practices.	en	[]	[]	[]	4	3	7	[]	[]	https://twitter.com/DrNealDunnFL2/status/1192847279222349825	False		0								[]				
1192168017561567232	1192168017561567232	2019-11-06 14:52:59 EST	2019-11-06	14:52:59	-0400	815952318487298048	drnealdunnfl2	Dr. Neal Dunn		I want to hear your thoughts on the impeachment proceedings against President Trump. Take my survey --&gt;   https://t.co/bbyRmEYGkC	en	[]	['https://dunn.house.gov/survey']	[]	15	5	3	[]	[]	https://twitter.com/DrNealDunnFL2/status/1192168017561567232	False		0								[]				
1191830415818067973	1191830415818067973	2019-11-05 16:31:28 EST	2019-11-05	16:31:28	-0400	815952318487298048	drnealdunnfl2	Dr. Neal Dunn		Recently I honored the courageous efforts of Sgt. Jeff Hewitt &amp; Dep. Jared Hewitt of the @fcsofl in the Congressional Record. These 2 officers went above &amp; beyond during the Eastpoint fire &amp; were named the 2019 Law Enforcement Officers of the Year by the FL Sheriff's Association.  https://t.co/RpjRW9CqFh	en	[]	[]	['https://pbs.twimg.com/media/EIo7cdvXkAA-ukl.jpg']	1	2	5	[]	[]	https://twitter.com/DrNealDunnFL2/status/1191830415818067973	False		1	https://pbs.twimg.com/media/EIo7cdvXkAA-ukl.jpg							[]				
1189946483698806784	1189946482989907979	2019-10-31 12:45:24 EDT	2019-10-31	12:45:24	-0400	815952318487298048	drnealdunnfl2	Dr. Neal Dunn		The reason they haven’t presented any evidence is that they have none. This ‘Soviet style justice’ is an insult to our democracy. This investigation would not stand up in any court in the United States and should not stand up in the House of Representatives. #ImpeachmentVote	en	[]	[]	[]	11	5	13	['impeachmentvote']	[]	https://twitter.com/DrNealDunnFL2/status/1189946483698806784	False		0								[]				
