id	conversation_id	created_at	date	time	timezone	user_id	username	name	place	tweet	language	mentions	urls	photos	replies_count	retweets_count	likes_count	hashtags	cashtags	link	retweet	quote_url	video	thumbnail	near	geo	source	user_rt_id	user_rt	retweet_id	reply_to	retweet_date	translate	trans_src	trans_dest
915281836808564746	915281836808564746	2017-10-03 14:26:09 EDT	2017-10-03	14:26:09	-0400	815952318487298048	drnealdunnfl2	Dr. Neal Dunn		At more than 4 million words, our tax code is a prime example of the govt red tape that is strangling our economy.  https://t.co/BZapLThbHi	en	[]	['https://fairandsimple.gop/?utm_source=DrNealDunnFL2']	[]	11	3	4	[]	[]	https://twitter.com/DrNealDunnFL2/status/915281836808564746	False		0								[]				
914865542057603072	914865542057603072	2017-10-02 10:51:57 EDT	2017-10-02	10:51:57	-0400	815952318487298048	drnealdunnfl2	Dr. Neal Dunn		Thank you to all of the officers and first responders who immediately took action. Their bravery saved countless lives. (3/3)	en	[]	[]	[]	6	0	10	[]	[]	https://twitter.com/DrNealDunnFL2/status/914865542057603072	False		0								[]				
914865495530262528	914865495530262528	2017-10-02 10:51:46 EDT	2017-10-02	10:51:46	-0400	815952318487298048	drnealdunnfl2	Dr. Neal Dunn		We are praying for all who were affected by this tragedy. (2/3)	en	[]	[]	[]	4	0	5	[]	[]	https://twitter.com/DrNealDunnFL2/status/914865495530262528	False		0								[]				
914865423530827778	914865423530827778	2017-10-02 10:51:29 EDT	2017-10-02	10:51:29	-0400	815952318487298048	drnealdunnfl2	Dr. Neal Dunn		Leah and I were heartbroken to hear of the tragic events that claimed so many lives in Las Vegas last night. (1/3)	en	[]	[]	[]	5	1	7	[]	[]	https://twitter.com/DrNealDunnFL2/status/914865423530827778	False		0								[]				
913417129768230912	913417129768230912	2017-09-28 10:56:28 EDT	2017-09-28	10:56:28	-0400	815952318487298048	drnealdunnfl2	Dr. Neal Dunn		Great to have you back @SteveScalise!  https://t.co/tSI6fcCYr1	en	[{'screen_name': 'stevescalise', 'name': 'steve scalise', 'id': '1209417007'}]	['https://twitter.com/stevescalise/status/913405166178783232']	[]	2	0	6	[]	[]	https://twitter.com/DrNealDunnFL2/status/913417129768230912	False	https://twitter.com/stevescalise/status/913405166178783232	0								[]				
913402932363776001	913402932363776001	2017-09-28 10:00:03 EDT	2017-09-28	10:00:03	-0400	815952318487298048	drnealdunnfl2	Dr. Neal Dunn		View our unified tax reform blueprint here --&gt;     https://t.co/BZapLThbHi	en	[]	['https://fairandsimple.gop/?utm_source=DrNealDunnFL2']	[]	4	0	4	[]	[]	https://twitter.com/DrNealDunnFL2/status/913402932363776001	False		0								[]				
913112068299137024	913112068299137024	2017-09-27 14:44:16 EDT	2017-09-27	14:44:16	-0400	815952318487298048	drnealdunnfl2	Dr. Neal Dunn		We have a once in a generation opportunity to overhaul our tax system, lower rates &amp; make the IRS work for people.  https://t.co/tsn1JvKovt	en	[]	['http://dunn.house.gov/media/press-releases/dunn-releases-statement-unified-tax-reform-blueprint']	[]	7	1	6	[]	[]	https://twitter.com/DrNealDunnFL2/status/913112068299137024	False		0								[]				
912851335648866304	912851335648866304	2017-09-26 21:28:13 EDT	2017-09-26	21:28:13	-0400	815952318487298048	drnealdunnfl2	Dr. Neal Dunn		Today I introduced the Veterans Opioid Prevention Act to fight the opioid epidemic in the US. (2/2)--&gt;   https://t.co/dsGEyHbgnP	en	[]	['https://dunn.house.gov/media/press-releases/dr-dunn-introduces-bill-protect-veterans-opioid-abuse']	[]	3	1	11	[]	[]	https://twitter.com/DrNealDunnFL2/status/912851335648866304	False		0								[]				
912851074104651776	912851074104651776	2017-09-26 21:27:10 EDT	2017-09-26	21:27:10	-0400	815952318487298048	drnealdunnfl2	Dr. Neal Dunn		More than 140 people in the U.S. die from opioid abuse each day, and veterans are twice as likely than civilians. (1/2)	en	[]	[]	[]	1	1	2	[]	[]	https://twitter.com/DrNealDunnFL2/status/912851074104651776	False		0								[]				
912754409570017280	912754409570017280	2017-09-26 15:03:04 EDT	2017-09-26	15:03:04	-0400	815952318487298048	drnealdunnfl2	Dr. Neal Dunn		Tomorrow: President Trump and Congress publish our updated middle class tax cut plans. Learn more here --&gt;  https://t.co/BZapLThbHi  https://t.co/1wy4prDsQh	en	[]	['https://fairandsimple.gop/?utm_source=DrNealDunnFL2']	['https://pbs.twimg.com/media/DKrBS07UQAAQ6ah.jpg']	3	1	1	[]	[]	https://twitter.com/DrNealDunnFL2/status/912754409570017280	False		1	https://pbs.twimg.com/media/DKrBS07UQAAQ6ah.jpg							[]				
912697988451094529	912697988451094529	2017-09-26 11:18:52 EDT	2017-09-26	11:18:52	-0400	815952318487298048	drnealdunnfl2	Dr. Neal Dunn		All 3 of my offices are looking for interns. Contact my D.C. office to learn more.  https://t.co/Ei4GaQxr81	en	[]	[]	['https://pbs.twimg.com/media/DKqN-oaW4AAJwKS.jpg', 'https://pbs.twimg.com/media/DKqN-oeXcAAy4Nh.jpg']	1	3	5	[]	[]	https://twitter.com/DrNealDunnFL2/status/912697988451094529	False		1	https://pbs.twimg.com/media/DKqN-oaW4AAJwKS.jpg							[]				
912399660089839617	912399660089839617	2017-09-25 15:33:25 EDT	2017-09-25	15:33:25	-0400	815952318487298048	drnealdunnfl2	Dr. Neal Dunn		I want to know what you think about tax reform. Take my survey at the link below.   https://t.co/XZiyMQ4LMB	en	[]	['https://iqconnect.lmhostediq.com/iqextranet/EForm.aspx?__cid=FL02ND&__fid=100013']	[]	2	0	0	[]	[]	https://twitter.com/DrNealDunnFL2/status/912399660089839617	False		0								[]				
911272481993961472	911272481993961472	2017-09-22 12:54:24 EDT	2017-09-22	12:54:24	-0400	815952318487298048	drnealdunnfl2	Dr. Neal Dunn		The last time the tax code was reformed, the TV show Cheers was in its prime. #TaxReform  https://t.co/ppa4tNpna3	en	[]	['https://goo.gl/Ki1uXT']	[]	3	1	2	['taxreform']	[]	https://twitter.com/DrNealDunnFL2/status/911272481993961472	False		0								[]				
911043408780775424	911043408780775424	2017-09-21 21:44:09 EDT	2017-09-21	21:44:09	-0400	815952318487298048	drnealdunnfl2	Dr. Neal Dunn		Urgent, important news out of Dominica tonight on evacuations  after Hurricane Maria. --&gt;  https://t.co/6shNArKt9o	en	[]	['https://www.facebook.com/DrNealDunnFL2/']	[]	0	2	2	[]	[]	https://twitter.com/DrNealDunnFL2/status/911043408780775424	False		0								[]				
910936148716982272	910936148716982272	2017-09-21 14:37:56 EDT	2017-09-21	14:37:56	-0400	815952318487298048	drnealdunnfl2	Dr. Neal Dunn		Did you know our Tax Code is roughly 4 millions words long? That would be like reading the bible…5 times. #TaxReform  https://t.co/ppa4tNpna3	en	[]	['https://goo.gl/Ki1uXT']	[]	6	4	5	['taxreform']	[]	https://twitter.com/DrNealDunnFL2/status/910936148716982272	False		0								[]				
910897909356474369	910897909356474369	2017-09-21 12:05:59 EDT	2017-09-21	12:05:59	-0400	815952318487298048	drnealdunnfl2	Dr. Neal Dunn		Ever wish you could file your taxes on a form the size of a postcard? Your wish might be coming true. #TaxReform  https://t.co/ppa4tNpna3	en	[]	['https://goo.gl/Ki1uXT']	[]	4	3	2	['taxreform']	[]	https://twitter.com/DrNealDunnFL2/status/910897909356474369	False		0								[]				
910863320437026816	910863320437026816	2017-09-21 09:48:33 EDT	2017-09-21	09:48:33	-0400	815952318487298048	drnealdunnfl2	Dr. Neal Dunn		This week I toured Florida Gateway College w/ Pres. Barrett &amp; discussed the impact of Irma &amp; what's in store for the future of the college.  https://t.co/jpMQn6qrjg	en	[]	[]	['https://pbs.twimg.com/media/DKQJWXEWAAE2baN.jpg', 'https://pbs.twimg.com/media/DKQJWXKW0AAZ1nF.jpg', 'https://pbs.twimg.com/media/DKQJWXQXkAEFWHo.jpg', 'https://pbs.twimg.com/media/DKQJWXFWAAME5DN.jpg']	1	2	2	[]	[]	https://twitter.com/DrNealDunnFL2/status/910863320437026816	False		1	https://pbs.twimg.com/media/DKQJWXEWAAE2baN.jpg							[]				
910610658651250690	910610658651250690	2017-09-20 17:04:34 EDT	2017-09-20	17:04:34	-0400	815952318487298048	drnealdunnfl2	Dr. Neal Dunn		We met with first responders and local leaders and learned about the economic impacts of Hurricane Irma.  https://t.co/SYfeVbCj1c	en	[]	[]	['https://pbs.twimg.com/media/DKMjjqDX0AAriEf.jpg', 'https://pbs.twimg.com/media/DKMjjqBWkAAg4_3.jpg', 'https://pbs.twimg.com/media/DKMjjp-XkAIanRE.jpg']	1	3	4	[]	[]	https://twitter.com/DrNealDunnFL2/status/910610658651250690	False		1	https://pbs.twimg.com/media/DKMjjqDX0AAriEf.jpg							[]				
910610568230445056	910610568230445056	2017-09-20 17:04:12 EDT	2017-09-20	17:04:12	-0400	815952318487298048	drnealdunnfl2	Dr. Neal Dunn		More photos from our delegation tour in Jacksonville this morning with @SpeakerRyan.  https://t.co/mkBWiUNxXb	en	[{'screen_name': 'speakerryan', 'name': 'paul ryan', 'id': '18916432'}]	[]	['https://pbs.twimg.com/media/DKMjek3W4AEWhv_.jpg', 'https://pbs.twimg.com/media/DKMjek4XoAAFDyy.jpg', 'https://pbs.twimg.com/media/DKMjek6W0AAV21i.jpg', 'https://pbs.twimg.com/media/DKMjek8WsAAbxeF.jpg']	0	1	2	[]	[]	https://twitter.com/DrNealDunnFL2/status/910610568230445056	False		1	https://pbs.twimg.com/media/DKMjek3W4AEWhv_.jpg							[]				
910541984254824450	910541984254824450	2017-09-20 12:31:40 EDT	2017-09-20	12:31:40	-0400	815952318487298048	drnealdunnfl2	Dr. Neal Dunn		Joined @SpeakerRyan and several members of the Florida delegation to tour areas that were impacted by Irma and hear from local officials.  https://t.co/oaky819obJ	en	[{'screen_name': 'speakerryan', 'name': 'paul ryan', 'id': '18916432'}]	[]	['https://pbs.twimg.com/media/DKLlGxOW4AAfOUH.jpg']	34	14	62	[]	[]	https://twitter.com/DrNealDunnFL2/status/910541984254824450	False		1	https://pbs.twimg.com/media/DKLlGxOW4AAfOUH.jpg							[]				
910308866570768391	910308866570768391	2017-09-19 21:05:21 EDT	2017-09-19	21:05:21	-0400	815952318487298048	drnealdunnfl2	Dr. Neal Dunn		Met with government classes today at Columbia High School and discussed the ins and outs of Congress. They had some great questions.  https://t.co/UPXDIINzdR	en	[]	[]	['https://pbs.twimg.com/media/DKIRFFtWkAIQRoB.jpg', 'https://pbs.twimg.com/media/DKIRFFsXoAEpnl-.jpg', 'https://pbs.twimg.com/media/DKIRFFtXoAEyDf_.jpg']	5	3	9	[]	[]	https://twitter.com/DrNealDunnFL2/status/910308866570768391	False		1	https://pbs.twimg.com/media/DKIRFFtWkAIQRoB.jpg							[]				
910228707570315264	910228707570315264	2017-09-19 15:46:49 EDT	2017-09-19	15:46:49	-0400	815952318487298048	drnealdunnfl2	Dr. Neal Dunn		Just delivered a donation of books from @librarycongress to Columbia HS. Students will now have more resources for history &amp; govt classes.  https://t.co/kOCqbSKVzx	en	[{'screen_name': 'librarycongress', 'name': 'library of congress', 'id': '7152572'}]	[]	['https://pbs.twimg.com/media/DKHILtgXoAM7YSX.jpg', 'https://pbs.twimg.com/media/DKHILwHWkAIyVa7.jpg', 'https://pbs.twimg.com/media/DKHILwCXUAAFUUZ.jpg']	2	1	5	[]	[]	https://twitter.com/DrNealDunnFL2/status/910228707570315264	False		1	https://pbs.twimg.com/media/DKHILtgXoAM7YSX.jpg							[]				
910165996580823041	910165996580823041	2017-09-19 11:37:38 EDT	2017-09-19	11:37:38	-0400	815952318487298048	drnealdunnfl2	Dr. Neal Dunn		Thank you to all of the linemen who are working to bring power back to Florida.  https://t.co/hyIo0rfXwX	en	[]	[]	['https://pbs.twimg.com/media/DKGPJdnW4AEZZtn.jpg', 'https://pbs.twimg.com/media/DKGPJdnW0AEoxac.jpg']	1	2	7	[]	[]	https://twitter.com/DrNealDunnFL2/status/910165996580823041	False		1	https://pbs.twimg.com/media/DKGPJdnW4AEZZtn.jpg							[]				
910165978134253568	910165978134253568	2017-09-19 11:37:33 EDT	2017-09-19	11:37:33	-0400	815952318487298048	drnealdunnfl2	Dr. Neal Dunn		Stopped by the Columbia County fairground this morning to check-in on the lineman staging area as they work to restore power to the area.  https://t.co/8v8UHgLAfr	en	[]	[]	['https://pbs.twimg.com/media/DKGPIYlXUAAo_Cf.jpg', 'https://pbs.twimg.com/media/DKGPIb7W0AAMe4d.jpg', 'https://pbs.twimg.com/media/DKGPIczW4AEgFuU.jpg', 'https://pbs.twimg.com/media/DKGPH8lX0AYiU3L.jpg']	0	2	2	[]	[]	https://twitter.com/DrNealDunnFL2/status/910165978134253568	False		1	https://pbs.twimg.com/media/DKGPIYlXUAAo_Cf.jpg							[]				
909849073485787136	909849073485787136	2017-09-18 14:38:17 EDT	2017-09-18	14:38:17	-0400	815952318487298048	drnealdunnfl2	Dr. Neal Dunn		Happy 70th Birthday @usairforce. Thank you to all who serve &amp; those at Tyndall for pledging your lives to serve &amp; protect this great nation.  https://t.co/Tl38n723HZ	en	[{'screen_name': 'usairforce', 'name': 'u.s. air force', 'id': '19611483'}]	[]	['https://pbs.twimg.com/media/DKBu5_UXcAcidqH.jpg']	2	3	3	[]	[]	https://twitter.com/DrNealDunnFL2/status/909849073485787136	False		1	https://pbs.twimg.com/media/DKBu5_UXcAcidqH.jpg							[]				
909783485086355456	909783485086355456	2017-09-18 10:17:40 EDT	2017-09-18	10:17:40	-0400	815952318487298048	drnealdunnfl2	Dr. Neal Dunn		Are you eligible for federal assistance in the wake of #Irma? Learn about @fema , @SBAgov &amp; Disaster Unemployment.  https://t.co/AHswtzYv4r	en	[{'screen_name': 'fema', 'name': 'fema', 'id': '16669075'}, {'screen_name': 'sbagov', 'name': 'sba', 'id': '153149305'}]	['https://dunn.house.gov/disaster-assistance']	[]	0	1	0	['irma']	[]	https://twitter.com/DrNealDunnFL2/status/909783485086355456	False		0								[]				
909566957787258882	909566957787258882	2017-09-17 19:57:16 EDT	2017-09-17	19:57:16	-0400	815952318487298048	drnealdunnfl2	Dr. Neal Dunn		Disaster Unemployment Assistance is available to those who became unemployed because of Hurricane Irma. Learn more.  https://t.co/2Bts87J99z	en	[]	['http://www.floridajobs.org/office-directory/division-of-workforce-services/reemployment-assistance-programs/disaster-unemployment-assistance']	[]	0	2	2	[]	[]	https://twitter.com/DrNealDunnFL2/status/909566957787258882	False		0								[]				
909558049689473027	909558049689473027	2017-09-17 19:21:52 EDT	2017-09-17	19:21:52	-0400	815952318487298048	drnealdunnfl2	Dr. Neal Dunn		The @SBAgov offers disaster loans to businesses, private non-profit organizations, homeowners, and renters.  https://t.co/AHswtzYv4r	en	[{'screen_name': 'sbagov', 'name': 'sba', 'id': '153149305'}]	['https://dunn.house.gov/disaster-assistance']	[]	0	1	2	[]	[]	https://twitter.com/DrNealDunnFL2/status/909558049689473027	False		0								[]				
908746764529930240	908746764529930240	2017-09-15 13:38:07 EDT	2017-09-15	13:38:07	-0400	815952318487298048	drnealdunnfl2	Dr. Neal Dunn		Learn if you are eligible for FEMA Individual Assistance in the wake of Hurricane Irma.   https://t.co/tbvC1MlHzn  https://t.co/m1OvHWIq0z	en	[]	['https://www.disasterassistance.gov/']	['https://pbs.twimg.com/media/DJyEXNYW4AEdgav.jpg']	0	2	1	[]	[]	https://twitter.com/DrNealDunnFL2/status/908746764529930240	False		1	https://pbs.twimg.com/media/DJyEXNYW4AEdgav.jpg							[]				
908472974960922624	908472974960922624	2017-09-14 19:30:10 EDT	2017-09-14	19:30:10	-0400	815952318487298048	drnealdunnfl2	Dr. Neal Dunn		Residents and businesses in those counties now qualify for an extended quarterly tax filing season. --&gt;  https://t.co/wguZT1dFdS	en	[]	['https://www.irs.gov/newsroom/irs-gives-tax-relief-to-victims-of-hurricane-irma-like-harvey-extension-filers-have-until-jan-31-to-file-additional-relief-planned?utm_source=hootsuite&utm_medium=&utm_campaign']	[]	1	1	2	[]	[]	https://twitter.com/DrNealDunnFL2/status/908472974960922624	False		0								[]				
908472685902036993	908472685902036993	2017-09-14 19:29:01 EDT	2017-09-14	19:29:01	-0400	815952318487298048	drnealdunnfl2	Dr. Neal Dunn		Suwannee, Gilchrist, Levy, and Columbia added to list of counties eligible for Individual Assistance through FEMA.  https://t.co/tbvC1MlHzn	en	[]	['https://www.disasterassistance.gov/']	[]	0	1	3	[]	[]	https://twitter.com/DrNealDunnFL2/status/908472685902036993	False		0								[]				
908411014701600769	908411014701600769	2017-09-14 15:23:58 EDT	2017-09-14	15:23:58	-0400	815952318487298048	drnealdunnfl2	Dr. Neal Dunn		Updated info on FL02 power outages. Thank you to all the linemen who are working tirelessly to restore power to FL.  https://t.co/umh4xP1LlR	en	[]	['http://www.wctv.tv/content/news/customers-without-power-443636373.html']	[]	1	2	4	[]	[]	https://twitter.com/DrNealDunnFL2/status/908411014701600769	False		0								[]				
908076200689618944	908076200689618944	2017-09-13 17:13:32 EDT	2017-09-13	17:13:32	-0400	815952318487298048	drnealdunnfl2	Dr. Neal Dunn		Florida shouldn’t have to fight government bureaucracy as it rebuilds. #Irma  https://t.co/745ewRweUE	en	[]	['https://dunn.house.gov/media/press-releases/dunn-works-cut-government-red-tape-wake-irma']	[]	1	1	3	['irma']	[]	https://twitter.com/DrNealDunnFL2/status/908076200689618944	False		0								[]				
908076070821392384	908076070821392384	2017-09-13 17:13:01 EDT	2017-09-13	17:13:01	-0400	815952318487298048	drnealdunnfl2	Dr. Neal Dunn		Today, I led members of the Florida delegation in requesting @POTUS use his authority to cut government red tape in the aftermath of #Irma.  https://t.co/gHqzSmrdEU	en	[{'screen_name': 'potus', 'name': 'president biden', 'id': '1349149096909668363'}]	[]	['https://pbs.twimg.com/media/DJoiRp9WAAAL02w.jpg', 'https://pbs.twimg.com/media/DJoiUDzXoAAqnoG.jpg']	4	1	5	['irma']	[]	https://twitter.com/DrNealDunnFL2/status/908076070821392384	False		1	https://pbs.twimg.com/media/DJoiRp9WAAAL02w.jpg							[]				
907760665024253953	907760665024253953	2017-09-12 20:19:42 EDT	2017-09-12	20:19:42	-0400	815952318487298048	drnealdunnfl2	Dr. Neal Dunn		Get post-storm tips from @DHSgov here --&gt;  https://t.co/ycQUqPOPYy #Irma	en	[{'screen_name': 'dhsgov', 'name': 'homeland security', 'id': '15647676'}]	['http://www.ready.gov']	[]	0	1	1	['irma']	[]	https://twitter.com/DrNealDunnFL2/status/907760665024253953	False		0								[]				
907760376678371329	907760376678371329	2017-09-12 20:18:33 EDT	2017-09-12	20:18:33	-0400	815952318487298048	drnealdunnfl2	Dr. Neal Dunn		Even though Hurricane Irma has passed, it is still important to be cautious &amp; listen to advice from local officials.	en	[]	[]	[]	1	2	5	[]	[]	https://twitter.com/DrNealDunnFL2/status/907760376678371329	False		0								[]				
907299450586107904	907299450586107904	2017-09-11 13:47:00 EDT	2017-09-11	13:47:00	-0400	815952318487298048	drnealdunnfl2	Dr. Neal Dunn		This great group of people have your safety in their hands on a daily basis, but truly shine in emergencies like Hurricane Irma. (2/2)  https://t.co/DOXZDlonmL	en	[]	[]	['https://pbs.twimg.com/media/DJdgCZSWAAAWuF8.jpg']	0	1	4	[]	[]	https://twitter.com/DrNealDunnFL2/status/907299450586107904	False		1	https://pbs.twimg.com/media/DJdgCZSWAAAWuF8.jpg							[]				
907299384508985344	907299384508985344	2017-09-11 13:46:44 EDT	2017-09-11	13:46:44	-0400	815952318487298048	drnealdunnfl2	Dr. Neal Dunn		I have a real appreciation for the focused attention of the dedicated Public Servants at the Bay County Emergency Operations Center.  (1/2)  https://t.co/WqBk6tKs2z	en	[]	[]	['https://pbs.twimg.com/media/DJdf-Y-WsAAKAiv.jpg', 'https://pbs.twimg.com/media/DJdf-Y_WsAAGjdt.jpg']	0	2	4	[]	[]	https://twitter.com/DrNealDunnFL2/status/907299384508985344	False		1	https://pbs.twimg.com/media/DJdf-Y-WsAAKAiv.jpg							[]				
907256020057182208	907256020057182208	2017-09-11 10:54:25 EDT	2017-09-11	10:54:25	-0400	815952318487298048	drnealdunnfl2	Dr. Neal Dunn		Let us all pray for our first responders, who today, like 16 years ago, ran into danger to save fellow Americans.  https://t.co/dt1a6n9cD3  https://t.co/gCo3smk6Xa	en	[]	['https://dunn.house.gov/media/press-releases/congressman-dunn-s-statement-anniversary-september-11-2001']	['https://pbs.twimg.com/media/DJc4aeDXcAECA3F.jpg']	0	1	4	[]	[]	https://twitter.com/DrNealDunnFL2/status/907256020057182208	False		1	https://pbs.twimg.com/media/DJc4aeDXcAECA3F.jpg							[]				
906523022194036736	906523022194036736	2017-09-09 10:21:45 EDT	2017-09-09	10:21:45	-0400	815952318487298048	drnealdunnfl2	Dr. Neal Dunn		Please listen to @FLGovScott warnings. He's doing a tremendous job managing the emergency response.  https://t.co/G5BARzbmM7	en	[]	['https://twitter.com/flgovscott/status/906172777576579072']	[]	5	6	16	[]	[]	https://twitter.com/DrNealDunnFL2/status/906523022194036736	False	https://twitter.com/flgovscott/status/906172777576579072	0								[]				
906304370131730434	906304370131730434	2017-09-08 19:52:54 EDT	2017-09-08	19:52:54	-0400	815952318487298048	drnealdunnfl2	Dr. Neal Dunn		Levy County is currently evacuating all citizens to designated shelters/out the area. Check their website for info  https://t.co/AFhbkYSBhC	en	[]	['http://www.levydisaster.com/default.aspx']	[]	0	2	2	[]	[]	https://twitter.com/DrNealDunnFL2/status/906304370131730434	False		0								[]				
906304105366392832	906304105366392832	2017-09-08 19:51:51 EDT	2017-09-08	19:51:51	-0400	815952318487298048	drnealdunnfl2	Dr. Neal Dunn		Met w/ Levy County Sheriff Bobby McCallum, Emergency Management Director John MacDonald &amp; Assistant Director David Peaton today in Bronson.  https://t.co/t09I9u87ij	en	[]	[]	['https://pbs.twimg.com/media/DJPWxaWXoAA-92g.jpg']	1	1	2	[]	[]	https://twitter.com/DrNealDunnFL2/status/906304105366392832	False		1	https://pbs.twimg.com/media/DJPWxaWXoAA-92g.jpg							[]				
906237018727997442	906237018727997442	2017-09-08 15:25:16 EDT	2017-09-08	15:25:16	-0400	815952318487298048	drnealdunnfl2	Dr. Neal Dunn		Hurricane #Irma is expected to bring tropical storm winds to Columbia Co. Sunday. Stay up to date on preparations--&gt;  https://t.co/Hf9fY6nzFg  https://t.co/QAMCQUj5yh	en	[]	['http://em.columbiacountyfla.com/home']	['https://pbs.twimg.com/media/DJOZwgAXoAAJhHb.jpg']	0	2	2	['irma']	[]	https://twitter.com/DrNealDunnFL2/status/906237018727997442	False		1	https://pbs.twimg.com/media/DJOZwgAXoAAJhHb.jpg							[]				
906236351733002248	906236351733002248	2017-09-08 15:22:37 EDT	2017-09-08	15:22:37	-0400	815952318487298048	drnealdunnfl2	Dr. Neal Dunn		Just met with Columbia County Administrators Ben Scott and Scott Ward and Sheriff Hunter in Lake City - they are preparing for #Irma.  https://t.co/y0rSAhqclI	en	[]	[]	['https://pbs.twimg.com/media/DJOZJpkXgAATqsf.jpg']	0	2	6	['irma']	[]	https://twitter.com/DrNealDunnFL2/status/906236351733002248	False		1	https://pbs.twimg.com/media/DJOZJpkXgAATqsf.jpg							[]				
906228111120969731	906228111120969731	2017-09-08 14:49:53 EDT	2017-09-08	14:49:53	-0400	815952318487298048	drnealdunnfl2	Dr. Neal Dunn		Leon County will be frequently updating their Emergency Information Portal regarding preparations for #Irma.  https://t.co/T5zizxD0xb	en	[]	['http://cms.leoncountyfl.gov/ei/']	[]	0	0	1	['irma']	[]	https://twitter.com/DrNealDunnFL2/status/906228111120969731	False		0								[]				
906212227086254080	906212227086254080	2017-09-08 13:46:46 EDT	2017-09-08	13:46:46	-0400	815952318487298048	drnealdunnfl2	Dr. Neal Dunn		Spending the day traveling throughout FL02 meeting local leaders &amp; visiting emergency operations centers in preparation for Hurricane #Irma.	en	[]	[]	[]	1	0	4	['irma']	[]	https://twitter.com/DrNealDunnFL2/status/906212227086254080	False		0								[]				
905939241900879872	905939241900879872	2017-09-07 19:42:01 EDT	2017-09-07	19:42:01	-0400	815952318487298048	drnealdunnfl2	Dr. Neal Dunn		Important tips from @fema on evacuations. #Irma  https://t.co/bYvIPIhhhl	en	[{'screen_name': 'fema', 'name': 'fema', 'id': '16669075'}]	[]	['https://pbs.twimg.com/media/DJKK70gXoAAyEQa.jpg']	0	1	1	['irma']	[]	https://twitter.com/DrNealDunnFL2/status/905939241900879872	False		1	https://pbs.twimg.com/media/DJKK70gXoAAyEQa.jpg							[]				
905904049106677761	905904049106677761	2017-09-07 17:22:10 EDT	2017-09-07	17:22:10	-0400	815952318487298048	drnealdunnfl2	Dr. Neal Dunn		Don't forget to sign up for the Congressional App Challenge! More info here --&gt;  https://t.co/4s2InWKPOr	en	[]	['https://dunn.house.gov/congressional-app-challenge']	[]	0	1	0	[]	[]	https://twitter.com/DrNealDunnFL2/status/905904049106677761	False		0								[]				
905903807309152257	905903807309152257	2017-09-07 17:21:13 EDT	2017-09-07	17:21:13	-0400	815952318487298048	drnealdunnfl2	Dr. Neal Dunn		Are you a tech-savvy high school student? Do you love to code? #CAC Click here to learn more --&gt;  https://t.co/iHgde9OkoG	en	[]	['https://www.youtube.com/watch?v=GArIeWQKmls']	[]	4	2	4	['cac']	[]	https://twitter.com/DrNealDunnFL2/status/905903807309152257	False		0								[]				
905835245529948161	905835245529948161	2017-09-07 12:48:46 EDT	2017-09-07	12:48:46	-0400	815952318487298048	drnealdunnfl2	Dr. Neal Dunn		Veterans in storm-impacted areas &amp; need immediate assistance please contact VA Health Resource Center Disaster Hotline at 1-800-507-4571.	en	[]	[]	[]	0	1	3	[]	[]	https://twitter.com/DrNealDunnFL2/status/905835245529948161	False		0								[]				
905824879013978118	905824879013978118	2017-09-07 12:07:35 EDT	2017-09-07	12:07:35	-0400	815952318487298048	drnealdunnfl2	Dr. Neal Dunn		Our current tax code is long &amp; confusing. We’re working to fix that. Learn more here --&gt;  https://t.co/BZapLThbHi #fairandsimple @HouseGOP	en	[{'screen_name': 'housegop', 'name': 'house republicans', 'id': '15207668'}]	['https://fairandsimple.gop/?utm_source=DrNealDunnFL2']	[]	1	3	0	['fairandsimple']	[]	https://twitter.com/DrNealDunnFL2/status/905824879013978118	False		0								[]				
905817971070824448	905817971070824448	2017-09-07 11:40:08 EDT	2017-09-07	11:40:08	-0400	815952318487298048	drnealdunnfl2	Dr. Neal Dunn		With evacuations &amp; Hurricane #Irma preparations continuing, Volunteer Florida is looking for help. Learn more --&gt;  https://t.co/BlEQX3uXWJ	en	[]	['https://www.volunteerflorida.org/']	[]	0	3	4	['irma']	[]	https://twitter.com/DrNealDunnFL2/status/905817971070824448	False		0								[]				
