id	conversation_id	created_at	date	time	timezone	user_id	username	name	place	tweet	language	mentions	urls	photos	replies_count	retweets_count	likes_count	hashtags	cashtags	link	retweet	quote_url	video	thumbnail	near	geo	source	user_rt_id	user_rt	retweet_id	reply_to	retweet_date	translate	trans_src	trans_dest
1016383013557559298	1016382998516764672	2018-07-09 14:06:08 EDT	2018-07-09	14:06:08	-0400	815952318487298048	drnealdunnfl2	Dr. Neal Dunn		I met w/ Grady Carlisle last week in Panama City &amp; he walked me through the mess he faced when dealing w/ the VA. Grady served in the @USArmy &amp; reached out to our office for help. It was a special pleasure to be able to help Grady as we had served at Ft. Bragg at the same time!  https://t.co/mqYUExVHJY	en	[{'screen_name': 'usarmy', 'name': 'u.s. army', 'id': '8775672'}]	[]	['https://pbs.twimg.com/media/Dhrq9IeWsAUWiVz.jpg', 'https://pbs.twimg.com/media/Dhrq9IwWsAElmBF.jpg', 'https://pbs.twimg.com/media/Dhrq9IfX4AAPlfa.jpg']	1	0	3	[]	[]	https://twitter.com/DrNealDunnFL2/status/1016383013557559298	False		1	https://pbs.twimg.com/media/Dhrq9IeWsAUWiVz.jpg							[]				
1016382998516764672	1016382998516764672	2018-07-09 14:06:04 EDT	2018-07-09	14:06:04	-0400	815952318487298048	drnealdunnfl2	Dr. Neal Dunn		Helping our veterans has been a top priority of mine while in Congress, which is why it’s disappointing to hear about the roadblocks our veterans continue to face when trying to get their benefits.	en	[]	[]	[]	1	2	2	[]	[]	https://twitter.com/DrNealDunnFL2/status/1016382998516764672	False		0								[]				
1015976529887498241	1015976513081085958	2018-07-08 11:10:55 EDT	2018-07-08	11:10:55	-0400	815952318487298048	drnealdunnfl2	Dr. Neal Dunn		We were able to work with the State Department and the US Embassy in Ukraine to get Sveta to Panama City and they welcomed a healthy baby girl a few months later.  https://t.co/yrgNATzVxn	en	[]	[]	['https://pbs.twimg.com/media/Dhl5QqtUwAAdjnm.jpg', 'https://pbs.twimg.com/media/Dhl5QriVMAAliM9.jpg']	3	0	1	[]	[]	https://twitter.com/DrNealDunnFL2/status/1015976529887498241	False		1	https://pbs.twimg.com/media/Dhl5QqtUwAAdjnm.jpg							[]				
1015976513081085958	1015976513081085958	2018-07-08 11:10:51 EDT	2018-07-08	11:10:51	-0400	815952318487298048	drnealdunnfl2	Dr. Neal Dunn		My office was also able to help the Adessi family when they ran into issues with Sveta's fiance visa.  At the time, Sveta was pregnant and needed medical care in the United States.  https://t.co/lFWnDxAjdj	en	[]	[]	['https://pbs.twimg.com/media/Dhl5P42UwAA03eu.jpg']	2	0	4	[]	[]	https://twitter.com/DrNealDunnFL2/status/1015976513081085958	False		1	https://pbs.twimg.com/media/Dhl5P42UwAA03eu.jpg							[]				
1014866908091486208	1014866908091486208	2018-07-05 09:41:40 EDT	2018-07-05	09:41:40	-0400	815952318487298048	drnealdunnfl2	Dr. Neal Dunn		I enjoyed visiting w/ MSgt Chris McKay, his wife Sahar &amp; their son. We talked about difficulties they faced going through the legal immigration process. We were able to help Sahar legally immigrate to the US after receiving inaccurate info shared between the State Dept &amp; USCIS.  https://t.co/Z9qDopTnAu	en	[]	[]	['https://pbs.twimg.com/media/DhWIDysUEAAcE6Y.jpg', 'https://pbs.twimg.com/media/DhWIDyrU0AADk4O.jpg', 'https://pbs.twimg.com/media/DhWIDysUwAAyrLM.jpg', 'https://pbs.twimg.com/media/DhWIDyrU0AItoeP.jpg']	1	0	4	[]	[]	https://twitter.com/DrNealDunnFL2/status/1014866908091486208	False		1	https://pbs.twimg.com/media/DhWIDysUEAAcE6Y.jpg							[]				
1014572379207544833	1014572379207544833	2018-07-04 14:11:19 EDT	2018-07-04	14:11:19	-0400	815952318487298048	drnealdunnfl2	Dr. Neal Dunn		Happy Independence Day! #FourthofJuly #GodBlessAmerica  https://t.co/T9ycev6VlD	en	[]	[]	['https://pbs.twimg.com/media/DhR8MUpXcAQv3nv.jpg']	1	1	8	['fourthofjuly', 'godblessamerica']	[]	https://twitter.com/DrNealDunnFL2/status/1014572379207544833	False		1	https://pbs.twimg.com/media/DhR8MUpXcAQv3nv.jpg							[]				
1014176313387732994	1014176305418522624	2018-07-03 11:57:30 EDT	2018-07-03	11:57:30	-0400	815952318487298048	drnealdunnfl2	Dr. Neal Dunn		We talked about the possibility of expanding the Mission Based Resilience program used at the Bay County Jail throughout the state, and hopefully, the country. (2/2)  https://t.co/KnavEJSMA7	en	[]	[]	['https://pbs.twimg.com/media/DhMT-s3W0AE7Hqr.jpg']	0	0	2	[]	[]	https://twitter.com/DrNealDunnFL2/status/1014176313387732994	False		1	https://pbs.twimg.com/media/DhMT-s3W0AE7Hqr.jpg							[]				
1014176305418522624	1014176305418522624	2018-07-03 11:57:28 EDT	2018-07-03	11:57:28	-0400	815952318487298048	drnealdunnfl2	Dr. Neal Dunn		Yesterday, I met with Bay County Sheriff Tommy Ford and Dr. Ed Naggiar to continue discussions on combating the opioid crisis. They are working hard on the local level to fight this epidemic. (1/2)  https://t.co/VxzUlYmBrT	en	[]	[]	['https://pbs.twimg.com/media/DhMT-RTXcAEJ3QK.jpg']	2	0	5	[]	[]	https://twitter.com/DrNealDunnFL2/status/1014176305418522624	False		1	https://pbs.twimg.com/media/DhMT-RTXcAEJ3QK.jpg							[]				
1013860919309492227	1013860919309492227	2018-07-02 15:04:14 EDT	2018-07-02	15:04:14	-0400	815952318487298048	drnealdunnfl2	Dr. Neal Dunn		I was able to honor the heroic efforts of Suwannee County Sheriff's Deputy Troy Wadford, who was off-duty &amp; traveling w/ his family when he saw a car accident. He immediately took action &amp; saved Destiny Romine. Thank you Deputy Wadford &amp; all who work tirelessly to keep us safe.  https://t.co/JHMz3hw859	en	[]	[]	[]	0	0	9	[]	[]	https://twitter.com/DrNealDunnFL2/status/1013860919309492227	False		1	https://pbs.twimg.com/ext_tw_video_thumb/1013849595099664384/pu/img/NCJt1iTf30moQjjN.jpg							[]				
1013790662624514048	1013790662624514048	2018-07-02 10:25:03 EDT	2018-07-02	10:25:03	-0400	815952318487298048	drnealdunnfl2	Dr. Neal Dunn		It was great meeting Madison Retherford, our 2018 Congressional Art Competition winner for the Second District, last week. Madison was honored with artists from across the country and we stopped by to see her artwork that is now hanging in the Capitol. Congratulations Madison!  https://t.co/qrMdzjlVOb	en	[]	[]	['https://pbs.twimg.com/media/DhG1Ma6X0AANnjM.jpg', 'https://pbs.twimg.com/media/DhG1L_uXkAIzYwF.jpg']	0	0	6	[]	[]	https://twitter.com/DrNealDunnFL2/status/1013790662624514048	False		1	https://pbs.twimg.com/media/DhG1Ma6X0AANnjM.jpg							[]				
1012059037217771523	1012059037217771523	2018-06-27 15:44:12 EDT	2018-06-27	15:44:12	-0400	815952318487298048	drnealdunnfl2	Dr. Neal Dunn		I spoke on the House floor today on the horrible wildfire that has devastated Eastpoint.  https://t.co/2ojqSviOM2	en	[]	[]	[]	4	0	9	[]	[]	https://twitter.com/DrNealDunnFL2/status/1012059037217771523	False		1	https://pbs.twimg.com/ext_tw_video_thumb/1012058948273360898/pu/img/-YOtXFH9bcl-76Bq.jpg							[]				
1012026742314356749	1012026742314356749	2018-06-27 13:35:52 EDT	2018-06-27	13:35:52	-0400	815952318487298048	drnealdunnfl2	Dr. Neal Dunn		Today is a great day for North Florida and the future of the Apalachicola River and Bay. #FloridavGeorgia #WaterWars #SCOTUS Read my full statement here --&gt;  https://t.co/8upsqSHjtc  https://t.co/3xMP1VXbPk	en	[]	['https://dunn.house.gov/index.cfm?p=press-releases&id=70C41BA6-93C6-4120-81AA-695091697CAD']	['https://pbs.twimg.com/media/DgtvvVPW4AIG4t_.png']	2	3	9	['floridavgeorgia', 'waterwars', 'scotus']	[]	https://twitter.com/DrNealDunnFL2/status/1012026742314356749	False		1	https://pbs.twimg.com/media/DgtvvVPW4AIG4t_.png							[]				
1011664973876088832	1011664973876088832	2018-06-26 13:38:20 EDT	2018-06-26	13:38:20	-0400	815952318487298048	drnealdunnfl2	Dr. Neal Dunn		#SCOTUS made the right decision today in upholding @POTUS @realDonaldTrump travel ban.  https://t.co/sOcUxfkcGm	en	[{'screen_name': 'potus', 'name': 'president biden', 'id': '1349149096909668363'}, {'screen_name': 'realdonaldtrump', 'name': 'donald j. trump', 'id': '25073877'}]	[]	['https://pbs.twimg.com/media/Dgonpu8UEAARtlA.png']	7	3	11	['scotus']	[]	https://twitter.com/DrNealDunnFL2/status/1011664973876088832	False		1	https://pbs.twimg.com/media/Dgonpu8UEAARtlA.png							[]				
1011333528255115266	1011333528255115266	2018-06-25 15:41:17 EDT	2018-06-25	15:41:17	-0400	815952318487298048	drnealdunnfl2	Dr. Neal Dunn		As first responders &amp; volunteer firefighters work to begin recovery efforts, we are praying for the victims during these difficult times. Thank you to all who worked tirelessly to contain the blaze.   https://t.co/VEEMTDoGDn	en	[]	['http://www.wctv.tv/content/news/Officials-working-to-contain-Franklin-County-fire-486400281.html']	[]	0	1	3	[]	[]	https://twitter.com/DrNealDunnFL2/status/1011333528255115266	False		0								[]				
1010149521018454017	1010149521018454017	2018-06-22 09:16:28 EDT	2018-06-22	09:16:28	-0400	815952318487298048	drnealdunnfl2	Dr. Neal Dunn		Congratulations to my friend, Tom Neubauer, on winning the the 2018 Defense Community Leadership Award this week. You are a superb advocate for Bay County and military communities across Florida.  https://t.co/HBe6twRmGC	en	[]	[]	[]	3	0	4	[]	[]	https://twitter.com/DrNealDunnFL2/status/1010149521018454017	False		1	https://pbs.twimg.com/ext_tw_video_thumb/1010148935284019201/pu/img/ecNt3NloyGqH1RSc.jpg							[]				
1009905486085443585	1009905486085443585	2018-06-21 17:06:45 EDT	2018-06-21	17:06:45	-0400	815952318487298048	drnealdunnfl2	Dr. Neal Dunn		Today is a great day for Florida farmers – we just passed the 2018 Farm and Food Bill. This historic legislation will ensure that our farmers are protected for years to come #FarmBill2018 Read my full statement here --&gt;  https://t.co/3IjSbGT4nk  https://t.co/njOTwqCd42	en	[]	['https://dunn.house.gov/index.cfm?p=press-releases&id=A45ED9C0-C23F-4C64-9356-AF15D265E93D']	['https://pbs.twimg.com/media/DgPngdGX4AUyaIP.jpg']	7	2	9	['farmbill2018']	[]	https://twitter.com/DrNealDunnFL2/status/1009905486085443585	False		1	https://pbs.twimg.com/media/DgPngdGX4AUyaIP.jpg							[]				
1009825859925094404	1009825850051776513	2018-06-21 11:50:21 EDT	2018-06-21	11:50:21	-0400	815952318487298048	drnealdunnfl2	Dr. Neal Dunn		He has been building better relations and a tighter sense of community between military and civilian communities not only in Bay County, but throughout Florida. Congratulations Tom!  https://t.co/dhydLvmHUG	en	[]	[]	['https://pbs.twimg.com/media/DgOfNtwWAAAiIAP.jpg', 'https://pbs.twimg.com/media/DgOfNF8X4AAMm-y.jpg', 'https://pbs.twimg.com/media/DgOfOI-WsAMBi-5.jpg']	1	0	1	[]	[]	https://twitter.com/DrNealDunnFL2/status/1009825859925094404	False		1	https://pbs.twimg.com/media/DgOfNtwWAAAiIAP.jpg							[]				
1009825850051776513	1009825850051776513	2018-06-21 11:50:18 EDT	2018-06-21	11:50:18	-0400	815952318487298048	drnealdunnfl2	Dr. Neal Dunn		It was an honor to present Tom Neubauer with the 2018 Defense Community Leadership Award this week. Tom has been the leading communicator between our military and civilian communities for as long as I can remember.  https://t.co/INF6ITs5av	en	[]	[]	['https://pbs.twimg.com/media/DgOe9j1XcAEejfV.jpg', 'https://pbs.twimg.com/media/DgOe-kaXUAA6WNX.jpg', 'https://pbs.twimg.com/media/DgOe-eSX0AAokeH.jpg', 'https://pbs.twimg.com/media/DgOe-q6XcAM_e33.jpg']	1	0	3	[]	[]	https://twitter.com/DrNealDunnFL2/status/1009825850051776513	False		1	https://pbs.twimg.com/media/DgOe9j1XcAEejfV.jpg							[]				
1009535696040812545	1009535696040812545	2018-06-20 16:37:20 EDT	2018-06-20	16:37:20	-0400	815952318487298048	drnealdunnfl2	Dr. Neal Dunn		Congratulations to Bay County native, Major General Patrick Sargent on your new posting and thank you for your service.  https://t.co/KE069L4lP7	en	[]	[]	[]	2	0	3	[]	[]	https://twitter.com/DrNealDunnFL2/status/1009535696040812545	False		1	https://pbs.twimg.com/ext_tw_video_thumb/1009535609675964416/pu/img/w4usZir5QhIThdU4.jpg							[]				
1009128786569449472	1009128779216801792	2018-06-19 13:40:26 EDT	2018-06-19	13:40:26	-0400	815952318487298048	drnealdunnfl2	Dr. Neal Dunn		They joined 50,000 students from rural areas across the country to learn about the political process in Washington. Congratulations to these students and I look forward to hearing about the amazing things you accomplish!  https://t.co/xeoRh4wJRK	en	[]	[]	['https://pbs.twimg.com/media/DgElP3nWkAE3brQ.jpg', 'https://pbs.twimg.com/media/DgElPm6W4AAY1qv.jpg', 'https://pbs.twimg.com/media/DgElP2NX4AAkg6o.jpg', 'https://pbs.twimg.com/media/DgElP2RXUAEfGWH.jpg']	1	0	2	[]	[]	https://twitter.com/DrNealDunnFL2/status/1009128786569449472	False		1	https://pbs.twimg.com/media/DgElP3nWkAE3brQ.jpg							[]				
1009128779216801792	1009128779216801792	2018-06-19 13:40:24 EDT	2018-06-19	13:40:24	-0400	815952318487298048	drnealdunnfl2	Dr. Neal Dunn		The Electric Cooperative Youth Tour came to Washington last week with students from seven cooperatives in the Second District. It was great meeting with students from Central Florida, Clay, Gulf Coast, Suwannee Valley, Talquin, Tri-County, and West Florida Electric Cooperatives.  https://t.co/P6G8ZXsUdS	en	[]	[]	['https://pbs.twimg.com/media/DgElKOEXcAEKZjh.jpg', 'https://pbs.twimg.com/media/DgElLJZXUAcTt4g.jpg', 'https://pbs.twimg.com/media/DgElKxaWkAM0suy.jpg', 'https://pbs.twimg.com/media/DgElKwZW4AAg_oC.jpg']	2	0	3	[]	[]	https://twitter.com/DrNealDunnFL2/status/1009128779216801792	False		1	https://pbs.twimg.com/media/DgElKOEXcAEKZjh.jpg							[]				
1007679530839040005	1007679530839040005	2018-06-15 13:41:36 EDT	2018-06-15	13:41:36	-0400	815952318487298048	drnealdunnfl2	Dr. Neal Dunn		Leah and I had a great time at the Twilight Tattoo at Fort Myer this week recognizing the Soldier for Life in honor of the 243rd Birthday of the @USArmy. We even ran into the Levy County Safety Patrol group as we enjoyed the Army’s performances.  https://t.co/R0j0K9nf1S	en	[{'screen_name': 'usarmy', 'name': 'u.s. army', 'id': '8775672'}]	[]	['https://pbs.twimg.com/media/Dfv_J8lWkAAt7A4.jpg', 'https://pbs.twimg.com/media/Dfv_J8nWkAE8gVt.jpg', 'https://pbs.twimg.com/media/Dfv_J8sWAAEjhlX.jpg', 'https://pbs.twimg.com/media/Dfv_J8yX4AEyhZf.jpg']	1	0	3	[]	[]	https://twitter.com/DrNealDunnFL2/status/1007679530839040005	False		1	https://pbs.twimg.com/media/Dfv_J8lWkAAt7A4.jpg							[]				
1007334277032349696	1007334277032349696	2018-06-14 14:49:41 EDT	2018-06-14	14:49:41	-0400	815952318487298048	drnealdunnfl2	Dr. Neal Dunn		Happy 243rd Birthday to the @USArmy - thank you to all who serve and have served this great nation! #ArmyBDay  https://t.co/R7SB6Au1uP	en	[{'screen_name': 'usarmy', 'name': 'u.s. army', 'id': '8775672'}]	[]	['https://pbs.twimg.com/media/DfrFLkOWkAEgzrs.jpg']	1	0	1	['armybday']	[]	https://twitter.com/DrNealDunnFL2/status/1007334277032349696	False		1	https://pbs.twimg.com/media/DfrFLkOWkAEgzrs.jpg							[]				
1007288462528204800	1007288462528204800	2018-06-14 11:47:38 EDT	2018-06-14	11:47:38	-0400	815952318487298048	drnealdunnfl2	Dr. Neal Dunn		Happy Birthday @POTUS @realDonaldTrump! It's an honor to work with you to Make America Great Again!  https://t.co/jxO3Dn1QFx	en	[{'screen_name': 'potus', 'name': 'president biden', 'id': '1349149096909668363'}, {'screen_name': 'realdonaldtrump', 'name': 'donald j. trump', 'id': '25073877'}]	[]	['https://pbs.twimg.com/media/DfqbdrwW4AAVFi9.jpg']	9	2	11	[]	[]	https://twitter.com/DrNealDunnFL2/status/1007288462528204800	False		1	https://pbs.twimg.com/media/DfqbdrwW4AAVFi9.jpg							[]				
1007251926470283264	1007251926470283264	2018-06-14 09:22:27 EDT	2018-06-14	09:22:27	-0400	815952318487298048	drnealdunnfl2	Dr. Neal Dunn		Learn about what Congress is doing to combat the opioid epidemic --&gt;  https://t.co/W6EBSff6WH	en	[]	['https://www.opioidcrisis.gop/']	[]	0	0	1	[]	[]	https://twitter.com/DrNealDunnFL2/status/1007251926470283264	False		0								[]				
1007007818476589058	1007007818476589058	2018-06-13 17:12:27 EDT	2018-06-13	17:12:27	-0400	815952318487298048	drnealdunnfl2	Dr. Neal Dunn		I had a great time meeting with members of the Levy County Safety Patrol, parents and chaperones, and Levy County Sheriff's deputies out in front of the Capitol this week. Thank you to Sgt Max Long for making this happen!  https://t.co/vZEszjBgew	en	[]	[]	['https://pbs.twimg.com/media/DfmcO9UXkAIxaZz.jpg', 'https://pbs.twimg.com/media/DfmcN6ZWAAEEs-y.jpg', 'https://pbs.twimg.com/media/DfmcPOaWAAAwoUa.jpg', 'https://pbs.twimg.com/media/DfmcOo0XcAM-ztY.jpg']	0	0	11	[]	[]	https://twitter.com/DrNealDunnFL2/status/1007007818476589058	False		1	https://pbs.twimg.com/media/DfmcO9UXkAIxaZz.jpg							[]				
1006906079517831169	1006906079517831169	2018-06-13 10:28:11 EDT	2018-06-13	10:28:11	-0400	815952318487298048	drnealdunnfl2	Dr. Neal Dunn		It's great to see @SteveScalise back on the field!  https://t.co/8m6W6Rr9fr	en	[{'screen_name': 'stevescalise', 'name': 'steve scalise', 'id': '1209417007'}]	['https://twitter.com/SteveScalise/status/1006880007669497856']	[]	0	0	8	[]	[]	https://twitter.com/DrNealDunnFL2/status/1006906079517831169	False	https://twitter.com/SteveScalise/status/1006880007669497856	0								[]				
1006886766983426048	1006886766983426048	2018-06-13 09:11:26 EDT	2018-06-13	09:11:26	-0400	815952318487298048	drnealdunnfl2	Dr. Neal Dunn		Over the next two weeks, we will be voting on important legislation aimed at tackling the opioid epidemic from all angles. Yesterday, I spoke on the House floor about this effort. #OpioidCrisis  https://t.co/GDfFrqy1Gk	en	[]	[]	[]	0	0	4	['opioidcrisis']	[]	https://twitter.com/DrNealDunnFL2/status/1006886766983426048	False		1	https://pbs.twimg.com/ext_tw_video_thumb/1006886369795420160/pu/img/BwGMj_CzW2B0NrsK.jpg							[]				
1005142586586288129	1005142586586288129	2018-06-08 13:40:41 EDT	2018-06-08	13:40:41	-0400	815952318487298048	drnealdunnfl2	Dr. Neal Dunn		PASSED --&gt; The Military Construction and Veterans Affairs Appropriations Bill - increasing funding for our veterans to the largest dollar amount in history.  https://t.co/aDMGgnTRxF	en	[]	[]	[]	1	0	8	[]	[]	https://twitter.com/DrNealDunnFL2/status/1005142586586288129	False		1	https://pbs.twimg.com/ext_tw_video_thumb/1005142400531095553/pu/img/v173KuXWp5RCcJYj.jpg							[]				
1005100217086210049	1005100217086210049	2018-06-08 10:52:20 EDT	2018-06-08	10:52:20	-0400	815952318487298048	drnealdunnfl2	Dr. Neal Dunn		As a doctor and a veteran, I have met heroes who need help, but aren’t finding it at the VA. We can change that. Check out my op-ed in the @TDOnline about my efforts to fight the #opioid crisis among our veterans --&gt;  https://t.co/veKQbeEFYT	en	[{'screen_name': 'tdonline', 'name': 'tallahassee democrat', 'id': '15822299'}]	['https://www.tallahassee.com/story/opinion/2018/06/07/no-veteran-should-slip-through-cracks-opinion/679701002/']	[]	17	6	31	['opioid']	[]	https://twitter.com/DrNealDunnFL2/status/1005100217086210049	False		0								[]				
1004904688205094912	1004904688205094912	2018-06-07 21:55:22 EDT	2018-06-07	21:55:22	-0400	815952318487298048	drnealdunnfl2	Dr. Neal Dunn		Government spending is out of control. Tonight we voted to cut unnecessary &amp; wasteful government spending by nearly $15 billion. I came to Washington to drain the swamp &amp; this is a great step towards achieving that goal. #Rescissions	en	[]	[]	[]	22	2	17	['rescissions']	[]	https://twitter.com/DrNealDunnFL2/status/1004904688205094912	False		0								[]				
1004840656148291585	1004840656148291585	2018-06-07 17:40:56 EDT	2018-06-07	17:40:56	-0400	815952318487298048	drnealdunnfl2	Dr. Neal Dunn		Happy birthday @VP Mike Pence!  https://t.co/JIWCB0SgZR	en	[{'screen_name': 'vp', 'name': 'vice president kamala harris', 'id': '803694179079458816'}]	[]	['https://pbs.twimg.com/media/DfHpNz3X0AAtdoN.jpg']	8	2	27	[]	[]	https://twitter.com/DrNealDunnFL2/status/1004840656148291585	False		1	https://pbs.twimg.com/media/DfHpNz3X0AAtdoN.jpg							[]				
1004418110282084352	1004418110282084352	2018-06-06 13:41:53 EDT	2018-06-06	13:41:53	-0400	815952318487298048	drnealdunnfl2	Dr. Neal Dunn		Thanks for the shout-out @POTUS @realDonaldTrump and for your support of my efforts to help veterans fight the opioid crisis and get organ transplant treatments closer to home. By signing the VA MISSION Act today you’ve helped make these initiatives a reality. #VAMISSIONAct  https://t.co/8XI3Ig59fO	en	[{'screen_name': 'potus', 'name': 'president biden', 'id': '1349149096909668363'}, {'screen_name': 'realdonaldtrump', 'name': 'donald j. trump', 'id': '25073877'}]	[]	['https://pbs.twimg.com/media/DfBmKIRXUAElhze.jpg', 'https://pbs.twimg.com/media/DfBmKIcWkAEPT4g.jpg']	3	5	20	['vamissionact']	[]	https://twitter.com/DrNealDunnFL2/status/1004418110282084352	False		1	https://pbs.twimg.com/media/DfBmKIRXUAElhze.jpg							[]				
1004393258485780481	1004393258485780481	2018-06-06 12:03:08 EDT	2018-06-06	12:03:08	-0400	815952318487298048	drnealdunnfl2	Dr. Neal Dunn		Looking forward to joining @POTUS @realDonaldTrump at the White House as he signs the VA MISSION Act of 2018 into law. Tune in here --&gt;  https://t.co/X29HezYD2V	en	[{'screen_name': 'potus', 'name': 'president biden', 'id': '1349149096909668363'}, {'screen_name': 'realdonaldtrump', 'name': 'donald j. trump', 'id': '25073877'}]	['https://www.youtube.com/watch?v=Z8jN0yoFulA']	[]	2	0	11	[]	[]	https://twitter.com/DrNealDunnFL2/status/1004393258485780481	False		0								[]				
1004392198828371968	1004392198828371968	2018-06-06 11:58:55 EDT	2018-06-06	11:58:55	-0400	815952318487298048	drnealdunnfl2	Dr. Neal Dunn		Today we honor the 74th anniversary of D-Day, the beginning of the “Great Crusade,” which led to the Allied liberation of Western Europe from Nazi Germany. Thank you to the Greatest Generation, we will never forget your sacrifices &amp; your heroism continues to inspire us today.  https://t.co/mkupxPFFKu	en	[]	[]	['https://pbs.twimg.com/media/DfBRXmGX0AEskMP.jpg']	2	0	5	[]	[]	https://twitter.com/DrNealDunnFL2/status/1004392198828371968	False		1	https://pbs.twimg.com/media/DfBRXmGX0AEskMP.jpg							[]				
1004189093180379137	1004189093180379137	2018-06-05 22:31:51 EDT	2018-06-05	22:31:51	-0400	815952318487298048	drnealdunnfl2	Dr. Neal Dunn		Congrats @FSU_Softball - 2018 National Champions! #GoNoles  https://t.co/kvt8fVChfY	en	[{'screen_name': 'fsu_softball', 'name': 'florida state softball 🥎', 'id': '30027373'}]	['https://twitter.com/ncaasoftball/status/1004187594979094528']	[]	1	4	20	['gonoles']	[]	https://twitter.com/DrNealDunnFL2/status/1004189093180379137	False	https://twitter.com/ncaasoftball/status/1004187594979094528	0								[]				
1002589739986440193	1002589734328299525	2018-06-01 12:36:35 EDT	2018-06-01	12:36:35	-0400	815952318487298048	drnealdunnfl2	Dr. Neal Dunn		If you are a veteran or know a veteran in the Second District, and you are having issues with the VA please contact my office - we can help. Our veterans fought for our freedoms, they shouldn’t have the fight the government to get the benefits they rightly deserve.  https://t.co/h2zxgPTFP1	en	[]	[]	['https://pbs.twimg.com/media/Denp64fW4AActta.jpg']	3	0	5	[]	[]	https://twitter.com/DrNealDunnFL2/status/1002589739986440193	False		1	https://pbs.twimg.com/media/Denp64fW4AActta.jpg							[]				
1002589734328299525	1002589734328299525	2018-06-01 12:36:34 EDT	2018-06-01	12:36:34	-0400	815952318487298048	drnealdunnfl2	Dr. Neal Dunn		I had a great time having breakfast with local veterans this week at Granny Cantrell’s in Panama City. We discussed their service to our country and issues that they have when dealing with the VA.  https://t.co/ynUtlIV3gZ	en	[]	[]	['https://pbs.twimg.com/media/Denp0lGW4AATK9y.jpg', 'https://pbs.twimg.com/media/Denp3AkWAAE8OEJ.jpg']	1	0	12	[]	[]	https://twitter.com/DrNealDunnFL2/status/1002589734328299525	False		1	https://pbs.twimg.com/media/Denp0lGW4AATK9y.jpg							[]				
1002259964877049857	1002259964877049857	2018-05-31 14:46:11 EDT	2018-05-31	14:46:11	-0400	815952318487298048	drnealdunnfl2	Dr. Neal Dunn		Check out the @OcalaStarBanner editorial on my work fighting for our veterans --&gt;  https://t.co/FsfwwR1qIt	en	[{'screen_name': 'ocalastarbanner', 'name': 'ocala starbanner', 'id': '36948979'}]	['http://www.ocala.com/opinion/20180528/editorial-strong-voice-for-our-veterans']	[]	1	1	2	[]	[]	https://twitter.com/DrNealDunnFL2/status/1002259964877049857	False		0								[]				
1002193196649209856	1002193196649209856	2018-05-31 10:20:52 EDT	2018-05-31	10:20:52	-0400	815952318487298048	drnealdunnfl2	Dr. Neal Dunn		As a doctor and a veteran, I have met heroes who need help, but aren’t finding it at the VA. We can do more for our veterans, and we must do more to support and protect them.  https://t.co/f0gRw0FKja	en	[]	['http://www.mypanhandle.com/news/congressman-neal-dunn-hopeful-veterans-affairs-reform-bill-will-combat-opioid-epidemic/1206647085']	[]	4	2	7	[]	[]	https://twitter.com/DrNealDunnFL2/status/1002193196649209856	False		0								[]				
1001182780108230657	1001182780108230657	2018-05-28 15:25:50 EDT	2018-05-28	15:25:50	-0400	815952318487298048	drnealdunnfl2	Dr. Neal Dunn		Today we honor those brave Americans who gave all to protect our nation and ensure we are free. #MemorialDay  https://t.co/r85WTXxiqL	en	[]	[]	[]	1	0	8	['memorialday']	[]	https://twitter.com/DrNealDunnFL2/status/1001182780108230657	False		1	https://pbs.twimg.com/ext_tw_video_thumb/1001182565250813952/pu/img/PdHNNCnYqC0lB-e_.jpg							[]				
999666812550811648	999666812550811648	2018-05-24 11:01:55 EDT	2018-05-24	11:01:55	-0400	815952318487298048	drnealdunnfl2	Dr. Neal Dunn		Great news - the House just passed the NDAA w/ my amendment to upgrade the F-22 training wing at Tyndall AFB --&gt;  https://t.co/62WausJDLI  https://t.co/4eQtgg5Gxn	en	[]	['https://dunn.house.gov/press-releases?id=63B8F5D5-8171-49EF-AE05-81A122BD269B']	['https://pbs.twimg.com/media/Dd-HotWU0AUIrq0.jpg']	2	0	4	[]	[]	https://twitter.com/DrNealDunnFL2/status/999666812550811648	False		1	https://pbs.twimg.com/media/Dd-HotWU0AUIrq0.jpg							[]				
