id	conversation_id	created_at	date	time	timezone	user_id	username	name	place	tweet	language	mentions	urls	photos	replies_count	retweets_count	likes_count	hashtags	cashtags	link	retweet	quote_url	video	thumbnail	near	geo	source	user_rt_id	user_rt	retweet_id	reply_to	retweet_date	translate	trans_src	trans_dest
1311041830746808320	1311041830746808320	2020-09-29 16:35:05 EDT	2020-09-29	16:35:05	-0400	1262531473057423361	repmikegarcia	Rep. Mike Garcia		The #BobcatFire has burned over 100,000 acres, destroyed over 100 homes, &amp; injured at least 6. Today I sent a letter to the President in support of CA’s request for a another major disaster declaration to ensure our communities have the resources they need to combat this threat.  https://t.co/edhM6s0Bo5	en	[]	[]	['https://pbs.twimg.com/media/EjHBmG-WAAkHJTv.jpg']	7	7	17	['bobcatfire']	[]	https://twitter.com/RepMikeGarcia/status/1311041830746808320	False		1	https://pbs.twimg.com/media/EjHBmG-WAAkHJTv.jpg							[]				
1309525909070807041	1309525907057586178	2020-09-25 12:11:21 EDT	2020-09-25	12:11:21	-0400	1262531473057423361	repmikegarcia	Rep. Mike Garcia		--Allow the $138 billion to go to struggling businesses --Allow small businesses to take a second PPP loan if they show 25% revenue loss --Simplify the PPP loan forgiveness process --Extend the PPP until December 31, 2020	en	[]	[]	[]	9	8	26	[]	[]	https://twitter.com/RepMikeGarcia/status/1309525909070807041	False		0								[]				
1309525907057586178	1309525907057586178	2020-09-25 12:11:20 EDT	2020-09-25	12:11:20	-0400	1262531473057423361	repmikegarcia	Rep. Mike Garcia		Democrats continue to block allocation of $138 billion in unused PPP funds. Today, I was one of the first to sign onto a discharge petition to force a vote on a bill that would:  https://t.co/Vg43diquho	en	[]	[]	['https://pbs.twimg.com/media/Eixe3zxXgAABA4O.jpg']	46	172	517	[]	[]	https://twitter.com/RepMikeGarcia/status/1309525907057586178	False		1	https://pbs.twimg.com/media/Eixe3zxXgAABA4O.jpg							[]				
1309218901960556552	1309218901960556552	2020-09-24 15:51:24 EDT	2020-09-24	15:51:24	-0400	1262531473057423361	repmikegarcia	Rep. Mike Garcia		Today I voted in favor of a bipartisan amendment pkg that would strengthen the grid &amp; increase wildfire preparedness &amp; mitigation for Californians facing the threat of wildfires. As wildfires continue to rage in CA, we must continue to address these important issues in the House.  https://t.co/XfuG4eY9rn	en	[]	[]	['https://pbs.twimg.com/media/EitHprxWAAAxiwn.jpg']	8	14	40	[]	[]	https://twitter.com/RepMikeGarcia/status/1309218901960556552	False		1	https://pbs.twimg.com/media/EitHprxWAAAxiwn.jpg							[]				
1309162277376069645	1309162277376069645	2020-09-24 12:06:24 EDT	2020-09-24	12:06:24	-0400	1262531473057423361	repmikegarcia	Rep. Mike Garcia		If you are impacted by the #BobcatFire or live in an evacuation zone, visit  https://t.co/Svo8hM6eH3 for resources and updates.  https://t.co/8XZzDt8CPR	en	[]	['https://www.211la.org/bobcat-fire']	['https://pbs.twimg.com/media/EisUJyXWAAALkDQ.jpg']	1	3	7	['bobcatfire']	[]	https://twitter.com/RepMikeGarcia/status/1309162277376069645	False		1	https://pbs.twimg.com/media/EisUJyXWAAALkDQ.jpg							[]				
1308902948685180928	1308902947494002695	2020-09-23 18:55:55 EDT	2020-09-23	18:55:55	-0400	1262531473057423361	repmikegarcia	Rep. Mike Garcia		2/2 That’s why I cosponsored the Gig Worker Equity Compensation Act this week in the House, which will preserve the flexibility the gig workforce needs and preempt job-killing bills like AB5 from creeping to the national level.	en	[]	[]	[]	5	12	50	[]	[]	https://twitter.com/RepMikeGarcia/status/1308902948685180928	False		0								[]				
1308902947494002695	1308902947494002695	2020-09-23 18:55:55 EDT	2020-09-23	18:55:55	-0400	1262531473057423361	repmikegarcia	Rep. Mike Garcia		1/2 As millions of Californians remain unemployed due to COVID-19, CA state government is pushing ahead with implementation of the devastating AB5, which will kill an additional hundreds of thousands of jobs. We can’t let this also happen at the federal level.	en	[]	[]	[]	4	59	150	[]	[]	https://twitter.com/RepMikeGarcia/status/1308902947494002695	False		0								[]				
1308849347266777090	1308849346641907714	2020-09-23 15:22:56 EDT	2020-09-23	15:22:56	-0400	1262531473057423361	repmikegarcia	Rep. Mike Garcia		2/2 Over $100 billion in COVID relief funding is available to be provided to struggling businesses right away, but for political reasons, this funding continues to sit unused. Congress must set politics aside and come together for the American people.	en	[]	[]	[]	1	18	65	[]	[]	https://twitter.com/RepMikeGarcia/status/1308849347266777090	False		0								[]				
1308849346641907714	1308849346641907714	2020-09-23 15:22:56 EDT	2020-09-23	15:22:56	-0400	1262531473057423361	repmikegarcia	Rep. Mike Garcia		1/2 Today, I voted to move toward reopening the vital Paycheck Protection Program. Unfortunately, Democrats blocked this effort.	en	[]	[]	[]	12	145	310	[]	[]	https://twitter.com/RepMikeGarcia/status/1308849346641907714	False		0								[]				
1308465542970437637	1308461456665477126	2020-09-22 13:57:50 EDT	2020-09-22	13:57:50	-0400	1262531473057423361	repmikegarcia	Rep. Mike Garcia		Residents needing animal care support can go to the following locations: Large Animals Antelope Valley Fairgrounds: 2551 W Avenue H, Lancaster Dogs, Cats, &amp; Small Animals Lancaster Animal Care Center (ACC): 5210 W Ave I, Lancaster Palmdale ACC: 38550 Sierra Hwy, Palmdale	en	[]	[]	[]	1	5	4	[]	[]	https://twitter.com/RepMikeGarcia/status/1308465542970437637	False		0								[]				
1308461458817191937	1308461456665477126	2020-09-22 13:41:36 EDT	2020-09-22	13:41:36	-0400	1262531473057423361	repmikegarcia	Rep. Mike Garcia		2/2 The Virtual Evacuation Line continues to remain active &amp; supportive in processing residents who are within the mandatory evacuation zone. That number is 800-675-5799.   Residents are urged to remain alert for any additional evacuation orders or warnings that may be issued.	en	[]	[]	[]	1	4	4	[]	[]	https://twitter.com/RepMikeGarcia/status/1308461458817191937	False		0								[]				
1308461456665477126	1308461456665477126	2020-09-22 13:41:35 EDT	2020-09-22	13:41:35	-0400	1262531473057423361	repmikegarcia	Rep. Mike Garcia		1/2 Residents of #CA25 effected by #BOBCATFIRE Fire in the Antelope Valley, the Evacuation Site is @ Palmdale HS and remains active and receiving clients.   TY to the @PalmdaleCity for providing transportation support for residents needing transportation to their assigned hotel.  https://t.co/fShyDetund	en	[{'screen_name': 'palmdalecity', 'name': 'palmdale', 'id': '44372436'}]	[]	['https://pbs.twimg.com/media/EiiWwnFXkAIoe1s.jpg']	5	6	12	['ca25', 'bobcatfire']	[]	https://twitter.com/RepMikeGarcia/status/1308461456665477126	False		1	https://pbs.twimg.com/media/EiiWwnFXkAIoe1s.jpg							[]				
1308205752214052864	1308205752214052864	2020-09-21 20:45:31 EDT	2020-09-21	20:45:31	-0400	1262531473057423361	repmikegarcia	Rep. Mike Garcia		 https://t.co/tGNhMDBF33	und	[]	[]	[]	354	163	588	[]	[]	https://twitter.com/RepMikeGarcia/status/1308205752214052864	False		1	https://pbs.twimg.com/ext_tw_video_thumb/1308203731964637186/pu/img/Z5qIwWDHg3HhvVvx.jpg							[]				
1307012561351716864	1307012557891395586	2020-09-18 13:44:12 EDT	2020-09-18	13:44:12	-0400	1262531473057423361	repmikegarcia	Rep. Mike Garcia		4/4 We have the Air Force to thank for standing up the @SpaceForceDoD which we hope finds a home in our beautiful 25th district as well.   Again, Happy Birthday USAF, and thank you for building stronger leaders to answer the Nation's call!	en	[{'screen_name': 'spaceforcedod', 'name': 'united states space force', 'id': '26572460'}]	[]	[]	1	1	4	[]	[]	https://twitter.com/RepMikeGarcia/status/1307012561351716864	False		0								[]				
1307012560336506880	1307012557891395586	2020-09-18 13:44:12 EDT	2020-09-18	13:44:12	-0400	1262531473057423361	repmikegarcia	Rep. Mike Garcia		3/4 California's 25th District has a special connection to the USAF. In our beautiful Antelope Valley stands @EdwardsAFB. A beacon of ingenuity, technology, and sheer strength.	en	[{'screen_name': 'edwardsafb', 'name': 'edwards air force base', 'id': '213695774'}]	[]	[]	1	1	6	[]	[]	https://twitter.com/RepMikeGarcia/status/1307012560336506880	False		0								[]				
1307012559380328448	1307012557891395586	2020-09-18 13:44:11 EDT	2020-09-18	13:44:11	-0400	1262531473057423361	repmikegarcia	Rep. Mike Garcia		2/4 Men and Women of past and present have shown their courage and integrity protecting our freedoms; some, giving the ultimate sacrifice. For that, we owe them our eternal gratitude.	en	[]	[]	[]	1	1	2	[]	[]	https://twitter.com/RepMikeGarcia/status/1307012559380328448	False		0								[]				
1307012557891395586	1307012557891395586	2020-09-18 13:44:11 EDT	2020-09-18	13:44:11	-0400	1262531473057423361	repmikegarcia	Rep. Mike Garcia		1/4 Today we wish the @usairforce a Happy Birthday. It has been 73 years since the establishment of an independent air Force, and over the last 73 years, our Air Force has made us proud.  https://t.co/kNbBfZfPzt	en	[{'screen_name': 'usairforce', 'name': 'u.s. air force', 'id': '19611483'}]	[]	['https://pbs.twimg.com/media/EiNw_oJWkAguT0v.jpg']	9	4	11	[]	[]	https://twitter.com/RepMikeGarcia/status/1307012557891395586	False		1	https://pbs.twimg.com/media/EiNw_oJWkAguT0v.jpg							[]				
1305970690135330819	1305970688340242434	2020-09-15 16:44:10 EDT	2020-09-15	16:44:10	-0400	1262531473057423361	repmikegarcia	Rep. Mike Garcia		3/3 W/in this renewal of national pride, we need to think big, stand up &amp; wave the American flag w/ honor &amp; be courageous in the face of stupendous challenges. I am the American dream. But at my core, I am a patriot &amp; the responsibility &amp; role I cherish most is being an American.	en	[]	[]	[]	8	3	14	[]	[]	https://twitter.com/RepMikeGarcia/status/1305970690135330819	False		0								[]				
1305970689355153417	1305970688340242434	2020-09-15 16:44:10 EDT	2020-09-15	16:44:10	-0400	1262531473057423361	repmikegarcia	Rep. Mike Garcia		2/3 I had the opportunity to address the audience &amp; speak to one of the 3 central pillars of this contract with the American people; Renewing the American Dream. I believe we as a nation are too strong, we have too much potential to limit ourselves to simple hopes &amp; small dreams.	en	[]	[]	[]	4	3	12	[]	[]	https://twitter.com/RepMikeGarcia/status/1305970689355153417	False		0								[]				
1305970688340242434	1305970688340242434	2020-09-15 16:44:10 EDT	2020-09-15	16:44:10	-0400	1262531473057423361	repmikegarcia	Rep. Mike Garcia		1/3 This morning, I stood on the East Steps of the Capitol Building with @GOPLeader Kevin McCarthy, Republican Whip @SteveScalise, House Republican Conference Chair @RepLizCheney, and members of the House GOP to rollout their Commitment to America.  https://t.co/2cjVk9g4sR	en	[{'screen_name': 'gopleader', 'name': 'kevin mccarthy', 'id': '19739126'}, {'screen_name': 'stevescalise', 'name': 'steve scalise', 'id': '1209417007'}, {'screen_name': 'replizcheney', 'name': 'rep. liz cheney', 'id': '816719802328715264'}]	['https://youtu.be/HD5twayoBMY']	[]	10	6	23	[]	[]	https://twitter.com/RepMikeGarcia/status/1305970688340242434	False		0								[]				
1304912264412106752	1304912262935633920	2020-09-12 18:38:22 EDT	2020-09-12	18:38:22	-0400	1262531473057423361	repmikegarcia	Rep. Mike Garcia		2 of 2 These letters will start going out on September 24th.   Our office can help! The deadline to claim your economic impact payment is October 15th. If you live in California's 25th district, contact one of our three offices, Monday - Friday, between 9 am - 5 pm.	en	[]	[]	[]	2	2	5	[]	[]	https://twitter.com/RepMikeGarcia/status/1304912264412106752	False		0								[]				
1304912262935633920	1304912262935633920	2020-09-12 18:38:22 EDT	2020-09-12	18:38:22	-0400	1262531473057423361	repmikegarcia	Rep. Mike Garcia		1 of 2 An estimated 9 million people still haven't collected the first economic impact payment promised under the CARES Act.  The IRS announced that it is mailing letters to Americans who have not yet gone online to determine whether they're eligible for a stimulus payment.  https://t.co/KFgN39CdFI	en	[]	[]	['https://pbs.twimg.com/media/Ehv6yU5VoAI46jJ.jpg']	11	7	13	[]	[]	https://twitter.com/RepMikeGarcia/status/1304912262935633920	False		1	https://pbs.twimg.com/media/Ehv6yU5VoAI46jJ.jpg							[]				
1303906784428531712	1303906774861320193	2020-09-10 00:02:57 EDT	2020-09-10	00:02:57	-0400	1262531473057423361	repmikegarcia	Rep. Mike Garcia		5 of 5 This wildfire roundtable was a significant opportunity to discuss what we truly need and our priorities to have complete fire suppression efficacy. We will host more events on a regular basis	en	[]	[]	[]	1	1	8	[]	[]	https://twitter.com/RepMikeGarcia/status/1303906784428531712	False		0								[]				
1303906781391810560	1303906774861320193	2020-09-10 00:02:56 EDT	2020-09-10	00:02:56	-0400	1262531473057423361	repmikegarcia	Rep. Mike Garcia		4 of 5 Brush clearance, controlled burns, and more fixed-wing assets earlier in these fights. This is what needs to be done to achieve efficacy in fire suppression in California.	en	[]	[]	[]	2	1	8	[]	[]	https://twitter.com/RepMikeGarcia/status/1303906781391810560	False		0								[]				
1303906778522894336	1303906774861320193	2020-09-10 00:02:56 EDT	2020-09-10	00:02:56	-0400	1262531473057423361	repmikegarcia	Rep. Mike Garcia		3 of 5 We need to fight these fires like we are waging combat: With overwhelming force. The resources we have are well managed; however, we need more, and we need to do more.	en	[]	[]	[]	1	1	5	[]	[]	https://twitter.com/RepMikeGarcia/status/1303906778522894336	False		0								[]				
1303906777541435392	1303906774861320193	2020-09-10 00:02:55 EDT	2020-09-10	00:02:55	-0400	1262531473057423361	repmikegarcia	Rep. Mike Garcia		2 of 5 Our focus was to advance the alignment between all levels of government as we enter the heart of the envelope to ensure we are getting the right resources to the right battlefronts in a timely fashion for the 25th District.	en	[]	[]	[]	1	1	5	[]	[]	https://twitter.com/RepMikeGarcia/status/1303906777541435392	False		0								[]				
1303906774861320193	1303906774861320193	2020-09-10 00:02:55 EDT	2020-09-10	00:02:55	-0400	1262531473057423361	repmikegarcia	Rep. Mike Garcia		1 of 5 Tonight I hosted the USDA Natural Resources &amp; Environment Under Secretary, James Hubbard, at the Command Center for Lake Fire with State Senator @ScottWilkCA &amp; Representatives from the @Angeles_NF, @LACoFDPIO, supervisor @kathrynbarger's Office, &amp; @TomLackey36’s Office.  https://t.co/6juYFMriep	en	[{'screen_name': 'scottwilkca', 'name': 'scott wilk', 'id': '396395609'}, {'screen_name': 'angeles_nf', 'name': 'angeles national forest', 'id': '606625312'}, {'screen_name': 'lacofdpio', 'name': 'l.a. county fire department', 'id': '919373695'}, {'screen_name': 'kathrynbarger', 'name': 'supervisor kathryn barger', 'id': '3165949670'}, {'screen_name': 'tomlackey36', 'name': 'assemblyman lackey', 'id': '563440622'}]	[]	['https://pbs.twimg.com/media/EhhoSwiVgAIeKq_.jpg', 'https://pbs.twimg.com/media/EhhoSwhVgAEdpVB.jpg', 'https://pbs.twimg.com/media/EhhoSwXUwAAzqjT.jpg']	3	6	17	[]	[]	https://twitter.com/RepMikeGarcia/status/1303906774861320193	False		1	https://pbs.twimg.com/media/EhhoSwiVgAIeKq_.jpg							[]				
1301210695619534857	1301210690447978496	2020-09-02 13:29:39 EDT	2020-09-02	13:29:39	-0400	1262531473057423361	repmikegarcia	Rep. Mike Garcia		4 of 4 Santa Clarita is a great place to live thanks to our local law enforcement's hard-working men and women. We need to honor them and fight for their funding at all levels of government.   Thank you, SCV Captain Diez, for the great tour! #thinblueline #DefendThePolice	en	[]	[]	[]	2	0	13	['thinblueline', 'defendthepolice']	[]	https://twitter.com/RepMikeGarcia/status/1301210695619534857	False		0								[]				
1301210694382235648	1301210690447978496	2020-09-02 13:29:39 EDT	2020-09-02	13:29:39	-0400	1262531473057423361	repmikegarcia	Rep. Mike Garcia		3 of 4 The sheriffs would take a hit to the gang units, specialists such as rape investigators, homeless programs, and programs that keep our precious youth engaged in positivity community activities like those in Val Verde (YAL Program).	en	[]	[]	[]	4	0	10	[]	[]	https://twitter.com/RepMikeGarcia/status/1301210694382235648	False		0								[]				
1301210693300092931	1301210690447978496	2020-09-02 13:29:39 EDT	2020-09-02	13:29:39	-0400	1262531473057423361	repmikegarcia	Rep. Mike Garcia		2 of 4 Captain Diez and I discussed the implications of the funding cuts threatened by the county in November.	en	[]	[]	[]	1	0	5	[]	[]	https://twitter.com/RepMikeGarcia/status/1301210693300092931	False		0								[]				
1301210690447978496	1301210690447978496	2020-09-02 13:29:38 EDT	2020-09-02	13:29:38	-0400	1262531473057423361	repmikegarcia	Rep. Mike Garcia		1 of 4 I had the privilege to tour the Santa Clarita Valley Sheriff station Monday with Captain Diez and Lt Lasko.   The sheriffs in SCV are doing a fantastic job protecting us and helping our youth.  https://t.co/cmUeVwYSNV	en	[]	[]	['https://pbs.twimg.com/media/Eg7UORiVgAEq3sa.jpg']	9	6	26	[]	[]	https://twitter.com/RepMikeGarcia/status/1301210690447978496	False		1	https://pbs.twimg.com/media/Eg7UORiVgAEq3sa.jpg							[]				
1300611217719832576	1300611204763848706	2020-08-31 21:47:33 EDT	2020-08-31	21:47:33	-0400	1262531473057423361	repmikegarcia	Rep. Mike Garcia		4 of 4 It was my honor and privilege to present the Gold Valor Award to Cadet Technical Sergeant Matthew Harrison. #saugusstrong  https://t.co/MRzbAFlvwd	en	[]	[]	['https://pbs.twimg.com/media/EgyzAS2U0AA4wAo.jpg']	0	4	19	['saugusstrong']	[]	https://twitter.com/RepMikeGarcia/status/1300611217719832576	False		1	https://pbs.twimg.com/media/EgyzAS2U0AA4wAo.jpg							[]				
1300611208865656832	1300611204763848706	2020-08-31 21:47:31 EDT	2020-08-31	21:47:31	-0400	1262531473057423361	repmikegarcia	Rep. Mike Garcia		3 of 4 And for the students who effectively experienced the terror of combat in the sanctuary of their campus, we cannot let this happen again. But in this case, Harrison demonstrated the courage to act and, in doing so, saved a precious life.	en	[]	[]	[]	1	3	14	[]	[]	https://twitter.com/RepMikeGarcia/status/1300611208865656832	False		0								[]				
1300611208072974336	1300611204763848706	2020-08-31 21:47:30 EDT	2020-08-31	21:47:30	-0400	1262531473057423361	repmikegarcia	Rep. Mike Garcia		2 of 4 Matthew Harrison distinguished himself with acts of gallantry and intrepidity above and well beyond the call of duty of a high school student. My heart breaks for all of the victims and their families.	en	[]	[]	[]	1	1	9	[]	[]	https://twitter.com/RepMikeGarcia/status/1300611208072974336	False		0								[]				
1300611204763848706	1300611204763848706	2020-08-31 21:47:30 EDT	2020-08-31	21:47:30	-0400	1262531473057423361	repmikegarcia	Rep. Mike Garcia		1 of 4 As we are all still healing from the tragic events on the campus of my alma mater @SaugusHigh School that occurred on the 14th of November of last year, today, we paid tribute to one of the amazing heroes who took valiant action to save a fellow student’s life.  https://t.co/LbbOf0hMRg	en	[{'screen_name': 'saugushigh', 'name': 'saugus high school', 'id': '72785446'}]	[]	['https://pbs.twimg.com/media/Egyy-LfU4AAy1V-.jpg', 'https://pbs.twimg.com/media/Egyy-LeVkAA5fWP.jpg', 'https://pbs.twimg.com/media/Egyy-LeU4AAJebi.jpg', 'https://pbs.twimg.com/media/Egyy-LeVkAEz-Sm.jpg']	8	17	64	[]	[]	https://twitter.com/RepMikeGarcia/status/1300611204763848706	False		1	https://pbs.twimg.com/media/Egyy-LfU4AAy1V-.jpg							[]				
1300608468584296448	1300608465283375104	2020-08-31 21:36:37 EDT	2020-08-31	21:36:37	-0400	1262531473057423361	repmikegarcia	Rep. Mike Garcia		2 of 4 Matthew Harrison distinguished himself with acts of gallantry and intrepidity above and well beyond the call of duty of a high school student. My heart breaks for all of the victims and their families.	en	[]	[]	[]	0	3	6	[]	[]	https://twitter.com/RepMikeGarcia/status/1300608468584296448	False		0								[]				
1298008482474467328	1298008482474467328	2020-08-24 17:25:12 EDT	2020-08-24	17:25:12	-0400	1262531473057423361	repmikegarcia	Rep. Mike Garcia		Measure like these are critically important to improving customer service for #Veterans using the VA.  The current interfaces of the VA health system are outdated and are causing many of the unnecessary delays Vets are experiencing still today.	en	[]	[]	[]	10	6	13	['veterans']	[]	https://twitter.com/RepMikeGarcia/status/1298008482474467328	False	https://twitter.com/SecWilkie/status/1297901499620691974	0								[]				
1296966129911566337	1296966129911566337	2020-08-21 20:23:16 EDT	2020-08-21	20:23:16	-0400	1262531473057423361	repmikegarcia	Rep. Mike Garcia		Today, I sent a letter to President @realDonaldTrump, asking him to give full consideration to CA’s request for a major disaster declaration. #CA25 and all of CA were hit hard by the recent fires and we must ensure that every resource is being made available to our communities.  https://t.co/ixJccGN8LK	en	[{'screen_name': 'realdonaldtrump', 'name': 'donald j. trump', 'id': '25073877'}]	[]	['https://pbs.twimg.com/media/Ef-_0cyWAAEqiDn.jpg']	64	28	101	['ca25']	[]	https://twitter.com/RepMikeGarcia/status/1296966129911566337	False		1	https://pbs.twimg.com/media/Ef-_0cyWAAEqiDn.jpg							[]				
1296668005015969793	1296667997281583104	2020-08-21 00:38:37 EDT	2020-08-21	00:38:37	-0400	1262531473057423361	repmikegarcia	Rep. Mike Garcia		Gunnery Sergeant Diego Pongo, USMC (July 19, 1985 – March 8, 2020). May God Bless Diego and be with his family during this most difficult time.	en	[]	[]	[]	0	5	23	[]	[]	https://twitter.com/RepMikeGarcia/status/1296668005015969793	False		0								[]				
1296668004256800768	1296667997281583104	2020-08-21 00:38:37 EDT	2020-08-21	00:38:37	-0400	1262531473057423361	repmikegarcia	Rep. Mike Garcia		Gunnery Sergeant Diego Pongo is survived by his daughter (Avery), his ex-wife (Ms. Randi Savage), his mother and father (Ms. Kathryn Steffen and Mr. Carlos Pongo), and his two brothers and their wives (Jorge and Jenna Pongo &amp; Andres and Andrea Pongo).	en	[]	[]	[]	1	2	23	[]	[]	https://twitter.com/RepMikeGarcia/status/1296668004256800768	False		0								[]				
1296668003598311424	1296667997281583104	2020-08-21 00:38:37 EDT	2020-08-21	00:38:37	-0400	1262531473057423361	repmikegarcia	Rep. Mike Garcia		the Global War on Terrorism Expeditionary Medal, the Global War on Terrorism Service Medal, and four Sea Service Deployment Ribbons.	en	[]	[]	[]	1	1	9	[]	[]	https://twitter.com/RepMikeGarcia/status/1296668003598311424	False		0								[]				
1296668002868486145	1296667997281583104	2020-08-21 00:38:37 EDT	2020-08-21	00:38:37	-0400	1262531473057423361	repmikegarcia	Rep. Mike Garcia		the Navy and Marine Corps Achievement Medal, the Combat Action Ribbon with Gold Star in lieu of 2nd award, the Army Valorous Unit Award, the Good Conduct Medal with 3 Bronze Stars, two Humanitarian Service Medals, the National Defense Medal...	en	[]	[]	[]	1	1	8	[]	[]	https://twitter.com/RepMikeGarcia/status/1296668002868486145	False		0								[]				
1296668002016825344	1296667997281583104	2020-08-21 00:38:37 EDT	2020-08-21	00:38:37	-0400	1262531473057423361	repmikegarcia	Rep. Mike Garcia		Here, he performed the duties of the Regional Operations Chief. Gunnery Sergeant Pongo’s awards include the Bronze Star Medal with Combat “V,” the Purple Heart, the Navy and Marine Corps Commendation Medal with Gold Star in lieu of 2nd award...	en	[]	[]	[]	1	1	8	[]	[]	https://twitter.com/RepMikeGarcia/status/1296668002016825344	False		0								[]				
1296668001115287557	1296667997281583104	2020-08-21 00:38:37 EDT	2020-08-21	00:38:37	-0400	1262531473057423361	repmikegarcia	Rep. Mike Garcia		Gunnery Sergeant Diego Pongo enlisted into the United States Marine Corps in October of 2004. He was assigned to Golf Company 2nd Marine Raider Battalion under the Marine Special Operations Command in 2011 and ultimately was assigned to the Marine Raider Regiment in 2017.	en	[]	[]	[]	1	2	7	[]	[]	https://twitter.com/RepMikeGarcia/status/1296668001115287557	False		0								[]				
1296668000364515328	1296667997281583104	2020-08-21 00:38:36 EDT	2020-08-21	00:38:36	-0400	1262531473057423361	repmikegarcia	Rep. Mike Garcia		We must never forget that there are men and women deployed overseas that are placing themselves in danger every day in defense of the freedoms that we enjoy here at home. May God bless them all and may he embrace Diego in the warmth of his unending love.	en	[]	[]	[]	1	2	8	[]	[]	https://twitter.com/RepMikeGarcia/status/1296668000364515328	False		0								[]				
1296667999613714432	1296667997281583104	2020-08-21 00:38:36 EDT	2020-08-21	00:38:36	-0400	1262531473057423361	repmikegarcia	Rep. Mike Garcia		While #CA25 mourns his loss, we also give thanks for his selfless sacrifice and the sacrifices of his family. Gunnery Sergeant Diego Pongo represents the best of us and will forever be remembered as a true American hero and patriot.	en	[]	[]	[]	1	1	8	['ca25']	[]	https://twitter.com/RepMikeGarcia/status/1296667999613714432	False		0								[]				
1296667998749519872	1296667997281583104	2020-08-21 00:38:36 EDT	2020-08-21	00:38:36	-0400	1262531473057423361	repmikegarcia	Rep. Mike Garcia		Today, I was humbled &amp; honored to attend a funeral service in honor of Gunnery Sergeant Diego Pongo, USMC, in Arlington National Cemetery with his family. The Pongos are residents of Simi Valley. Diego was a true hero to our nation &amp; was killed in action on March 8, 2020 in Iraq.	en	[]	[]	[]	1	3	12	[]	[]	https://twitter.com/RepMikeGarcia/status/1296667998749519872	False		0								[]				
