id	conversation_id	created_at	date	time	timezone	user_id	username	name	place	tweet	language	mentions	urls	photos	replies_count	retweets_count	likes_count	hashtags	cashtags	link	retweet	quote_url	video	thumbnail	near	geo	source	user_rt_id	user_rt	retweet_id	reply_to	retweet_date	translate	trans_src	trans_dest
880427033922326528	880427033922326528	2017-06-29 10:05:37 EDT	2017-06-29	10:05:37	-0400	249288197	samspressshop	Sam Johnson		But today, we’re focusing on the close to 3/4 of state &amp; local workers who are covered…	en	[]	[]	[]	0	0	0	[]	[]	https://twitter.com/SamsPressShop/status/880427033922326528	False		0								[]				
880426991043956736	880426991043956736	2017-06-29 10:05:26 EDT	2017-06-29	10:05:26	-0400	249288197	samspressshop	Sam Johnson		Usually when we talk about state &amp; local workers &amp; Social Security, we talk about how many of them aren’t covered by Social Security	en	[]	[]	[]	0	0	0	[]	[]	https://twitter.com/SamsPressShop/status/880426991043956736	False		0								[]				
880426927441539072	880426927441539072	2017-06-29 10:05:11 EDT	2017-06-29	10:05:11	-0400	249288197	samspressshop	Sam Johnson		WATCH: @WaysandMeansGOP hearing on Social Security coverage, payroll tax compliance for state/local gov employees  https://t.co/geyKlumosw	en	[{'screen_name': 'waysandmeansgop', 'name': 'ways and means gop', 'id': '12788332'}]	['http://bit.ly/2sXMzHM']	[]	0	3	1	[]	[]	https://twitter.com/SamsPressShop/status/880426927441539072	False		0								[]				
879720068216737792	879720068216737792	2017-06-27 11:16:23 EDT	2017-06-27	11:16:23	-0400	249288197	samspressshop	Sam Johnson		"@taxreformer supports my commonsense ""No Bonuses for Tax Delinquent IRS Employees Act!  LEARN MORE HERE:  https://t.co/UQF8ducj0q"	en	[]	['http://www.atr.org/atr-supports-representative-johnsons-no-bonuses-tax-delinquent-irs-employees-act']	[]	0	0	0	[]	[]	https://twitter.com/SamsPressShop/status/879720068216737792	False		0								[]				
874972541714132992	874972541714132992	2017-06-14 08:51:24 EDT	2017-06-14	08:51:24	-0400	249288197	samspressshop	Sam Johnson		Lifting in prayer @SteveScalise &amp; all who were targeted this morning @ baseball practice. Praying for strength &amp; healing. God bless you.	en	[{'screen_name': 'stevescalise', 'name': 'steve scalise', 'id': '1209417007'}]	[]	[]	5	8	15	[]	[]	https://twitter.com/SamsPressShop/status/874972541714132992	False		0								[]				
868099878026661890	868099878026661890	2017-05-26 09:41:54 EDT	2017-05-26	09:41:54	-0400	249288197	samspressshop	Sam Johnson		ICYMI: My oped  about how the gov's own rules are blocking people f/ getting off of disability  https://t.co/Ji4bxfYQRy via @dallasnews	en	[{'screen_name': 'dallasnews', 'name': 'dallas morning news', 'id': '15679641'}]	['https://www.dallasnews.com/opinion/commentary/2017/05/25/governments-rules-blocking-people-getting-disability']	[]	6	3	4	[]	[]	https://twitter.com/SamsPressShop/status/868099878026661890	False		0								[]				
859044105170677760	859044105170677760	2017-05-01 09:57:29 EDT	2017-05-01	09:57:29	-0400	249288197	samspressshop	Sam Johnson		VOTE NOW for the 2017 Art Competition's People's Choice Award!  Our high school students appreciate your support!  https://t.co/T5P6HwQgm9	en	[]	['http://bit.ly/2p0Dd8G']	[]	10	2	3	[]	[]	https://twitter.com/SamsPressShop/status/859044105170677760	False		0								[]				
857248888738238465	857248888738238465	2017-04-26 11:03:56 EDT	2017-04-26	11:03:56	-0400	249288197	samspressshop	Sam Johnson		Thank you to our witnesses for their testimony &amp; our Members for being here 6/6	en	[]	[]	[]	3	1	3	[]	[]	https://twitter.com/SamsPressShop/status/857248888738238465	False		0								[]				
857248856647630849	857248856647630849	2017-04-26 11:03:48 EDT	2017-04-26	11:03:48	-0400	249288197	samspressshop	Sam Johnson		I’m committed to working w/ Social Security &amp; all of my colleagues to make sure the agency has all the tools it needs to stop fraud 5/6	en	[]	[]	[]	0	0	6	[]	[]	https://twitter.com/SamsPressShop/status/857248856647630849	False		0								[]				
857248824972259329	857248824972259329	2017-04-26 11:03:41 EDT	2017-04-26	11:03:41	-0400	249288197	samspressshop	Sam Johnson		While Social Security has taken important steps to prevent fraud, there is still work to be done 4/6	en	[]	[]	[]	1	0	4	[]	[]	https://twitter.com/SamsPressShop/status/857248824972259329	False		0								[]				
857248792516734976	857248792516734976	2017-04-26 11:03:33 EDT	2017-04-26	11:03:33	-0400	249288197	samspressshop	Sam Johnson		We need to make sure that fraudsters don’t continue to benefit at the expense of hardworking taxpayers 3/6	en	[]	[]	[]	4	0	4	[]	[]	https://twitter.com/SamsPressShop/status/857248792516734976	False		0								[]				
857248759704670208	857248759704670208	2017-04-26 11:03:25 EDT	2017-04-26	11:03:25	-0400	249288197	samspressshop	Sam Johnson		We all agree that disability fraud is a serious issue 2/6	en	[]	[]	[]	0	0	2	[]	[]	https://twitter.com/SamsPressShop/status/857248759704670208	False		0								[]				
857248728322891777	857248728322891777	2017-04-26 11:03:18 EDT	2017-04-26	11:03:18	-0400	249288197	samspressshop	Sam Johnson		@WaysandMeansGOP Social Security Subcommittee hearing on preventing &amp; identifying disability fraud is wrapping up 1/6	en	[]	[]	[]	0	0	0	[]	[]	https://twitter.com/SamsPressShop/status/857248728322891777	False		0								[]				
857246271312101376	857246271312101376	2017-04-26 10:53:32 EDT	2017-04-26	10:53:32	-0400	249288197	samspressshop	Sam Johnson		He said fraud prosecution is important &amp; they’re working to increase preventative activities to identify fraud quicker with AFES 6/6	en	[]	[]	[]	0	1	2	[]	[]	https://twitter.com/SamsPressShop/status/857246271312101376	False		0								[]				
857246207458115588	857246207458115588	2017-04-26 10:53:17 EDT	2017-04-26	10:53:17	-0400	249288197	samspressshop	Sam Johnson		I asked Mr. Brune if this new software would make it harder to get the DOJ to prosecute if the fraud schemes $ are on the smaller scale 5/6	en	[]	[]	[]	0	1	2	[]	[]	https://twitter.com/SamsPressShop/status/857246207458115588	False		0								[]				
857246158204407808	857246158204407808	2017-04-26 10:53:05 EDT	2017-04-26	10:53:05	-0400	249288197	samspressshop	Sam Johnson		SSA’s new anti-fraud software sounds like it should quickly identify fraud &amp; avoid multi-million $ fraud schemes, which is a good thing 4/6	en	[]	[]	[]	0	1	2	[]	[]	https://twitter.com/SamsPressShop/status/857246158204407808	False		0								[]				
857246075454935040	857246075454935040	2017-04-26 10:52:45 EDT	2017-04-26	10:52:45	-0400	249288197	samspressshop	Sam Johnson		He pointed to the Anti-Fraud Enterprise Solution (AFES) data analytics software package 3/6	en	[]	[]	[]	0	1	2	[]	[]	https://twitter.com/SamsPressShop/status/857246075454935040	False		0								[]				
857245999739305985	857245999739305985	2017-04-26 10:52:27 EDT	2017-04-26	10:52:27	-0400	249288197	samspressshop	Sam Johnson		I asked Mr. Brune what SSA is doing on this front &amp; what role SSA’s Special Assistant U.S. Attorneys play… 2/6	en	[]	[]	[]	0	1	2	[]	[]	https://twitter.com/SamsPressShop/status/857245999739305985	False		0								[]				
857245932949307392	857245932949307392	2017-04-26 10:52:11 EDT	2017-04-26	10:52:11	-0400	249288197	samspressshop	Sam Johnson		One of my longstanding frustrations is how hard it’s been for SSA to get some of its fraud cases prosecuted 1/6	en	[]	[]	[]	0	1	2	[]	[]	https://twitter.com/SamsPressShop/status/857245932949307392	False		0								[]				
857236811789344768	857236811789344768	2017-04-26 10:15:57 EDT	2017-04-26	10:15:57	-0400	249288197	samspressshop	Sam Johnson		I thank our witnesses for being here today and I look forward to hearing their testimony.  12/12	en	[]	[]	[]	1	0	2	[]	[]	https://twitter.com/SamsPressShop/status/857236811789344768	False		0								[]				
857236757846401024	857236757846401024	2017-04-26 10:15:44 EDT	2017-04-26	10:15:44	-0400	249288197	samspressshop	Sam Johnson		If left undiscovered, fraud rings like Eric Conn &amp; New York City have the potential to cost hard-working taxpayers billions of dollars 11/12	en	[]	[]	[]	0	0	1	[]	[]	https://twitter.com/SamsPressShop/status/857236757846401024	False		0								[]				
857236622986944512	857236622986944512	2017-04-26 10:15:12 EDT	2017-04-26	10:15:12	-0400	249288197	samspressshop	Sam Johnson		Stopping fraud is a goal we all share. SS has increased its efforts to fight fraud, but we need to be sure it’s doing all it can 10/12	en	[]	[]	[]	2	1	3	[]	[]	https://twitter.com/SamsPressShop/status/857236622986944512	False		0								[]				
857236102368952320	857236102368952320	2017-04-26 10:13:08 EDT	2017-04-26	10:13:08	-0400	249288197	samspressshop	Sam Johnson		Today the GAO will release its 1st report looking at agency efforts under its new Framework for Managing Fraud Risks. 9/12	en	[]	[]	[]	0	0	1	[]	[]	https://twitter.com/SamsPressShop/status/857236102368952320	False		0								[]				
857236024610738181	857236024610738181	2017-04-26 10:12:49 EDT	2017-04-26	10:12:49	-0400	249288197	samspressshop	Sam Johnson		Social Security has a number of anti-fraud initiatives, but w/o any way to judge their effectiveness, we don’t know if they’re working 8/12	en	[]	[]	[]	2	0	2	[]	[]	https://twitter.com/SamsPressShop/status/857236024610738181	False		0								[]				
857235947406200832	857235947406200832	2017-04-26 10:12:31 EDT	2017-04-26	10:12:31	-0400	249288197	samspressshop	Sam Johnson		Today we’re taking a hard look at Social Security’s efforts to fight fraud in its disability programs. 7/12	en	[]	[]	[]	0	0	1	[]	[]	https://twitter.com/SamsPressShop/status/857235947406200832	False		0								[]				
857235887993884675	857235887993884675	2017-04-26 10:12:17 EDT	2017-04-26	10:12:17	-0400	249288197	samspressshop	Sam Johnson		Bottom-line:  Social Security has got to be one step ahead of the fraudsters 6/12	en	[]	[]	[]	0	3	6	[]	[]	https://twitter.com/SamsPressShop/status/857235887993884675	False		0								[]				
857235620044910601	857235620044910601	2017-04-26 10:11:13 EDT	2017-04-26	10:11:13	-0400	249288197	samspressshop	Sam Johnson		The Bipartisan Budget Act '15 included commonsense ideas to address problems these cases brought to light, but we're playing catch-up 5/12	en	[]	[]	[]	0	0	1	[]	[]	https://twitter.com/SamsPressShop/status/857235620044910601	False		0								[]				
857235507914436608	857235507914436608	2017-04-26 10:10:46 EDT	2017-04-26	10:10:46	-0400	249288197	samspressshop	Sam Johnson		...NYC police officers &amp; firefighters claimed 9/11-related injuries when many hadn’t been to Ground Zero  https://t.co/BgqoIrslKL 4/12	en	[]	['http://on.wsj.com/2oJdjVO']	[]	2	4	6	[]	[]	https://twitter.com/SamsPressShop/status/857235507914436608	False		0								[]				
857235387042992129	857235387042992129	2017-04-26 10:10:17 EDT	2017-04-26	10:10:17	-0400	249288197	samspressshop	Sam Johnson		ICYMI, Eric Conn is a SS fraudster who recently pled guilty to a $550 million scheme…  https://t.co/g5uoi97RGw 3/12	en	[]	['http://nydn.us/2n2fTp7']	[]	2	3	6	[]	[]	https://twitter.com/SamsPressShop/status/857235387042992129	False		0								[]				
857235290351652868	857235290351652868	2017-04-26 10:09:54 EDT	2017-04-26	10:09:54	-0400	249288197	samspressshop	Sam Johnson		Recent scandals reveal fraud rings made up of doctors, lawyers &amp; even Social Security’s employees. 2/12	en	[]	[]	[]	0	1	1	[]	[]	https://twitter.com/SamsPressShop/status/857235290351652868	False		0								[]				
857235214657085440	857235214657085440	2017-04-26 10:09:36 EDT	2017-04-26	10:09:36	-0400	249288197	samspressshop	Sam Johnson		WATCH LIVE: @WaysandMeansGOP Social Security Subcommittee hearing on preventing &amp; identifying disability fraud  https://t.co/gEBjLdv3U3 1/12	en	[{'screen_name': 'waysandmeansgop', 'name': 'ways and means gop', 'id': '12788332'}]	['http://bit.ly/2phYbkj']	[]	0	2	7	[]	[]	https://twitter.com/SamsPressShop/status/857235214657085440	False		0								[]				
849653408596471814	849653408596471814	2017-04-05 12:02:13 EDT	2017-04-05	12:02:13	-0400	249288197	samspressshop	Sam Johnson		Congratulations to our Frisco combined team on winning the HS hockey national championship!  https://t.co/jcA2ufxCxk #friscoyouknow	en	[]	['http://p.d-news.co/ddn0']	[]	0	1	5	['friscoyouknow']	[]	https://twitter.com/SamsPressShop/status/849653408596471814	False		0								[]				
847111846750556160	847111846750556160	2017-03-29 11:42:57 EDT	2017-03-29	11:42:57	-0400	249288197	samspressshop	Sam Johnson		On #vietnamveteransday, I encourage vet &amp; families to RSVP to attend the Veterans History Project workshop April 8  https://t.co/ortjtFaZ7C	en	[]	['https://goo.gl/d6OKCY']	[]	6	0	4	['vietnamveteransday']	[]	https://twitter.com/SamsPressShop/status/847111846750556160	False		0								[]				
844568047939698688	844568047939698688	2017-03-22 11:14:48 EDT	2017-03-22	11:14:48	-0400	249288197	samspressshop	Sam Johnson		ICYMI: my bill to save small business from #ObamaCare!  @RepWalberg  https://t.co/wob8OPzPrp via @WSJOpinion	en	[{'screen_name': 'repwalberg', 'name': 'rep tim walberg', 'id': '237862972'}, {'screen_name': 'wsjopinion', 'name': 'wsj editorial page', 'id': '7228682'}]	['https://www.wsj.com/articles/save-small-business-from-obamacare-1490138524']	[]	11	0	4	['obamacare']	[]	https://twitter.com/SamsPressShop/status/844568047939698688	False		0								[]				
839585505897508868	839585505897508868	2017-03-08 16:15:58 EST	2017-03-08	16:15:58	-0400	249288197	samspressshop	Sam Johnson		ICYMI, today @EdWorkforce passed my bill to help #smallbiz join together for more affordable health care plans!  https://t.co/m9zo37STtF	en	[]	['https://twitter.com/EdWorkforce/status/839513980804689925']	[]	2	1	3	['smallbiz']	[]	https://twitter.com/SamsPressShop/status/839585505897508868	False	https://twitter.com/EdWorkforce/status/839513980804689925	0								[]				
837038597022838784	837038597022838784	2017-03-01 15:35:27 EST	2017-03-01	15:35:27	-0400	249288197	samspressshop	Sam Johnson		ICYMI, here's my response to President Trump’s Joint Session of Congress address last night  https://t.co/WVZOtTOEaF	en	[]	['https://goo.gl/nNm1Bf']	[]	0	1	1	[]	[]	https://twitter.com/SamsPressShop/status/837038597022838784	False		0								[]				
828986321465200640	828986321465200640	2017-02-07 10:18:35 EST	2017-02-07	10:18:35	-0400	249288197	samspressshop	Sam Johnson		I thank our witnesses for being here today and I look forward to hearing their testimony. (25/25)	en	[]	[]	[]	16	1	4	[]	[]	https://twitter.com/SamsPressShop/status/828986321465200640	False		0								[]				
828986270529572868	828986270529572868	2017-02-07 10:18:23 EST	2017-02-07	10:18:23	-0400	249288197	samspressshop	Sam Johnson		We can all agree that the American people deserve better, and Social Security must take this responsibility seriously.  (24/25)	en	[]	[]	[]	5	1	5	[]	[]	https://twitter.com/SamsPressShop/status/828986270529572868	False		0								[]				
828986239537803264	828986239537803264	2017-02-07 10:18:15 EST	2017-02-07	10:18:15	-0400	249288197	samspressshop	Sam Johnson		But unless the person comes to Social Security and says “I now need help,” it’s hard for SS to figure it out. (23/25)	en	[]	[]	[]	2	1	5	[]	[]	https://twitter.com/SamsPressShop/status/828986239537803264	False		0								[]				
828986189977939968	828986189977939968	2017-02-07 10:18:04 EST	2017-02-07	10:18:04	-0400	249288197	samspressshop	Sam Johnson		Just because someone doesn’t need a rep payee when they 1st claim benefits doesn’t mean they won’t need help later. (22/25)	en	[]	[]	[]	0	1	4	[]	[]	https://twitter.com/SamsPressShop/status/828986189977939968	False		0								[]				
828986128984317958	828986128984317958	2017-02-07 10:17:49 EST	2017-02-07	10:17:49	-0400	249288197	samspressshop	Sam Johnson		Another concern is that SS doesn’t have a way to see if someone’s ability to manage their benefits has changed over time.  (21/25)	en	[]	[]	[]	1	1	4	[]	[]	https://twitter.com/SamsPressShop/status/828986128984317958	False		0								[]				
828986079772545025	828986079772545025	2017-02-07 10:17:37 EST	2017-02-07	10:17:37	-0400	249288197	samspressshop	Sam Johnson		It’s hard to be sure if decisions that are being made are the right ones when evidence is missing.  (20/25)	en	[]	[]	[]	1	1	2	[]	[]	https://twitter.com/SamsPressShop/status/828986079772545025	False		0								[]				
828986012894363648	828986012894363648	2017-02-07 10:17:21 EST	2017-02-07	10:17:21	-0400	249288197	samspressshop	Sam Johnson		According to a 2015 study, more than 3/4 of cases reviewed were incomplete &amp; over 40% were missing required lay evidence.  (19/25)	en	[]	[]	[]	2	0	2	[]	[]	https://twitter.com/SamsPressShop/status/828986012894363648	False		0								[]				
828985940970463237	828985940970463237	2017-02-07 10:17:04 EST	2017-02-07	10:17:04	-0400	249288197	samspressshop	Sam Johnson		One concern is that SS employees routinely fail to complete “capability determination” tests…  (18/25)	en	[]	[]	[]	0	1	3	[]	[]	https://twitter.com/SamsPressShop/status/828985940970463237	False		0								[]				
828985875136643072	828985875136643072	2017-02-07 10:16:49 EST	2017-02-07	10:16:49	-0400	249288197	samspressshop	Sam Johnson		The Institute of Medicine, Social Security IG, &amp; Social Security have ALL raised serious questions about the rep payee program (17/25)	en	[]	[]	[]	0	0	1	[]	[]	https://twitter.com/SamsPressShop/status/828985875136643072	False		0								[]				
828985823223767041	828985823223767041	2017-02-07 10:16:36 EST	2017-02-07	10:16:36	-0400	249288197	samspressshop	Sam Johnson		Deciding who needs help managing benefits is an important responsibility, and Social Security has to get it right.  (16/25)	en	[]	[]	[]	2	1	3	[]	[]	https://twitter.com/SamsPressShop/status/828985823223767041	False		0								[]				
828985783273000960	828985783273000960	2017-02-07 10:16:27 EST	2017-02-07	10:16:27	-0400	249288197	samspressshop	Sam Johnson		Lay evidence = evidence other than legal or medical evidence that provides info about whether someone can manage their money. (15/25)	en	[]	[]	[]	0	0	1	[]	[]	https://twitter.com/SamsPressShop/status/828985783273000960	False		0								[]				
828985638686978048	828985638686978048	2017-02-07 10:15:52 EST	2017-02-07	10:15:52	-0400	249288197	samspressshop	Sam Johnson		SS field office employees use lay and medical evidence to make this decision – and lay evidence is the deciding factor. (14/25)	en	[]	[]	[]	0	0	1	[]	[]	https://twitter.com/SamsPressShop/status/828985638686978048	False		0								[]				
828985607779135489	828985607779135489	2017-02-07 10:15:45 EST	2017-02-07	10:15:45	-0400	249288197	samspressshop	Sam Johnson		In the latter case, Social Security conducts what’s called a “capability determination” to see if the person needs assistance. (13/25)	en	[]	[]	[]	1	0	1	[]	[]	https://twitter.com/SamsPressShop/status/828985607779135489	False		0								[]				
828985444968833025	828985444968833025	2017-02-07 10:15:06 EST	2017-02-07	10:15:06	-0400	249288197	samspressshop	Sam Johnson		Some ppl w/ rep payees decide for themselves they need help.  Other times a Social Security employee suggests someone needs help. (12/25)	en	[]	[]	[]	0	0	1	[]	[]	https://twitter.com/SamsPressShop/status/828985444968833025	False		0								[]				
828985373355339776	828985373355339776	2017-02-07 10:14:49 EST	2017-02-07	10:14:49	-0400	249288197	samspressshop	Sam Johnson		That’s about 5.5 million ppl. And it doesn’t include those receiving Supplemental Security Income w/ representative payees (11/25)	en	[]	[]	[]	0	0	1	[]	[]	https://twitter.com/SamsPressShop/status/828985373355339776	False		0								[]				
828985330879586306	828985330879586306	2017-02-07 10:14:39 EST	2017-02-07	10:14:39	-0400	249288197	samspressshop	Sam Johnson		Did you know about 9% of those receiving Social Security benefits get help from a representative payee to manage their benefits? (10/25)	en	[]	[]	[]	1	1	2	[]	[]	https://twitter.com/SamsPressShop/status/828985330879586306	False		0								[]				
828985279696474112	828985279696474112	2017-02-07 10:14:27 EST	2017-02-07	10:14:27	-0400	249288197	samspressshop	Sam Johnson		Today’s hearing will focus on 1) those who need help, &amp; 2) the process Social Security uses to identify them.  (9/25)	en	[]	[]	[]	0	0	1	[]	[]	https://twitter.com/SamsPressShop/status/828985279696474112	False		0								[]				
828985243055095808	828985243055095808	2017-02-07 10:14:18 EST	2017-02-07	10:14:18	-0400	249288197	samspressshop	Sam Johnson		We'll need to work together to ensure the rep payee program meets today’s challenges. It's too important not to get it right. (8/25)	en	[]	[]	[]	0	0	0	[]	[]	https://twitter.com/SamsPressShop/status/828985243055095808	False		0								[]				
828985171680645120	828985171680645120	2017-02-07 10:14:01 EST	2017-02-07	10:14:01	-0400	249288197	samspressshop	Sam Johnson		After the hearings, I ask Social Security to send a report covering challenges as well as required improvements &amp; legislative needs. (7/25)	en	[]	[]	[]	0	0	1	[]	[]	https://twitter.com/SamsPressShop/status/828985171680645120	False		0								[]				
828985046623191042	828985046623191042	2017-02-07 10:13:31 EST	2017-02-07	10:13:31	-0400	249288197	samspressshop	Sam Johnson		And we need to see if there are any changes needed in the program to ensure Americans receive the service they expect &amp; deserve. (6/25)	en	[]	[]	[]	1	1	1	[]	[]	https://twitter.com/SamsPressShop/status/828985046623191042	False		0								[]				
828985008610230273	828985008610230273	2017-02-07 10:13:22 EST	2017-02-07	10:13:22	-0400	249288197	samspressshop	Sam Johnson		We need to make sure Social Security is improving to meet today’s challenges… (5/25)	en	[]	[]	[]	0	1	4	[]	[]	https://twitter.com/SamsPressShop/status/828985008610230273	False		0								[]				
828984975500382209	828984975500382209	2017-02-07 10:13:14 EST	2017-02-07	10:13:14	-0400	249288197	samspressshop	Sam Johnson		We need to make sure Social Security’s representative payee program is working the way it should… (4/25)	en	[]	[]	[]	0	1	1	[]	[]	https://twitter.com/SamsPressShop/status/828984975500382209	False		0								[]				
828984888854450176	828984888854450176	2017-02-07 10:12:53 EST	2017-02-07	10:12:53	-0400	249288197	samspressshop	Sam Johnson		The last time Congress made changes to the representative payee program was 13 yrs ago.  Today we are taking a fresh look. (3/25)	en	[]	[]	[]	0	1	2	[]	[]	https://twitter.com/SamsPressShop/status/828984888854450176	False		0								[]				
828984847867715585	828984847867715585	2017-02-07 10:12:44 EST	2017-02-07	10:12:44	-0400	249288197	samspressshop	Sam Johnson		Who are representative payees? They're people Social Security authorizes to receive benefit payments on behalf of a beneficiary. (2/25)	en	[]	[]	[]	0	1	1	[]	[]	https://twitter.com/SamsPressShop/status/828984847867715585	False		0								[]				
828984765499965440	828984765499965440	2017-02-07 10:12:24 EST	2017-02-07	10:12:24	-0400	249288197	samspressshop	Sam Johnson		WATCH LIVE as I chair the 1st of 2 @WaysandMeansGOP Social Security hearings on representative payees!   https://t.co/OG9Rcdgoqe (1/25)	en	[{'screen_name': 'waysandmeansgop', 'name': 'ways and means gop', 'id': '12788332'}]	['http://waysandmeans.house.gov/live']	[]	0	3	4	[]	[]	https://twitter.com/SamsPressShop/status/828984765499965440	False		0								[]				
827237937049911297	827237937049911297	2017-02-02 14:31:08 EST	2017-02-02	14:31:08	-0400	249288197	samspressshop	Sam Johnson		We MUST act today to protect the 2nd Amendment rights of individuals w/ disabilities.  I urge adoption of House Joint Resolution 40. (7/7)	en	[]	[]	[]	9	0	2	[]	[]	https://twitter.com/SamsPressShop/status/827237937049911297	False		0								[]				
827237899879981057	827237899879981057	2017-02-02 14:30:59 EST	2017-02-02	14:30:59	-0400	249288197	samspressshop	Sam Johnson		As the ACLU said:   https://t.co/fXBiMTm02D  https://t.co/5MT6il27b5	en	[]	['http://samjohnson.house.gov/uploadedfiles/aclu_letter_re_cra_hj_res_37_and_hj_res_40.pdf']	['https://pbs.twimg.com/media/C3rweM9XAAAEe3r.jpg']	2	0	3	[]	[]	https://twitter.com/SamsPressShop/status/827237899879981057	False		1	https://pbs.twimg.com/media/C3rweM9XAAAEe3r.jpg							[]				
827237845291171840	827237845291171840	2017-02-02 14:30:46 EST	2017-02-02	14:30:46	-0400	249288197	samspressshop	Sam Johnson		This disapproval resolution is supported across the political spectrum: f/ the disability community, to the @NRA, to the @ACLU.  (5/7)	en	[{'screen_name': 'nra', 'name': 'nra', 'id': '21829541'}, {'screen_name': 'aclu', 'name': 'aclu', 'id': '13393052'}]	[]	[]	1	0	2	[]	[]	https://twitter.com/SamsPressShop/status/827237845291171840	False		0								[]				
827237813812883456	827237813812883456	2017-02-02 14:30:38 EST	2017-02-02	14:30:38	-0400	249288197	samspressshop	Sam Johnson		Furthermore, needing help to manage your benefits does NOT make you dangerous. (4/7)	en	[]	[]	[]	0	0	5	[]	[]	https://twitter.com/SamsPressShop/status/827237813812883456	False		0								[]				
827237784716984321	827237784716984321	2017-02-02 14:30:31 EST	2017-02-02	14:30:31	-0400	249288197	samspressshop	Sam Johnson		Just because someone has a disability does NOT mean they’re a threat to society. (3/7)	en	[]	[]	[]	3	0	4	[]	[]	https://twitter.com/SamsPressShop/status/827237784716984321	False		0								[]				
827237748977332224	827237748977332224	2017-02-02 14:30:23 EST	2017-02-02	14:30:23	-0400	249288197	samspressshop	Sam Johnson		My resolution today is about the constitutional rights of individuals with disabilities. (2/7)	en	[]	[]	[]	0	1	2	[]	[]	https://twitter.com/SamsPressShop/status/827237748977332224	False		0								[]				
