id	conversation_id	created_at	date	time	timezone	user_id	username	name	place	tweet	language	mentions	urls	photos	replies_count	retweets_count	likes_count	hashtags	cashtags	link	retweet	quote_url	video	thumbnail	near	geo	source	user_rt_id	user_rt	retweet_id	reply_to	retweet_date	translate	trans_src	trans_dest
623599563790807041	623599563790807041	2015-07-21 17:04:56 EDT	2015-07-21	17:04:56	-0400	249288197	samspressshop	Sam Johnson		READ THE LETTER I sent w/ @RepPaulRyan @TomColeOK04 &amp; others 2 @SocialSecurity Commissioner in oposition&gt;&gt;  http://t.co/dxEXRAtNZx	en	[{'screen_name': 'tomcoleok04', 'name': 'rep. tom cole', 'id': '23124635'}, {'screen_name': 'socialsecurity', 'name': 'social security', 'id': '39580052'}]	['http://1.usa.gov/1IcKfIA']	[]	0	3	1	[]	[]	https://twitter.com/SamsPressShop/status/623599563790807041	False		0								[]				
623597043160862720	623596303201796096	2015-07-21 16:54:55 EDT	2015-07-21	16:54:55	-0400	249288197	samspressshop	Sam Johnson		READ MORE HERE:  http://t.co/m2ENWjtCKG #GunRights #2ndAmendment	en	[]	['http://lat.ms/1GsuZ9i']	[]	0	0	0	['gunrights', '2ndamendment']	[]	https://twitter.com/SamsPressShop/status/623597043160862720	False		0								[]				
623596622874832896	623596622874832896	2015-07-21 16:53:15 EDT	2015-07-21	16:53:15	-0400	249288197	samspressshop	Sam Johnson		Make no mistake about it this is part of Obama’s effort to implement his gun control agenda through executive fiat #2ndAmendment @NRA	en	[{'screen_name': 'nra', 'name': 'nra', 'id': '21829541'}]	[]	[]	0	0	0	['2ndamendment']	[]	https://twitter.com/SamsPressShop/status/623596622874832896	False		0								[]				
623596303201796096	623596303201796096	2015-07-21 16:51:59 EDT	2015-07-21	16:51:59	-0400	249288197	samspressshop	Sam Johnson		Obama wants to use #SocialSecurity 2 send individuals w/ disabilities 2 the Ntl Instant Criminal Bckgrnd Check System  http://t.co/CSun0X2kTa	en	[]	[]	['https://pbs.twimg.com/media/CKd1iJSW8AADcSc.jpg']	1	0	0	['socialsecurity']	[]	https://twitter.com/SamsPressShop/status/623596303201796096	False		1	https://pbs.twimg.com/media/CKd1iJSW8AADcSc.jpg							[]				
623127551611936768	623127551611936768	2015-07-20 09:49:20 EDT	2015-07-20	09:49:20	-0400	249288197	samspressshop	Sam Johnson		@SenJohnMcCain As an American &amp; former POW, I say thank you today &amp; every day to our men &amp; women in uniform. God bless you &amp; I salute you.	en	[]	[]	[]	0	2	3	[]	[]	https://twitter.com/SamsPressShop/status/623127551611936768	False		0								[]				
623126893454340096	623126893454340096	2015-07-20 09:46:43 EDT	2015-07-20	09:46:43	-0400	249288197	samspressshop	Sam Johnson		...And as a fellow veteran and POW, I would like to express to ALL veterans my deep gratitude for your selfless service. Thank you.	en	[]	[]	[]	0	2	3	[]	[]	https://twitter.com/SamsPressShop/status/623126893454340096	False		0								[]				
623126717834633216	623126717834633216	2015-07-20 09:46:01 EDT	2015-07-20	09:46:01	-0400	249288197	samspressshop	Sam Johnson		As an American I'm grateful for the blessing of freedom we all enjoy - freedom that is protected &amp; defended by ALL of our faithful veterans	en	[]	[]	[]	0	2	3	[]	[]	https://twitter.com/SamsPressShop/status/623126717834633216	False		0								[]				
622064035014529024	622064035014529024	2015-07-17 11:23:17 EDT	2015-07-17	11:23:17	-0400	249288197	samspressshop	Sam Johnson		Glad to have @RightOnCrime support my Wrongful Convictions Tax Relief Act to exempt restitution awards f/ IRS taxes  http://t.co/Aow8SBnWTt	en	[{'screen_name': 'rightoncrime', 'name': 'right on crime', 'id': '178384775'}]	['http://rightoncrime.com/?p=8816']	[]	0	0	0	[]	[]	https://twitter.com/SamsPressShop/status/622064035014529024	False		0								[]				
621761287324893184	621761287324893184	2015-07-16 15:20:17 EDT	2015-07-16	15:20:17	-0400	249288197	samspressshop	Sam Johnson		Lifting up the community of #Chattanooga today and saying a special pray for the families of those who were shot. #PrayForChattanooga	en	[]	[]	[]	0	0	2	['chattanooga', 'prayforchattanooga']	[]	https://twitter.com/SamsPressShop/status/621761287324893184	False		0								[]				
621410010791309312	621410010791309312	2015-07-15 16:04:26 EDT	2015-07-15	16:04:26	-0400	249288197	samspressshop	Sam Johnson		Live in Celina, McKinney, Murphy, or Fairview? Need help w/ a federal agency? I have Mobile Offices near you on 7/29!  http://t.co/K8IyPVkcmh	en	[]	['http://goo.gl/OF5UTR']	[]	0	0	2	[]	[]	https://twitter.com/SamsPressShop/status/621410010791309312	False		0								[]				
621073654621827072	621073654621827072	2015-07-14 17:47:52 EDT	2015-07-14	17:47:52	-0400	249288197	samspressshop	Sam Johnson		Nuclear deal? Iran gets: sanctions lifted, boosting its economy by BILLIONS. America gets: to ask permission to inspect their nuclear sites	en	[]	[]	[]	0	1	1	[]	[]	https://twitter.com/SamsPressShop/status/621073654621827072	False		0								[]				
621065743652810756	621065743652810756	2015-07-14 17:16:26 EDT	2015-07-14	17:16:26	-0400	249288197	samspressshop	Sam Johnson		I do not trust Obama, let along Iran. This nuclear deal is dangerous for Americans &amp; our national security.  http://t.co/ODQb0u800w	en	[]	['http://samjohnson.house.gov/news/documentsingle.aspx?DocumentID=397839']	[]	1	1	1	[]	[]	https://twitter.com/SamsPressShop/status/621065743652810756	False		0								[]				
621065331436593154	621065331436593154	2015-07-14 17:14:48 EDT	2015-07-14	17:14:48	-0400	249288197	samspressshop	Sam Johnson		Time &amp; again Obama has proven we can’t take him at his word &amp; that's especially the case w/ this nuclear deal w/ Iran  http://t.co/ODQb0u800w	en	[]	['http://samjohnson.house.gov/news/documentsingle.aspx?DocumentID=397839']	[]	0	0	2	[]	[]	https://twitter.com/SamsPressShop/status/621065331436593154	False		0								[]				
619160789161746432	619160789161746432	2015-07-09 11:06:50 EDT	2015-07-09	11:06:50	-0400	249288197	samspressshop	Sam Johnson		1 solution? My bill 2 require #SocialSecurity 2 provide denied applicants w/ info on organizations that provide employment support service	en	[]	[]	[]	0	1	1	['socialsecurity']	[]	https://twitter.com/SamsPressShop/status/619160789161746432	False		0								[]				
619159447743635456	619159447743635456	2015-07-09 11:01:30 EDT	2015-07-09	11:01:30	-0400	249288197	samspressshop	Sam Johnson		@WaysandMeansGOP SS hearing right now &amp; I believe we have a moral responsibility to help those with disabilities who can get back to work.	en	[]	[]	[]	1	1	0	[]	[]	https://twitter.com/SamsPressShop/status/619159447743635456	False		0								[]				
619154920873271297	619154920873271297	2015-07-09 10:43:31 EDT	2015-07-09	10:43:31	-0400	249288197	samspressshop	Sam Johnson		40% of #DI recipients want to return to work; the rules actually make it harder for people to do so!  http://t.co/NUV61W0FQd	en	[]	[]	['https://pbs.twimg.com/media/CJeuHqRUwAALJmh.jpg']	0	2	1	['di']	[]	https://twitter.com/SamsPressShop/status/619154920873271297	False		1	https://pbs.twimg.com/media/CJeuHqRUwAALJmh.jpg							[]				
619152180872921088	619152180872921088	2015-07-09 10:32:37 EDT	2015-07-09	10:32:37	-0400	249288197	samspressshop	Sam Johnson		@WaysandMeansGOP SS hearing right now: Look forward to discussing how to help disability beneficiaries return to work!	en	[]	[]	[]	1	2	0	[]	[]	https://twitter.com/SamsPressShop/status/619152180872921088	False		0								[]				
619150149533761536	619150149533761536	2015-07-09 10:24:33 EDT	2015-07-09	10:24:33	-0400	249288197	samspressshop	Sam Johnson		1) NO 20%t cut 2) Ensure benefits are paid on time 3) Make the program work better 4) Help those who can &amp; want to work get back to work #DI	en	[]	[]	[]	1	1	0	['di']	[]	https://twitter.com/SamsPressShop/status/619150149533761536	False		0								[]				
619148275279613952	619148275279613952	2015-07-09 10:17:06 EDT	2015-07-09	10:17:06	-0400	249288197	samspressshop	Sam Johnson		Over the past few months, I have laid out four principles to reform the Disability Insurance program. #DI #socialsecurity	en	[]	[]	[]	0	0	0	['di', 'socialsecurity']	[]	https://twitter.com/SamsPressShop/status/619148275279613952	False		0								[]				
619147009186996224	619147009186996224	2015-07-09 10:12:04 EDT	2015-07-09	10:12:04	-0400	249288197	samspressshop	Sam Johnson		Watch the @WaysandMeansGOP hearing over #socialsecurity happening NOW:  http://t.co/1rYZB01zQR #disability #reform	en	[{'screen_name': 'waysandmeansgop', 'name': 'ways and means gop', 'id': '12788332'}]	['http://bit.ly/1dKRb03']	[]	0	1	0	['socialsecurity', 'disability', 'reform']	[]	https://twitter.com/SamsPressShop/status/619147009186996224	False		0								[]				
618893035431051265	618893035431051265	2015-07-08 17:22:52 EDT	2015-07-08	17:22:52	-0400	249288197	samspressshop	Sam Johnson		READ MORE on my work w/ @WaysandMeansGOP to fix #socialsecurity and ensure the system is in place for years to come.   http://t.co/aahFAyFgFm	en	[{'screen_name': 'waysandmeansgop', 'name': 'ways and means gop', 'id': '12788332'}]	['http://1.usa.gov/1J4LxWV']	[]	1	1	0	['socialsecurity']	[]	https://twitter.com/SamsPressShop/status/618893035431051265	False		0								[]				
618892504507617280	618892504507617280	2015-07-08 17:20:46 EDT	2015-07-08	17:20:46	-0400	249288197	samspressshop	Sam Johnson		Ensuring the solvency of #socialsecurity is important to not only my constituents, but the entire nation.	en	[]	[]	[]	0	0	0	['socialsecurity']	[]	https://twitter.com/SamsPressShop/status/618892504507617280	False		0								[]				
618849656215351296	618849656215351296	2015-07-08 14:30:30 EDT	2015-07-08	14:30:30	-0400	249288197	samspressshop	Sam Johnson		But @WaysandMeansGOP will hold a hearing on #socialsecurity reform tomorrow! Let's get to the bottom of this!	en	[{'screen_name': 'waysandmeansgop', 'name': 'ways and means gop', 'id': '12788332'}]	[]	[]	0	0	0	['socialsecurity']	[]	https://twitter.com/SamsPressShop/status/618849656215351296	False		0								[]				
618849272331673600	618849272331673600	2015-07-08 14:28:58 EDT	2015-07-08	14:28:58	-0400	249288197	samspressshop	Sam Johnson		@WaysandMeansGOP hasn't held a full committee hearing over #socialsecurity since 2005	en	[]	[]	[]	0	0	0	['socialsecurity']	[]	https://twitter.com/SamsPressShop/status/618849272331673600	False		0								[]				
614162028144500736	614162028144500736	2015-06-25 16:03:32 EDT	2015-06-25	16:03:32	-0400	249288197	samspressshop	Sam Johnson		@USSupremeCourt upheld #Obamacare #subsidies, but I'm still working to help small businesses LOWER health care costs  http://t.co/pTzSWDjg6J	en	[]	['http://goo.gl/sk5IKR']	[]	0	0	0	['obamacare', 'subsidies']	[]	https://twitter.com/SamsPressShop/status/614162028144500736	False		0								[]				
614094052611502080	614094052611502080	2015-06-25 11:33:26 EDT	2015-06-25	11:33:26	-0400	249288197	samspressshop	Sam Johnson		But you can rest assured that, regardless, I will continue to fight #Obamacare until it is fully repealed.  It is the right thing to do.	en	[]	[]	[]	2	1	0	['obamacare']	[]	https://twitter.com/SamsPressShop/status/614094052611502080	False		0								[]				
614093815759159296	614093815759159296	2015-06-25 11:32:29 EDT	2015-06-25	11:32:29	-0400	249288197	samspressshop	Sam Johnson		#Obamacare is a TERRIBLE law, and it’s been terrible since day one for more reasons than I can count.  #SCOTUS  http://t.co/fA8U4WQRkM	en	[]	[]	['https://pbs.twimg.com/media/CIWzEkDUAAALlZk.jpg']	3	2	2	['obamacare', 'scotus']	[]	https://twitter.com/SamsPressShop/status/614093815759159296	False		1	https://pbs.twimg.com/media/CIWzEkDUAAALlZk.jpg							[]				
613441659448201216	613441659448201216	2015-06-23 16:21:03 EDT	2015-06-23	16:21:03	-0400	249288197	samspressshop	Sam Johnson		Exciting time for @SamaritanInnOrg as they break ground on their second location; blessed to have been a part of this  http://t.co/enp4ZVEG7f	en	[{'screen_name': 'samaritaninnorg', 'name': 'the samaritan inn', 'id': '541124383'}]	[]	['https://pbs.twimg.com/media/CINh8EYVEAEQBw2.jpg']	0	1	1	[]	[]	https://twitter.com/SamsPressShop/status/613441659448201216	False		1	https://pbs.twimg.com/media/CINh8EYVEAEQBw2.jpg							[]				
613426863122350080	613426863122350080	2015-06-23 15:22:15 EDT	2015-06-23	15:22:15	-0400	249288197	samspressshop	Sam Johnson		Thanks @SamaritanInnOrg for your outreach to the homeless of McKinney!  http://t.co/OZiohf25W0 #FaithitForward  http://t.co/tS086TQCAl	en	[{'screen_name': 'samaritaninnorg', 'name': 'the samaritan inn', 'id': '541124383'}]	['http://bit.ly/1rkwxML']	['https://pbs.twimg.com/media/CINUe0IWwAEgPIO.jpg']	0	4	5	['faithitforward']	[]	https://twitter.com/SamsPressShop/status/613426863122350080	False		1	https://pbs.twimg.com/media/CINUe0IWwAEgPIO.jpg							[]				
613421386246320129	613421386246320129	2015-06-23 15:00:29 EDT	2015-06-23	15:00:29	-0400	249288197	samspressshop	Sam Johnson		 http://t.co/KMpum5zxNA	und	[]	[]	['https://pbs.twimg.com/media/CINPgAqUMAEjl-W.jpg']	0	0	0	[]	[]	https://twitter.com/SamsPressShop/status/613421386246320129	False		1	https://pbs.twimg.com/media/CINPgAqUMAEjl-W.jpg							[]				
613406699823738881	613406699823738881	2015-06-23 14:02:08 EDT	2015-06-23	14:02:08	-0400	249288197	samspressshop	Sam Johnson		“I highly recommend @PrestonwoodPreg to anyone with questions and concerns on starting a family.They are great counselors and friends.”	en	[{'screen_name': 'prestonwoodpreg', 'name': 'prestonwood pregnancy', 'id': '1337672527'}]	[]	[]	1	0	1	[]	[]	https://twitter.com/SamsPressShop/status/613406699823738881	False		0								[]				
613397077339557888	613397077339557888	2015-06-23 13:23:54 EDT	2015-06-23	13:23:54	-0400	249288197	samspressshop	Sam Johnson		@PrestonwoodPreg the community is grateful for your work! READ MORE about the Center here:  http://t.co/8qzzZrWK2Q	en	[]	['http://bit.ly/1KacoXc']	[]	0	0	0	[]	[]	https://twitter.com/SamsPressShop/status/613397077339557888	False		0								[]				
613395333415084032	613395333415084032	2015-06-23 13:16:58 EDT	2015-06-23	13:16:58	-0400	249288197	samspressshop	Sam Johnson		Thank you to @PrestonwoodPreg for making a difference in our district! #FaithItForward  #CongressionalPrayerCaucus  http://t.co/EVkiTaeihi	en	[{'screen_name': 'prestonwoodpreg', 'name': 'prestonwood pregnancy', 'id': '1337672527'}]	[]	['https://pbs.twimg.com/media/CIM3zi_WUAAyaPT.jpg']	2	2	1	['faithitforward', 'congressionalprayercaucus']	[]	https://twitter.com/SamsPressShop/status/613395333415084032	False		1	https://pbs.twimg.com/media/CIM3zi_WUAAyaPT.jpg							[]				
613082783657934848	613082783657934848	2015-06-22 16:35:00 EDT	2015-06-22	16:35:00	-0400	249288197	samspressshop	Sam Johnson		Folks! 2morrow my District staff will have mobile office hours for those that can't make it to the Plano office &gt;&gt;  http://t.co/SlAbaigDlq	en	[]	['http://1.usa.gov/1dZL5ko']	[]	0	0	0	[]	[]	https://twitter.com/SamsPressShop/status/613082783657934848	False		0								[]				
613070488517148672	613070488517148672	2015-06-22 15:46:09 EDT	2015-06-22	15:46:09	-0400	249288197	samspressshop	Sam Johnson		Tomorrow night I will be hosting another #TeleTownHall to hear from constituents. Email your questions to SamJohnson.TTH@mail.house.gov	en	[]	[]	[]	0	0	0	['teletownhall']	[]	https://twitter.com/SamsPressShop/status/613070488517148672	False		0								[]				
611993293698826240	611993293698826240	2015-06-19 16:25:46 EDT	2015-06-19	16:25:46	-0400	249288197	samspressshop	Sam Johnson		@POTUS saw your hometeam team is visiting the WH. Our @AllenAmericans just won their 3rd straight championship &amp; would love to visit too!	en	[{'screen_name': 'allenamericans', 'name': 'x - allen americans', 'id': '34692502'}]	[]	[]	0	6	12	[]	[]	https://twitter.com/SamsPressShop/status/611993293698826240	False		0								[]				
611566334426673152	611566334426673152	2015-06-18 12:09:11 EDT	2015-06-18	12:09:11	-0400	249288197	samspressshop	Sam Johnson		Need help w/ veteran benefits, the IRS, passports, etc? My next monthly Mobile Office hrs are June 23rd! LEARN MORE:  http://t.co/rvsMRvvFiy	en	[]	['http://goo.gl/S5iVwY']	[]	0	0	0	[]	[]	https://twitter.com/SamsPressShop/status/611566334426673152	False		0								[]				
611183252079030273	611183252079030273	2015-06-17 10:46:57 EDT	2015-06-17	10:46:57	-0400	249288197	samspressshop	Sam Johnson		My “Right-of-Way for American Drivers Act” would do just that.  http://t.co/1H2cRMH0Na #fixthetrustfund	en	[]	['http://1.usa.gov/1dKmOyP']	[]	0	0	0	['fixthetrustfund']	[]	https://twitter.com/SamsPressShop/status/611183252079030273	False		0								[]				
611182384277516288	611182384277516288	2015-06-17 10:43:30 EDT	2015-06-17	10:43:30	-0400	249288197	samspressshop	Sam Johnson		Using taxes meant for hwys to actually pay for hwys makes the HWY Trust Fund 98% solvent for 10yrs READ MORE:  http://t.co/dY0XqXhbXy	en	[]	['http://on.wsj.com/1xrIzoQ']	[]	0	1	0	[]	[]	https://twitter.com/SamsPressShop/status/611182384277516288	False		0								[]				
611181804947668992	611181804947668992	2015-06-17 10:41:12 EDT	2015-06-17	10:41:12	-0400	249288197	samspressshop	Sam Johnson		Question for Mr. Shirley from @uscbo: Wouldn’t it make sense to end the diversion of #gastax dollars for things other than roads?	en	[{'screen_name': 'uscbo', 'name': 'u.s. cbo', 'id': '1531265618'}]	[]	[]	0	0	0	['gastax']	[]	https://twitter.com/SamsPressShop/status/611181804947668992	False		0								[]				
611181515460976640	611181515460976640	2015-06-17 10:40:03 EDT	2015-06-17	10:40:03	-0400	249288197	samspressshop	Sam Johnson		Join @WaysandMeansGOP RIGHT NOW for our hearing over the #highwaytrustfund WATCH HERE:  http://t.co/1rYZB01zQR	en	[{'screen_name': 'waysandmeansgop', 'name': 'ways and means gop', 'id': '12788332'}]	['http://bit.ly/1dKRb03']	[]	0	0	0	['highwaytrustfund']	[]	https://twitter.com/SamsPressShop/status/611181515460976640	False		0								[]				
611180739233755136	611180739233755136	2015-06-17 10:36:58 EDT	2015-06-17	10:36:58	-0400	249288197	samspressshop	Sam Johnson		My constituents pay more to Washington via the #gastax than they get in return. This is wrong! #fixthetrustfund	en	[]	[]	[]	1	1	0	['gastax', 'fixthetrustfund']	[]	https://twitter.com/SamsPressShop/status/611180739233755136	False		0								[]				
611175738448941056	611175738448941056	2015-06-17 10:17:05 EDT	2015-06-17	10:17:05	-0400	249288197	samspressshop	Sam Johnson		But the bad news is that Washington is not just hamstringing Texas, but shortchanging the Lone Star State when it comes to road funding!	en	[]	[]	[]	0	2	1	[]	[]	https://twitter.com/SamsPressShop/status/611175738448941056	False		0								[]				
611175273908842496	611175273908842496	2015-06-17 10:15:15 EDT	2015-06-17	10:15:15	-0400	249288197	samspressshop	Sam Johnson		Under the leadership of Governor @GregAbbott_TX , Texas is working to provide billions more for #roads	en	[{'screen_name': 'gregabbott_tx', 'name': 'greg abbott', 'id': '90651198'}]	[]	[]	1	0	0	['roads']	[]	https://twitter.com/SamsPressShop/status/611175273908842496	False		0								[]				
611173410664787968	611173410664787968	2015-06-17 10:07:50 EDT	2015-06-17	10:07:50	-0400	249288197	samspressshop	Sam Johnson		@RepPaulRyan “We are not going to raise gas taxes, plain and simple.” #fixthetrustfund #waysandmeanshearing	en	[]	[]	[]	1	0	0	['fixthetrustfund', 'waysandmeanshearing']	[]	https://twitter.com/SamsPressShop/status/611173410664787968	False		0								[]				
611172752884670464	611172752884670464	2015-06-17 10:05:13 EDT	2015-06-17	10:05:13	-0400	249288197	samspressshop	Sam Johnson		"@RepPaulRyan in his opening statement: ""We need to find a real long term solution.”"	en	[]	[]	[]	0	0	0	[]	[]	https://twitter.com/SamsPressShop/status/611172752884670464	False		0								[]				
611172372415123456	611172372415123456	2015-06-17 10:03:43 EDT	2015-06-17	10:03:43	-0400	249288197	samspressshop	Sam Johnson		Given my home state of Texas’ booming economy we certainly get how important road funding is! #highwaytrustfund #fixthetrustfund	en	[]	[]	[]	0	1	1	['highwaytrustfund', 'fixthetrustfund']	[]	https://twitter.com/SamsPressShop/status/611172372415123456	False		0								[]				
611169198165872640	611169198165872640	2015-06-17 09:51:06 EDT	2015-06-17	09:51:06	-0400	249288197	samspressshop	Sam Johnson		The #Highwaytrustfund is in trouble-- @WaysandMeansGOP is meeting to discuss the problem WATCH HERE:  http://t.co/1rYZB01zQR	en	[{'screen_name': 'waysandmeansgop', 'name': 'ways and means gop', 'id': '12788332'}]	['http://bit.ly/1dKRb03']	[]	0	0	0	['highwaytrustfund']	[]	https://twitter.com/SamsPressShop/status/611169198165872640	False		0								[]				
610889052464791552	610889052464791552	2015-06-16 15:17:54 EDT	2015-06-16	15:17:54	-0400	249288197	samspressshop	Sam Johnson		READ the full opening statement from @WaysandMeansGOP's hearing:  http://t.co/AIdY97R1L9 #disability #SocialSecurity	en	[{'screen_name': 'waysandmeansgop', 'name': 'ways and means gop', 'id': '12788332'}]	['http://1.usa.gov/1IjgTIR']	[]	0	0	0	['disability', 'socialsecurity']	[]	https://twitter.com/SamsPressShop/status/610889052464791552	False		0								[]				
610876082737254400	610876082737254400	2015-06-16 14:26:22 EDT	2015-06-16	14:26:22	-0400	249288197	samspressshop	Sam Johnson		Unfortunately the system for reporting wages is not user friendly for the worker and unreliable. #SocialSecurity #disability	en	[]	[]	[]	0	2	2	['socialsecurity', 'disability']	[]	https://twitter.com/SamsPressShop/status/610876082737254400	False		0								[]				
610875675336122369	610875675336122369	2015-06-16 14:24:45 EDT	2015-06-16	14:24:45	-0400	249288197	samspressshop	Sam Johnson		Leading cause of overpayments in the Disability Insurance program is due to complex work rules, which are difficult and costly to administer	en	[]	[]	[]	0	1	1	[]	[]	https://twitter.com/SamsPressShop/status/610875675336122369	False		0								[]				
610875202503864321	610875202503864321	2015-06-16 14:22:52 EDT	2015-06-16	14:22:52	-0400	249288197	samspressshop	Sam Johnson		Today we will hear from @SocialSecurity and @USGAO about how the complexity of the disability program hurts both beneficiaries and taxpayers	en	[{'screen_name': 'socialsecurity', 'name': 'social security', 'id': '39580052'}, {'screen_name': 'usgao', 'name': 'u.s. gao', 'id': '34274380'}]	[]	[]	0	0	0	[]	[]	https://twitter.com/SamsPressShop/status/610875202503864321	False		0								[]				
610869773073784834	610869773073784834	2015-06-16 14:01:17 EDT	2015-06-16	14:01:17	-0400	249288197	samspressshop	Sam Johnson		Let's get to the bottom of this issue so we can preserve #socialsecurity! WATCH the HEARING:  http://t.co/1rYZB01zQR	en	[]	['http://bit.ly/1dKRb03']	[]	0	0	0	['socialsecurity']	[]	https://twitter.com/SamsPressShop/status/610869773073784834	False		0								[]				
610869124953149440	610869124953149440	2015-06-16 13:58:43 EDT	2015-06-16	13:58:43	-0400	249288197	samspressshop	Sam Johnson		These difficulties can cause large over payments for #disability beneficiaries trying to return to work!	en	[]	[]	[]	0	1	0	['disability']	[]	https://twitter.com/SamsPressShop/status/610869124953149440	False		0								[]				
610868979750563841	610868979750563841	2015-06-16 13:58:08 EDT	2015-06-16	13:58:08	-0400	249288197	samspressshop	Sam Johnson		The @SocialSecurity Admin. faces difficulties processing earnings reports and adjusting #benefits in a timely fashion	en	[{'screen_name': 'socialsecurity', 'name': 'social security', 'id': '39580052'}]	[]	[]	0	1	1	['benefits']	[]	https://twitter.com/SamsPressShop/status/610868979750563841	False		0								[]				
609433940127023104	609433940127023104	2015-06-12 14:55:48 EDT	2015-06-12	14:55:48	-0400	249288197	samspressshop	Sam Johnson		"Read more about the #TPA and trade in the ""Hot Topics"" section of my website &gt;&gt;  http://t.co/lPsI3eIHM5"	en	[]	['http://1.usa.gov/1e9jqOx']	[]	0	0	0	['tpa']	[]	https://twitter.com/SamsPressShop/status/609433940127023104	False		0								[]				
609433422549925889	609433422549925889	2015-06-12 14:53:45 EDT	2015-06-12	14:53:45	-0400	249288197	samspressshop	Sam Johnson		Congress now holds the reins for the trade agreement! Read more about how #TPA helps in @SenTedCruz's Op-Ed &gt;&gt;  http://t.co/ZVAGtRLfPz	en	[{'screen_name': 'sentedcruz', 'name': 'senator ted cruz', 'id': '1074480192'}]	['http://on.wsj.com/1J9ON8a']	[]	1	1	2	['tpa']	[]	https://twitter.com/SamsPressShop/status/609433422549925889	False		0								[]				
609431857780948992	609431857780948992	2015-06-12 14:47:32 EDT	2015-06-12	14:47:32	-0400	249288197	samspressshop	Sam Johnson		Thank goodness #TPA passed in the House! W/ TPA Congress now sets the trade negotiating objectives – not the President.	en	[]	[]	[]	0	0	0	['tpa']	[]	https://twitter.com/SamsPressShop/status/609431857780948992	False		0								[]				
609397592045297665	609397592045297665	2015-06-12 12:31:22 EDT	2015-06-12	12:31:22	-0400	249288197	samspressshop	Sam Johnson		A Trade Benefits America poll shows 76% of Americans support Congressional passage of Trade Promotion Authority.	en	[]	[]	[]	1	0	0	[]	[]	https://twitter.com/SamsPressShop/status/609397592045297665	False		0								[]				
609360690034409473	609360690034409473	2015-06-12 10:04:44 EDT	2015-06-12	10:04:44	-0400	249288197	samspressshop	Sam Johnson		Some folks are concerned today's vote is a “secret” deal. This just isn't true! You can read TPA just like I have &gt;&gt;  http://t.co/gBw4bsSaXt	en	[]	['http://bitly.com/1GA1kB3']	[]	0	0	0	[]	[]	https://twitter.com/SamsPressShop/status/609360690034409473	False		0								[]				
609064751579209729	609064751579209729	2015-06-11 14:28:47 EDT	2015-06-11	14:28:47	-0400	249288197	samspressshop	Sam Johnson		 http://t.co/KaFxoDIZVs	und	[]	[]	['https://pbs.twimg.com/media/CHPVKgLW4AAEELp.jpg']	3	2	0	[]	[]	https://twitter.com/SamsPressShop/status/609064751579209729	False		1	https://pbs.twimg.com/media/CHPVKgLW4AAEELp.jpg							[]				
