id	conversation_id	created_at	date	time	timezone	user_id	username	name	place	tweet	language	mentions	urls	photos	replies_count	retweets_count	likes_count	hashtags	cashtags	link	retweet	quote_url	video	thumbnail	near	geo	source	user_rt_id	user_rt	retweet_id	reply_to	retweet_date	translate	trans_src	trans_dest
407586485919952896	407586485919952896	2013-12-02 14:06:05 EST	2013-12-02	14:06:05	-0400	249288197	samspressshop	Sam Johnson		A dear friend, fellow POW, and American legend - Air Force Pilot - Robbie Risner --&gt;  http://t.co/j6fAKzx9L5  http://t.co/NAvUIay2LF	en	[]	['http://bit.ly/1dLJOvU']	['https://pbs.twimg.com/media/BagJv9zCMAAK_U9.jpg']	3	3	0	[]	[]	https://twitter.com/SamsPressShop/status/407586485919952896	False		1	https://pbs.twimg.com/media/BagJv9zCMAAK_U9.jpg							[]				
403207780137332736	403207780137332736	2013-11-20 12:06:40 EST	2013-11-20	12:06:40	-0400	249288197	samspressshop	Sam Johnson		Great news for Texas women and the unborn.  Every life is precious and must be protected.   http://t.co/yeP73cNls9	en	[]	['http://wapo.st/1atMryE']	[]	5	2	3	[]	[]	https://twitter.com/SamsPressShop/status/403207780137332736	False		0								[]				
400682446863085568	400682446863085568	2013-11-13 12:51:54 EST	2013-11-13	12:51:54	-0400	249288197	samspressshop	Sam Johnson		Tom from Allen, TX likes his current health plan and wants to keep it. PERIOD.  #KeepThePromise #KeepYourHealthPlan  http://t.co/iPkxkJibML	en	[]	['http://bit.ly/1aTDn7X']	[]	3	1	0	['keepthepromise', 'keepyourhealthplan']	[]	https://twitter.com/SamsPressShop/status/400682446863085568	False		0								[]				
398180341925433344	398180341925433344	2013-11-06 15:09:26 EST	2013-11-06	15:09:26	-0400	249288197	samspressshop	Sam Johnson		Are your premiums doubling or worse, tripling? Share your #ObamaCare story, I look forward to hearing from you!  http://t.co/FplCsHE6UI	en	[]	['http://1.usa.gov/1cSFbvv']	[]	1	1	0	['obamacare']	[]	https://twitter.com/SamsPressShop/status/398180341925433344	False		0								[]				
398175320752156672	398175320752156672	2013-11-06 14:49:28 EST	2013-11-06	14:49:28	-0400	249288197	samspressshop	Sam Johnson		Let your voice be heard, share your #ObamaCare story and expose the truth about how this law effects you!  http://t.co/FplCsHE6UI	en	[]	['http://1.usa.gov/1cSFbvv']	[]	2	2	0	['obamacare']	[]	https://twitter.com/SamsPressShop/status/398175320752156672	False		0								[]				
397487871189192704	397487871189192704	2013-11-04 17:17:48 EST	2013-11-04	17:17:48	-0400	249288197	samspressshop	Sam Johnson		ICYMI via @HoustonChron: John Cornyn, Sam Johnson call for federal tax transparency laws  http://t.co/cPamkBZ3jW	en	[{'screen_name': 'houstonchron', 'name': 'houston chronicle', 'id': '8940342'}]	['http://bit.ly/1dINaMQ']	[]	3	1	0	[]	[]	https://twitter.com/SamsPressShop/status/397487871189192704	False		0								[]				
397484045463855106	397484045463855106	2013-11-04 17:02:35 EST	2013-11-04	17:02:35	-0400	249288197	samspressshop	Sam Johnson		Our Founding Fathers declared we are, ‘One nation under God,’ and you better believe I’ll fight to keep it that way.  http://t.co/wKJGLuaxct	en	[]	['http://1.usa.gov/HFRhNS']	[]	4	3	2	[]	[]	https://twitter.com/SamsPressShop/status/397484045463855106	False		0								[]				
395255500138229760	395255500138229760	2013-10-29 14:27:09 EDT	2013-10-29	14:27:09	-0400	249288197	samspressshop	Sam Johnson		Obama admin knew millions wouldn't be able to keep their insurance under #Obamacare, yet told Americans they would.  http://t.co/yOdAZNWBJ4	en	[]	['http://nbcnews.to/1dFbgut']	[]	1	2	0	['obamacare']	[]	https://twitter.com/SamsPressShop/status/395255500138229760	False		0								[]				
394932953362345984	394932953362345984	2013-10-28 17:05:28 EDT	2013-10-28	17:05:28	-0400	249288197	samspressshop	Sam Johnson		TX Fed. judge's ruling today is very sad news for our country and for folks who are dedicated to the protection of the unborn and value life	en	[]	[]	[]	3	1	1	[]	[]	https://twitter.com/SamsPressShop/status/394932953362345984	False		0								[]				
393459406832009216	393459406832009216	2013-10-24 15:30:07 EDT	2013-10-24	15:30:07	-0400	249288197	samspressshop	Sam Johnson		Great read, @NRO - Obama still does not appear to have noticed that he’s the executive &amp; accountable. @charlescwcooke  http://t.co/5fQduEZ73g	en	[{'screen_name': 'nro', 'name': 'national review', 'id': '19417492'}, {'screen_name': 'charlescwcooke', 'name': 'charles c. w. cooke', 'id': '233484761'}]	['http://www.nationalreview.com/article/362083/no-one-sabotaged-obamacare-charles-c-w-cooke/page/0/1']	[]	5	1	0	[]	[]	https://twitter.com/SamsPressShop/status/393459406832009216	False		0								[]				
393429630041853952	393429630041853952	2013-10-24 13:31:48 EDT	2013-10-24	13:31:48	-0400	249288197	samspressshop	Sam Johnson		Not a smart and sensible use of taxpayer dollars. Give me a break!  http://t.co/lxev4w0y9u	en	[]	['http://nypost.com/2013/10/23/obama-wants-marines-to-wear-girly-hats/']	[]	3	0	0	[]	[]	https://twitter.com/SamsPressShop/status/393429630041853952	False		0								[]				
393402177839849472	393402177839849472	2013-10-24 11:42:42 EDT	2013-10-24	11:42:42	-0400	249288197	samspressshop	Sam Johnson		Clearly, President Obama's if-you-like-your-coverage-you-can-keep-it pledge is false --&gt;  http://t.co/MqalFpl4Vd	en	[]	['http://www.forbes.com/sites/theapothecary/2013/10/24/more-americans-have-had-their-insurance-canceled-under-obamacare-than-have-filed-an-exchange-account/']	[]	0	1	1	[]	[]	https://twitter.com/SamsPressShop/status/393402177839849472	False		0								[]				
392729593188077568	392682713964367872	2013-10-22 15:10:06 EDT	2013-10-22	15:10:06	-0400	249288197	samspressshop	Sam Johnson		@Watchdogorg a commonsense bill, H.R. 556 would prevent this abuse, and save hardworking taxpayers an ~ $24.4 billion over the next 10 years	en	[]	[]	[]	0	0	0	[]	[]	https://twitter.com/SamsPressShop/status/392729593188077568	False		0								[]				
392729084418981888	392729084418981888	2013-10-22 15:08:04 EDT	2013-10-22	15:08:04	-0400	249288197	samspressshop	Sam Johnson		My bill H.R. 556, the Refundable Child Tax Credit Eligibility Verification Reform Act seeks to prevent this #abuse.  http://t.co/PrSMLfoder	en	[]	['http://bit.ly/1gB0KXe']	[]	0	0	0	['abuse']	[]	https://twitter.com/SamsPressShop/status/392729084418981888	False		0								[]				
391262954890334208	391262954890334208	2013-10-18 14:02:12 EDT	2013-10-18	14:02:12	-0400	249288197	samspressshop	Sam Johnson		It out! Let me know what you think about this week's e-newsletter --&gt;  http://t.co/YGdO8ci0Vl	en	[]	['http://samjohnson.house.gov/news/email/show.aspx?ID=HGFSZ3F3BG7PRJYHJ23IMMR7SI']	[]	3	2	0	[]	[]	https://twitter.com/SamsPressShop/status/391262954890334208	False		0								[]				
388689079975428096	388665382552481792	2013-10-11 11:34:32 EDT	2013-10-11	11:34:32	-0400	249288197	samspressshop	Sam Johnson		@cqprofiles @PattyMurray @RepChuck Thank you!	en	[{'screen_name': 'pattymurray', 'name': 'senator patty murray', 'id': '293131808'}, {'screen_name': 'repchuck', 'name': 'chuck fleischmann', 'id': '235190657'}]	[]	[]	1	0	0	[]	[]	https://twitter.com/SamsPressShop/status/388689079975428096	False		0								[]				
388689052041351168	388668071998935040	2013-10-11 11:34:26 EDT	2013-10-11	11:34:26	-0400	249288197	samspressshop	Sam Johnson		@AAUWPolicy @AAUW Thank you!	en	[{'screen_name': 'aauw', 'name': 'aauw', 'id': '19719380'}]	[]	[]	0	0	0	[]	[]	https://twitter.com/SamsPressShop/status/388689052041351168	False		0								[]				
388046605191880704	388046605191880704	2013-10-09 17:01:34 EDT	2013-10-09	17:01:34	-0400	249288197	samspressshop	Sam Johnson		We must demonstrate support for our troops, not just in words, but in actions. I urge @SenatorReid to honor our fallen heroes &amp; their family	en	[{'screen_name': 'senatorreid', 'name': 'senator harry reid', 'id': '16789970'}]	[]	[]	3	5	2	[]	[]	https://twitter.com/SamsPressShop/status/388046605191880704	False		0								[]				
388045648055894016	388045648055894016	2013-10-09 16:57:46 EDT	2013-10-09	16:57:46	-0400	249288197	samspressshop	Sam Johnson		"I urge the Senate 2 fulfill the pledge of Abraham Lincoln, ""to care for him who shall have borne the battle, &amp; for his widow &amp; his orphans."""	en	[]	[]	[]	0	4	2	[]	[]	https://twitter.com/SamsPressShop/status/388045648055894016	False		0								[]				
388018223230111744	388018223230111744	2013-10-09 15:08:48 EDT	2013-10-09	15:08:48	-0400	249288197	samspressshop	Sam Johnson		The expenses of a burial service is the last thing a grieving military family should worry about. #HonorOurVets #HJRes91	en	[]	[]	[]	3	4	1	['honorourvets', 'hjres91']	[]	https://twitter.com/SamsPressShop/status/388018223230111744	False		0								[]				
387298448602435584	387298448602435584	2013-10-07 15:28:40 EDT	2013-10-07	15:28:40	-0400	249288197	samspressshop	Sam Johnson		We must work to protect the program for those who truly need it. Waste, fraud, and abuse is real &amp; cheats honest, American taxpayers. (2/2)	en	[]	[]	[]	5	1	0	[]	[]	https://twitter.com/SamsPressShop/status/387298448602435584	False		0								[]				
387298015762841600	387298015762841600	2013-10-07 15:26:57 EDT	2013-10-07	15:26:57	-0400	249288197	samspressshop	Sam Johnson		ICYMI: @60Minutes reports on the deeply troubling state of the SS disability insurance program. (1/2)  http://t.co/cdTES2X7k8	en	[{'screen_name': '60minutes', 'name': '60 minutes', 'id': '18812572'}]	['http://www.cbsnews.com/video/watch/?id=50156574n']	[]	4	2	0	[]	[]	https://twitter.com/SamsPressShop/status/387298015762841600	False		0								[]				
386185021637152768	386185021637152768	2013-10-04 13:44:18 EDT	2013-10-04	13:44:18	-0400	249288197	samspressshop	Sam Johnson		Looking forward to joining @HonorFlightDCA Vets from North Texas at the WWII Memorial around 3:15 pm alongside most of the #TX delegation.	en	[{'screen_name': 'honorflightdca', 'name': 'honor flight dca', 'id': '284154572'}]	[]	[]	2	6	1	['tx']	[]	https://twitter.com/SamsPressShop/status/386185021637152768	False		0								[]				
385848681435385856	385848681435385856	2013-10-03 15:27:49 EDT	2013-10-03	15:27:49	-0400	249288197	samspressshop	Sam Johnson		My thoughts &amp; prayers are with the injured officer from today's tragedy. Grateful for Capitol Police officers who work hard to keep us safe.	en	[]	[]	[]	1	1	1	[]	[]	https://twitter.com/SamsPressShop/status/385848681435385856	False		0								[]				
385529477855342593	385529477855342593	2013-10-02 18:19:24 EDT	2013-10-02	18:19:24	-0400	249288197	samspressshop	Sam Johnson		On my way to vote to re-open our national parks and monuments as well as fund the NIH so important research and treatment continues.	en	[]	[]	[]	4	1	0	[]	[]	https://twitter.com/SamsPressShop/status/385529477855342593	False		0								[]				
385492752906993664	385492752906993664	2013-10-02 15:53:29 EDT	2013-10-02	15:53:29	-0400	249288197	samspressshop	Sam Johnson		Can someone explain to me why @SenatorReid refuses to provide funds for children with Cancer? #HarryReidsShutdown  http://t.co/p7hVPEfOgq	en	[{'screen_name': 'senatorreid', 'name': 'senator harry reid', 'id': '16789970'}]	['http://www.youtube.com/watch?v=QfHLkacQDFw&feature=youtu.be']	[]	4	4	0	['harryreidsshutdown']	[]	https://twitter.com/SamsPressShop/status/385492752906993664	False		0								[]				
385466141931352064	385466141931352064	2013-10-02 14:07:44 EDT	2013-10-02	14:07:44	-0400	249288197	samspressshop	Sam Johnson		PROOF  http://t.co/VMoKcUKw7M	en	[]	[]	['https://pbs.twimg.com/media/BVlzae8CMAAqohB.jpg']	0	2	0	[]	[]	https://twitter.com/SamsPressShop/status/385466141931352064	False		1	https://pbs.twimg.com/media/BVlzae8CMAAqohB.jpg							[]				
385465713453826048	385465713453826048	2013-10-02 14:06:02 EDT	2013-10-02	14:06:02	-0400	249288197	samspressshop	Sam Johnson		Rain or shine, day or night #WWII memorial is reg. open &amp; unstaffed. Yet, the @WhiteHouse closes it.  Nothing more than a #PublicityStunt	en	[{'screen_name': 'whitehouse', 'name': 'the white house', 'id': '1323730225067339784'}]	[]	[]	0	5	0	['wwii', 'publicitystunt']	[]	https://twitter.com/SamsPressShop/status/385465713453826048	False		0								[]				
385426860282097666	385426860282097666	2013-10-02 11:31:39 EDT	2013-10-02	11:31:39	-0400	249288197	samspressshop	Sam Johnson		More guards at WWII memorial than #Benghazi, Park Service closes park it doesn't run --&gt; #HarryReidsShutdown  http://t.co/geAQdEJyBL	en	[]	['http://washingtonexaminer.com/article/2536710']	[]	2	7	0	['benghazi', 'harryreidsshutdown']	[]	https://twitter.com/SamsPressShop/status/385426860282097666	False		0								[]				
385418406062616579	385418406062616579	2013-10-02 10:58:03 EDT	2013-10-02	10:58:03	-0400	249288197	samspressshop	Sam Johnson		#Obamacare is a law that is negatively impacting the American people --&gt; 100 consequences due to false promises @NRO  http://t.co/2kdvRTfDc2	en	[{'screen_name': 'nro', 'name': 'national review', 'id': '19417492'}]	['http://www.nationalreview.com/article/359861/100-unintended-consequences-obamacare-andrew-johnson']	[]	1	1	0	['obamacare']	[]	https://twitter.com/SamsPressShop/status/385418406062616579	False		0								[]				
384900603211554816	384900603211554816	2013-10-01 00:40:29 EDT	2013-10-01	00:40:29	-0400	249288197	samspressshop	Sam Johnson		Senate's doors are closed, House continues to work to keep government open.  #DejaVu  #HarryReidsShutdown	en	[]	[]	[]	5	8	0	['dejavu', 'harryreidsshutdown']	[]	https://twitter.com/SamsPressShop/status/384900603211554816	False		0								[]				
384852933939974144	384852933939974144	2013-09-30 21:31:04 EDT	2013-09-30	21:31:04	-0400	249288197	samspressshop	Sam Johnson		It's time to fund the government &amp; give the American ppl the same relief from ObamaCare that @BarackObama unilaterally gave  businesses	en	[{'screen_name': 'barackobama', 'name': 'barack obama', 'id': '813286'}]	[]	[]	3	5	0	[]	[]	https://twitter.com/SamsPressShop/status/384852933939974144	False		0								[]				
384842084739346432	384842084739346432	2013-09-30 20:47:57 EDT	2013-09-30	20:47:57	-0400	249288197	samspressshop	Sam Johnson		House passes 3rd #CR. If ObamaCare is the best thing since sliced bread, @SenatorReid should have no problem voting for this bill.	en	[{'screen_name': 'senatorreid', 'name': 'senator harry reid', 'id': '16789970'}]	[]	[]	0	1	0	['cr']	[]	https://twitter.com/SamsPressShop/status/384842084739346432	False		0								[]				
381139505710768129	381139505710768129	2013-09-20 15:35:14 EDT	2013-09-20	15:35:14	-0400	249288197	samspressshop	Sam Johnson		Today I voted to derail ObamaCare and keep the government open - now the #Senatemustact  http://t.co/5RYknZFwCw	en	[]	['http://samjohnson.house.gov/news/email/show.aspx?ID=MZYU2CWA62C5S43SJGH3Q4PZQE']	[]	8	6	0	['senatemustact']	[]	https://twitter.com/SamsPressShop/status/381139505710768129	False		0								[]				
381104328783589378	381104328783589378	2013-09-20 13:15:27 EDT	2013-09-20	13:15:27	-0400	249288197	samspressshop	Sam Johnson		#TX GOP delegation sent a letter to U.S. Senators, urging them 2 join the effort 2 defund Obamacare through the #CR  http://t.co/azNxrvuJgA	en	[]	['http://1.usa.gov/18g4fdh']	[]	1	1	0	['tx', 'cr']	[]	https://twitter.com/SamsPressShop/status/381104328783589378	False		0								[]				
381080792362803200	381080792362803200	2013-09-20 11:41:55 EDT	2013-09-20	11:41:55	-0400	249288197	samspressshop	Sam Johnson		Today, House Republicans did what’s best for the American people – prevent a government-shutdown and defund ObamaCare fully and permanently.	en	[]	[]	[]	6	9	2	[]	[]	https://twitter.com/SamsPressShop/status/381080792362803200	False		0								[]				
381034346485780480	381034346485780480	2013-09-20 08:37:22 EDT	2013-09-20	08:37:22	-0400	249288197	samspressshop	Sam Johnson		Greatly enjoyed talking to fellow #TX veterans - your service and sacrifice will never be forgotten! Thank you @MacTXPress for including me.	en	[{'screen_name': 'mactxpress', 'name': 'mac thornberry press', 'id': '377534571'}]	[]	[]	1	2	0	['tx']	[]	https://twitter.com/SamsPressShop/status/381034346485780480	False		0								[]				
380757752886214656	380757752886214656	2013-09-19 14:18:17 EDT	2013-09-19	14:18:17	-0400	249288197	samspressshop	Sam Johnson		Heading to a @WaysandMeansGOP Social Security hearing on the Disability Insurance fraud in Puerto Rico - the American ppl deserve answers.	en	[{'screen_name': 'waysandmeansgop', 'name': 'ways and means gop', 'id': '12788332'}]	[]	[]	2	5	0	[]	[]	https://twitter.com/SamsPressShop/status/380757752886214656	False		0								[]				
380691115239673857	380691115239673857	2013-09-19 09:53:29 EDT	2013-09-19	09:53:29	-0400	249288197	samspressshop	Sam Johnson		It's an honor to receive the @AirForceAssoc Lifetime Achievement Award - recognizing not a single achievement but a lifetime of work. #GBU	en	[{'screen_name': 'airforceassoc', 'name': 'air force association', 'id': '50313443'}]	[]	[]	4	2	1	['gbu']	[]	https://twitter.com/SamsPressShop/status/380691115239673857	False		0								[]				
380461026954600450	380461026954600450	2013-09-18 18:39:12 EDT	2013-09-18	18:39:12	-0400	249288197	samspressshop	Sam Johnson		I'll be w fellow pilots, aviation fans &amp; great patriots at the @AirForceAssoc dinner on @usairforce 66th bday.  I'm looking forward to it!	en	[{'screen_name': 'airforceassoc', 'name': 'air force association', 'id': '50313443'}, {'screen_name': 'usairforce', 'name': 'u.s. air force', 'id': '19611483'}]	[]	[]	1	2	0	[]	[]	https://twitter.com/SamsPressShop/status/380461026954600450	False		0								[]				
379968634124115968	379968634124115968	2013-09-17 10:02:36 EDT	2013-09-17	10:02:36	-0400	249288197	samspressshop	Sam Johnson		On this #ConstitutionDay, let's be grateful for the blessings of #freedom - like the freedom of speech - that makes us exceptional.	en	[]	[]	[]	0	1	0	['constitutionday', 'freedom']	[]	https://twitter.com/SamsPressShop/status/379968634124115968	False		0								[]				
379681763187900416	379681763187900416	2013-09-16 15:02:41 EDT	2013-09-16	15:02:41	-0400	249288197	samspressshop	Sam Johnson		District staff members will visit 4 different cities across #NTX on Thurs., Sept. 19 to assist you w federal issues.  http://t.co/BQQXMmjSQH	en	[]	['http://1.usa.gov/18rWXXN']	[]	3	2	1	['ntx']	[]	https://twitter.com/SamsPressShop/status/379681763187900416	False		0								[]				
378254772848951296	378254772848951296	2013-09-12 16:32:20 EDT	2013-09-12	16:32:20	-0400	249288197	samspressshop	Sam Johnson		And it's out! Check out our latest e-newsletter, it includes info. on Syria, my vote to STOP ObamaCare's fraud &amp; more  http://t.co/LAwW5lGLgW	en	[]	['http://1.usa.gov/1e7gjnd']	[]	3	1	0	[]	[]	https://twitter.com/SamsPressShop/status/378254772848951296	False		0								[]				
378252167812890624	378252167812890624	2013-09-12 16:21:59 EDT	2013-09-12	16:21:59	-0400	249288197	samspressshop	Sam Johnson		E-Newsletter is about to go out, don't miss it! Sign-up now ----&gt;  https://t.co/DOumiQvRws #TX03 Issues mentioned: #RepealObamaCare #Syria	en	[]	['https://samjohnson.house.gov/forms/form/?ID=2431']	[]	0	0	0	['tx03', 'repealobamacare', 'syria']	[]	https://twitter.com/SamsPressShop/status/378252167812890624	False		0								[]				
378248177440129024	378248177440129024	2013-09-12 16:06:07 EDT	2013-09-12	16:06:07	-0400	249288197	samspressshop	Sam Johnson		I thank folks calling in to make their voices heard on defunding ObamaCare, I have consistently voted to REPEAL this TERRIBLE law. #TX03	en	[]	[]	[]	2	3	0	['tx03']	[]	https://twitter.com/SamsPressShop/status/378248177440129024	False		0								[]				
378165119756148736	378165119756148736	2013-09-12 10:36:05 EDT	2013-09-12	10:36:05	-0400	249288197	samspressshop	Sam Johnson		ObamaCare delays open a wide door to further fraud in our HC system. Today I'll vote to close it &amp; protect taxpayer $  http://t.co/LSLU1q4mDs	en	[]	['http://bit.ly/14OpEI7']	[]	1	2	1	[]	[]	https://twitter.com/SamsPressShop/status/378165119756148736	False		0								[]				
377896559376990208	377896559376990208	2013-09-11 16:48:55 EDT	2013-09-11	16:48:55	-0400	249288197	samspressshop	Sam Johnson		SAVE THE DATE --- I hope you join us for our Fall events in #NorthTexas. @neighborsgo  http://t.co/kboRhoWgZM	en	[{'screen_name': 'neighborsgo', 'name': 'neighborsgo', 'id': '8725052'}]	[]	['https://pbs.twimg.com/media/BT6O6yhCAAAWgBw.jpg']	0	1	0	['northtexas']	[]	https://twitter.com/SamsPressShop/status/377896559376990208	False		1	https://pbs.twimg.com/media/BT6O6yhCAAAWgBw.jpg							[]				
377796635855568896	377796635855568896	2013-09-11 10:11:51 EDT	2013-09-11	10:11:51	-0400	249288197	samspressshop	Sam Johnson		We honor those who serve, past and present.  We remember those we lost. We will #NeverForget.  http://t.co/iiUgUz1jCq	en	[]	[]	['https://pbs.twimg.com/media/BT40CeYCQAAcgHY.jpg']	1	2	2	['neverforget']	[]	https://twitter.com/SamsPressShop/status/377796635855568896	False		1	https://pbs.twimg.com/media/BT40CeYCQAAcgHY.jpg							[]				
377546498113671168	377546498113671168	2013-09-10 17:37:55 EDT	2013-09-10	17:37:55	-0400	249288197	samspressshop	Sam Johnson		Lynda Ricci made a surprise visit to my office to hand-deliver a #POW bracelet engraved w/ my name &amp; shoot-down date.  http://t.co/O7xKWovW13	en	[]	[]	['https://pbs.twimg.com/media/BT1QiiqCEAANrOi.jpg']	2	3	2	['pow']	[]	https://twitter.com/SamsPressShop/status/377546498113671168	False		1	https://pbs.twimg.com/media/BT1QiiqCEAANrOi.jpg							[]				
377089544782241792	377089544782241792	2013-09-09 11:22:08 EDT	2013-09-09	11:22:08	-0400	249288197	samspressshop	Sam Johnson		ATTN High School Students: Applications for the Congressional Youth Advisory Council are due this Fri, Sept. 13.  http://t.co/CFqUJ6OGcB	en	[]	['http://1.usa.gov/1ew2spb']	[]	0	0	0	[]	[]	https://twitter.com/SamsPressShop/status/377089544782241792	False		0								[]				
376066086568873984	376066086568873984	2013-09-06 15:35:16 EDT	2013-09-06	15:35:16	-0400	249288197	samspressshop	Sam Johnson		Had a wonderful time @Prestonwood last weekend. Thank you for faithfully serving our community for over 30 years!  http://t.co/o8lX7150fP	en	[{'screen_name': 'prestonwood', 'name': 'prestonwood baptist', 'id': '180044219'}]	[]	['https://pbs.twimg.com/media/BTgOHP6CUAI2UVG.jpg']	0	1	0	[]	[]	https://twitter.com/SamsPressShop/status/376066086568873984	False		1	https://pbs.twimg.com/media/BTgOHP6CUAI2UVG.jpg							[]				
370256347670913024	370256347670913024	2013-08-21 14:49:26 EDT	2013-08-21	14:49:26	-0400	249288197	samspressshop	Sam Johnson		It's an outrage to learn of the widespread disability fraud in Puerto Rico. Read more about it via @WSJ  http://t.co/zCGtTfnpXO	en	[{'screen_name': 'wsj', 'name': 'the wall street journal', 'id': '3108351'}]	['http://on.wsj.com/1d2v4rK']	[]	9	4	0	[]	[]	https://twitter.com/SamsPressShop/status/370256347670913024	False		0								[]				
366923230172282882	366923230172282882	2013-08-12 10:04:49 EDT	2013-08-12	10:04:49	-0400	249288197	samspressshop	Sam Johnson		ICYMI: A tribute to a dear friend and fellow POW Bud Day: a legacy of freedom, service and valor.  http://t.co/EPOu2VhT3B via @dallasnews	en	[{'screen_name': 'dallasnews', 'name': 'dallas morning news', 'id': '15679641'}]	['http://dallasne.ws/14mNHwq']	[]	6	4	1	[]	[]	https://twitter.com/SamsPressShop/status/366923230172282882	False		0								[]				
363322171256348673	363322171256348673	2013-08-02 11:35:30 EDT	2013-08-02	11:35:30	-0400	249288197	samspressshop	Sam Johnson		ICYMI: via @marklevinshow IRS-Chief says no thanks to ObamaCare, prefers to keep current plan. LISTEN HERE:  https://t.co/xcOiQtpfXJ	en	[{'screen_name': 'marklevinshow', 'name': 'mark r. levin', 'id': '38495835'}]	['https://www.youtube.com/watch?v=A3MwpbSrmj8']	[]	2	4	1	[]	[]	https://twitter.com/SamsPressShop/status/363322171256348673	False		0								[]				
363054503504785408	363054503504785408	2013-08-01 17:51:53 EDT	2013-08-01	17:51:53	-0400	249288197	samspressshop	Sam Johnson		IRS-Chief says no thanks to ObamaCare  https://t.co/7fmgMDpfEp via @FNTheFive. RED FLAG? #RepealObamaCare	en	[{'screen_name': 'fnthefive', 'name': 'fnthefive', 'id': '2756831326'}]	['https://www.youtube.com/upload']	[]	2	3	2	['repealobamacare']	[]	https://twitter.com/SamsPressShop/status/363054503504785408	False		0								[]				
363009744887230465	363009744887230465	2013-08-01 14:54:02 EDT	2013-08-01	14:54:02	-0400	249288197	samspressshop	Sam Johnson		In Case You Missed It: #IRS Commissioner: I Would Rather Keep My Health Plan Than Have Obamacare  http://t.co/h2uxGsc1dl #RepealObamaCare	en	[]	['http://bit.ly/19A49Bu']	[]	2	9	1	['irs', 'repealobamacare']	[]	https://twitter.com/SamsPressShop/status/363009744887230465	False		0								[]				
362996788313067520	362996788313067520	2013-08-01 14:02:33 EDT	2013-08-01	14:02:33	-0400	249288197	samspressshop	Sam Johnson		If confirmed as the new #IRS Commissioner, John Koskinen’s first order of business must be to earn back the #TRUST of the American people.	en	[]	[]	[]	5	2	1	['irs', 'trust']	[]	https://twitter.com/SamsPressShop/status/362996788313067520	False		0								[]				
361967613565345792	361967613565345792	2013-07-29 17:52:58 EDT	2013-07-29	17:52:58	-0400	249288197	samspressshop	Sam Johnson		My statement on the passing of fellow POW Col. Bud Day  http://t.co/Gcnjof1jL3 #AmericanHero. Shirley and I will miss Bud tremendously!	en	[]	['http://1.usa.gov/15rNID3']	[]	0	1	0	['americanhero']	[]	https://twitter.com/SamsPressShop/status/361967613565345792	False		0								[]				
360853573103386625	360853573103386625	2013-07-26 16:06:10 EDT	2013-07-26	16:06:10	-0400	249288197	samspressshop	Sam Johnson		Sadly, when it comes to individual liberty, the President doesn't have a clue.  http://t.co/r9pi6Qvo5B #freedomisnotfree #VietnamPOW	en	[]	['http://1.usa.gov/1brO8yT']	[]	4	5	1	['freedomisnotfree', 'vietnampow']	[]	https://twitter.com/SamsPressShop/status/360853573103386625	False		0								[]				
