id	conversation_id	created_at	date	time	timezone	user_id	username	name	place	tweet	language	mentions	urls	photos	replies_count	retweets_count	likes_count	hashtags	cashtags	link	retweet	quote_url	video	thumbnail	near	geo	source	user_rt_id	user_rt	retweet_id	reply_to	retweet_date	translate	trans_src	trans_dest
284395295800958976	284395295800958976	2012-12-27 15:28:16 EST	2012-12-27	15:28:16	-0400	85322445	repkucinich	Dennis Kucinich		Came in to work today. Few Members here for #ProForma session. Hope #Congress will return to the protect the nation's economy #FiscalCliff	en	[]	[]	[]	12	13	19	['proforma', 'congress', 'fiscalcliff']	[]	https://twitter.com/RepKucinich/status/284395295800958976	False		0								[]				
281813829208399872	281813829208399872	2012-12-20 12:30:27 EST	2012-12-20	12:30:27	-0400	85322445	repkucinich	Dennis Kucinich		Say NO to #CatFoodChristmas #FiscalCliff  http://t.co/GezVRQY6 #SocialSecurity does not contribute to the debt, should not be on the table.	en	[]	['http://www.youtube.com/watch?v=JUoGq1mLRQI']	[]	0	11	16	['catfoodchristmas', 'fiscalcliff', 'socialsecurity']	[]	https://twitter.com/RepKucinich/status/281813829208399872	False		0								[]				
281582541276839938	281582541276839938	2012-12-19 21:11:24 EST	2012-12-19	21:11:24	-0400	85322445	repkucinich	Dennis Kucinich		"Don't ""chain"" senior's #SocSec benefits to #FiscalCiff. Say no say #CatFoodChristmas #CPI"	en	[]	[]	[]	1	22	4	['socsec', 'fiscalciff', 'catfoodchristmas', 'cpi']	[]	https://twitter.com/RepKucinich/status/281582541276839938	False		0								[]				
281174750796062720	281174750796062720	2012-12-18 18:10:59 EST	2012-12-18	18:10:59	-0400	85322445	repkucinich	Dennis Kucinich		The #Iran/Western Hemisphere Act is a barrier to serious diplomacy.  A barrier to diplomacy makes conflict more likely.  http://t.co/HSASVcII	en	[]	['http://kucinich.house.gov/news/email/show.aspx?ID=EWC7WJTRSIVHOMDRFX4RYKZGHA']	[]	4	15	5	['iran']	[]	https://twitter.com/RepKucinich/status/281174750796062720	False		0								[]				
279320090116231169	279320090116231169	2012-12-13 15:21:13 EST	2012-12-13	15:21:13	-0400	85322445	repkucinich	Dennis Kucinich		Today we forced a rare discussion of this Administration's #drones policy in the Judiciary Committee.  http://t.co/CFHAOnOW	en	[]	['http://www.huffingtonpost.com/2012/12/13/drone-strikes-congress-transparency_n_2294339.html?utm_hp_ref=mostpopular']	[]	5	21	4	['drones']	[]	https://twitter.com/RepKucinich/status/279320090116231169	False		0								[]				
278918785644261376	278918785644261376	2012-12-12 12:46:35 EST	2012-12-12	12:46:35	-0400	85322445	repkucinich	Dennis Kucinich		Critical Vote Alert: House committee to vote on drone oversight bill tomorrow.   http://t.co/OnHEhVSt	en	[]	['http://kucinich.house.gov/news/email/show.aspx?ID=FKAFNUFJIEQOUIJMK7QXNGGPNU']	[]	0	15	6	[]	[]	https://twitter.com/RepKucinich/status/278918785644261376	False		0								[]				
276740371206266880	276740371206266880	2012-12-06 12:30:20 EST	2012-12-06	12:30:20	-0400	85322445	repkucinich	Dennis Kucinich		Dear Facebook Friends,  Thank you for all your support, kind wishes and spirit of activism.   I will be closing...  http://t.co/pnmoGfJM	en	[]	['http://fb.me/226Wzw3Vk']	[]	2	2	3	[]	[]	https://twitter.com/RepKucinich/status/276740371206266880	False		0								[]				
276353663952363520	276353663952363520	2012-12-05 10:53:42 EST	2012-12-05	10:53:42	-0400	85322445	repkucinich	Dennis Kucinich		It’s our choice. Increase #taxes, cut #spending, put the #economy in a stall, or put millions back to work. #NeedAct  http://t.co/BEkrf7aV	en	[]	['http://kucinich.house.gov/news/documentsingle.aspx?DocumentID=314613']	[]	1	6	0	['taxes', 'spending', 'economy', 'needact']	[]	https://twitter.com/RepKucinich/status/276353663952363520	False		0								[]				
275986675233079296	275986675233079296	2012-12-04 10:35:25 EST	2012-12-04	10:35:25	-0400	85322445	repkucinich	Dennis Kucinich		#NPR examines bad idea – We shouldn't celebrate #bomb that killed hundreds of thousands and started the #ColdWar #Nukes  http://t.co/deZV9PMo	en	[]	['http://n.pr/RyRUx5']	[]	2	6	4	['npr', 'bomb', 'coldwar', 'nukes']	[]	https://twitter.com/RepKucinich/status/275986675233079296	False		0								[]				
275634242522841088	275634242522841088	2012-12-03 11:14:59 EST	2012-12-03	11:14:59	-0400	85322445	repkucinich	Dennis Kucinich		The #CIA bombing &amp; the #Pentagon spying. Who knows what the other 12 spy agencies are up to? I'll speak to Congress at 2 pm et #DIA	en	[]	[]	[]	4	20	4	['cia', 'pentagon', 'dia']	[]	https://twitter.com/RepKucinich/status/275634242522841088	False		0								[]				
274539208050360320	274539208050360320	2012-11-30 10:43:42 EST	2012-11-30	10:43:42	-0400	85322445	repkucinich	Dennis Kucinich		Do you think Social Security, Medicare and Medicaid should  should be part of a budget deal?  http://t.co/5Xp84T9R	en	[]	['http://fb.me/1SCYuYHU6']	[]	7	5	2	[]	[]	https://twitter.com/RepKucinich/status/274539208050360320	False		0								[]				
273889943770763264	273889943770763264	2012-11-28 15:43:45 EST	2012-11-28	15:43:45	-0400	85322445	repkucinich	Dennis Kucinich		We must reject the notion that protecting our national security requires revoking the constitutional rights of...  http://t.co/7Om7ch5U	en	[]	['http://fb.me/1JaWzJNEC']	[]	1	20	5	[]	[]	https://twitter.com/RepKucinich/status/273889943770763264	False		0								[]				
273512553177554944	273512553177554944	2012-11-27 14:44:08 EST	2012-11-27	14:44:08	-0400	85322445	repkucinich	Dennis Kucinich		We need a Great Economic Revival, not another Great Depression. #FiscalCliff  http://t.co/gcqUtsMP	en	[]	['http://fb.me/21oIIwFAM']	[]	4	8	1	['fiscalcliff']	[]	https://twitter.com/RepKucinich/status/273512553177554944	False		0								[]				
273179010962432003	273179010962432003	2012-11-26 16:38:46 EST	2012-11-26	16:38:46	-0400	85322445	repkucinich	Dennis Kucinich		How long can a democracy last with a foreign policy based on assassination without oversight? #Drones  http://t.co/FUuVsgEU	en	[]	['http://fb.me/2m8Z9VFpp']	[]	2	40	9	['drones']	[]	https://twitter.com/RepKucinich/status/273179010962432003	False		0								[]				
271327173707722756	271327173707722756	2012-11-21 14:00:13 EST	2012-11-21	14:00:13	-0400	85322445	repkucinich	Dennis Kucinich		Will be on @TOTN with @kenrudin at 2:15 pm et today to discuss my 16 years in Congress. @NPR	en	[{'screen_name': 'kenrudin', 'name': 'ken rudin', 'id': '16249259'}, {'screen_name': 'npr', 'name': 'npr', 'id': '5392522'}]	[]	[]	0	7	2	[]	[]	https://twitter.com/RepKucinich/status/271327173707722756	False		0								[]				
271314555974602753	271314555974602753	2012-11-21 13:10:05 EST	2012-11-21	13:10:05	-0400	85322445	repkucinich	Dennis Kucinich		Part 2 of WKYC's 3-part series is here:  http://t.co/N5rw7t1W	en	[]	['http://www.wkyc.com/news/politics_government/article/269964/130/Washington-DC-Activists-fear-losing-Kucinich-voice']	[]	1	2	0	[]	[]	https://twitter.com/RepKucinich/status/271314555974602753	False		0								[]				
270991385786728449	270991385786728449	2012-11-20 15:45:55 EST	2012-11-20	15:45:55	-0400	85322445	repkucinich	Dennis Kucinich		@samfbiddle @Gizmodo just posted interview conducted after the 1st Congressional briefing on #drones. #GoodRead  http://t.co/PEd8vLuF	en	[{'screen_name': 'gizmodo', 'name': 'gizmodo', 'id': '2890961'}]	['http://bit.ly/UdmMSO']	[]	1	1	2	['drones', 'goodread']	[]	https://twitter.com/RepKucinich/status/270991385786728449	False		0								[]				
270987374366973952	270987374366973952	2012-11-20 15:29:59 EST	2012-11-20	15:29:59	-0400	85322445	repkucinich	Dennis Kucinich		Part 1 of WKYC’s series on my 16 yrs in Congress is here:  http://t.co/Hv79ude5 Part 2 should air tonight during the 6:00 pm broadcast.	en	[]	['http://on.wkyc.com/Y0bC6P']	[]	0	3	0	[]	[]	https://twitter.com/RepKucinich/status/270987374366973952	False		0								[]				
270916214858055680	270916214858055680	2012-11-20 10:47:13 EST	2012-11-20	10:47:13	-0400	85322445	repkucinich	Dennis Kucinich		Undermining peace in #Gaza and #Israel in one minute flat  http://t.co/ordwv2JI	en	[]	['http://kucinich.house.gov/news/email/show.aspx?ID=I26NBQEMIP3ISRLAO7PNHGCA6A']	[]	2	23	3	['gaza', 'israel']	[]	https://twitter.com/RepKucinich/status/270916214858055680	False		0								[]				
269540481359294464	269540481359294464	2012-11-16 15:40:33 EST	2012-11-16	15:40:33	-0400	85322445	repkucinich	Dennis Kucinich		Today, Congress finally heard expert testimony re U.S. combat drones. The first attack took place in 2002.   http://t.co/ErTOeXe5	en	[]	['http://www.guardian.co.uk/commentisfree/2012/nov/16/obama-administration-account-congress-targeted-assassinations']	[]	2	17	7	[]	[]	https://twitter.com/RepKucinich/status/269540481359294464	False		0								[]				
268832248084709376	268832248084709376	2012-11-14 16:46:17 EST	2012-11-14	16:46:17	-0400	85322445	repkucinich	Dennis Kucinich		Want to know what a national security state looks like? Look around.  http://t.co/0nvC1Q6i	en	[]	['http://fb.me/1nadlc2IH']	[]	0	18	8	[]	[]	https://twitter.com/RepKucinich/status/268832248084709376	False		0								[]				
268423493396361216	268423493396361216	2012-11-13 13:42:02 EST	2012-11-13	13:42:02	-0400	85322445	repkucinich	Dennis Kucinich		I will be on the House floor at about 2 pm et today to call for General Petraeus to testify before Congress. #Libya #Benghazi	en	[]	[]	[]	5	14	2	['libya', 'benghazi']	[]	https://twitter.com/RepKucinich/status/268423493396361216	False		0								[]				
267672615626362880	267672615626362880	2012-11-11 11:58:19 EST	2012-11-11	11:58:19	-0400	85322445	repkucinich	Dennis Kucinich		Discussing Fiscal Cliff and the security situation in Libya on Fox News with Rep. Jason Chaffetz.	en	[]	[]	[]	2	1	1	[]	[]	https://twitter.com/RepKucinich/status/267672615626362880	False		0								[]				
266926637545820160	266926637545820160	2012-11-09 10:34:04 EST	2012-11-09	10:34:04	-0400	85322445	repkucinich	Dennis Kucinich		Just finished taping with Dick Feagler @WVIZ. The show will air Friday 8:30 PM and Sunday 11:30 AM	en	[{'screen_name': 'wviz', 'name': 'wviz', 'id': '13751412'}]	[]	[]	1	1	0	[]	[]	https://twitter.com/RepKucinich/status/266926637545820160	False		0								[]				
266015116573675521	266015116573675521	2012-11-06 22:12:00 EST	2012-11-06	22:12:00	-0400	85322445	repkucinich	Dennis Kucinich		Currently on Democracy Now with Amy Goodman  http://t.co/OysRQ6ga	en	[]	['http://www.democracynow.org/']	[]	1	4	2	[]	[]	https://twitter.com/RepKucinich/status/266015116573675521	False		0								[]				
265987795154268160	265987795154268160	2012-11-06 20:23:26 EST	2012-11-06	20:23:26	-0400	85322445	repkucinich	Dennis Kucinich		I will be on HuffPost live in about 20 minutes.	en	[]	[]	[]	0	5	1	[]	[]	https://twitter.com/RepKucinich/status/265987795154268160	False		0								[]				
265968860333744128	265968860333744128	2012-11-06 19:08:12 EST	2012-11-06	19:08:12	-0400	85322445	repkucinich	Dennis Kucinich		Headed to CurrentTV to discuss early election results with Stephanie Miller.	en	[]	[]	[]	1	3	1	[]	[]	https://twitter.com/RepKucinich/status/265968860333744128	False		0								[]				
265943290820571137	265943290820571137	2012-11-06 17:26:36 EST	2012-11-06	17:26:36	-0400	85322445	repkucinich	Dennis Kucinich		I'll be on WKYC to discuss the election shortly.	en	[]	[]	[]	0	2	1	[]	[]	https://twitter.com/RepKucinich/status/265943290820571137	False		0								[]				
265554339135905793	265554339135905793	2012-11-05 15:41:02 EST	2012-11-05	15:41:02	-0400	85322445	repkucinich	Dennis Kucinich		Headed to Triv’s restaurant in Strongsville to be on the Mike Trivisonno show on @WTAM1100 Listen Live:  http://t.co/8comNj18	en	[{'screen_name': 'wtam1100', 'name': 'newsradio wtam 1100', 'id': '52398718'}]	['http://www.iheart.com/live/1749/?autoplay=true']	[]	0	0	0	[]	[]	https://twitter.com/RepKucinich/status/265554339135905793	False		0								[]				
265479571418251264	265479571418251264	2012-11-05 10:43:56 EST	2012-11-05	10:43:56	-0400	85322445	repkucinich	Dennis Kucinich		I was proud to introduce Melissa Etheridge as she was acclaimed by the National Museum of Women in the Arts last night.  http://t.co/MjosCGbR	en	[]	['http://www.nmwa.org/press-room/press-releases/nmwa-25th-anniversary-fall-benefit-honors-melissa-etheridge']	[]	2	4	2	[]	[]	https://twitter.com/RepKucinich/status/265479571418251264	False		0								[]				
264750097634578434	264750097634578434	2012-11-03 11:25:16 EDT	2012-11-03	11:25:16	-0400	85322445	repkucinich	Dennis Kucinich		More than ten years in, estimates suggest that our covert drones have killed more than 3000 people, including...  http://t.co/PYp8rPYz	en	[]	['http://fb.me/vuAE2YqP']	[]	1	16	6	[]	[]	https://twitter.com/RepKucinich/status/264750097634578434	False		0								[]				
264445701717643264	264445701717643264	2012-11-02 15:15:43 EDT	2012-11-02	15:15:43	-0400	85322445	repkucinich	Dennis Kucinich		Did you know that you are paying to promote the childhood obesity epidemic?  http://t.co/z09d6Hwq	en	[]	['http://fb.me/24UbehByI']	[]	1	7	1	[]	[]	https://twitter.com/RepKucinich/status/264445701717643264	False		0								[]				
263999995202633728	263999995202633728	2012-11-01 09:44:38 EDT	2012-11-01	09:44:38	-0400	85322445	repkucinich	Dennis Kucinich		We must get serious about climate change.  http://t.co/tewQLJ7r	en	[]	['http://fb.me/IRSUue7q']	[]	5	6	1	[]	[]	https://twitter.com/RepKucinich/status/263999995202633728	False		0								[]				
261215572954603520	261215572954603520	2012-10-24 17:20:20 EDT	2012-10-24	17:20:20	-0400	85322445	repkucinich	Dennis Kucinich		"""Targeted killing is now so routine that the Obama administration has spent much of the past year codifying and...  http://t.co/LuvCIBo4"	en	[]	['http://fb.me/1lmhPODnd']	[]	0	13	3	[]	[]	https://twitter.com/RepKucinich/status/261215572954603520	False		0								[]				
260472394488098816	260472394488098816	2012-10-22 16:07:12 EDT	2012-10-22	16:07:12	-0400	85322445	repkucinich	Dennis Kucinich		As we listen to Democratic and Republican presidential candidates it is worth saying that a thoughtful foreign...  http://t.co/LXhAxFRw	en	[]	['http://fb.me/1GkNa5vdE']	[]	0	7	0	[]	[]	https://twitter.com/RepKucinich/status/260472394488098816	False		0								[]				
259670604171603968	259670604171603968	2012-10-20 11:01:11 EDT	2012-10-20	11:01:11	-0400	85322445	repkucinich	Dennis Kucinich		Approving the CIA's  request for more drones would be tantamount to doubling down on the dismissal of...  http://t.co/tALslJ3U	en	[]	['http://fb.me/IHOSfwJ4']	[]	0	19	0	[]	[]	https://twitter.com/RepKucinich/status/259670604171603968	False		0								[]				
258978940226523136	258978940226523136	2012-10-18 13:12:45 EDT	2012-10-18	13:12:45	-0400	85322445	repkucinich	Dennis Kucinich		The Trans-Pacific Partnership (TPP) is shaping up to be worse than NAFTA. We need transparency and accountability...  http://t.co/DdZYNL0k	en	[]	['http://fb.me/1S8zFQn9v']	[]	0	13	2	[]	[]	https://twitter.com/RepKucinich/status/258978940226523136	False		0								[]				
256039103731232768	256039103731232768	2012-10-10 10:30:53 EDT	2012-10-10	10:30:53	-0400	85322445	repkucinich	Dennis Kucinich		Ten years ago, on October 10, 2002, the United States House of Representatives made one of the most calamitous...  http://t.co/nPFpdhH0	en	[]	['http://fb.me/Yhj6TZ9h']	[]	0	10	1	[]	[]	https://twitter.com/RepKucinich/status/256039103731232768	False		0								[]				
253499866452484096	253499866452484096	2012-10-03 10:20:52 EDT	2012-10-03	10:20:52	-0400	85322445	repkucinich	Dennis Kucinich		Imagine America trillions richer, our sons and daughters returned to us. Imagine America at peace in the Middle...  http://t.co/CutQjJ0p	en	[]	['http://fb.me/H2kabjyQ']	[]	3	32	4	[]	[]	https://twitter.com/RepKucinich/status/253499866452484096	False		0								[]				
253147752597438464	253147752597438464	2012-10-02 11:01:42 EDT	2012-10-02	11:01:42	-0400	85322445	repkucinich	Dennis Kucinich		Iraq: ten years, a million lives and trillions of dollars later, it's time for truth and reconciliation.  http://t.co/GPW27qMZ	en	[]	['http://fb.me/28vxPAC5J']	[]	1	22	5	[]	[]	https://twitter.com/RepKucinich/status/253147752597438464	False		0								[]				
252770768071565312	252770768071565312	2012-10-01 10:03:42 EDT	2012-10-01	10:03:42	-0400	85322445	repkucinich	Dennis Kucinich		Standing up to whitewashing at Davis-Besse. Tell #FirstEnergy not to gamble with our safety  http://t.co/rrjDtV9E	en	[]	['http://www.beyondnuclear.org/home/2012/9/27/congressman-kucinich-objects-to-whitewash-of-davis-besse-con.html']	[]	3	6	2	['firstenergy']	[]	https://twitter.com/RepKucinich/status/252770768071565312	False		0								[]				
251716200587993088	251716200587993088	2012-09-28 12:13:13 EDT	2012-09-28	12:13:13	-0400	85322445	repkucinich	Dennis Kucinich		Time for #NationBuilding here at home.  http://t.co/ZLJEch5W #Afghanistan #Debt	en	[]	['http://www.youtube.com/watch?v=61JJ4bFmBPM&feature=youtu.be']	[]	0	3	1	['nationbuilding', 'afghanistan', 'debt']	[]	https://twitter.com/RepKucinich/status/251716200587993088	False		0								[]				
251714669570576384	251714669570576384	2012-09-28 12:07:08 EDT	2012-09-28	12:07:08	-0400	85322445	repkucinich	Dennis Kucinich		Congratulations to peace activists in Selma, Al who successfully stopped a monument to hate. I stand in solidarity for peace and justice.	en	[]	[]	[]	0	12	4	[]	[]	https://twitter.com/RepKucinich/status/251714669570576384	False		0								[]				
251694891258769409	251694891258769409	2012-09-28 10:48:33 EDT	2012-09-28	10:48:33	-0400	85322445	repkucinich	Dennis Kucinich		I urge supporters of the #BombPark to focus their energy on more productive activities.  http://t.co/ekbKwbcw	en	[]	['http://www.huffingtonpost.com/rep-dennis-kucinich/drop-the-bomb-park_b_1922679.html']	[]	0	2	2	['bombpark']	[]	https://twitter.com/RepKucinich/status/251694891258769409	False		0								[]				
251095721149865985	251095721149865985	2012-09-26 19:07:39 EDT	2012-09-26	19:07:39	-0400	85322445	repkucinich	Dennis Kucinich		I will be on CurrentTV tonight at 10pm to discuss the energy market's impact on Ohio, the nation and November with @JenGranholm	en	[{'screen_name': 'jengranholm', 'name': 'jennifer granholm', 'id': '14185317'}]	[]	[]	0	5	1	[]	[]	https://twitter.com/RepKucinich/status/251095721149865985	False		0								[]				
250327541167054848	250327541167054848	2012-09-24 16:15:11 EDT	2012-09-24	16:15:11	-0400	85322445	repkucinich	Dennis Kucinich		Peabody Energy Corporation persuaded nine regional power agencies to become partial owners of a new coal plant in...  http://t.co/oRT4NooB	en	[]	['http://fb.me/EdMZckpk']	[]	0	3	0	[]	[]	https://twitter.com/RepKucinich/status/250327541167054848	False		0								[]				
249186501978624000	249186501978624000	2012-09-21 12:41:06 EDT	2012-09-21	12:41:06	-0400	85322445	repkucinich	Dennis Kucinich		Int'l monetary experts meeting in Chi 2 discuss NEED Act - would create millions of jobs &amp; rebuild America, debt-free  http://t.co/ru1xYgLg	en	[]	['http://1.usa.gov/Sf5MMe']	[]	0	4	0	[]	[]	https://twitter.com/RepKucinich/status/249186501978624000	False		0								[]				
248836390756962304	248836390756962304	2012-09-20 13:29:53 EDT	2012-09-20	13:29:53	-0400	85322445	repkucinich	Dennis Kucinich		Manhattan Project not a walk in the park? Debate postponed into the late night yesterday; Why is the vote on H.R. 5987 being delayed today?	en	[]	[]	[]	0	6	2	[]	[]	https://twitter.com/RepKucinich/status/248836390756962304	False		0								[]				
248827961539719168	248827961539719168	2012-09-20 12:56:23 EDT	2012-09-20	12:56:23	-0400	85322445	repkucinich	Dennis Kucinich		Did Peabody Energy Company deliberately unload a bad investment on public power organizations serving 217 cities...  http://t.co/BsR2A4Cd	en	[]	['http://fb.me/1hCigQ7hz']	[]	0	9	3	[]	[]	https://twitter.com/RepKucinich/status/248827961539719168	False		0								[]				
248810579739938816	248810579739938816	2012-09-20 11:47:19 EDT	2012-09-20	11:47:19	-0400	85322445	repkucinich	Dennis Kucinich		About to challenge Peabody's energy deal which is doubling electric rates across the Midwest. #CSPAN	en	[]	[]	[]	0	7	3	['cspan']	[]	https://twitter.com/RepKucinich/status/248810579739938816	False		0								[]				
248519667717652481	248519667717652481	2012-09-19 16:31:20 EDT	2012-09-19	16:31:20	-0400	85322445	repkucinich	Dennis Kucinich		The FDA has received over a million comments from citizens demanding labeling of GMOs. Ninety percent of Americans...  http://t.co/MsZAJHQi	en	[]	['http://fb.me/IDYmpTRX']	[]	0	22	6	[]	[]	https://twitter.com/RepKucinich/status/248519667717652481	False		0								[]				
248484058621952001	248484058621952001	2012-09-19 14:09:50 EDT	2012-09-19	14:09:50	-0400	85322445	repkucinich	Dennis Kucinich		I can't support new nat'l park which glorifies project that resulted in the deaths of 100s of 1000s of innocent Japanese civilians #HR5987	en	[]	[]	[]	0	10	3	['hr5987']	[]	https://twitter.com/RepKucinich/status/248484058621952001	False		0								[]				
248483975490830337	248483975490830337	2012-09-19 14:09:31 EDT	2012-09-19	14:09:31	-0400	85322445	repkucinich	Dennis Kucinich		About to address Congress #ManhattanProject #BombPark	en	[]	[]	[]	0	4	0	['manhattanproject', 'bombpark']	[]	https://twitter.com/RepKucinich/status/248483975490830337	False		0								[]				
248437100763041792	248437100763041792	2012-09-19 11:03:15 EDT	2012-09-19	11:03:15	-0400	85322445	repkucinich	Dennis Kucinich		2.5 million households in eight states are overpaying for electricity.   In order to build a new coal plant in...  http://t.co/QTW8ilUZ	en	[]	['http://fb.me/1X59aCSPd']	[]	6	30	2	[]	[]	https://twitter.com/RepKucinich/status/248437100763041792	False		0								[]				
246336551175458816	246336551175458816	2012-09-13 15:56:25 EDT	2012-09-13	15:56:25	-0400	85322445	repkucinich	Dennis Kucinich		We have an obligation to defend our country, but we also have an obligation for housing, for health care, for...  http://t.co/VXxuMokA	en	[]	['http://fb.me/1YEljoRfk']	[]	2	9	1	[]	[]	https://twitter.com/RepKucinich/status/246336551175458816	False		0								[]				
246297336349863936	246297336349863936	2012-09-13 13:20:35 EDT	2012-09-13	13:20:35	-0400	85322445	repkucinich	Dennis Kucinich		About to address the House of Representatives. We have to stop wasting our national resources on unnecessary wars #Afghanistan	en	[]	[]	[]	3	20	6	['afghanistan']	[]	https://twitter.com/RepKucinich/status/246297336349863936	False		0								[]				
246013176678846464	246013176678846464	2012-09-12 18:31:26 EDT	2012-09-12	18:31:26	-0400	85322445	repkucinich	Dennis Kucinich		One day after September 11, 2012, Americans woke to images of our embassy in Benghazi burning, and with news that...  http://t.co/NGdpsMN3	en	[]	['http://fb.me/QL9Ofa5C']	[]	0	7	2	[]	[]	https://twitter.com/RepKucinich/status/246013176678846464	False		0								[]				
245627995782529025	245627995782529025	2012-09-11 17:00:52 EDT	2012-09-11	17:00:52	-0400	85322445	repkucinich	Dennis Kucinich		From remarks I delivered to Congress 11 years ago when the House of Representatives reconvened following the...  http://t.co/Bv8B7S1n	en	[]	['http://fb.me/Ieb9yaqj']	[]	1	10	4	[]	[]	https://twitter.com/RepKucinich/status/245627995782529025	False		0								[]				
243822966478082048	243822966478082048	2012-09-06 17:28:19 EDT	2012-09-06	17:28:19	-0400	85322445	repkucinich	Dennis Kucinich		About to go on @dailybeasttv with Michelle Cottle @HowardKurtz and @JohnAvlon	en	[{'screen_name': 'dailybeasttv', 'name': 'dailybeasttv', 'id': '2541848485'}, {'screen_name': 'howardkurtz', 'name': 'howardkurtz', 'id': '15731368'}, {'screen_name': 'johnavlon', 'name': 'john avlon', 'id': '52596376'}]	[]	[]	2	3	0	[]	[]	https://twitter.com/RepKucinich/status/243822966478082048	False		0								[]				
241617900492947456	241617900492947456	2012-08-31 15:26:11 EDT	2012-08-31	15:26:11	-0400	85322445	repkucinich	Dennis Kucinich		Labor Day 2012. Workers deserve a raise. America deserves a raise. Let's support a #LivingWage  http://t.co/I1Kr6TzD	en	[]	['http://www.huffingtonpost.com/rep-dennis-kucinich/america-deserves-a-raise_b_1847595.html']	[]	3	18	3	['livingwage']	[]	https://twitter.com/RepKucinich/status/241617900492947456	False		0								[]				
239478833538023425	239478833538023425	2012-08-25 17:46:17 EDT	2012-08-25	17:46:17	-0400	85322445	repkucinich	Dennis Kucinich		Neil Armstrong's voyage to the moon carried the hopes of a nation and reminded the world for all time that in America nothing is impossible.	en	[]	[]	[]	1	19	2	[]	[]	https://twitter.com/RepKucinich/status/239478833538023425	False		0								[]				
238267214569021441	238267214569021441	2012-08-22 09:31:45 EDT	2012-08-22	09:31:45	-0400	85322445	repkucinich	Dennis Kucinich		Our presence creates destabilization, then radicalization. Occupations create insurgencies. #Syria #Iraq #Libya #Afghan  http://t.co/F729uM8H	en	[]	['http://huff.to/NHqzCA']	[]	5	28	7	['syria', 'iraq', 'libya', 'afghan']	[]	https://twitter.com/RepKucinich/status/238267214569021441	False		0								[]				
237911900749443074	237911900749443074	2012-08-21 09:59:51 EDT	2012-08-21	09:59:51	-0400	85322445	repkucinich	Dennis Kucinich		I’ll be discussing the importance of Ohio with @ThomasARoberts on @MSNBC this morning at 11:10 eastern.	en	[{'screen_name': 'thomasaroberts', 'name': 'thomas roberts', 'id': '70771229'}, {'screen_name': 'msnbc', 'name': 'msnbc', 'id': '2836421'}]	[]	[]	0	3	0	[]	[]	https://twitter.com/RepKucinich/status/237911900749443074	False		0								[]				
237572012573343744	237572012573343744	2012-08-20 11:29:16 EDT	2012-08-20	11:29:16	-0400	85322445	repkucinich	Dennis Kucinich		Visited w/ Rep. Jackson Fri, Sat @ Mayo. Photo w/ Cong. get well card. Kind words of colleagues clearly meant a lot.   http://t.co/ZbLxHukh	en	[]	['http://bit.ly/Pyy3sd']	[]	0	4	1	[]	[]	https://twitter.com/RepKucinich/status/237572012573343744	False		0								[]				
