id	conversation_id	created_at	date	time	timezone	user_id	username	name	place	tweet	language	mentions	urls	photos	replies_count	retweets_count	likes_count	hashtags	cashtags	link	retweet	quote_url	video	thumbnail	near	geo	source	user_rt_id	user_rt	retweet_id	reply_to	retweet_date	translate	trans_src	trans_dest
1285645705760182272	1285645705760182272	2020-07-21 14:39:57 EDT	2020-07-21	14:39:57	-0400	242772524	repfranklucas	Frank Lucas		As our nation's vast research enterprise remains committed to our coronavirus response, China and Russia's unlawful cyberattacks have only grown more aggressive.  China &amp; Russia's theft continues to threaten our public health and national security.   ↓↓  https://t.co/b8YOKFNabG	en	[]	['https://www.foxnews.com/world/chinese-hackers-charged-steal-usa-coronavirus-research']	[]	3	3	4	[]	[]	https://twitter.com/RepFrankLucas/status/1285645705760182272	False	https://twitter.com/GOPLeader/status/1285574572503379972	0								[]				
1285575257483440129	1285575257483440129	2020-07-21 10:00:00 EDT	2020-07-21	10:00:00	-0400	242772524	repfranklucas	Frank Lucas		Providing for the common defense of our Nation is Congress’ highest priority.  Congress must invest in emerging technologies and the procurement of advanced defense systems to deter authoritarian regimes like China, Russia, and North Korea.  https://t.co/xtyJ3HMPMA	en	[]	[]	['https://pbs.twimg.com/media/Eda3VsyXoAEo3qb.png']	9	9	35	[]	[]	https://twitter.com/RepFrankLucas/status/1285575257483440129	False		1	https://pbs.twimg.com/media/Eda3VsyXoAEo3qb.png							[]				
1285318566020096000	1285318566020096000	2020-07-20 17:00:00 EDT	2020-07-20	17:00:00	-0400	242772524	repfranklucas	Frank Lucas		51 years ago today, @NASA's @TheRealBuzz &amp; Neil Armstrong opened up a world of opportunities for space exploration.  Today, building upon their historic first steps, @NASA is planning the next phase of American space exploration: returning to the Moon &amp; venturing on to Mars.	en	[{'screen_name': 'nasa', 'name': 'nasa', 'id': '11348282'}, {'screen_name': 'therealbuzz', 'name': 'dr. buzz aldrin', 'id': '46220856'}, {'screen_name': 'nasa', 'name': 'nasa', 'id': '11348282'}]	[]	[]	0	2	7	[]	[]	https://twitter.com/RepFrankLucas/status/1285318566020096000	False	https://twitter.com/Mike_Pence/status/1285250746716491777	0								[]				
1285273264928043025	1285273264928043025	2020-07-20 14:00:00 EDT	2020-07-20	14:00:00	-0400	242772524	repfranklucas	Frank Lucas		The Chinese Communist Party and now Russia are threatening to weaken America’s pandemic response by stealing U.S. coronavirus research.  Their theft threatens U.S. scientific research, health and national security and must not go unchecked.   https://t.co/zZjZOyqLpv	en	[]	['https://m.washingtontimes.com/news/2020/jul/16/us-and-allies-say-russian-hackers-targeting-corona/']	[]	40	212	284	[]	[]	https://twitter.com/RepFrankLucas/status/1285273264928043025	False		0								[]				
1285227970076917760	1285227970076917760	2020-07-20 11:00:01 EDT	2020-07-20	11:00:01	-0400	242772524	repfranklucas	Frank Lucas		This week, Congress looks to pass the 60th NDAA. In doing so, Congress must give our troops the resources, equipment, training, and policies they need to keep America safe.  Our military is the best in the world- let’s keep it that way!  https://t.co/5WxBd8THna	en	[]	[]	['https://pbs.twimg.com/media/EdVr4jGWsAEUTPR.jpg']	2	1	2	[]	[]	https://twitter.com/RepFrankLucas/status/1285227970076917760	False		1	https://pbs.twimg.com/media/EdVr4jGWsAEUTPR.jpg							[]				
1284457896026112000	1284457896026112000	2020-07-18 08:00:01 EDT	2020-07-18	08:00:01	-0400	242772524	repfranklucas	Frank Lucas		Today, America mourns the loss of Congressman John Lewis, a civil rights icon and the conscience of the United States Congress. John Lewis led a life fighting for equal rights and worked tirelessly to bend our nation’s arc towards justice.  God bless you, John.	en	[]	[]	[]	0	7	18	[]	[]	https://twitter.com/RepFrankLucas/status/1284457896026112000	False		0								[]				
1284186104313180160	1284186104313180160	2020-07-17 14:00:00 EDT	2020-07-17	14:00:00	-0400	242772524	repfranklucas	Frank Lucas		Congratulations to Oklahoma's very own Arnetta Cotton &amp; Dr. Claud Evans on being appointed to @USDA's Advisory Committee on Minority Farmers.  Cotton &amp; Evans will advise @USDA on the challenges minority farmers face and the implementation of USDA programs.  https://t.co/eaHqj5Lefo	en	[{'screen_name': 'usda', 'name': 'dept. of agriculture', 'id': '61853389'}, {'screen_name': 'usda', 'name': 'dept. of agriculture', 'id': '61853389'}]	['https://www.usda.gov/media/press-releases/2020/07/13/usda-announces-new-members-advisory-committee-minority-farmers']	[]	0	2	1	[]	[]	https://twitter.com/RepFrankLucas/status/1284186104313180160	False		0								[]				
1284125705672904705	1284125705672904705	2020-07-17 10:00:00 EDT	2020-07-17	10:00:00	-0400	242772524	repfranklucas	Frank Lucas		USMCA will help energize America's economy, eliminate barriers to trade and create thousands of jobs for American workers.  In Oklahoma, USMCA will help support more than 112,000 jobs and more than $1.8 BILLION worth of Oklahoma agricultural exports.  https://t.co/YS7Hqnw02S	en	[]	['https://www.wsj.com/articles/the-north-american-trade-dividend-11594076282?fbclid=IwAR2zb11sEcKsAcsmT4YtI4fwXlj5agfqtTOwpmQFAkr3DS9qXY6D14tWyg8']	[]	11	27	102	[]	[]	https://twitter.com/RepFrankLucas/status/1284125705672904705	False		0								[]				
1283869012728803328	1283869012728803328	2020-07-16 17:00:00 EDT	2020-07-16	17:00:00	-0400	242772524	repfranklucas	Frank Lucas		Yesterday, @POTUS @realDonaldTrump modernized the NEPA, cutting bureaucratic red-tape obstructing critical national and local infrastructure projects- projects vital to communities in OK-03.  Thank you @POTUS for streamlining the NEPA process for all of Oklahoma's communities.	en	[{'screen_name': 'potus', 'name': 'president biden', 'id': '1349149096909668363'}, {'screen_name': 'realdonaldtrump', 'name': 'donald j. trump', 'id': '25073877'}, {'screen_name': 'potus', 'name': 'president biden', 'id': '1349149096909668363'}]	[]	[]	4	1	3	[]	[]	https://twitter.com/RepFrankLucas/status/1283869012728803328	False	https://twitter.com/WhiteHouse45/status/1283493697343180801	0								[]				
1283823719052455938	1283823719052455938	2020-07-16 14:00:01 EDT	2020-07-16	14:00:01	-0400	242772524	repfranklucas	Frank Lucas		On Tuesday, @OKcommerce launched Phase 2 of the Oklahoma Business Relief Program.  @OKcommerce and the OBRP are working hard to help local businesses across the state overcome the economic challenges of COVID-19.   Learn more ↓	en	[{'screen_name': 'okcommerce', 'name': 'ok dept. of commerce', 'id': '16232895'}, {'screen_name': 'okcommerce', 'name': 'ok dept. of commerce', 'id': '16232895'}]	[]	[]	0	1	1	[]	[]	https://twitter.com/RepFrankLucas/status/1283823719052455938	False	https://twitter.com/OKcommerce/status/1282700550971285511	0								[]				
1282749695664717826	1282749695664717826	2020-07-13 14:52:14 EDT	2020-07-13	14:52:14	-0400	242772524	repfranklucas	Frank Lucas		🚨 REMINDER 🚨   Don't forget to file your taxes by this Wednesday, July 15th!  For more helpful information, click ↓  https://t.co/9aKkMUrzcY  https://t.co/NxKUrVV3gd	en	[]	['http://irs.gov/newsroom/irsgov-has-answers-about-filing-paying-and-july-15-due-date']	['https://pbs.twimg.com/media/Ec097AOXkAAD5z7.png']	5	0	2	[]	[]	https://twitter.com/RepFrankLucas/status/1282749695664717826	False		1	https://pbs.twimg.com/media/Ec097AOXkAAD5z7.png							[]				
1281677421117411335	1281677421117411335	2020-07-10 15:51:24 EDT	2020-07-10	15:51:24	-0400	242772524	repfranklucas	Frank Lucas		During #COVID19, families across the U.S. are relying more &amp; more on youth mentorship organizations like @4H.  As a proud alumnus of @Oklahoma4H and advocate for STEM &amp; ag education, I know just how big the impact is these organizations have on our youth.  https://t.co/mClizu9K57	en	[{'screen_name': '4h', 'name': '4-h', 'id': '14107459'}, {'screen_name': 'oklahoma4h', 'name': 'oklahoma 4-h', 'id': '15615238'}]	['https://lucas.house.gov/news/press-releases/lucas-joins-colleagues-advocating-support-4-h-youth-mentorship-organizations']	[]	1	3	8	['covid19']	[]	https://twitter.com/RepFrankLucas/status/1281677421117411335	False		0								[]				
1280969911641100289	1280969911641100289	2020-07-08 17:00:00 EDT	2020-07-08	17:00:00	-0400	242772524	repfranklucas	Frank Lucas		Earlier this week, the @federalreserve announced that the Main Street Lending Program is fully operational.   Keeping our Main Street businesses solvent will help ensure a strong economic recovery as our communities work to reopen. READ MORE ↓	en	[{'screen_name': 'federalreserve', 'name': 'federal reserve', 'id': '26538229'}]	[]	[]	0	3	4	[]	[]	https://twitter.com/RepFrankLucas/status/1280969911641100289	False		0								[]				
1280917768536195073	1280917768536195073	2020-07-08 13:32:48 EDT	2020-07-08	13:32:48	-0400	242772524	repfranklucas	Frank Lucas		The Paycheck Protection Program has supported over 620,000+ Oklahoma jobs- including more than 127,000+ jobs right here in Oklahoma's Third District!  The Paycheck Protection Program is a crucial lifeline for America's small businesses. APPLY HERE ↓  https://t.co/0IhPKOT7Py	en	[]	['https://www.sba.gov/funding-programs/loans/coronavirus-relief-options/paycheck-protection-program']	[]	1	2	2	[]	[]	https://twitter.com/RepFrankLucas/status/1280917768536195073	False		0								[]				
1280235464373481472	1280235464373481472	2020-07-06 16:21:34 EDT	2020-07-06	16:21:34	-0400	242772524	repfranklucas	Frank Lucas		The coronavirus caused unprecedented market and operational disruptions to Oklahoma's livestock producers.  The RAMP-UP Act helps address America's food supply chain issues while helping our state's processing facilities receive federal inspection status.  https://t.co/myKcoQ4zD9	en	[]	['https://www.farmprogress.com/farm-policy/ramp-act-will-help-meat-processors-meet-demand']	[]	0	4	6	[]	[]	https://twitter.com/RepFrankLucas/status/1280235464373481472	False		0								[]				
1279414663214661632	1279414663214661632	2020-07-04 10:00:00 EDT	2020-07-04	10:00:00	-0400	242772524	repfranklucas	Frank Lucas		Happy Independence Day! 🇺🇸   244 years ago, America’s Founding Fathers gathered at Independence Hall to found a great Nation- one that endowed unalienable rights- Life, Liberty, and the pursuit of Happiness.  To this day, that freedom continues to ring! Happy #4thofJuly! 🇺🇸  https://t.co/hsbCadPfua	en	[]	[]	['https://pbs.twimg.com/media/EcA35KcXsAEVU01.jpg']	3	2	13	['4thofjuly']	[]	https://twitter.com/RepFrankLucas/status/1279414663214661632	False		1	https://pbs.twimg.com/media/EcA35KcXsAEVU01.jpg							[]				
1278819469301895175	1278819468383322113	2020-07-02 18:34:55 EDT	2020-07-02	18:34:55	-0400	242772524	repfranklucas	Frank Lucas		Right now, states need more tools to help them and their meat processing facilities meet the demands of consumers. The RAMP-UP Act helps smaller facilities upgrade their plants and ship product across state lines, widening their consumer base.  READ MORE↓  https://t.co/6V1ISixiNK	en	[]	['https://lucas.house.gov/news/press-releases/lucas-peterson-introduce-ramp-act-helping-meat-poultry-processors-access']	[]	1	1	2	[]	[]	https://twitter.com/RepFrankLucas/status/1278819469301895175	False		0								[]				
1278819468383322113	1278819468383322113	2020-07-02 18:34:55 EDT	2020-07-02	18:34:55	-0400	242772524	repfranklucas	Frank Lucas		Today, I joined @HouseAgDems Chairman Collin Peterson in introducing the RAMP-UP Act.   During the COVID-19 pandemic, our meat processing industry has faced unprecedented challenges, impacting livestock, pork, and other producers across the U.S.  https://t.co/6V1ISixiNK	en	[{'screen_name': 'houseagdems', 'name': 'house agriculture committee', 'id': '989317210463186946'}]	['https://lucas.house.gov/news/press-releases/lucas-peterson-introduce-ramp-act-helping-meat-poultry-processors-access']	[]	1	4	5	[]	[]	https://twitter.com/RepFrankLucas/status/1278819468383322113	False		0								[]				
1278723676410728448	1278723676410728448	2020-07-02 12:14:16 EDT	2020-07-02	12:14:16	-0400	242772524	repfranklucas	Frank Lucas		On July 2, 1862, President Lincoln signed the #MorrillAct, charting the path for institutions of higher education like @okstate.   Fast forward 158 years later and @okstate, and other land-grant institutions, are continuing to lead through instruction, research, &amp; extension.	en	[{'screen_name': 'okstate', 'name': 'oklahoma state univ.', 'id': '16011832'}, {'screen_name': 'okstate', 'name': 'oklahoma state univ.', 'id': '16011832'}]	[]	[]	1	3	4	['morrillact']	[]	https://twitter.com/RepFrankLucas/status/1278723676410728448	False	https://twitter.com/APLU_News/status/1278682245641969664	0								[]				
1278688958692634624	1278688958692634624	2020-07-02 09:56:19 EDT	2020-07-02	09:56:19	-0400	242772524	repfranklucas	Frank Lucas		🚨JOBS JOBS JOBS🚨   The June #JobsReport has smashed expectations and is encouraging news as we chart the path for a great American comeback! 🇺🇸  📈 4.8 MILLION jobs added 📉 Unemployment fell to 11.1% ✅ LARGEST monthly gain on record  https://t.co/MuAL5S3r2c	en	[]	['https://www.cnbc.com/2020/07/02/jobs-report-june-2020.html']	[]	2	3	6	['jobsreport']	[]	https://twitter.com/RepFrankLucas/status/1278688958692634624	False		0								[]				
1278463394132066304	1278463394132066304	2020-07-01 19:00:00 EDT	2020-07-01	19:00:00	-0400	242772524	repfranklucas	Frank Lucas		The House has agreed to extend the Paycheck Protection Program through August 8th.   With roughly $134 billion remaining in available funds, this extension will allow businesses to get the help they need.	en	[]	[]	[]	1	2	6	[]	[]	https://twitter.com/RepFrankLucas/status/1278463394132066304	False	https://twitter.com/HSBCgop/status/1278444142918610944	0								[]				
1278445288659791879	1278445288659791879	2020-07-01 17:48:03 EDT	2020-07-01	17:48:03	-0400	242772524	repfranklucas	Frank Lucas		I just voted NO on Speaker Pelosi's partisan infrastructure bill.   America needs an infrastructure system that it can rely on, one that provides stability for American producers and businesses across our interstates and rural roads and waterways.  READ MY FULL STATEMENT ↓  https://t.co/2LSGuCtXsq	en	[]	[]	['https://pbs.twimg.com/media/Eb3wXHDXQA8OlLC.jpg']	4	4	10	[]	[]	https://twitter.com/RepFrankLucas/status/1278445288659791879	False		1	https://pbs.twimg.com/media/Eb3wXHDXQA8OlLC.jpg							[]				
1278327624989921281	1278327624989921281	2020-07-01 10:00:30 EDT	2020-07-01	10:00:30	-0400	242772524	repfranklucas	Frank Lucas		🚨  BIG DAY FOR AMERICA🚨  Today marks the new beginning of North American trade. Today, @POTUS' modernized, America-First #USMCA trade deal officially goes into effect. Increasing market access for farmers &amp; expanding opportunities for manufacturers, #USMCA is a WIN for America!  https://t.co/WoiJraD9M3	en	[{'screen_name': 'potus', 'name': 'president biden', 'id': '1349149096909668363'}]	[]	['https://pbs.twimg.com/media/Eb2EkWUWsAEUigN.jpg']	6	6	8	['usmca', 'usmca']	[]	https://twitter.com/RepFrankLucas/status/1278327624989921281	False		1	https://pbs.twimg.com/media/Eb2EkWUWsAEUigN.jpg							[]				
1277986215954984967	1277986215954984967	2020-06-30 11:23:52 EDT	2020-06-30	11:23:52	-0400	242772524	repfranklucas	Frank Lucas		Historically, SST has jurisdiction over the R&amp;D title of Congress' infrastructure bill.   Unlike T&amp;I, the Science Committee produced a bipartisan title for this bill. We worked together. We compromised. Sadly, none of SST's work is included in this bill.   We must do better!	en	[]	[]	[]	1	3	7	[]	[]	https://twitter.com/RepFrankLucas/status/1277986215954984967	False	https://twitter.com/TransportGOP/status/1277972416816230401	0								[]				
1277704457174867971	1277704457174867971	2020-06-29 16:44:15 EDT	2020-06-29	16:44:15	-0400	242772524	repfranklucas	Frank Lucas		China holds an overwhelming advantage in access to critical minerals and the COVID-19 pandemic has made it dangerously clear that we can’t take our supply for granted.   The U.S. must better develop our resources and manage our access to critical minerals.  https://t.co/BcJUhcDIGM	en	[]	['https://www.wsj.com/articles/u-s-is-vulnerable-to-chinas-dominance-in-rare-earths-report-finds-11593423003']	[]	3	1	2	[]	[]	https://twitter.com/RepFrankLucas/status/1277704457174867971	False		0								[]				
1277621435192745985	1277621435192745985	2020-06-29 11:14:21 EDT	2020-06-29	11:14:21	-0400	242772524	repfranklucas	Frank Lucas		TOMORROW is the application deadline for @SBAgov's Paycheck Protection Program.  The #PaycheckProtectionProgram has provided more than $5.4 BILLION to more than 63,000 Oklahoma small businesses- helping keep their doors open and employees on the payroll.   APPLY TODAY ↓	en	[{'screen_name': 'sbagov', 'name': 'sba', 'id': '153149305'}]	[]	[]	0	4	1	['paycheckprotectionprogram']	[]	https://twitter.com/RepFrankLucas/status/1277621435192745985	False		0								[]				
1276560863579664384	1276560863579664384	2020-06-26 13:00:01 EDT	2020-06-26	13:00:01	-0400	242772524	repfranklucas	Frank Lucas		We cannot allow American leadership in #STEM to be compromised in the wake of #COVID19.   I'm proud to have introduced the #RISEAct with my friends @RepDianaDeGette, @RepEBJ, @RepFredUpton, @RepAnnaEshoo, &amp; @RepAGonzalez to ensure our research enterprise is wholly supported.	en	[{'screen_name': 'repdianadegette', 'name': 'rep. diana degette', 'id': '28599820'}, {'screen_name': 'repebj', 'name': 'rep. eddie bernice johnson', 'id': '168502762'}, {'screen_name': 'repfredupton', 'name': 'fred upton #getvaccinated', 'id': '124224165'}, {'screen_name': 'repannaeshoo', 'name': 'rep. anna g. eshoo', 'id': '249348006'}, {'screen_name': 'repagonzalez', 'name': 'rep. anthony gonzalez', 'id': '1054381765224210432'}]	[]	[]	2	7	13	['stem', 'covid19', 'riseact']	[]	https://twitter.com/RepFrankLucas/status/1276560863579664384	False	https://twitter.com/housesciencegop/status/1275861198492360714	0								[]				
1276318621845856257	1276318621845856257	2020-06-25 20:57:26 EDT	2020-06-25	20:57:26	-0400	242772524	repfranklucas	Frank Lucas		Tonight I voted NO on the Democrats' partisan police reform bill.   House Democrats rejected every Republican opportunity to enact meaningful, bipartisan reform. Americans deserve better. Congress must work in a bipartisan manner and rise to meet this moment.  FULL STATEMENT ↓  https://t.co/k6w4tqfJgB	en	[]	[]	['https://pbs.twimg.com/media/EbZjokwXQAI7Ds-.jpg']	2	2	9	[]	[]	https://twitter.com/RepFrankLucas/status/1276318621845856257	False		1	https://pbs.twimg.com/media/EbZjokwXQAI7Ds-.jpg							[]				
1276306369868705792	1276306369868705792	2020-06-25 20:08:45 EDT	2020-06-25	20:08:45	-0400	242772524	repfranklucas	Frank Lucas		House Democrats just voted against the #JUSTICEAct.   Yesterday → Senate Democrats blocked the #JUSTICEAct because of politics.   Today → House Democrats refused to include bipartisan amendments to their legislation.   Americans deserve bipartisan reform, not partisan politics.	en	[]	[]	[]	3	1	4	['justiceact', 'justiceact']	[]	https://twitter.com/RepFrankLucas/status/1276306369868705792	False		0								[]				
1276241308722610176	1276241307678183431	2020-06-25 15:50:14 EDT	2020-06-25	15:50:14	-0400	242772524	repfranklucas	Frank Lucas		Yet sadly, today House Democrats are rejecting bipartisan solutions to address police misconduct. Congress can't pass meaningful reform if Republicans are shut out of the process.   The American people deserve bipartisan police reform, not a purely-partisan approach.	en	[]	[]	[]	1	3	4	[]	[]	https://twitter.com/RepFrankLucas/status/1276241308722610176	False		0								[]				
1276241307678183431	1276241307678183431	2020-06-25 15:50:13 EDT	2020-06-25	15:50:13	-0400	242772524	repfranklucas	Frank Lucas		The Nation and our communities are calling for police reform and the #JUSTICEAct provides just that!  The #JUSTICEAct offers real solutions to increase transparency, provide accountability, and strengthen training for our law enforcement officers.  https://t.co/WbXLofKEIL	en	[]	[]	['https://pbs.twimg.com/media/EbYZLPeWoAMrDLn.jpg']	14	21	33	['justiceact', 'justiceact']	[]	https://twitter.com/RepFrankLucas/status/1276241307678183431	False		1	https://pbs.twimg.com/media/EbYZLPeWoAMrDLn.jpg							[]				
1276204611020435457	1276204611020435457	2020-06-25 13:24:24 EDT	2020-06-25	13:24:24	-0400	242772524	repfranklucas	Frank Lucas		A fitting tribute to a generational trailblazer, @NASA HQ will now bear the name Mary W. Jackson. I'm honored to have worked with @HouseScience Chairwoman @RepEBJ to honor the women of Hidden Figures and look forward to witnessing history be made out of Mary W. Jackson @NASA HQ.	en	[{'screen_name': 'nasa', 'name': 'nasa', 'id': '11348282'}, {'screen_name': 'housescience', 'name': 'science committee', 'id': '22053641'}, {'screen_name': 'repebj', 'name': 'rep. eddie bernice johnson', 'id': '168502762'}, {'screen_name': 'nasa', 'name': 'nasa', 'id': '11348282'}]	[]	[]	0	4	3	[]	[]	https://twitter.com/RepFrankLucas/status/1276204611020435457	False	https://twitter.com/JimBridenstine/status/1275844780103262213	0								[]				
1275471782317883392	1275471782317883392	2020-06-23 12:52:24 EDT	2020-06-23	12:52:24	-0400	242772524	repfranklucas	Frank Lucas		With @OklahomaAg &amp; @okcareertech's collaboration, our state will now be able to train &amp; certify individuals to help close the workforce shortage gap in Oklahoma's meat processing industry. Thanks @OklahomaAg &amp; @okcareertech for expanding our ag workforce!  https://t.co/dspLr8itEZ	en	[{'screen_name': 'oklahomaag', 'name': 'ok dept of ag', 'id': '83840182'}, {'screen_name': 'okcareertech', 'name': 'oklahoma careertech', 'id': '16781544'}, {'screen_name': 'oklahomaag', 'name': 'ok dept of ag', 'id': '83840182'}, {'screen_name': 'okcareertech', 'name': 'oklahoma careertech', 'id': '16781544'}]	['https://www.okcareertech.org/educators/resource-center/meat-processing-workforce-education/meat-processing-workforce-education']	[]	2	3	11	[]	[]	https://twitter.com/RepFrankLucas/status/1275471782317883392	False		0								[]				
1274773322912456706	1274773322912456706	2020-06-21 14:36:58 EDT	2020-06-21	14:36:58	-0400	242772524	repfranklucas	Frank Lucas		Happy #FathersDay to all the Dads in Oklahoma’s Third District.   So thankful for my wife, Lynda, and our kids for making me a father and grandfather. From my father, Ike, to all the amazing Dads in Oklahoma- Happy #FathersDay	en	[]	[]	[]	1	3	3	['fathersday', 'fathersday']	[]	https://twitter.com/RepFrankLucas/status/1274773322912456706	False		0								[]				
1274079662398996480	1274079662398996480	2020-06-19 16:40:37 EDT	2020-06-19	16:40:37	-0400	242772524	repfranklucas	Frank Lucas		DYK: @okstate is home to 2 supercomputers- Cowboy and Pistol Pete.   Funded by @NSF these supercomputers help meet the emerging demands of a diverse community of researchers in Oklahoma.  https://t.co/9yXKEIct7P	en	[{'screen_name': 'okstate', 'name': 'oklahoma state univ.', 'id': '16011832'}, {'screen_name': 'nsf', 'name': 'national science foundation', 'id': '16245822'}]	[]	['https://pbs.twimg.com/media/Ea5wsiuWsAIQu4x.jpg']	0	2	5	[]	[]	https://twitter.com/RepFrankLucas/status/1274079662398996480	False	https://twitter.com/housesciencegop/status/1274054096492920846	1	https://pbs.twimg.com/media/Ea5wsiuWsAIQu4x.jpg							[]				
1273706378172018689	1273706378172018689	2020-06-18 15:57:19 EDT	2020-06-18	15:57:19	-0400	242772524	repfranklucas	Frank Lucas		Proud to join @RepPeteStauber, @SenatorTimScott, &amp; @SenatorLankford in introducing the JUSTICE Act. The #JUSTICEAct offers real solutions to increase transparency, accountability &amp; performance so our nation’s law enforcement officers can better protect the communities they serve.	en	[{'screen_name': 'reppetestauber', 'name': 'pete stauber', 'id': '1075830599007510535'}, {'screen_name': 'senatortimscott', 'name': 'tim scott', 'id': '217543151'}, {'screen_name': 'senatorlankford', 'name': 'sen. james lankford', 'id': '225921757'}]	[]	[]	24	18	45	['justiceact']	[]	https://twitter.com/RepFrankLucas/status/1273706378172018689	False		0								[]				
1273332954551418880	1273332954551418880	2020-06-17 15:13:28 EDT	2020-06-17	15:13:28	-0400	242772524	repfranklucas	Frank Lucas		#COVID19 has impacted rural &amp; urban communities alike. During this unprecedented time, it's critical the @federalreserve continue its actions supporting our rural economies, households, &amp; businesses.   Today, I discussed how important the Fed's actions are with Chairman Powell ↓  https://t.co/vZgfpD9Upd	en	[{'screen_name': 'federalreserve', 'name': 'federal reserve', 'id': '26538229'}]	[]	[]	0	3	1	['covid19']	[]	https://twitter.com/RepFrankLucas/status/1273332954551418880	False		1	https://pbs.twimg.com/ext_tw_video_thumb/1273330734783176704/pu/img/fQ0OYIzJjMmJfs_6.jpg							[]				
1273285542390771712	1273285542390771712	2020-06-17 12:05:04 EDT	2020-06-17	12:05:04	-0400	242772524	repfranklucas	Frank Lucas		NEW THIS MORNING: @SBAgov and @USTreasury have released simplified Paycheck Protection Program forgiveness applications.   The EZ application requires fewer calculations and less documentation for eligible borrowers.  MORE FROM @SBAgov ↓	en	[{'screen_name': 'sbagov', 'name': 'sba', 'id': '153149305'}, {'screen_name': 'ustreasury', 'name': 'treasury department', 'id': '120176950'}, {'screen_name': 'sbagov', 'name': 'sba', 'id': '153149305'}]	[]	[]	1	2	6	[]	[]	https://twitter.com/RepFrankLucas/status/1273285542390771712	False		0								[]				
