id	conversation_id	created_at	date	time	timezone	user_id	username	name	place	tweet	language	mentions	urls	photos	replies_count	retweets_count	likes_count	hashtags	cashtags	link	retweet	quote_url	video	thumbnail	near	geo	source	user_rt_id	user_rt	retweet_id	reply_to	retweet_date	translate	trans_src	trans_dest
819950114018127875	819950114018127875	2017-01-13 11:51:55 EST	2017-01-13	11:51:55	-0400	242772524	repfranklucas	Frank Lucas		VIDEO: An update on my work in Washington &amp; the year ahead. Link:  https://t.co/n9zlLAm6f6  https://t.co/EeqBnZ1m28	en	[]	['https://www.facebook.com/RepFrankLucas/videos/10153959060907396/']	['https://pbs.twimg.com/media/C2EL2DgWgAIQ_0B.jpg']	1	1	2	[]	[]	https://twitter.com/RepFrankLucas/status/819950114018127875	False		1	https://pbs.twimg.com/media/C2EL2DgWgAIQ_0B.jpg							[]				
818594590190145536	818594590190145536	2017-01-09 18:05:33 EST	2017-01-09	18:05:33	-0400	242772524	repfranklucas	Frank Lucas		Every extra minute in the lead up to a major storm or tornado could be the difference between life and death or thousands of $'s in damages.  https://t.co/5Xxuuh3LtN	en	[]	[]	[]	0	2	12	[]	[]	https://twitter.com/RepFrankLucas/status/818594590190145536	False		1	https://pbs.twimg.com/ext_tw_video_thumb/818594364503060480/pu/img/0gfnLtohZIMgs85D.jpg							[]				
818592516756807680	818592516756807680	2017-01-09 17:57:19 EST	2017-01-09	17:57:19	-0400	242772524	repfranklucas	Frank Lucas		The House passed the Weather Research &amp; Forecasting Innovation Act, a bill I intro'd to improve lead times for storm &amp; tornado predictions  https://t.co/XLC5sk2oYT	en	[]	[]	['https://pbs.twimg.com/media/C1w5eEAWIAAWmje.jpg']	0	4	9	[]	[]	https://twitter.com/RepFrankLucas/status/818592516756807680	False		1	https://pbs.twimg.com/media/C1w5eEAWIAAWmje.jpg							[]				
818580937902432257	818580937902432257	2017-01-09 17:11:18 EST	2017-01-09	17:11:18	-0400	242772524	repfranklucas	Frank Lucas		Speaking on the House floor now in support of the Weather Research and Forecasting Innovation Act – tune in here:  https://t.co/8U9z9gHEag	en	[]	['http://houselive.gov/']	[]	0	0	0	[]	[]	https://twitter.com/RepFrankLucas/status/818580937902432257	False		0								[]				
818537396967002112	818537396967002112	2017-01-09 14:18:17 EST	2017-01-09	14:18:17	-0400	242772524	repfranklucas	Frank Lucas		Please join me in recognizing the brave men &amp; women who put their safety on the line in order to protect ours #LawEnforcementAppreciationDay  https://t.co/sazQaXB8yw	en	[]	[]	['https://pbs.twimg.com/media/C1wHYeJWIAAvi3i.jpg']	0	0	5	['lawenforcementappreciationday']	[]	https://twitter.com/RepFrankLucas/status/818537396967002112	False		1	https://pbs.twimg.com/media/C1wHYeJWIAAvi3i.jpg							[]				
817406019865341954	817406019865341954	2017-01-06 11:22:36 EST	2017-01-06	11:22:36	-0400	242772524	repfranklucas	Frank Lucas		Thank you for the birthday wishes, @rfbo! I'm very proud of the amazing work you all are doing for our state!  https://t.co/np6KfAlyFM	en	[{'screen_name': 'rfbo', 'name': 'regional food bank of oklahoma', 'id': '18453284'}]	['https://twitter.com/rfbo/status/817400406787686400']	[]	0	0	3	[]	[]	https://twitter.com/RepFrankLucas/status/817406019865341954	False	https://twitter.com/rfbo/status/817400406787686400	0								[]				
817186393231388672	817186393231388672	2017-01-05 20:49:53 EST	2017-01-05	20:49:53	-0400	242772524	repfranklucas	Frank Lucas		The #REINSAct will help curb costly government overregulation so that we can get back to growing our economy &amp; creating new opportunities!  https://t.co/PVLCokyI5G	en	[]	[]	['https://pbs.twimg.com/media/C1c6Lr_XgAAhWOW.jpg']	0	1	2	['reinsact']	[]	https://twitter.com/RepFrankLucas/status/817186393231388672	False		1	https://pbs.twimg.com/media/C1c6Lr_XgAAhWOW.jpg							[]				
816417707004493825	816417707004493825	2017-01-03 17:55:24 EST	2017-01-03	17:55:24	-0400	242772524	repfranklucas	Frank Lucas		Looking forward to the 115th Congress! It’s a great privilege and honor to serve Oklahoma’s 3rd district.  https://t.co/fUAlMB4Sma	en	[]	[]	['https://pbs.twimg.com/media/C1R_bFeXAAEkM55.jpg']	2	5	23	[]	[]	https://twitter.com/RepFrankLucas/status/816417707004493825	False		1	https://pbs.twimg.com/media/C1R_bFeXAAEkM55.jpg							[]				
813136751841734657	813136751841734657	2016-12-25 16:38:03 EST	2016-12-25	16:38:03	-0400	242772524	repfranklucas	Frank Lucas		Wishing everyone a very Merry Christmas and happy holidays! 🎄  https://t.co/s01WcAwsMI	en	[]	[]	['https://pbs.twimg.com/media/C0jXjf3WgAAdWIZ.jpg']	0	2	7	[]	[]	https://twitter.com/RepFrankLucas/status/813136751841734657	False		1	https://pbs.twimg.com/media/C0jXjf3WgAAdWIZ.jpg							[]				
804401334271299584	804401334271299584	2016-12-01 14:06:37 EST	2016-12-01	14:06:37	-0400	242772524	repfranklucas	Frank Lucas		Sign up here to receive news and updates about my work in Washington —  https://t.co/Ry7RId5ds7  https://t.co/lgwwcME02O	en	[]	['http://bit.ly/2fQ40Px']	['https://pbs.twimg.com/media/CynOkQLXgAAlCpa.png']	0	0	1	[]	[]	https://twitter.com/RepFrankLucas/status/804401334271299584	False		1	https://pbs.twimg.com/media/CynOkQLXgAAlCpa.png							[]				
798943028744507392	798943028744507392	2016-11-16 12:37:16 EST	2016-11-16	12:37:16	-0400	242772524	repfranklucas	Frank Lucas		On this day 109 years ago, Oklahoma became the 46th state in the Union. Happy Statehood Day!  https://t.co/o7qIHx4Xll	en	[]	[]	['https://pbs.twimg.com/media/CxZqQNhXEAQViSl.jpg']	1	31	48	[]	[]	https://twitter.com/RepFrankLucas/status/798943028744507392	False		1	https://pbs.twimg.com/media/CxZqQNhXEAQViSl.jpg							[]				
797113339927265280	797113339927265280	2016-11-11 11:26:44 EST	2016-11-11	11:26:44	-0400	242772524	repfranklucas	Frank Lucas		Oklahoma is proud to have vets like Maj Gen Tinker as part of our state history. Thank you to those who have served!  https://t.co/IFBOCxZ7vu  https://t.co/XFU0UFfp3q	en	[]	['http://lucas.house.gov/frankly-speaking/tinker-and-oklahoma%E2%80%99s-legacy-service']	['https://pbs.twimg.com/media/Cw_qCP1XgAAFy10.jpg']	0	3	13	[]	[]	https://twitter.com/RepFrankLucas/status/797113339927265280	False		1	https://pbs.twimg.com/media/Cw_qCP1XgAAFy10.jpg							[]				
788119214292889600	788119214292889600	2016-10-17 16:47:17 EDT	2016-10-17	16:47:17	-0400	242772524	repfranklucas	Frank Lucas		I wrote in @TheOklahoman about the stakes of this election – the Supreme Court &amp; roughly 4,000 political appointees  https://t.co/ozXFX7DeOp  https://t.co/sYBUzsGaOp	en	[{'screen_name': 'theoklahoman', 'name': 'portland (individual account)', 'id': '1187743875445788673'}]	['http://newsok.com/article/5522584']	['https://pbs.twimg.com/media/Cu_2J4-WIAI5e4c.jpg']	0	2	1	[]	[]	https://twitter.com/RepFrankLucas/status/788119214292889600	False		1	https://pbs.twimg.com/media/Cu_2J4-WIAI5e4c.jpg							[]				
784113956256358401	784113956256358401	2016-10-06 15:31:49 EDT	2016-10-06	15:31:49	-0400	242772524	repfranklucas	Frank Lucas		Honored to receive the Defender of Housing Award from @OkStateHBA! Proud of their work to continue to provide quality housing for our state.  https://t.co/8PjfFD7YsN	en	[]	[]	['https://pbs.twimg.com/media/CuG7TldWAAAYdHk.jpg']	0	2	5	[]	[]	https://twitter.com/RepFrankLucas/status/784113956256358401	False		1	https://pbs.twimg.com/media/CuG7TldWAAAYdHk.jpg							[]				
783137421357703168	783137421357703168	2016-10-03 22:51:25 EDT	2016-10-03	22:51:25	-0400	242772524	repfranklucas	Frank Lucas		Visited w/ @MyCentralCOOP CEO David Swank who gave me a tour of their new HQ and some of the tech they're using to update the grid system!  https://t.co/MQN95f8oMF	en	[{'screen_name': 'mycentralcoop', 'name': 'central rural electric cooperative', 'id': '45861086'}]	[]	['https://pbs.twimg.com/media/Ct5C-pfXgAAdN9y.jpg', 'https://pbs.twimg.com/media/Ct5C-pgW8AAQrIG.jpg', 'https://pbs.twimg.com/media/Ct5C-phWIAAOt7s.jpg']	0	0	1	[]	[]	https://twitter.com/RepFrankLucas/status/783137421357703168	False		1	https://pbs.twimg.com/media/Ct5C-pfXgAAdN9y.jpg							[]				
781603706320093184	781603706320093184	2016-09-29 17:16:59 EDT	2016-09-29	17:16:59	-0400	242772524	repfranklucas	Frank Lucas		VIDEO from today's @FinancialCmte hearing with Wells Fargo CEO John Stumpf regarding the bank's fraudulent practices  https://t.co/09UWKqs08i  https://t.co/USpw6EQUsn	en	[{'screen_name': 'financialcmte', 'name': 'financial services gop', 'id': '42924141'}]	['https://www.facebook.com/RepFrankLucas/videos/10153674087062396/?permPage=1']	['https://pbs.twimg.com/media/CtjQWzmXYAQHxC8.jpg']	1	0	1	[]	[]	https://twitter.com/RepFrankLucas/status/781603706320093184	False		1	https://pbs.twimg.com/media/CtjQWzmXYAQHxC8.jpg							[]				
781217150757396480	781217150757396480	2016-09-28 15:40:57 EDT	2016-09-28	15:40:57	-0400	242772524	repfranklucas	Frank Lucas		Don’t forget – applications for military service academy nominations are due by Friday, October 14.  https://t.co/R5x6Cxy2xf  https://t.co/OLTLZBCaKe	en	[]	['https://lucas.house.gov/serving-you/military-academy-nominations']	['https://pbs.twimg.com/media/CtdwsUAWgAEi3B2.jpg']	1	0	0	[]	[]	https://twitter.com/RepFrankLucas/status/781217150757396480	False		1	https://pbs.twimg.com/media/CtdwsUAWgAEi3B2.jpg							[]				
772099796333133824	772099796333133824	2016-09-03 11:51:51 EDT	2016-09-03	11:51:51	-0400	242772524	repfranklucas	Frank Lucas		Glad to hear reports that no damage was found at @okstate stadium after inspection. Hope to see everyone at today's game #GoPokes	en	[{'screen_name': 'okstate', 'name': 'oklahoma state univ.', 'id': '16011832'}]	[]	[]	1	1	6	['gopokes']	[]	https://twitter.com/RepFrankLucas/status/772099796333133824	False		0								[]				
772099276994441217	772099276994441217	2016-09-03 11:49:47 EDT	2016-09-03	11:49:47	-0400	242772524	repfranklucas	Frank Lucas		Felt this morning's earthquake all the way in Roger Mills county. Currently monitoring any reports of damages throughout the 3rd district.	en	[]	[]	[]	1	1	3	[]	[]	https://twitter.com/RepFrankLucas/status/772099276994441217	False		0								[]				
768101889682575360	768101889682575360	2016-08-23 11:05:35 EDT	2016-08-23	11:05:35	-0400	242772524	repfranklucas	Frank Lucas		Great town hall meeting this morning in Guymon! Discussed science behind GMO labeling, EPA WOTUS rule and Dodd-Frank  https://t.co/rLO44DI0yL	en	[]	[]	['https://pbs.twimg.com/media/CqjYk6eWgAA_GsJ.jpg']	1	0	5	[]	[]	https://twitter.com/RepFrankLucas/status/768101889682575360	False		1	https://pbs.twimg.com/media/CqjYk6eWgAA_GsJ.jpg							[]				
766280494585610240	766280494585610240	2016-08-18 10:28:01 EDT	2016-08-18	10:28:01	-0400	242772524	repfranklucas	Frank Lucas		Look forward to hosting a town hall here in Yukon later this afternoon! We'll be at 10 West Main Street from 5-6 pm.  https://t.co/dp7Tzdu2YD	en	[]	['http://lucas.house.gov/press-release/lucas-hold-town-hall-meeting-yukon']	[]	0	1	1	[]	[]	https://twitter.com/RepFrankLucas/status/766280494585610240	False		0								[]				
751453181993943040	751453181993943040	2016-07-08 12:29:34 EDT	2016-07-08	12:29:34	-0400	242772524	repfranklucas	Frank Lucas		As we mourn this senseless tragedy, I stand with our law enforcement officers &amp; their families #DallasPoliceShooting  https://t.co/UdQCHaIQdK	en	[]	['https://www.facebook.com/RepFrankLucas/posts/10153481214502396']	[]	0	0	7	['dallaspoliceshooting']	[]	https://twitter.com/RepFrankLucas/status/751453181993943040	False		0								[]				
750782120012967936	750782120012967936	2016-07-06 16:03:00 EDT	2016-07-06	16:03:00	-0400	242772524	repfranklucas	Frank Lucas		"It's alarming the FBI found Clinton was ""extremely careless"" in handling classified info but recommended no charges  https://t.co/fqEu5C7GUF"	en	[]	[]	['https://pbs.twimg.com/media/CmtLas7XEAEvSnB.jpg']	3	7	9	[]	[]	https://twitter.com/RepFrankLucas/status/750782120012967936	False		1	https://pbs.twimg.com/media/CmtLas7XEAEvSnB.jpg							[]				
745307095843676160	745307095843676160	2016-06-21 13:27:13 EDT	2016-06-21	13:27:13	-0400	242772524	repfranklucas	Frank Lucas		Appreciated the opportunity to meet with @97AMW Commander, Col. Todd Hohn, to discuss the latest at Altus AFB  https://t.co/zm2MapIbiU	en	[{'screen_name': '97amw', 'name': 'altus air force base', 'id': '50664456'}]	[]	['https://pbs.twimg.com/media/ClfcQnyWMAEMrwx.jpg']	3	4	7	[]	[]	https://twitter.com/RepFrankLucas/status/745307095843676160	False		1	https://pbs.twimg.com/media/ClfcQnyWMAEMrwx.jpg							[]				
743465931062509568	743465931062509568	2016-06-16 11:31:05 EDT	2016-06-16	11:31:05	-0400	242772524	repfranklucas	Frank Lucas		Proud of @okstate's impressive record of generating military leaders through their ROTC program  https://t.co/ykEl8vgNqZ	en	[{'screen_name': 'okstate', 'name': 'oklahoma state univ.', 'id': '16011832'}]	['http://newsok.com/osu-boasts-rich-heritage-in-rotc-creating-officers/article/5503605']	[]	0	2	2	[]	[]	https://twitter.com/RepFrankLucas/status/743465931062509568	False		0								[]				
742822268800225280	742822268800225280	2016-06-14 16:53:24 EDT	2016-06-14	16:53:24	-0400	242772524	repfranklucas	Frank Lucas		Happy 241st Birthday to the @USArmy! Thank you to those who serve and have served our country. #ArmyStrong  https://t.co/ashxRpMlgT	en	[{'screen_name': 'usarmy', 'name': 'u.s. army', 'id': '8775672'}]	[]	['https://pbs.twimg.com/media/Ck8I6o8UoAAViJz.jpg']	1	2	2	['armystrong']	[]	https://twitter.com/RepFrankLucas/status/742822268800225280	False		1	https://pbs.twimg.com/media/Ck8I6o8UoAAViJz.jpg							[]				
740994221172260864	740994221172260864	2016-06-09 15:49:23 EDT	2016-06-09	15:49:23	-0400	242772524	repfranklucas	Frank Lucas		Had a great time today visiting with @FFAOK students on the steps of the Capitol!  https://t.co/poEHSbGM02	en	[{'screen_name': 'ffaok', 'name': 'fuak faok', 'id': '1269957437588566017'}]	[]	['https://pbs.twimg.com/media/CkiKUPSWEAAg9YJ.jpg']	2	15	31	[]	[]	https://twitter.com/RepFrankLucas/status/740994221172260864	False		1	https://pbs.twimg.com/media/CkiKUPSWEAAg9YJ.jpg							[]				
739850011375218688	739850011375218688	2016-06-06 12:02:43 EDT	2016-06-06	12:02:43	-0400	242772524	repfranklucas	Frank Lucas		On this 72nd anniversary of #DDay we continue to honor the courage, sacrifice and service of the Greatest Generation  https://t.co/MtUFTeJ2yW	en	[]	[]	['https://pbs.twimg.com/media/CkR5qZqXIAAtkRj.jpg']	0	2	3	['dday']	[]	https://twitter.com/RepFrankLucas/status/739850011375218688	False		1	https://pbs.twimg.com/media/CkR5qZqXIAAtkRj.jpg							[]				
738107931170902018	738107931170902018	2016-06-01 16:40:18 EDT	2016-06-01	16:40:18	-0400	242772524	repfranklucas	Frank Lucas		Thank you to everyone who came out to participate in our Stillwater and Guthrie town hall meetings today!  https://t.co/GGVPvsCPVr	en	[]	[]	['https://pbs.twimg.com/media/Cj5JQCXXAAEH490.jpg', 'https://pbs.twimg.com/media/Cj5JQDkWYAAcvU2.jpg']	1	0	5	[]	[]	https://twitter.com/RepFrankLucas/status/738107931170902018	False		1	https://pbs.twimg.com/media/Cj5JQCXXAAEH490.jpg							[]				
737348644958048256	737348644958048256	2016-05-30 14:23:10 EDT	2016-05-30	14:23:10	-0400	242772524	repfranklucas	Frank Lucas		Today we reflect on those who made the ultimate sacrifice for our country – never forget our fallen heroes  https://t.co/PD7GmsH6gx	en	[]	[]	['https://pbs.twimg.com/media/CjuWr3nWgAAAeHN.jpg']	0	0	8	[]	[]	https://twitter.com/RepFrankLucas/status/737348644958048256	False		1	https://pbs.twimg.com/media/CjuWr3nWgAAAeHN.jpg							[]				
735553827076739072	735553827076739072	2016-05-25 15:31:12 EDT	2016-05-25	15:31:12	-0400	242772524	repfranklucas	Frank Lucas		At @HouseScience today we discussed ways to prevent spread of Zika virus &amp; steps to address issue in the long term  https://t.co/P2yUFU5e0q	en	[{'screen_name': 'housescience', 'name': 'science committee', 'id': '22053641'}]	['https://www.facebook.com/RepFrankLucas/videos/10153393062077396/']	[]	0	3	1	[]	[]	https://twitter.com/RepFrankLucas/status/735553827076739072	False		0								[]				
734835634989375488	734835634989375488	2016-05-23 15:57:22 EDT	2016-05-23	15:57:22	-0400	242772524	repfranklucas	Frank Lucas		Delivered this year’s graduation address at my high school alma mater in Cheyenne. Congrats to the class of 2016!  https://t.co/kd2BuVNnh8	en	[]	[]	['https://pbs.twimg.com/media/CjKpHZYUkAAgoZI.jpg']	0	3	11	[]	[]	https://twitter.com/RepFrankLucas/status/734835634989375488	False		1	https://pbs.twimg.com/media/CjKpHZYUkAAgoZI.jpg							[]				
734155504520450049	734155504520450049	2016-05-21 18:54:46 EDT	2016-05-21	18:54:46	-0400	242772524	repfranklucas	Frank Lucas		Celebrated #ArmedForcesDay w/ the Piedmont Area Veterans Association – thank you to all those who serve our country!  https://t.co/VtL5vad1Ne	en	[]	[]	['https://pbs.twimg.com/media/CjA-imHWYAAbdTs.jpg']	0	2	6	['armedforcesday']	[]	https://twitter.com/RepFrankLucas/status/734155504520450049	False		1	https://pbs.twimg.com/media/CjA-imHWYAAbdTs.jpg							[]				
732636388752031746	732636388752031746	2016-05-17 14:18:21 EDT	2016-05-17	14:18:21	-0400	242772524	repfranklucas	Frank Lucas		VIDEO: Land conservation is best handled at the local level, not by government bureaucrats thousands of miles away  https://t.co/ADD9CNyyTA	en	[]	['http://bit.ly/1Oy6kFU']	[]	0	0	1	[]	[]	https://twitter.com/RepFrankLucas/status/732636388752031746	False		0								[]				
732619651344175105	732619651344175105	2016-05-17 13:11:50 EDT	2016-05-17	13:11:50	-0400	242772524	repfranklucas	Frank Lucas		Excited to announce this year's winner of the Third District Congressional Art Competition!  https://t.co/dnTBmGjn41  https://t.co/oGPj16uBXm	en	[]	['http://1.usa.gov/1ZYgzcE']	['https://pbs.twimg.com/media/CirJsMvXAAA4vOi.jpg']	1	0	2	[]	[]	https://twitter.com/RepFrankLucas/status/732619651344175105	False		1	https://pbs.twimg.com/media/CirJsMvXAAA4vOi.jpg							[]				
731180973648433152	731180973648433152	2016-05-13 13:55:03 EDT	2016-05-13	13:55:03	-0400	242772524	repfranklucas	Frank Lucas		Column: A recent USDA proposal could threaten rural America’s access to assistance programs  https://t.co/kZJSdS9F5z  https://t.co/7NmXrFsiN5	en	[]	['http://1.usa.gov/1skEKYA']	['https://pbs.twimg.com/media/CiWtOHpU4AEV-zV.jpg']	0	0	1	[]	[]	https://twitter.com/RepFrankLucas/status/731180973648433152	False		1	https://pbs.twimg.com/media/CiWtOHpU4AEV-zV.jpg							[]				
730502943762464768	730502943762464768	2016-05-11 17:00:48 EDT	2016-05-11	17:00:48	-0400	242772524	repfranklucas	Frank Lucas		Excited to welcome Perkins native &amp; @okstate grad, Conner Carroll, to my Washington DC staff  https://t.co/14REksaur5  https://t.co/TZKX6Bf15x	en	[{'screen_name': 'okstate', 'name': 'oklahoma state univ.', 'id': '16011832'}]	['http://lucas.house.gov/press-release/congressman-lucas-welcomes-third-district-resident-conner-carroll-washington-dc-staff']	['https://pbs.twimg.com/media/CiNEjlEWkAI11pF.jpg']	0	3	6	[]	[]	https://twitter.com/RepFrankLucas/status/730502943762464768	False		1	https://pbs.twimg.com/media/CiNEjlEWkAI11pF.jpg							[]				
730034812233383937	730034812233383937	2016-05-10 10:00:37 EDT	2016-05-10	10:00:37	-0400	242772524	repfranklucas	Frank Lucas		Don't forget to vote for your favorite piece in our 2016 Third District Art Competition!  https://t.co/0qg5YlRkC0  https://t.co/XRQaUPf0g4	en	[]	['http://bit.ly/1TPlLh8']	['https://pbs.twimg.com/media/CiGaytYXIAUES1Y.jpg']	0	0	2	[]	[]	https://twitter.com/RepFrankLucas/status/730034812233383937	False		1	https://pbs.twimg.com/media/CiGaytYXIAUES1Y.jpg							[]				
725455177218662401	725455177218662401	2016-04-27 18:42:47 EDT	2016-04-27	18:42:47	-0400	242772524	repfranklucas	Frank Lucas		Pleasure to speak w/ @okcchamber this afternoon. Discussed Farm Bill &amp; issues before the financial services cmte.  https://t.co/d11LLnQzHq	en	[{'screen_name': 'okcchamber', 'name': 'greater okc chamber', 'id': '16583493'}]	[]	['https://pbs.twimg.com/media/ChFVo6PW0AAdJDO.jpg']	1	1	5	[]	[]	https://twitter.com/RepFrankLucas/status/725455177218662401	False		1	https://pbs.twimg.com/media/ChFVo6PW0AAdJDO.jpg							[]				
722895528111910913	722895528111910913	2016-04-20 17:11:39 EDT	2016-04-20	17:11:39	-0400	242772524	repfranklucas	Frank Lucas		Proud to support two bills today aimed at improving accountability and oversight at the IRS  https://t.co/ocSDok55UC  https://t.co/gg5uTienjs	en	[]	['http://1.usa.gov/1TjL2jq']	['https://pbs.twimg.com/media/Cgg9ptYUUAAIm5W.jpg']	1	0	6	[]	[]	https://twitter.com/RepFrankLucas/status/722895528111910913	False		1	https://pbs.twimg.com/media/Cgg9ptYUUAAIm5W.jpg							[]				
722525184620675072	722525184620675072	2016-04-19 16:40:02 EDT	2016-04-19	16:40:02	-0400	242772524	repfranklucas	Frank Lucas		"""Lucas contends the money is in better hands when it is in the people’s hands"" #TaxDay  https://t.co/0SXaSR4Xqq via @McCarvilleRept"	en	[{'screen_name': 'mccarvillerept', 'name': 'mccarville report', 'id': '258859368'}]	['http://mccarvillereport.com/archives/38290']	[]	0	0	1	['taxday']	[]	https://twitter.com/RepFrankLucas/status/722525184620675072	False		0								[]				
722447538998128640	722447538998128640	2016-04-19 11:31:30 EDT	2016-04-19	11:31:30	-0400	242772524	repfranklucas	Frank Lucas		We will never forget the 168 souls taken from us too soon on this day, 21 years ago #OKCbombing #OklahomaStandard  https://t.co/AJm7Zq4Tp4	en	[]	[]	['https://pbs.twimg.com/media/CgamNTtWsAEpyXp.jpg']	0	7	9	['okcbombing', 'oklahomastandard']	[]	https://twitter.com/RepFrankLucas/status/722447538998128640	False		1	https://pbs.twimg.com/media/CgamNTtWsAEpyXp.jpg							[]				
722132212183920640	722132212183920640	2016-04-18 14:38:30 EDT	2016-04-18	14:38:30	-0400	242772524	repfranklucas	Frank Lucas		It’s #TaxDay – our annual reminder that it’s time for a simpler and fairer tax code  https://t.co/9AWrnt61qW  https://t.co/103WT3lzf6	en	[]	['http://1.usa.gov/1SgUwtj']	['https://pbs.twimg.com/tweet_video_thumb/CgWHJhVUEAEsDWN.jpg']	0	1	5	['taxday']	[]	https://twitter.com/RepFrankLucas/status/722132212183920640	False		1	https://pbs.twimg.com/tweet_video_thumb/CgWHJhVUEAEsDWN.jpg							[]				
721045239872516096	721045239872516096	2016-04-15 14:39:16 EDT	2016-04-15	14:39:16	-0400	242772524	repfranklucas	Frank Lucas		This week I questioned IRS officials about their ability to combat fraudulent returns and the identify theft problem  https://t.co/0DXxSjMsV9	en	[]	['https://goo.gl/AFr1AS']	[]	1	1	2	[]	[]	https://twitter.com/RepFrankLucas/status/721045239872516096	False		0								[]				
720621817917009920	720621817917009920	2016-04-14 10:36:44 EDT	2016-04-14	10:36:44	-0400	242772524	repfranklucas	Frank Lucas		Great to hear stories directly from these @Oklahoma4H students who are working hard to improve our communities!  https://t.co/NGLJFeOTmg	en	[{'screen_name': 'oklahoma4h', 'name': 'oklahoma 4-h', 'id': '15615238'}]	[]	['https://pbs.twimg.com/media/CgApuXcW8AId3Wg.jpg']	0	5	14	[]	[]	https://twitter.com/RepFrankLucas/status/720621817917009920	False		1	https://pbs.twimg.com/media/CgApuXcW8AId3Wg.jpg							[]				
720331447928623105	720331447928623105	2016-04-13 15:22:54 EDT	2016-04-13	15:22:54	-0400	242772524	repfranklucas	Frank Lucas		REMINDER: This Friday is the deadline for the Third District Congressional Art Competition!  https://t.co/go9vsNSdjw  https://t.co/GRxvqs5aPm	en	[]	['https://lucas.house.gov/serving-you/art-competition']	['https://pbs.twimg.com/media/Cf8hooEWQAAeQjE.jpg']	1	0	0	[]	[]	https://twitter.com/RepFrankLucas/status/720331447928623105	False		1	https://pbs.twimg.com/media/Cf8hooEWQAAeQjE.jpg							[]				
719963830915358720	719963830915358720	2016-04-12 15:02:08 EDT	2016-04-12	15:02:08	-0400	242772524	repfranklucas	Frank Lucas		Enjoyed visiting with these ag student leaders from @okstate who are visiting Washington with the @OKYouthExpo  https://t.co/tNUlIktFab	en	[{'screen_name': 'okstate', 'name': 'oklahoma state univ.', 'id': '16011832'}, {'screen_name': 'okyouthexpo', 'name': 'oklahoma youth expo', 'id': '122399922'}]	[]	['https://pbs.twimg.com/media/Cf3TScrVAAA2Xil.jpg']	0	5	15	[]	[]	https://twitter.com/RepFrankLucas/status/719963830915358720	False		1	https://pbs.twimg.com/media/Cf3TScrVAAA2Xil.jpg							[]				
717041338642993154	717041338642993154	2016-04-04 13:29:11 EDT	2016-04-04	13:29:11	-0400	242772524	repfranklucas	Frank Lucas		TOMORROW: Town Hall Meetings in Fairview (1pm) and Cherokee (3pm) – details here ➡  https://t.co/qSkU9efGCO  https://t.co/XAeosDwQUb	en	[]	['http://lucas.house.gov/press-release/lucas-hold-town-hall-meetings-fairview-and-cherokee']	['https://pbs.twimg.com/media/CfNxTD6UsAImamZ.jpg']	0	2	0	[]	[]	https://twitter.com/RepFrankLucas/status/717041338642993154	False		1	https://pbs.twimg.com/media/CfNxTD6UsAImamZ.jpg							[]				
715193863233736705	715193863233736705	2016-03-30 11:07:59 EDT	2016-03-30	11:07:59	-0400	242772524	repfranklucas	Frank Lucas		Just wrapped up our town hall in Shattuck! Look forward to hosting three more public meetings today. Schedule here:  https://t.co/lLlI4clPJK	en	[]	['http://lucas.house.gov/press-release/lucas-hold-four-town-hall-meetings-northwest-oklahoma']	[]	0	1	1	[]	[]	https://twitter.com/RepFrankLucas/status/715193863233736705	False		0								[]				
712333600595845122	712333600595845122	2016-03-22 13:42:19 EDT	2016-03-22	13:42:19	-0400	242772524	repfranklucas	Frank Lucas		This Thursday afternoon at 3:00 pm, I'm hosting a town hall meeting in Alva at the NWOSU Student Center Ranger Room  https://t.co/sz3sk4imtP	en	[]	['http://1.usa.gov/1ULeDE1']	[]	1	1	1	[]	[]	https://twitter.com/RepFrankLucas/status/712333600595845122	False		0								[]				
