id	conversation_id	created_at	date	time	timezone	user_id	username	name	place	tweet	language	mentions	urls	photos	replies_count	retweets_count	likes_count	hashtags	cashtags	link	retweet	quote_url	video	thumbnail	near	geo	source	user_rt_id	user_rt	retweet_id	reply_to	retweet_date	translate	trans_src	trans_dest
1398353712939163648	1398353712939163648	2021-05-28 15:01:19 EDT	2021-05-28	15:01:19	-0400	242772524	repfranklucas	Frank Lucas		Enjoyed speaking to Oklahoma Farm Bureau members last night!	en	[]	[]	[]	3	2	1	[]	[]	https://twitter.com/RepFrankLucas/status/1398353712939163648	False	https://twitter.com/okfarmbureau/status/1398095861079490561	0								[]				
1398336230622912514	1398336230622912514	2021-05-28 13:51:51 EDT	2021-05-28	13:51:51	-0400	242772524	repfranklucas	Frank Lucas		President Biden’s $6 trillion spending plan is irresponsible and reckless, promising crushing debt, higher taxes,  and higher prices for America’s families.  The American people deserve a fiscally responsible federal government- not reckless spending.   https://t.co/X20Gd1dR3l	en	[]	['https://www.wsj.com/articles/biden-budget-plan-fiscal-2022-11622169489']	[]	8	3	2	[]	[]	https://twitter.com/RepFrankLucas/status/1398336230622912514	False		0								[]				
1398323597517668353	1398323597517668353	2021-05-28 13:01:39 EDT	2021-05-28	13:01:39	-0400	242772524	repfranklucas	Frank Lucas		Proud to join @SteveScalise!  Earlier this week, @WSJ reported that 3 researchers from China's Wuhan Institute of Virology fell ill in November of 2019 with symptoms consistent with COVID-19.   Congress and the American people deserve to know the truth about COVID-19's origins.	en	[{'screen_name': 'stevescalise', 'name': 'steve scalise', 'id': '1209417007'}, {'screen_name': 'wsj', 'name': 'the wall street journal', 'id': '3108351'}]	[]	[]	26	23	83	[]	[]	https://twitter.com/RepFrankLucas/status/1398323597517668353	False	https://twitter.com/SteveScalise/status/1398268375055413252	0								[]				
1398286085185286149	1398286085185286149	2021-05-28 10:32:36 EDT	2021-05-28	10:32:36	-0400	242772524	repfranklucas	Frank Lucas		Today, President Biden will unveil a $6T spending plan.  Across the U.S., inflation is skyrocketing. Across the globe, the dollar is weakening. The Biden Administration is fumbling America's economic recovery and it's hitting Americans where it hurts.    https://t.co/0I51NRiVSc	en	[]	['https://www.nytimes.com/2021/05/28/business/inflation-consumer-prices.html']	[]	147	77	182	[]	[]	https://twitter.com/RepFrankLucas/status/1398286085185286149	False		0								[]				
1398021903806353408	1398021903806353408	2021-05-27 17:02:50 EDT	2021-05-27	17:02:50	-0400	242772524	repfranklucas	Frank Lucas		Today, @SenateAgGOP heard from Pres. Biden's nominee to be GC of @USDA.   I'm encouraged by Janie Hipp's comments recognizing the need for coordinated oversight between @USDA &amp; the @TheJusticeDept in the meat-packing industry while also recognizing the complexities of the market.  https://t.co/w4rqRgySje	en	[{'screen_name': 'senateaggop', 'name': 'senate ag committee republicans', 'id': '3006258669'}, {'screen_name': 'usda', 'name': 'dept. of agriculture', 'id': '61853389'}, {'screen_name': 'usda', 'name': 'dept. of agriculture', 'id': '61853389'}, {'screen_name': 'thejusticedept', 'name': 'justice department', 'id': '73181712'}]	[]	[]	0	2	2	[]	[]	https://twitter.com/RepFrankLucas/status/1398021903806353408	False		1	https://pbs.twimg.com/ext_tw_video_thumb/1398016025564782592/pu/img/vEaZfR4eZGYOQ_OX.jpg							[]				
1398000192088121351	1398000192088121351	2021-05-27 15:36:34 EDT	2021-05-27	15:36:34	-0400	242772524	repfranklucas	Frank Lucas		"Today at our @FinancialCmte hearing with bank CEOs, I asked how Pres. Biden's global minimum corporate tax rate would impact the U.S.   Their answer, it would make the U.S. ""less competitive"" and ""drive capital, brains, R&amp;D, and investment overseas"".  Biden's taxes are bad news.  https://t.co/fDkEZDTS17"	en	[{'screen_name': 'financialcmte', 'name': 'financial services gop', 'id': '42924141'}]	[]	[]	11	2	0	[]	[]	https://twitter.com/RepFrankLucas/status/1398000192088121351	False		1	https://pbs.twimg.com/ext_tw_video_thumb/1397997637333393413/pu/img/DghVNWPU9ipFbV62.jpg							[]				
1397934163236372480	1397934163236372480	2021-05-27 11:14:11 EDT	2021-05-27	11:14:11	-0400	242772524	repfranklucas	Frank Lucas		Tune in later today. 📺  @ENERGY and @doescience is critical to America's comprehensive approach in remaining a leader in science and innovation.  Long-term investments- like the @NSF for the Future Act &amp; SALSTA- are central to turning basic research into marketable technology.	en	[{'screen_name': 'energy', 'name': 'u.s. department of energy', 'id': '166252256'}, {'screen_name': 'doescience', 'name': 'doe science', 'id': '162118290'}, {'screen_name': 'nsf', 'name': 'national science foundation', 'id': '16245822'}]	[]	[]	0	1	3	[]	[]	https://twitter.com/RepFrankLucas/status/1397934163236372480	False	https://twitter.com/housesciencegop/status/1397930464606789635	0								[]				
1397311957867409408	1397311957867409408	2021-05-25 18:01:46 EDT	2021-05-25	18:01:46	-0400	242772524	repfranklucas	Frank Lucas		ICYMI: Last week, the House passed the Rural STEM Education Research Act.  In order to address the challenges of tomorrow, we need a STEM workforce that draws from all the best minds from across America- that includes rural America.   https://t.co/MSTaNIk7UB	en	[]	['https://www.oklahoman.com/story/news/2021/05/19/oklahoma-frank-lucas-stem-bill-passed-house-representatives/5146694001/']	[]	1	5	8	[]	[]	https://twitter.com/RepFrankLucas/status/1397311957867409408	False		0								[]				
1397251120083308544	1397251120083308544	2021-05-25 14:00:01 EDT	2021-05-25	14:00:01	-0400	242772524	repfranklucas	Frank Lucas		The complexity of beef markets has caused devastating declines in futures markets for cattlemen and price increases on store shelves for consumers.  Proud to stand w/ @GovStitt &amp; Sec. @blaynearthur supporting Oklahoma's cattlemen and agriculture industry.   https://t.co/PkNloEkIZh	en	[{'screen_name': 'govstitt', 'name': 'governor kevin stitt', 'id': '865210877678686208'}, {'screen_name': 'blaynearthur', 'name': 'blayne arthur', 'id': '81926369'}]	['https://ktul.com/news/local/stitt-voices-support-for-investigation-of-meatpacking-industry-and-prices']	[]	1	2	5	[]	[]	https://twitter.com/RepFrankLucas/status/1397251120083308544	False		0								[]				
1396915998725390337	1396915998725390337	2021-05-24 15:48:22 EDT	2021-05-24	15:48:22	-0400	242772524	repfranklucas	Frank Lucas		I'm pleased to announce that Isabel Ley from Stillwater High School is the winner of the 2021 Congressional Art Competition for #OK03!  Isabel’s art, “Symphony”, will hang in the U.S. Capitol for a full year.  Congrats Isabel!  https://t.co/tu5rgDrbwm	en	[]	[]	['https://pbs.twimg.com/media/E2LSxYFWUAQwnlW.jpg']	1	6	55	['ok03']	[]	https://twitter.com/RepFrankLucas/status/1396915998725390337	False		1	https://pbs.twimg.com/media/E2LSxYFWUAQwnlW.jpg							[]				
1395756762830151686	1395756762830151686	2021-05-21 11:01:58 EDT	2021-05-21	11:01:58	-0400	242772524	repfranklucas	Frank Lucas		The climate financial risk EO signed by Pres. Biden is a dramatic overstep of the Executive Branch.  Instead of the Biden Admin. enacting burdensome financial regulations, it should be Congress and innovation moving the country towards a cleaner future.  https://t.co/PMY41qd59l	en	[]	['https://www.politico.com/news/2021/05/20/biden-climate-financial-risk-490045']	[]	7	2	0	[]	[]	https://twitter.com/RepFrankLucas/status/1395756762830151686	False		0								[]				
1395444521899544576	1395444521899544576	2021-05-20 14:21:14 EDT	2021-05-20	14:21:14	-0400	242772524	repfranklucas	Frank Lucas		NEW: I just introduced the Agricultural Security Risk Review Act, a bill that would increase scrutiny of foreign investment in the United States' agricultural sector.   Learn more👇 🔗 https://t.co/HUKxEvZcRI  https://t.co/as5TLDScR3	en	[]	['https://lucas.house.gov/news/press-releases/congressman-lucas-introduces-legislation-increasing-scrutiny-foreign-investment']	['https://pbs.twimg.com/media/E12b8jAXsAQ8WoW.jpg']	1	5	3	[]	[]	https://twitter.com/RepFrankLucas/status/1395444521899544576	False		1	https://pbs.twimg.com/media/E12b8jAXsAQ8WoW.jpg							[]				
1395095376441585669	1395095376441585669	2021-05-19 15:13:52 EDT	2021-05-19	15:13:52	-0400	242772524	repfranklucas	Frank Lucas		At today's @FinancialCmte hearing, I spoke about how climate-related risk regulations would impact the cost and availability of capital for consumers.   Financial regulations shouldn't be used to shape people's lives- the goal is to access risk to drive market-based solutions.  https://t.co/1vG4pJ3qBO	en	[{'screen_name': 'financialcmte', 'name': 'financial services gop', 'id': '42924141'}]	[]	[]	3	2	2	[]	[]	https://twitter.com/RepFrankLucas/status/1395095376441585669	False		1	https://pbs.twimg.com/ext_tw_video_thumb/1395095066973282306/pu/img/G1UFZQnsd8kRe4Zu.jpg							[]				
1394781256781635586	1394781256005660678	2021-05-18 18:25:40 EDT	2021-05-18	18:25:40	-0400	242772524	repfranklucas	Frank Lucas		The Rural STEM Education Research Act would help give teachers more STEM resources, engage students in hands-on education within their communities, and address key obstacles to rural STEM education- particularly the lack of broadband access.   READ MORE ↓  https://t.co/DQihWH7DJN	en	[]	['https://lucas.house.gov/news/press-releases/lucas-rural-stem-education-bill-passed-house']	[]	0	3	7	[]	[]	https://twitter.com/RepFrankLucas/status/1394781256781635586	False		0								[]				
1394781256005660678	1394781256005660678	2021-05-18 18:25:39 EDT	2021-05-18	18:25:39	-0400	242772524	repfranklucas	Frank Lucas		JUST NOW → The House passed H.R. 210- the Rural STEM Education Research Act.   Whether you live in Dallas, TX- home of my wonderful Chairwoman @RepEBJ- or Cheyenne, OK, every student should have access to STEM education and to be able to compete for the jobs of the future.	en	[{'screen_name': 'repebj', 'name': 'rep. eddie bernice johnson', 'id': '168502762'}]	[]	[]	2	13	37	[]	[]	https://twitter.com/RepFrankLucas/status/1394781256005660678	False		0								[]				
1394389343423315972	1394389343423315972	2021-05-17 16:28:20 EDT	2021-05-17	16:28:20	-0400	242772524	repfranklucas	Frank Lucas		Tune in!📺  The House is debating my bill, H.R. 210- the Rural STEM Education Research Act. H.R. 210 makes great strides to improve STEM education to America's rural students and ensures rural students aren't left behind.   📺:  https://t.co/Wt4Q0eyU9t	en	[]	['http://live.house.gov']	[]	0	2	3	[]	[]	https://twitter.com/RepFrankLucas/status/1394389343423315972	False	https://twitter.com/HouseDailyPress/status/1394387141128507394	0								[]				
1393303513598410753	1393303513598410753	2021-05-14 16:33:38 EDT	2021-05-14	16:33:38	-0400	242772524	repfranklucas	Frank Lucas		Proud to join @RepDavidRouzer, @SteveScalise, and @RepMullin in sending a letter to President Biden urging him to invest in America's oil and natural gas pipeline network.  The Colonial Pipeline attack emphasizes the need to invest in an all-of-the-above energy approach.	en	[{'screen_name': 'repdavidrouzer', 'name': 'david rouzer', 'id': '834069080'}, {'screen_name': 'stevescalise', 'name': 'steve scalise', 'id': '1209417007'}, {'screen_name': 'repmullin', 'name': 'markwayne mullin', 'id': '1060370282'}]	[]	[]	42	25	87	[]	[]	https://twitter.com/RepFrankLucas/status/1393303513598410753	False	https://twitter.com/RepDavidRouzer/status/1393287278001365004	0								[]				
1392931711412019200	1392931711412019200	2021-05-13 15:56:14 EDT	2021-05-13	15:56:14	-0400	242772524	repfranklucas	Frank Lucas		Proud to join @RepMichaelGuest and @repjulialetlow in honoring America's law enforcement officers this National Police Week!  Thank you to all law enforcement officers in Oklahoma and across the country for the work you do to keep our communities safe. 🇺🇸  https://t.co/sL6XYYiyMA	en	[{'screen_name': 'repmichaelguest', 'name': 'congressman michael guest', 'id': '1081243468327018496'}, {'screen_name': 'repjulialetlow', 'name': 'congresswoman julia letlow', 'id': '1382395679700439041'}]	[]	['https://pbs.twimg.com/media/E1SunmpWEAAfkk6.jpg']	2	1	2	[]	[]	https://twitter.com/RepFrankLucas/status/1392931711412019200	False	https://twitter.com/RepMichaelGuest/status/1392470572722966534	1	https://pbs.twimg.com/media/E1SunmpWEAAfkk6.jpg							[]				
1392855832212217859	1392855832212217859	2021-05-13 10:54:43 EDT	2021-05-13	10:54:43	-0400	242772524	repfranklucas	Frank Lucas		I believe that the nation that leads in science and technology will shape the world order for the next century. I’d like that nation to be ours, and I’d like for emerging technologies to be developed with our values of transparency and fairness.	en	[]	[]	[]	1	2	5	[]	[]	https://twitter.com/RepFrankLucas/status/1392855832212217859	False	https://twitter.com/housesciencegop/status/1392855125845319684	0								[]				
1392562046156353536	1392562046156353536	2021-05-12 15:27:19 EDT	2021-05-12	15:27:19	-0400	242772524	repfranklucas	Frank Lucas		Infrastructure can and should be a bipartisan issue.  Read about how my fellow @HouseGOP colleague, @RepSamGraves, intends to ensure traditional infrastructure- like roads, bridges, airports, waterways, and broadband- receives the investment it needs.👇🏻  https://t.co/YxMX6eJdUN	en	[{'screen_name': 'housegop', 'name': 'house republicans', 'id': '15207668'}, {'screen_name': 'repsamgraves', 'name': 'rep. sam graves', 'id': '29766367'}]	['https://thehill.com/blogs/congress-blog/politics/553029-republicans-welcome-the-chance-to-work-with-democrats-on-a']	[]	0	1	2	[]	[]	https://twitter.com/RepFrankLucas/status/1392562046156353536	False		0								[]				
1392511657360957444	1392511656282972164	2021-05-12 12:07:05 EDT	2021-05-12	12:07:05	-0400	242772524	repfranklucas	Frank Lucas		Recently, the U.S. Labor Dept. reported job openings soared to its highest level on record since 2000 &amp; inflation in April accelerated at its fastest pace in 12 yrs.  These are the effects of Pres. Biden's Washington competing against US small businesses.  https://t.co/a8VqEkZ366	en	[]	['https://www.nationalreview.com/news/consumer-price-index-sees-largest-yearly-increase-since-2008-as-evidence-of-inflation-mounts/']	[]	2	0	1	[]	[]	https://twitter.com/RepFrankLucas/status/1392511657360957444	False		0								[]				
1392511656282972164	1392511656282972164	2021-05-12 12:07:05 EDT	2021-05-12	12:07:05	-0400	242772524	repfranklucas	Frank Lucas		In February, Larry Summers warned of big government spending and skyrocketing inflation:  “there is a chance that macroeconomic stimulus on a scale closer to WW II levels than normal recession levels will set off inflationary pressures of a kind we have not seen in a generation.”	en	[]	[]	[]	7	3	5	[]	[]	https://twitter.com/RepFrankLucas/status/1392511656282972164	False	https://twitter.com/washingtonpost/status/1357485693078011904	0								[]				
1392162592022433794	1392162592022433794	2021-05-11 13:00:01 EDT	2021-05-11	13:00:01	-0400	242772524	repfranklucas	Frank Lucas		"Before Pres. Biden's address outlining the ""Build Back Better"" agenda there were whispers of inflation- now Americans are paying the price for nearly everything: gas, groceries, appliances.   Biden's costly agenda is hamstringing America's middle class.  https://t.co/bVGGTFeWvO"	en	[]	['https://www.wsj.com/articles/consumers-adjust-to-higher-prices-11620552601?mod=djem10point&fbclid=IwAR1FzpdFWv3Ld5_R06uYvpvQPkgzw8COJJ-23fje3ypIKagyZvGOE1LYJTE']	[]	4	1	5	[]	[]	https://twitter.com/RepFrankLucas/status/1392162592022433794	False		0								[]				
1392122958089445379	1392122958089445379	2021-05-11 10:22:32 EDT	2021-05-11	10:22:32	-0400	242772524	repfranklucas	Frank Lucas		China is spending millions in the U.S. to assert their geopolitical dominance while spending billions at home to thwart America's leadership in R&amp;D.   The U.S. needs a long-term strategy for the investment in basic research &amp; SALSTA will deliver that!  https://t.co/AmXYY2KyVH	en	[]	['https://www.axios.com/china-foreign-influence-spending-317a9be4-8ead-4abf-8ac4-3f27974d7a9d.html']	[]	4	2	4	[]	[]	https://twitter.com/RepFrankLucas/status/1392122958089445379	False		0								[]				
1391872071974666241	1391872071974666241	2021-05-10 17:45:36 EDT	2021-05-10	17:45:36	-0400	242772524	repfranklucas	Frank Lucas		This #NationalPoliceWeek, and every other week, we honor and recognize the brave law enforcement officials who protect and serve.   Thank you to all of Oklahoma's law enforcement officers for keeping our communities and our families safe. #BackTheBlue  https://t.co/xUyXupCJym	en	[]	[]	['https://pbs.twimg.com/media/E1DsK4fWQAQZY6y.jpg']	5	1	5	['nationalpoliceweek', 'backtheblue']	[]	https://twitter.com/RepFrankLucas/status/1391872071974666241	False		1	https://pbs.twimg.com/media/E1DsK4fWQAQZY6y.jpg							[]				
1390707700988776450	1390707700988776450	2021-05-07 12:38:48 EDT	2021-05-07	12:38:48	-0400	242772524	repfranklucas	Frank Lucas		It was a pleasure to spend yesterday evening in Woodward with Farm Credit of Western Oklahoma board members, customers and staff to discuss the federal issues impacting farmers, ranchers and rural communities in our state and nation.  https://t.co/PuIrizwwo4	en	[]	[]	['https://pbs.twimg.com/media/E0zJSDcX0AUoILg.jpg']	0	2	2	[]	[]	https://twitter.com/RepFrankLucas/status/1390707700988776450	False		1	https://pbs.twimg.com/media/E0zJSDcX0AUoILg.jpg							[]				
1390388243724750849	1390388243724750849	2021-05-06 15:29:24 EDT	2021-05-06	15:29:24	-0400	242772524	repfranklucas	Frank Lucas		During #NationalNurseAppreciationWeek, I want to recognize and thank all of the nurses in Oklahoma and across the country. Throughout the COVID-19 pandemic, nurses have been at the frontline working tirelessly to provide care for their communities and neighbors.  https://t.co/sED3V6NWgH	en	[]	[]	['https://pbs.twimg.com/media/E0umvFrXMAM4-ln.jpg']	1	1	0	['nationalnurseappreciationweek']	[]	https://twitter.com/RepFrankLucas/status/1390388243724750849	False		1	https://pbs.twimg.com/media/E0umvFrXMAM4-ln.jpg							[]				
1390022777705570306	1390022777705570306	2021-05-05 15:17:10 EDT	2021-05-05	15:17:10	-0400	242772524	repfranklucas	Frank Lucas		I enjoyed visiting with my friends this morning at the @OklahomaHBA. Thank you for providing valuable insight into the current supply chain issues facing the builders industry in Oklahoma after the pandemic.  https://t.co/aiEgiLS97w	en	[{'screen_name': 'oklahomahba', 'name': 'okhba', 'id': '176936426'}]	[]	['https://pbs.twimg.com/media/E0paV4-WUAopwlP.jpg', 'https://pbs.twimg.com/media/E0paV4-WUAkva9H.jpg', 'https://pbs.twimg.com/media/E0paV7eXoAQAJOA.jpg']	4	1	3	[]	[]	https://twitter.com/RepFrankLucas/status/1390022777705570306	False		1	https://pbs.twimg.com/media/E0paV4-WUAopwlP.jpg							[]				
1389693820229627907	1389693820229627907	2021-05-04 17:30:00 EDT	2021-05-04	17:30:00	-0400	242772524	repfranklucas	Frank Lucas		Thank you to all of Oklahoma's teachers who have made the education of our children their priority! #ThankATeacher  https://t.co/jyEdLfstrH	en	[]	[]	['https://pbs.twimg.com/media/E0kmDb6WUAIzOvj.jpg']	6	0	4	['thankateacher']	[]	https://twitter.com/RepFrankLucas/status/1389693820229627907	False		1	https://pbs.twimg.com/media/E0kmDb6WUAIzOvj.jpg							[]				
1389300466341797894	1389300466341797894	2021-05-03 15:26:57 EDT	2021-05-03	15:26:57	-0400	242772524	repfranklucas	Frank Lucas		Congratulations to @USDA_ARS Dr. Sherry Hunt @SLHBOH2004 for being named a finalist for the 2021 Samuel J. Heyman Service to America Medal! I applaud your commitment to protecting infrastructure investments &amp; downstream communities in Oklahoma &amp; across the country #Sammies2021	en	[{'screen_name': 'usda_ars', 'name': 'agricultural research service', 'id': '76733474'}, {'screen_name': 'slhboh2004', 'name': 'sherry hunt', 'id': '877961985673048065'}]	[]	[]	0	3	10	['sammies2021']	[]	https://twitter.com/RepFrankLucas/status/1389300466341797894	False	https://twitter.com/USDA_ARS/status/1389209078468124672	0								[]				
1387594934534950916	1387594934534950916	2021-04-28 22:29:47 EDT	2021-04-28	22:29:47	-0400	242772524	repfranklucas	Frank Lucas		The era of Big Government is back under @POTUS and @VP.   Ignoring current crises, passing the buck to our children’s children, and squandering opportunities for investment isn’t what the American people bargained for. Americans deserve common-sense &amp; common ground.  Read more:	en	[{'screen_name': 'potus', 'name': 'president biden', 'id': '1349149096909668363'}, {'screen_name': 'vp', 'name': 'vice president kamala harris', 'id': '803694179079458816'}]	[]	[]	7	2	4	[]	[]	https://twitter.com/RepFrankLucas/status/1387594934534950916	False		0								[]				
1387589534397997057	1387589534397997057	2021-04-28 22:08:19 EDT	2021-04-28	22:08:19	-0400	242772524	repfranklucas	Frank Lucas		In his first 100 days, @POTUS is failing to take responsibility for the humanitarian &amp; national security crisis at our Southern Border.   Border security is ag security. Border security is national security.   We are a Nation of immigrants BUT we must respect the rule of law!	en	[{'screen_name': 'potus', 'name': 'president biden', 'id': '1349149096909668363'}]	[]	[]	8	1	5	[]	[]	https://twitter.com/RepFrankLucas/status/1387589534397997057	False		0								[]				
1387587517789114374	1387587517789114374	2021-04-28 22:00:19 EDT	2021-04-28	22:00:19	-0400	242772524	repfranklucas	Frank Lucas		If @POTUS is serious about holding our adversaries accountable, we MUST invest in America's defenses &amp; ensure America remains a leader in science, technology &amp; innovation.   The Chinese Communist Party, Iran &amp; Russia are constant threats. America's time for investment is NOW!	en	[{'screen_name': 'potus', 'name': 'president biden', 'id': '1349149096909668363'}]	[]	[]	5	1	9	[]	[]	https://twitter.com/RepFrankLucas/status/1387587517789114374	False		0								[]				
1387585085403275265	1387585085403275265	2021-04-28 21:50:39 EDT	2021-04-28	21:50:39	-0400	242772524	repfranklucas	Frank Lucas		"President Ronald Reagan once said, ""The most terrifying words in the English language are: I'm from the government and I'm here to help.”  We don't need to raise taxes, Mr. President. We need to cut wasteful government spending and ensure our Main Street businesses can grow!"	en	[]	[]	[]	22	8	31	[]	[]	https://twitter.com/RepFrankLucas/status/1387585085403275265	False		0								[]				
1387583601324302337	1387583601324302337	2021-04-28 21:44:45 EDT	2021-04-28	21:44:45	-0400	242772524	repfranklucas	Frank Lucas		.@POTUS &amp; @VP have proposed a crushing $6 TRILLION in spending through the American Rescue Plan, the American Jobs Plan &amp; the American Families Plan.   @POTUS' unprecedented spending will balloon the size of the federal government &amp; pass the buck to our children's children.	en	[{'screen_name': 'potus', 'name': 'president biden', 'id': '1349149096909668363'}, {'screen_name': 'vp', 'name': 'vice president kamala harris', 'id': '803694179079458816'}, {'screen_name': 'potus', 'name': 'president biden', 'id': '1349149096909668363'}]	[]	[]	7	4	7	[]	[]	https://twitter.com/RepFrankLucas/status/1387583601324302337	False		0								[]				
1387580193976594433	1387580193976594433	2021-04-28 21:31:12 EDT	2021-04-28	21:31:12	-0400	242772524	repfranklucas	Frank Lucas		The American Jobs Plan is the GND disguised as infrastructure. @POTUS' energy policies will cripple communities across the country and cost countless American jobs.  America’s clean energy future should be driven by innovation- not by the baseball bat of taxes &amp; regulation.	en	[{'screen_name': 'potus', 'name': 'president biden', 'id': '1349149096909668363'}]	[]	[]	2	4	6	[]	[]	https://twitter.com/RepFrankLucas/status/1387580193976594433	False		0								[]				
1387578247588765703	1387578247588765703	2021-04-28 21:23:28 EDT	2021-04-28	21:23:28	-0400	242772524	repfranklucas	Frank Lucas		"In 2020, Congress passed 5 bipartisan COVID relief bills for the American people. And thanks to Operation Warp Speed, our scientific community was delivering COVID vaccines to communities across the US.  @POTUS' $1.9M ""COVID Relief"" bill spent less than 9% on defeating the virus."	en	[{'screen_name': 'potus', 'name': 'president biden', 'id': '1349149096909668363'}]	[]	[]	5	4	7	[]	[]	https://twitter.com/RepFrankLucas/status/1387578247588765703	False		0								[]				
1387569777300971520	1387569777300971520	2021-04-28 20:49:49 EDT	2021-04-28	20:49:49	-0400	242772524	repfranklucas	Frank Lucas		Tonight, @POTUS will give his first #JointAddress to Congress.   While I hope to hear a message about reaching bipartisan solutions to address the pressing issues facing our country, it will be the @POTUS' actions that will speak louder than words.   📺:  https://t.co/Ume0y5Qlmr	en	[{'screen_name': 'potus', 'name': 'president biden', 'id': '1349149096909668363'}, {'screen_name': 'potus', 'name': 'president biden', 'id': '1349149096909668363'}]	['https://www.c-span.org']	[]	8	2	3	['jointaddress']	[]	https://twitter.com/RepFrankLucas/status/1387569777300971520	False		0								[]				
1387170480961073161	1387170480961073161	2021-04-27 18:23:09 EDT	2021-04-27	18:23:09	-0400	242772524	repfranklucas	Frank Lucas		Oklahoma- severe weather is in the forecast for tonight and into tomorrow. Be sure to remain weather aware and heed the advice of your local officials and meteorologists.	en	[]	[]	[]	1	2	3	[]	[]	https://twitter.com/RepFrankLucas/status/1387170480961073161	False	https://twitter.com/NWSNorman/status/1387105362206150656	0								[]				
