id	conversation_id	created_at	date	time	timezone	user_id	username	name	place	tweet	language	mentions	urls	photos	replies_count	retweets_count	likes_count	hashtags	cashtags	link	retweet	quote_url	video	thumbnail	near	geo	source	user_rt_id	user_rt	retweet_id	reply_to	retweet_date	translate	trans_src	trans_dest
1166346092482629639	1166346092482629639	2019-08-27 09:45:52 EDT	2019-08-27	09:45:52	-0400	242772524	repfranklucas	Frank Lucas		Due to the effects of last night's storm and loss of power, the Yukon District Office will be closed today. If you need immediate assistance from my staff please call the D.C. Office at (202) 225- 5565.	en	[]	[]	[]	3	2	7	[]	[]	https://twitter.com/RepFrankLucas/status/1166346092482629639	False	https://twitter.com/OGandE/status/1166292668223295489	0								[]				
1164635855014834177	1164635855014834177	2019-08-22 16:30:00 EDT	2019-08-22	16:30:00	-0400	242772524	repfranklucas	Frank Lucas		Had the opportunity to sit down with @NEWS9’ @AlexDCameron today while I was in Oklahoma City.   Be sure to tune into today and tonight to watch our discussion!  https://t.co/DrAvglrR4S	en	[{'screen_name': 'news9', 'name': 'news 9', 'id': '15896162'}, {'screen_name': 'alexdcameron', 'name': 'alex cameron', 'id': '22739917'}]	[]	['https://pbs.twimg.com/media/ECmEABCWwAEl4jl.jpg']	2	1	5	[]	[]	https://twitter.com/RepFrankLucas/status/1164635855014834177	False		1	https://pbs.twimg.com/media/ECmEABCWwAEl4jl.jpg							[]				
1164562051940925441	1164562051940925441	2019-08-22 11:36:44 EDT	2019-08-22	11:36:44	-0400	242772524	repfranklucas	Frank Lucas		Yesterday was another great day of Town Hall Meetings in @StillwaterOKgov, Pawnee, and Pawhuska. Thank you to everyone attended my last 6 Town Hall Meetings. Be sure to stay in touch to find out when I’ll be in your area next!  https://t.co/E1hnfEAAfq	en	[{'screen_name': 'stillwaterokgov', 'name': 'city of stillwater', 'id': '109372752'}]	[]	['https://pbs.twimg.com/media/ECla57rWkAI6peI.jpg', 'https://pbs.twimg.com/media/ECla57uWsAAGVxk.jpg', 'https://pbs.twimg.com/media/ECla57uXoAAzDEf.jpg']	1	0	6	[]	[]	https://twitter.com/RepFrankLucas/status/1164562051940925441	False		1	https://pbs.twimg.com/media/ECla57rWkAI6peI.jpg							[]				
1164511283804299264	1164511283804299264	2019-08-22 08:15:00 EDT	2019-08-22	08:15:00	-0400	242772524	repfranklucas	Frank Lucas		LISTEN LIVE📻: I'll be on @KOKCradio's with @Jackcheese beginning at 8:30 a.m. this morning.   Be sure to tune in!	en	[{'screen_name': 'kokcradio', 'name': 'kokcradio', 'id': '822120218906476545'}, {'screen_name': 'jackcheese', 'name': 'jack damn elliott', 'id': '17884093'}]	[]	[]	2	0	2	[]	[]	https://twitter.com/RepFrankLucas/status/1164511283804299264	False		0								[]				
1164163995307335680	1164163995307335680	2019-08-21 09:15:00 EDT	2019-08-21	09:15:00	-0400	242772524	repfranklucas	Frank Lucas		Thankful to those who attended my Town Hall Meetings in Yukon, Perry, and Ponca City! At each, we shared a great conversation about what lies ahead for Congress, the need for fair and equitable global trade, and much more.  I hope to see you at my next Town Hall Meeting!  https://t.co/JXcJtn8Mld	en	[]	[]	['https://pbs.twimg.com/media/ECe4xnwXUAAMv_9.jpg', 'https://pbs.twimg.com/media/ECe4xn5XoAAmGcZ.jpg', 'https://pbs.twimg.com/media/ECe4xnyXsAAE5fW.jpg']	3	0	3	[]	[]	https://twitter.com/RepFrankLucas/status/1164163995307335680	False		1	https://pbs.twimg.com/media/ECe4xnwXUAAMv_9.jpg							[]				
1164133796482093056	1164133796482093056	2019-08-21 07:15:00 EDT	2019-08-21	07:15:00	-0400	242772524	repfranklucas	Frank Lucas		TUNE IN📻: @KGFYCountry is home to Country and Red Dirt Music in Stillwater and it's also where you'll find me this morning.  I'll be live on @KGFYCountry this morning at 7:30 a.m. Don't miss it!	en	[{'screen_name': 'kgfycountry', 'name': 'cowboy country 105.5', 'id': '2786432174'}, {'screen_name': 'kgfycountry', 'name': 'cowboy country 105.5', 'id': '2786432174'}]	[]	[]	1	0	3	[]	[]	https://twitter.com/RepFrankLucas/status/1164133796482093056	False		0								[]				
1163865781026861057	1163865781026861057	2019-08-20 13:30:00 EDT	2019-08-20	13:30:00	-0400	242772524	repfranklucas	Frank Lucas		Tomorrow I'll be holding 3 more Town Hall Meetings in @StillwaterOKgov, Pawnee, and Pawhuska. I'll see you there! 📅: Aug. 21st 🕒: 9:00 a.m., 11:00 a.m., 2:00 p.m.  MORE INFO:  https://t.co/4fbDepyAwV  https://t.co/tW6ai7qCuK	en	[{'screen_name': 'stillwaterokgov', 'name': 'city of stillwater', 'id': '109372752'}]	['https://tinyurl.com/y26dqgtt']	['https://pbs.twimg.com/media/EBTzSQuXsAA3GmV.jpg']	1	3	5	[]	[]	https://twitter.com/RepFrankLucas/status/1163865781026861057	False		1	https://pbs.twimg.com/media/EBTzSQuXsAA3GmV.jpg							[]				
1163495846140239873	1163495846140239873	2019-08-19 13:00:01 EDT	2019-08-19	13:00:01	-0400	242772524	repfranklucas	Frank Lucas		Tomorrow I'll be holding Town Hall Meetings in @cityofyukonok, Perry, and @PoncaCityOKgov. I'll see you there! 📅: Aug. 20th 🕒: 10:00 a.m., 1:30 p.m., 3:30 p.m.  MORE INFO:  https://t.co/4fbDepgZ8l  https://t.co/FTt4zpDNlH	en	[{'screen_name': 'cityofyukonok', 'name': 'city of yukon ok', 'id': '375797920'}, {'screen_name': 'poncacityokgov', 'name': 'ponca city oklahoma', 'id': '135869400'}]	['https://tinyurl.com/y26dqgtt']	['https://pbs.twimg.com/media/EBTs4UkX4AEiGzH.jpg']	1	2	8	[]	[]	https://twitter.com/RepFrankLucas/status/1163495846140239873	False		1	https://pbs.twimg.com/media/EBTs4UkX4AEiGzH.jpg							[]				
1162097418462216192	1162097418462216192	2019-08-15 16:23:09 EDT	2019-08-15	16:23:09	-0400	242772524	repfranklucas	Frank Lucas		It was my pleasure! Thanks for taking the time and sharing the importance of the research done at @NEON_sci Klemme Range Research Station in our very own Western Oklahoma.	en	[{'screen_name': 'neon_sci', 'name': 'neon', 'id': '44483406'}]	[]	[]	2	0	6	[]	[]	https://twitter.com/RepFrankLucas/status/1162097418462216192	False	https://twitter.com/Battelle/status/1162084143502680064	0								[]				
1161365778484092934	1161365778484092934	2019-08-13 15:55:53 EDT	2019-08-13	15:55:53	-0400	242772524	repfranklucas	Frank Lucas		Wind energy supports over 7,000 jobs in Oklahoma while providing more than 30% of the state’s energy. As the 3rd highest producer of wind energy, Oklahoma is proud to celebrate #AmericaWindWeek	en	[]	[]	[]	3	5	8	['americawindweek']	[]	https://twitter.com/RepFrankLucas/status/1161365778484092934	False	https://twitter.com/housesciencegop/status/1161010978257027085	0								[]				
1161291320020930561	1161291320020930561	2019-08-13 11:00:01 EDT	2019-08-13	11:00:01	-0400	242772524	repfranklucas	Frank Lucas		WATCH LIVE📺: I'll be on @OKCFOX Midday with @DanSnyderFOX25 at 11:30 a.m. giving an update on what's happening in Washington, D.C. and back home here in Oklahoma.   Be sure to tune in!	en	[{'screen_name': 'okcfox', 'name': 'kokh fox 25', 'id': '30868693'}, {'screen_name': 'dansnyderfox25', 'name': 'dan snyder', 'id': '195950960'}]	[]	[]	1	1	6	[]	[]	https://twitter.com/RepFrankLucas/status/1161291320020930561	False		0								[]				
1159828201675395072	1159828201675395072	2019-08-09 10:06:06 EDT	2019-08-09	10:06:06	-0400	242772524	repfranklucas	Frank Lucas		Thank you, @EPAAWheeler for ensuring that farmers and ranchers, and consumers as a whole, can rely on the best available science and accurate and consistent labeling. READ MORE⬇️	en	[{'screen_name': 'epaawheeler', 'name': 'epa administrator andrew wheeler', 'id': '832672006113931269'}]	[]	[]	7	2	6	[]	[]	https://twitter.com/RepFrankLucas/status/1159828201675395072	False	https://twitter.com/housesciencegop/status/1159606482494734336	0								[]				
1159101890099142656	1159101890099142656	2019-08-07 10:00:00 EDT	2019-08-07	10:00:00	-0400	242772524	repfranklucas	Frank Lucas		Originally named the Badge of Military Merit by President George Washington, the Purple Heart is our nation's oldest military award presented to American service members. I'm forever grateful for the more than 1.8 million Purple Heart recipients- including the 1,340 Oklahomans💜  https://t.co/hcDxBWf996	en	[]	[]	['https://pbs.twimg.com/media/EBT_9_eXYAAA4w8.jpg']	41	14	54	[]	[]	https://twitter.com/RepFrankLucas/status/1159101890099142656	False		1	https://pbs.twimg.com/media/EBT_9_eXYAAA4w8.jpg							[]				
1158793412684001282	1158793412684001282	2019-08-06 13:34:13 EDT	2019-08-06	13:34:13	-0400	242772524	repfranklucas	Frank Lucas		Central Oklaomans, I'll be in Canadian, Noble, &amp; Kay Counties on Tuesday, August 20th and Payne, Pawnee, &amp; Osage Counties on Wednesday, August 21st! MORE INFO⬇️  https://t.co/0Oblfbr4NN	en	[]	['https://lucas.house.gov/press-release/lucas-announces-august-town-hall-meetings-central-north-central-oklahoma']	[]	4	4	10	[]	[]	https://twitter.com/RepFrankLucas/status/1158793412684001282	False		0								[]				
1157405180243206149	1157405180243206149	2019-08-02 17:37:53 EDT	2019-08-02	17:37:53	-0400	242772524	repfranklucas	Frank Lucas		Today’s announcement means Oklahoma’s beef producers finally regain long-lost access to EU markets. I commend @POTUS and his team for addressing this inequality in the U.S./EU trade relationship.	en	[{'screen_name': 'potus', 'name': 'president biden', 'id': '1349149096909668363'}]	[]	[]	5	3	6	[]	[]	https://twitter.com/RepFrankLucas/status/1157405180243206149	False	https://twitter.com/USTradeRep45/status/1157364630643232772	0								[]				
1157317483453460481	1157317483453460481	2019-08-02 11:49:24 EDT	2019-08-02	11:49:24	-0400	242772524	repfranklucas	Frank Lucas		The U.S. witnessed another month of economic growth in July!  📈164,000 new jobs 💵Wages increased 3.2%  🏆Record high 163.4 million labor force ↘️Historical low unemployment   America’s economy continues to thrive under @realDonaldTrump and the Republican pro-growth agenda.	en	[{'screen_name': 'realdonaldtrump', 'name': 'donald j. trump', 'id': '25073877'}]	[]	[]	17	19	117	[]	[]	https://twitter.com/RepFrankLucas/status/1157317483453460481	False	https://twitter.com/CNBC/status/1157270730301685760	0								[]				
1157274852106964992	1157274852106964992	2019-08-02 09:00:00 EDT	2019-08-02	09:00:00	-0400	242772524	repfranklucas	Frank Lucas		ICYMI: Oklahomans impacted by the severe storms between May 7 to June 9 now have more time to register with @fema and the @SBAgov.  READ MORE⬇️  https://t.co/lK3z9ZgxHo	en	[{'screen_name': 'fema', 'name': 'fema', 'id': '16669075'}, {'screen_name': 'sbagov', 'name': 'sba', 'id': '153149305'}]	['http://www.guthrienewsleader.net/news/oklahomans-have-more-time-to-register-for-disaster-assistance/article_2b49cdf6-b3b4-11e9-a1c7-fb11e0c92232.html']	[]	3	1	4	[]	[]	https://twitter.com/RepFrankLucas/status/1157274852106964992	False		0								[]				
1156999305280000002	1156999305280000002	2019-08-01 14:45:05 EDT	2019-08-01	14:45:05	-0400	242772524	repfranklucas	Frank Lucas		The proud son of the Republic of Texas, @ConawayTX11 has been and remains a champion for farmers and ranchers in West Texas and across the country. As he finishes his last term in Congress, I wish Mike and Suzanne the best as they embark on their next journey in life.	en	[{'screen_name': 'conawaytx11', 'name': 'mike conaway', 'id': '295685416'}]	[]	[]	3	3	14	[]	[]	https://twitter.com/RepFrankLucas/status/1156999305280000002	False		0								[]				
1155865919937290240	1155865919937290240	2019-07-29 11:41:24 EDT	2019-07-29	11:41:24	-0400	242772524	repfranklucas	Frank Lucas		Thanks for chatting with me about the importance of Oklahoma's flood control dams, @Ron_on_RON!   I'm proud to continue the work of my fellow Oklahomans.	en	[{'screen_name': 'ron_on_ron', 'name': 'ron hays', 'id': '17814568'}]	[]	[]	6	4	9	[]	[]	https://twitter.com/RepFrankLucas/status/1155865919937290240	False	https://twitter.com/Ron_on_RON/status/1155810361406382081	0								[]				
1154802508180676609	1154802508180676609	2019-07-26 13:15:47 EDT	2019-07-26	13:15:47	-0400	242772524	repfranklucas	Frank Lucas		Led by @realDonaldTrump’s deregulation and pro-growth policies and @HouseGOP’s #TaxCuts, the majority of Americans feel like the economy and their personal finances are ‘excellent or good’.   https://t.co/Q44avhO2ue	en	[{'screen_name': 'realdonaldtrump', 'name': 'donald j. trump', 'id': '25073877'}, {'screen_name': 'housegop', 'name': 'house republicans', 'id': '15207668'}]	['https://www.washingtontimes.com/news/2019/jul/26/majority-of-americans-rate-economy-and-personal-fi/']	[]	2	2	6	['taxcuts']	[]	https://twitter.com/RepFrankLucas/status/1154802508180676609	False		0								[]				
1154520280666165248	1154520280666165248	2019-07-25 18:34:19 EDT	2019-07-25	18:34:19	-0400	242772524	repfranklucas	Frank Lucas		Happy #NationalInternDay to the interns- both in my personal office and the @housesciencegop- who serve the great people of Oklahoma and help keep my office running on a daily basis.  https://t.co/uJP5uXABVy	en	[{'screen_name': 'housesciencegop', 'name': 'sci, space, & tech gop', 'id': '23103488'}]	[]	['https://pbs.twimg.com/media/EAWuD8OW4AAcBTG.jpg', 'https://pbs.twimg.com/media/EAWuD8NXoAA4siU.jpg', 'https://pbs.twimg.com/media/EAWuD8MXoAQbwVj.jpg']	0	1	10	['nationalinternday']	[]	https://twitter.com/RepFrankLucas/status/1154520280666165248	False		1	https://pbs.twimg.com/media/EAWuD8OW4AAcBTG.jpg							[]				
1154478759522648064	1154478759522648064	2019-07-25 15:49:20 EDT	2019-07-25	15:49:20	-0400	242772524	repfranklucas	Frank Lucas		Yesterday, I was delighted to meet with Oklahoma’s @ASA_Soybeans producers. Oklahoma’s farmers and ranchers are committed to producing  and selling into a global market which is why I’m committed to having their backs during trade negotiations.  https://t.co/94bjxQPfMw	en	[{'screen_name': 'asa_soybeans', 'name': 'american soybean association', 'id': '74164455'}]	[]	['https://pbs.twimg.com/media/EAWIT5NWkAARFxv.jpg']	0	2	16	[]	[]	https://twitter.com/RepFrankLucas/status/1154478759522648064	False		1	https://pbs.twimg.com/media/EAWIT5NWkAARFxv.jpg							[]				
1154407319033323521	1154407319033323521	2019-07-25 11:05:27 EDT	2019-07-25	11:05:27	-0400	242772524	repfranklucas	Frank Lucas		Thanks for having me on @KEYBRADIO and @K101online!  It was great discussing the importance of Oklahoma’s watershed dams, the President’s actions curbing illegal immigration, and passing #USMCA.  https://t.co/eTXOooC67f	en	[{'screen_name': 'keybradio', 'name': 'keyb radio', 'id': '51483768'}, {'screen_name': 'k101online', 'name': 'k101', 'id': '565739777'}]	[]	['https://pbs.twimg.com/media/EAVHVinWsAAksQV.jpg']	0	0	4	['usmca']	[]	https://twitter.com/RepFrankLucas/status/1154407319033323521	False	https://twitter.com/RepFrankLucas/status/1154353099097673729	1	https://pbs.twimg.com/media/EAVHVinWsAAksQV.jpg							[]				
1154353099097673729	1154353099097673729	2019-07-25 07:30:00 EDT	2019-07-25	07:30:00	-0400	242772524	repfranklucas	Frank Lucas		📻LISTEN LIVE: Tune in this morning at 7:10 a.m. to catch me on Altus' @KEYBRADIO with Shelby and Scott and 7:35 a.m. on Woodward's @K101online with J. Douglas and Sean.	en	[{'screen_name': 'keybradio', 'name': 'keyb radio', 'id': '51483768'}, {'screen_name': 'k101online', 'name': 'k101', 'id': '565739777'}]	[]	[]	1	0	4	[]	[]	https://twitter.com/RepFrankLucas/status/1154353099097673729	False		0								[]				
1154155838220709888	1154155838220709888	2019-07-24 18:26:09 EDT	2019-07-24	18:26:09	-0400	242772524	repfranklucas	Frank Lucas		Today I celebrated #NatLabDay with America’s leading lab directors, innovators, and researchers. @ENERGY’s 17 #NationalsLabs across the U.S. conduct research- from renewable energy to the origins of our universe- and advance the science and technology of the nation.  https://t.co/KEoEczVBkd	en	[{'screen_name': 'energy', 'name': 'u.s. department of energy', 'id': '166252256'}]	[]	['https://pbs.twimg.com/media/EARindxXYAAMP5f.jpg']	1	2	5	['natlabday', 'nationalslabs']	[]	https://twitter.com/RepFrankLucas/status/1154155838220709888	False		1	https://pbs.twimg.com/media/EARindxXYAAMP5f.jpg							[]				
1154122831623442433	1154122831623442433	2019-07-24 16:15:00 EDT	2019-07-24	16:15:00	-0400	242772524	repfranklucas	Frank Lucas		Thankful to the members of Oklahoma @farmcredit who visited with me to discuss the importance of Oklahoma agriculture and the various industries that are the backbone of so many rural communities across my district.  https://t.co/qgwuC15VV6	en	[{'screen_name': 'farmcredit', 'name': 'farm credit system', 'id': '15287435'}]	[]	['https://pbs.twimg.com/media/EAQ5tCvWkAEhEhe.jpg']	1	1	8	[]	[]	https://twitter.com/RepFrankLucas/status/1154122831623442433	False		1	https://pbs.twimg.com/media/EAQ5tCvWkAEhEhe.jpg							[]				
1154104505241395200	1154104505241395200	2019-07-24 15:02:10 EDT	2019-07-24	15:02:10	-0400	242772524	repfranklucas	Frank Lucas		Women like Dorothy Vaughan, Mary Jackson, Katherine Johnson, &amp; Dr. Christine Darden paved the way for women in STEM careers. Thanks to the @girlscouts’ new Space Science badges, in partnership with @SETIInstitute, we are inspiring generations of female astronauts and scientists.  https://t.co/IVCgkAIJlB	en	[{'screen_name': 'girlscouts', 'name': 'girl scouts', 'id': '103018203'}, {'screen_name': 'setiinstitute', 'name': 'the seti institute', 'id': '34554134'}]	[]	['https://pbs.twimg.com/media/EAQz7bsXsAEAd8P.jpg']	1	7	42	[]	[]	https://twitter.com/RepFrankLucas/status/1154104505241395200	False		1	https://pbs.twimg.com/media/EAQz7bsXsAEAd8P.jpg							[]				
1154013363388788737	1154013363388788737	2019-07-24 09:00:01 EDT	2019-07-24	09:00:01	-0400	242772524	repfranklucas	Frank Lucas		Great news! I’m delighted to learn that @TysonFoods is expanding their growth in @CityofEnid. Home to a hard working and well equipped workforce, our community is a bright example of why it’s great to do business in Oklahoma.   https://t.co/yPpPKJmKYL	en	[{'screen_name': 'tysonfoods', 'name': 'tyson foods', 'id': '15836048'}, {'screen_name': 'cityofenid', 'name': 'city of enid, ok', 'id': '50406557'}]	['https://www.enidnews.com/news/tyson-foods-to-reopen-pine-st-facility-expand-workforce/article_ddff6b20-ad80-11e9-9ff2-eb65a5c42309.html']	[]	1	1	7	[]	[]	https://twitter.com/RepFrankLucas/status/1154013363388788737	False		0								[]				
1153998263734984706	1153998263734984706	2019-07-24 08:00:00 EDT	2019-07-24	08:00:00	-0400	242772524	repfranklucas	Frank Lucas		Yesterday @oksde announced the 2020 OK Teacher of the Year finalists! This year the Third District is home to two of those finalists- Debbie Carlisle of @CPSRedTornadoes and Patricia Lightfoot of Weatherford Middle School. Congratulations!	en	[{'screen_name': 'oksde', 'name': 'ok state dept of ed', 'id': '123944252'}, {'screen_name': 'cpsredtornadoes', 'name': 'clinton public schools', 'id': '823453777'}]	[]	[]	1	1	6	[]	[]	https://twitter.com/RepFrankLucas/status/1153998263734984706	False	https://twitter.com/oksde/status/1153664584735186945	0								[]				
1153823056344698882	1153815498691244033	2019-07-23 20:23:48 EDT	2019-07-23	20:23:48	-0400	242772524	repfranklucas	Frank Lucas		I want to thank all my colleagues on the Committee for their leadership in developing strong, commonsense policies. Through our work, we can continue to advance American science by supporting research and innovative technologies.   READ MORE HERE⬇️  https://t.co/Hodrj670zU	en	[]	['https://republicans-science.house.gov/news/press-releases/bipartisan-science-committee-bills-stem-energy-research-and-more-pass-house']	[]	1	1	4	[]	[]	https://twitter.com/RepFrankLucas/status/1153823056344698882	False		0								[]				
1153823051714191361	1153815498691244033	2019-07-23 20:23:47 EDT	2019-07-23	20:23:47	-0400	242772524	repfranklucas	Frank Lucas		Our nation's opioid epidemic knows no economic, societal, ethnic, or political boundaries. H.R. 3153- the EFFORT Act, identifies current gaps that exist in research on the prevention &amp; treatment of opioid addiction &amp; authorizes the @NSF to support research grants in these areas.  https://t.co/B0qJxareQr	en	[{'screen_name': 'nsf', 'name': 'national science foundation', 'id': '16245822'}]	[]	[]	1	1	5	[]	[]	https://twitter.com/RepFrankLucas/status/1153823051714191361	False		1	https://pbs.twimg.com/ext_tw_video_thumb/1153822973523947521/pu/img/VylJt46VcIThNfJF.jpg							[]				
1153822967328956418	1153815498691244033	2019-07-23 20:23:27 EDT	2019-07-23	20:23:27	-0400	242772524	repfranklucas	Frank Lucas		Our nation's veterans deserve the best care we can provide. H.R. 617 authorizes critical programs between @ENERGY &amp; @DeptVetAffairs to better serve our veterans while advancing our technological capabilities.   I applaud @RepRalphNorman for his leadership addressing this issue.  https://t.co/hyK7r1qiCF	en	[{'screen_name': 'energy', 'name': 'u.s. department of energy', 'id': '166252256'}, {'screen_name': 'deptvetaffairs', 'name': 'veterans affairs', 'id': '78408666'}, {'screen_name': 'repralphnorman', 'name': 'rep. ralph norman', 'id': '880480631108644864'}]	[]	[]	1	1	5	[]	[]	https://twitter.com/RepFrankLucas/status/1153822967328956418	False		1	https://pbs.twimg.com/ext_tw_video_thumb/1153822908977831939/pu/img/drkz2HfxkaBvPkTy.jpg							[]				
1153819964664508418	1153815498691244033	2019-07-23 20:11:31 EDT	2019-07-23	20:11:31	-0400	242772524	repfranklucas	Frank Lucas		Engaging women in STEM studies is essential to American competitiveness. Unfortunately, too many women have been driven out of STEM careers because of harassment &amp; abuse. As Ranking Member, I'm proud to cosponsor &amp; support H.R. 36- the Combating Sexual Harassment in Science Act.  https://t.co/uMgmwi6hKD	en	[]	[]	[]	2	0	3	[]	[]	https://twitter.com/RepFrankLucas/status/1153819964664508418	False		1	https://pbs.twimg.com/ext_tw_video_thumb/1153819793071284225/pu/img/LBTkrxO2v638nKzc.jpg							[]				
1153815894222503937	1153815498691244033	2019-07-23 19:55:20 EDT	2019-07-23	19:55:20	-0400	242772524	repfranklucas	Frank Lucas		In Oklahoma, agriculture is the single largest consumer of water. It also contributes indirectly to the energy sector through the production of biofuels. H.R. 34 prioritizes research and encourages the development of innovative technologies between water and energy systems.  https://t.co/bFNjehT2JK	en	[]	[]	[]	1	0	3	[]	[]	https://twitter.com/RepFrankLucas/status/1153815894222503937	False		1	https://pbs.twimg.com/ext_tw_video_thumb/1153815500855500800/pu/img/StCp6Zl-7asy9Vp7.jpg							[]				
1153815498691244033	1153815498691244033	2019-07-23 19:53:46 EDT	2019-07-23	19:53:46	-0400	242772524	repfranklucas	Frank Lucas		Today, the House passed 7 bipartisan @housesciencegop bills.  From expanding research on the relationship between energy &amp; water systems to supporting STEM education &amp; combating sexual harassment in the sciences, these bills represent a broad range of the Committee's priorities.	en	[{'screen_name': 'housesciencegop', 'name': 'sci, space, & tech gop', 'id': '23103488'}]	[]	[]	2	0	6	[]	[]	https://twitter.com/RepFrankLucas/status/1153815498691244033	False		0								[]				
1153766863194722304	1153766863194722304	2019-07-23 16:40:30 EDT	2019-07-23	16:40:30	-0400	242772524	repfranklucas	Frank Lucas		Today I welcomed @OKFFA’s State President and Central Region VP, Drew and Emily, to the nation’s capital. The future of Oklahoma agriculture is in good hands with leaders like Drew and Emily.  https://t.co/FA44PR0isC	en	[{'screen_name': 'okffa', 'name': 'oklahoma ffa', 'id': '478923759'}]	[]	['https://pbs.twimg.com/media/EAMA2GxW4AAPXuc.jpg']	0	0	12	[]	[]	https://twitter.com/RepFrankLucas/status/1153766863194722304	False		1	https://pbs.twimg.com/media/EAMA2GxW4AAPXuc.jpg							[]				
1153708910060199937	1153708910060199937	2019-07-23 12:50:13 EDT	2019-07-23	12:50:13	-0400	242772524	repfranklucas	Frank Lucas		Business leaders from across the U.S. are urging Congress to pass #USMCA- including @ArdmoreChamber, @EdmondChamber, @okcchamber, @OklahomaRetail, @okstatechamber, Blackwell Industrial Authority.  The #CostOfDelay is adding up. It's time to pass #USMCAnow!  https://t.co/3gpWQBjEmt	en	[{'screen_name': 'ardmorechamber', 'name': 'ardmore chamber', 'id': '342120777'}, {'screen_name': 'edmondchamber', 'name': 'edmond chamber', 'id': '22799794'}, {'screen_name': 'okcchamber', 'name': 'greater okc chamber', 'id': '16583493'}, {'screen_name': 'oklahomaretail', 'name': 'oklahoma retail', 'id': '3392965239'}, {'screen_name': 'okstatechamber', 'name': 'state chamber of oklahoma', 'id': '19734708'}]	['https://www.uschamber.com/letters-congress/coalition-letter-the-usmca']	[]	32	115	615	['usmca', 'costofdelay', 'usmcanow']	[]	https://twitter.com/RepFrankLucas/status/1153708910060199937	False		0								[]				
1152652505014317059	1152652505014317059	2019-07-20 14:52:27 EDT	2019-07-20	14:52:27	-0400	242772524	repfranklucas	Frank Lucas		50 years ago, families across the globe huddled to witness Neil Armstrong &amp; Buzz Aldrin’s historic “leap”. As we celebrate #Apollo50th, we are reminded of the American innovation that led to mankind’s first lunar landing but also look forward to returning to continue the journey.  https://t.co/z4DNnV1UTj	en	[]	[]	['https://pbs.twimg.com/media/D_8LN-7WsAElwWj.jpg']	2	1	10	['apollo50th']	[]	https://twitter.com/RepFrankLucas/status/1152652505014317059	False		1	https://pbs.twimg.com/media/D_8LN-7WsAElwWj.jpg							[]				
