id	conversation_id	created_at	date	time	timezone	user_id	username	name	place	tweet	language	mentions	urls	photos	replies_count	retweets_count	likes_count	hashtags	cashtags	link	retweet	quote_url	video	thumbnail	near	geo	source	user_rt_id	user_rt	retweet_id	reply_to	retweet_date	translate	trans_src	trans_dest
1362843134091214850	1362843134091214850	2021-02-19 14:14:58 EST	2021-02-19	14:14:58	-0400	1343597700542038017	repnancymace	Rep. Nancy Mace		Thank you @BeaufortRegCoC &amp; its Military Enhancement Committee for their support on our work to keep Parris Island open for the next generation of brave marines.   Parris Island impacts so many lives in the Lowcountry &amp; is vital to our national security.  https://t.co/bVZdomMNGm  https://t.co/K6563Mvzjb	en	[{'screen_name': 'beaufortregcoc', 'name': 'beaufort reg. coc', 'id': '30711276'}]	['https://bit.ly/2NpwGFM']	['https://pbs.twimg.com/media/EunKlbAXIAEwkgy.jpg']	12	6	45	[]	[]	https://twitter.com/RepNancyMace/status/1362843134091214850	False		1	https://pbs.twimg.com/media/EunKlbAXIAEwkgy.jpg							[]				
1362801994738597893	1362801994738597893	2021-02-19 11:31:29 EST	2021-02-19	11:31:29	-0400	1343597700542038017	repnancymace	Rep. Nancy Mace		The Biden Administration is weakening enforcement &amp; security at the border. This risks a new wave of COVID-19 infections as Americans are struggling to beat the virus.  Today, I joined my colleagues on @GOPOversight calling for transparency from @DHSGov.  https://t.co/ySBFAjvbvv  https://t.co/QWkohRXfNa	en	[{'screen_name': 'gopoversight', 'name': 'oversight committee republicans', 'id': '22508473'}, {'screen_name': 'dhsgov', 'name': 'homeland security', 'id': '15647676'}]	['https://fxn.ws/2ZzGIXi']	['https://pbs.twimg.com/media/EumlHePXAAo5hPD.png']	83	56	188	[]	[]	https://twitter.com/RepNancyMace/status/1362801994738597893	False		1	https://pbs.twimg.com/media/EumlHePXAAo5hPD.png							[]				
1362793754717995013	1362793754717995013	2021-02-19 10:58:45 EST	2021-02-19	10:58:45	-0400	1343597700542038017	repnancymace	Rep. Nancy Mace		The science is clear:    1) We CAN #ReopenSchools safely 2) School closures are harming the mental, physical, and emotional health of millions of kids   But the Biden Administration won't listen.    Share how this is impacting YOUR family HERE:  https://t.co/0LW9aK1LEa	en	[]	['https://bit.ly/2NBuJ97']	[]	120	84	274	['reopenschools']	[]	https://twitter.com/RepNancyMace/status/1362793754717995013	False	https://twitter.com/SteveScalise/status/1362523470911963140	0								[]				
1362520967621263360	1362520967621263360	2021-02-18 16:54:47 EST	2021-02-18	16:54:47	-0400	1343597700542038017	repnancymace	Rep. Nancy Mace		Great meeting with @CofCHsu, President of the College of Charleston! We discussed @CofC's amazing marine biology program on James Island &amp; their exciting new engineering program.   The Lowcountry is so fortunate to have a person like him leading this great school.  https://t.co/c1zazR4pWz	en	[{'screen_name': 'cofchsu', 'name': 'andrew t. hsu', 'id': '1128736230429155329'}, {'screen_name': 'cofc', 'name': 'college of charleston', 'id': '14586296'}]	[]	['https://pbs.twimg.com/media/EuilmOfWQAUlpH-.jpg']	6	7	76	[]	[]	https://twitter.com/RepNancyMace/status/1362520967621263360	False		1	https://pbs.twimg.com/media/EuilmOfWQAUlpH-.jpg							[]				
1362508912130416640	1362508912130416640	2021-02-18 16:06:53 EST	2021-02-18	16:06:53	-0400	1343597700542038017	repnancymace	Rep. Nancy Mace		Huge achievement for @NASA, our nation, &amp; humanity.  Since we first looked at the stars, we've wondered if someone, somewhere was looking back. @NASAPersevere is a chance to see if some form of life existed on Mars, a big step toward answering that question. #CountdownToMars 🇺🇸🚀	en	"[{'screen_name': 'nasa', 'name': 'nasa', 'id': '11348282'}, {'screen_name': 'nasapersevere', 'name': ""nasa's perseverance mars rover"", 'id': '1232783237623119872'}]"	[]	[]	8	11	78	['countdowntomars']	[]	https://twitter.com/RepNancyMace/status/1362508912130416640	False	https://twitter.com/NASA/status/1362507497450459138	0								[]				
1362500375815876608	1362462223814307847	2021-02-18 15:32:58 EST	2021-02-18	15:32:58	-0400	1343597700542038017	repnancymace	Rep. Nancy Mace		@MPSCChamber thank you for having me!	en	[]	[]	[]	2	0	4	[]	[]	https://twitter.com/RepNancyMace/status/1362500375815876608	False		0								[{'screen_name': 'MPSCChamber', 'name': 'Mount Pleasant Chamber', 'id': '271544356'}]				
1362454210743316482	1362454210743316482	2021-02-18 12:29:31 EST	2021-02-18	12:29:31	-0400	1343597700542038017	repnancymace	Rep. Nancy Mace		Democrats in Congress are willing to fund razor wire fencing around our nation’s Capitol, but when it comes to a wall at our southern border, it's a non-starter.  This makes zero sense.   Watch my interview w/ @DanaPerino &amp; @BillHemmer 📺  https://t.co/1Ebf0N2xzW	en	[{'screen_name': 'danaperino', 'name': 'dana perino', 'id': '27311044'}, {'screen_name': 'billhemmer', 'name': 'bill hemmer', 'id': '21010214'}]	[]	[]	98	72	204	[]	[]	https://twitter.com/RepNancyMace/status/1362454210743316482	False		1	https://pbs.twimg.com/media/Euho2pMXUAEagfG.jpg							[]				
1362139841971048453	1362139841971048453	2021-02-17 15:40:20 EST	2021-02-17	15:40:20	-0400	1343597700542038017	repnancymace	Rep. Nancy Mace		🤨 #ReopenSchoolsNow  https://t.co/VkkStJ5Fyx	und	[]	[]	[]	187	123	562	['reopenschoolsnow']	[]	https://twitter.com/RepNancyMace/status/1362139841971048453	False		1	https://pbs.twimg.com/ext_tw_video_thumb/1362139692787990530/pu/img/wWftILRg-Mv5QJ8f.jpg							[]				
1362125305503240198	1362125305503240198	2021-02-17 14:42:34 EST	2021-02-17	14:42:34	-0400	1343597700542038017	repnancymace	Rep. Nancy Mace		Had a great meeting with members of @HHIBChamber and Lowcountry business leaders like Steve Birdwell of @SeaPinesResort!   Discussed challenges facing our economy and how we get the Lowcountry back to work!  https://t.co/xoTD3RZxkS	en	[{'screen_name': 'hhibchamber', 'name': 'hhi-bluffton chamber', 'id': '78042370'}, {'screen_name': 'seapinesresort', 'name': 'the sea pines resort', 'id': '34935002'}]	[]	['https://pbs.twimg.com/media/Euc9vlJXEAEIrma.jpg', 'https://pbs.twimg.com/media/Euc9vlJXAAkAMoQ.jpg']	7	3	48	[]	[]	https://twitter.com/RepNancyMace/status/1362125305503240198	False		1	https://pbs.twimg.com/media/Euc9vlJXEAEIrma.jpg							[]				
1362095298571620354	1362095298571620354	2021-02-17 12:43:20 EST	2021-02-17	12:43:20	-0400	1343597700542038017	repnancymace	Rep. Nancy Mace		Rush Limbaugh paved the way for countless conservative voices who otherwise may never have been heard, while working tirelessly to help others in their fight against cancer.  We lost an absolute titan today. My heart is with Rush’s family during this time.  https://t.co/JRanabc6nh	en	[]	[]	['https://pbs.twimg.com/media/EuciclQWgAcoGX1.png']	120	48	378	[]	[]	https://twitter.com/RepNancyMace/status/1362095298571620354	False		1	https://pbs.twimg.com/media/EuciclQWgAcoGX1.png							[]				
1362085339880452100	1362085339880452100	2021-02-17 12:03:46 EST	2021-02-17	12:03:46	-0400	1343597700542038017	repnancymace	Rep. Nancy Mace		"Charleston is officially the #1 place to live for our veterans!  The Lowcountry has one of the highest income levels for vets &amp; is home to countless vet-owned businesses, which put us at the top of @NavyFederal's ""Best Cities After Service"" Survey.  https://t.co/RPSZT64dKh  https://t.co/TWycnyO3SH"	en	[{'screen_name': 'navyfederal', 'name': 'navy federal credit union', 'id': '145227381'}]	['https://nfcu.me/3pvChr4']	['https://pbs.twimg.com/media/EucZWlEXIAI9vK-.jpg']	9	9	52	[]	[]	https://twitter.com/RepNancyMace/status/1362085339880452100	False		1	https://pbs.twimg.com/media/EucZWlEXIAI9vK-.jpg							[]				
1362031299540758534	1362031299540758534	2021-02-17 08:29:01 EST	2021-02-17	08:29:01	-0400	1343597700542038017	repnancymace	Rep. Nancy Mace		Ash Wednesday is an opportunity to look toward our inner, spiritual commitment to God and to each other, putting the needs of others ahead of our own.    Happy Ash Wednesday to all who observe. #AshWednesday  https://t.co/dpfxENvVQ2	en	[]	[]	['https://pbs.twimg.com/media/EuboP3DXUAA5w6P.jpg']	9	20	142	['ashwednesday']	[]	https://twitter.com/RepNancyMace/status/1362031299540758534	False		1	https://pbs.twimg.com/media/EuboP3DXUAA5w6P.jpg							[]				
1361681422734544898	1361681422734544898	2021-02-16 09:18:44 EST	2021-02-16	09:18:44	-0400	1343597700542038017	repnancymace	Rep. Nancy Mace		Every day we learn more about the devastating impacts school closures are having on students. Our kids are losing a year+ of their lives at a critical time for development.  We can’t afford for this to continue. We CAN #ReopenSchools safely and we MUST.  https://t.co/fEOFW8svKB	en	[]	['https://bit.ly/3anTqP7']	[]	35	46	149	['reopenschools']	[]	https://twitter.com/RepNancyMace/status/1361681422734544898	False		0								[]				
1361412466933170187	1361412466933170187	2021-02-15 15:30:00 EST	2021-02-15	15:30:00	-0400	1343597700542038017	repnancymace	Rep. Nancy Mace		Nearly a million working moms quit their jobs due to school closures, dialing the clock back by decades on women’s workplace progress.  I'm introducing a bill to give tax credits to working families impacted by this issue. I hope both sides of the aisle join me. #ReopenSchools  https://t.co/9fyiAMNCLG	en	[]	[]	[]	48	32	205	['reopenschools']	[]	https://twitter.com/RepNancyMace/status/1361412466933170187	False		1	https://pbs.twimg.com/media/EuSrxRNXUAEj4N0.jpg							[]				
1361400765605109763	1361400765605109763	2021-02-15 14:43:30 EST	2021-02-15	14:43:30	-0400	1343597700542038017	repnancymace	Rep. Nancy Mace		The science is unequivocally clear: Schools are safe to reopen.   But instead of following the science, the Biden administration is caving to teachers’ unions. This is irresponsible &amp; unacceptable. #ReopenSchools  https://t.co/tFlkUW7xaq	en	[]	[]	[]	216	164	582	['reopenschools']	[]	https://twitter.com/RepNancyMace/status/1361400765605109763	False		1	https://pbs.twimg.com/media/EuSqFgEWQA4kri0.jpg							[]				
1361319855442382853	1361319855442382853	2021-02-15 09:22:00 EST	2021-02-15	09:22:00	-0400	1343597700542038017	repnancymace	Rep. Nancy Mace		Today we honor the Americans who stepped forward to lead our nation, through the good times and bad, during war and peace.    Happy Presidents' Day!  https://t.co/CVvcMyafsU	en	[]	[]	['https://pbs.twimg.com/media/EuDvgbUXUAEbnIG.jpg']	33	22	225	[]	[]	https://twitter.com/RepNancyMace/status/1361319855442382853	False		1	https://pbs.twimg.com/media/EuDvgbUXUAEbnIG.jpg							[]				
1361023606172614656	1361023606172614656	2021-02-14 13:44:48 EST	2021-02-14	13:44:48	-0400	1343597700542038017	repnancymace	Rep. Nancy Mace		On Friday, I sent a letter to @HenryMcMaster.   Thanks to him, 98% of federal COVID-19 relief will reach those in need by month’s end AND these resources won’t go to waste.  Thank you, Governor.  https://t.co/s7uFCCxWQZ	en	[{'screen_name': 'henrymcmaster', 'name': 'gov. henry mcmaster', 'id': '16335288'}]	['https://bit.ly/3b7oT7C']	[]	45	23	163	[]	[]	https://twitter.com/RepNancyMace/status/1361023606172614656	False		0								[]				
1360635933285109763	1360635933285109763	2021-02-13 12:04:20 EST	2021-02-13	12:04:20	-0400	1343597700542038017	repnancymace	Rep. Nancy Mace		The COVID-19 school closures are absolutely devastating students, and not just academically.  Our kids are suffering with mental, emotional, &amp; even physical health. I’m a mom, I know firsthand. We can stop it.   #ReopenSchools NOW.  https://t.co/LtKLPF67A8	en	[]	[]	[]	41	29	115	['reopenschools']	[]	https://twitter.com/RepNancyMace/status/1360635933285109763	False		1	https://pbs.twimg.com/media/EuH7ie1XUAcqdI_.jpg							[]				
1360630532002971653	1360630532002971653	2021-02-13 11:42:52 EST	2021-02-13	11:42:52	-0400	1343597700542038017	repnancymace	Rep. Nancy Mace		While we still have a ways to go, I’m pleased to see South Carolina’s COVID-19 rates have dropped significantly.   I will continue to work closely with our local officials to get vaccines distributed &amp; defeat this virus. 💪🏼   https://t.co/zyUZNEHy7Y	en	[]	['https://scdhec.gov/covid19']	[]	18	4	46	[]	[]	https://twitter.com/RepNancyMace/status/1360630532002971653	False		0								[]				
1360360025944973313	1360360025944973313	2021-02-12 17:47:59 EST	2021-02-12	17:47:59	-0400	1343597700542038017	repnancymace	Rep. Nancy Mace		Elected officials are eager to talk about how much was spent, but it's rare to find one who ensures our hard-earned money is ACTUALLY used to help those in need.   Thank you, @HenryMcMaster, for helping South Carolina combat COVID-19 &amp; being a good steward of taxpayer money.  https://t.co/sM4Cux28df	en	[{'screen_name': 'henrymcmaster', 'name': 'gov. henry mcmaster', 'id': '16335288'}]	[]	['https://pbs.twimg.com/media/EuD4DEgWQAY4puL.jpg']	40	18	78	[]	[]	https://twitter.com/RepNancyMace/status/1360360025944973313	False		1	https://pbs.twimg.com/media/EuD4DEgWQAY4puL.jpg							[]				
1360334410814545922	1360334410814545922	2021-02-12 16:06:11 EST	2021-02-12	16:06:11	-0400	1343597700542038017	repnancymace	Rep. Nancy Mace		.@POTUS' plan to reopen schools once a week isn't bold OR ambitious. It's unacceptable.  Our kids are suffering. We need to get them back in the classroom NOW.  Great to chat with @guypbenson about COVID-19 school closures, trauma &amp; more. Take a listen:  https://t.co/kLO9MosH2G	en	[{'screen_name': 'potus', 'name': 'president biden', 'id': '1349149096909668363'}, {'screen_name': 'guypbenson', 'name': 'guy benson', 'id': '16193222'}]	['https://bit.ly/3p9BTP2']	[]	53	37	180	[]	[]	https://twitter.com/RepNancyMace/status/1360334410814545922	False		0								[]				
1360327083738726401	1360327083738726401	2021-02-12 15:37:05 EST	2021-02-12	15:37:05	-0400	1343597700542038017	repnancymace	Rep. Nancy Mace		Chatted with @kelly_golden about the future of the Republican Party and took questions from voters in the Lowcountry! 📻 🎙️ LISTEN:  https://t.co/ERt4E88tCh	en	[{'screen_name': 'kelly_golden', 'name': 'kelly golden', 'id': '102825696'}]	['https://ihr.fm/2Oz3BrS']	[]	15	1	15	[]	[]	https://twitter.com/RepNancyMace/status/1360327083738726401	False		0								[]				
1360302904691810309	1360302904691810309	2021-02-12 14:01:00 EST	2021-02-12	14:01:00	-0400	1343597700542038017	repnancymace	Rep. Nancy Mace		If all of the science—including from the CDC &amp; the American Academy of Pediatrics—tells us schools are safe and keeping them shuttered is detrimental to our kids, then why are they still closed?  Enter: Teachers unions &amp; local school officials. READ:  https://t.co/TFPxQaluck	en	[]	['https://fxn.ws/3aZPkMj']	[]	60	28	186	[]	[]	https://twitter.com/RepNancyMace/status/1360302904691810309	False		0								[]				
1360254781302972416	1360254781302972416	2021-02-12 10:49:46 EST	2021-02-12	10:49:46	-0400	1343597700542038017	repnancymace	Rep. Nancy Mace		So great to sit down with you today, Mayor O’Neil! Look forward to working with you on behalf of the Lowcountry. #LowcountryFirst	en	[]	[]	[]	3	1	29	['lowcountryfirst']	[]	https://twitter.com/RepNancyMace/status/1360254781302972416	False	https://twitter.com/oneilpm1/status/1360238441829715976	0								[]				
1360247711283490817	1360247711283490817	2021-02-12 10:21:41 EST	2021-02-12	10:21:41	-0400	1343597700542038017	repnancymace	Rep. Nancy Mace		From securing victory in the Civil War to ending the scourge of slavery, Abraham Lincoln ensured our nation would remain the greatest experiment in human liberty.  Happy birthday, Mr. President.  https://t.co/iHlqNACd0I	en	[]	[]	['https://pbs.twimg.com/media/EuCSEoVXMAQdcq8.jpg']	26	11	96	[]	[]	https://twitter.com/RepNancyMace/status/1360247711283490817	False		1	https://pbs.twimg.com/media/EuCSEoVXMAQdcq8.jpg							[]				
1360224842012909571	1360224842012909571	2021-02-12 08:50:48 EST	2021-02-12	08:50:48	-0400	1343597700542038017	repnancymace	Rep. Nancy Mace		For months, care workers, medical experts &amp; journalists raised alarms about horrific COVID-19 death rates in NY nursing homes.   Instead of saving lives, @NYGovCuomo lied to cover his ass. He even got an Emmy for it.  Despicable. #ImpeachCuomo    https://t.co/qsvatOGXNH	en	[{'screen_name': 'nygovcuomo', 'name': 'andrew cuomo', 'id': '232268199'}]	['https://nypost.com/2021/02/11/cuomo-aide-admits-they-hid-nursing-home-data-from-feds/']	[]	50	49	145	['impeachcuomo']	[]	https://twitter.com/RepNancyMace/status/1360224842012909571	False		0								[]				
1360221065201483776	1360221065201483776	2021-02-12 08:35:48 EST	2021-02-12	08:35:48	-0400	1343597700542038017	repnancymace	Rep. Nancy Mace		When we first closed schools, we had no idea how it would affect kids. Now we do:  - 31% jump in teen mental health ER visits - 17 million kids risk going hungry - Academic failure rate up 600% - Countless dropouts  We CAN #ReopenSchools safely, &amp; we MUST.  https://t.co/eMwJZ5R2y3	en	[]	['https://fxn.ws/2OnXgiK']	[]	248	733	2238	['reopenschools']	[]	https://twitter.com/RepNancyMace/status/1360221065201483776	False		0								[]				
1359996920043872257	1359996920043872257	2021-02-11 17:45:07 EST	2021-02-11	17:45:07	-0400	1343597700542038017	repnancymace	Rep. Nancy Mace		This could not be more deserved 👏🏼💙  Proud to serve as the lead Republican alongside @RepCharlieCrist &amp; @repcleaver to introduce legislation doing just this.   https://t.co/O1ZptsV8rP	en	[{'screen_name': 'repcharliecrist', 'name': 'congressman charlie crist', 'id': '816030424778543104'}, {'screen_name': 'repcleaver', 'name': 'rep. emanuel cleaver', 'id': '163570705'}]	['https://nyti.ms/3aa6yY3']	[]	97	30	272	[]	[]	https://twitter.com/RepNancyMace/status/1359996920043872257	False		0								[]				
1359984806071828480	1359984806071828480	2021-02-11 16:56:59 EST	2021-02-11	16:56:59	-0400	1343597700542038017	repnancymace	Rep. Nancy Mace		Sat down with @dcexaminer's @ElishaKrauss this week to talk my first chaotic weeks in Congress, where the GOP goes from here, and why Members of Congress should have the means to defend themselves.  WATCH our full chat📺:  https://t.co/4fn8jUFGFd	en	[{'screen_name': 'dcexaminer', 'name': 'washington examiner', 'id': '18956073'}, {'screen_name': 'elishakrauss', 'name': 'elisha', 'id': '25526853'}]	['https://washex.am/2MTHdc4']	[]	34	11	61	[]	[]	https://twitter.com/RepNancyMace/status/1359984806071828480	False		0								[]				
1359956538304126982	1359947167385944065	2021-02-11 15:04:40 EST	2021-02-11	15:04:40	-0400	1343597700542038017	repnancymace	Rep. Nancy Mace		@PadraicCNN Source: Photoshop	en	[]	[]	[]	4	0	3	[]	[]	https://twitter.com/RepNancyMace/status/1359956538304126982	False		0								[]				
1359946107992875010	1359946107992875010	2021-02-11 14:23:13 EST	2021-02-11	14:23:13	-0400	1343597700542038017	repnancymace	Rep. Nancy Mace		Well, I looked up “whataboutism”!  https://t.co/9QUCRL6S8q	en	[]	[]	['https://pbs.twimg.com/media/Et9_xvDXYAAkuP8.jpg']	301	52	532	[]	[]	https://twitter.com/RepNancyMace/status/1359946107992875010	False		1	https://pbs.twimg.com/media/Et9_xvDXYAAkuP8.jpg							[]				
1359634653402050564	1359634653402050564	2021-02-10 17:45:36 EST	2021-02-10	17:45:36	-0400	1343597700542038017	repnancymace	Rep. Nancy Mace		Many rural communities don't have the cold facilities needed to store the COVID-19 vaccine. Or they don't have the broadband access to schedule a vaccination appointment online.  I'm glad @TransportDems Acting-Chair @RepAnthonyBrown agreed to work together to solve these issues.  https://t.co/suTyhh4GWK	en	[{'screen_name': 'transportdems', 'name': 'committee on transportation and infrastructure', 'id': '21684013'}, {'screen_name': 'repanthonybrown', 'name': 'anthony brown', 'id': '823552974253342721'}]	[]	[]	102	22	187	[]	[]	https://twitter.com/RepNancyMace/status/1359634653402050564	False		1	https://pbs.twimg.com/media/Et5kfJxXUAs2mr8.jpg							[]				
1359586420491489280	1359586420491489280	2021-02-10 14:33:57 EST	2021-02-10	14:33:57	-0400	1343597700542038017	repnancymace	Rep. Nancy Mace		Particularly for SINGLE working parents, like myself.  Parents should be making this decision. Not the government.	en	[]	[]	[]	147	127	803	[]	[]	https://twitter.com/RepNancyMace/status/1359586420491489280	False	https://twitter.com/MarkBednar/status/1359561783124647936	0								[]				
1359556110232018944	1359556110232018944	2021-02-10 12:33:30 EST	2021-02-10	12:33:30	-0400	1343597700542038017	repnancymace	Rep. Nancy Mace		Dems want $350B for states to cover pandemic 'revenue shortfalls'.   They ALREADY sent $150B, which hasn't been spent.  States like SC balanced budgets AND paid for COVID-19 relief. They shouldn't pay for states who didn't.  Expect amendments from me, @GOPoversight.	en	[{'screen_name': 'gopoversight', 'name': 'oversight committee republicans', 'id': '22508473'}]	[]	[]	177	258	1178	[]	[]	https://twitter.com/RepNancyMace/status/1359556110232018944	False		0								[]				
1359548452338880517	1359548452338880517	2021-02-10 12:03:04 EST	2021-02-10	12:03:04	-0400	1343597700542038017	repnancymace	Rep. Nancy Mace		Um, YES @Bethvanduyne. But only if I get to be the cat... 😝😻	en	[{'screen_name': 'bethvanduyne', 'name': 'beth van duyne', 'id': '489856457'}]	[]	[]	14	11	106	[]	[]	https://twitter.com/RepNancyMace/status/1359548452338880517	False	https://twitter.com/Bethvanduyne/status/1359240501933846529	0								[]				
1359545125832130560	1359545125832130560	2021-02-10 11:49:51 EST	2021-02-10	11:49:51	-0400	1343597700542038017	repnancymace	Rep. Nancy Mace		Republican women shattered glass ceilings this year, but we still have a ways to go. If we want our party to grow, the faces of our party need to reflect the faces of America.  Great chatting with @washingtonpost’s @kkOttesen about this &amp; more!   https://t.co/AqT9NW3Wky	en	[{'screen_name': 'washingtonpost', 'name': 'the washington post', 'id': '2467791'}, {'screen_name': 'kkottesen', 'name': 'kk ottesen', 'id': '501214949'}]	['https://www.washingtonpost.com/lifestyle/magazine/republican-rep-nancy-mace-on-the-capitol-insurrection-we-need-to-rebuild-our-party/2021/02/04/ee6691fa-446a-11eb-975c-d17b8815a66d_story.html']	[]	43	19	120	[]	[]	https://twitter.com/RepNancyMace/status/1359545125832130560	False		0								[]				
1359236448650727425	1359236448650727425	2021-02-09 15:23:17 EST	2021-02-09	15:23:17	-0400	1343597700542038017	repnancymace	Rep. Nancy Mace		Toured @ProPacInc’s facility in Charleston! They've built a business helping people prepare for the worst here in the Lowcountry.  They've helped private companies &amp; govt agencies w/ disaster prep &amp; PPE for 3 decades. Now they're helping our community safely combat COVID-19.  https://t.co/C8mZaam408	en	[{'screen_name': 'propacinc', 'name': 'propac', 'id': '100024423'}]	[]	['https://pbs.twimg.com/media/Etz6V1MXYAURLQL.jpg', 'https://pbs.twimg.com/media/Etz6V3IXEAAMmui.jpg', 'https://pbs.twimg.com/media/Etz6V71WgAMkzSY.jpg']	35	15	128	[]	[]	https://twitter.com/RepNancyMace/status/1359236448650727425	False		1	https://pbs.twimg.com/media/Etz6V1MXYAURLQL.jpg							[]				
1359197381611425792	1359197381611425792	2021-02-09 12:48:03 EST	2021-02-09	12:48:03	-0400	1343597700542038017	repnancymace	Rep. Nancy Mace		Just got word from @DeptofDefense: Naval Support Activity Charleston received a 100% accuracy rating for its recent financial audit!  Thank you to Capt. Kevin M. Byrne &amp; his team for being good stewards of taxpayers' hard-earned money!	en	[{'screen_name': 'deptofdefense', 'name': 'department of defense 🇺🇸', 'id': '66369181'}]	[]	[]	25	11	134	[]	[]	https://twitter.com/RepNancyMace/status/1359197381611425792	False		0								[]				
1359179725818707976	1359179725818707976	2021-02-09 11:37:53 EST	2021-02-09	11:37:53	-0400	1343597700542038017	repnancymace	Rep. Nancy Mace		Congress COULD be working to get our kids back in school, speeding up COVID-19 vaccinations, or helping Americans struggling to make ends meet.   But Senate Dems are putting that on hold to impeach a president...who is no longer president.   What are we doing here? 🤦🏻‍♀️	en	[]	[]	[]	2637	1237	4604	[]	[]	https://twitter.com/RepNancyMace/status/1359179725818707976	False		0								[]				
1358838464444305411	1358838464444305411	2021-02-08 13:01:50 EST	2021-02-08	13:01:50	-0400	1343597700542038017	repnancymace	Rep. Nancy Mace		If Speaker Pelosi bypassed her own metal detectors to get onto the House floor, then she needs to pay up.  Democrats may operate under a “rules for thee but not for me” attitude, but the American people don't and neither should Congress.  https://t.co/kRRY6fjjSy	en	[]	[]	[]	162	112	523	[]	[]	https://twitter.com/RepNancyMace/status/1358838464444305411	False		1	https://pbs.twimg.com/ext_tw_video_thumb/1358838296936386560/pu/img/lLv_EOXJSQOrkVTe.jpg							[]				
1358824680438824960	1358824680438824960	2021-02-08 12:07:04 EST	2021-02-08	12:07:04	-0400	1343597700542038017	repnancymace	Rep. Nancy Mace		No one could be more deserving of the Order of the Palmetto than Henry Darby.   So many educators have gone above and beyond to help kids in need during this pandemic. Mr. Darby’s actions represent their very best. #LowcountryFirst  https://t.co/XTCimqHmF1	en	[]	['https://bit.ly/36RkC72']	[]	16	13	128	['lowcountryfirst']	[]	https://twitter.com/RepNancyMace/status/1358824680438824960	False		0								[]				
