id	conversation_id	created_at	date	time	timezone	user_id	username	name	place	tweet	language	mentions	urls	photos	replies_count	retweets_count	likes_count	hashtags	cashtags	link	retweet	quote_url	video	thumbnail	near	geo	source	user_rt_id	user_rt	retweet_id	reply_to	retweet_date	translate	trans_src	trans_dest
1375114808870252555	1375114808870252555	2021-03-25 11:58:13 EDT	2021-03-25	11:58:13	-0400	1343597700542038017	repnancymace	Rep. Nancy Mace		American service members have jumped on grenades, pulled dozens out of the line of fire, or stood alone against the enemy. All to protect their brothers &amp; sisters-in-arms &amp; our nation.   Today, we salute those brave patriots. #MedalOfHonor #MedalOfHonorDay  https://t.co/ttkMwbzDM8	en	[]	[]	['https://pbs.twimg.com/media/ExVjfGxWUAU5GSi.jpg']	8	16	73	['medalofhonor', 'medalofhonorday']	[]	https://twitter.com/RepNancyMace/status/1375114808870252555	False		1	https://pbs.twimg.com/media/ExVjfGxWUAU5GSi.jpg							[]				
1374843678171205635	1374843678171205635	2021-03-24 18:00:50 EDT	2021-03-24	18:00:50	-0400	1343597700542038017	repnancymace	Rep. Nancy Mace		The votes in @RepMMM’s race were counted, recounted, and in some cases, counted a THIRD time.  Instead of bringing her concerns to court, Rita Hart went straight to Speaker Pelosi in an attempt to get DC politicians to elect her because Iowa voters rejected her. #IA02  https://t.co/h1QJ0N2NlS	en	[{'screen_name': 'repmmm', 'name': 'rep. mariannette miller-meeks, m.d.', 'id': '1345807954604412929'}]	[]	[]	25	24	100	['ia02']	[]	https://twitter.com/RepNancyMace/status/1374843678171205635	False		1	https://pbs.twimg.com/media/ExRtCTFWQAQeYqc.jpg							[]				
1374820816269938688	1374820816269938688	2021-03-24 16:30:00 EDT	2021-03-24	16:30:00	-0400	1343597700542038017	repnancymace	Rep. Nancy Mace		Speaker Pelosi’s hypocrisy knows no bounds. She’s trying to overturn a state-certified, free and fair election while simultaneously claiming voter fraud doesn’t exist nationwide.  The voters of IA-02 have spoken: @RepMMM is their duly-elected representative. #IA02  https://t.co/xGAdkw8CWv	en	[{'screen_name': 'repmmm', 'name': 'rep. mariannette miller-meeks, m.d.', 'id': '1345807954604412929'}]	[]	[]	27	20	82	['ia02']	[]	https://twitter.com/RepNancyMace/status/1374820816269938688	False		1	https://pbs.twimg.com/ext_tw_video_thumb/1374815990949773312/pu/img/Y80s8Cpv_5f8X8ed.jpg							[]				
1374808268128796681	1374808268128796681	2021-03-24 15:40:08 EDT	2021-03-24	15:40:08	-0400	1343597700542038017	repnancymace	Rep. Nancy Mace		In today's hyper-partisan world, we can at least all agree #TeamUSA️ is the greatest! ⚽️🇺🇸  https://t.co/p4qLs4eBlu	en	[]	[]	[]	12	4	65	['teamusa️']	[]	https://twitter.com/RepNancyMace/status/1374808268128796681	False		1	https://pbs.twimg.com/media/ExRM1MVW8AIDNe2.jpg							[]				
1374743065718579207	1374743065718579207	2021-03-24 11:21:03 EDT	2021-03-24	11:21:03	-0400	1343597700542038017	repnancymace	Rep. Nancy Mace		Two people who have the same education and perform the same job should receive the same pay regardless of gender. Period.  But Democrats misrepresent the facts on equal pay. The gender pay gap is often due to women trading higher pay for greater flexibility, not discrimination.  https://t.co/ZxhHpKBNQp	en	[]	[]	[]	55	39	168	[]	[]	https://twitter.com/RepNancyMace/status/1374743065718579207	False		1	https://pbs.twimg.com/amplify_video_thumb/1374742747681337344/img/lKixkhsVlccAwVE-.jpg							[]				
1374446579348729859	1374446579348729859	2021-03-23 15:42:55 EDT	2021-03-23	15:42:55	-0400	1343597700542038017	repnancymace	Rep. Nancy Mace		Animal rights groups in SC are offering $5,000 for info leading to the arrest of those who subject innocent animals to the horror of cockfighting.  Cockfighting isn't just cruel and barbaric. It's a CRIME.  https://t.co/Wa6vhDiTdm	en	[]	['https://bit.ly/3vQG1rH']	[]	13	17	37	[]	[]	https://twitter.com/RepNancyMace/status/1374446579348729859	False		0								[]				
1374421183333068800	1374421183333068800	2021-03-23 14:02:00 EDT	2021-03-23	14:02:00	-0400	1343597700542038017	repnancymace	Rep. Nancy Mace		Speaker Pelosi opposed unconstitutional efforts in Congress to overturn state-certified presidential votes, as I did.  Now, she thinks Congress can overturn @RepMMM's state-certified election? The hypocrisy is shameless.  Even Dems oppose this power grab.  https://t.co/R7ovV48cO7  https://t.co/47y8JDDRjd	en	[{'screen_name': 'repmmm', 'name': 'rep. mariannette miller-meeks, m.d.', 'id': '1345807954604412929'}]	['https://bit.ly/2NI9XVE']	['https://pbs.twimg.com/media/ExLUv-VU8AAOJ7Z.jpg']	19	16	43	[]	[]	https://twitter.com/RepNancyMace/status/1374421183333068800	False		1	https://pbs.twimg.com/media/ExLUv-VU8AAOJ7Z.jpg							[]				
1374389929807998982	1374389929807998982	2021-03-23 11:57:48 EDT	2021-03-23	11:57:48	-0400	1343597700542038017	repnancymace	Rep. Nancy Mace		Congress shouldn't overturn state-certified elections. PERIOD.  Nancy Pelosi's understanding of this seems to depend on whether her political power is at stake.  The voters of IA-02 have spoken. @RepMMM is the duly-elected Member from Iowa's 2nd District.  https://t.co/rL4FGl2vL3  https://t.co/2DzpsLT0t4	en	[{'screen_name': 'repmmm', 'name': 'rep. mariannette miller-meeks, m.d.', 'id': '1345807954604412929'}]	['https://bit.ly/31cDeuJ']	['https://pbs.twimg.com/media/ExLQHj0VkAYke2u.jpg', 'https://pbs.twimg.com/media/ExLQLVlVIAArjKH.jpg']	20	20	133	[]	[]	https://twitter.com/RepNancyMace/status/1374389929807998982	False		1	https://pbs.twimg.com/media/ExLQHj0VkAYke2u.jpg							[]				
1374354719003582467	1374354719003582467	2021-03-23 09:37:53 EDT	2021-03-23	09:37:53	-0400	1343597700542038017	repnancymace	Rep. Nancy Mace		🚨 VACCINE ALERT 🚨  The Ralph H. Johnson VA Medical Center will hold 2 walk-in vaccine clinics for enrolled veterans THIS WEEK!  - Wednesday, March 24: 8 AM - 2 PM - Thursday, March 25: 3 PM - 6 PM  Go to 6450 Rivers Ave., N. Charleston &amp; get vaccinated!  https://t.co/0UBCdCNkMi	en	[]	['https://bit.ly/3d2Txjc']	[]	2	9	18	[]	[]	https://twitter.com/RepNancyMace/status/1374354719003582467	False		0								[]				
1374038632047202310	1374038632047202310	2021-03-22 12:41:52 EDT	2021-03-22	12:41:52	-0400	1343597700542038017	repnancymace	Rep. Nancy Mace		We understand people, not politicians, should be in control of their money, their work, and their lives. With this message, we have an opportunity to grow our party to new heights.   Read more with @RiponSociety:  https://t.co/YZ7IQBSZdw	en	[{'screen_name': 'riponsociety', 'name': 'the ripon society', 'id': '18981785'}]	['https://riponsociety.org/article/we-sit-at-a-crossroads/']	[]	28	5	36	[]	[]	https://twitter.com/RepNancyMace/status/1374038632047202310	False		0								[]				
1374002103186825223	1374002103186825223	2021-03-22 10:16:43 EDT	2021-03-22	10:16:43	-0400	1343597700542038017	repnancymace	Rep. Nancy Mace		Joined SC @quail4ever to talk about my efforts to conserve and defend the natural beauty of the Lowcountry.  This group has done an incredible job ensuring the Lowcountry remains the best place in the South to work, live, play, and recreate!  https://t.co/qluyNSftyq	en	[{'screen_name': 'quail4ever', 'name': 'quail forever', 'id': '22931957'}]	[]	['https://pbs.twimg.com/media/ExFvoRTWUAIakRm.jpg', 'https://pbs.twimg.com/media/ExFvoZMXIAQGaPB.jpg']	7	5	73	[]	[]	https://twitter.com/RepNancyMace/status/1374002103186825223	False		1	https://pbs.twimg.com/media/ExFvoRTWUAIakRm.jpg							[]				
1373014593115656200	1373014593115656200	2021-03-19 16:52:43 EDT	2021-03-19	16:52:43	-0400	1343597700542038017	repnancymace	Rep. Nancy Mace		School closures are devastating our kids and our communities. The science says we can safely reopen schools.   This can’t wait another day, week, or month. #ReopenSchoolsNow  https://t.co/bSXImS5mxq	en	[]	[]	[]	26	12	48	['reopenschoolsnow']	[]	https://twitter.com/RepNancyMace/status/1373014593115656200	False		1	https://pbs.twimg.com/ext_tw_video_thumb/1373014490992762888/pu/img/Cp9RDuhTpGDvZ60B.jpg							[]				
1372981931906842624	1372981931906842624	2021-03-19 14:42:55 EDT	2021-03-19	14:42:55	-0400	1343597700542038017	repnancymace	Rep. Nancy Mace		President Biden shouldn’t try to ram through massive tax spending increases that crush #AmericanWorkers.  I stand opposed. He should be forced to make his case &amp; allow Republicans to offer amendments.  Nancy Pelosi’s closed-door jamming of their big government agenda must end.  https://t.co/7NfGYtz3wk	en	[]	[]	[]	47	15	67	['americanworkers']	[]	https://twitter.com/RepNancyMace/status/1372981931906842624	False		1	https://pbs.twimg.com/media/Ew3PybMXMAIp8UI.jpg							[]				
1372966591487430667	1372966591487430667	2021-03-19 13:41:58 EDT	2021-03-19	13:41:58	-0400	1343597700542038017	repnancymace	Rep. Nancy Mace		Came back from votes to this sweet scene in my office. 🥰 🐶  https://t.co/FDmZeLthQE	en	[]	[]	['https://pbs.twimg.com/media/Ew3B1l9XMAkb9u3.jpg']	13	4	298	[]	[]	https://twitter.com/RepNancyMace/status/1372966591487430667	False		1	https://pbs.twimg.com/media/Ew3B1l9XMAkb9u3.jpg							[]				
1372953988006559744	1372953988006559744	2021-03-19 12:51:53 EDT	2021-03-19	12:51:53	-0400	1343597700542038017	repnancymace	Rep. Nancy Mace		🚨 VACCINE ALERT 🚨   ALL veterans who receive health care from the VA, regardless of age, can register for a vaccination appointment at Ralph H. Johnson VA Medical Center in Charleston!   Call 843-789-6900 to schedule an appointment! Go to  https://t.co/YTwaSlCRfG to learn more.	en	[]	['https://bit.ly/38Wt8m9']	[]	1	3	22	[]	[]	https://twitter.com/RepNancyMace/status/1372953988006559744	False		0								[]				
1372939034771791880	1372939034771791880	2021-03-19 11:52:28 EDT	2021-03-19	11:52:28	-0400	1343597700542038017	repnancymace	Rep. Nancy Mace		Our caseworking staff has worked tirelessly to meet the needs of our constituents back in the Lowcountry.  We've recovered millions for constituents from government agencies and resolved 650+ cases.  Huge thanks to @ABCNews4 for bringing several of these cases to our attention!  https://t.co/aX54shHBX2	en	[{'screen_name': 'abcnews4', 'name': 'abc news 4', 'id': '15109904'}]	[]	[]	5	4	13	[]	[]	https://twitter.com/RepNancyMace/status/1372939034771791880	False		1	https://pbs.twimg.com/ext_tw_video_thumb/1372938841498222596/pu/img/rEonvrIjqbCp3CEU.jpg							[]				
1372917560975491073	1372917560975491073	2021-03-19 10:27:08 EDT	2021-03-19	10:27:08	-0400	1343597700542038017	repnancymace	Rep. Nancy Mace		Number 1 in our hearts, number 7 on @CondeNast's best cities in the world list, Charleston is doing big things! 💕🌴  https://t.co/uTBAQVpoMh	en	[{'screen_name': 'condenast', 'name': 'condé nast', 'id': '266187076'}]	['https://www.cntraveller.com/gallery/best-cities-in-the-world']	[]	4	3	42	[]	[]	https://twitter.com/RepNancyMace/status/1372917560975491073	False		0								[]				
1372650303691100165	1372650303691100165	2021-03-18 16:45:09 EDT	2021-03-18	16:45:09	-0400	1343597700542038017	repnancymace	Rep. Nancy Mace		Brad reached out to my office after getting the run around from the federal government about assisted living care for his mother, a Korean War veteran.   Our caseworkers were able to help get this resolved within days. #LowcountryFirst  https://t.co/S0x4TA1sib  https://t.co/pUuhQ2NDPz	en	[]	['https://bit.ly/3bZkDbX']	['https://pbs.twimg.com/media/EwyiLTvWUAACcue.png']	5	4	28	['lowcountryfirst']	[]	https://twitter.com/RepNancyMace/status/1372650303691100165	False		1	https://pbs.twimg.com/media/EwyiLTvWUAACcue.png							[]				
1372636341083770887	1372636341083770887	2021-03-18 15:49:40 EDT	2021-03-18	15:49:40	-0400	1343597700542038017	repnancymace	Rep. Nancy Mace		Robin waited for months for her Social Security benefits. She couldn't get anyone to help her despite repeated phone calls.   She reached out to my office and the very next day, she got a call from Social Security &amp; soon after got her benefits! #LowcountryFirst  https://t.co/eo4Kb6vLVU	en	[]	[]	['https://pbs.twimg.com/media/EwyVej8WUAQU60u.png']	5	2	52	['lowcountryfirst']	[]	https://twitter.com/RepNancyMace/status/1372636341083770887	False		1	https://pbs.twimg.com/media/EwyVej8WUAQU60u.png							[]				
1372624343667240965	1372624343667240965	2021-03-18 15:02:00 EDT	2021-03-18	15:02:00	-0400	1343597700542038017	repnancymace	Rep. Nancy Mace		An unholy amount of our constituents' hard-earned money is trapped in an endless web of government bureaucracy.   Thanks to the tireless efforts of our caseworkers and staff, over $1.2 MILLION is back in the pockets of those who earned it. #LowcountryFirst  https://t.co/S0x4TA1sib  https://t.co/4OSfqHeiaG	en	[]	['https://bit.ly/3bZkDbX']	['https://pbs.twimg.com/media/EwyGRObWgAEkgFB.jpg']	6	4	23	['lowcountryfirst']	[]	https://twitter.com/RepNancyMace/status/1372624343667240965	False		1	https://pbs.twimg.com/media/EwyGRObWgAEkgFB.jpg							[]				
1372616379564761088	1372616379564761088	2021-03-18 14:30:21 EDT	2021-03-18	14:30:21	-0400	1343597700542038017	repnancymace	Rep. Nancy Mace		Businesses pass tax hikes onto the rest of us.   The more a business pays in taxes, the fewer workers it can hire, the lower wages it can pay, and the more it has to raise prices.   Biden's tax hikes won't hurt giant corporations. They'll hurt ALL of us.  https://t.co/ISUy60hSW2	en	[]	['https://bloom.bg/3lsVrh2']	[]	246	219	647	[]	[]	https://twitter.com/RepNancyMace/status/1372616379564761088	False		0								[]				
1372603708144545794	1372603708144545794	2021-03-18 13:40:00 EDT	2021-03-18	13:40:00	-0400	1343597700542038017	repnancymace	Rep. Nancy Mace		When I came to Congress, I promised no one would work harder to meet the Lowcountry's needs.  So far, our office has resolved over 650 cases and 99% of those who reach out to us for help hear back within 24 hours.  And we're just getting started.  https://t.co/MOVBF1zckf  https://t.co/rneBBYbJSD	en	[]	['https://bit.ly/2OCDjFD']	['https://pbs.twimg.com/media/Ewx3vfWWgAQ1bTt.png']	17	8	62	[]	[]	https://twitter.com/RepNancyMace/status/1372603708144545794	False		1	https://pbs.twimg.com/media/Ewx3vfWWgAQ1bTt.png							[]				
1372558069582946307	1372558069582946307	2021-03-18 10:38:39 EDT	2021-03-18	10:38:39	-0400	1343597700542038017	repnancymace	Rep. Nancy Mace		Yesterday marked another first in Congress: My first time asking questions before @TransportGOP!!   Featuring electric vehicles &amp; my nifty dollar store glasses. 🤓 🚘 🚙  https://t.co/YLlojUymB1	en	[{'screen_name': 'transportgop', 'name': 't&i committee republicans', 'id': '35829796'}]	[]	['https://pbs.twimg.com/media/EwxOFTRWQAMB3O1.jpg']	9	6	114	[]	[]	https://twitter.com/RepNancyMace/status/1372558069582946307	False		1	https://pbs.twimg.com/media/EwxOFTRWQAMB3O1.jpg							[]				
1372546999829024777	1372546999829024777	2021-03-18 09:54:40 EDT	2021-03-18	09:54:40	-0400	1343597700542038017	repnancymace	Rep. Nancy Mace		🚨 WEATHER ALERT 🚨  The National Weather Service is predicting SEVERE weather for South Carolina throughout Thrusday, Damaging winds, hail, and tornadoes are possible across the state.  Charge your phones, remain indoors, and STAY SAFE:  https://t.co/ACvtIyaHCK	en	[]	['https://bit.ly/2NvjQ9h']	[]	5	16	31	[]	[]	https://twitter.com/RepNancyMace/status/1372546999829024777	False		0								[]				
1372300534732972042	1372300534732972042	2021-03-17 17:35:18 EDT	2021-03-17	17:35:18	-0400	1343597700542038017	repnancymace	Rep. Nancy Mace		Officer Eugene Goodman &amp; his Capitol Police colleagues risked everything to defend the Capitol from a violent mob. Some, like Officer Brian Sicknick, made the ultimate sacrifice.   Tonight, I voted to recognize their heroism with a Congressional Gold Medal. #BacktheBlue 💙💙  https://t.co/mZDNNVl7Lu	en	[]	[]	[]	38	11	160	['backtheblue']	[]	https://twitter.com/RepNancyMace/status/1372300534732972042	False		1	https://pbs.twimg.com/ext_tw_video_thumb/1372300465954816005/pu/img/hyQ4GrCycMznxrjQ.jpg							[]				
1372295345426866187	1372295345426866187	2021-03-17 17:14:41 EDT	2021-03-17	17:14:41	-0400	1343597700542038017	repnancymace	Rep. Nancy Mace		Happy St. Patrick’s Day, y’all! 🍀🌈💚🇮🇪  https://t.co/zFcIPYa4E2	en	[]	[]	['https://pbs.twimg.com/media/EwtfV8WW8AQSKMU.jpg']	5	2	57	[]	[]	https://twitter.com/RepNancyMace/status/1372295345426866187	False		1	https://pbs.twimg.com/media/EwtfV8WW8AQSKMU.jpg							[]				
1372247507003191296	1372247507003191296	2021-03-17 14:04:35 EDT	2021-03-17	14:04:35	-0400	1343597700542038017	repnancymace	Rep. Nancy Mace		This is a direct result of the words &amp; policies of the Biden administration.  The border crisis has been ignored for MONTHS. The time when it could be solved by the President asking people not to cross illegally is long gone.  We need ACTION, @POTUS.  https://t.co/9DoQSypXdp	en	[{'screen_name': 'potus', 'name': 'president biden', 'id': '1349149096909668363'}]	['https://on.wsj.com/3cH4N4S']	[]	54	23	104	[]	[]	https://twitter.com/RepNancyMace/status/1372247507003191296	False		0								[]				
1372230451717361668	1372230451717361668	2021-03-17 12:56:49 EDT	2021-03-17	12:56:49	-0400	1343597700542038017	repnancymace	Rep. Nancy Mace		I hear a lot in DC about helping our economy rebound from COVID, so you'd think I'd hear a lot about ensuring our job creators can afford to hire workers.  Nope.  We're talking about taking MORE of their money &amp; strapping our kids w/ the cost of pie-in-the-sky spending sprees.  https://t.co/UqA9zTL1n7	en	[]	[]	[]	32	8	48	[]	[]	https://twitter.com/RepNancyMace/status/1372230451717361668	False		1	https://pbs.twimg.com/ext_tw_video_thumb/1372230060132945921/pu/img/7s9MzifE9X-EIqvv.jpg							[]				
1372216410311692298	1372216410311692298	2021-03-17 12:01:01 EDT	2021-03-17	12:01:01	-0400	1343597700542038017	repnancymace	Rep. Nancy Mace		The Biden administration's tax hikes are going to lead to fewer companies creating fewer jobs at lower wages. This will hurt every single American.  https://t.co/m47vhe2QhE	en	[]	[]	[]	69	32	105	[]	[]	https://twitter.com/RepNancyMace/status/1372216410311692298	False		1	https://pbs.twimg.com/ext_tw_video_thumb/1372216335317544963/pu/img/H0i5B3TV-GLHG2jb.jpg							[]				
1372193895153594373	1372193895153594373	2021-03-17 10:31:33 EDT	2021-03-17	10:31:33	-0400	1343597700542038017	repnancymace	Rep. Nancy Mace		I'm working with anyone who is willing to work with me. Most recently, I got to do that on an issue I care about deeply: criminal justice reform.  https://t.co/TosYflC7kb  https://t.co/YC159CjFFH	en	[]	['https://bit.ly/3bTve88']	['https://pbs.twimg.com/media/EwsC-D8XIAMx5mS.png']	13	7	53	[]	[]	https://twitter.com/RepNancyMace/status/1372193895153594373	False		1	https://pbs.twimg.com/media/EwsC-D8XIAMx5mS.png							[]				
1372172493486747650	1372172493486747650	2021-03-17 09:06:30 EDT	2021-03-17	09:06:30	-0400	1343597700542038017	repnancymace	Rep. Nancy Mace		“If more people in Congress can put aside their partisan blinders and work together like our congresswoman, Nancy Mace, there’s a chance we can go above and beyond the “First Step,” and push forward to the “Next Step” of fixing our justice system.” 🙏🏼  https://t.co/sxJAtLBEvZ	en	[]	['https://www.postandcourier.com/opinion/commentary/commentary-mace-bill-would-help-modernize-due-process-rights/article_9ea9657e-8363-11eb-a224-ff85f72572fb.html']	[]	19	16	68	[]	[]	https://twitter.com/RepNancyMace/status/1372172493486747650	False		0								[]				
1371945449599475713	1371945449599475713	2021-03-16 18:04:19 EDT	2021-03-16	18:04:19	-0400	1343597700542038017	repnancymace	Rep. Nancy Mace		Biden is going to tax hard-working Americans while leaving our borders open to hundreds of thousands of illegal immigrants.   This is NOT putting the #AmericanWorker first.  https://t.co/IXu0mH6U3J	en	[]	[]	[]	226	149	506	['americanworker']	[]	https://twitter.com/RepNancyMace/status/1371945449599475713	False		1	https://pbs.twimg.com/media/EwohHJDXAA8kJMK.jpg							[]				
1371937888842223622	1371937888842223622	2021-03-16 17:34:16 EDT	2021-03-16	17:34:16	-0400	1343597700542038017	repnancymace	Rep. Nancy Mace		Biden’s plan to raise taxes on job creators will lead to an exodus of jobs in South Carolina.  Companies like Boeing and Volvo have chosen to call my state home thanks to our low tax rates. Biden’s tax plan threatens to ship jobs overseas.  https://t.co/bSvrN2jPbE	en	[]	[]	[]	52	13	59	[]	[]	https://twitter.com/RepNancyMace/status/1371937888842223622	False		1	https://pbs.twimg.com/media/EwoaPG8WUAURWfo.jpg							[]				
1371929406818680834	1371929406818680834	2021-03-16 17:00:34 EDT	2021-03-16	17:00:34	-0400	1343597700542038017	repnancymace	Rep. Nancy Mace		I can’t think of a worse thing to do than raise taxes in the middle of a pandemic. Unfortunately, President Biden is planning to do just that.  https://t.co/61BMzewzJQ	en	[]	[]	[]	102	48	246	[]	[]	https://twitter.com/RepNancyMace/status/1371929406818680834	False		1	https://pbs.twimg.com/media/EwoShZQWUAYawQj.jpg							[]				
1371890376987017223	1371890376987017223	2021-03-16 14:25:29 EDT	2021-03-16	14:25:29	-0400	1343597700542038017	repnancymace	Rep. Nancy Mace		In recent yrs, Atlantic Diving Supply received 90% of all small business contracts for 1 DoD program. Despite a history of fraud, they've raked in $6+ BILLION in tax dollars in 2 yrs.  Members of both parties joined me to demand @SecDef step in.  https://t.co/u2bsX0U6v9  https://t.co/s1vom19wU1	en	[{'screen_name': 'secdef', 'name': 'secretary of defense lloyd j. austin iii', 'id': '1338994562090602497'}]	['https://bit.ly/3cFiAbX']	['https://pbs.twimg.com/media/Ewnu9c7WYAA_o7Q.jpg', 'https://pbs.twimg.com/media/Ewnu9dBWEAIEC-c.png', 'https://pbs.twimg.com/media/Ewnu9cvWQAkIVag.jpg', 'https://pbs.twimg.com/media/Ewnu9dAXEAsGPZj.jpg']	8	14	50	[]	[]	https://twitter.com/RepNancyMace/status/1371890376987017223	False		1	https://pbs.twimg.com/media/Ewnu9c7WYAA_o7Q.jpg							[]				
1371886622057316352	1371879601430016010	2021-03-16 14:10:33 EDT	2021-03-16	14:10:33	-0400	1343597700542038017	repnancymace	Rep. Nancy Mace		My office regulars were not thrilled by the shiny new object... #IStillLoveYall  https://t.co/krVpoXZOkJ	en	[]	[]	['https://pbs.twimg.com/media/EwnrnDHW8AEMRTh.jpg']	5	3	99	['istillloveyall']	[]	https://twitter.com/RepNancyMace/status/1371886622057316352	False		1	https://pbs.twimg.com/media/EwnrnDHW8AEMRTh.jpg							[]				
1371879601430016010	1371879601430016010	2021-03-16 13:42:39 EDT	2021-03-16	13:42:39	-0400	1343597700542038017	repnancymace	Rep. Nancy Mace		If you bring your pup to work, you better bring it by my office!! Say hi to today's visitor, Griffey 🥺🥰💞#ICantEven #DogsofTheHill  https://t.co/koWuNVJWtM	en	[]	[]	['https://pbs.twimg.com/media/EwnlOdQWEAA_ZO2.jpg', 'https://pbs.twimg.com/media/EwnlOdQWEAEqjSg.jpg']	19	14	377	['icanteven', 'dogsofthehill']	[]	https://twitter.com/RepNancyMace/status/1371879601430016010	False		1	https://pbs.twimg.com/media/EwnlOdQWEAA_ZO2.jpg							[]				
1371826947546812417	1371826947546812417	2021-03-16 10:13:26 EDT	2021-03-16	10:13:26	-0400	1343597700542038017	repnancymace	Rep. Nancy Mace		Great to meet with the South Carolina Business Council in DC this morning!  These South Carolinians are some of the most accomplished business leaders in the country, all determined to see SC succeed. Getting their perspective on issues in Congress was incredibly valuable.  https://t.co/r4G2M0BqwZ	en	[]	[]	['https://pbs.twimg.com/media/Ewm1Vo-WgAAMDo6.jpg']	0	6	36	[]	[]	https://twitter.com/RepNancyMace/status/1371826947546812417	False		1	https://pbs.twimg.com/media/Ewm1Vo-WgAAMDo6.jpg							[]				
1371817013279080451	1371817013279080451	2021-03-16 09:33:57 EDT	2021-03-16	09:33:57	-0400	1343597700542038017	repnancymace	Rep. Nancy Mace		Such an amazing way to celebrate #WomensHistoryMonth and the contribution of women to the defense of our nation!   Thank you to these incredible pilots for their service and to the countless women who serve in our armed forces. 🇺🇸  https://t.co/1kBHt8xFyn	en	[]	['https://www.counton2.com/news/local-news/charleston-county-news/joint-base-charleston-celebrates-womens-history-month-with-all-female-flight/']	[]	9	9	43	['womenshistorymonth']	[]	https://twitter.com/RepNancyMace/status/1371817013279080451	False		0								[]				
1371585594774675464	1371585594774675464	2021-03-15 18:14:23 EDT	2021-03-15	18:14:23	-0400	1343597700542038017	repnancymace	Rep. Nancy Mace		Going through emails with my loyal assistant! Although he’s on thin ice for sleeping on the job... 🐶 #DogsOfTheHill  https://t.co/rQuvmLe1uP	en	[]	[]	['https://pbs.twimg.com/media/EwjZ0_mXMAYihOX.jpg']	24	8	394	['dogsofthehill']	[]	https://twitter.com/RepNancyMace/status/1371585594774675464	False		1	https://pbs.twimg.com/media/EwjZ0_mXMAYihOX.jpg							[]				
1371562338948616193	1371562338948616193	2021-03-15 16:41:58 EDT	2021-03-15	16:41:58	-0400	1343597700542038017	repnancymace	Rep. Nancy Mace		After the Tax Cuts &amp; Jobs Act, we saw a job SURPLUS for the 1st time on record. Pay went up for the 1st time in decades.   And tax revenue INCREASED.   DC has a SPENDING problem, not a revenue problem. Hurting the #AmericanWorker &amp; businesses won't fix it.  https://t.co/uOP7sRLaZz	en	[]	['https://bloom.bg/3rX045C']	[]	57	37	155	['americanworker']	[]	https://twitter.com/RepNancyMace/status/1371562338948616193	False		0								[]				
