id	conversation_id	created_at	date	time	timezone	user_id	username	name	place	tweet	language	mentions	urls	photos	replies_count	retweets_count	likes_count	hashtags	cashtags	link	retweet	quote_url	video	thumbnail	near	geo	source	user_rt_id	user_rt	retweet_id	reply_to	retweet_date	translate	trans_src	trans_dest
1388176479108861952	1388176479108861952	2021-04-30 13:00:38 EDT	2021-04-30	13:00:38	-0400	1343597700542038017	repnancymace	Rep. Nancy Mace		🚨 Today is the LAST DAY to put in your submissions for the 2021 Congressional High School Art Competition! I know there are so many talented young artists in the Lowcountry. Get your artwork in TODAY! 🖼 🎨    SUBMIT HERE:  https://t.co/zdyQboS6J0	en	[]	['https://bit.ly/2PG17Jc']	[]	0	1	4	[]	[]	https://twitter.com/RepNancyMace/status/1388176479108861952	False		0								[]				
1388138650001715200	1388138650001715200	2021-04-30 10:30:19 EDT	2021-04-30	10:30:19	-0400	1343597700542038017	repnancymace	Rep. Nancy Mace		Too many of our veterans quietly suffer from the burden of the terrifying experiences they've endured. An average of 17 vets die of PTSD-related suicide daily.  We must explore anything which may help them overcome their trauma, including medical cannabis.  https://t.co/pTlnSavw0Y  https://t.co/WT19ET4I2A	en	[]	['https://bit.ly/3e7rUaC']	['https://pbs.twimg.com/media/E0Oovs6XoAo_enN.png']	9	15	50	[]	[]	https://twitter.com/RepNancyMace/status/1388138650001715200	False		1	https://pbs.twimg.com/media/E0Oovs6XoAo_enN.png							[]				
1388117968136122376	1388117968136122376	2021-04-30 09:08:08 EDT	2021-04-30	09:08:08	-0400	1343597700542038017	repnancymace	Rep. Nancy Mace		Despite President Biden’s promises, his administration has ceded control over its agenda to radicals who aren’t interested in working w/ anyone but themselves.   America can’t afford four more years of this out-of-control of spending.  https://t.co/nYRtL3H31D  https://t.co/fdNGvBWxRl	en	[]	['https://fxn.ws/2QIhENa']	['https://pbs.twimg.com/media/E0OV71-XMAIuqba.jpg']	63	10	45	[]	[]	https://twitter.com/RepNancyMace/status/1388117968136122376	False		1	https://pbs.twimg.com/media/E0OV71-XMAIuqba.jpg							[]				
1387918984901709825	1387904623067942913	2021-04-29 19:57:26 EDT	2021-04-29	19:57:26	-0400	1343597700542038017	repnancymace	Rep. Nancy Mace		🚨 For #IOP folks looking for a great place to work:  https://t.co/5hEXQGuZBY	en	[]	[]	['https://pbs.twimg.com/media/E0Lg9cDWQAAy5Dh.jpg']	5	1	7	['iop']	[]	https://twitter.com/RepNancyMace/status/1387918984901709825	False		1	https://pbs.twimg.com/media/E0Lg9cDWQAAy5Dh.jpg							[]				
1387904623067942913	1387904623067942913	2021-04-29 19:00:22 EDT	2021-04-29	19:00:22	-0400	1343597700542038017	repnancymace	Rep. Nancy Mace		Small businesses across the Lowcountry are desperate to hire more workers to keep up with tourist season, but they're struggling to fill positions.   DC politicians are paying millions of Americans to stay home, and this is exactly what they’re doing.  https://t.co/Mm6pWWKIdM	en	[]	['https://bit.ly/3gNEa1E']	[]	48	19	51	[]	[]	https://twitter.com/RepNancyMace/status/1387904623067942913	False		0								[]				
1387874602257420289	1387874602257420289	2021-04-29 17:01:05 EDT	2021-04-29	17:01:05	-0400	1343597700542038017	repnancymace	Rep. Nancy Mace		The vision of America which President Biden promised us was one of bipartisanship, moderation, and unity. What we're getting is the socialist vision promised by Nancy Pelosi and AOC.  I'm ready to work across the aisle to get things done. I just wish the Democrats were.  https://t.co/oZcb0jGPuY	en	[]	[]	[]	48	12	71	[]	[]	https://twitter.com/RepNancyMace/status/1387874602257420289	False		1	https://pbs.twimg.com/media/E0K4l46WUAIg-c-.jpg							[]				
1387836632695459842	1387836632695459842	2021-04-29 14:30:12 EDT	2021-04-29	14:30:12	-0400	1343597700542038017	repnancymace	Rep. Nancy Mace		Had a great discussion with #VotersForCures in Charleston yesterday! Hearing their stories was a powerful reminder of how vital the freedom to innovate is to developing treatments for illnesses like cancer &amp; COVID.    Looking forward to working together to preserve this freedom!  https://t.co/X7z2BSz1JU	en	[]	[]	['https://pbs.twimg.com/media/E0KWD3qX0AI0YCl.jpg']	7	3	21	['votersforcures']	[]	https://twitter.com/RepNancyMace/status/1387836632695459842	False		1	https://pbs.twimg.com/media/E0KWD3qX0AI0YCl.jpg							[]				
1387806575532912644	1387806575532912644	2021-04-29 12:30:46 EDT	2021-04-29	12:30:46	-0400	1343597700542038017	repnancymace	Rep. Nancy Mace		We must share our stories to give survivors of sexual assault &amp; domestic violence the confidence they need to heal and speak out.  Thank you @SenJoniErnst &amp; @RepDLesko for leading on this issue. #SAAM  If you need help, call the National Sexual Assault Hotline at 1-800-656-4673  https://t.co/kLuOW1Q1oG	en	[{'screen_name': 'senjoniernst', 'name': 'joni ernst', 'id': '2856787757'}, {'screen_name': 'repdlesko', 'name': 'congresswoman debbie lesko', 'id': '996094929733652481'}]	[]	[]	8	10	36	['saam']	[]	https://twitter.com/RepNancyMace/status/1387806575532912644	False		1	https://pbs.twimg.com/media/E0J6uODXEAAaOXV.jpg							[]				
1387770498990366721	1387770498990366721	2021-04-29 10:07:25 EDT	2021-04-29	10:07:25	-0400	1343597700542038017	repnancymace	Rep. Nancy Mace		Yesterday, I met with mayors from across the Lowcountry to discuss the unique challenges our growing communities are facing and what we can do to tackle them in Congress.    I'm looking forward to continuing to work with them to support our infrastructure needs and more. 🚗🛣️✈️  https://t.co/jn9dMoGNUO	en	[]	[]	[]	6	4	17	[]	[]	https://twitter.com/RepNancyMace/status/1387770498990366721	False		1	https://pbs.twimg.com/media/E0JZ6NiXoAArLBV.jpg							[]				
1387594083133267969	1387594083133267969	2021-04-28 22:26:24 EDT	2021-04-28	22:26:24	-0400	1343597700542038017	repnancymace	Rep. Nancy Mace		Me when President Biden finally took his mask off. #JointAddress  https://t.co/jfZO6f9zo3	en	[]	[]	['https://pbs.twimg.com/tweet_video_thumb/E0G5dRXXIAAYnYn.jpg']	69	6	118	['jointaddress']	[]	https://twitter.com/RepNancyMace/status/1387594083133267969	False		1	https://pbs.twimg.com/tweet_video_thumb/E0G5dRXXIAAYnYn.jpg							[]				
1387585947865341952	1387585947865341952	2021-04-28 21:54:04 EDT	2021-04-28	21:54:04	-0400	1343597700542038017	repnancymace	Rep. Nancy Mace		Me trying to figure out how we’re paying for everything laid out in President Biden’s #JointAddress  https://t.co/RKY5E5BJcY	en	[]	[]	['https://pbs.twimg.com/tweet_video_thumb/E0GyDuWWQAEw2L1.jpg']	55	13	133	['jointaddress']	[]	https://twitter.com/RepNancyMace/status/1387585947865341952	False		1	https://pbs.twimg.com/tweet_video_thumb/E0GyDuWWQAEw2L1.jpg							[]				
1387578932375982087	1387578932375982087	2021-04-28 21:26:12 EDT	2021-04-28	21:26:12	-0400	1343597700542038017	repnancymace	Rep. Nancy Mace		Oh great, this is the part where President Biden tries to tell us how he magically fixed everything, even though the previous administration actually developed and set up the system to distribute vaccines. #JointAddress	en	[]	[]	[]	157	82	641	['jointaddress']	[]	https://twitter.com/RepNancyMace/status/1387578932375982087	False		0								[]				
1387578183915089926	1387578183915089926	2021-04-28 21:23:13 EDT	2021-04-28	21:23:13	-0400	1343597700542038017	repnancymace	Rep. Nancy Mace		So President Biden’s CDC says vaccinated people don’t need to wear masks when in a room together, but here we are... virtue signaling.  https://t.co/CzYtDpbuB4	en	[]	[]	['https://pbs.twimg.com/media/E0GrAORXMAETy38.jpg']	117	214	1294	[]	[]	https://twitter.com/RepNancyMace/status/1387578183915089926	False		1	https://pbs.twimg.com/media/E0GrAORXMAETy38.jpg							[]				
1387542206462955525	1387542206462955525	2021-04-28 19:00:15 EDT	2021-04-28	19:00:15	-0400	1343597700542038017	repnancymace	Rep. Nancy Mace		I can't think of anyone better than @SenatorTimScott to deliver the Republican response to President Biden's first joint address to Congress.    He represents the best South Carolina, the Republican Party, and America have to offer. Go get 'em Tim! 🌙 🌴 🇺🇸	en	[{'screen_name': 'senatortimscott', 'name': 'tim scott', 'id': '217543151'}]	[]	[]	36	22	254	[]	[]	https://twitter.com/RepNancyMace/status/1387542206462955525	False		0								[]				
1387527346975121410	1387527346975121410	2021-04-28 18:01:13 EDT	2021-04-28	18:01:13	-0400	1343597700542038017	repnancymace	Rep. Nancy Mace		"Like many Americans, I was hopeful when President Biden promised to lead through unity and bipartisanship.    Unfortunately, over the last 100 days, we've learned ""unity"" and ""bipartisanship"" means giving in to the Pelosi/AOC wing of the Democratic Party.  https://t.co/QC3wCogyX2"	en	[]	[]	['https://pbs.twimg.com/media/E0F8xHeWUAIztJk.jpg']	179	64	246	[]	[]	https://twitter.com/RepNancyMace/status/1387527346975121410	False		1	https://pbs.twimg.com/media/E0F8xHeWUAIztJk.jpg							[]				
1387504501725224967	1387504501725224967	2021-04-28 16:30:26 EDT	2021-04-28	16:30:26	-0400	1343597700542038017	repnancymace	Rep. Nancy Mace		To get things done for the American people, we have to put our partisan blinders aside and work together.   We need to see more of this from the party of Pelosi and AOC. #SOTU  https://t.co/59Iv7gFmZZ	en	[]	[]	[]	29	6	28	['sotu']	[]	https://twitter.com/RepNancyMace/status/1387504501725224967	False		1	https://pbs.twimg.com/media/E0Fn_Q5X0AExe5m.jpg							[]				
1387498813506662400	1387477713448013828	2021-04-28 16:07:50 EDT	2021-04-28	16:07:50	-0400	1343597700542038017	repnancymace	Rep. Nancy Mace		@ghabib1968 thank you for attending, it was so great seeing you!	en	[]	[]	[]	0	0	2	[]	[]	https://twitter.com/RepNancyMace/status/1387498813506662400	False		0								[{'screen_name': 'ghabib1968', 'name': 'Greg Habib', 'id': '59326105'}]				
1387476348650856455	1387476348650856455	2021-04-28 14:38:34 EDT	2021-04-28	14:38:34	-0400	1343597700542038017	repnancymace	Rep. Nancy Mace		Today, I hosted a brown bag lunch meeting with mayors across SC-01 to talk about the top issues facing our communities. 🥪  With a booming district like ours, we have several infrastructure challenges like 526/26/17 traffic, the Charleston seawall, and waterway dredging.  https://t.co/meksSYMkrj	en	[]	[]	['https://pbs.twimg.com/media/E0FOYjOX0AYB6zr.jpg', 'https://pbs.twimg.com/media/E0FOYiGXMAMNDxr.jpg', 'https://pbs.twimg.com/media/E0FOYiIWEAExzJO.jpg']	11	4	31	[]	[]	https://twitter.com/RepNancyMace/status/1387476348650856455	False		1	https://pbs.twimg.com/media/E0FOYjOX0AYB6zr.jpg							[]				
1387431989331075072	1387431989331075072	2021-04-28 11:42:18 EDT	2021-04-28	11:42:18	-0400	1343597700542038017	repnancymace	Rep. Nancy Mace		In 100 days, Washington spent nearly $2 trillion we don't have, unveiled $4+ trillion in MORE spending on radical schemes, and EVEN MORE deficit spending will be announced at the #SOTU.   No amount of YOUR taxpayer dollars will ever be enough for Pelosi &amp; AOC.  https://t.co/qvaNrjKaJ8	en	[]	[]	[]	71	53	148	['sotu']	[]	https://twitter.com/RepNancyMace/status/1387431989331075072	False		1	https://pbs.twimg.com/amplify_video_thumb/1387431880648273920/img/niUIvm9f2K9M8UPK.jpg							[]				
1387126320065359874	1387126320065359874	2021-04-27 15:27:40 EDT	2021-04-27	15:27:40	-0400	1343597700542038017	repnancymace	Rep. Nancy Mace		It's been a whirlwind, but our team is working day-in and day-out for the Lowcountry.  I talked about the road to Congress and our first 100 days in office with @WCBD's own @cmurraywcbdtv.  https://t.co/FFWRzhukCO	en	[{'screen_name': 'wcbd', 'name': 'wcbd news 2', 'id': '15357193'}, {'screen_name': 'cmurraywcbdtv', 'name': 'carolyn murray', 'id': '20711173'}]	[]	[]	8	2	15	[]	[]	https://twitter.com/RepNancyMace/status/1387126320065359874	False		1	https://pbs.twimg.com/media/E0AQCJMXMAMvVPn.jpg							[]				
1387108409821048834	1387108400950042626	2021-04-27 14:16:30 EDT	2021-04-27	14:16:30	-0400	1343597700542038017	repnancymace	Rep. Nancy Mace		Add to the list today's reversal on whether pregnant women can get vaccinated, and the CDC has been nothing more than a dumpster fire of misinformation.  https://t.co/podCxR3TqF	en	[]	[]	['https://pbs.twimg.com/tweet_video_thumb/Ez__vqEXEAUdCns.jpg']	31	10	63	[]	[]	https://twitter.com/RepNancyMace/status/1387108409821048834	False		1	https://pbs.twimg.com/tweet_video_thumb/Ez__vqEXEAUdCns.jpg							[]				
1387108403219214341	1387108400950042626	2021-04-27 14:16:29 EDT	2021-04-27	14:16:29	-0400	1343597700542038017	repnancymace	Rep. Nancy Mace		This chart is absurd. According to the CDC, vaccinated Americans have only a sliver more freedom than those who are unvaxxed?   So, Dr. Fauci, does the vaccine work, or does it not?  https://t.co/c9SkezQNuA	en	[]	[]	['https://pbs.twimg.com/media/Ez__eDOX0AENWev.jpg']	27	29	98	[]	[]	https://twitter.com/RepNancyMace/status/1387108403219214341	False		1	https://pbs.twimg.com/media/Ez__eDOX0AENWev.jpg							[]				
1387108400950042626	1387108400950042626	2021-04-27 14:16:28 EDT	2021-04-27	14:16:28	-0400	1343597700542038017	repnancymace	Rep. Nancy Mace		"The CDC's outdoor mask guidelines are performative, non science-based trash. Today's ""update"" is the CDC merely acknowledging this to be the case.   Even among those unvaccinated, there is a less than ZERO% chance of transmitting COVID outdoors."	en	[]	[]	[]	72	24	155	[]	[]	https://twitter.com/RepNancyMace/status/1387108400950042626	False		0								[]				
1387061795433627648	1387061795433627648	2021-04-27 11:11:17 EDT	2021-04-27	11:11:17	-0400	1343597700542038017	repnancymace	Rep. Nancy Mace		100 days in office.  - Nearly $2 million dollars returned to taxpayers. - Over 1,000 constituent cases closed. - Over 250 meetings in district. - 53 bills co-sponsored. - 3 bills sponsored.  1 main priority: Putting #LowcountryFirst.  https://t.co/MCJ84Yr2OB	en	[]	['https://bit.ly/3ewZpSU']	[]	17	4	58	['lowcountryfirst']	[]	https://twitter.com/RepNancyMace/status/1387061795433627648	False		0								[]				
1386801263757639684	1386801263757639684	2021-04-26 17:56:01 EDT	2021-04-26	17:56:01	-0400	1343597700542038017	repnancymace	Rep. Nancy Mace		"Recent reports of the @USPS trawling through Americans' social media posts for ""inflammatory"" materials is incredibly disturbing.    I urge Postmaster General Louis DeJoy to answer the many questions my colleagues and I have about this invasion of privacy.  https://t.co/Ydp6R1NC9z  https://t.co/DeHu8iaKHm"	en	[{'screen_name': 'usps', 'name': 'u.s. postal service', 'id': '386507775'}]	['https://bit.ly/3xksn0R']	['https://pbs.twimg.com/media/Ez7oZkEWEAoCYeJ.png']	45	182	314	[]	[]	https://twitter.com/RepNancyMace/status/1386801263757639684	False		1	https://pbs.twimg.com/media/Ez7oZkEWEAoCYeJ.png							[]				
1386783773052784644	1386783773052784644	2021-04-26 16:46:31 EDT	2021-04-26	16:46:31	-0400	1343597700542038017	repnancymace	Rep. Nancy Mace		We’ve known for months kids could return to school safely. We’ve also known closed schools have caused real harm to families, both physically and emotionally.   Thank you, @HenryMcMaster, for putting South Carolina’s kids first.  https://t.co/bEFNvR7QUa	en	[{'screen_name': 'henrymcmaster', 'name': 'gov. henry mcmaster', 'id': '16335288'}]	['https://bit.ly/3dT72nB']	[]	54	23	205	[]	[]	https://twitter.com/RepNancyMace/status/1386783773052784644	False		0								[]				
1386749749802455046	1386749749802455046	2021-04-26 14:31:19 EDT	2021-04-26	14:31:19	-0400	1343597700542038017	repnancymace	Rep. Nancy Mace		For once, I'm in total agreement with Rep. AOC: The Biden admin. surprised all of us with how far left they've gone in the first 100 Days.    From the Green New Deal, to H.R. 1, to trillions in new spending, Pelosi’s party has gone far beyond what even AOC could've hoped.  https://t.co/rY6Xl2wSAi	en	[]	[]	[]	44	12	72	[]	[]	https://twitter.com/RepNancyMace/status/1386749749802455046	False		1	https://pbs.twimg.com/media/Ez65i6SXsAAPv70.png							[]				
1386719483444830220	1386719483444830220	2021-04-26 12:31:03 EDT	2021-04-26	12:31:03	-0400	1343597700542038017	repnancymace	Rep. Nancy Mace		Special thanks to @CBP's Trade &amp; Cargo Academy for hosting me last week. I saw firsthand the diligent training happening in SC-01 to keep our border safe.  The timing of this visit could not have been more fitting given the current crisis at our southern border.  https://t.co/D9gI70WDYq	en	[{'screen_name': 'cbp', 'name': 'cbp', 'id': '16613128'}]	[]	['https://pbs.twimg.com/media/Ez6eBF0XIAMhIJY.jpg', 'https://pbs.twimg.com/media/Ez6eBRIXEAIHq0o.jpg']	2	1	17	[]	[]	https://twitter.com/RepNancyMace/status/1386719483444830220	False		1	https://pbs.twimg.com/media/Ez6eBF0XIAMhIJY.jpg							[]				
1386699226130919424	1386699226130919424	2021-04-26 11:10:33 EDT	2021-04-26	11:10:33	-0400	1343597700542038017	repnancymace	Rep. Nancy Mace		We need police AND police reform. Pelosi’s party wants to defund and even abolish our police departments.    We depend upon those brave Americans who put on the badge every day. Eradicating law enforcement is not the solution.  https://t.co/j7qSEMmYEU	en	[]	[]	[]	43	9	63	[]	[]	https://twitter.com/RepNancyMace/status/1386699226130919424	False		1	https://pbs.twimg.com/media/Ez6LmEDXMAUQadW.jpg							[]				
1386672307725295617	1386672307725295617	2021-04-26 09:23:35 EDT	2021-04-26	09:23:35	-0400	1343597700542038017	repnancymace	Rep. Nancy Mace		Congratulations to @petermccoyforsc on his much-deserved nomination to head the board of Santee Cooper. SC-01 is proud of your dedication to our state!	en	[{'screen_name': 'petermccoyforsc', 'name': 'peter m. mccoy, jr.', 'id': '113990679'}]	[]	[]	0	1	8	[]	[]	https://twitter.com/RepNancyMace/status/1386672307725295617	False		0								[]				
1385720472755712003	1385720472755712003	2021-04-23 18:21:20 EDT	2021-04-23	18:21:20	-0400	1343597700542038017	repnancymace	Rep. Nancy Mace		Like the Minutemen of the Revolutionary War, Army Reservists stand ready rush to America's defense at a moment's notice. Their willingness to put their lives on hold and risk everything for our nation is a debt we can never repay.  Happy Birthday, U.S. Army Reserve. #ArmyReserve  https://t.co/YV4A3e9nMH	en	[]	[]	['https://pbs.twimg.com/media/EzsRbI7WYAIGZOL.jpg']	10	4	42	['armyreserve']	[]	https://twitter.com/RepNancyMace/status/1385720472755712003	False		1	https://pbs.twimg.com/media/EzsRbI7WYAIGZOL.jpg							[]				
1385673624485498882	1385673624485498882	2021-04-23 15:15:11 EDT	2021-04-23	15:15:11	-0400	1343597700542038017	repnancymace	Rep. Nancy Mace		Many treats were required for the making of this photo 🐶 🐕 😋 #NMBTS #DogsoftheHill  https://t.co/ruWcR6350c	en	[]	[]	['https://pbs.twimg.com/media/Ezrm0J0X0AYvOU2.jpg', 'https://pbs.twimg.com/media/Ezrm0J2WYAEHuda.jpg']	21	18	372	['nmbts', 'dogsofthehill']	[]	https://twitter.com/RepNancyMace/status/1385673624485498882	False		1	https://pbs.twimg.com/media/Ezrm0J0X0AYvOU2.jpg							[]				
1385578816828022789	1385578816828022789	2021-04-23 08:58:27 EDT	2021-04-23	08:58:27	-0400	1343597700542038017	repnancymace	Rep. Nancy Mace		Politicians in Washington are paying millions of Americans to stay home and not work, and that’s exactly what they’re doing.  Now, businesses owners in the Lowcountry are finding it difficult to compete with these bloated unemployment benefits.  https://t.co/cUW9gm4HpH	en	[]	['https://www.postandcourier.com/opinion/commentary/mace-government-is-incentivizing-unemployment-our-businesses-are-suffering/article_d0ed781a-a12a-11eb-9e8e-63d9d548f253.html']	[]	50	17	73	[]	[]	https://twitter.com/RepNancyMace/status/1385578816828022789	False		0								[]				
1385330136678084614	1385330136678084614	2021-04-22 16:30:17 EDT	2021-04-22	16:30:17	-0400	1343597700542038017	repnancymace	Rep. Nancy Mace		The Lowcountry's heart and soul are tied to the conservation of our environment. It's up to us to protect our region's natural splendor. #EarthDay  https://t.co/Y9TDIWFjD3	en	[]	[]	['https://pbs.twimg.com/media/EzmuakTWQAkqChx.jpg']	13	5	41	['earthday']	[]	https://twitter.com/RepNancyMace/status/1385330136678084614	False		1	https://pbs.twimg.com/media/EzmuakTWQAkqChx.jpg							[]				
1385292582469636096	1385292582469636096	2021-04-22 14:01:03 EDT	2021-04-22	14:01:03	-0400	1343597700542038017	repnancymace	Rep. Nancy Mace		The Lowcountry is renowned for its natural beauty. Our region represents what conservationists hope to preserve.  But down here, it's not just conservationists who want to protect the environment. Anyone who earns a living here wants the same. #EarthDay  https://t.co/36v5v9lc3r  https://t.co/wuncgOSBJ4	en	[]	['https://bit.ly/3sJBZP7']	['https://pbs.twimg.com/media/EzmMQyVXMAEGVK4.jpg']	13	4	14	['earthday']	[]	https://twitter.com/RepNancyMace/status/1385292582469636096	False		1	https://pbs.twimg.com/media/EzmMQyVXMAEGVK4.jpg							[]				
1385269994670407682	1385269994670407682	2021-04-22 12:31:18 EDT	2021-04-22	12:31:18	-0400	1343597700542038017	repnancymace	Rep. Nancy Mace		Helping American families would be sending kids to school, getting parents back to work, and doing everything we can to get our economy back to where it was pre-COVID.  Instead we're spending trillions of dollars we don't have on radical progressive schemes to expand govt power.  https://t.co/pvSaxWx7CW	en	[]	[]	[]	32	9	38	[]	[]	https://twitter.com/RepNancyMace/status/1385269994670407682	False		1	https://pbs.twimg.com/amplify_video_thumb/1385269926479474697/img/ARSoQ3vZIfnzCKj8.jpg							[]				
1385242946988032002	1385242946988032002	2021-04-22 10:43:49 EDT	2021-04-22	10:43:49	-0400	1343597700542038017	repnancymace	Rep. Nancy Mace		"It seems every day we wake up to the Biden admin unveiling yet another boondoggle that they have absolutely no way of paying for beyond raising taxes on hardworking Americans.   The ""American Families Plan"" is just another $1 trillion taxpayer-funded liberal wishlist.  https://t.co/zVPDudqUoH"	en	[]	[]	[]	52	11	62	[]	[]	https://twitter.com/RepNancyMace/status/1385242946988032002	False		1	https://pbs.twimg.com/amplify_video_thumb/1385242886229438464/img/8aUIvuxi5DhPW1k9.jpg							[]				
1385217081805783048	1385217081805783048	2021-04-22 09:01:03 EDT	2021-04-22	09:01:03	-0400	1343597700542038017	repnancymace	Rep. Nancy Mace		Protecting our environment isn't some act of charity toward nature. The Lowcountry's way of life depends on preserving our natural splendor.  The #TrillionTrees Initiative is an easy way to do it, &amp; the Trillion Trees Act puts the US out front. #EarthDay    https://t.co/Z1OEsAGBnE  https://t.co/Mn37IyOzvy	en	[]	['https://bit.ly/3n7vy78']	['https://pbs.twimg.com/media/EzlHmDxWUAETtio.png']	9	5	31	['trilliontrees', 'earthday']	[]	https://twitter.com/RepNancyMace/status/1385217081805783048	False		1	https://pbs.twimg.com/media/EzlHmDxWUAETtio.png							[]				
1384983788103606275	1384983788103606275	2021-04-21 17:34:01 EDT	2021-04-21	17:34:01	-0400	1343597700542038017	repnancymace	Rep. Nancy Mace		Our military men and women risk everything to protect us. It is our duty to ensure victims of Military Sexual Trauma have the support they need to heal.  https://t.co/iprx8hcp5l  https://t.co/umX0CUa59e	en	[]	['https://bit.ly/3vfvmWB']	['https://pbs.twimg.com/media/EzhzalsXsAQtfOP.png']	10	6	26	[]	[]	https://twitter.com/RepNancyMace/status/1384983788103606275	False		1	https://pbs.twimg.com/media/EzhzalsXsAQtfOP.png							[]				
1384951946818297860	1384951946818297860	2021-04-21 15:27:29 EDT	2021-04-21	15:27:29	-0400	1343597700542038017	repnancymace	Rep. Nancy Mace		Lt. Col. Sam Mulrain is a pillar of the Lowcountry community. His accomplishments and service, both in war and in peace, merit so much more than 280 characters. Across his 104 years, he's had a huge &amp; lasting impact on everyone around him.   Happy Birthday, Lt. Col. Mulrain! 🎂  https://t.co/wDXJKBEXEF	en	[]	[]	[]	2	4	31	[]	[]	https://twitter.com/RepNancyMace/status/1384951946818297860	False		1	https://pbs.twimg.com/media/EzhWc-1WEAUE9wP.jpg							[]				
1384900260707901443	1384900260707901443	2021-04-21 12:02:07 EDT	2021-04-21	12:02:07	-0400	1343597700542038017	repnancymace	Rep. Nancy Mace		Scientists have known for decades there are faster &amp; more effective drug testing methods than animal testing. But the FDA forces them to run unnecessary &amp; inhumane tests on animals to get new drugs approved.  It's time to bring the FDA to the 21st Century.  https://t.co/ILjS9y80rL	en	[]	['https://yhoo.it/3tzdbuk']	[]	13	12	52	[]	[]	https://twitter.com/RepNancyMace/status/1384900260707901443	False		0								[]				
1384898333739732992	1384898333739732992	2021-04-21 11:54:27 EDT	2021-04-21	11:54:27	-0400	1343597700542038017	repnancymace	Rep. Nancy Mace		Colonel Maura Hennigan delivered our office's Marine Corps Seal today! Daisy helped me accept. 🐶  Looking forward to displaying this in a place of honor for all of our Marines and veterans in the Lowcountry.  https://t.co/XoSRdYIMsX	en	[]	[]	['https://pbs.twimg.com/media/EzglsToWQAIsWv-.jpg']	6	10	157	[]	[]	https://twitter.com/RepNancyMace/status/1384898333739732992	False		1	https://pbs.twimg.com/media/EzglsToWQAIsWv-.jpg							[]				
1384882907714621440	1384882907714621440	2021-04-21 10:53:09 EDT	2021-04-21	10:53:09	-0400	1343597700542038017	repnancymace	Rep. Nancy Mace		I just discovered it takes approximately 5 minutes to sprint from the Cannon Office Building to @GOPLeader’s office in the Capitol WHILE wearing high heels 👠 😅 #TheMoreYouKnow  https://t.co/eo9rtfgpyb	en	[{'screen_name': 'gopleader', 'name': 'kevin mccarthy', 'id': '19739126'}]	[]	[]	57	12	150	['themoreyouknow']	[]	https://twitter.com/RepNancyMace/status/1384882907714621440	False		1	https://pbs.twimg.com/ext_tw_video_thumb/1384882882741784579/pu/img/O_c2HZRHUa-TzR_4.jpg							[]				
