id	conversation_id	created_at	date	time	timezone	user_id	username	name	place	tweet	language	mentions	urls	photos	replies_count	retweets_count	likes_count	hashtags	cashtags	link	retweet	quote_url	video	thumbnail	near	geo	source	user_rt_id	user_rt	retweet_id	reply_to	retweet_date	translate	trans_src	trans_dest
1398731851955589127	1398731851955589127	2021-05-29 16:03:55 EDT	2021-05-29	16:03:55	-0400	1343597700542038017	repnancymace	Rep. Nancy Mace		Just attended an historic Pinning Ceremony for the U.S. Naval Sea Cadets where Amelia Overman became the Yorktown Division's FIRST female Chief Petty Officer. 🦸‍♀️  I can't do her justice in a tweet. She's proven herself as a leader, and I can't wait to see what her future holds!  https://t.co/KPJLUKEbaJ	en	[]	[]	['https://pbs.twimg.com/media/E2lLNJLXoAkc--3.jpg', 'https://pbs.twimg.com/media/E2lLNJKXwAAIgXl.jpg', 'https://pbs.twimg.com/media/E2lLNJNXMAAB6d6.jpg', 'https://pbs.twimg.com/media/E2lLNJOXIAQiz4d.jpg']	8	5	71	[]	[]	https://twitter.com/RepNancyMace/status/1398731851955589127	False		1	https://pbs.twimg.com/media/E2lLNJLXoAkc--3.jpg							[]				
1398383669908226052	1398383669908226052	2021-05-28 17:00:22 EDT	2021-05-28	17:00:22	-0400	1343597700542038017	repnancymace	Rep. Nancy Mace		The pandemic hit few industries harder than tourism which hit #SC01 hard.  But Sweetgrass Inn is open for business! What a sign of the strength &amp; resilience of our Lowcountry business leaders. Huge props to Dan Battista &amp; his team for their hard work in making this possible!  https://t.co/KX9sZriOg6	en	[]	[]	['https://pbs.twimg.com/media/E2gOiYEXIAcSFtw.jpg']	11	1	20	['sc01']	[]	https://twitter.com/RepNancyMace/status/1398383669908226052	False		1	https://pbs.twimg.com/media/E2gOiYEXIAcSFtw.jpg							[]				
1398355039429799936	1398355039429799936	2021-05-28 15:06:36 EDT	2021-05-28	15:06:36	-0400	1343597700542038017	repnancymace	Rep. Nancy Mace		This is an historic moment for the Port of Charleston, the Lowcountry, &amp; South Carolina.  To have the record-breaking @cmacgm Marco Polo dock here is a reminder how much we've grown &amp; how vital our region is to America's economy.  https://t.co/sqcg8BFnDZ #SCPorts #CMACGMMarcoPolo  https://t.co/4eHqKSsb9O	en	[{'screen_name': 'cmacgm', 'name': 'cma cgm group', 'id': '557755826'}]	['https://bit.ly/3vwSy33']	['https://pbs.twimg.com/media/E2f0ffsWQAomagK.jpg', 'https://pbs.twimg.com/media/E2f0fodWQBUmY8L.jpg', 'https://pbs.twimg.com/media/E2f0f1tXwAA87Ql.jpg']	10	4	24	['scports', 'cmacgmmarcopolo']	[]	https://twitter.com/RepNancyMace/status/1398355039429799936	False		1	https://pbs.twimg.com/media/E2f0ffsWQAomagK.jpg							[]				
1398318102908178437	1398318102908178437	2021-05-28 12:39:49 EDT	2021-05-28	12:39:49	-0400	1343597700542038017	repnancymace	Rep. Nancy Mace		We can't afford to think of cyber threats as an afterthought any more. Reinforcing our cyber security must be a top priority.  Encouraging top cyber talent in federal agencies is a solid start. Can't thank @RepRoKhanna enough for introducing this w/ me.  https://t.co/nm5GbWxoeX  https://t.co/9ZB3vVitEf	en	[{'screen_name': 'reprokhanna', 'name': 'rep. ro khanna', 'id': '816298918468259841'}]	['https://bit.ly/3wGQqWs']	['https://pbs.twimg.com/media/E2fS5zoWYAEyvZC.png']	10	4	26	[]	[]	https://twitter.com/RepNancyMace/status/1398318102908178437	False		1	https://pbs.twimg.com/media/E2fS5zoWYAEyvZC.png							[]				
1398006209433714692	1398006207550480386	2021-05-27 16:00:28 EDT	2021-05-27	16:00:28	-0400	1343597700542038017	repnancymace	Rep. Nancy Mace		Here are some great vantage points:   - Sullivan’s Island - Patriot’s Point - SC Aquarium - Chas. Waterfront Park - Ravenel Bridge - Mt. Pleasant Shem Creek Park - Pitt Street Bridge - Charlotte St. Park Irish Memorial - Melton Peter Demetre Park - Mt. Pleasant Waterfront Park	en	[]	[]	[]	0	2	6	[]	[]	https://twitter.com/RepNancyMace/status/1398006209433714692	False		0								[]				
1398006207550480386	1398006207550480386	2021-05-27 16:00:28 EDT	2021-05-27	16:00:28	-0400	1343597700542038017	repnancymace	Rep. Nancy Mace		.@cmacgm is hosting an Instagram contest to see who can take the best pic of the Marco Polo as it docks in Charleston! I know I'll be there to see it.  Post your pics to Instagram &amp; tag @CMACGM w/ #CMACGMMarcoPolo! Tag @SCPorts &amp; use #SCPorts too!  https://t.co/TEGyNH2rVA	en	[{'screen_name': 'cmacgm', 'name': 'cma cgm group', 'id': '557755826'}, {'screen_name': 'cmacgm', 'name': 'cma cgm group', 'id': '557755826'}, {'screen_name': 'scports', 'name': 'south carolina ports', 'id': '36477784'}]	['https://bit.ly/3wJ0zCh']	[]	5	2	8	['cmacgmmarcopolo', 'scports']	[]	https://twitter.com/RepNancyMace/status/1398006207550480386	False		0								[]				
1397976280512057347	1397976280512057347	2021-05-27 14:01:33 EDT	2021-05-27	14:01:33	-0400	1343597700542038017	repnancymace	Rep. Nancy Mace		The Biden admin. has stopped even trying to pretend like they care about the national debt. Now, their reckless spending is ticking away at the savings of every working American with massive inflation.   We can't keep this up.  https://t.co/NovyIhxSpF	en	[]	[]	[]	46	9	33	[]	[]	https://twitter.com/RepNancyMace/status/1397976280512057347	False		1	https://pbs.twimg.com/media/E2acA19WYAEwaW0.jpg							[]				
1397948963005865985	1397948963005865985	2021-05-27 12:13:00 EDT	2021-05-27	12:13:00	-0400	1343597700542038017	repnancymace	Rep. Nancy Mace		We've made great progress toward making our justice system work for all, but we still have work to do.  The First Step Implementation Act will make our justice system fairer, more efficient, &amp; more effective. Thx to @RepJeffries for working w/ me on this!  https://t.co/eE8fmzdktW  https://t.co/rQSO2Zc2Hk	en	[{'screen_name': 'repjeffries', 'name': 'hakeem jeffries', 'id': '467823431'}]	['https://bit.ly/3i53yAy']	['https://pbs.twimg.com/media/E2aDLDsWQAg2fmd.png']	14	13	43	[]	[]	https://twitter.com/RepNancyMace/status/1397948963005865985	False		1	https://pbs.twimg.com/media/E2aDLDsWQAg2fmd.png							[]				
1397930797651296256	1397930797651296256	2021-05-27 11:00:49 EDT	2021-05-27	11:00:49	-0400	1343597700542038017	repnancymace	Rep. Nancy Mace		We're already seeing inflation skyrocket. Every dollar working Americans earn is worth LESS each day. It's effectively a hidden tax on workers.  The Biden admin's solution? Have the govt spend more money than ever and put us in Greece-level debt by 2031.  https://t.co/4fjwmsbkZ7	en	[]	['https://nyti.ms/3fRMECL']	[]	84	41	147	[]	[]	https://twitter.com/RepNancyMace/status/1397930797651296256	False		0								[]				
1397915682692423682	1397915682692423682	2021-05-27 10:00:45 EDT	2021-05-27	10:00:45	-0400	1343597700542038017	repnancymace	Rep. Nancy Mace		Our inaugural District Dog of the Week is a double-whammy! 🐶🐶  Jax and Cocco, German Shorthaired Pointers, are two adorable Charleston doggos who clearly love to hunt with their humans! 🦆🐕  Submit pics of YOUR pup HERE:  https://t.co/Ms8u4Br0Zi  https://t.co/YqTlNW1UGb	en	[]	['https://bit.ly/3fob3Rx']	['https://pbs.twimg.com/media/E2Zk5iOVIAAumd1.jpg', 'https://pbs.twimg.com/media/E2Zk5xzVUAASOSs.jpg']	0	5	35	[]	[]	https://twitter.com/RepNancyMace/status/1397915682692423682	False		1	https://pbs.twimg.com/media/E2Zk5iOVIAAumd1.jpg							[]				
1397906339888775176	1397906339888775176	2021-05-27 09:23:37 EDT	2021-05-27	09:23:37	-0400	1343597700542038017	repnancymace	Rep. Nancy Mace		"“Nancy Mace assured us she would do everything within her power to advance legislation that promotes the needs &amp; rights promised vets. I’m heartened to see that she is carrying through on her promises as a member of the VA Committee.""  Thank you Dr. Shimp!  https://t.co/goTwdsZp8Z"	en	[]	['https://bit.ly/2SySYaA']	[]	4	5	9	[]	[]	https://twitter.com/RepNancyMace/status/1397906339888775176	False		0								[]				
1397619231349518343	1397619231349518343	2021-05-26 14:22:45 EDT	2021-05-26	14:22:45	-0400	1343597700542038017	repnancymace	Rep. Nancy Mace		The perseverance Amy Sutherland and the rest of Jamal Sutherland's family has shown throughout this tragedy is nothing short of heroic.   We need transparency. We need accountability. We need reform. This can't be allowed to continue.  https://t.co/StGzK14yXN	en	[]	['https://bit.ly/3wvgSSM']	[]	16	3	13	[]	[]	https://twitter.com/RepNancyMace/status/1397619231349518343	False		0								[]				
1397591270676127745	1397591270676127745	2021-05-26 12:31:39 EDT	2021-05-26	12:31:39	-0400	1343597700542038017	repnancymace	Rep. Nancy Mace		Reading the story behind Dorothy Yaun's development as the incredible artist she is today is inspiring.    Her Congressional Art Competition-winning portrait was beautiful enough. To learn more about the woman who created it is even more so.  https://t.co/ETyO1VhkL6  https://t.co/zq3bBjVeme	en	[]	['https://bit.ly/3bV53h6']	['https://pbs.twimg.com/media/E2U92ZUXMAYmhXP.jpg']	2	3	14	[]	[]	https://twitter.com/RepNancyMace/status/1397591270676127745	False		1	https://pbs.twimg.com/media/E2U92ZUXMAYmhXP.jpg							[]				
1397357070698090499	1397357070698090499	2021-05-25 21:01:01 EDT	2021-05-25	21:01:01	-0400	1343597700542038017	repnancymace	Rep. Nancy Mace		Republicans have been trying for weeks to meet Democrats &amp; the Biden admin. halfway on a REAL infrastructure bill. The problem is Dems don't want a bipartisan bill.  They want to be able to claim they tried to get one, &amp; then pass the radical left bill they wanted from the start.  https://t.co/Q5nYJxDWDH	en	[]	[]	[]	73	12	64	[]	[]	https://twitter.com/RepNancyMace/status/1397357070698090499	False		1	https://pbs.twimg.com/media/E2Ro2IfXoAIvMcM.jpg							[]				
1397315460614524933	1397315460614524933	2021-05-25 18:15:41 EDT	2021-05-25	18:15:41	-0400	1343597700542038017	repnancymace	Rep. Nancy Mace		From the beginning, anyone who even SUGGESTED it might be POSSIBLE COVID-19 originated in a lab was ruthlessly mocked by the left &amp; the media. Until recently, we were all told this was some conspiracy theory.  Now, here we are.  https://t.co/o9yeVy4ld1	en	[]	[]	[]	28	17	64	[]	[]	https://twitter.com/RepNancyMace/status/1397315460614524933	False		1	https://pbs.twimg.com/media/E2RDAK2XoAM4bUt.jpg							[]				
1397284085849014281	1397284085849014281	2021-05-25 16:11:01 EDT	2021-05-25	16:11:01	-0400	1343597700542038017	repnancymace	Rep. Nancy Mace		Congress' failure to seriously address our infrastructure challenges isn't some theoretical exercise. It impacts real people with real families.   The Biden admin. needs to get real, stop caving to the far-left, &amp; honestly work w/ Republicans on a bill which will help all of us.  https://t.co/PibefQpb05	en	[]	[]	[]	35	5	28	[]	[]	https://twitter.com/RepNancyMace/status/1397284085849014281	False		1	https://pbs.twimg.com/media/E2Qmd1FXoAUTN2F.jpg							[]				
1397258959535452172	1397258959535452172	2021-05-25 14:31:10 EDT	2021-05-25	14:31:10	-0400	1343597700542038017	repnancymace	Rep. Nancy Mace		Protecting the privacy of Americans is a no-brainer. I'm cosponsoring the bipartisan ENCRYPT Act with @RepTedLieu to ensure the government can't force private companies to hand over your data only to then use it against you.  https://t.co/iAZj7oLGF3  https://t.co/OKTMArA5uk	en	[{'screen_name': 'reptedlieu', 'name': 'rep. ted lieu', 'id': '3044993235'}]	['https://bit.ly/3hPGKVp']	['https://pbs.twimg.com/media/E2QPnlTXsAofR4t.png']	1	3	22	[]	[]	https://twitter.com/RepNancyMace/status/1397258959535452172	False		1	https://pbs.twimg.com/media/E2QPnlTXsAofR4t.png							[]				
1397246055834587142	1397246055834587142	2021-05-25 13:39:53 EDT	2021-05-25	13:39:53	-0400	1343597700542038017	repnancymace	Rep. Nancy Mace		Americans donate their organs to save others' lives every day. Sadly, this selfless act puts them at risk of losing their jobs, health insurance, &amp; more.  I'm working across the aisle to pass a bill which protects them from being punished for their generosity. @FOX24Charleston  https://t.co/hwdH5Rbe2p	en	[{'screen_name': 'fox24charleston', 'name': 'fox 24 news', 'id': '79555668'}]	[]	[]	9	4	19	[]	[]	https://twitter.com/RepNancyMace/status/1397246055834587142	False		1	https://pbs.twimg.com/media/E2QD4SLWUAAXSx4.jpg							[]				
1397183216113569793	1397183216113569793	2021-05-25 09:30:11 EDT	2021-05-25	09:30:11	-0400	1343597700542038017	repnancymace	Rep. Nancy Mace		One year ago, George Floyd was murdered. He was pinned to the ground until he couldn't breathe for 9 minutes and 29 seconds.   His death exposed undeniable problems with our justice system, ones we're still struggling to rectify. Ones I'm determined to take head on. #GeorgeFloyd  https://t.co/7NRZ8A3eb9	en	[]	[]	['https://pbs.twimg.com/media/E2PKuqOXIA47rdK.png']	71	22	198	['georgefloyd']	[]	https://twitter.com/RepNancyMace/status/1397183216113569793	False		1	https://pbs.twimg.com/media/E2PKuqOXIA47rdK.png							[]				
1396994590771748868	1396994590771748868	2021-05-24 21:00:40 EDT	2021-05-24	21:00:40	-0400	1343597700542038017	repnancymace	Rep. Nancy Mace		Indoctrinating our kids with a curriculum based in Marxist ideology has no place in American institutions. Not a single taxpayer dime should support Critical Race Theory.  https://t.co/6n8XxJUr5o	en	[]	[]	[]	42	19	88	[]	[]	https://twitter.com/RepNancyMace/status/1396994590771748868	False		1	https://pbs.twimg.com/media/E2MfLFtX0AMoJa4.jpg							[]				
1396964406702055428	1396964406702055428	2021-05-24 19:00:43 EDT	2021-05-24	19:00:43	-0400	1343597700542038017	repnancymace	Rep. Nancy Mace		Republicans have come to the negotiating table time and time again to try and produce a bill which would genuinely tackle our nation's infrastructure challenges.   Sadly, the Biden administration isn't interested in real bipartisanship.  https://t.co/s4bXKsUGDQ	en	[]	[]	[]	58	7	52	[]	[]	https://twitter.com/RepNancyMace/status/1396964406702055428	False		1	https://pbs.twimg.com/media/E2MDuJ0XsAAiPSX.jpg							[]				
1396930265763680265	1396930265763680265	2021-05-24 16:45:03 EDT	2021-05-24	16:45:03	-0400	1343597700542038017	repnancymace	Rep. Nancy Mace		We leave school curriculum to local school boards for a reason. They're directly accountable to parents. DC bureaucrats are not.  Forcing a poisonous curriculum like Critical Race Theory on kids is among the worst examples of federal overreach.  https://t.co/QnWvJe8HyV  https://t.co/Cp4DdGKXOF	en	[]	['https://bit.ly/3yDrTmS']	['https://pbs.twimg.com/media/E2LkrFPXEAMQb9j.png']	36	9	48	[]	[]	https://twitter.com/RepNancyMace/status/1396930265763680265	False		1	https://pbs.twimg.com/media/E2LkrFPXEAMQb9j.png							[]				
1396910867715866627	1396910867715866627	2021-05-24 15:27:58 EDT	2021-05-24	15:27:58	-0400	1343597700542038017	repnancymace	Rep. Nancy Mace		Take a bite out of this one: A South Carolina high school teacher caught the largest shark in state history off of Edisto Island! Two fins up for Nikki Colwell 🦈 🎣 🦸‍♀️  https://t.co/nS7wDRvgiW	en	[]	['http://live5news.com/2021/05/24/sc-teacher-reels-record-setting-shark/']	[]	8	2	29	[]	[]	https://twitter.com/RepNancyMace/status/1396910867715866627	False		0								[]				
1396903828927168512	1396903828927168512	2021-05-24 15:00:00 EDT	2021-05-24	15:00:00	-0400	1343597700542038017	repnancymace	Rep. Nancy Mace		Calling all Lowcountry dog owners: We want to meet your fur babies! 🐶   Share a story and a picture of your #SC01 pup to be featured on our social media and newsletter!  https://t.co/IUdLRTyxH8	en	[]	['https://bit.ly/2TgiuSg']	[]	5	2	4	['sc01']	[]	https://twitter.com/RepNancyMace/status/1396903828927168512	False		0								[]				
1396888895846064130	1396888895846064130	2021-05-24 14:00:40 EDT	2021-05-24	14:00:40	-0400	1343597700542038017	repnancymace	Rep. Nancy Mace		Huge props to @lyft for offering discounted rides to and from vaccine appointments across the Lowcountry!  Getting as many people vaccinated as possible is key to getting our region &amp; America back to normal, &amp; this removes one more barrier. #GetVaccinated!  https://t.co/ck9a229uYT	en	[{'screen_name': 'lyft', 'name': 'lyft', 'id': '569569550'}]	['https://lft.to/34cjLMl']	[]	6	2	13	['getvaccinated']	[]	https://twitter.com/RepNancyMace/status/1396888895846064130	False		0								[]				
1396878282663071747	1396878282663071747	2021-05-24 13:18:29 EDT	2021-05-24	13:18:29	-0400	1343597700542038017	repnancymace	Rep. Nancy Mace		President Biden needs to retake Civics 101. It is not the role of the federal government to determine local housing policy.  Americans elect mayors, city councilors, governors &amp; state legislators to tackle these issues, not presidents.  https://t.co/9Xd79lu7Ip	en	[]	[]	[]	50	5	51	[]	[]	https://twitter.com/RepNancyMace/status/1396878282663071747	False		1	https://pbs.twimg.com/amplify_video_thumb/1396878060528472065/img/HdQ4Sh2k4vMzLn0K.jpg							[]				
1396858884346814468	1396858884346814468	2021-05-24 12:01:25 EDT	2021-05-24	12:01:25	-0400	1343597700542038017	repnancymace	Rep. Nancy Mace		Met with morning with Charleston Mayor @JohnTecklenburg and his team on the project to restore the Battery Sea Wall.   Charleston faces serious flooding issues, now and going forward. This is an important project, and I'm determined to support Charleston's needs as #SC01 grows.  https://t.co/bijMedQlF1	en	[{'screen_name': 'johntecklenburg', 'name': 'mayor tecklenburg', 'id': '2248531659'}]	[]	[]	10	5	16	['sc01']	[]	https://twitter.com/RepNancyMace/status/1396858884346814468	False		1	https://pbs.twimg.com/media/E2Kjv2bXEAMR7Ix.jpg							[]				
1396835931966033923	1396835931966033923	2021-05-24 10:30:12 EDT	2021-05-24	10:30:12	-0400	1343597700542038017	repnancymace	Rep. Nancy Mace		Restoring the Crab Bank 🦀 estuary required all our elected officials rolling up their sleeves and working together to solve this. To our Lowcountry leaders, thank you! @LindseyGrahamSC, Mayor @willhaynie, @USACEHQ, @SCDNR.  https://t.co/XMlrWSaSDU	en	[{'screen_name': 'lindseygrahamsc', 'name': 'lindsey graham', 'id': '432895323'}, {'screen_name': 'willhaynie', 'name': 'will haynie', 'id': '65376147'}, {'screen_name': 'usacehq', 'name': 'usace hq', 'id': '161329769'}, {'screen_name': 'scdnr', 'name': 's.c. dept. of natural resources', 'id': '46129982'}]	['https://bit.ly/3wzaEBF']	[]	2	5	12	[]	[]	https://twitter.com/RepNancyMace/status/1396835931966033923	False		0								[]				
1396801892475412481	1396801892475412481	2021-05-24 08:14:57 EDT	2021-05-24	08:14:57	-0400	1343597700542038017	repnancymace	Rep. Nancy Mace		History was made in SC-01 this weekend.  Congratulations to @PhilMickelson on your hard fought win! #PGAChamp 🏆 ⛳️ 👏🏼	en	[{'screen_name': 'philmickelson', 'name': 'phil mickelson', 'id': '1027351783071346688'}]	[]	[]	8	12	103	['pgachamp']	[]	https://twitter.com/RepNancyMace/status/1396801892475412481	False	https://twitter.com/pgachampionship/status/1396604208883851264	0								[]				
1396595455543349249	1396595455543349249	2021-05-23 18:34:38 EDT	2021-05-23	18:34:38	-0400	1343597700542038017	repnancymace	Rep. Nancy Mace		There is absolutely nothing I could ever say which would help ease the pain of this loss. All I can say is I’m praying for the families of Deas Hill, and I will do all in my power to ensure the perpetrators are brought to justice.  https://t.co/SVb8uowMUO	en	[]	['https://bit.ly/3oUelPP']	[]	27	3	22	[]	[]	https://twitter.com/RepNancyMace/status/1396595455543349249	False		0								[]				
1395818551597019137	1395818551597019137	2021-05-21 15:07:30 EDT	2021-05-21	15:07:30	-0400	1343597700542038017	repnancymace	Rep. Nancy Mace		It's a beautiful day here at the PGA Championship! South Carolina is BACK and open for business.  Got the chance to speak w/ leaders of some of SC's most successful employers, @ScientificVikor &amp; @DukeEnergy!  https://t.co/3pkLk6FKWj	en	[{'screen_name': 'scientificvikor', 'name': 'vikor scientific', 'id': '1033468995515633664'}, {'screen_name': 'dukeenergy', 'name': 'duke energy', 'id': '81192849'}]	[]	['https://pbs.twimg.com/media/E17xkRTXMAEY3kK.jpg', 'https://pbs.twimg.com/media/E17xkhYXsAEXVc-.jpg', 'https://pbs.twimg.com/media/E17xkunXoAAodgk.jpg']	9	4	52	[]	[]	https://twitter.com/RepNancyMace/status/1395818551597019137	False		1	https://pbs.twimg.com/media/E17xkRTXMAEY3kK.jpg							[]				
1395817448415408129	1395817448415408129	2021-05-21 15:03:07 EDT	2021-05-21	15:03:07	-0400	1343597700542038017	repnancymace	Rep. Nancy Mace		In Congress, you never eat lunch alone. 🐶  #DogsOfTheHill #FlashbackFriday  https://t.co/nkyXsw6nCP	en	[]	[]	[]	14	3	75	['dogsofthehill', 'flashbackfriday']	[]	https://twitter.com/RepNancyMace/status/1395817448415408129	False		1	https://pbs.twimg.com/media/E17wkdyXMAIYTo9.jpg							[]				
1395726238279479299	1395726238279479299	2021-05-21 09:00:41 EDT	2021-05-21	09:00:41	-0400	1343597700542038017	repnancymace	Rep. Nancy Mace		Working in a restaurant is hard in the best circumstances. But millions of Americans worked their tails off to keep us fed &amp; take our minds off stressful times throughout the pandemic.  From a former waitress, thank you. Always tip your waitstaff! 🧇🧇🧇 #NationalWaitstaffDay  https://t.co/amsCPqCRf2	en	[]	[]	['https://pbs.twimg.com/media/E16dnY-WUAU4TD0.jpg']	28	6	76	['nationalwaitstaffday']	[]	https://twitter.com/RepNancyMace/status/1395726238279479299	False		1	https://pbs.twimg.com/media/E16dnY-WUAU4TD0.jpg							[]				
1395510907594289155	1395510907594289155	2021-05-20 18:45:02 EDT	2021-05-20	18:45:02	-0400	1343597700542038017	repnancymace	Rep. Nancy Mace		Our debt does more than put our economic future at risk. It risks our ability to defend ourselves in a hostile world.  We must force Washington to recognize our debt as a national security risk, and I'm co-sponsoring a resolution to do it.  https://t.co/bqCQ9EtJDi  https://t.co/rQvNwyWO6R	en	[]	['https://bit.ly/3u15Q69']	['https://pbs.twimg.com/media/E13ZxjgXIAYxMg-.jpg']	93	14	52	[]	[]	https://twitter.com/RepNancyMace/status/1395510907594289155	False		1	https://pbs.twimg.com/media/E13ZxjgXIAYxMg-.jpg							[]				
1395477334766014498	1395477334766014498	2021-05-20 16:31:37 EDT	2021-05-20	16:31:37	-0400	1343597700542038017	repnancymace	Rep. Nancy Mace		This is absolutely unacceptable. Veterans have enough to worry about without people ripping them out of their homes.	en	[]	[]	[]	31	9	22	[]	[]	https://twitter.com/RepNancyMace/status/1395477334766014498	False	https://twitter.com/Live5News/status/1395099729382543360	0								[]				
1395476992070459396	1395476992070459396	2021-05-20 16:30:16 EDT	2021-05-20	16:30:16	-0400	1343597700542038017	repnancymace	Rep. Nancy Mace		We need to get our kids back in school as quickly and as safely as possible. Allowing schools to use federal properties to safely get back to in-person learning is a no-brainer.  Congress should pass the LEARN Act as soon as possible.  https://t.co/uelXCIBweA  https://t.co/knJ7r3jeyo	en	[]	['https://bit.ly/3bHGrIv']	['https://pbs.twimg.com/media/E1267cdXsAkE16J.jpg']	28	16	36	[]	[]	https://twitter.com/RepNancyMace/status/1395476992070459396	False		1	https://pbs.twimg.com/media/E1267cdXsAkE16J.jpg							[]				
1395450585130930176	1395450585130930176	2021-05-20 14:45:20 EDT	2021-05-20	14:45:20	-0400	1343597700542038017	repnancymace	Rep. Nancy Mace		The families of veterans who've been killed or disabled in the line of duty shouldn't have to worry about when their tuition assistance will expire.  Our vets' sacrifice for America doesn't expire. Neither should our promises to them.  https://t.co/Bh5cqmlWNE	en	[]	[]	[]	12	3	31	[]	[]	https://twitter.com/RepNancyMace/status/1395450585130930176	False		1	https://pbs.twimg.com/media/E12i6ExWQAAivxH.jpg							[]				
1395420347760095234	1395420347760095234	2021-05-20 12:45:11 EDT	2021-05-20	12:45:11	-0400	1343597700542038017	repnancymace	Rep. Nancy Mace		Just finished a vote on Nancy Pelosi's bill to militarize the Capitol. The absolute LAST thing we should be spending $500 million of YOUR money on is turning YOUR Capitol Building into a military base.  We need to be MORE accessible to the people, not less.  https://t.co/GGigsZU3JP	en	[]	[]	[]	92	13	125	[]	[]	https://twitter.com/RepNancyMace/status/1395420347760095234	False		1	https://pbs.twimg.com/media/E12HaKXXMA8QcB0.jpg							[]				
1395382851751792648	1395382851751792648	2021-05-20 10:16:11 EDT	2021-05-20	10:16:11	-0400	1343597700542038017	repnancymace	Rep. Nancy Mace		Rich O'Brien is an incredible humanitarian whose work with PGA HOPE and golf therapy has improved the lives of countless veterans across the Lowcountry.  Thank you, Rich!  https://t.co/WGZJhJPgyC	en	[]	[]	[]	8	4	39	[]	[]	https://twitter.com/RepNancyMace/status/1395382851751792648	False		1	https://pbs.twimg.com/media/E11lTkFWEAYEAWW.jpg							[]				
1395147154130456582	1395147154130456582	2021-05-19 18:39:36 EDT	2021-05-19	18:39:36	-0400	1343597700542038017	repnancymace	Rep. Nancy Mace		As we speak, 10 congressional committees and 4 federal agencies are investigating Jan. 6.  I am committed to holding those responsible accountable, but we do not need duplicate efforts to probe the insurrection w/ yet another federal panel.  https://t.co/nW9iftSoTJ  https://t.co/pldu7C7CSm	en	[]	['https://bit.ly/3f1XHu3']	['https://pbs.twimg.com/media/E1yO8UNX0AILdyQ.png']	233	27	111	[]	[]	https://twitter.com/RepNancyMace/status/1395147154130456582	False		1	https://pbs.twimg.com/media/E1yO8UNX0AILdyQ.png							[]				
