id	conversation_id	created_at	date	time	timezone	user_id	username	name	place	tweet	language	mentions	urls	photos	replies_count	retweets_count	likes_count	hashtags	cashtags	link	retweet	quote_url	video	thumbnail	near	geo	source	user_rt_id	user_rt	retweet_id	reply_to	retweet_date	translate	trans_src	trans_dest
1374545168775458818	1374545168775458818	2021-03-23 22:14:40 EDT	2021-03-23	22:14:40	-0400	1351236267707654145	senalexpadilla	Senator Alex Padilla		"Today, Postmaster General DeJoy announced a plan called ""Delivering for America"" that would do exactly the opposite — making mail delivery slower, reducing post office hours, and hiking postage prices.  The American people deserve better. DeJoy should be removed immediately."	en	[]	[]	[]	50	270	1025	[]	[]	https://twitter.com/SenAlexPadilla/status/1374545168775458818	False		0								[]				
1374510223633752066	1374510223633752066	2021-03-23 19:55:49 EDT	2021-03-23	19:55:49	-0400	1351236267707654145	senalexpadilla	Senator Alex Padilla		NEW: My office has launched a COVID-19 resource page to help Californians access critical info and navigate what’s in the American Rescue Plan. Please spread the word ⤵️  https://t.co/4lPDCjjfuB	en	[]	['https://www.padilla.senate.gov/coronavirus/']	[]	5	31	90	[]	[]	https://twitter.com/SenAlexPadilla/status/1374510223633752066	False		0								[]				
1374474652441927681	1374474652441927681	2021-03-23 17:34:28 EDT	2021-03-23	17:34:28	-0400	1351236267707654145	senalexpadilla	Senator Alex Padilla		Central Valley and LA communities face some of the most toxic air pollution.   @SenFeinstein and I are calling for California's authority to set vehicle emissions standards to be restored because everyone deserves clean air to breathe.  https://t.co/lTIy6BGXRG	en	[{'screen_name': 'senfeinstein', 'name': 'senator dianne feinstein', 'id': '476256944'}]	[]	[]	5	50	195	[]	[]	https://twitter.com/SenAlexPadilla/status/1374474652441927681	False		1	https://pbs.twimg.com/ext_tw_video_thumb/1374474597991510024/pu/img/u2m4GOUW7DGxUzMn.jpg							[]				
1374449581627371521	1374449581627371521	2021-03-23 15:54:50 EDT	2021-03-23	15:54:50	-0400	1351236267707654145	senalexpadilla	Senator Alex Padilla		I’m on the Senate floor speaking on why we must pass the #ForThePeople Act to protect the right to vote and save our democracy. Watch live:  https://t.co/AzK52GhHLO	en	[]	['https://twitter.com/i/broadcasts/1BRKjBLwkVBKw']	[]	38	159	621	['forthepeople']	[]	https://twitter.com/SenAlexPadilla/status/1374449581627371521	False		0								[]				
1374427399195037702	1374427399195037702	2021-03-23 14:26:42 EDT	2021-03-23	14:26:42	-0400	1351236267707654145	senalexpadilla	Senator Alex Padilla		In the 11 years since passing, the ACA has transformed our health care system by:  ➡️ Expanding coverage to &gt;20m Americans ➡️ Protecting those with pre-existing conditions  ➡️ Expanding Medicaid  We must keep fighting to protect &amp; expand health care until it is guaranteed to all.	en	[]	[]	[]	17	45	269	[]	[]	https://twitter.com/SenAlexPadilla/status/1374427399195037702	False		0								[]				
1374403531256389640	1374403531256389640	2021-03-23 12:51:51 EDT	2021-03-23	12:51:51	-0400	1351236267707654145	senalexpadilla	Senator Alex Padilla		It should not be easier to buy a gun than it is to cast a ballot.	en	[]	[]	[]	623	6751	35747	[]	[]	https://twitter.com/SenAlexPadilla/status/1374403531256389640	False		0								[]				
1374362661245353984	1374362661245353984	2021-03-23 10:09:27 EDT	2021-03-23	10:09:27	-0400	1351236267707654145	senalexpadilla	Senator Alex Padilla		There couldn’t be a more clear call to action to end gun violence. I’m joining @JudiciaryDems in discussing commonsense gun safety reforms. Watch live:	en	[{'screen_name': 'judiciarydems', 'name': 'senate judiciary committee', 'id': '818513652814843906'}]	[]	[]	14	44	172	[]	[]	https://twitter.com/SenAlexPadilla/status/1374362661245353984	False	https://twitter.com/JudiciaryDems/status/1374360113893498884	0								[]				
1374181975053983755	1374181975053983755	2021-03-22 22:11:28 EDT	2021-03-22	22:11:28	-0400	1351236267707654145	senalexpadilla	Senator Alex Padilla		My heart breaks for the Boulder community and the families of the victims in yet another tragic shooting.  We must remember that we are not powerless. We need to act now to end gun violence.	en	[]	[]	[]	13	45	302	[]	[]	https://twitter.com/SenAlexPadilla/status/1374181975053983755	False	https://twitter.com/USATODAY/status/1374165474389413893	0								[]				
1374162554403098624	1374162554403098624	2021-03-22 20:54:18 EDT	2021-03-22	20:54:18	-0400	1351236267707654145	senalexpadilla	Senator Alex Padilla		Voter suppression and the filibuster are both rooted in white supremacy. To save our democracy and our country, we must end both.	en	[]	[]	[]	43	458	1853	[]	[]	https://twitter.com/SenAlexPadilla/status/1374162554403098624	False		0								[]				
1374143529480507400	1374143529480507400	2021-03-22 19:38:42 EDT	2021-03-22	19:38:42	-0400	1351236267707654145	senalexpadilla	Senator Alex Padilla		Thank you to everyone for their kind birthday wishes today. Reflecting on this past year, I really do have a lot to be grateful for — including this surprise in the office today. My staff knows me well! ⚾️  https://t.co/i3ewBwlBO4	en	[]	[]	['https://pbs.twimg.com/media/ExHwQN9XEAE_v5O.jpg']	22	20	318	[]	[]	https://twitter.com/SenAlexPadilla/status/1374143529480507400	False		1	https://pbs.twimg.com/media/ExHwQN9XEAE_v5O.jpg							[]				
1374066000237318145	1374066000237318145	2021-03-22 14:30:38 EDT	2021-03-22	14:30:38	-0400	1351236267707654145	senalexpadilla	Senator Alex Padilla		The ability to access COVID care should never depend on immigration status.   Proud to join @SenatorBennet in urging @POTUS to ensure that everyone—including undocumented immigrants—can receive COVID testing, treatment &amp; vaccines without worrying about how they'll pay for them.	en	[{'screen_name': 'senatorbennet', 'name': 'michael bennet', 'id': '224285242'}, {'screen_name': 'potus', 'name': 'president biden', 'id': '1349149096909668363'}]	[]	[]	14	46	188	[]	[]	https://twitter.com/SenAlexPadilla/status/1374066000237318145	False	https://twitter.com/SenatorBennet/status/1373043188051677186	0								[]				
1374013089713098753	1374013089713098753	2021-03-22 11:00:23 EDT	2021-03-22	11:00:23	-0400	1351236267707654145	senalexpadilla	Senator Alex Padilla		Continuing to deny Washington, D.C. a vote in Congress means denying full representation to the Black and Brown voters who make up a majority in our nation’s capital. Let's pass #DCStatehood now.	en	[]	[]	[]	26	286	1430	['dcstatehood']	[]	https://twitter.com/SenAlexPadilla/status/1374013089713098753	False		0								[]				
1373984721445781509	1373984721445781509	2021-03-22 09:07:39 EDT	2021-03-22	09:07:39	-0400	1351236267707654145	senalexpadilla	Senator Alex Padilla		In order to fight climate change, we must follow CA’s lead to eliminate harmful pollution from the transportation sector.   @SenFeinstein &amp; I are calling on @POTUS to restore CA's authority to set clean car standards while improving national standards.  https://t.co/xJHjaT1BPg	en	[{'screen_name': 'senfeinstein', 'name': 'senator dianne feinstein', 'id': '476256944'}, {'screen_name': 'potus', 'name': 'president biden', 'id': '1349149096909668363'}]	['https://www.reuters.com/article/us-autos-emissions-california-exclusive-idUSKBN2BE111']	[]	23	56	325	[]	[]	https://twitter.com/SenAlexPadilla/status/1373984721445781509	False		0								[]				
1373775547294171137	1373775547294171137	2021-03-21 19:16:28 EDT	2021-03-21	19:16:28	-0400	1351236267707654145	senalexpadilla	Senator Alex Padilla		The #EqualityAct isn’t just about tolerance. It’s about respect. It’s about letting children be who they are. It’s about letting their parents love who they love. It’s about affirming the words carved above the Supreme Court of the United States: equal justice under law.	en	[]	[]	[]	17	121	548	['equalityact']	[]	https://twitter.com/SenAlexPadilla/status/1373775547294171137	False		0								[]				
1373420832735834112	1373420832735834112	2021-03-20 19:46:58 EDT	2021-03-20	19:46:58	-0400	1351236267707654145	senalexpadilla	Senator Alex Padilla		Since Citizens United, dark money and super PACs have polluted our political system. We’re going to end this corruption with the #ForThePeople Act and get dark money OUT of our elections.	en	[]	[]	[]	31	227	1039	['forthepeople']	[]	https://twitter.com/SenAlexPadilla/status/1373420832735834112	False		0								[]				
1373380665916465158	1373380665916465158	2021-03-20 17:07:21 EDT	2021-03-20	17:07:21	-0400	1351236267707654145	senalexpadilla	Senator Alex Padilla		Congratulations to @RWCLibrary for being named a finalist for the nation’s highest service award for libraries and museums! In the face of a pandemic, their efforts to help educate and serve their community have never been more critical. They make California proud.	en	[{'screen_name': 'rwclibrary', 'name': 'redwood city library', 'id': '87603022'}]	[]	[]	3	3	44	[]	[]	https://twitter.com/SenAlexPadilla/status/1373380665916465158	False	https://twitter.com/RWCLibrary/status/1372550524780875779	0								[]				
1373354771969622022	1373354771969622022	2021-03-20 15:24:27 EDT	2021-03-20	15:24:27	-0400	1351236267707654145	senalexpadilla	Senator Alex Padilla		Happy #Nowruz to everyone celebrating the arrival of Spring in California and around the world. May the spirit of Nowruz bring hope, peace, and good health to you and your family!	en	[]	[]	[]	8	38	252	['nowruz']	[]	https://twitter.com/SenAlexPadilla/status/1373354771969622022	False		0								[]				
1373076945567686659	1373076945567686659	2021-03-19 21:00:29 EDT	2021-03-19	21:00:29	-0400	1351236267707654145	senalexpadilla	Senator Alex Padilla		Let's be clear: immigration status does not impact vaccine eligibility.   No one should be asked about their citizenship or immigration status when they get a vaccine.  https://t.co/3sTYtihsHQ	en	[]	['https://abc7.com/covid-19-vaccine-undocumented-immigrants-san-fernando-valley-cdc-guidelines/10421134/']	[]	7	131	389	[]	[]	https://twitter.com/SenAlexPadilla/status/1373076945567686659	False		0								[]				
1373038288676732929	1373038288676732929	2021-03-19 18:26:52 EDT	2021-03-19	18:26:52	-0400	1351236267707654145	senalexpadilla	Senator Alex Padilla		To date, administrations of both parties have been silent on the truth of the Armenian Genocide. Proud to stand with the Armenian community and join @SenatorMenendez in calling on @POTUS to affirm the historical facts of this genocide.  https://t.co/HF8zHkAJYG	en	[{'screen_name': 'senatormenendez', 'name': 'senator bob menendez', 'id': '18695134'}, {'screen_name': 'potus', 'name': 'president biden', 'id': '1349149096909668363'}]	[]	['https://pbs.twimg.com/media/Ew39JUhWQAM2fhI.jpg', 'https://pbs.twimg.com/media/Ew39fExXIAIeQMC.jpg', 'https://pbs.twimg.com/media/Ew39gCqWEAseY13.jpg']	68	246	861	[]	[]	https://twitter.com/SenAlexPadilla/status/1373038288676732929	False		1	https://pbs.twimg.com/media/Ew39JUhWQAM2fhI.jpg							[]				
1373010135916875790	1373010135916875790	2021-03-19 16:35:00 EDT	2021-03-19	16:35:00	-0400	1351236267707654145	senalexpadilla	Senator Alex Padilla		I'll be joining @KNX1070 shortly to talk about how COVID relief will help Californians — tune in!	en	[{'screen_name': 'knx1070', 'name': 'knx 1070 newsradio', 'id': '18149465'}]	[]	[]	3	6	69	[]	[]	https://twitter.com/SenAlexPadilla/status/1373010135916875790	False		0								[]				
1372967145139757058	1372967145139757058	2021-03-19 13:44:10 EDT	2021-03-19	13:44:10	-0400	1351236267707654145	senalexpadilla	Senator Alex Padilla		COVID has exposed the stark contrast between those with access to Wi-Fi &amp; the luxury of Zooming in to work and those who must put their lives at risk working on farms, at grocery stores, in construction, or at hospitals. We must continue to address these inequities.  https://t.co/HLukaXZGvY	en	[]	[]	[]	3	10	84	[]	[]	https://twitter.com/SenAlexPadilla/status/1372967145139757058	False		1	https://pbs.twimg.com/ext_tw_video_thumb/1372967026214502406/pu/img/OJo5RXE3tqry8Xfb.jpg							[]				
1372947206999846919	1372947206999846919	2021-03-19 12:24:56 EDT	2021-03-19	12:24:56	-0400	1351236267707654145	senalexpadilla	Senator Alex Padilla		Thinking of those whose lives were stolen in the Atlanta shooting:   Daoyou Feng Paul Andre Michels Xiaojie Tan Delaina Ashley Yaun Hyun J. Grant Suncha Kim Soon C. Park Yong A. Yue   They were friends, parents, partners, and neighbors. We must say and know their names.	en	[]	[]	[]	6	112	497	[]	[]	https://twitter.com/SenAlexPadilla/status/1372947206999846919	False		0								[]				
1372936271283228672	1372936271283228672	2021-03-19 11:41:29 EDT	2021-03-19	11:41:29	-0400	1351236267707654145	senalexpadilla	Senator Alex Padilla		Congratulations to Jesse Magdaleno who, through his hard work and dedication to his community, has received the Boys and Girls Club's Coastal California Youth of the Year award. I have no doubt that he will go on to accomplish great things. Adelante!  https://t.co/M7w9WgEpkO	en	[]	[]	['https://pbs.twimg.com/media/Ew2mPkYXEAUOBQj.jpg']	3	7	138	[]	[]	https://twitter.com/SenAlexPadilla/status/1372936271283228672	False		1	https://pbs.twimg.com/media/Ew2mPkYXEAUOBQj.jpg							[]				
1372728082289803266	1372728082289803266	2021-03-18 21:54:13 EDT	2021-03-18	21:54:13	-0400	1351236267707654145	senalexpadilla	Senator Alex Padilla		Last month, I received the COVID-19 vaccine. Vaccines are safe, effective, and crucial in beating this virus. Please get yours as soon as you are able.  Californians: check your eligibility at  https://t.co/CB7yJhrqFW  #ThrowbackThursday  https://t.co/O7ffzhU8Ao	en	[]	['https://myturn.ca.gov/']	['https://pbs.twimg.com/media/Ewzo6S5WUAAQB0p.jpg']	4	30	266	['throwbackthursday']	[]	https://twitter.com/SenAlexPadilla/status/1372728082289803266	False		1	https://pbs.twimg.com/media/Ewzo6S5WUAAQB0p.jpg							[]				
1372699387864965125	1372699387864965125	2021-03-18 20:00:12 EDT	2021-03-18	20:00:12	-0400	1351236267707654145	senalexpadilla	Senator Alex Padilla		Big news: the Dream &amp; Promise Act and the Farm Workforce Modernization Act both passed the House today with bipartisan support.   This lays the foundation for a pathway to citizenship for all 11 million undocumented immigrants who call America home. Let's keep up this momentum.	en	[]	[]	[]	46	325	1473	[]	[]	https://twitter.com/SenAlexPadilla/status/1372699387864965125	False		0								[]				
1372625990720094209	1372625990720094209	2021-03-18 15:08:33 EDT	2021-03-18	15:08:33	-0400	1351236267707654145	senalexpadilla	Senator Alex Padilla		Thank you @RepGraceMeng for your powerful testimony in today's @HouseJudiciary hearing on anti-Asian hate &amp; discrimination. I stand with you not just in solidarity, but in action to help our Asian American &amp; Pacific Islander community feel seen, heard, and safe in this country.	en	[{'screen_name': 'repgracemeng', 'name': 'grace meng', 'id': '1051127714'}, {'screen_name': 'housejudiciary', 'name': 'house judiciary dems', 'id': '246357149'}]	[]	[]	2	21	100	[]	[]	https://twitter.com/SenAlexPadilla/status/1372625990720094209	False	https://twitter.com/ABC/status/1372585677251084290	0								[]				
1372608874029723655	1372608874029723655	2021-03-18 14:00:32 EDT	2021-03-18	14:00:32	-0400	1351236267707654145	senalexpadilla	Senator Alex Padilla		Electrifying our public transportation system will create nearly a million jobs, help modernize our crumbling infrastructure, and fight the climate crisis. That’s good for everyone, and why I am proud to join @SenWarren, @SenMarkey, @RepAOC &amp; @RepAndyLevin on the #BuildGreen Act.	en	[{'screen_name': 'senwarren', 'name': 'elizabeth warren', 'id': '970207298'}, {'screen_name': 'senmarkey', 'name': 'ed markey', 'id': '21406834'}, {'screen_name': 'repaoc', 'name': 'rep. alexandria ocasio-cortez', 'id': '1079104563280527364'}, {'screen_name': 'repandylevin', 'name': 'rep. andy levin', 'id': '1080277407867772930'}]	[]	[]	38	158	837	['buildgreen']	[]	https://twitter.com/SenAlexPadilla/status/1372608874029723655	False	https://twitter.com/SenWarren/status/1372599574427238402	0								[]				
1372591492380905472	1372591492380905472	2021-03-18 12:51:27 EDT	2021-03-18	12:51:27	-0400	1351236267707654145	senalexpadilla	Senator Alex Padilla		Congratulations to my friend @XavierBecerra on his confirmation as our nation's top public health official—the first Latino to serve in the role.   I know he's ready to get to work to protect health care for millions, tackle structural inequities, and help defeat this pandemic.	en	[{'screen_name': 'xavierbecerra', 'name': 'xavier becerra', 'id': '565469671'}]	[]	[]	4	39	314	[]	[]	https://twitter.com/SenAlexPadilla/status/1372591492380905472	False	https://twitter.com/axios/status/1372590062454538240	0								[]				
1372574064477417472	1372574064477417472	2021-03-18 11:42:12 EDT	2021-03-18	11:42:12	-0400	1351236267707654145	senalexpadilla	Senator Alex Padilla		During the pandemic alone, @StopAAPIHate has received nearly 3,800 reports of hate incidents against Asian Americans.   We must fight the dangerous rhetoric fueling this surge in bigotry &amp; violence and reform the systems upholding it. We must pass the #COVID19 Hate Crimes Act.	en	[{'screen_name': 'stopaapihate', 'name': 'stop aapi hate', 'id': '1295455922777501696'}]	[]	[]	2	18	121	['covid19']	[]	https://twitter.com/SenAlexPadilla/status/1372574064477417472	False		0								[]				
1372555006008823808	1372555006008823808	2021-03-18 10:26:28 EDT	2021-03-18	10:26:28	-0400	1351236267707654145	senalexpadilla	Senator Alex Padilla		The American Rescue Plan will help California beat this crisis by putting shots in arms, money in pockets, children in schools, and people in jobs.  https://t.co/XVGYVDymcX	en	[]	['https://www.nytimes.com/2021/03/16/us/ca-federal-stimulus.html']	[]	1	10	89	[]	[]	https://twitter.com/SenAlexPadilla/status/1372555006008823808	False		0								[]				
1372320806072684547	1372320806072684547	2021-03-17 18:55:51 EDT	2021-03-17	18:55:51	-0400	1351236267707654145	senalexpadilla	Senator Alex Padilla		As the first Latinos in our respective positions, @XavierBecerra &amp; I are not unfamiliar with being held to different standards. That's what the cynical delays and political games around his nomination have been about.  It’s time to let him get to work.	en	[{'screen_name': 'xavierbecerra', 'name': 'xavier becerra', 'id': '565469671'}]	[]	[]	12	135	762	[]	[]	https://twitter.com/SenAlexPadilla/status/1372320806072684547	False		0								[]				
1372309493342691332	1372309493342691332	2021-03-17 18:10:54 EDT	2021-03-17	18:10:54	-0400	1351236267707654145	senalexpadilla	Senator Alex Padilla		I am on the Senate floor speaking about why we must confirm @XavierBecerra, a proven leader and champion for equity, as our next HHS Secretary. Watch live:  https://t.co/WDos3aZz9U	en	[{'screen_name': 'xavierbecerra', 'name': 'xavier becerra', 'id': '565469671'}]	['https://twitter.com/i/broadcasts/1jMKgpdMgBmGL']	[]	5	56	247	[]	[]	https://twitter.com/SenAlexPadilla/status/1372309493342691332	False		0								[]				
1372290360823713792	1372290360823713792	2021-03-17 16:54:52 EDT	2021-03-17	16:54:52	-0400	1351236267707654145	senalexpadilla	Senator Alex Padilla		Congratulations @SenatorWarnock on a wonderful first floor speech on the importance of protecting the sacred right to vote &amp; the urgent need for the Senate to take action. I look forward to working together to ensure every voice is heard in our democracy.	en	[{'screen_name': 'senatorwarnock', 'name': 'senator reverend raphael warnock', 'id': '1352287997853622273'}]	[]	[]	1	38	288	[]	[]	https://twitter.com/SenAlexPadilla/status/1372290360823713792	False	https://twitter.com/SenatorWarnock/status/1372230275330101251	0								[]				
1372225384247390208	1372225384247390208	2021-03-17 12:36:40 EDT	2021-03-17	12:36:40	-0400	1351236267707654145	senalexpadilla	Senator Alex Padilla		Let’s call polices like ending no excuse absentee voting &amp; limiting weekend voting what they are: voter suppression. We must fight these injustices &amp; pass the John Lewis #VotingRightsAct to expand access to the ballot box &amp; #ProtectTheVote.	en	[]	[]	[]	41	332	1454	['votingrightsact', 'protectthevote']	[]	https://twitter.com/SenAlexPadilla/status/1372225384247390208	False		0								[]				
1372210343641026575	1371968214209544195	2021-03-17 11:36:55 EDT	2021-03-17	11:36:55	-0400	1351236267707654145	senalexpadilla	Senator Alex Padilla		@SenWarren Thank you, @SenWarren. It is an honor to work with you on my first bill in the Senate and fight alongside you to make our country and democracy work better for America's working families.	en	[{'screen_name': 'senwarren', 'name': 'elizabeth warren', 'id': '970207298'}]	[]	[]	1	1	68	[]	[]	https://twitter.com/SenAlexPadilla/status/1372210343641026575	False		0								[{'screen_name': 'SenWarren', 'name': 'Elizabeth Warren', 'id': '970207298'}]				
1372209395715686404	1372209395715686404	2021-03-17 11:33:09 EDT	2021-03-17	11:33:09	-0400	1351236267707654145	senalexpadilla	Senator Alex Padilla		It has been two decades since Congress last took significant action to improve our elections—we can't wait any longer. The fate of our democracy rests on our ability to protect voting rights for all citizens. That's why we're introducing the #ForthePeople Act in the Senate today.	en	[]	[]	[]	44	171	630	['forthepeople']	[]	https://twitter.com/SenAlexPadilla/status/1372209395715686404	False		0								[]				
1372186567863902214	1372186567863902214	2021-03-17 10:02:26 EDT	2021-03-17	10:02:26	-0400	1351236267707654145	senalexpadilla	Senator Alex Padilla		The Senate is holding its first-ever hearing on the #EqualityAct right now. Watch live below:	en	[]	[]	[]	3	18	73	['equalityact']	[]	https://twitter.com/SenAlexPadilla/status/1372186567863902214	False	https://twitter.com/JudiciaryDems/status/1372185591417335824	0								[]				
1372177814007513090	1372177814007513090	2021-03-17 09:27:39 EDT	2021-03-17	09:27:39	-0400	1351236267707654145	senalexpadilla	Senator Alex Padilla		I am horrified and heartbroken by the shooting last night in Atlanta. My heart is with the victims, their loved ones, and the AAPI community.  Enough is enough. We must take action to #StopAsianHate.	en	[]	[]	[]	7	73	455	['stopasianhate']	[]	https://twitter.com/SenAlexPadilla/status/1372177814007513090	False		0								[]				
1371953925511917569	1371854654783508485	2021-03-16 18:38:00 EDT	2021-03-16	18:38:00	-0400	1351236267707654145	senalexpadilla	Senator Alex Padilla		Millions of immigrant essential workers have been called heroes throughout the pandemic. It's time to thank them with more than just our words.   Looking forward to my conversation with @CHIRLA in a few minutes—tune in on my Instagram:  https://t.co/a9hLIHPkns	en	[{'screen_name': 'chirla', 'name': 'chirla', 'id': '16568741'}]	['https://www.instagram.com/senalexpadilla/']	[]	0	7	58	[]	[]	https://twitter.com/SenAlexPadilla/status/1371953925511917569	False		0								[]				
1371929907257864194	1371929907257864194	2021-03-16 17:02:33 EDT	2021-03-16	17:02:33	-0400	1351236267707654145	senalexpadilla	Senator Alex Padilla		The environmental crises we face demand more than simply scaling up our current efforts.   That's why I'm joining @RepRaulGrijalva, @RepJoeNeguse, @SenBlumenthal, &amp; @SenatorLujan in advocating for @POTUS to work with communities to decide how to preserve American lands &amp; waters.	en	[{'screen_name': 'repraulgrijalva', 'name': 'raul m. grijalva', 'id': '28602948'}, {'screen_name': 'repjoeneguse', 'name': 'rep. joe neguse', 'id': '1078749802765139968'}, {'screen_name': 'senblumenthal', 'name': 'richard blumenthal', 'id': '278124059'}, {'screen_name': 'senatorlujan', 'name': 'ben ray luján', 'id': '19318314'}, {'screen_name': 'potus', 'name': 'president biden', 'id': '1349149096909668363'}]	[]	[]	4	16	85	[]	[]	https://twitter.com/SenAlexPadilla/status/1371929907257864194	False	https://twitter.com/NRDems/status/1371832435042877454	0								[]				
1371890641068814336	1371890641068814336	2021-03-16 14:26:31 EDT	2021-03-16	14:26:31	-0400	1351236267707654145	senalexpadilla	Senator Alex Padilla		Yesterday, the son of Mexican immigrants from a working-class town in California rose to speak on the floor of the U.S. Senate. While this is my story, it is not unique to me—it is the American Dream that we must keep alive for future generations.  https://t.co/18KjxLSAaq	en	[]	['https://www.dailynews.com/2021/03/15/alex-padillas-first-senate-speech-two-americas-exposed-by-pandemic-demand-bold-response/']	[]	23	250	1414	[]	[]	https://twitter.com/SenAlexPadilla/status/1371890641068814336	False		0								[]				
1371854654783508485	1371854654783508485	2021-03-16 12:03:32 EDT	2021-03-16	12:03:32	-0400	1351236267707654145	senalexpadilla	Senator Alex Padilla		I will be joining @CHIRLA and @CAPimmigration for an Instagram Live today to discuss the urgent need for a pathway to citizenship for essential workers.   It will be live on my IG page at 6:45pm ET. Hope you'll tune in:  https://t.co/xuLCBri2Tx	en	[{'screen_name': 'chirla', 'name': 'chirla', 'id': '16568741'}, {'screen_name': 'capimmigration', 'name': 'cap immigration', 'id': '46733238'}]	['https://www.instagram.com/chirla_org/']	[]	9	49	146	[]	[]	https://twitter.com/SenAlexPadilla/status/1371854654783508485	False	https://twitter.com/CHIRLA/status/1371690447563857923	0								[]				
