id	conversation_id	created_at	date	time	timezone	user_id	username	name	place	tweet	language	mentions	urls	photos	replies_count	retweets_count	likes_count	hashtags	cashtags	link	retweet	quote_url	video	thumbnail	near	geo	source	user_rt_id	user_rt	retweet_id	reply_to	retweet_date	translate	trans_src	trans_dest
1398713516551512069	1398655393694470144	2021-05-29 14:51:03 EDT	2021-05-29	14:51:03	-0400	1351236267707654145	senalexpadilla	Senator Alex Padilla		@SenJeffMerkley Glad to be fighting alongside you, @SenJeffMerkley.	en	[{'screen_name': 'senjeffmerkley', 'name': 'senator jeff merkley', 'id': '29201047'}]	[]	[]	2	4	147	[]	[]	https://twitter.com/SenAlexPadilla/status/1398713516551512069	False		0								[{'screen_name': 'SenJeffMerkley', 'name': 'Senator Jeff Merkley', 'id': '29201047'}]				
1398415236227608580	1398415236227608580	2021-05-28 19:05:48 EDT	2021-05-28	19:05:48	-0400	1351236267707654145	senalexpadilla	Senator Alex Padilla		As we head into Memorial Day Weekend, I had the opportunity to visit Arlington National Cemetery and honor those who made the ultimate sacrifice in defense of our nation and our democracy.   Today especially, I am reflecting on how we must uphold the democracy they fought for.  https://t.co/hcBCP9mJFO	en	[]	[]	[]	10	27	107	[]	[]	https://twitter.com/SenAlexPadilla/status/1398415236227608580	False		1	https://pbs.twimg.com/amplify_video_thumb/1398361512931115010/img/GE6JS8t3aoiaVSND.jpg							[]				
1398378295117422595	1398378295117422595	2021-05-28 16:39:00 EDT	2021-05-28	16:39:00	-0400	1351236267707654145	senalexpadilla	Senator Alex Padilla		The truth is that Latino communities want the COVID-19 vaccine—but barriers and misinformation remain.   I'm leading my colleagues in calling on the Biden Admin to improve access &amp; provide accurate info on vaccine cost, safety, and sick leave policies.  https://t.co/32gO3VlI7F	en	[]	['https://abcnews.go.com/Health/vaccine-access-hesitancy-problem-latinos-senators/story?id=77961547']	[]	12	76	219	[]	[]	https://twitter.com/SenAlexPadilla/status/1398378295117422595	False		0								[]				
1398351080623427591	1398351080623427591	2021-05-28 14:50:52 EDT	2021-05-28	14:50:52	-0400	1351236267707654145	senalexpadilla	Senator Alex Padilla		Between extreme heat from wildfires and the COVID pandemic, workers in CA and across the U.S. have risked their health &amp; safety to keep our country running.  I'm teaming up with @SenSherrodBrown to protect these workers from heat stress on the job.  #NationalHeatAwarenessDay	en	[{'screen_name': 'sensherrodbrown', 'name': 'sherrod brown', 'id': '43910797'}]	[]	[]	16	42	209	['nationalheatawarenessday']	[]	https://twitter.com/SenAlexPadilla/status/1398351080623427591	False		0								[]				
1398337913868402691	1398337913868402691	2021-05-28 13:58:33 EDT	2021-05-28	13:58:33	-0400	1351236267707654145	senalexpadilla	Senator Alex Padilla		A minority of my Republican colleagues were able to block a January 6th commission that a majority of the Senate voted to move forward with—one meant to investigate a deadly attack on our democracy. If this isn't proof that the filibuster is undemocratic, I don't know what is.	en	[]	[]	[]	43	234	887	[]	[]	https://twitter.com/SenAlexPadilla/status/1398337913868402691	False		0								[]				
1398312448759828481	1398312448759828481	2021-05-28 12:17:21 EDT	2021-05-28	12:17:21	-0400	1351236267707654145	senalexpadilla	Senator Alex Padilla		If my Republican colleagues will filibuster a bipartisan, independent commission—one that they themselves negotiated the terms of—to investigate an attack on our democracy, what else will they filibuster?   We shouldn't wait to find out.	en	[]	[]	[]	35	154	710	[]	[]	https://twitter.com/SenAlexPadilla/status/1398312448759828481	False		0								[]				
1398032226655342597	1398032226655342597	2021-05-27 17:43:51 EDT	2021-05-27	17:43:51	-0400	1351236267707654145	senalexpadilla	Senator Alex Padilla		My Republican colleagues have a choice: vote for the truth, or preserve their loyalty to Donald Trump.  If they choose the latter, the January 6th insurrectionists will have succeeded.	en	[]	[]	[]	24	71	336	[]	[]	https://twitter.com/SenAlexPadilla/status/1398032226655342597	False		0								[]				
1398027931885215745	1398027931885215745	2021-05-27 17:26:47 EDT	2021-05-27	17:26:47	-0400	1351236267707654145	senalexpadilla	Senator Alex Padilla		We swore an oath to support and defend the Constitution of the United States against all enemies, foreign and domestic.   I'm on the Senate floor calling on my colleagues to uphold their oaths and vote for the January 6th commission.  https://t.co/tirLEaE1ne	en	[]	['https://twitter.com/i/broadcasts/1MnxnlEPMLyGO']	[]	33	279	1151	[]	[]	https://twitter.com/SenAlexPadilla/status/1398027931885215745	False		0								[]				
1398008292832653326	1398008292832653326	2021-05-27 16:08:45 EDT	2021-05-27	16:08:45	-0400	1351236267707654145	senalexpadilla	Senator Alex Padilla		Joining @jaketapper on CNN to discuss the Jan. 6th commission. Tune in soon.  https://t.co/MIG1Skejm7	en	[{'screen_name': 'jaketapper', 'name': 'jake tapper', 'id': '14529929'}]	[]	['https://pbs.twimg.com/media/E2a5H43XEAEiTGG.jpg']	5	6	79	[]	[]	https://twitter.com/SenAlexPadilla/status/1398008292832653326	False		1	https://pbs.twimg.com/media/E2a5H43XEAEiTGG.jpg							[]				
1397985993064583172	1397985993064583172	2021-05-27 14:40:08 EDT	2021-05-27	14:40:08	-0400	1351236267707654145	senalexpadilla	Senator Alex Padilla		No president should have the power to ban travel to the US based solely on religion or country of origin. We must ensure that Trump's xenophobic policies are never repeated.   That's why I'm introducing the Access to Counsel Act with @RepJayapal alongside @ChrisCoons' NO BAN Act.	en	[{'screen_name': 'repjayapal', 'name': 'rep. pramila jayapal', 'id': '815733290955112448'}, {'screen_name': 'chriscoons', 'name': 'senator chris coons', 'id': '15324851'}]	[]	[]	62	105	398	[]	[]	https://twitter.com/SenAlexPadilla/status/1397985993064583172	False		0								[]				
1397934974796451840	1397934974796451840	2021-05-27 11:17:25 EDT	2021-05-27	11:17:25	-0400	1351236267707654145	senalexpadilla	Senator Alex Padilla		The pursuit of Republican votes on infrastructure can't come at the expense of limiting popular investments.   This is a once-in-a-generation opportunity to tackle the climate crisis, create jobs, &amp; reshape vital sectors like caregiving &amp; clean energy.  Now is the time to go big.	en	[]	[]	[]	23	53	227	[]	[]	https://twitter.com/SenAlexPadilla/status/1397934974796451840	False		0								[]				
1397676306649788419	1397676306649788419	2021-05-26 18:09:33 EDT	2021-05-26	18:09:33	-0400	1351236267707654145	senalexpadilla	Senator Alex Padilla		My heart breaks for the San Jose community and for the families who tragically lost their loved ones in yet another senseless mass shooting. We must put an end to this disturbing cycle of tragedy. I am committed to passing commonsense reforms that will protect our communities.	en	[]	[]	[]	13	32	223	[]	[]	https://twitter.com/SenAlexPadilla/status/1397676306649788419	False		0								[]				
1397583220284305409	1397583220284305409	2021-05-26 11:59:40 EDT	2021-05-26	11:59:40	-0400	1351236267707654145	senalexpadilla	Senator Alex Padilla		My team and I are continuing to monitor this tragic news. My thoughts are with the entire San Jose community on this dark morning.	en	[]	[]	[]	2	12	94	[]	[]	https://twitter.com/SenAlexPadilla/status/1397583220284305409	False	https://twitter.com/mercnews/status/1397566527545688071	0								[]				
1397566448101466118	1397566448101466118	2021-05-26 10:53:01 EDT	2021-05-26	10:53:01	-0400	1351236267707654145	senalexpadilla	Senator Alex Padilla		At every step, politicians need to make it easier, not harder, for citizens to exercise their right to vote. It’s time for the country to follow California's lead and implement automatic voter registration for all.   Read my op-ed for @DemocracyDocket ⬇️	en	[{'screen_name': 'democracydocket', 'name': 'democracy docket', 'id': '841489249157468161'}]	[]	[]	18	433	1764	[]	[]	https://twitter.com/SenAlexPadilla/status/1397566448101466118	False	https://twitter.com/marceelias/status/1397552354581491712	0								[]				
1397286241150902279	1397286241150902279	2021-05-25 16:19:34 EDT	2021-05-25	16:19:34	-0400	1351236267707654145	senalexpadilla	Senator Alex Padilla		Throughout her career, Kristen Clarke has been an unwavering ally to the most vulnerable amongst us. I'm thrilled to have supported her historic nomination and look forward to working with her to strengthen our democracy.  https://t.co/GvjzSTLD1m	en	[]	['https://www.latimes.com/politics/story/2021-05-25/kristen-clarke-becomes-first-woman-of-color-to-officially-helm-doj-civil-rights-division']	[]	7	32	152	[]	[]	https://twitter.com/SenAlexPadilla/status/1397286241150902279	False		0								[]				
1397263318331666433	1397263318331666433	2021-05-25 14:48:29 EDT	2021-05-25	14:48:29	-0400	1351236267707654145	senalexpadilla	Senator Alex Padilla		Urban Indian Organizations are a lifeline to Native Americans living in urban areas across CA. I'm leading a bipartisan bill with @SenatorLankford, @RepRubenGallego, and @RepDonBacon to help improve the quality of health care they provide to patients.  https://t.co/spevbQA78t	en	[{'screen_name': 'senatorlankford', 'name': 'sen. james lankford', 'id': '225921757'}, {'screen_name': 'reprubengallego', 'name': 'ruben gallego', 'id': '2966570782'}, {'screen_name': 'repdonbacon', 'name': 'rep. don bacon', 'id': '818975124460335106'}]	['https://www.indianz.com/News/2021/05/25/bipartisan-bill-brings-long-overdue-boost-to-urban-indian-health-providers/']	[]	2	19	58	[]	[]	https://twitter.com/SenAlexPadilla/status/1397263318331666433	False		0								[]				
1397246938983145474	1397246938983145474	2021-05-25 13:43:24 EDT	2021-05-25	13:43:24	-0400	1351236267707654145	senalexpadilla	Senator Alex Padilla		.@KristenClarkeJD is exceptionally qualified and ready to champion civil rights for all Americans.  Today, I am proud to vote to #ConfirmClarke as Assistant Attorney General, the first Black woman to lead the Civil Rights Division of the DOJ.	en	[{'screen_name': 'kristenclarkejd', 'name': 'kristen clarke', 'id': '84734907'}]	[]	[]	6	46	205	['confirmclarke']	[]	https://twitter.com/SenAlexPadilla/status/1397246938983145474	False		0								[]				
1397229397166460938	1397229397166460938	2021-05-25 12:33:42 EDT	2021-05-25	12:33:42	-0400	1351236267707654145	senalexpadilla	Senator Alex Padilla		Eliminate the filibuster and pass the George Floyd Justice in Policing Act.	en	[]	[]	[]	38	239	986	[]	[]	https://twitter.com/SenAlexPadilla/status/1397229397166460938	False		0								[]				
1397211329048498182	1397211329048498182	2021-05-25 11:21:54 EDT	2021-05-25	11:21:54	-0400	1351236267707654145	senalexpadilla	Senator Alex Padilla		Trump systematically undermined the independence of our immigration courts to push his anti-immigrant agenda. I'm teaming up with @SenatorDurbin and other @JudiciaryDems to call on the Biden Admin to reverse this damage and protect the judges' union.  https://t.co/zClyiA4xpa	en	[{'screen_name': 'senatordurbin', 'name': 'senator dick durbin', 'id': '247334603'}, {'screen_name': 'judiciarydems', 'name': 'senate judiciary committee', 'id': '818513652814843906'}]	['https://rollcall.com/2021/05/24/durbin-padilla-urge-garland-to-protect-immigration-judges-union/']	[]	16	53	179	[]	[]	https://twitter.com/SenAlexPadilla/status/1397211329048498182	False		0								[]				
1397195693081743365	1397195693081743365	2021-05-25 10:19:46 EDT	2021-05-25	10:19:46	-0400	1351236267707654145	senalexpadilla	Senator Alex Padilla		One year ago today, former police officer Derek Chauvin murdered George Floyd while three other officers looked on. The pain of his death led Americans to rise up by the millions to demand change to our criminal justice system. We must honor him with real reform.  https://t.co/ImeWD5shVX	en	[]	[]	['https://pbs.twimg.com/media/E2PTFMwWYAwbztl.jpg']	20	89	323	[]	[]	https://twitter.com/SenAlexPadilla/status/1397195693081743365	False		1	https://pbs.twimg.com/media/E2PTFMwWYAwbztl.jpg							[]				
1396949753439694852	1396949753439694852	2021-05-24 18:02:29 EDT	2021-05-24	18:02:29	-0400	1351236267707654145	senalexpadilla	Senator Alex Padilla		California is home to more immigrants than any state in the nation and represents the largest economy in the nation. That's not a coincidence.   #ImmigrantsAreEssential to the economic power of California and our country.	en	[]	[]	[]	19	66	309	['immigrantsareessential']	[]	https://twitter.com/SenAlexPadilla/status/1396949753439694852	False		0								[]				
1396929801076752392	1396929801076752392	2021-05-24 16:43:12 EDT	2021-05-24	16:43:12	-0400	1351236267707654145	senalexpadilla	Senator Alex Padilla		From protecting voting rights to increasing access to health care, jobs, and higher education for our Black and Brown communities, I was glad to join leaders from the @ULBayArea to discuss some of the most pressing issues affecting our communities.  https://t.co/81Ylte5A0j	en	[{'screen_name': 'ulbayarea', 'name': 'urban league of greater san francisco bay area', 'id': '1379648270218055680'}]	[]	['https://pbs.twimg.com/media/E2LkN5bWEAMLX7a.jpg']	2	3	21	[]	[]	https://twitter.com/SenAlexPadilla/status/1396929801076752392	False		1	https://pbs.twimg.com/media/E2LkN5bWEAMLX7a.jpg							[]				
1396879785440260099	1396879785440260099	2021-05-24 13:24:28 EDT	2021-05-24	13:24:28	-0400	1351236267707654145	senalexpadilla	Senator Alex Padilla		Student debt is holding back 3.5 million borrowers in California alone from owning homes, saving for retirement, and staying afloat.  President Biden can and should #CancelStudentDebt to lift this burden for millions of Americans and boost our economy.	en	[]	[]	[]	151	465	2081	['cancelstudentdebt']	[]	https://twitter.com/SenAlexPadilla/status/1396879785440260099	False		0								[]				
1396860014900518914	1396860014900518914	2021-05-24 12:05:54 EDT	2021-05-24	12:05:54	-0400	1351236267707654145	senalexpadilla	Senator Alex Padilla		Like many parents of color, I experienced George Floyd’s murder through a painful double vision: my own grief and anger, and the anguish of my three young sons. One year later, we must remain committed to reforming our broken system.  https://t.co/elhYM70oKx	en	[]	['https://www.usatoday.com/in-depth/opinion/2021/05/24/year-after-murder-george-floyd-americans-react-his-death/5080199001/']	[]	7	27	87	[]	[]	https://twitter.com/SenAlexPadilla/status/1396860014900518914	False		0								[]				
1396834265447518213	1396834265447518213	2021-05-24 10:23:35 EDT	2021-05-24	10:23:35	-0400	1351236267707654145	senalexpadilla	Senator Alex Padilla		We must make good on the promise to make voting easier and more accessible for all eligible citizens. That’s why I’m keeping up the urgent fight in Congress to pass the For the People Act.	en	[]	[]	[]	18	142	749	[]	[]	https://twitter.com/SenAlexPadilla/status/1396834265447518213	False		0								[]				
1396819063398141957	1396819063398141957	2021-05-24 09:23:11 EDT	2021-05-24	09:23:11	-0400	1351236267707654145	senalexpadilla	Senator Alex Padilla		Infrastructure is not just roads, bridges, and tunnels. We have an obligation to be bigger and bolder and address climate change.  https://t.co/p7U91eveZe	en	[]	['https://www.capradio.org/news/california-state-of-mind-podcast/2021/05/21/when-it-comes-to-immigration-reform-and-clean-energy-its-personal-for-sen-alex-padilla/']	[]	6	32	123	[]	[]	https://twitter.com/SenAlexPadilla/status/1396819063398141957	False		0								[]				
1396653038828494852	1396653038828494852	2021-05-23 22:23:27 EDT	2021-05-23	22:23:27	-0400	1351236267707654145	senalexpadilla	Senator Alex Padilla		While Trump may be gone, Trumpism clearly isn't. We have a Republican Party that is choosing to protect party loyalty over truth about the violent &amp; deadly insurrection on January 6th.  https://t.co/YrSuB9XWr3	en	[]	[]	[]	17	45	151	[]	[]	https://twitter.com/SenAlexPadilla/status/1396653038828494852	False		1	https://pbs.twimg.com/ext_tw_video_thumb/1396652913565577216/pu/img/Ai9l9McMCv2MEcFQ.jpg							[]				
1395833534888173569	1395833534888173569	2021-05-21 16:07:02 EDT	2021-05-21	16:07:02	-0400	1351236267707654145	senalexpadilla	Senator Alex Padilla		Millions of Americans and businesses rely on @USPS to deliver our medicine, ballots, and retail goods—securely and on time. We must invest in the long-term strength and stability of the Postal Service.	en	[{'screen_name': 'usps', 'name': 'u.s. postal service', 'id': '386507775'}]	[]	[]	34	38	176	[]	[]	https://twitter.com/SenAlexPadilla/status/1395833534888173569	False	https://twitter.com/ABC/status/1395549895902339074	0								[]				
1395805897587298304	1395805897587298304	2021-05-21 14:17:13 EDT	2021-05-21	14:17:13	-0400	1351236267707654145	senalexpadilla	Senator Alex Padilla		CA has administered over 35 MILLION vaccines—let's keep up this momentum. Help a friend or neighbor get their vaccine this weekend by:  🔍 Going to  https://t.co/CB7yJhrqFW 💬 Texting your ZIP code to 438829  📞 Calling 1-800-232-0233  #WeCanDoThis	en	[]	['https://myturn.ca.gov/']	[]	3	17	63	['wecandothis']	[]	https://twitter.com/SenAlexPadilla/status/1395805897587298304	False		0								[]				
1395789737068216326	1395789737068216326	2021-05-21 13:13:00 EDT	2021-05-21	13:13:00	-0400	1351236267707654145	senalexpadilla	Senator Alex Padilla		Expanding @rosieriveternps to include Nystrom Elementary School helps honor the contributions of the American women—real life Rosie the Riveters—who entered the workforce during World War II. Preserving the diverse legacy of all Americans must be a priority for our parks system.	en	[{'screen_name': 'rosieriveternps', 'name': 'rosie riveter nhp', 'id': '3301608800'}]	[]	[]	1	8	20	[]	[]	https://twitter.com/SenAlexPadilla/status/1395789737068216326	False	https://twitter.com/RepDeSaulnier/status/1395556095234543621	0								[]				
1395740670548131850	1395740670548131850	2021-05-21 09:58:02 EDT	2021-05-21	09:58:02	-0400	1351236267707654145	senalexpadilla	Senator Alex Padilla		"""As Congress considers the long-awaited infrastructure bill, Sen. Padilla's Clean Commute for Kids Act is a must-include investment for the 21st century.""  https://t.co/AkOWzljKXH"	en	[]	['https://www.mercurynews.com/2021/05/20/opinion-all-electric-buses-will-provide-clean-school-transportation/']	[]	6	20	90	[]	[]	https://twitter.com/SenAlexPadilla/status/1395740670548131850	False		0								[]				
1395546065781280770	1395546065781280770	2021-05-20 21:04:44 EDT	2021-05-20	21:04:44	-0400	1351236267707654145	senalexpadilla	Senator Alex Padilla		"When discussing the filibuster, I'm often asked, ""What if Republicans are in the majority again?"" That's a chance I'm willing to take. We know what we need to do on voting rights, gun safety, &amp; climate—we can't let a procedural relic stand in the way.  https://t.co/Df7H4maivW"	en	[]	['https://www.rollingstone.com/politics/politics-features/democrats-filibuster-biden-mcconnell-manchin-1168837/']	[]	46	35	198	[]	[]	https://twitter.com/SenAlexPadilla/status/1395546065781280770	False		0								[]				
1395506627948818432	1395506627948818432	2021-05-20 18:28:02 EDT	2021-05-20	18:28:02	-0400	1351236267707654145	senalexpadilla	Senator Alex Padilla		By lifting significant financial burdens and increasing accountability for mail delivery, we can ensure the @USPS better serves the American people. Proud to be part of the bipartisan group of Senators working to make this happen.  https://t.co/ND1D3UE9Bn	en	[{'screen_name': 'usps', 'name': 'u.s. postal service', 'id': '386507775'}]	['https://www.washingtonpost.com/business/2021/05/19/usps-senate-bipartisan-agreement/?wpmk=1&wpisrc=al_business__alert-politics--alert-economy']	[]	7	9	71	[]	[]	https://twitter.com/SenAlexPadilla/status/1395506627948818432	False		0								[]				
1395490663249088516	1395490663249088516	2021-05-20 17:24:35 EDT	2021-05-20	17:24:35	-0400	1351236267707654145	senalexpadilla	Senator Alex Padilla		Proud to be by your side in the fight for health care justice, @AdyBarkan.	en	[{'screen_name': 'adybarkan', 'name': 'ady barkan', 'id': '76837768'}]	[]	[]	11	19	107	[]	[]	https://twitter.com/SenAlexPadilla/status/1395490663249088516	False	https://twitter.com/nowthisnews/status/1395402182585831424	0								[]				
1395474423214452737	1395474423214452737	2021-05-20 16:20:03 EDT	2021-05-20	16:20:03	-0400	1351236267707654145	senalexpadilla	Senator Alex Padilla		Reports of an anti-Semitic attack at a Beverly Grove restaurant in Los Angeles are deeply disturbing. Everyone deserves to feel safe in their own community—we must make clear that acts of hate and prejudice have no place in California or the rest of the country.	en	[]	[]	[]	17	31	214	[]	[]	https://twitter.com/SenAlexPadilla/status/1395474423214452737	False		0								[]				
1395452166559703042	1395452166559703042	2021-05-20 14:51:37 EDT	2021-05-20	14:51:37	-0400	1351236267707654145	senalexpadilla	Senator Alex Padilla		BREAKING: President Biden just signed the COVID-19 Hate Crimes Act into law. Together, we are sending a united and resolute message that acts of hate &amp; discrimination of any kind have no place in this country. Together, we are standing up to #StopAsianHate.	en	[]	[]	[]	97	62	345	['stopasianhate']	[]	https://twitter.com/SenAlexPadilla/status/1395452166559703042	False		0								[]				
1395424687065387010	1395424687065387010	2021-05-20 13:02:25 EDT	2021-05-20	13:02:25	-0400	1351236267707654145	senalexpadilla	Senator Alex Padilla		Our mental health needs the same care and attention as our physical health. If you’ve been struggling, know that you are not alone, and you deserve support. Make a plan to reach out today:  https://t.co/tlAieWRqil. #MentalHealthActionDay  https://t.co/rmIFfj8aBs	en	[]	['https://nami.org/help']	['https://pbs.twimg.com/media/E12LW2nWUAgatqP.jpg']	257	14	53	['mentalhealthactionday']	[]	https://twitter.com/SenAlexPadilla/status/1395424687065387010	False		1	https://pbs.twimg.com/media/E12LW2nWUAgatqP.jpg							[]				
1395392151610134529	1395392151610134529	2021-05-20 10:53:08 EDT	2021-05-20	10:53:08	-0400	1351236267707654145	senalexpadilla	Senator Alex Padilla		148 years ago today, Levi Strauss &amp; Jacob Davis received a patent to create work pants in San Francisco, CA, marking the birth of one of the world’s most famous garments: blue jeans. The original paperwork is still in the CA Secretary of State's office today.  https://t.co/Q9yEZKVFES	en	[]	[]	['https://pbs.twimg.com/media/E11tvs2X0AAocLi.jpg']	104	18	120	[]	[]	https://twitter.com/SenAlexPadilla/status/1395392151610134529	False		1	https://pbs.twimg.com/media/E11tvs2X0AAocLi.jpg							[]				
1395093334121664517	1395093334121664517	2021-05-19 15:05:45 EDT	2021-05-19	15:05:45	-0400	1351236267707654145	senalexpadilla	Senator Alex Padilla		Mitch McConnell is working to fulfill his promise to block not only the new administration, but also bipartisan efforts to investigate an attack on our democracy—one fueled by a disproven lie. When it comes to the Senate to vote on a Jan. 6th commission, I will vote for truth.	en	[]	[]	[]	68	94	487	[]	[]	https://twitter.com/SenAlexPadilla/status/1395093334121664517	False		0								[]				
1395077758007627778	1395077758007627778	2021-05-19 14:03:51 EDT	2021-05-19	14:03:51	-0400	1351236267707654145	senalexpadilla	Senator Alex Padilla		It's become increasingly clear: broadband is infrastructure.   Yet, too many families across the country struggle to afford internet service. That's why Congress passed the Emergency Broadband Benefit –– see if you qualify &amp; sign up here:  https://t.co/fIWFFsp3Hq	en	[]	['http://getemergencybroadband.org']	[]	17	21	59	[]	[]	https://twitter.com/SenAlexPadilla/status/1395077758007627778	False	https://twitter.com/FCC/status/1392489384415539208	0								[]				
1394837635936436228	1394837635936436228	2021-05-18 22:09:41 EDT	2021-05-18	22:09:41	-0400	1351236267707654145	senalexpadilla	Senator Alex Padilla		Instead of continuing to define bipartisanship by what Mitch McConnell will vote for, we need to listen to the majority of Americans who support making it easier for eligible citizens to vote. We need to pass the For the People Act.	en	[]	[]	[]	104	576	2372	[]	[]	https://twitter.com/SenAlexPadilla/status/1394837635936436228	False		0								[]				
1394746125060616199	1394746125060616199	2021-05-18 16:06:04 EDT	2021-05-18	16:06:04	-0400	1351236267707654145	senalexpadilla	Senator Alex Padilla		I commend @CAgovernor for taking action to fund the cleanup of the former Exide battery plant outside LA—CA's largest toxic cleanup. Now, we must continue to work to hold polluters accountable for environmental crimes that hurt communities of color.  https://t.co/MTcTCkUyix	en	[{'screen_name': 'cagovernor', 'name': 'office of the governor of california', 'id': '38349184'}]	['https://kfiam640.iheart.com/content/2021-05-17-officials-support-newsoms-added-funding-for-exide-plant-cleanup/?Sc=editorial&Pname=local_social&Keyid=socialflow']	[]	7	12	37	[]	[]	https://twitter.com/SenAlexPadilla/status/1394746125060616199	False		0								[]				
1394731030976794632	1394731030976794632	2021-05-18 15:06:05 EDT	2021-05-18	15:06:05	-0400	1351236267707654145	senalexpadilla	Senator Alex Padilla		As an engineer by training, I love to see practical solutions hiding in plain sight. If we #ElectrifyAmericasFuture, we can lower bills for American households, help meet our carbon reduction goals, and create millions of good-paying jobs.  https://t.co/TpbQGduTWw	en	[]	[]	['https://pbs.twimg.com/media/E1r9wIrXoAIvoPz.jpg']	10	29	171	['electrifyamericasfuture']	[]	https://twitter.com/SenAlexPadilla/status/1394731030976794632	False		1	https://pbs.twimg.com/media/E1r9wIrXoAIvoPz.jpg							[]				
