id	conversation_id	created_at	date	time	timezone	user_id	username	name	place	tweet	language	mentions	urls	photos	replies_count	retweets_count	likes_count	hashtags	cashtags	link	retweet	quote_url	video	thumbnail	near	geo	source	user_rt_id	user_rt	retweet_id	reply_to	retweet_date	translate	trans_src	trans_dest
1368576653014745093	1368576653014745093	2021-03-07 09:57:55 EST	2021-03-07	09:57:55	-0400	1351236267707654145	senalexpadilla	Senator Alex Padilla		We need bold, comprehensive action to address this pandemic.   We’re one step closer in delivering urgently needed COVID relief that will help millions get back on their feet, ramp up vaccine distribution, and reopen schools safely.  https://t.co/4HY1HQtRM6	en	[]	[]	[]	6	7	87	[]	[]	https://twitter.com/SenAlexPadilla/status/1368576653014745093	False		1	https://pbs.twimg.com/ext_tw_video_thumb/1368576612980121609/pu/img/VB0BhtfgfZZL7Huj.jpg							[]				
1368551503477215232	1368551503477215232	2021-03-07 08:17:59 EST	2021-03-07	08:17:59	-0400	1351236267707654145	senalexpadilla	Senator Alex Padilla		Joining @abbydphillip soon, tune in!	en	[{'screen_name': 'abbydphillip', 'name': 'abby d. phillip', 'id': '126722715'}]	[]	[]	13	21	232	[]	[]	https://twitter.com/SenAlexPadilla/status/1368551503477215232	False	https://twitter.com/abbydphillip/status/1367938154242711558	0								[]				
1368270975545073669	1368270975545073669	2021-03-06 13:43:16 EST	2021-03-06	13:43:16	-0400	1351236267707654145	senalexpadilla	Senator Alex Padilla		This pandemic has taken a devastating toll on families, small businesses, and communities across California.  I am proud to have fought to ensure that the relief package we passed today delivers for our state and helps us turn the corner.  https://t.co/sBGz92bX7o	en	[]	[]	['https://pbs.twimg.com/media/Ev0Shb0WEAULyo3.jpg']	18	42	195	[]	[]	https://twitter.com/SenAlexPadilla/status/1368270975545073669	False		1	https://pbs.twimg.com/media/Ev0Shb0WEAULyo3.jpg							[]				
1368251573005148162	1368251573005148162	2021-03-06 12:26:10 EST	2021-03-06	12:26:10	-0400	1351236267707654145	senalexpadilla	Senator Alex Padilla		UPDATE: I just voted to pass the #AmericanRescuePlan to help millions of Americans get back on their feet and finally defeat this pandemic.  To the families, workers, small businesses, and communities who have been struggling and waiting for relief: know that help is on the way.	en	[]	[]	[]	40	72	711	['americanrescueplan']	[]	https://twitter.com/SenAlexPadilla/status/1368251573005148162	False		0								[]				
1368195213706076160	1368195213706076160	2021-03-06 08:42:13 EST	2021-03-06	08:42:13	-0400	1351236267707654145	senalexpadilla	Senator Alex Padilla		I’ve stayed up all night to help keep this covid relief package moving.   We will get this done. Help is on the way. Hope is on the horizon.	en	[]	[]	[]	425	1047	11054	[]	[]	https://twitter.com/SenAlexPadilla/status/1368195213706076160	False		0								[]				
1368011186604814341	1367896245407281157	2021-03-05 20:30:57 EST	2021-03-05	20:30:57	-0400	1351236267707654145	senalexpadilla	Senator Alex Padilla		Before we head back onto the Senate floor, I’m answering questions that people from California &amp; across the country have submitted about the COVID relief package.  Head over to my Instagram to tune in ➡️  https://t.co/vxzvwU8iWU	en	[]	['https://instagram.com/senalexpadilla/']	[]	5	3	44	[]	[]	https://twitter.com/SenAlexPadilla/status/1368011186604814341	False		0								[]				
1367896245407281157	1367896245407281157	2021-03-05 12:54:13 EST	2021-03-05	12:54:13	-0400	1351236267707654145	senalexpadilla	Senator Alex Padilla		I’ll be doing a Q&amp;A on my Instagram Stories this evening about the COVID relief bill.   Submit any questions you have about the bill or process for passing it, and I’ll answer when we have a break from voting ➡️  https://t.co/a9hLIHPkns  https://t.co/s43BlgqTIH	en	[]	['https://www.instagram.com/senalexpadilla/']	['https://pbs.twimg.com/media/EvutccDXAAMy5o9.jpg']	9	15	79	[]	[]	https://twitter.com/SenAlexPadilla/status/1367896245407281157	False		1	https://pbs.twimg.com/media/EvutccDXAAMy5o9.jpg							[]				
1367874881875042304	1367874881875042304	2021-03-05 11:29:20 EST	2021-03-05	11:29:20	-0400	1351236267707654145	senalexpadilla	Senator Alex Padilla		I just voted YES to raise the minimum wage to $15. It is past time to start paying the workers who keep this country running a living wage.	en	[]	[]	[]	69	397	3002	[]	[]	https://twitter.com/SenAlexPadilla/status/1367874881875042304	False		0								[]				
1367857493624389633	1367857493624389633	2021-03-05 10:20:14 EST	2021-03-05	10:20:14	-0400	1351236267707654145	senalexpadilla	Senator Alex Padilla		It's simple: No one who works a full-time job should live in poverty. We have to be on the side of hard-working Americans. We have to raise the minimum wage.	en	[]	[]	[]	49	279	1298	[]	[]	https://twitter.com/SenAlexPadilla/status/1367857493624389633	False		0								[]				
1367853117212098560	1367853117212098560	2021-03-05 10:02:51 EST	2021-03-05	10:02:51	-0400	1351236267707654145	senalexpadilla	Senator Alex Padilla		Proud to join @SenSanders on the Senate floor in fighting to raise the minimum wage. Raising the wage IS COVID relief. Watch now:  https://t.co/s9aBBHLHM0	en	[{'screen_name': 'sensanders', 'name': 'bernie sanders', 'id': '29442313'}]	['https://twitter.com/i/broadcasts/1rmGPzPgPMDxN']	[]	16	70	348	[]	[]	https://twitter.com/SenAlexPadilla/status/1367853117212098560	False		0								[]				
1367652747722555393	1367652747722555393	2021-03-04 20:46:39 EST	2021-03-04	20:46:39	-0400	1351236267707654145	senalexpadilla	Senator Alex Padilla		If you're a Californian who's lost your job, who's worried about not being able to make rent or put food on the table, who's balancing work with children at home, or who's just struggling to get by during this pandemic: I want you to know that I see you and I'm fighting for you.	en	[]	[]	[]	43	75	613	[]	[]	https://twitter.com/SenAlexPadilla/status/1367652747722555393	False		0								[]				
1367619031101038594	1367619031101038594	2021-03-04 18:32:40 EST	2021-03-04	18:32:40	-0400	1351236267707654145	senalexpadilla	Senator Alex Padilla		Had the opportunity to speak with @DebHaalandNM today about her historic nomination for Interior Secretary &amp; California's priorities. I look forward to voting to confirm a fierce champion of environmental justice, tribal sovereignty, and our public lands.  https://t.co/ZVxDOo0pCN	en	[{'screen_name': 'debhaalandnm', 'name': 'deb haaland', 'id': '286476728'}]	[]	['https://pbs.twimg.com/media/EvqaOINWYAI6mfu.jpg']	13	31	255	[]	[]	https://twitter.com/SenAlexPadilla/status/1367619031101038594	False		1	https://pbs.twimg.com/media/EvqaOINWYAI6mfu.jpg							[]				
1367604309257572361	1367604309257572361	2021-03-04 17:34:10 EST	2021-03-04	17:34:10	-0400	1351236267707654145	senalexpadilla	Senator Alex Padilla		While all Senate Republicans voted against moving forward with the COVID relief bill and one is now holding it hostage on the Senate floor, we have our eyes on the prize. We will pass the American Rescue Plan.	en	[]	[]	[]	50	116	533	[]	[]	https://twitter.com/SenAlexPadilla/status/1367604309257572361	False	https://twitter.com/GeoffRBennett/status/1367598054380089352	0								[]				
1367556692838350854	1367556692838350854	2021-03-04 14:24:58 EST	2021-03-04	14:24:58	-0400	1351236267707654145	senalexpadilla	Senator Alex Padilla		I'm joining @RonWyden in calling on @POTUS to include recurring checks &amp; unemployment insurance in the next round of COVID relief.  Americans deserve certainty that they can put food on the table &amp; keep a roof over their heads until this crisis is over.  https://t.co/qmbFawkQjM	en	[{'screen_name': 'ronwyden', 'name': 'ron wyden', 'id': '250188760'}, {'screen_name': 'potus', 'name': 'president biden', 'id': '1349149096909668363'}]	['https://thehill.com/homenews/senate/541095-democrats-push-biden-to-include-recurring-payments-in-recovery-package']	[]	11	26	94	[]	[]	https://twitter.com/SenAlexPadilla/status/1367556692838350854	False		0								[]				
1367540305394868231	1367540305394868231	2021-03-04 13:19:51 EST	2021-03-04	13:19:51	-0400	1351236267707654145	senalexpadilla	Senator Alex Padilla		We must move quickly to pass COVID relief. But we shouldn't be making tradeoffs that leave out millions of Americans who are struggling. Now is the time to help more people, not less.	en	[]	[]	[]	18	72	321	[]	[]	https://twitter.com/SenAlexPadilla/status/1367540305394868231	False	https://twitter.com/JStein_WaPo/status/1367164931183902720	0								[]				
1367524629665972225	1367524629665972225	2021-03-04 12:17:33 EST	2021-03-04	12:17:33	-0400	1351236267707654145	senalexpadilla	Senator Alex Padilla		Last night—30 years after Rodney King was brutally beaten in Los Angeles—the House passed the George Floyd Justice in Policing Act.  It is past time to reckon with our broken system that fundamentally devalues Black lives. We must take action in the Senate and pass these reforms.	en	[]	[]	[]	8	15	104	[]	[]	https://twitter.com/SenAlexPadilla/status/1367524629665972225	False	https://twitter.com/washingtonpost/status/1367303717930827786	0								[]				
1367506168445296644	1367506168445296644	2021-03-04 11:04:12 EST	2021-03-04	11:04:12	-0400	1351236267707654145	senalexpadilla	Senator Alex Padilla		Happy Birthday, Alex! I can’t believe you’re 8. You are kind, smart, and thoughtful, and your smile lights up any room — or podium. Mommy and I love you!  https://t.co/f5lHdZXRom	en	[]	[]	['https://pbs.twimg.com/media/EvpbkLsXcAM_FTK.jpg']	16	9	471	[]	[]	https://twitter.com/SenAlexPadilla/status/1367506168445296644	False		1	https://pbs.twimg.com/media/EvpbkLsXcAM_FTK.jpg							[]				
1367481116958072872	1367481116958072872	2021-03-04 09:24:39 EST	2021-03-04	09:24:39	-0400	1351236267707654145	senalexpadilla	Senator Alex Padilla		It's simple: anybody risking their lives on the front lines of this pandemic to keep this country running should be vaccinated as soon as possible.	en	[]	[]	[]	6	14	158	[]	[]	https://twitter.com/SenAlexPadilla/status/1367481116958072872	False	https://twitter.com/nytimes/status/1366402918581235716	0								[]				
1367325784466206721	1367325784466206721	2021-03-03 23:07:25 EST	2021-03-03	23:07:25	-0400	1351236267707654145	senalexpadilla	Senator Alex Padilla		The House just passed the most important voting rights legislation since 1965. The #ForThePeople Act will:  ✔️ Protect the right to vote ✔️ Stop partisan gerrymandering ✔️ Root out dark money spending  Now the Senate must use our mandate to pass it. Our democracy depends on it.	en	[]	[]	[]	43	327	1407	['forthepeople']	[]	https://twitter.com/SenAlexPadilla/status/1367325784466206721	False		0								[]				
1367251205714567173	1367251205714567173	2021-03-03 18:11:04 EST	2021-03-03	18:11:04	-0400	1351236267707654145	senalexpadilla	Senator Alex Padilla		Imagine thinking that getting relief to millions of struggling Americans is a game.	en	[]	[]	[]	45	163	627	[]	[]	https://twitter.com/SenAlexPadilla/status/1367251205714567173	False	https://twitter.com/alexanderbolton/status/1367194618186637314	0								[]				
1367232738701541380	1367232738701541380	2021-03-03 16:57:41 EST	2021-03-03	16:57:41	-0400	1351236267707654145	senalexpadilla	Senator Alex Padilla		It's imperative that everyone—including the FBI—does their part to combat the rise in hate crimes against Asian Americans happening in California &amp; across the country.   That includes denouncing the racist rhetoric of our former president that caused this rise in the first place.  https://t.co/whCoo8tLNx	en	[]	[]	[]	10	11	77	[]	[]	https://twitter.com/SenAlexPadilla/status/1367232738701541380	False		1	https://pbs.twimg.com/amplify_video_thumb/1367218512234745857/img/h9xcQloUh7Zfuvxk.jpg							[]				
1367209806629646336	1367209806629646336	2021-03-03 15:26:34 EST	2021-03-03	15:26:34	-0400	1351236267707654145	senalexpadilla	Senator Alex Padilla		Glad to see this mass vaccination site open at SoFi Stadium for all L.A. County education employees. Getting vaccines into the arms of our teachers and staff is critical as we work toward safely opening schools.  https://t.co/M82F874Slb	en	[]	['https://losangeles.cbslocal.com/2021/03/01/lausd-opens-covid-vaccine-site-at-sofi-stadium-monday-for-education-staff-only/']	[]	2	6	55	[]	[]	https://twitter.com/SenAlexPadilla/status/1367209806629646336	False		0								[]				
1367190433013657601	1367190433013657601	2021-03-03 14:09:35 EST	2021-03-03	14:09:35	-0400	1351236267707654145	senalexpadilla	Senator Alex Padilla		I'm in, @gillibrandny.   The American Rescue Plan will deliver relief to families &amp; communities, lift millions of children out of poverty, and speed up vaccinations so we can defeat this pandemic.  Let's get this across the finish line. What do you say, @ChrisMurphyCT?	en	[{'screen_name': 'gillibrandny', 'name': 'sen. kirsten gillibrand', 'id': '899978622416695297'}, {'screen_name': 'chrismurphyct', 'name': 'chris murphy', 'id': '150078976'}]	[]	[]	20	77	400	[]	[]	https://twitter.com/SenAlexPadilla/status/1367190433013657601	False	https://twitter.com/gillibrandny/status/1366817813382500357	0								[]				
1367172329739071489	1367172329739071489	2021-03-03 12:57:38 EST	2021-03-03	12:57:38	-0400	1351236267707654145	senalexpadilla	Senator Alex Padilla		Just now in the @HSGAC hearing on Jan. 6th, intelligence officials confirmed how dangerous the continued lies about the 2020 election being stolen are — agreeing that it not only makes their jobs more difficult, but also inspires other domestic extremists to take violent action.	en	[{'screen_name': 'hsgac', 'name': 'homeland security & govt. affairs committee — dems', 'id': '1249418526'}]	[]	[]	15	26	113	[]	[]	https://twitter.com/SenAlexPadilla/status/1367172329739071489	False		0								[]				
1367132813305200640	1367132813305200640	2021-03-03 10:20:37 EST	2021-03-03	10:20:37	-0400	1351236267707654145	senalexpadilla	Senator Alex Padilla		Universal background checks are the single most effective way to stop gun violence. We must act.	en	[]	[]	[]	9	30	203	[]	[]	https://twitter.com/SenAlexPadilla/status/1367132813305200640	False	https://twitter.com/ChrisMurphyCT/status/1366762988108210179	0								[]				
1366933858176884739	1366933858176884739	2021-03-02 21:10:02 EST	2021-03-02	21:10:02	-0400	1351236267707654145	senalexpadilla	Senator Alex Padilla		As we work to get to the bottom of what happened on January 6th, this much is clear: we must root out white supremacists and right-wing extremists from law enforcement.  https://t.co/pjwhxcWQza	en	[]	[]	[]	10	18	96	[]	[]	https://twitter.com/SenAlexPadilla/status/1366933858176884739	False		1	https://pbs.twimg.com/ext_tw_video_thumb/1366928674403024897/pu/img/KWrUWAYuAAAenQpo.jpg							[]				
1366914333062668292	1366914333062668292	2021-03-02 19:52:27 EST	2021-03-02	19:52:27	-0400	1351236267707654145	senalexpadilla	Senator Alex Padilla		The Supreme Court should see these restrictive voter laws in AZ for what they are: blatantly partisan attempts at silencing minority voters.   The stakes of this ruling remind us of the dire need to protect &amp; expand on the Voting Rights Act.  https://t.co/TxvdFIf4Tb	en	[]	['https://www.nbcnews.com/politics/supreme-court/supreme-court-questions-need-restrictive-voting-laws-voting-rights-act-n1259301']	[]	11	36	109	[]	[]	https://twitter.com/SenAlexPadilla/status/1366914333062668292	False		0								[]				
1366901911199379457	1366901911199379457	2021-03-02 19:03:06 EST	2021-03-02	19:03:06	-0400	1351236267707654145	senalexpadilla	Senator Alex Padilla		Tune in: I'll be joining @thereidout on @MSNBC shortly to discuss today's Senate Judiciary hearing on Jan. 6 attack.  https://t.co/WMOh4nvxMr	en	[{'screen_name': 'thereidout', 'name': 'the reidout', 'id': '205864193'}, {'screen_name': 'msnbc', 'name': 'msnbc', 'id': '2836421'}]	[]	['https://pbs.twimg.com/media/Evg1LhdXUAAvmos.jpg']	12	22	183	[]	[]	https://twitter.com/SenAlexPadilla/status/1366901911199379457	False		1	https://pbs.twimg.com/media/Evg1LhdXUAAvmos.jpg							[]				
1366880498061041667	1366880498061041667	2021-03-02 17:38:00 EST	2021-03-02	17:38:00	-0400	1351236267707654145	senalexpadilla	Senator Alex Padilla		My office is closely monitoring the heartbreaking crash in Imperial County, CA that has claimed 15 lives and injured several more. Our prayers are with their families and with those still in the hospital.  We are in touch with local authorities &amp; will assist in any way possible.	en	[]	[]	[]	12	14	198	[]	[]	https://twitter.com/SenAlexPadilla/status/1366880498061041667	False		0								[]				
1366848346103689222	1366848346103689222	2021-03-02 15:30:15 EST	2021-03-02	15:30:15	-0400	1351236267707654145	senalexpadilla	Senator Alex Padilla		Since Jan. 6th, we've seen reports that some members of the Capitol Police were sympathetic to and even encouraged insurrectionists attacking the building they’re sworn to protect.   It’s clear the FBI must work with law enforcement agencies to root out white supremacists.  https://t.co/qU9utcKhUe	en	[]	[]	[]	14	25	130	[]	[]	https://twitter.com/SenAlexPadilla/status/1366848346103689222	False		1	https://pbs.twimg.com/amplify_video_thumb/1366847653963829254/img/bU0-VX8nVGTigaw5.jpg							[]				
1366782466946719745	1366782466946719745	2021-03-02 11:08:28 EST	2021-03-02	11:08:28	-0400	1351236267707654145	senalexpadilla	Senator Alex Padilla		Raising the minimum wage is COVID relief. I support this amendment and will vote for it on the Senate floor.	en	[]	[]	[]	20	46	312	[]	[]	https://twitter.com/SenAlexPadilla/status/1366782466946719745	False	https://twitter.com/SenSanders/status/1366545093876924416	0								[]				
1366551463166697481	1366551463166697481	2021-03-01 19:50:32 EST	2021-03-01	19:50:32	-0400	1351236267707654145	senalexpadilla	Senator Alex Padilla		This #WomensHistoryMonth, we celebrate the vital role women have played in shaping our nation. But we must also confront the painful reality that women — especially women of color — have been hit hardest by this pandemic. We owe it to them to continue fighting for equal rights.	en	[]	[]	[]	17	51	195	['womenshistorymonth']	[]	https://twitter.com/SenAlexPadilla/status/1366551463166697481	False		0								[]				
1366531802890960900	1366531802890960900	2021-03-01 18:32:25 EST	2021-03-01	18:32:25	-0400	1351236267707654145	senalexpadilla	Senator Alex Padilla		Just voted to confirm @teachcardona as our next Secretary of Education. Looking forward to having a former teacher and proven advocate for all students &amp; teachers in the role at a time when we need it most.	en	[{'screen_name': 'teachcardona', 'name': 'dr. miguel a. cardona', 'id': '763766437'}]	[]	[]	20	77	469	[]	[]	https://twitter.com/SenAlexPadilla/status/1366531802890960900	False	https://twitter.com/abc7newsbayarea/status/1366530352517373952	0								[]				
1366484069501042694	1366484069501042694	2021-03-01 15:22:44 EST	2021-03-01	15:22:44	-0400	1351236267707654145	senalexpadilla	Senator Alex Padilla		Unions make our country better. The Amazon worker vote happening in Alabama will make history and help empower workers across the country to organize without fear of intimidation, coercion, threats, or anti-union propaganda. Glad @POTUS is voicing his support.	en	[{'screen_name': 'potus', 'name': 'president biden', 'id': '1349149096909668363'}]	[]	[]	6	41	140	[]	[]	https://twitter.com/SenAlexPadilla/status/1366484069501042694	False	https://twitter.com/POTUS/status/1366191901196644354	0								[]				
1366462318821986304	1366462318821986304	2021-03-01 13:56:19 EST	2021-03-01	13:56:19	-0400	1351236267707654145	senalexpadilla	Senator Alex Padilla		The Attorney General is the people's lawyer, not the president's. Judge Garland's conduct in last week’s @JudiciaryDems hearings make it clear: he will restore the integrity and independence of the Justice Department. I was proud to vote to move his nomination forward today.	en	[{'screen_name': 'judiciarydems', 'name': 'senate judiciary committee', 'id': '818513652814843906'}]	[]	[]	47	642	2763	[]	[]	https://twitter.com/SenAlexPadilla/status/1366462318821986304	False	https://twitter.com/JudiciaryDems/status/1366453915961679872	0								[]				
1366436864941576194	1366436864941576194	2021-03-01 12:15:10 EST	2021-03-01	12:15:10	-0400	1351236267707654145	senalexpadilla	Senator Alex Padilla		It is critical that the CDC collects robust demographic information to make vaccine distribution more equitable.   Right now, only 32 states report race &amp; ethnicity data.   Proud to join @SenatorMenendez &amp; @SenatorCardin in an effort to change this.  https://t.co/vZQXdr310Y	en	[{'screen_name': 'senatormenendez', 'name': 'senator bob menendez', 'id': '18695134'}, {'screen_name': 'senatorcardin', 'name': 'senator ben cardin', 'id': '109071031'}]	['https://www.huffpost.com/entry/democrats-vaccinations-data-race-ethnicity_n_60395482c5b6d7794adeea36']	[]	7	21	75	[]	[]	https://twitter.com/SenAlexPadilla/status/1366436864941576194	False		0								[]				
1366422093106204675	1366422093106204675	2021-03-01 11:16:28 EST	2021-03-01	11:16:28	-0400	1351236267707654145	senalexpadilla	Senator Alex Padilla		On this day 60 years ago, President Kennedy signed an executive order establishing the @PeaceCorps — an organization that has woven public service into our national fabric and empowered over 240,000 volunteers to promote peace &amp; friendship around the world.  https://t.co/3iBHBfEQSx	en	[{'screen_name': 'peacecorps', 'name': 'peace corps', 'id': '9109712'}]	[]	['https://pbs.twimg.com/media/EvaBPzkWYAYdtNi.jpg']	6	33	116	[]	[]	https://twitter.com/SenAlexPadilla/status/1366422093106204675	False		1	https://pbs.twimg.com/media/EvaBPzkWYAYdtNi.jpg							[]				
1366196187716591624	1366196187716591624	2021-02-28 20:18:48 EST	2021-02-28	20:18:48	-0400	1351236267707654145	senalexpadilla	Senator Alex Padilla		This is already becoming more than a wish list, with 253 bills introduced in 43 states this year to restrict voting access.   Our response? Eliminate the filibuster and pass both the John Lewis Voting Rights Act &amp; the For the People Act.	en	[]	[]	[]	31	283	754	[]	[]	https://twitter.com/SenAlexPadilla/status/1366196187716591624	False	https://twitter.com/marceelias/status/1366161145489477636	0								[]				
1366178788124618755	1366178788124618755	2021-02-28 19:09:40 EST	2021-02-28	19:09:40	-0400	1351236267707654145	senalexpadilla	Senator Alex Padilla		We now have three vaccines that are safe, effective, and life-saving. Please listen to the experts and get yours as soon as you are able.	en	[]	[]	[]	4	33	173	[]	[]	https://twitter.com/SenAlexPadilla/status/1366178788124618755	False	https://twitter.com/WHCOVIDResponse/status/1366040339979591685	0								[]				
1366133023905882119	1366133023905882119	2021-02-28 16:07:49 EST	2021-02-28	16:07:49	-0400	1351236267707654145	senalexpadilla	Senator Alex Padilla		"Republicans say protecting public lands, championing clean air &amp; water, and fighting climate change is ""radical.""  A majority of Americans say it is exactly what we need.  I'm proud to support @DebHaalandNM's historic nomination for @Interior Secretary.  https://t.co/boJyfMBP23"	en	[{'screen_name': 'debhaalandnm', 'name': 'deb haaland', 'id': '286476728'}, {'screen_name': 'interior', 'name': 'us department of the interior', 'id': '76348185'}]	['https://www.washingtonpost.com/politics/2021/02/27/republicans-call-deb-haaland-radical-polls-show-their-views-climate-are-out-mainstream/?utm_campaign=wp_main&utm_source=twitter&utm_medium=social']	[]	2	54	233	[]	[]	https://twitter.com/SenAlexPadilla/status/1366133023905882119	False		0								[]				
1366106671693651970	1366106671693651970	2021-02-28 14:23:06 EST	2021-02-28	14:23:06	-0400	1351236267707654145	senalexpadilla	Senator Alex Padilla		Family farms like @DelBosqueFarms have been running year-round to keep this country fed throughout the pandemic.    This work is essential, and it's time to give the people putting their lives at risk to do it a pathway to citizenship.  https://t.co/Zcy5oQ3pep	en	[{'screen_name': 'delbosquefarms', 'name': 'del bosque farms', 'id': '721409426406572033'}]	['https://abc30.com/10374119/']	[]	7	51	172	[]	[]	https://twitter.com/SenAlexPadilla/status/1366106671693651970	False		0								[]				
1365816727074967555	1365816727074967555	2021-02-27 19:10:58 EST	2021-02-27	19:10:58	-0400	1351236267707654145	senalexpadilla	Senator Alex Padilla		San Jose is not only home to Silicon Valley tech giants, but also many small businesses that are integral parts of the city’s most diverse communities.  This grant will help these small businesses weather the pandemic and prepare them to succeed in the years ahead.	en	[]	[]	[]	7	9	74	[]	[]	https://twitter.com/SenAlexPadilla/status/1365816727074967555	False	https://twitter.com/US_EDA/status/1365044848798089220	0								[]				
1365728896512106503	1365728896512106503	2021-02-27 13:21:57 EST	2021-02-27	13:21:57	-0400	1351236267707654145	senalexpadilla	Senator Alex Padilla		Millions of essential workers without permanent legal status have put their lives at risk to keep communities safe and our economy running.  It's time to thank them with more than just our words — they deserve a pathway to citizenship.  https://t.co/SSrcNbrgzy	en	[]	[]	[]	18	114	406	[]	[]	https://twitter.com/SenAlexPadilla/status/1365728896512106503	False		1	https://pbs.twimg.com/ext_tw_video_thumb/1365728798994497538/pu/img/q-Cg1MaybX4j9mch.jpg							[]				
