id	conversation_id	created_at	date	time	timezone	user_id	username	name	place	tweet	language	mentions	urls	photos	replies_count	retweets_count	likes_count	hashtags	cashtags	link	retweet	quote_url	video	thumbnail	near	geo	source	user_rt_id	user_rt	retweet_id	reply_to	retweet_date	translate	trans_src	trans_dest
1199550974773346305	1199550964484759552	2019-11-26 23:50:13 EST	2019-11-26	23:50:13	-0400	1262099252	senbrianschatz	Senator Brian Schatz		My new bill will protect her right to address this medical condition without losing any money from her paycheck. It will also ensure that every worker has the right to bathroom breaks &amp; meal breaks #DignityOfWork  https://t.co/PixBDwjPLG	en	[]	[]	['https://pbs.twimg.com/media/EKWpQH0XYAAM976.jpg']	4	6	21	['dignityofwork']	[]	https://twitter.com/SenBrianSchatz/status/1199550974773346305	False		1	https://pbs.twimg.com/media/EKWpQH0XYAAM976.jpg							[]				
1199550968091856897	1199550964484759552	2019-11-26 23:50:12 EST	2019-11-26	23:50:12	-0400	1262099252	senbrianschatz	Senator Brian Schatz		Anna can’t afford to lose the pay, but she also can’t not take the breaks when she need to.  That isn’t right.	en	[]	[]	[]	1	2	12	[]	[]	https://twitter.com/SenBrianSchatz/status/1199550968091856897	False		0								[]				
1199550966820986880	1199550964484759552	2019-11-26 23:50:11 EST	2019-11-26	23:50:11	-0400	1262099252	senbrianschatz	Senator Brian Schatz		For medical reasons, Anna had to get an accommodation for additional bathroom breaks.   Even after obtaining a note from her physician, her company refuses to pay her for taking these medically-required breaks — reducing her already low pay of $11.40/hour.	en	[]	[]	[]	1	1	8	[]	[]	https://twitter.com/SenBrianSchatz/status/1199550966820986880	False		0								[]				
1199550964484759552	1199550964484759552	2019-11-26 23:50:11 EST	2019-11-26	23:50:11	-0400	1262099252	senbrianschatz	Senator Brian Schatz		THREAD: Anna Flemmings is a customer service representative at a call center in Hattiesburg, Mississippi.  Anna helps people access affordable health care through the Center for Medicaid and Medicare Services.	en	[]	[]	[]	1	6	19	[]	[]	https://twitter.com/SenBrianSchatz/status/1199550964484759552	False		0								[]				
1199468123222470656	1199468123222470656	2019-11-26 18:21:00 EST	2019-11-26	18:21:00	-0400	1262099252	senbrianschatz	Senator Brian Schatz		When we let companies use our personal information, we should be able to trust that it will be protected &amp; won’t be used to harm us.  Our new bill lays out a set of strong data privacy rights &amp; provides the tools needed to hold Big Tech accountable.   https://t.co/29l8RwleQM	en	[]	['https://www.washingtonpost.com/technology/2019/11/26/top-senate-democrats-unveil-new-online-privacy-bill-promising-tough-penalties-data-abuse/']	[]	1	1	12	[]	[]	https://twitter.com/SenBrianSchatz/status/1199468123222470656	False		0								[]				
1199435202302554112	1199435202302554112	2019-11-26 16:10:11 EST	2019-11-26	16:10:11	-0400	1262099252	senbrianschatz	Senator Brian Schatz		Too many workers don’t have the right to use the restroom, eat a meal or tend to medical conditions while working long shifts.   My new bill will ensure all workers are treated with dignity &amp; protect the right to address needs during the workday. #DignityOfWork  https://t.co/X0G7BCWpf0	en	[]	[]	['https://pbs.twimg.com/tweet_video_thumb/EKU_5FxW4AAVL_Z.jpg']	2	4	20	['dignityofwork']	[]	https://twitter.com/SenBrianSchatz/status/1199435202302554112	False		1	https://pbs.twimg.com/tweet_video_thumb/EKU_5FxW4AAVL_Z.jpg							[]				
1199161351970656257	1199161351970656257	2019-11-25 22:02:00 EST	2019-11-25	22:02:00	-0400	1262099252	senbrianschatz	Senator Brian Schatz		Federal funding for new buses on Kauai &amp; Hawaii Island means that those who depend on buses to get to school or work every day will continue to have an affordable way to get around.  📺 more from @KHONnews  https://t.co/QSDD98JvZm	en	[{'screen_name': 'khonnews', 'name': 'khon2 news', 'id': '20479321'}]	[]	[]	6	11	59	[]	[]	https://twitter.com/SenBrianSchatz/status/1199161351970656257	False		1	https://pbs.twimg.com/ext_tw_video_thumb/1199104679071961088/pu/img/l3XeD7fAasuXY9UY.jpg							[]				
1199104532007071744	1199104532007071744	2019-11-25 18:16:13 EST	2019-11-25	18:16:13	-0400	1262099252	senbrianschatz	Senator Brian Schatz		$6.5M in federal funding for new buses is headed to Kauai &amp; Hawaii Island 🚌  This big investment means that residents who depend on buses to get to school or work every day will continue to have an affordable way to get around #HINews   https://t.co/1oqdFfEdX0	en	[]	['http://www.bizjournals.com/pacific/news/2019/11/22/kauai-hawaii-island-to-receive-6-5m-in-federal.html']	[]	1	0	15	['hinews']	[]	https://twitter.com/SenBrianSchatz/status/1199104532007071744	False		0								[]				
1197711548711493634	1197711548711493634	2019-11-21 22:01:00 EST	2019-11-21	22:01:00	-0400	1262099252	senbrianschatz	Senator Brian Schatz		The @DeptofDefense is expanding access to military commissaries &amp; exchanges to more veterans &amp; caregivers in Hawai‘i.  Here's what you need to know ⬇️  https://t.co/K1ds50VgXy	en	[{'screen_name': 'deptofdefense', 'name': 'department of defense 🇺🇸', 'id': '66369181'}]	[]	['https://pbs.twimg.com/media/EJ7ylnFXkAc9COq.jpg']	2	1	9	[]	[]	https://twitter.com/SenBrianSchatz/status/1197711548711493634	False		1	https://pbs.twimg.com/media/EJ7ylnFXkAc9COq.jpg							[]				
1197660830894108672	1197660830894108672	2019-11-21 18:39:28 EST	2019-11-21	18:39:28	-0400	1262099252	senbrianschatz	Senator Brian Schatz		.@SenDemsClimate spoke with leaders from low-income communities &amp; communities of color who are facing the worst of the climate crisis. Their leadership is integral to developing climate solutions.  Thanks @SenDuckworth for leading an important discussion on #EnvironmentalJustice  https://t.co/gTt0rpUtE5	en	"[{'screen_name': 'sendemsclimate', 'name': ""senate democrats' climate committee"", 'id': '1148973240355827713'}, {'screen_name': 'senduckworth', 'name': 'tammy duckworth', 'id': '1058520120'}]"	[]	['https://pbs.twimg.com/media/EJ7yIWMWwAA9Fjw.jpg', 'https://pbs.twimg.com/media/EJ7yJmQX0AADxmm.jpg', 'https://pbs.twimg.com/media/EJ7yKU4X0AEsKNM.jpg']	0	2	13	['environmentaljustice']	[]	https://twitter.com/SenBrianSchatz/status/1197660830894108672	False		1	https://pbs.twimg.com/media/EJ7yIWMWwAA9Fjw.jpg							[]				
1197384883380871168	1197384883380871168	2019-11-21 00:22:57 EST	2019-11-21	00:22:57	-0400	1262099252	senbrianschatz	Senator Brian Schatz		Trump's White House made a baseless claim that providing more shelters incentivizes homelessness – a claim that their own nominee for Deputy Secretary of @HUDgov couldn't even defend.  Watch our exchange below 👀  https://t.co/eYXVKoiBvs	en	[{'screen_name': 'hudgov', 'name': 'hudgov', 'id': '19948202'}]	[]	[]	3	7	29	[]	[]	https://twitter.com/SenBrianSchatz/status/1197384883380871168	False		1	https://pbs.twimg.com/ext_tw_video_thumb/1197384239119028225/pu/img/L1wogJAQlRsbapzx.jpg							[]				
1197353980143263744	1197353930864414720	2019-11-20 22:20:09 EST	2019-11-20	22:20:09	-0400	1262099252	senbrianschatz	Senator Brian Schatz		This bill would require the Fed to do its job and make sure our largest financial institutions are resilient to climate risks to avoid a financial crisis.   https://t.co/ucidqR1Tt6	en	[]	['https://www.nytimes.com/reuters/2019/11/20/business/20reuters-usa-senate-fed-climate.html']	[]	1	2	10	[]	[]	https://twitter.com/SenBrianSchatz/status/1197353980143263744	False		0								[]				
1197353977802895365	1197353930864414720	2019-11-20 22:20:08 EST	2019-11-20	22:20:08	-0400	1262099252	senbrianschatz	Senator Brian Schatz		Financial stability is part of the Fed’s mandate, and regulators in other countries are already working to quantify and manage climate risks. Why is the Fed lagging behind?	en	[]	[]	[]	1	0	5	[]	[]	https://twitter.com/SenBrianSchatz/status/1197353977802895365	False		0								[]				
1197353973004619776	1197353930864414720	2019-11-20 22:20:07 EST	2019-11-20	22:20:07	-0400	1262099252	senbrianschatz	Senator Brian Schatz		Banks face the risk of direct losses from climate change, not just in the distant future but now. But, like the housing bubble in 2007, our regulators are ignoring these risks.	en	[]	[]	[]	1	0	4	[]	[]	https://twitter.com/SenBrianSchatz/status/1197353973004619776	False		0								[]				
1197353967828779009	1197353930864414720	2019-11-20 22:20:06 EST	2019-11-20	22:20:06	-0400	1262099252	senbrianschatz	Senator Brian Schatz		Climate change lowers labor productivity, stresses farm output, hurts property values, and disrupts supply chains. No part of our economy will be spared.	en	[]	[]	[]	1	0	5	[]	[]	https://twitter.com/SenBrianSchatz/status/1197353967828779009	False		0								[]				
1197353965173825536	1197353930864414720	2019-11-20 22:20:05 EST	2019-11-20	22:20:05	-0400	1262099252	senbrianschatz	Senator Brian Schatz		Climate change is a major risk we are ignoring. It is increasing severe floods and wildfires, driving sea level rise and dangerous heat waves. These events are happening more often and causing more damage. These events hurt the economy.	en	[]	[]	[]	1	0	4	[]	[]	https://twitter.com/SenBrianSchatz/status/1197353965173825536	False		0								[]				
1197353952842571776	1197353930864414720	2019-11-20 22:20:02 EST	2019-11-20	22:20:02	-0400	1262099252	senbrianschatz	Senator Brian Schatz		When we ignore risks in our financial system, we risk a crisis that harms the whole economy and wipes out household wealth, as we saw in 2008.	en	[]	[]	[]	1	0	4	[]	[]	https://twitter.com/SenBrianSchatz/status/1197353952842571776	False		0								[]				
1197353930864414720	1197353930864414720	2019-11-20 22:19:57 EST	2019-11-20	22:19:57	-0400	1262099252	senbrianschatz	Senator Brian Schatz		THREAD: Here’s how our new climate stress test bill can help preserve our financial future ⬇️	en	[]	[]	[]	2	2	5	[]	[]	https://twitter.com/SenBrianSchatz/status/1197353930864414720	False		0								[]				
1197334061200691200	1197334061200691200	2019-11-20 21:01:00 EST	2019-11-20	21:01:00	-0400	1262099252	senbrianschatz	Senator Brian Schatz		The West Hawaii Community Health Center provides affordable &amp; accessible health care services to thousands of people who might not otherwise receive care.  This new funding will provide the resources needed to continue serving Hawaii Island families.   https://t.co/NEJrRdtl2W	en	[]	['https://www.westhawaiitoday.com/2019/11/19/hawaii-news/west-hawaii-community-health-center-receives-1m-federal-grant/']	[]	0	1	8	[]	[]	https://twitter.com/SenBrianSchatz/status/1197334061200691200	False		0								[]				
1197311915275542531	1197311915275542531	2019-11-20 19:33:00 EST	2019-11-20	19:33:00	-0400	1262099252	senbrianschatz	Senator Brian Schatz		We're urging the U.S. Marine Corps to listen to community concerns &amp; rethink its plan to build a massive seawall on Ewa Beach.   📺 more from @HawaiiNewsNow  https://t.co/AsFGvXSMv0	en	[{'screen_name': 'hawaiinewsnow', 'name': 'hawaii news now', 'id': '14671170'}]	[]	[]	2	3	11	[]	[]	https://twitter.com/SenBrianSchatz/status/1197311915275542531	False		1	https://pbs.twimg.com/ext_tw_video_thumb/1197296357670866951/pu/img/wPbAlUiXqA7mlaSR.jpg							[]				
1197287796890836992	1197287796890836992	2019-11-20 17:57:09 EST	2019-11-20	17:57:09	-0400	1262099252	senbrianschatz	Senator Brian Schatz		Federal regulators are ignoring the growing risks of the climate crisis on our financial system.  Our new bill requires the Fed to take climate risk seriously &amp; ensure our large financial institutions are resilient to climate change.   https://t.co/HS51ALnRBB	en	[]	['https://news.bloombergenvironment.com/environment-and-energy/senate-bill-would-extend-bank-stress-tests-to-climate-risk']	[]	0	10	14	[]	[]	https://twitter.com/SenBrianSchatz/status/1197287796890836992	False		0								[]				
1196975764979232768	1196975764979232768	2019-11-19 21:17:15 EST	2019-11-19	21:17:15	-0400	1262099252	senbrianschatz	Senator Brian Schatz		.@USMC must listen to community concerns &amp; further review the environmental impact of building a retaining wall on Ewa Beach.    https://t.co/cDo3QCZZtt	en	[{'screen_name': 'usmc', 'name': 'u.s. marines', 'id': '10126672'}]	['https://www.civilbeat.org/2019/11/schatz-to-marines-rethink-project-that-threatens-ewa-beach/']	[]	1	1	9	[]	[]	https://twitter.com/SenBrianSchatz/status/1196975764979232768	False		0								[]				
1196603657183285249	1196603657183285249	2019-11-18 20:38:38 EST	2019-11-18	20:38:38	-0400	1262099252	senbrianschatz	Senator Brian Schatz		We need to empower communities to fight back against bleaching. My bill will provide them federal funds to help save their reefs.    https://t.co/YC3WjI8ehA	en	[]	['https://www.staradvertiser.com/2019/11/15/hawaii-news/coral-reef-restoration-bill-clears-key-senate-committee/']	[]	0	3	20	[]	[]	https://twitter.com/SenBrianSchatz/status/1196603657183285249	False		0								[]				
1195491671754055681	1195491671754055681	2019-11-15 19:00:00 EST	2019-11-15	19:00:00	-0400	1262099252	senbrianschatz	Senator Brian Schatz		Starting in January, more veterans &amp; caregivers in Hawaii will have access to commissaries &amp; exchanges statewide.  📺 more about the new program from @HawaiiNewsNow  https://t.co/GAhrarOapg	en	[{'screen_name': 'hawaiinewsnow', 'name': 'hawaii news now', 'id': '14671170'}]	[]	[]	3	2	14	[]	[]	https://twitter.com/SenBrianSchatz/status/1195491671754055681	False		1	https://pbs.twimg.com/ext_tw_video_thumb/1195464693101551616/pu/img/RZPWiYC9BnJOhhu1.jpg							[]				
1195463895814721536	1195463486698139649	2019-11-15 17:09:38 EST	2019-11-15	17:09:38	-0400	1262099252	senbrianschatz	Senator Brian Schatz		The Koʻa Card is a great example of a project that will be supported by this new federal funding from @NOAA.  Thanks to @himb_soest, this easy tool helps communities check the health of their corals based on their coloring. Learn more:  https://t.co/EYyUt1aX7p  https://t.co/jFVJEWS6Fx	en	[{'screen_name': 'noaa', 'name': 'noaa', 'id': '14342564'}, {'screen_name': 'himb_soest', 'name': 'hawai‘i institute of marine biology', 'id': '752656268381155328'}]	['https://www.pacioos.hawaii.edu/projects/coral-card/']	['https://pbs.twimg.com/media/EJckEaHWkAM0qg8.jpg']	1	0	7	[]	[]	https://twitter.com/SenBrianSchatz/status/1195463895814721536	False		1	https://pbs.twimg.com/media/EJckEaHWkAM0qg8.jpg							[]				
1195463486698139649	1195463486698139649	2019-11-15 17:08:00 EST	2019-11-15	17:08:00	-0400	1262099252	senbrianschatz	Senator Brian Schatz		With emerging threats to coral reefs like bleaching &amp; disease, we need to empower communities to fight back.   My bill will grow the federal coral program to $35M so that local governments &amp; organizations have resources to save their reefs.   https://t.co/yfl2AIZdtr	en	[]	['https://www.thegardenisland.com/2019/11/15/hawaii-news/more-money-for-protection-of-coral/']	[]	1	0	9	[]	[]	https://twitter.com/SenBrianSchatz/status/1195463486698139649	False		0								[]				
1195189681715060737	1195189681715060737	2019-11-14 23:00:00 EST	2019-11-14	23:00:00	-0400	1262099252	senbrianschatz	Senator Brian Schatz		For 25 years, #VAWA has provided support, shelter and a new chance at life for women and children in Hawaii and across the country. Reauthorizing this bill will help ensure that more Americans can live free from violence and abuse.   https://t.co/zbqDEuQSNR	en	[]	['https://www.huffpost.com/entry/violence-against-women-act-senate-democrats-lgbtq-native-women_n_5dcc5373e4b0a794d1f9af45']	[]	1	6	19	['vawa']	[]	https://twitter.com/SenBrianSchatz/status/1195189681715060737	False		0								[]				
1195095309686394880	1195095309686394880	2019-11-14 16:45:00 EST	2019-11-14	16:45:00	-0400	1262099252	senbrianschatz	Senator Brian Schatz		On Maui, they have just half the surgeons needed to serve residents - forcing many to travel off island to receive the care they need. My bill will produce quality data on where surgeons are in short supply so we can work to bring more to the communities that need them most.  https://t.co/GgregJ4U0Z	en	[]	[]	['https://pbs.twimg.com/tweet_video_thumb/EJWxgyZXYAApmMz.jpg']	1	2	9	[]	[]	https://twitter.com/SenBrianSchatz/status/1195095309686394880	False		1	https://pbs.twimg.com/tweet_video_thumb/EJWxgyZXYAApmMz.jpg							[]				
1195029649631457282	1195029649631457282	2019-11-14 12:24:05 EST	2019-11-14	12:24:05	-0400	1262099252	senbrianschatz	Senator Brian Schatz		We have a surgeon shortage crisis in Hawaii. My bipartisan bill will help us better understand where the shortages exist so that we can work to bring more surgeons to those communities.   We must ensure everyone can get the care they need — regardless of where they live.  https://t.co/QIMQ4lah53	en	[]	[]	['https://pbs.twimg.com/tweet_video_thumb/EJWZE03WoAA2Uwn.jpg']	2	5	10	[]	[]	https://twitter.com/SenBrianSchatz/status/1195029649631457282	False		1	https://pbs.twimg.com/tweet_video_thumb/EJWZE03WoAA2Uwn.jpg							[]				
1194837359621279746	1194837359621279746	2019-11-13 23:40:00 EST	2019-11-13	23:40:00	-0400	1262099252	senbrianschatz	Senator Brian Schatz		Today, I was interviewed for a new documentary about our work to give those in prison a chance to earn a higher education, rebuild their lives &amp; end the cycle of recidivism.  Proud to be a part of this project (alongside @johnlegend!) from @edtrust and @nwjfilms #SecondChancePell  https://t.co/3liV9Fvx4N	en	[{'screen_name': 'johnlegend', 'name': 'john legend', 'id': '18228898'}, {'screen_name': 'edtrust', 'name': 'the education trust', 'id': '112471133'}, {'screen_name': 'nwjfilms', 'name': 'nwjfilms', 'id': '1082536380268371969'}]	[]	['https://pbs.twimg.com/media/EJTjO-AW4AAlCd4.jpg']	3	16	51	['secondchancepell']	[]	https://twitter.com/SenBrianSchatz/status/1194837359621279746	False		1	https://pbs.twimg.com/media/EJTjO-AW4AAlCd4.jpg							[]				
1194828573720416256	1194828573720416256	2019-11-13 23:05:05 EST	2019-11-13	23:05:05	-0400	1262099252	senbrianschatz	Senator Brian Schatz		I'm calling on @GetSpectrum, @Verizon &amp; @CenturyLink to explain the cell and internet service outage on Kauai and provide a plan to prevent this from happening again.   https://t.co/DHfavME3ZZ	en	[{'screen_name': 'getspectrum', 'name': 'spectrum', 'id': '127975950'}, {'screen_name': 'verizon', 'name': 'verizon', 'id': '59889953'}, {'screen_name': 'centurylink', 'name': 'centurylink', 'id': '44182242'}]	['https://www.thegardenisland.com/2019/11/09/hawaii-news/schatz-demands-outage-answers/']	[]	0	2	11	[]	[]	https://twitter.com/SenBrianSchatz/status/1194828573720416256	False		0								[]				
1194473965193818112	1194473965193818112	2019-11-12 23:36:00 EST	2019-11-12	23:36:00	-0400	1262099252	senbrianschatz	Senator Brian Schatz		When Kauai lost cell &amp; internet service, residents were left in the dark and didn’t have the information they needed.  @GetSpectrum, @Verizon &amp; @CenturyLink owe us an explanation for the outage on Kauai &amp; a plan to prevent future outages.  https://t.co/fIthGX4xjB	en	[{'screen_name': 'getspectrum', 'name': 'spectrum', 'id': '127975950'}, {'screen_name': 'verizon', 'name': 'verizon', 'id': '59889953'}, {'screen_name': 'centurylink', 'name': 'centurylink', 'id': '44182242'}]	[]	[]	8	6	24	[]	[]	https://twitter.com/SenBrianSchatz/status/1194473965193818112	False		1	https://pbs.twimg.com/ext_tw_video_thumb/1194338600193839105/pu/img/MIurayy5oj7cDcoB.jpg							[]				
1193952551013625856	1193952551013625856	2019-11-11 13:04:05 EST	2019-11-11	13:04:05	-0400	1262099252	senbrianschatz	Senator Brian Schatz		This Veterans Day, we remember and give thanks to veterans past and present for their service.  But we must honor them with not just words, but with actions: improving their access to care, ensuring they return to good jobs and supporting military families in every way we can.  https://t.co/UjTBL6UEYj	en	[]	[]	['https://pbs.twimg.com/media/EJHFTh_XkAAhjhX.jpg']	9	4	16	[]	[]	https://twitter.com/SenBrianSchatz/status/1193952551013625856	False		1	https://pbs.twimg.com/media/EJHFTh_XkAAhjhX.jpg							[]				
1192616979187716096	1192616979187716096	2019-11-07 20:37:00 EST	2019-11-07	20:37:00	-0400	1262099252	senbrianschatz	Senator Brian Schatz		We saw one of the worst traffic accidents in January - so we’re working on making Ala Moana Blvd safer.   Hawaii was just awarded a $20M federal grant to help build a new pedestrian bridge – a big win for Oahu residents &amp; businesses.   Read more ⬇️   https://t.co/d5VPiYKQzP	en	[]	['https://www.civilbeat.org/2019/11/new-ala-moana-pedestrian-bridge-planned-near-fatal-crash-site/']	[]	12	4	18	[]	[]	https://twitter.com/SenBrianSchatz/status/1192616979187716096	False		0								[]				
1192577470068707328	1192577470068707328	2019-11-07 18:00:00 EST	2019-11-07	18:00:00	-0400	1262099252	senbrianschatz	Senator Brian Schatz		The USDA just announced that Hilo's @TheFoodBasketHi will receive nearly $1M in federal funding to combat food insecurity in Hawaii.   This grant will expand statewide a program helping families in need buy locally grown produce &amp; support local farmers.  https://t.co/jpJdtopiBo	en	[{'screen_name': 'thefoodbaskethi', 'name': 'the food basket', 'id': '770500124975824896'}]	['https://www.westhawaiitoday.com/2019/11/07/hawaii-news/food-basket-to-receive-nearly-1m-to-help-low-income-families/']	[]	3	3	10	[]	[]	https://twitter.com/SenBrianSchatz/status/1192577470068707328	False		0								[]				
1192506647693922307	1192506647693922307	2019-11-07 13:18:35 EST	2019-11-07	13:18:35	-0400	1262099252	senbrianschatz	Senator Brian Schatz		We won $20M in federal funding to help build a new pedestrian bridge – making it safer for people to cross over Ala Moana Blvd to visit Ala Moana Beach Park, shop at local businesses &amp; access the future rail line.  More from @KHONnews 📺  https://t.co/diYx9QTHV3	en	[{'screen_name': 'khonnews', 'name': 'khon2 news', 'id': '20479321'}]	[]	[]	3	1	11	[]	[]	https://twitter.com/SenBrianSchatz/status/1192506647693922307	False		1	https://pbs.twimg.com/ext_tw_video_thumb/1192506482526429184/pu/img/GoOKJOrklJWLz15a.jpg							[]				
1192211926081777667	1192211926081777667	2019-11-06 17:47:28 EST	2019-11-06	17:47:28	-0400	1262099252	senbrianschatz	Senator Brian Schatz		For more than 80 years, @hgeahawaii has been a champion for unions and for working people. Mahalo for all that you do on behalf of the nearly 43,000 public sector workers across Hawai‘i.  https://t.co/jVYpD9UkAH	en	[{'screen_name': 'hgeahawaii', 'name': 'hgea', 'id': '50517818'}]	[]	['https://pbs.twimg.com/media/EIuWQBhWwAIZ0RE.jpg', 'https://pbs.twimg.com/media/EIuWQBiWkAAfZrS.jpg']	1	1	6	[]	[]	https://twitter.com/SenBrianSchatz/status/1192211926081777667	False		1	https://pbs.twimg.com/media/EIuWQBhWwAIZ0RE.jpg							[]				
1191890442008383488	1191890442008383488	2019-11-05 20:30:00 EST	2019-11-05	20:30:00	-0400	1262099252	senbrianschatz	Senator Brian Schatz		The US Air Force has selected Kauai as the preferred location for a space control squadron -- proof of Hawaii's critical role in keeping our country safe.  This decision also means 88 new jobs &amp; more federal funds for our state.    https://t.co/FVDb2h8O00	en	[]	['https://www.thegardenisland.com/2019/11/05/hawaii-news/space-squadron-settles-on-pmrf/']	[]	4	3	14	[]	[]	https://twitter.com/SenBrianSchatz/status/1191890442008383488	False		0								[]				
1191852694648098816	1191852694648098816	2019-11-05 18:00:00 EST	2019-11-05	18:00:00	-0400	1262099252	senbrianschatz	Senator Brian Schatz		📣 We're looking for college &amp; grad interns for our DC &amp; Hawaii offices!   If you're a hard worker, excellent communicator &amp; passionate about public service, click here to apply today ⬇️    https://t.co/ZiGvdL7lto  https://t.co/yASb1F9l3s	en	[]	['https://www.schatz.senate.gov/services/internships']	['https://pbs.twimg.com/tweet_video_thumb/EIodpWcXYAAAWlY.jpg']	1	2	3	[]	[]	https://twitter.com/SenBrianSchatz/status/1191852694648098816	False		1	https://pbs.twimg.com/tweet_video_thumb/EIodpWcXYAAAWlY.jpg							[]				
1191795992368230400	1191795992368230400	2019-11-05 14:14:41 EST	2019-11-05	14:14:41	-0400	1262099252	senbrianschatz	Senator Brian Schatz		The men and women of Hawaii's Air National Guard are the best in the world. That's why the US Air Force chose Kauai as the preferred site for a new space control squadron.  Hear more about what this means for our state from @HawaiiNewsNow ⬇️  https://t.co/YCMb00pe2M	en	[{'screen_name': 'hawaiinewsnow', 'name': 'hawaii news now', 'id': '14671170'}]	[]	[]	0	6	15	[]	[]	https://twitter.com/SenBrianSchatz/status/1191795992368230400	False		1	https://pbs.twimg.com/ext_tw_video_thumb/1191795943626149890/pu/img/LT0LKD2IsQk857cW.jpg							[]				
1191575113956646912	1191575113956646912	2019-11-04 23:37:00 EST	2019-11-04	23:37:00	-0400	1262099252	senbrianschatz	Senator Brian Schatz		Invasive species like the longhorn beetles are a growing threat to Hawaii Island’s cacao plantations, kukui &amp; breadfruit trees.  I'm asking the federal government to support state &amp; local agencies in eradicating these pests before they spread further.   https://t.co/fB9KGNp6ee	en	[]	['https://www.staradvertiser.com/2019/11/03/hawaii-news/newswatch/brian-schatz-presses-feds-for-help-with-beetle-issue/']	[]	2	5	28	[]	[]	https://twitter.com/SenBrianSchatz/status/1191575113956646912	False		0								[]				
