id	conversation_id	created_at	date	time	timezone	user_id	username	name	place	tweet	language	mentions	urls	photos	replies_count	retweets_count	likes_count	hashtags	cashtags	link	retweet	quote_url	video	thumbnail	near	geo	source	user_rt_id	user_rt	retweet_id	reply_to	retweet_date	translate	trans_src	trans_dest
1398083248039792642	1398083248039792642	2021-05-27 21:06:36 EDT	2021-05-27	21:06:36	-0400	1262099252	senbrianschatz	Senator Brian Schatz		The Senate just passed legislation to repeal a bunch of racist laws. We still have federal policies in the books that are deeply and explicitly racist, but this is an important step in the right direction. Now the bill heads to the House.  https://t.co/0rVsDvzcFB	en	[]	[]	['https://pbs.twimg.com/media/E2b9S35X0AE8gw2.jpg']	9	4	34	[]	[]	https://twitter.com/SenBrianSchatz/status/1398083248039792642	False		1	https://pbs.twimg.com/media/E2b9S35X0AE8gw2.jpg							[]				
1397615813495033858	1397615813495033858	2021-05-26 14:09:11 EDT	2021-05-26	14:09:11	-0400	1262099252	senbrianschatz	Senator Brian Schatz		Surfing and outrigger canoe paddling are so much more than sports. They are a part of our culture and a way of life. I look forward to seeing our kids out in the water competing in surf contests and regattas again.  https://t.co/QQ50lCvD6A	en	[]	['https://www.hawaiinewsnow.com/2021/05/25/governor-gives-green-surf-tournaments-ocean-sport-competitions-resume/']	[]	2	7	20	[]	[]	https://twitter.com/SenBrianSchatz/status/1397615813495033858	False		0								[]				
1397335592858443777	1397335592858443777	2021-05-25 19:35:41 EDT	2021-05-25	19:35:41	-0400	1262099252	senbrianschatz	Senator Brian Schatz		FINALLY! They are going to let the kids surf!	en	[]	[]	[]	4	4	38	[]	[]	https://twitter.com/SenBrianSchatz/status/1397335592858443777	False		0								[]				
1395807619508473863	1395807619508473863	2021-05-21 14:24:03 EDT	2021-05-21	14:24:03	-0400	1262099252	senbrianschatz	Senator Brian Schatz		This #MentalHealthAwarenessMonth, I want LGBTQ youth to know there are people who have your back – including lawmakers like myself and @TrevorProject. If you need immediate support, contact The Trevor Project by calling 1-866-488-7386 or going to  https://t.co/lQMwsajc96.  https://t.co/RI8eqJzpXf	en	[{'screen_name': 'trevorproject', 'name': 'the trevor project', 'id': '18916728'}]	['http://TheTrevorProject.org']	[]	1	3	12	['mentalhealthawarenessmonth']	[]	https://twitter.com/SenBrianSchatz/status/1395807619508473863	False		1	https://pbs.twimg.com/ext_tw_video_thumb/1395807342743236617/pu/img/lioqIIYZs7O_ncp4.jpg							[]				
1395417149250936845	1395417149250936845	2021-05-20 12:32:28 EDT	2021-05-20	12:32:28	-0400	1262099252	senbrianschatz	Senator Brian Schatz		Right now, paying our national debts is treated as a politicized weapon used for leverage. These attempts to govern through threats must stop. That’s why I just introduced legislation to eliminate the arbitrary debt ceiling altogether:  https://t.co/mDJlhm1pnj	en	[]	['https://www.schatz.senate.gov/press-releases/schatz-foster-bennet-van-hollen-introduce-legislation-to-repeal-debt-ceiling']	[]	2	2	15	[]	[]	https://twitter.com/SenBrianSchatz/status/1395417149250936845	False		0								[]				
1394798223299076100	1394798223299076100	2021-05-18 19:33:05 EDT	2021-05-18	19:33:05	-0400	1262099252	senbrianschatz	Senator Brian Schatz		Now, we need to let the kids surf.   https://t.co/BUBbT5GMjK	en	[]	['https://www.hawaiinewsnow.com/video/2021/05/18/senator-brian-schatz-says-letting-parents-watch-their-kids-play-sports-makes-sense/']	[]	1	1	14	[]	[]	https://twitter.com/SenBrianSchatz/status/1394798223299076100	False		0								[]				
1394662920034963458	1394662823632982021	2021-05-18 10:35:26 EDT	2021-05-18	10:35:26	-0400	1262099252	senbrianschatz	Senator Brian Schatz		Outdoor exercise is just about the healthiest thing that can be done, pandemic or not. And watching your kids play a sport is one of the great joys of life, so we’re thankful for this change. I look forward to additional announcements about ocean sports.	en	[]	[]	[]	0	0	9	[]	[]	https://twitter.com/SenBrianSchatz/status/1394662920034963458	False		0								[]				
1394662823632982021	1394662823632982021	2021-05-18 10:35:03 EDT	2021-05-18	10:35:03	-0400	1262099252	senbrianschatz	Senator Brian Schatz		GOOD NEWS: Families can now watch their kids play sports outside.  https://t.co/kjzFxzWHSJ	en	[]	['https://www.staradvertiser.com/2021/05/17/breaking-news/spectators-now-allowed-at-oahu-outdoor-sporting-events/']	[]	1	0	6	[]	[]	https://twitter.com/SenBrianSchatz/status/1394662823632982021	False		0								[]				
1393632140013801474	1393631911797526528	2021-05-15 14:19:29 EDT	2021-05-15	14:19:29	-0400	1262099252	senbrianschatz	Senator Brian Schatz		Local journalism is an irreplaceable public service. Our bill will create a committee to study the state of this industry and offer recommendations to Congress on actions it can take to bolster local news organizations.	en	[]	[]	[]	2	2	16	[]	[]	https://twitter.com/SenBrianSchatz/status/1393632140013801474	False		0								[]				
1393632034686447631	1393631911797526528	2021-05-15 14:19:04 EDT	2021-05-15	14:19:04	-0400	1262099252	senbrianschatz	Senator Brian Schatz		Families rely on local journalists to report the stories that matter most to their communities. These journalists are trusted sources of essential information — like the pandemic response and how tax dollars are spent. And, they hold local governments accountable.	en	[]	[]	[]	1	1	15	[]	[]	https://twitter.com/SenBrianSchatz/status/1393632034686447631	False		0								[]				
1393631911797526528	1393631911797526528	2021-05-15 14:18:34 EDT	2021-05-15	14:18:34	-0400	1262099252	senbrianschatz	Senator Brian Schatz		Local journalism is vital to our democracy, but the rise of digital media and the pandemic’s impacts on our economy have left the local news industry struggling to stay afloat. We reintroduced the Future of Local News Act to respond to this crisis.	en	[]	[]	[]	6	7	26	[]	[]	https://twitter.com/SenBrianSchatz/status/1393631911797526528	False		0								[]				
1393292866248663041	1393292866248663041	2021-05-14 15:51:20 EDT	2021-05-14	15:51:20	-0400	1262099252	senbrianschatz	Senator Brian Schatz		I chaired my first Transportation and Housing Subcommittee hearing yesterday, where we talked about how to make our infrastructure and transportation resilient against the growing impacts of climate change. We’ve got work to do, and I’m ready to make sure we get the job done.  https://t.co/CI10ab1xXC	en	[]	[]	['https://pbs.twimg.com/media/E1X4TTMXMAEqKLf.jpg', 'https://pbs.twimg.com/media/E1X4TTNXsAIWdno.jpg', 'https://pbs.twimg.com/media/E1X4TTTXMAYnDri.jpg', 'https://pbs.twimg.com/media/E1X4TTzXsAEv52z.jpg']	1	5	32	[]	[]	https://twitter.com/SenBrianSchatz/status/1393292866248663041	False		1	https://pbs.twimg.com/media/E1X4TTMXMAEqKLf.jpg							[]				
1393252257047662595	1393252257047662595	2021-05-14 13:09:58 EDT	2021-05-14	13:09:58	-0400	1262099252	senbrianschatz	Senator Brian Schatz		We should follow the science: It’s time to lift COVID restrictions on outdoor youth sports.  https://t.co/9JxFGSKqRK	en	[]	[]	[]	2	1	13	[]	[]	https://twitter.com/SenBrianSchatz/status/1393252257047662595	False		1	https://pbs.twimg.com/ext_tw_video_thumb/1393252082170355717/pu/img/DKft63IYNw6WSgor.jpg							[]				
1392954256525774857	1392954256525774857	2021-05-13 17:25:49 EDT	2021-05-13	17:25:49	-0400	1262099252	senbrianschatz	Senator Brian Schatz		Right now, Hawai‘i residents can watch sports in bars, but families can't watch their kids play sports outside. And surfing competitions and regattas are canceled entirely. I’m urging Gov. Ige to lift this ban and help us start moving towards returning to a more normal life.	en	[]	[]	[]	7	20	90	[]	[]	https://twitter.com/SenBrianSchatz/status/1392954256525774857	False		0								[]				
1392597609525690368	1392597609525690368	2021-05-12 17:48:37 EDT	2021-05-12	17:48:37	-0400	1262099252	senbrianschatz	Senator Brian Schatz		COVID RELIEF UPDATE: Hawai‘i residents can now save up to $50 on monthly internet bills and get discounts on computers and tablets through a new program created by the December COVID-19 relief package. To learn how you can apply, visit   https://t.co/Msxwdd0Sg7	en	[]	['http://GetEmergencyBroadband.Org']	[]	1	4	17	[]	[]	https://twitter.com/SenBrianSchatz/status/1392597609525690368	False		0								[]				
1392231769550770183	1392231769550770183	2021-05-11 17:34:54 EDT	2021-05-11	17:34:54	-0400	1262099252	senbrianschatz	Senator Brian Schatz		Hawaii will receive nearly $14 million in additional federal funding for rental assistance.  This money from the American Rescue Plan will help families pay their rent and utility bills. As we keep working to bring back more federal relief, this new funding will be a big help.  https://t.co/hxazVKGgwH	en	[]	[]	[]	1	3	18	[]	[]	https://twitter.com/SenBrianSchatz/status/1392231769550770183	False		1	https://pbs.twimg.com/ext_tw_video_thumb/1392231536154578944/pu/img/xe-LBShqya_2cPO3.jpg							[]				
1391856907334340619	1391856907334340619	2021-05-10 16:45:20 EDT	2021-05-10	16:45:20	-0400	1262099252	senbrianschatz	Senator Brian Schatz		Right now, more than 70% of hotel employees are still out of work due to the ongoing pandemic. That why I introduced the Save Hotel Jobs Act, which will bring back laid-off workers, pay hotel employees, and ensure safe workplaces.  https://t.co/xBt0Jl4c0n	en	[]	['https://www.kitv.com/story/43819133/sen-schatz-fights-for-hawaiis-hotel-industry-workers-with-new-measure']	[]	3	2	32	[]	[]	https://twitter.com/SenBrianSchatz/status/1391856907334340619	False		0								[]				
1390770604312350727	1390770604312350727	2021-05-07 16:48:45 EDT	2021-05-07	16:48:45	-0400	1262099252	senbrianschatz	Senator Brian Schatz		To solve the student loan debt crisis, we need to focus on the real cost to students and families — including books, room and board, transportation, and supplies. I reintroduced the Debt-Free College Act to go beyond tuition costs and help people cover the full cost of college.  https://t.co/hNGI9uNPnR	en	[]	[]	[]	4	2	20	[]	[]	https://twitter.com/SenBrianSchatz/status/1390770604312350727	False		1	https://pbs.twimg.com/ext_tw_video_thumb/1390770320987021312/pu/img/K_abqDaCCqcrvpJp.jpg							[]				
1390397022054801414	1390397022054801414	2021-05-06 16:04:17 EDT	2021-05-06	16:04:17	-0400	1262099252	senbrianschatz	Senator Brian Schatz		We're now accepting applications for our High School Internship Program. I encourage students across the state to apply for this opportunity to learn about the U.S. Senate and make a difference in our communities. More info here:  https://t.co/oI2YiRz6GA	en	[]	['https://www.schatz.senate.gov/Services/Internships']	[]	0	6	14	[]	[]	https://twitter.com/SenBrianSchatz/status/1390397022054801414	False		0								[]				
1390061578918064130	1390061249065590792	2021-05-05 17:51:21 EDT	2021-05-05	17:51:21	-0400	1262099252	senbrianschatz	Senator Brian Schatz		By providing new grants and tax credits, the Save Hotel Jobs Act will:   ✅Help pay hotel employees  ✅Bring back laid-off workers  ✅Ensure safe workplaces    We need to pass this crucial bill to deliver the long-term assistance hotel workers need to get through this crisis.	en	[]	[]	[]	2	3	13	[]	[]	https://twitter.com/SenBrianSchatz/status/1390061578918064130	False		0								[]				
1390061249065590792	1390061249065590792	2021-05-05 17:50:02 EDT	2021-05-05	17:50:02	-0400	1262099252	senbrianschatz	Senator Brian Schatz		Hotel workers in Hawai‘i and across the country have been crushed by the pandemic – with millions of employees out of work and many more struggling to get by with less hours. I introduced the Save Hotel Jobs Act to help them get back to work.	en	[]	[]	[]	1	3	20	[]	[]	https://twitter.com/SenBrianSchatz/status/1390061249065590792	False	https://twitter.com/KITV4/status/1387602541412851718	0								[]				
1385313597908307968	1385313597908307968	2021-04-22 15:24:34 EDT	2021-04-22	15:24:34	-0400	1262099252	senbrianschatz	Senator Brian Schatz		This #EarthDay, I’m more hopeful than ever before. Now that @POTUS has set bold climate goals for the US, it's time for Congress to enact legislation that protects our planet, creates jobs, &amp; makes sure everyone can benefit from a new clean energy future.  https://t.co/AadO6hbFgQ	en	[{'screen_name': 'potus', 'name': 'president biden', 'id': '1349149096909668363'}]	['https://www.nbcnews.com/think/opinion/president-biden-s-earth-day-climate-summit-rebuke-trump-s-ncna1264884']	[]	4	18	48	['earthday']	[]	https://twitter.com/SenBrianSchatz/status/1385313597908307968	False		0								[]				
1371164725468405767	1371164725468405767	2021-03-14 14:22:00 EDT	2021-03-14	14:22:00	-0400	1262099252	senbrianschatz	Senator Brian Schatz		The American Rescue Plan is a big win for Hawai‘i and for the country — delivering much needed relief to families, workers, and small businesses.  I discussed the package, and more, with @BrianBeutler on his podcast, Rubicon.   https://t.co/3GIgYp9lLh	en	[{'screen_name': 'brianbeutler', 'name': 'brian beutler', 'id': '21696279'}]	['https://crooked.com/podcast/98-percent-great/']	[]	14	25	211	[]	[]	https://twitter.com/SenBrianSchatz/status/1371164725468405767	False		0								[]				
1367185284853604359	1367185281699504133	2021-03-03 13:49:07 EST	2021-03-03	13:49:07	-0400	1262099252	senbrianschatz	Senator Brian Schatz		Our new bill will block these illegally sourced goods from reaching the market, which will help protect the rainforests and fight the climate crisis.	en	[]	[]	[]	2	3	35	[]	[]	https://twitter.com/SenBrianSchatz/status/1367185284853604359	False		0								[]				
1367185283247202304	1367185281699504133	2021-03-03 13:49:07 EST	2021-03-03	13:49:07	-0400	1262099252	senbrianschatz	Senator Brian Schatz		This illegal deforestation accounts for a big chunk of carbon emissions and accelerates climate change.  Plus 1.5 billion people depend on healthy rainforests to support their families and make a living.	en	[]	[]	[]	1	1	20	[]	[]	https://twitter.com/SenBrianSchatz/status/1367185283247202304	False		0								[]				
1367185281699504133	1367185281699504133	2021-03-03 13:49:06 EST	2021-03-03	13:49:06	-0400	1262099252	senbrianschatz	Senator Brian Schatz		You may not know this, but half the packaged food at the supermarket contains palm oil — an ingredient that is driving illegal deforestation.  So when we buy these products, we're unknowingly supporting the destruction of our rainforests.  https://t.co/1T60qPwY7C	en	[]	['https://www.cbsnews.com/news/brian-schatz-bill-to-curb-illegal-deforestation/']	[]	6	13	34	[]	[]	https://twitter.com/SenBrianSchatz/status/1367185281699504133	False		0								[]				
1366860095561363464	1366860095561363464	2021-03-02 16:16:56 EST	2021-03-02	16:16:56	-0400	1262099252	senbrianschatz	Senator Brian Schatz		$80M in new federal funding will soon be on its way to Native Hawaiian health centers, higher education institutions &amp; housing assistance programs.  We fought hard to get this much-needed relief included in the latest COVID package. Still negotiating—we'll have more updates soon.  https://t.co/Vv9RbxTtbR	en	[]	[]	[]	1	3	38	[]	[]	https://twitter.com/SenBrianSchatz/status/1366860095561363464	False		1	https://pbs.twimg.com/ext_tw_video_thumb/1366857317661237252/pu/img/hyNlgUvamTI2bdz8.jpg							[]				
1366555914354974723	1366555912597630981	2021-03-01 20:08:14 EST	2021-03-01	20:08:14	-0400	1262099252	senbrianschatz	Senator Brian Schatz		This will provide much needed relief for the Native Hawaiian community as we weather this storm. We're still working on the final deal, so we'll have more to announce in the coming days.	en	[]	[]	[]	0	1	27	[]	[]	https://twitter.com/SenBrianSchatz/status/1366555914354974723	False		0								[]				
1366555912597630981	1366555912597630981	2021-03-01 20:08:13 EST	2021-03-01	20:08:13	-0400	1262099252	senbrianschatz	Senator Brian Schatz		We just secured $80 million in new relief funding exclusively for the Native Hawaiian community in the latest COVID deal.  These federal dollars will help families make rent, pay for health care, and provide quality educational opportunities for their kids.	en	[]	[]	[]	4	5	50	[]	[]	https://twitter.com/SenBrianSchatz/status/1366555912597630981	False		0								[]				
1365564214451052544	1365564214451052544	2021-02-27 02:27:34 EST	2021-02-27	02:27:34	-0400	1262099252	senbrianschatz	Senator Brian Schatz		UPDATE: COVID relief just passed the House.  People need help now &amp; it's our job to deliver. The American Rescue Plan will give money to families in need, provide our small businesses a lifeline, get the vaccine into arms &amp; help make our schools safer. We need to get this done.	en	[]	[]	[]	23	72	321	[]	[]	https://twitter.com/SenBrianSchatz/status/1365564214451052544	False		0								[]				
1365110079968530432	1365110079968530432	2021-02-25 20:23:00 EST	2021-02-25	20:23:00	-0400	1262099252	senbrianschatz	Senator Brian Schatz		This $14 million grant will help us repair and maintain our public housing so that thousands of Hawai’i families have a safe, affordable place to call home.  https://t.co/P5Xx1RP80b	en	[]	[]	[]	3	5	35	[]	[]	https://twitter.com/SenBrianSchatz/status/1365110079968530432	False		1	https://pbs.twimg.com/ext_tw_video_thumb/1365061816875900931/pu/img/5OY9aglmoKtU41mb.jpg							[]				
1365081390757347334	1365081390757347334	2021-02-25 18:29:00 EST	2021-02-25	18:29:00	-0400	1262099252	senbrianschatz	Senator Brian Schatz		The Indian Affairs committee is the strongest voice for Native priorities in Congress—and as chair I'll bring Native Hawaiian issues to the forefront.  https://t.co/Jr1U32yRI0	en	[]	['https://www.civilbeat.org/beat/native-hawaiians-have-a-front-row-seat-at-the-us-senate/']	[]	2	0	28	[]	[]	https://twitter.com/SenBrianSchatz/status/1365081390757347334	False		0								[]				
1365054372061859847	1365054371252367367	2021-02-25 16:41:38 EST	2021-02-25	16:41:38	-0400	1262099252	senbrianschatz	Senator Brian Schatz		Now that this landmark bill has passed the House, it's our job to get it through the Senate and signed by the president.	en	[]	[]	[]	5	4	43	[]	[]	https://twitter.com/SenBrianSchatz/status/1365054372061859847	False		0								[]				
1365054371252367367	1365054371252367367	2021-02-25 16:41:38 EST	2021-02-25	16:41:38	-0400	1262099252	senbrianschatz	Senator Brian Schatz		No one should get fired from their job, barred from renting a home, or denied services because of who they are or who they love.  That's why I support the #EqualityAct, which will finally offer the LGBTQ+ community critical legal protections against discrimination.	en	[]	[]	[]	19	41	331	['equalityact']	[]	https://twitter.com/SenBrianSchatz/status/1365054371252367367	False		0								[]				
1364740046549639170	1364740043101908992	2021-02-24 19:52:37 EST	2021-02-24	19:52:37	-0400	1262099252	senbrianschatz	Senator Brian Schatz		Now more than ever, Congress must be tuned in. As the strongest voice for Native priorities in the Senate, our committee will continue our bipartisan tradition and work together to address these challenges. That starts by listening to and learning from Native leaders.	en	[]	[]	[]	1	2	28	[]	[]	https://twitter.com/SenBrianSchatz/status/1364740046549639170	False		0								[]				
1364740045681360900	1364740043101908992	2021-02-24 19:52:37 EST	2021-02-24	19:52:37	-0400	1262099252	senbrianschatz	Senator Brian Schatz		We met with Native leaders from Indian Country, Hawaiʻi, and Alaska, who shared how COVID-19, economic insecurity, racial injustice, and climate change are disproportionately impacting their communities.	en	[]	[]	[]	2	3	29	[]	[]	https://twitter.com/SenBrianSchatz/status/1364740045681360900	False		0								[]				
1364740043101908992	1364740043101908992	2021-02-24 19:52:36 EST	2021-02-24	19:52:36	-0400	1262099252	senbrianschatz	Senator Brian Schatz		Today we held our first hearing of the Senate @IndianCommittee, putting the priorities of Native communities directly in the spotlight.  https://t.co/opezxhDLMD	en	[{'screen_name': 'indiancommittee', 'name': 'senate committee on indian affairs', 'id': '329761746'}]	[]	['https://pbs.twimg.com/media/EvB-LyDVEAI1vPl.jpg', 'https://pbs.twimg.com/media/EvB-LyFVgAIVkIq.jpg']	2	6	64	[]	[]	https://twitter.com/SenBrianSchatz/status/1364740043101908992	False		1	https://pbs.twimg.com/media/EvB-LyDVEAI1vPl.jpg							[]				
1364711759752396801	1364711759752396801	2021-02-24 18:00:13 EST	2021-02-24	18:00:13	-0400	1262099252	senbrianschatz	Senator Brian Schatz		STARTING TODAY: small businesses with fewer than 20 employees will have an exclusive two-week window to apply for more PPP relief.  Visit our resource guide for more information:  https://t.co/4KUPrmLOjy	en	[]	['https://www.schatz.senate.gov/coronavirus/small-businesses/sba-paycheck-protection-loan-program']	[]	2	9	24	[]	[]	https://twitter.com/SenBrianSchatz/status/1364711759752396801	False		0								[]				
1364688326364651525	1364688326364651525	2021-02-24 16:27:06 EST	2021-02-24	16:27:06	-0400	1262099252	senbrianschatz	Senator Brian Schatz		The research is clear: masks are critical to stopping the spread of the virus.  We've been pushing for months to get the federal government to send out free masks to people who need them most, so I'm glad to see @POTUS is considering this plan.  https://t.co/7krA8j0duK	en	[{'screen_name': 'potus', 'name': 'president biden', 'id': '1349149096909668363'}]	['https://www.cnn.com/2021/02/23/politics/biden-masks-coronavirus/index.html']	[]	2	6	34	[]	[]	https://twitter.com/SenBrianSchatz/status/1364688326364651525	False		0								[]				
1364450930331164675	1364450929207087105	2021-02-24 00:43:46 EST	2021-02-24	00:43:46	-0400	1262099252	senbrianschatz	Senator Brian Schatz		➜ *starting tomorrow* small businesses with less than 20 employees will get an exclusive 2 week window to apply ➜ self-employed, sole proprietors &amp; independent contractors will soon be eligible for bigger loans ➜ more small businesses will soon be eligible to apply for funding	en	[]	[]	[]	1	9	27	[]	[]	https://twitter.com/SenBrianSchatz/status/1364450930331164675	False		0								[]				
1364450929207087105	1364450929207087105	2021-02-24 00:43:46 EST	2021-02-24	00:43:46	-0400	1262099252	senbrianschatz	Senator Brian Schatz		UPDATE: new changes to the PPP program will provide immediate help for small businesses struggling to stay afloat.  We still need to pass a relief package but these executive actions will help keep workers on payroll &amp; keep the lights on in the meantime.   https://t.co/QgvsU1wXDK	en	[]	['https://www.washingtonpost.com/business/2021/02/22/biden-ppp-rules//']	[]	2	9	41	[]	[]	https://twitter.com/SenBrianSchatz/status/1364450929207087105	False		0								[]				
1364347449863733254	1364347449863733254	2021-02-23 17:52:35 EST	2021-02-23	17:52:35	-0400	1262099252	senbrianschatz	Senator Brian Schatz		Everyone deserves a safe, affordable place to call home. This $14 million federal grant will help us repair and maintain homes for thousands of families living in public housing across Hawai’i. https://t.co/dt8ljMZOvp	en	[]	['https://www.bizjournals.com/pacific/news/2021/02/23/hawaii-gets-14m-for-public-housing.html']	[]	0	4	21	[]	[]	https://twitter.com/SenBrianSchatz/status/1364347449863733254	False		0								[]				
1362948197748989959	1362948196436221952	2021-02-19 21:12:27 EST	2021-02-19	21:12:27	-0400	1262099252	senbrianschatz	Senator Brian Schatz		This much needed relief will make sure we have the resources to get through this tough time until everyone can get vaccinated.	en	[]	[]	[]	2	1	22	[]	[]	https://twitter.com/SenBrianSchatz/status/1362948197748989959	False		0								[]				
1362948196436221952	1362948196436221952	2021-02-19 21:12:27 EST	2021-02-19	21:12:27	-0400	1262099252	senbrianschatz	Senator Brian Schatz		We're working on a new COVID package &amp; we should be able to get it done in the next few weeks. Too many families are struggling to make rent or put food on the table &amp; too many kids aren’t in school.   We're still negotiating, but here's where it stands👇   https://t.co/YjScmxlPBs	en	[]	['https://www.hawaiitribune-herald.com/2021/02/18/hawaii-news/schatz-touts-1-9t-pandemic-relief-package/']	[]	1	1	33	[]	[]	https://twitter.com/SenBrianSchatz/status/1362948196436221952	False		0								[]				
1362899578413084673	1362899578413084673	2021-02-19 17:59:15 EST	2021-02-19	17:59:15	-0400	1262099252	senbrianschatz	Senator Brian Schatz		We need to get our kids safely back to school ASAP. That means passing this new COVID relief package so that we have enough funding, working with local school boards &amp; teachers unions, and following CDC guidelines. It won't be easy, but we have to try.  https://t.co/XdK2UJAuoO	en	[]	['https://youtu.be/aBor2vkYOfs']	[]	3	1	35	[]	[]	https://twitter.com/SenBrianSchatz/status/1362899578413084673	False		0								[]				
1362869378883219459	1362869378883219459	2021-02-19 15:59:15 EST	2021-02-19	15:59:15	-0400	1262099252	senbrianschatz	Senator Brian Schatz		It's official: America is back.  Solving the climate crisis will require immediate, unprecedented global cooperation — and that's what American leadership can deliver. Excited to work with @POTUS and partners around the world on big, bold climate action.  https://t.co/JQnTNisr5o	en	[{'screen_name': 'potus', 'name': 'president biden', 'id': '1349149096909668363'}]	['https://www.cnn.com/2021/02/19/politics/us-rejoins-paris-agreement-biden-administration/index.html']	[]	7	6	41	[]	[]	https://twitter.com/SenBrianSchatz/status/1362869378883219459	False		0								[]				
