id	conversation_id	created_at	date	time	timezone	user_id	username	name	place	tweet	language	mentions	urls	photos	replies_count	retweets_count	likes_count	hashtags	cashtags	link	retweet	quote_url	video	thumbnail	near	geo	source	user_rt_id	user_rt	retweet_id	reply_to	retweet_date	translate	trans_src	trans_dest
1328427361239511040	1328427359675043841	2020-11-16 14:58:58 EST	2020-11-16	14:58:58	-0400	1079770852302958592	reptimmons	Congressman William Timmons		Last week, Pfizer announced a 90% effective rate for their vaccine candidate. Today, Moderna published their data showing a 94.5% effective rate. If both vaccines receive FDA approval as expected in the next few weeks, up to 20 million Americans could be vaccinated by year’s end.	en	[]	[]	[]	2	1	4	[]	[]	https://twitter.com/RepTimmons/status/1328427361239511040	False		0								[]				
1328427359675043841	1328427359675043841	2020-11-16 14:58:58 EST	2020-11-16	14:58:58	-0400	1079770852302958592	reptimmons	Congressman William Timmons		Thanks to our scientific community and the extraordinary efforts of the Trump Administration’s Operation Warp Speed, we now have at least two promising Covid-19 vaccines.	en	[]	[]	[]	4	2	7	[]	[]	https://twitter.com/RepTimmons/status/1328427359675043841	False	https://twitter.com/WSJ/status/1328307286457114624	0								[]				
1326587230031400960	1326587230031400960	2020-11-11 13:06:57 EST	2020-11-11	13:06:57	-0400	1079770852302958592	reptimmons	Congressman William Timmons		To all of our veterans—thank you for your service and sacrifice. Today, a grateful nation thanks and honors you.  https://t.co/2iAbdbXgcw	en	[]	[]	['https://pbs.twimg.com/media/Emj8DeUW8AIJvSX.jpg']	2	5	16	[]	[]	https://twitter.com/RepTimmons/status/1326587230031400960	False		1	https://pbs.twimg.com/media/Emj8DeUW8AIJvSX.jpg							[]				
1326274236864978956	1326274233203372039	2020-11-10 16:23:13 EST	2020-11-10	16:23:13	-0400	1079770852302958592	reptimmons	Congressman William Timmons		We need to see this all the way through so that the American people can be confident in this election. Our nation will be better off because of it.	en	[]	[]	[]	5	6	16	[]	[]	https://twitter.com/RepTimmons/status/1326274236864978956	False		0								[]				
1326274235715612672	1326274233203372039	2020-11-10 16:23:13 EST	2020-11-10	16:23:13	-0400	1079770852302958592	reptimmons	Congressman William Timmons		So to those of you who think President Trump should just pack up and go home, that is not going to happen. I encourage you to let the process play out before rushing to judgment.	en	[]	[]	[]	2	4	11	[]	[]	https://twitter.com/RepTimmons/status/1326274235715612672	False		0								[]				
1326274233941581824	1326274233203372039	2020-11-10 16:23:13 EST	2020-11-10	16:23:13	-0400	1079770852302958592	reptimmons	Congressman William Timmons		This means that, at the very least, the President and his legal team should be given every opportunity to fully investigate reports of voting irregularities and fraud, and any issues they find should be heard in the appropriate court of law.	en	[]	[]	[]	2	3	7	[]	[]	https://twitter.com/RepTimmons/status/1326274233941581824	False		0								[]				
1326274233203372039	1326274233203372039	2020-11-10 16:23:12 EST	2020-11-10	16:23:12	-0400	1079770852302958592	reptimmons	Congressman William Timmons		This election is not over because the mainstream media “called it.” Free and fair elections are the bedrock of our democratic process. More than 150 million Americans voted last week, and they deserve to have confidence in the outcome.	en	[]	[]	[]	10	8	26	[]	[]	https://twitter.com/RepTimmons/status/1326274233203372039	False		0								[]				
1324807221742546945	1324807220702359554	2020-11-06 15:13:50 EST	2020-11-06	15:13:50	-0400	1079770852302958592	reptimmons	Congressman William Timmons		Once every vote has been properly counted, we will know who won this election.	en	[]	[]	[]	46	44	277	[]	[]	https://twitter.com/RepTimmons/status/1324807221742546945	False		0								[]				
1324807220702359554	1324807220702359554	2020-11-06 15:13:49 EST	2020-11-06	15:13:49	-0400	1079770852302958592	reptimmons	Congressman William Timmons		The election is not over yet. Voting irregularities and allegations of fraud are serious claims that undermine our electoral process and must be fully vetted. The President has the right to challenge these claims in court just as any candidate for office would.	en	[]	[]	[]	221	1295	4050	[]	[]	https://twitter.com/RepTimmons/status/1324807220702359554	False		0								[]				
1323871362453282816	1323871361396318209	2020-11-04 01:15:03 EST	2020-11-04	01:15:03	-0400	1079770852302958592	reptimmons	Congressman William Timmons		As always, our dedicated team will be here to serve you and your family. You can always reach me on my personal cell at 864-616-8821 or my personal email at William@TimmonsLLC.com.   If you ever need us, please do not hesitate to reach out. We are here to help.	en	[]	[]	[]	5	1	20	[]	[]	https://twitter.com/RepTimmons/status/1323871362453282816	False		0								[]				
1323871361396318209	1323871361396318209	2020-11-04 01:15:03 EST	2020-11-04	01:15:03	-0400	1079770852302958592	reptimmons	Congressman William Timmons		Thank you, Greenville and Spartanburg! It has been an honor to represent the Fourth Congressional District in Washington. We have made a lot of progress these past two years, and we will continue to work hard on behalf of every citizen in the Upstate.	en	[]	[]	[]	8	11	76	[]	[]	https://twitter.com/RepTimmons/status/1323871361396318209	False		0								[]				
1321881653233463298	1321881653233463298	2020-10-29 14:28:40 EDT	2020-10-29	14:28:40	-0400	1079770852302958592	reptimmons	Congressman William Timmons		Over the last three months, our economy grew at its fastest rate ever. This is the largest single quarter of economic growth on record. While we have some more work to do, our Great American Comeback is well underway!   https://t.co/hdwWEp9ruU	en	[]	['https://www.cnbc.com/2020/10/29/us-gdp-report-third-quarter-2020.html']	[]	4	2	6	[]	[]	https://twitter.com/RepTimmons/status/1321881653233463298	False		0								[]				
1320890954476326917	1320890954476326917	2020-10-26 20:51:59 EDT	2020-10-26	20:51:59	-0400	1079770852302958592	reptimmons	Congressman William Timmons		Thanks to Chairman @LindseyGrahamSC, Judge Amy Coney Barrett is now officially Justice Amy Coney Barrett. She is eminently qualified and had a very impressive confirmation hearing. Our nation, and our Constitution, will be well served with Justice Barrett on the Supreme Court.	en	[{'screen_name': 'lindseygrahamsc', 'name': 'lindsey graham', 'id': '432895323'}]	[]	[]	4	5	23	[]	[]	https://twitter.com/RepTimmons/status/1320890954476326917	False		0								[]				
1319324986042142721	1319324986042142721	2020-10-22 13:09:23 EDT	2020-10-22	13:09:23	-0400	1079770852302958592	reptimmons	Congressman William Timmons		Under Chairman @LindseyGrahamSC's leadership, Judge Amy Coney Barrett's nomination to the Supreme Court has been approved by the Senate Judiciary Committee. The full Senate should move to confirm this highly-qualified nominee without delay.	en	[{'screen_name': 'lindseygrahamsc', 'name': 'lindsey graham', 'id': '432895323'}]	[]	[]	10	6	32	[]	[]	https://twitter.com/RepTimmons/status/1319324986042142721	False		0								[]				
1319276665051070465	1319276665051070465	2020-10-22 09:57:22 EDT	2020-10-22	09:57:22	-0400	1079770852302958592	reptimmons	Congressman William Timmons		After 16 hearings, 6 virtual discussions, and many listening sessions, my colleagues and I on the @ModernizeCmte are pleased to announce our final report with 97 recommendations to make Congress more effective, efficient, and transparent. Read more here:  https://t.co/Jaf80y05ER	en	[{'screen_name': 'modernizecmte', 'name': 'select committee on the modernization of congress', 'id': '1105127249852936200'}]	['https://modernizecongress.house.gov/final-report']	[]	0	8	17	[]	[]	https://twitter.com/RepTimmons/status/1319276665051070465	False		0								[]				
1318689982186389507	1318689981213409280	2020-10-20 19:06:06 EDT	2020-10-20	19:06:06	-0400	1079770852302958592	reptimmons	Congressman William Timmons		This is a reminder to all of us that law enforcement and first responders put their own lives on the line every day to keep us and our communities safe. Our prayers are with the families of those who were hurt and the entire Greenville law enforcement community tonight.	en	[]	[]	[]	0	2	13	[]	[]	https://twitter.com/RepTimmons/status/1318689982186389507	False		0								[]				
1318689981213409280	1318689981213409280	2020-10-20 19:06:06 EDT	2020-10-20	19:06:06	-0400	1079770852302958592	reptimmons	Congressman William Timmons		We are incredibly saddened by the news that a Greenville County Sheriff's Office Deputy was killed today and others were injured while responding to a traffic stop on I-85.	en	[]	[]	[]	2	6	29	[]	[]	https://twitter.com/RepTimmons/status/1318689981213409280	False		0								[]				
1317203415055933441	1317203415055933441	2020-10-16 16:39:01 EDT	2020-10-16	16:39:01	-0400	1079770852302958592	reptimmons	Congressman William Timmons		The deadline for the Congressional App Challenge has been extended! Middle and high school students in SC-04 now have until Monday, October 19 at 8:00pm to submit their apps. Visit  https://t.co/VkueKVvwXI for more information.	en	[]	['https://www.congressionalappchallenge.us/']	[]	0	2	3	[]	[]	https://twitter.com/RepTimmons/status/1317203415055933441	False		0								[]				
1316746893901393921	1316746893901393921	2020-10-15 10:24:58 EDT	2020-10-15	10:24:58	-0400	1079770852302958592	reptimmons	Congressman William Timmons		Big news for #SC04—the NCAA is returning to the Upstate! We are grateful for the opportunity to host these teams and look forward to welcoming them over the next few years.    https://t.co/spCXS7HSUB	en	[]	['https://www.postandcourier.com/sports/greenville-lands-future-ncaa-hoop-tournament-host-spots-columbia-misses-out/article_d31b595a-0e17-11eb-848a-7b0e19b12ca1.html']	[]	1	4	9	['sc04']	[]	https://twitter.com/RepTimmons/status/1316746893901393921	False		0								[]				
1316163913462034433	1316163913462034433	2020-10-13 19:48:24 EDT	2020-10-13	19:48:24	-0400	1079770852302958592	reptimmons	Congressman William Timmons		Happy 245th birthday to the U.S. Navy. To all of our nation’s Sailors, past and present, thank you for your service!  https://t.co/GE1mdLFYbC	en	[]	[]	['https://pbs.twimg.com/media/EkP0DgfXkAUQYZ5.jpg']	1	4	8	[]	[]	https://twitter.com/RepTimmons/status/1316163913462034433	False		1	https://pbs.twimg.com/media/EkP0DgfXkAUQYZ5.jpg							[]				
1315800333180964864	1315800331968819200	2020-10-12 19:43:40 EDT	2020-10-12	19:43:40	-0400	1079770852302958592	reptimmons	Congressman William Timmons		@spartanburgone, @SpartanburgD2, @SpartanburgD3, @SpartDist4, @SpartanburgD5, @SpartDistrict6, @SchoolDistrict7, @gcschools.	und	[{'screen_name': 'spartanburgd2', 'name': 'spartanburg school district 2', 'id': '752857119452389377'}, {'screen_name': 'spartanburgd3', 'name': 'spartanburg county school district three', 'id': '122673352'}, {'screen_name': 'spartdist4', 'name': 'spartanburgdistrict4', 'id': '1014343622479745024'}, {'screen_name': 'spartanburgd5', 'name': 'spartanburg5 schools', 'id': '1470585200'}, {'screen_name': 'spartdistrict6', 'name': 'spartanburg dist six', 'id': '377762951'}, {'screen_name': 'schooldistrict7', 'name': 'spartanburgdistrict7', 'id': '216373042'}, {'screen_name': 'gcschools', 'name': 'greenville county schools', 'id': '41578313'}]	[]	[]	0	1	2	[]	[]	https://twitter.com/RepTimmons/status/1315800333180964864	False		0								[]				
1315800331968819200	1315800331968819200	2020-10-12 19:43:40 EDT	2020-10-12	19:43:40	-0400	1079770852302958592	reptimmons	Congressman William Timmons		There is still time to submit your application for a Military Academy Nomination. Applications are due on October 23, 2020. Visit  https://t.co/B0MUixnVvS for more information and to complete your application today!  https://t.co/00nn9aWMlr	en	[]	['https://timmons.house.gov/services/military-academy']	['https://pbs.twimg.com/media/EkKoVGtXYAAUdSf.jpg']	2	5	3	[]	[]	https://twitter.com/RepTimmons/status/1315800331968819200	False		1	https://pbs.twimg.com/media/EkKoVGtXYAAUdSf.jpg							[]				
1315736982912471044	1315736982912471044	2020-10-12 15:31:56 EDT	2020-10-12	15:31:56	-0400	1079770852302958592	reptimmons	Congressman William Timmons		Under Chairman @LindseyGrahamSC’s leadership, the Senate held its first day of #SCOTUShearings for Judge Amy Coney Barrett. She is eminently qualified to serve on the Supreme Court and will uphold the Constitution as written. Our nation will be well-served with her on the bench.  https://t.co/zWMV6XMJ0l	en	[{'screen_name': 'lindseygrahamsc', 'name': 'lindsey graham', 'id': '432895323'}]	[]	['https://pbs.twimg.com/media/EkJvz_4XsAI5PNv.jpg']	44	53	188	['scotushearings']	[]	https://twitter.com/RepTimmons/status/1315736982912471044	False		1	https://pbs.twimg.com/media/EkJvz_4XsAI5PNv.jpg							[]				
1315016867325587456	1315016867325587456	2020-10-10 15:50:27 EDT	2020-10-10	15:50:27	-0400	1079770852302958592	reptimmons	Congressman William Timmons		Today is the 109th Annual Taiwan Day or Double Ten Day. Taiwan has been a special friend to the United States, sharing our values of freedom and democracy around the world. Best wishes to @TECRO_USA and the Taiwanese people on this joyous occasion!	en	[{'screen_name': 'tecro_usa', 'name': 'taiwan in the us', 'id': '1449728766'}]	[]	[]	1	7	18	[]	[]	https://twitter.com/RepTimmons/status/1315016867325587456	False		0								[]				
1314599945295532032	1314599945295532032	2020-10-09 12:13:45 EDT	2020-10-09	12:13:45	-0400	1079770852302958592	reptimmons	Congressman William Timmons		My thoughts on COVID-19 relief negotiations ⤵️  https://t.co/uAgEUo70JB	en	[]	[]	['https://pbs.twimg.com/media/Ej5lro4WoAMNU28.jpg']	1	2	5	[]	[]	https://twitter.com/RepTimmons/status/1314599945295532032	False		1	https://pbs.twimg.com/media/Ej5lro4WoAMNU28.jpg							[]				
1313441745691176960	1313441745691176960	2020-10-06 07:31:29 EDT	2020-10-06	07:31:29	-0400	1079770852302958592	reptimmons	Congressman William Timmons		Good morning #SC04! I will be joining @joeyhudson on the Morning Answer for another #TuesdayWithTimmons in a few minutes. Listen live on @talk945 FM or  https://t.co/ymabvlrApE	en	[{'screen_name': 'joeyhudson', 'name': 'joeyhudson', 'id': '14820058'}, {'screen_name': 'talk945', 'name': '94.5 wgtk the answer', 'id': '963572814'}]	['http://player.listenlive.co/56791']	[]	3	2	5	['sc04', 'tuesdaywithtimmons']	[]	https://twitter.com/RepTimmons/status/1313441745691176960	False		0								[]				
1313307395016331265	1313307395016331265	2020-10-05 22:37:37 EDT	2020-10-05	22:37:37	-0400	1079770852302958592	reptimmons	Congressman William Timmons		It is great to see President Trump back at the White House tonight! Thank you to the excellent team at Walter Reed. President @realDonaldTrump is a fighter, and we are glad to see him back at home and continuing to work hard on behalf of our nation.	en	[{'screen_name': 'realdonaldtrump', 'name': 'donald j. trump', 'id': '25073877'}]	[]	[]	33	281	1130	[]	[]	https://twitter.com/RepTimmons/status/1313307395016331265	False		0								[]				
1312017907237498885	1312017907237498885	2020-10-02 09:13:39 EDT	2020-10-02	09:13:39	-0400	1079770852302958592	reptimmons	Congressman William Timmons		Wishing President @realDonaldTrump and First Lady @MELANIATRUMP a full and speedy recovery. We are keeping them and all our fellow Americans fighting Covid-19 in our prayers.	en	[{'screen_name': 'realdonaldtrump', 'name': 'donald j. trump', 'id': '25073877'}, {'screen_name': 'melaniatrump', 'name': 'melania trump', 'id': '108471631'}]	[]	[]	4	5	11	[]	[]	https://twitter.com/RepTimmons/status/1312017907237498885	False		0								[]				
1311431461283803136	1311431461283803136	2020-09-30 18:23:20 EDT	2020-09-30	18:23:20	-0400	1079770852302958592	reptimmons	Congressman William Timmons		This is great news for our South Carolina economy! Boeing’s plans to consolidate production of the 787 Dreamliners in the Palmetto State will preserve and expand jobs for years to come.    https://t.co/JQbj8AqPry	en	[]	['https://www.wsj.com/articles/boeing-to-move-all-787-dreamliner-production-to-south-carolina-11601425533']	[]	4	3	10	[]	[]	https://twitter.com/RepTimmons/status/1311431461283803136	False		0								[]				
1311036141907443712	1311036141907443712	2020-09-29 16:12:28 EDT	2020-09-29	16:12:28	-0400	1079770852302958592	reptimmons	Congressman William Timmons		My parents had not even met yet...	en	[]	[]	[]	134	175	1345	[]	[]	https://twitter.com/RepTimmons/status/1311036141907443712	False	https://twitter.com/Jim_Jordan/status/1311013350554374144	0								[]				
1310903805459005440	1310903805459005440	2020-09-29 07:26:37 EDT	2020-09-29	07:26:37	-0400	1079770852302958592	reptimmons	Congressman William Timmons		I will be joining @joeyhudson on the Morning Answer for another #TuesdayWithTimmons in a few minutes. Listen live on @talk945 FM or  https://t.co/ymabvlrApE.	en	[{'screen_name': 'joeyhudson', 'name': 'joeyhudson', 'id': '14820058'}, {'screen_name': 'talk945', 'name': '94.5 wgtk the answer', 'id': '963572814'}]	['http://player.listenlive.co/56791']	[]	2	3	1	['tuesdaywithtimmons']	[]	https://twitter.com/RepTimmons/status/1310903805459005440	False		0								[]				
1310010389795672065	1310010388499640321	2020-09-26 20:16:30 EDT	2020-09-26	20:16:30	-0400	1079770852302958592	reptimmons	Congressman William Timmons		The President has the right to nominate a new associate justice, and the Senate should confirm her without delay.	en	[]	[]	[]	20	2	11	[]	[]	https://twitter.com/RepTimmons/status/1310010389795672065	False		0								[]				
1310010388499640321	1310010388499640321	2020-09-26 20:16:30 EDT	2020-09-26	20:16:30	-0400	1079770852302958592	reptimmons	Congressman William Timmons		Amy Coney Barrett has dedicated her life to the law as a federal judge, professor, lawyer, clerk, and academic. Her experience and thoughtful jurisprudence will make an excellent addition to the U.S. Supreme Court.	en	[]	[]	[]	23	5	26	[]	[]	https://twitter.com/RepTimmons/status/1310010388499640321	False		0								[]				
1309231788976492545	1309231788036968456	2020-09-24 16:42:37 EDT	2020-09-24	16:42:37	-0400	1079770852302958592	reptimmons	Congressman William Timmons		I was proud to support changes to the calendar and schedule, so we can spend more time legislating and helping our constituents. Read more about our recommendations here:  https://t.co/DZIxHCu3QS	en	[]	['https://timmons.house.gov/media/press-releases/timmons-supports-bipartisan-recommendations-and-final-report-select-committee']	[]	0	1	2	[]	[]	https://twitter.com/RepTimmons/status/1309231788976492545	False		0								[]				
1309231788036968456	1309231788036968456	2020-09-24 16:42:37 EDT	2020-09-24	16:42:37	-0400	1079770852302958592	reptimmons	Congressman William Timmons		Today, @ModernizeCmte passed an additional 40 recommendations, bringing our total to nearly 100 bipartisan recommendations to make Congress more effective, efficient, and transparent!	en	[{'screen_name': 'modernizecmte', 'name': 'select committee on the modernization of congress', 'id': '1105127249852936200'}]	[]	[]	3	10	30	[]	[]	https://twitter.com/RepTimmons/status/1309231788036968456	False		0								[]				
1308879275538485249	1308879275538485249	2020-09-23 17:21:51 EDT	2020-09-23	17:21:51	-0400	1079770852302958592	reptimmons	Congressman William Timmons		Small businesses are the lifeblood of our economy. As the owner of Upstate small businesses, I know they need our support now more than ever. Let’s help them during National Small Business Week by shopping small.  https://t.co/OgvkVqnVzY	en	[]	[]	['https://pbs.twimg.com/media/EioSwn3X0AAe8rh.jpg']	1	5	10	[]	[]	https://twitter.com/RepTimmons/status/1308879275538485249	False		1	https://pbs.twimg.com/media/EioSwn3X0AAe8rh.jpg							[]				
1308591253605543937	1308591172387065857	2020-09-22 22:17:21 EDT	2020-09-22	22:17:21	-0400	1079770852302958592	reptimmons	Congressman William Timmons		Yesterday, the House passed my bill to help ensure a level playing field in the global economy. I am pleased the Promoting Secure 5G Act passed with bipartisan support and that it is one step closer to becoming law!	en	[]	[]	[]	2	3	16	[]	[]	https://twitter.com/RepTimmons/status/1308591253605543937	False		0								[]				
1308591172387065857	1308591172387065857	2020-09-22 22:17:02 EDT	2020-09-22	22:17:02	-0400	1079770852302958592	reptimmons	Congressman William Timmons		5G technology has the power to revolutionize the way we live and transform the global economy. As we prepare for a 5G world, it is important we protect this technology and its infrastructure from malicious actors.  https://t.co/ykvX1EAxSg	en	[]	[]	[]	4	9	17	[]	[]	https://twitter.com/RepTimmons/status/1308591172387065857	False		1	https://pbs.twimg.com/amplify_video_thumb/1308590467630673921/img/ZUOnSrqQtFKZY7ZW.jpg							[]				
1307430957276975105	1307430957276975105	2020-09-19 17:26:45 EDT	2020-09-19	17:26:45	-0400	1079770852302958592	reptimmons	Congressman William Timmons		Happy birthday to my good friend, mentor, and fellow South Carolinian @SenatorTimScott. Sarah and I hope you have a wonderful day!  https://t.co/L6K3Ei5lrC	en	[{'screen_name': 'senatortimscott', 'name': 'tim scott', 'id': '217543151'}]	[]	['https://pbs.twimg.com/media/EiTtgHSWoAYXpzH.jpg']	0	3	36	[]	[]	https://twitter.com/RepTimmons/status/1307430957276975105	False		1	https://pbs.twimg.com/media/EiTtgHSWoAYXpzH.jpg							[]				
1307134914475761665	1307134914475761665	2020-09-18 21:50:23 EDT	2020-09-18	21:50:23	-0400	1079770852302958592	reptimmons	Congressman William Timmons		America lost an icon today. Justice Ginsburg lived an extraordinary life, not only as a jurist but as a trailblazer who forged the path for women in the legal profession and served as a role model for so many others. Sarah and I are praying for her family.	en	[]	[]	[]	1	5	24	[]	[]	https://twitter.com/RepTimmons/status/1307134914475761665	False		0								[]				
1307126083159027718	1307126083159027718	2020-09-18 21:15:18 EDT	2020-09-18	21:15:18	-0400	1079770852302958592	reptimmons	Congressman William Timmons		Happy birthday to the U.S. Air Force! I am proud to serve in the South Carolina Air National Guard with my fellow Airmen. Aim High… Fly-Fight-Win!  https://t.co/W3L9lOkPWY	en	[]	[]	['https://pbs.twimg.com/media/EiPYPj_XsAA4OUp.jpg']	2	2	11	[]	[]	https://twitter.com/RepTimmons/status/1307126083159027718	False		1	https://pbs.twimg.com/media/EiPYPj_XsAA4OUp.jpg							[]				
1306375906538258433	1306375904994697217	2020-09-16 19:34:22 EDT	2020-09-16	19:34:22	-0400	1079770852302958592	reptimmons	Congressman William Timmons		This could create a dangerous situation in our area. Please monitor the latest forecasts and be prepared to take action quickly. Be safe!	en	[]	[]	[]	0	0	3	[]	[]	https://twitter.com/RepTimmons/status/1306375906538258433	False		0								[]				
1306375904994697217	1306375904994697217	2020-09-16 19:34:21 EDT	2020-09-16	19:34:21	-0400	1079770852302958592	reptimmons	Congressman William Timmons		Hurricane Sally is slowly moving inland, bringing heavy rain and potential flooding to the Upstate. A Flash Flood Watch remains in effect for our area from Thursday morning through Friday morning, with the potential for rapid onset flooding based on current forecasts.	en	[]	[]	[]	1	2	4	[]	[]	https://twitter.com/RepTimmons/status/1306375904994697217	False		0								[]				
1306328861827891203	1306328861827891203	2020-09-16 16:27:25 EDT	2020-09-16	16:27:25	-0400	1079770852302958592	reptimmons	Congressman William Timmons		The SC-04 Congressional App Challenge is underway! Interested middle and high school students in the Fourth District should register online and submit their app by October 19th. No coding experience is required. For more information, please visit  https://t.co/VkueKVvwXI. #SC04  https://t.co/QT03J6tuzT	en	[]	['https://www.congressionalappchallenge.us/']	['https://pbs.twimg.com/media/EiEDLRVWsAIiH2E.jpg']	1	3	2	['sc04']	[]	https://twitter.com/RepTimmons/status/1306328861827891203	False		1	https://pbs.twimg.com/media/EiEDLRVWsAIiH2E.jpg							[]				
1305937988959039488	1305937988959039488	2020-09-15 14:34:14 EDT	2020-09-15	14:34:14	-0400	1079770852302958592	reptimmons	Congressman William Timmons		It is a new era for Israeli-Arab relations. With today’s signing of the #AbrahamAccords, the United Arab Emirates and Bahrain will restore diplomatic relations with Israel. This historic agreement, brokered by the President, will promote peace and stability in the Middle East.  https://t.co/FwiLbWQayU	en	[]	[]	['https://pbs.twimg.com/media/Eh-fk7rWsAIqps4.png']	14	26	92	['abrahamaccords']	[]	https://twitter.com/RepTimmons/status/1305937988959039488	False		1	https://pbs.twimg.com/media/Eh-fk7rWsAIqps4.png							[]				
1305612502898798594	1305612502017945600	2020-09-14 17:00:52 EDT	2020-09-14	17:00:52	-0400	1079770852302958592	reptimmons	Congressman William Timmons		Complicit mayors and governors have allowed the increasing violence and anti-police fervor to go on for far too long in our country. Law and order must return to our cities and streets.	en	[]	[]	[]	1	1	3	[]	[]	https://twitter.com/RepTimmons/status/1305612502898798594	False		0								[]				
1305612502017945600	1305612502017945600	2020-09-14 17:00:52 EDT	2020-09-14	17:00:52	-0400	1079770852302958592	reptimmons	Congressman William Timmons		The violence and mob rule in parts of our country took a dark turn this weekend when two LA County sheriff's deputies were shot in an ambush-style attack. Protesters blocked the entrance to the hospital where the two were taken, chanting “we hope they die” and “death to police.”	en	[]	[]	[]	3	0	5	[]	[]	https://twitter.com/RepTimmons/status/1305612502017945600	False		0								[]				
