id	conversation_id	created_at	date	time	timezone	user_id	username	name	place	tweet	language	mentions	urls	photos	replies_count	retweets_count	likes_count	hashtags	cashtags	link	retweet	quote_url	video	thumbnail	near	geo	source	user_rt_id	user_rt	retweet_id	reply_to	retweet_date	translate	trans_src	trans_dest
1397927080474513410	1397927080474513410	2021-05-27 10:46:02 EDT	2021-05-27	10:46:02	-0400	1079770852302958592	reptimmons	Congressman William Timmons		CEO’s were quick to denounce Georgia’s new voting laws, yet when pressed by @SenatorTimScott, could not name anything specific about it that they disagree with.   Perhaps they should read the actual bill instead of jumping on the “woke” bandwagon.	en	[{'screen_name': 'senatortimscott', 'name': 'tim scott', 'id': '217543151'}]	[]	[]	18	54	334	[]	[]	https://twitter.com/RepTimmons/status/1397927080474513410	False	https://twitter.com/senatortimscott/status/1397621319924129793	0								[]				
1397691148630626305	1397691147426873344	2021-05-26 19:08:32 EDT	2021-05-26	19:08:32	-0400	1079770852302958592	reptimmons	Congressman William Timmons		The Ham House will be greatly missed, and we stopped by to honor Tommy Stevenson on his final week in business. Thank you for an incredible 36 years, Tommy! We wish you the best in your retirement.	en	[]	[]	[]	0	0	7	[]	[]	https://twitter.com/RepTimmons/status/1397691148630626305	False		0								[]				
1397691147426873344	1397691147426873344	2021-05-26 19:08:32 EDT	2021-05-26	19:08:32	-0400	1079770852302958592	reptimmons	Congressman William Timmons		Tommy's @CountryHamHouse will close its doors for good on Sunday. The Ham House has been a staple in our community. We are especially grateful to Tommy for letting us set up an unofficial “office” at the restaurant to assist Upstate veterans and widowers in need of assistance.  https://t.co/JtiQftWQd9	en	[{'screen_name': 'countryhamhouse', 'name': 'country ham house', 'id': '3003269349'}]	[]	['https://pbs.twimg.com/media/E2WYeuuWQAYx2jw.jpg']	6	5	25	[]	[]	https://twitter.com/RepTimmons/status/1397691147426873344	False		1	https://pbs.twimg.com/media/E2WYeuuWQAYx2jw.jpg							[]				
1396874092251422720	1396874092251422720	2021-05-24 13:01:50 EDT	2021-05-24	13:01:50	-0400	1079770852302958592	reptimmons	Congressman William Timmons		Please join us for our next Coffee and Conversation event tomorrow, May 25, in Greer. I will be at Mutt’s BBQ at 3:30pm to discuss what I have been working on in Washington and to answer any questions you may have. We hope to see you there!  https://t.co/ZeoqabQCgj	en	[]	[]	['https://pbs.twimg.com/media/E2KxemxXMAANEK2.png']	1	6	8	[]	[]	https://twitter.com/RepTimmons/status/1396874092251422720	False		1	https://pbs.twimg.com/media/E2KxemxXMAANEK2.png							[]				
1395438387394400256	1395438387394400256	2021-05-20 13:56:52 EDT	2021-05-20	13:56:52	-0400	1079770852302958592	reptimmons	Congressman William Timmons		CEOs and corporations once stayed out of party politics, and rightly so. They are now starting to learn that involving themselves in the hot topic of the day might not be so good for their bottom lines.	en	[]	[]	[]	17	3	24	[]	[]	https://twitter.com/RepTimmons/status/1395438387394400256	False	https://twitter.com/WSJ/status/1395436672960106496	0								[]				
1395065852718948360	1395065852718948360	2021-05-19 13:16:33 EDT	2021-05-19	13:16:33	-0400	1079770852302958592	reptimmons	Congressman William Timmons		I am watching this development closely and am very concerned about any potential investor-driven restructuring of @DukeEnergy which could possibly harm South Carolina’s ratepayers and employees.  https://t.co/nRJ4bNzZ7b	en	[{'screen_name': 'dukeenergy', 'name': 'duke energy', 'id': '81192849'}]	['https://www.wsj.com/articles/elliott-urges-duke-energy-to-consider-separation-into-three-companies-11621266008?mod=article_relatedinline']	[]	4	2	5	[]	[]	https://twitter.com/RepTimmons/status/1395065852718948360	False		0								[]				
1395030908986667008	1395030908986667008	2021-05-19 10:57:41 EDT	2021-05-19	10:57:41	-0400	1079770852302958592	reptimmons	Congressman William Timmons		Israel is under attack. America stands with Israel and supports its right to defend itself from terrorism.   A ceasefire can only happen when Hamas stops launching rockets at Israeli citizens.  🇺🇸🇮🇱	en	[]	[]	[]	17	5	28	[]	[]	https://twitter.com/RepTimmons/status/1395030908986667008	False		0								[]				
1394059274876243968	1393715069331152897	2021-05-16 18:36:46 EDT	2021-05-16	18:36:46	-0400	1079770852302958592	reptimmons	Congressman William Timmons		@Wickliffe @JasonCZacher @SCDemocrats The vast majority of the people in SC04 strongly disagree with mandates. I fully support you both masking and getting a vaccination and I also fully support someone who wants to do neither. Happy to meet with you in the coming weeks. Enjoy your Sunday!	en	[]	[]	[]	2	0	1	[]	[]	https://twitter.com/RepTimmons/status/1394059274876243968	False		0								[{'screen_name': 'Wickliffe', 'name': 'Adam Wickliffe', 'id': '14089909'}, {'screen_name': 'JasonCZacher', 'name': 'Jason Zacher', 'id': '39773215'}, {'screen_name': 'SCDemocrats', 'name': 'SC  Democrats', 'id': '930176971'}]				
1394057556620976128	1393715069331152897	2021-05-16 18:29:56 EDT	2021-05-16	18:29:56	-0400	1079770852302958592	reptimmons	Congressman William Timmons		@Wickliffe @JasonCZacher @SCDemocrats Please call the Greer office and we will get a meeting scheduled at your convenience.  https://t.co/jFr9aDfeZm	en	[]	['https://timmons.house.gov']	[]	1	0	1	[]	[]	https://twitter.com/RepTimmons/status/1394057556620976128	False		0								[{'screen_name': 'Wickliffe', 'name': 'Adam Wickliffe', 'id': '14089909'}, {'screen_name': 'JasonCZacher', 'name': 'Jason Zacher', 'id': '39773215'}, {'screen_name': 'SCDemocrats', 'name': 'SC  Democrats', 'id': '930176971'}]				
1394057163417468931	1393715069331152897	2021-05-16 18:28:22 EDT	2021-05-16	18:28:22	-0400	1079770852302958592	reptimmons	Congressman William Timmons		@Wickliffe @JasonCZacher @SCDemocrats Perhaps request a meeting and make a more informed opinion?	en	[]	[]	[]	2	0	1	[]	[]	https://twitter.com/RepTimmons/status/1394057163417468931	False		0								[{'screen_name': 'Wickliffe', 'name': 'Adam Wickliffe', 'id': '14089909'}, {'screen_name': 'JasonCZacher', 'name': 'Jason Zacher', 'id': '39773215'}, {'screen_name': 'SCDemocrats', 'name': 'SC  Democrats', 'id': '930176971'}]				
1393710129409839111	1393710129409839111	2021-05-15 19:29:23 EDT	2021-05-15	19:29:23	-0400	1079770852302958592	reptimmons	Congressman William Timmons		As National Police Week comes to a close, I want to thank all of the men and women in blue. I pledge to never defund the police and to always support the law enforcement officials who keep our families and communities safe. God bless our police officers!  https://t.co/jHX9rabxNC	en	[]	[]	['https://pbs.twimg.com/media/E1dz-JWXsAMEwl-.jpg']	13	4	19	[]	[]	https://twitter.com/RepTimmons/status/1393710129409839111	False		1	https://pbs.twimg.com/media/E1dz-JWXsAMEwl-.jpg							[]				
1393185423770390530	1393185423770390530	2021-05-14 08:44:23 EDT	2021-05-14	08:44:23	-0400	1079770852302958592	reptimmons	Congressman William Timmons		No.	und	[]	[]	[]	48	12	75	[]	[]	https://twitter.com/RepTimmons/status/1393185423770390530	False	https://twitter.com/POTUS/status/1392935847863934987	0								[]				
1393034068904787968	1392899785682821122	2021-05-13 22:42:58 EDT	2021-05-13	22:42:58	-0400	1079770852302958592	reptimmons	Congressman William Timmons		@knightcolumbia That is inaccurate. We only block accounts for violating our social media terms of use per a policy provided our office by the US House. Next time please reach out to the office if you have questions.	en	[]	[]	[]	1	0	0	[]	[]	https://twitter.com/RepTimmons/status/1393034068904787968	False		0								[{'screen_name': 'knightcolumbia', 'name': 'Knight First Amendment Institute', 'id': '835172863502082048'}]				
1392603927292559362	1392603927292559362	2021-05-12 18:13:44 EDT	2021-05-12	18:13:44	-0400	1079770852302958592	reptimmons	Congressman William Timmons		As of this morning, 78% of stations had no gasoline in Greenville and Spartanburg. Congress has ignored cybersecurity for too long, and it is impacting South Carolinians. We must take steps to increase our cybersecurity and protect our critical infrastructure from future attacks.  https://t.co/mr7UvP9ccI	en	[]	[]	[]	14	14	36	[]	[]	https://twitter.com/RepTimmons/status/1392603927292559362	False		1	https://pbs.twimg.com/media/E1OFzOnWQAAmNE6.jpg							[]				
1392264207945637896	1392263722966650881	2021-05-11 19:43:48 EDT	2021-05-11	19:43:48	-0400	1079770852302958592	reptimmons	Congressman William Timmons		Vaccines are available to anyone who chooses to get one. Let’s get back to work.	en	[]	[]	[]	1	0	4	[]	[]	https://twitter.com/RepTimmons/status/1392264207945637896	False		0								[]				
1392264142048878600	1392263722966650881	2021-05-11 19:43:33 EDT	2021-05-11	19:43:33	-0400	1079770852302958592	reptimmons	Congressman William Timmons		The “Biden solution” is to throw more trillions of dollars at this problem, but the real solution is to get people back to work. I applaud Gov. @henrymcmaster's decision to discontinue SC’s participation in the federal unemployment programs recently extended by Democrats.	en	[{'screen_name': 'henrymcmaster', 'name': 'gov. henry mcmaster', 'id': '16335288'}]	[]	[]	2	0	5	[]	[]	https://twitter.com/RepTimmons/status/1392264142048878600	False		0								[]				
1392263724438786053	1392263722966650881	2021-05-11 19:41:53 EDT	2021-05-11	19:41:53	-0400	1079770852302958592	reptimmons	Congressman William Timmons		The federal incentives are causing staffing shortages not just in SC but across the country. Businesses that are able to reopen are having a hard time finding workers. Perhaps obviously, small businesses struggle to compete with the wages the federal government is providing.	en	[]	[]	[]	1	0	1	[]	[]	https://twitter.com/RepTimmons/status/1392263724438786053	False		0								[]				
1392263722966650881	1392263722966650881	2021-05-11 19:41:53 EDT	2021-05-11	19:41:53	-0400	1079770852302958592	reptimmons	Congressman William Timmons		There are nearly 8 million job openings in the United States right now, but the unemployment rate rose in April for the first time during the recovery. Why? Because the government is currently paying people more money to sit at home than to go back to work.	en	[]	[]	[]	15	2	16	[]	[]	https://twitter.com/RepTimmons/status/1392263722966650881	False	https://twitter.com/GreenvilleNews/status/1391724703715414017	0								[]				
1391919304447246336	1391919304447246336	2021-05-10 20:53:17 EDT	2021-05-10	20:53:17	-0400	1079770852302958592	reptimmons	Congressman William Timmons		The rocket attacks from Hamas on Israel are an act of terrorism. Israel has the right to defend its people and its sovereignty. America must stand with our ally, Israel.	en	[]	[]	[]	92	143	551	[]	[]	https://twitter.com/RepTimmons/status/1391919304447246336	False		0								[]				
1391804864439717893	1391804864439717893	2021-05-10 13:18:32 EDT	2021-05-10	13:18:32	-0400	1079770852302958592	reptimmons	Congressman William Timmons		Happening now! #BPCLive	en	[]	[]	[]	1	3	2	['bpclive']	[]	https://twitter.com/RepTimmons/status/1391804864439717893	False	https://twitter.com/BPC_Bipartisan/status/1391755416439250946	0								[]				
1391448386113572867	1391448386113572867	2021-05-09 13:42:01 EDT	2021-05-09	13:42:01	-0400	1079770852302958592	reptimmons	Congressman William Timmons		Today we pay tribute to the strong women whose love and support help guide and shape us throughout our lives. To my mother and to all the moms out there – Happy Mother’s Day!  https://t.co/whsKabCHx6	en	[]	[]	['https://pbs.twimg.com/media/E09q2lIXMAc6dIH.jpg']	1	2	16	[]	[]	https://twitter.com/RepTimmons/status/1391448386113572867	False		1	https://pbs.twimg.com/media/E09q2lIXMAc6dIH.jpg							[]				
1388590375774924801	1388590337208291328	2021-05-01 16:25:19 EDT	2021-05-01	16:25:19	-0400	1079770852302958592	reptimmons	Congressman William Timmons		I want to work with my colleagues on both sides of the aisle to help solve this divide, but tax and spend policies will not fix this problem. We need to fully reopen the economy and get Americans back to work.	en	[]	[]	[]	4	0	9	[]	[]	https://twitter.com/RepTimmons/status/1388590375774924801	False		0								[]				
1388590337208291328	1388590337208291328	2021-05-01 16:25:09 EDT	2021-05-01	16:25:09	-0400	1079770852302958592	reptimmons	Congressman William Timmons		We still have work to do to close the gender and race wealth gaps. Unfortunately, the COVID-19 pandemic only exacerbated these gaps.  https://t.co/u6NFCNpiJQ	en	[]	[]	[]	5	2	8	[]	[]	https://twitter.com/RepTimmons/status/1388590337208291328	False		1	https://pbs.twimg.com/amplify_video_thumb/1388589319833718789/img/75H0T382IrAMdT9Q.jpg							[]				
1388118417618702340	1388118417618702340	2021-04-30 09:09:55 EDT	2021-04-30	09:09:55	-0400	1079770852302958592	reptimmons	Congressman William Timmons		Congratulations to @Trevorlawrencee and @swaggy_t1! First Tigers and now @Jaguars, way to make @ClemsonFB and the Upstate proud!  https://t.co/l8oFdixjmG	en	[{'screen_name': 'trevorlawrencee', 'name': 'trevor lawrence', 'id': '1416537146'}, {'screen_name': 'swaggy_t1', 'name': 'travis etienne jr⁶𓅓', 'id': '2653998533'}, {'screen_name': 'jaguars', 'name': '#duuuval', 'id': '59471027'}, {'screen_name': 'clemsonfb', 'name': 'clemson football', 'id': '1655877529'}]	[]	['https://pbs.twimg.com/media/E0OWV9kWQA43FD4.jpg', 'https://pbs.twimg.com/media/E0OWV9kXIAAwgZu.jpg']	1	4	10	[]	[]	https://twitter.com/RepTimmons/status/1388118417618702340	False		1	https://pbs.twimg.com/media/E0OWV9kWQA43FD4.jpg							[]				
1387783217315565570	1387604994430537728	2021-04-29 10:57:57 EDT	2021-04-29	10:57:57	-0400	1079770852302958592	reptimmons	Congressman William Timmons		Perhaps President Biden will be more willing to engage with his Republican colleagues on meaningful solutions to these problems in his next 100 days than he was during his first 100. I hope for—but am not counting on—a more meaningful effort at bipartisanship going forward.	en	[]	[]	[]	3	1	4	[]	[]	https://twitter.com/RepTimmons/status/1387783217315565570	False		0								[]				
1387613256676777986	1387613256676777986	2021-04-28 23:42:35 EDT	2021-04-28	23:42:35	-0400	1079770852302958592	reptimmons	Congressman William Timmons		Wow, what an incredible speech from @SenatorTimScott. This was the real message of unity, optimism, and hope.   Senator Scott, you knocked it out of the park! Way to make South Carolina proud tonight.	en	[{'screen_name': 'senatortimscott', 'name': 'tim scott', 'id': '217543151'}]	[]	[]	9	2	27	[]	[]	https://twitter.com/RepTimmons/status/1387613256676777986	False		0								[]				
1387604995198042113	1387604994430537728	2021-04-28 23:09:45 EDT	2021-04-28	23:09:45	-0400	1079770852302958592	reptimmons	Congressman William Timmons		It is clear from his speech tonight that both parties share some of the same goals, but we have very different ideas on how we get there.	en	[]	[]	[]	1	4	14	[]	[]	https://twitter.com/RepTimmons/status/1387604995198042113	False		0								[]				
1387604994430537728	1387604994430537728	2021-04-28 23:09:45 EDT	2021-04-28	23:09:45	-0400	1079770852302958592	reptimmons	Congressman William Timmons		President Biden promised to unify the American people and bring us together. Unfortunately, the last 100 days have been marked by partisanship and one-sided policy.	en	[]	[]	[]	8	8	26	[]	[]	https://twitter.com/RepTimmons/status/1387604994430537728	False		0								[]				
1387487667961610242	1387487667961610242	2021-04-28 15:23:32 EDT	2021-04-28	15:23:32	-0400	1079770852302958592	reptimmons	Congressman William Timmons		President Biden preached unity, and instead, we got pure partisanship.   Tonight we will hear from a real unifier—my good friend South Carolina @SenatorTimScott.   Tune in this evening as Senator Scott lays out a better vision for America.    https://t.co/X6XE0XRN8c	en	[{'screen_name': 'senatortimscott', 'name': 'tim scott', 'id': '217543151'}]	['https://www.c-span.org/video/?511326-1/senator-tim-scott-delivers-republican-response']	[]	16	18	186	[]	[]	https://twitter.com/RepTimmons/status/1387487667961610242	False		0								[]				
1387471161135599616	1387471161135599616	2021-04-28 14:17:57 EDT	2021-04-28	14:17:57	-0400	1079770852302958592	reptimmons	Congressman William Timmons		Taiwan is an ally to the United States and has been a reliable partner on global health. We cannot allow the CCP to exclude Taiwan from the upcoming World Health Assembly. #LetTaiwanHelp	en	[]	[]	[]	12	119	408	['lettaiwanhelp']	[]	https://twitter.com/RepTimmons/status/1387471161135599616	False		0								[]				
1387424420315242497	1387424420315242497	2021-04-28 11:12:13 EDT	2021-04-28	11:12:13	-0400	1079770852302958592	reptimmons	Congressman William Timmons		You are invited to our Coffee and Conversation event on May 4 in Greenville. I will be at Levinson Hall at Bob Jones University at 3pm to discuss what I have been working on in Washington and to answer any questions you may have. Hope to see you there!    https://t.co/GfDtUhA5VR	en	[]	['https://www.facebook.com/events/166839652018314']	[]	8	4	6	[]	[]	https://twitter.com/RepTimmons/status/1387424420315242497	False		0								[]				
1386065754819338241	1386065751543631881	2021-04-24 17:13:22 EDT	2021-04-24	17:13:22	-0400	1079770852302958592	reptimmons	Congressman William Timmons		Lastly, I cannot wait to hear @SenatorTimScott’s rebuttal to the President’s Address to Congress this week. The Republican Party has no better spokesman, and I know he will showcase the best of our Party and our Country in his speech!	en	[{'screen_name': 'senatortimscott', 'name': 'tim scott', 'id': '217543151'}]	[]	[]	3	4	19	[]	[]	https://twitter.com/RepTimmons/status/1386065754819338241	False		0								[]				
1386065753930145795	1386065751543631881	2021-04-24 17:13:22 EDT	2021-04-24	17:13:22	-0400	1079770852302958592	reptimmons	Congressman William Timmons		I also want to commend @RepKarenBass for being willing to speak up and tell the truth. Her words are a great example of the civility and respect that are increasingly rare on Capitol Hill these days.	en	[{'screen_name': 'repkarenbass', 'name': 'congressmember bass', 'id': '239949176'}]	[]	[]	2	2	22	[]	[]	https://twitter.com/RepTimmons/status/1386065753930145795	False		0								[]				
1386065753020018760	1386065751543631881	2021-04-24 17:13:22 EDT	2021-04-24	17:13:22	-0400	1079770852302958592	reptimmons	Congressman William Timmons		@SenatorTimScott and his family’s story is inspiring and uniquely American. We are fortunate to have him representing us in the U.S. Senate.	en	[]	[]	[]	2	1	13	[]	[]	https://twitter.com/RepTimmons/status/1386065753020018760	False		0								[]				
1386065751543631881	1386065751543631881	2021-04-24 17:13:21 EDT	2021-04-24	17:13:21	-0400	1079770852302958592	reptimmons	Congressman William Timmons		You will not find a better example of why public trust in the media is so low than this disgusting hit piece from WaPo. The only thing Mr. Kessler and his editors accomplished with this piece is beclowning themselves.	en	[]	[]	[]	10	29	99	[]	[]	https://twitter.com/RepTimmons/status/1386065751543631881	False	https://twitter.com/GlennKesslerWP/status/1385631427753136135	0								[]				
1383085657573183488	1383085656184868864	2021-04-16 11:51:31 EDT	2021-04-16	11:51:31	-0400	1079770852302958592	reptimmons	Congressman William Timmons		We will continue our efforts to defend the integrity of our institutions from the Left’s naked power grabs.	en	[]	[]	[]	5	0	4	[]	[]	https://twitter.com/RepTimmons/status/1383085657573183488	False		0								[]				
1383085656184868864	1383085656184868864	2021-04-16 11:51:31 EDT	2021-04-16	11:51:31	-0400	1079770852302958592	reptimmons	Congressman William Timmons		I agree with 1983 Joe Biden when he said packing the court was a “bonehead idea.”   Now, 2021 Joe Biden has created a commission to “study” expanding the size of the High Court, and Congressional Dems have introduced legislation to add four justices.    https://t.co/G8hwCfogop	en	[]	[]	[]	10	5	15	[]	[]	https://twitter.com/RepTimmons/status/1383085656184868864	False		1	https://pbs.twimg.com/ext_tw_video_thumb/1380592029286113280/pu/img/fbKIrQasAdNJbDsn.jpg							[]				
1382702952553545735	1382702952553545735	2021-04-15 10:30:47 EDT	2021-04-15	10:30:47	-0400	1079770852302958592	reptimmons	Congressman William Timmons		During the 116th, the Modernization Committee held a Member Day Hearing to hear from Representatives on how Congress can work better for the American people.  Today at 12 PM, @ModernizeCmte is back at it again—watch our Member Day Hearing here:   https://t.co/2VmSCveAgc  https://t.co/DRoUfQK8sA	en	[{'screen_name': 'modernizecmte', 'name': 'select committee on the modernization of congress', 'id': '1105127249852936200'}]	['https://www.youtube.com/watch?v=geT0NgSeaVE']	['https://pbs.twimg.com/media/EzBYwCYXEAE8XQh.jpg']	3	7	11	[]	[]	https://twitter.com/RepTimmons/status/1382702952553545735	False		1	https://pbs.twimg.com/media/EzBYwCYXEAE8XQh.jpg							[]				
1382684351046037508	1382684351046037508	2021-04-15 09:16:52 EDT	2021-04-15	09:16:52	-0400	1079770852302958592	reptimmons	Congressman William Timmons		Every American should have access to capital formation and investment. I am proud to join @RepBryanSteil to launch the Investing in Innovation Initiative to promote policies that strengthen capital markets and support a dynamic economy that provides opportunity for all Americans.  https://t.co/fVuExVfHyG	en	[{'screen_name': 'repbryansteil', 'name': 'bryan steil', 'id': '1075205691621720064'}]	[]	['https://pbs.twimg.com/media/EzBIFqNWYAYuse4.jpg']	14	5	20	[]	[]	https://twitter.com/RepTimmons/status/1382684351046037508	False		1	https://pbs.twimg.com/media/EzBIFqNWYAYuse4.jpg							[]				
1382055251918872581	1382055251918872581	2021-04-13 15:37:04 EDT	2021-04-13	15:37:04	-0400	1079770852302958592	reptimmons	Congressman William Timmons		Coming up at 4:45pm, I will be joining @CharlieOnAir on  @1063WORD. Tune in on your radio or listen live here:  https://t.co/aMFwAKBVJN	en	[{'screen_name': 'charlieonair', 'name': 'charlie james 🇺🇸', 'id': '2978150277'}, {'screen_name': '1063word', 'name': '106.3 word', 'id': '161356961'}]	['https://audacy.com/1063word/listen']	[]	3	4	4	[]	[]	https://twitter.com/RepTimmons/status/1382055251918872581	False		0								[]				
1380915123708170240	1380915123708170240	2021-04-10 12:06:36 EDT	2021-04-10	12:06:36	-0400	1079770852302958592	reptimmons	Congressman William Timmons		Please join me in sending prayers to @RepDanCrenshaw for a full and speedy recovery.	en	[{'screen_name': 'repdancrenshaw', 'name': 'rep. dan crenshaw', 'id': '1080894931311431682'}]	[]	[]	2	4	34	[]	[]	https://twitter.com/RepTimmons/status/1380915123708170240	False	https://twitter.com/RepDanCrenshaw/status/1380896286082265089	0								[]				
1380646571260399623	1380646571260399623	2021-04-09 18:19:28 EDT	2021-04-09	18:19:28	-0400	1079770852302958592	reptimmons	Congressman William Timmons		Coming soon to @cityofmauldinsc! We broke ground on BridgeWay Station, a “New Town Center” with apartments, businesses, parks, and a pedestrian bridge. The Upstate is in a great position for growth, and projects like this will help make it a destination for years to come.  https://t.co/2Gi4E0qeud	en	[{'screen_name': 'cityofmauldinsc', 'name': 'city of mauldin', 'id': '293133755'}]	[]	['https://pbs.twimg.com/media/EykKcCjWQAEoC3S.jpg']	5	3	16	[]	[]	https://twitter.com/RepTimmons/status/1380646571260399623	False		1	https://pbs.twimg.com/media/EykKcCjWQAEoC3S.jpg							[]				
1379540251920728067	1379540251920728067	2021-04-06 17:03:21 EDT	2021-04-06	17:03:21	-0400	1079770852302958592	reptimmons	Congressman William Timmons		Coming up at 5:30, I will be joining @CharlieOnAir on @1063WORD. Tune in on your radio or listen live here:  https://t.co/sA6A9LEZLY	en	[{'screen_name': 'charlieonair', 'name': 'charlie james 🇺🇸', 'id': '2978150277'}, {'screen_name': '1063word', 'name': '106.3 word', 'id': '161356961'}]	['https://www.audacy.com/1063word/listen']	[]	4	1	1	[]	[]	https://twitter.com/RepTimmons/status/1379540251920728067	False		0								[]				
1379378850459656199	1379378850459656199	2021-04-06 06:22:00 EDT	2021-04-06	06:22:00	-0400	1079770852302958592	reptimmons	Congressman William Timmons		We are back with @joeyhudson on The Morning Answer around 7:30am. Tune in to @talk945 or listen live here:  https://t.co/mPKQSBuEW1	en	[{'screen_name': 'joeyhudson', 'name': 'joeyhudson', 'id': '14820058'}, {'screen_name': 'talk945', 'name': '94.5 wgtk the answer', 'id': '963572814'}]	['http://945theanswer.com']	[]	6	2	3	[]	[]	https://twitter.com/RepTimmons/status/1379378850459656199	False		0								[]				
1379200762614546435	1379200758948757513	2021-04-05 18:34:20 EDT	2021-04-05	18:34:20	-0400	1079770852302958592	reptimmons	Congressman William Timmons		Perhaps the MLB should stick to what they know: baseball.	en	[]	[]	[]	9	2	13	[]	[]	https://twitter.com/RepTimmons/status/1379200762614546435	False		0								[]				
1379200760118906882	1379200758948757513	2021-04-05 18:34:20 EDT	2021-04-05	18:34:20	-0400	1079770852302958592	reptimmons	Congressman William Timmons		Under the new bill, Georgians will have at least 17 days of early voting. In New York, where the MLB is headquartered, New Yorkers were only given nine days to vote early. This has gone so far that even Democrats disagree with MLB’s decision to pull out of Georgia.	en	[]	[]	[]	6	1	10	[]	[]	https://twitter.com/RepTimmons/status/1379200760118906882	False		0								[]				
