id	conversation_id	created_at	date	time	timezone	user_id	username	name	place	tweet	language	mentions	urls	photos	replies_count	retweets_count	likes_count	hashtags	cashtags	link	retweet	quote_url	video	thumbnail	near	geo	source	user_rt_id	user_rt	retweet_id	reply_to	retweet_date	translate	trans_src	trans_dest
1263500797742063617	1263500797742063617	2020-05-21 12:03:59 EDT	2020-05-21	12:03:59	-0400	1079770852302958592	reptimmons	Congressman William Timmons		I am incredibly saddened to learn that a South Carolina soldier has passed away from a non-combat-related incident. 1st Lt. Trevarius Ravon Bowman from Spartanburg was supporting Operation Freedom's Sentinel in Afghanistan. Please join me in praying for his family and loved ones.	en	[]	[]	[]	2	4	20	[]	[]	https://twitter.com/RepTimmons/status/1263500797742063617	False	https://twitter.com/wyffnews4/status/1263481448344031238	0								[]				
1263216129104908289	1263216129104908289	2020-05-20 17:12:49 EDT	2020-05-20	17:12:49	-0400	1079770852302958592	reptimmons	Congressman William Timmons		At 6:00pm tonight, I will be joined by Lt. Governor @PamelaEvette for a telephone town hall to get your questions answered on COVID-19 and South Carolina’s path forward. We will also have North Carolina Congressman @RepGregMurphy with us. To join us, call 844-227-7556.	en	[{'screen_name': 'pamelaevette', 'name': 'pamela evette', 'id': '373350646'}, {'screen_name': 'repgregmurphy', 'name': 'congressman greg murphy, m.d.', 'id': '1173978070535024642'}]	[]	[]	2	2	3	[]	[]	https://twitter.com/RepTimmons/status/1263216129104908289	False		0								[]				
1263146885814124545	1263146885814124545	2020-05-20 12:37:40 EDT	2020-05-20	12:37:40	-0400	1079770852302958592	reptimmons	Congressman William Timmons		We have taken judicious steps to manage the COVID-19 crisis, but now is the time to adapt and move forward. Read more on our pathway to a new normal in @GreenvilleNews:  https://t.co/ilKc2sFLiH	en	[{'screen_name': 'greenvillenews', 'name': 'the greenville news', 'id': '16007481'}]	['https://www.greenvilleonline.com/story/opinion/2020/05/17/opinion-its-time-move-forward-path-new-normal-after-coronavirus-william-timmons-donald-trump/5182148002/']	[]	1	2	5	[]	[]	https://twitter.com/RepTimmons/status/1263146885814124545	False		0								[]				
1262781974315503618	1262781974315503618	2020-05-19 12:27:38 EDT	2020-05-19	12:27:38	-0400	1079770852302958592	reptimmons	Congressman William Timmons		Tonight, State Senator Tom Corbin and I will be hosting a telephone town hall to answer your questions on COVID-19, South Carolina’s path forward, and more. Join us at 6:30pm tonight by calling 844-407-0271. We look forward to hearing from you!	en	[]	[]	[]	1	1	8	[]	[]	https://twitter.com/RepTimmons/status/1262781974315503618	False		0								[]				
1262496478255292416	1262496478255292416	2020-05-18 17:33:11 EDT	2020-05-18	17:33:11	-0400	1079770852302958592	reptimmons	Congressman William Timmons		.@SBAgov and @USTreasury have released the application for borrowers to apply for forgiveness of their PPP loans. Applications must be submitted to your lender. Access the application and instructions here →  https://t.co/4tR6TmWCQL	en	[{'screen_name': 'sbagov', 'name': 'sba', 'id': '153149305'}, {'screen_name': 'ustreasury', 'name': 'treasury department', 'id': '120176950'}]	['https://home.treasury.gov/news/press-releases/sm1010']	[]	0	3	4	[]	[]	https://twitter.com/RepTimmons/status/1262496478255292416	False		0								[]				
1261811044495904771	1261811044495904771	2020-05-16 20:09:30 EDT	2020-05-16	20:09:30	-0400	1079770852302958592	reptimmons	Congressman William Timmons		As National Police Week comes to a close, I want to take a moment to say thank you to the men and women in law enforcement who keep us and our communities safe. It is not an easy job, but we are grateful for everything you do.  https://t.co/ElSLoSURmT	en	[]	[]	['https://pbs.twimg.com/media/EYLacg5WAAc_zjt.jpg']	0	3	7	[]	[]	https://twitter.com/RepTimmons/status/1261811044495904771	False		1	https://pbs.twimg.com/media/EYLacg5WAAc_zjt.jpg							[]				
1261775626312261632	1261775626312261632	2020-05-16 17:48:46 EDT	2020-05-16	17:48:46	-0400	1079770852302958592	reptimmons	Congressman William Timmons		On #ArmedForcesDay, we honor the brave men and women who serve our nation. Thank you to our troops here at home and abroad!  https://t.co/uuXZdqvm7v	en	[]	[]	['https://pbs.twimg.com/media/EYK6PkxWAAQ8idR.jpg']	1	2	8	['armedforcesday']	[]	https://twitter.com/RepTimmons/status/1261775626312261632	False		1	https://pbs.twimg.com/media/EYK6PkxWAAQ8idR.jpg							[]				
1261469345240084481	1261469343008919557	2020-05-15 21:31:43 EDT	2020-05-15	21:31:43	-0400	1079770852302958592	reptimmons	Congressman William Timmons		It is our responsibility to do everything we can to get millions of people and businesses back on their feet and restore our previously booming economy, and unfortunately, nothing we did today made any progress towards fulfilling that obligation.	en	[]	[]	[]	7	0	9	[]	[]	https://twitter.com/RepTimmons/status/1261469345240084481	False		0								[]				
1261469343902085120	1261469343008919557	2020-05-15 21:31:43 EDT	2020-05-15	21:31:43	-0400	1079770852302958592	reptimmons	Congressman William Timmons		Today’s bill will never become law, or even brought to the Senate floor, and voting on it sends the wrong message to the American people. Congress has the responsibility to take serious problems seriously. We need to approach relief legislation in a thoughtful, bipartisan way.	en	[]	[]	[]	2	0	10	[]	[]	https://twitter.com/RepTimmons/status/1261469343902085120	False		0								[]				
1261469343008919557	1261469343008919557	2020-05-15 21:31:42 EDT	2020-05-15	21:31:42	-0400	1079770852302958592	reptimmons	Congressman William Timmons		With over 33 million Americans and 12.5% of South Carolinians currently unemployed, Speaker Pelosi brought members of Congress to Washington not to safely restart our economy or get us back to work, but to vote on a political messaging bill.	en	[]	[]	[]	10	4	13	[]	[]	https://twitter.com/RepTimmons/status/1261469343008919557	False		0								[]				
1261450469794168832	1261450469794168832	2020-05-15 20:16:43 EDT	2020-05-15	20:16:43	-0400	1079770852302958592	reptimmons	Congressman William Timmons		The House voted to upend 200+ years of precedent and allow proxy voting. These new rules allow 22 people to pass legislation that impacts the entire country. We should be working to get people and businesses back on their feet, not hiding at home and legislating from our phones.	en	[]	[]	[]	18	5	14	[]	[]	https://twitter.com/RepTimmons/status/1261450469794168832	False		0								[]				
1261052386195488768	1261052386195488768	2020-05-14 17:54:52 EDT	2020-05-14	17:54:52	-0400	1079770852302958592	reptimmons	Congressman William Timmons		Two years ago today, President @realDonaldTrump moved the U.S. embassy in Israel to Jerusalem, keeping our nation’s promise to the Jewish people and one of our strongest allies. 🇺🇸🇮🇱  https://t.co/nP9FrzK8wF	en	[{'screen_name': 'realdonaldtrump', 'name': 'donald j. trump', 'id': '25073877'}]	[]	['https://pbs.twimg.com/media/EYAodd0WsAYKH1p.jpg']	1	2	11	[]	[]	https://twitter.com/RepTimmons/status/1261052386195488768	False		1	https://pbs.twimg.com/media/EYAodd0WsAYKH1p.jpg							[]				
1261028015481466881	1261028015481466881	2020-05-14 16:18:02 EDT	2020-05-14	16:18:02	-0400	1079770852302958592	reptimmons	Congressman William Timmons		Essential workers have done their jobs throughout this pandemic, yet Speaker Pelosi is proposing members of Congress remain at home to VOTE. The Senate was able to reconvene, but apparently the House cannot.  Not only is this wrong, it would overturn 200 years of precedent.	en	[]	[]	[]	63	54	200	[]	[]	https://twitter.com/RepTimmons/status/1261028015481466881	False		0								[]				
1261007737875566593	1261007737875566593	2020-05-14 14:57:27 EDT	2020-05-14	14:57:27	-0400	1079770852302958592	reptimmons	Congressman William Timmons		Congratulations, @BJALions Class of 2020!	en	[{'screen_name': 'bjalions', 'name': 'bob jones academy', 'id': '2752937024'}]	[]	[]	0	1	3	[]	[]	https://twitter.com/RepTimmons/status/1261007737875566593	False	https://twitter.com/BJALions/status/1260932884434612229	0								[]				
1260707464812642312	1260707464812642312	2020-05-13 19:04:17 EDT	2020-05-13	19:04:17	-0400	1079770852302958592	reptimmons	Congressman William Timmons		Hey @elonmusk, we see you are ready to move @Tesla headquarters and programs out of California. May we suggest South Carolina instead? We are a business-friendly state with large-scale automotive manufacturing already taking place. Let us know if you would like to discuss.  https://t.co/ly35ovHtcO	en	[{'screen_name': 'elonmusk', 'name': 'elon musk', 'id': '44196397'}, {'screen_name': 'tesla', 'name': 'tesla', 'id': '13298072'}]	[]	['https://pbs.twimg.com/media/EX7uwV-WkAAXKel.jpg', 'https://pbs.twimg.com/media/EX7uwV_WAAI9V4s.jpg']	17	19	74	[]	[]	https://twitter.com/RepTimmons/status/1260707464812642312	False	https://twitter.com/elonmusk/status/1259162367285317633	1	https://pbs.twimg.com/media/EX7uwV-WkAAXKel.jpg							[]				
1260650086628917249	1260650086628917249	2020-05-13 15:16:17 EDT	2020-05-13	15:16:17	-0400	1079770852302958592	reptimmons	Congressman William Timmons		Great news for Greenville! @FirstSolar, the largest solar manufacturer in the nation, has chosen Greenville for its new 450,000-square-foot distribution hub. This is their first hub in the Southeast, and it will benefit from access to Inland Port Greer and the Port of Charleston.	en	[{'screen_name': 'firstsolar', 'name': 'first solar', 'id': '185718976'}]	[]	[]	2	6	33	[]	[]	https://twitter.com/RepTimmons/status/1260650086628917249	False	https://twitter.com/SCPorts/status/1260619686531805186	0								[]				
1260382281572769793	1260382281572769793	2020-05-12 21:32:07 EDT	2020-05-12	21:32:07	-0400	1079770852302958592	reptimmons	Congressman William Timmons		Turns out Democrats do not even like their own party’s bill as I am hearing Speaker Pelosi does not have the votes right now to pass her liberal wishlist. I wonder if we will even vote this week... Stay tuned.	en	[]	[]	[]	17	29	182	[]	[]	https://twitter.com/RepTimmons/status/1260382281572769793	False		0								[]				
1260284034766327809	1260284034766327809	2020-05-12 15:01:43 EDT	2020-05-12	15:01:43	-0400	1079770852302958592	reptimmons	Congressman William Timmons		Speaker Pelosi just released an 1,800+ page bill that Democrats drafted behind closed doors without input from Republicans or relevant committees and with members of Congress not even present in Washington.  Enough is enough. Congress needs to get back to work.	en	[]	[]	[]	126	190	581	[]	[]	https://twitter.com/RepTimmons/status/1260284034766327809	False		0								[]				
1259558887054852097	1259558887054852097	2020-05-10 15:00:14 EDT	2020-05-10	15:00:14	-0400	1079770852302958592	reptimmons	Congressman William Timmons		Happy Mother's Day to my wonderful mother! I hope you know how much you are loved each and every day. Wising all the moms out there a blessed Mother’s Day!  https://t.co/zPzSsZXl58	en	[]	[]	['https://pbs.twimg.com/media/EXraIHwXsAMjmwM.jpg']	0	1	22	[]	[]	https://twitter.com/RepTimmons/status/1259558887054852097	False		1	https://pbs.twimg.com/media/EXraIHwXsAMjmwM.jpg							[]				
1258822199575797769	1258822199575797769	2020-05-08 14:12:54 EDT	2020-05-08	14:12:54	-0400	1079770852302958592	reptimmons	Congressman William Timmons		I joined @RepArmstrongND and @SteveScalise in writing to @TheJusticeDept to oppose nationwide injunctions by district judges. In the case of NWP 12, tens of thousands of projects for drinking water, cable, utilities, and more will be unnecessarily delayed.	en	[{'screen_name': 'reparmstrongnd', 'name': 'congressman kelly armstrong', 'id': '1080515866255593472'}, {'screen_name': 'stevescalise', 'name': 'steve scalise', 'id': '1209417007'}, {'screen_name': 'thejusticedept', 'name': 'justice department', 'id': '73181712'}]	[]	[]	3	7	18	[]	[]	https://twitter.com/RepTimmons/status/1258822199575797769	False	https://twitter.com/RepArmstrongND/status/1258758521425989635	0								[]				
1258497957034430464	1258497957034430464	2020-05-07 16:44:29 EDT	2020-05-07	16:44:29	-0400	1079770852302958592	reptimmons	Congressman William Timmons		President @realDonaldTrump has declared today a National Day of Prayer. Today we come together to pray for everyone who has lost friends or loved ones from COVID-19, our health care workers and first responders, and strength as we recover from this pandemic.	en	[{'screen_name': 'realdonaldtrump', 'name': 'donald j. trump', 'id': '25073877'}]	[]	[]	2	2	7	[]	[]	https://twitter.com/RepTimmons/status/1258497957034430464	False		0								[]				
1258180020238979072	1258180020238979072	2020-05-06 19:41:07 EDT	2020-05-06	19:41:07	-0400	1079770852302958592	reptimmons	Congressman William Timmons		Thanks to President @realDonaldTrump and his administration, the U.S. is performing millions of more tests than other countries. Our increased testing capacity is critical as we reopen the economy and continue to fight #COVID19.  https://t.co/1gOTDhWsfk	en	[{'screen_name': 'realdonaldtrump', 'name': 'donald j. trump', 'id': '25073877'}]	[]	['https://pbs.twimg.com/media/EXX0AauVcAAotGN.jpg']	3	1	4	['covid19']	[]	https://twitter.com/RepTimmons/status/1258180020238979072	False		1	https://pbs.twimg.com/media/EXX0AauVcAAotGN.jpg							[]				
1258165369690296322	1258165369690296322	2020-05-06 18:42:54 EDT	2020-05-06	18:42:54	-0400	1079770852302958592	reptimmons	Congressman William Timmons		Small banks and community lenders—including those here in South Carolina—have stepped up to the plate to ensure small businesses across the country are able to participate in the Paycheck Protection Program.  https://t.co/No3iu8oelO	en	[]	['https://www.wsj.com/articles/small-businesses-were-at-a-breaking-point-small-banks-came-to-the-rescue-11588590013']	[]	0	1	3	[]	[]	https://twitter.com/RepTimmons/status/1258165369690296322	False		0								[]				
1258108704559370240	1258108704559370240	2020-05-06 14:57:44 EDT	2020-05-06	14:57:44	-0400	1079770852302958592	reptimmons	Congressman William Timmons		.@RepRatcliffe has a strong record of upholding and enforcing the law. He will serve our nation well as the next Director of National Intelligence. I look forward to his swift confirmation by the Senate.	en	[]	[]	[]	3	2	8	[]	[]	https://twitter.com/RepTimmons/status/1258108704559370240	False		0								[]				
1258098394100387841	1258098394100387841	2020-05-06 14:16:46 EDT	2020-05-06	14:16:46	-0400	1079770852302958592	reptimmons	Congressman William Timmons		On #NationalNursesDay, we want to say thank you to the nurses on the frontlines caring for our loved ones during this pandemic. We are grateful for each and every one of you. During Nurses Appreciation Week, please join us in saying #ThankYouNurses!  https://t.co/0tO78wgA9M	en	[]	[]	['https://pbs.twimg.com/media/EXWp0XaUwAEltc-.jpg']	2	3	10	['nationalnursesday', 'thankyounurses']	[]	https://twitter.com/RepTimmons/status/1258098394100387841	False		1	https://pbs.twimg.com/media/EXWp0XaUwAEltc-.jpg							[]				
1257785753209274368	1257785753209274368	2020-05-05 17:34:26 EDT	2020-05-05	17:34:26	-0400	1079770852302958592	reptimmons	Congressman William Timmons		State Senator @scottftalley and I will be hosting a telephone town hall at 6pm tonight. Join us by calling 844-227-7559. We look forward to hearing from you!	en	[{'screen_name': 'scottftalley', 'name': 'scott talley', 'id': '970280989'}]	[]	[]	0	1	2	[]	[]	https://twitter.com/RepTimmons/status/1257785753209274368	False	https://twitter.com/RepTimmons/status/1257717354030673924	0								[]				
1257717354030673924	1257717354030673924	2020-05-05 13:02:39 EDT	2020-05-05	13:02:39	-0400	1079770852302958592	reptimmons	Congressman William Timmons		Tonight, @scottftalley and I will be hosting a telephone town hall to answer your questions on COVID-19, small business issues, South Carolina’s path forward, and more. Join us at 6pm tonight by calling 844-227-7559. We look forward to hearing from you!	en	[{'screen_name': 'scottftalley', 'name': 'scott talley', 'id': '970280989'}]	[]	[]	1	0	10	[]	[]	https://twitter.com/RepTimmons/status/1257717354030673924	False		0								[]				
1257459726159405058	1257459726159405058	2020-05-04 19:58:55 EDT	2020-05-04	19:58:55	-0400	1079770852302958592	reptimmons	Congressman William Timmons		Firefighters dedicate their lives to protecting our safety. Thank you to these brave men and women who run towards danger to keep us safe. #InternationalFirefightersDay  https://t.co/9C7SSmuu9D	en	[]	[]	['https://pbs.twimg.com/media/EXNk7xBWkAAkWSA.jpg']	0	2	8	['internationalfirefightersday']	[]	https://twitter.com/RepTimmons/status/1257459726159405058	False		1	https://pbs.twimg.com/media/EXNk7xBWkAAkWSA.jpg							[]				
1256988828667195404	1256988828667195404	2020-05-03 12:47:45 EDT	2020-05-03	12:47:45	-0400	1079770852302958592	reptimmons	Congressman William Timmons		Governor @henrymcmaster has declared today a statewide day of prayer. I pray for those who have lost loved ones from this virus, our frontline workers who work tirelessly each day, and for our state as we recover from this pandemic. Through Him, may we emerge stronger than ever.	en	[{'screen_name': 'henrymcmaster', 'name': 'gov. henry mcmaster', 'id': '16335288'}]	[]	[]	4	3	17	[]	[]	https://twitter.com/RepTimmons/status/1256988828667195404	False		0								[]				
1256688233087369218	1256688233087369218	2020-05-02 16:53:17 EDT	2020-05-02	16:53:17	-0400	1079770852302958592	reptimmons	Congressman William Timmons		Convalescent blood plasma has helped a South Carolina woman recover from COVID-19. Donations from patients who have recovered from COVID-19 will be critical as we open the economy back up again. It will help us save lives and livelihoods at the same time.  https://t.co/9do1SM5kp4	en	[]	['https://www.greenvilleonline.com/story/news/2020/04/30/sc-woman-recovers-covid-19-help-plasma/3055093001/?utm_source=greenvilleonline-News%20Alert&utm_medium=email&utm_campaign=news_alerts&utm_term=news_alert']	[]	1	2	5	[]	[]	https://twitter.com/RepTimmons/status/1256688233087369218	False		0								[]				
1256241706309206017	1256241706309206017	2020-05-01 11:18:57 EDT	2020-05-01	11:18:57	-0400	1079770852302958592	reptimmons	Congressman William Timmons		Thank you to our health care heroes at @BonSecours and across South Carolina for saving lives and helping us get back to work safely! We are grateful for each and every one of you. #MyHeroesWearScrubs  https://t.co/yRTO28NE8U	en	[{'screen_name': 'bonsecours', 'name': 'bon secours', 'id': '19980909'}]	[]	['https://pbs.twimg.com/media/EW8RGzmWAAEIZdx.jpg']	1	2	8	['myheroeswearscrubs']	[]	https://twitter.com/RepTimmons/status/1256241706309206017	False		1	https://pbs.twimg.com/media/EW8RGzmWAAEIZdx.jpg							[]				
1256035607580758017	1256035607580758017	2020-04-30 21:39:59 EDT	2020-04-30	21:39:59	-0400	1079770852302958592	reptimmons	Congressman William Timmons		Hey @elonmusk! We heard you are having some issues in California. South Carolina is a business-friendly state with the workforce and infrastructure already in place for large-scale automotive manufacturing. Let us know–we have great opportunities in #SC04.  https://t.co/eZD81FrV5O	en	[{'screen_name': 'elonmusk', 'name': 'elon musk', 'id': '44196397'}]	['https://www.cbsnews.com/news/elon-musk-meltdown-fascist-social-distancing-tesla-production/']	[]	45	5	33	['sc04']	[]	https://twitter.com/RepTimmons/status/1256035607580758017	False		0								[]				
1255997541260431360	1255997541260431360	2020-04-30 19:08:43 EDT	2020-04-30	19:08:43	-0400	1079770852302958592	reptimmons	Congressman William Timmons		.@ghs_org has a launched an online, interactive COVID-19 symptom checker. It is free and available to everyone—not just Prisma Health patients. Chat about your symptoms of COVID-19 online at  https://t.co/74vNFPStnk or by texting “COVID19” to 83973.	en	[]	['https://www.prismahealth.org/coronavirus/']	[]	0	1	1	[]	[]	https://twitter.com/RepTimmons/status/1255997541260431360	False		0								[]				
1255222115546079233	1255222115546079233	2020-04-28 15:47:27 EDT	2020-04-28	15:47:27	-0400	1079770852302958592	reptimmons	Congressman William Timmons		Rapid testing for COVID-19 is coming to #SC04. @scdhec is deploying rapid testing devices and supplies to Bon Secours Health System in Greenville and Spartanburg Regional Healthcare. The Abbott ID NOW COVID-19 rapid-response test can provide results in just 15-20 minutes.	en	[{'screen_name': 'scdhec', 'name': 'scdhec', 'id': '209599290'}]	[]	[]	3	4	17	['sc04']	[]	https://twitter.com/RepTimmons/status/1255222115546079233	False		0								[]				
1255097014079172610	1255097014079172610	2020-04-28 07:30:21 EDT	2020-04-28	07:30:21	-0400	1079770852302958592	reptimmons	Congressman William Timmons		I will be joining @joeyhudson on The Morning Answer at 7:30am to discuss the latest on #PPP and bringing our supply chains back to the U.S. Tune in to @talk945 or listen live here:  https://t.co/ymabvlrApE	en	[{'screen_name': 'joeyhudson', 'name': 'joeyhudson', 'id': '14820058'}, {'screen_name': 'talk945', 'name': '94.5 wgtk the answer', 'id': '963572814'}]	['http://player.listenlive.co/56791']	[]	0	1	2	['ppp']	[]	https://twitter.com/RepTimmons/status/1255097014079172610	False		0								[]				
1254839853390405634	1254839853390405634	2020-04-27 14:28:29 EDT	2020-04-27	14:28:29	-0400	1079770852302958592	reptimmons	Congressman William Timmons		My office received word late last week that Donaldson Field Airport in Greenville will be receiving a $2.75 million grant from the @USDOT. This grant will be used to rehabilitate the taxiway and allow Donaldson Field and @SCTAC to continue to be a leader in our state.	en	[{'screen_name': 'usdot', 'name': 'transportationgov', 'id': '393562221'}, {'screen_name': 'sctac', 'name': 'sctac', 'id': '62591152'}]	[]	[]	1	1	12	[]	[]	https://twitter.com/RepTimmons/status/1254839853390405634	False		0								[]				
1254454464020393984	1254454464020393984	2020-04-26 12:57:05 EDT	2020-04-26	12:57:05	-0400	1079770852302958592	reptimmons	Congressman William Timmons		Today we welcomed @Boeing and @AtlasAirWW to @GSPairport with a shipment of 1.5 million face masks for our health care workers at @ghs_org. @Boeing generously donated a Dreamlifter aircraft to make the delivery for our doctors, nurses, and medical staff who are fighting COVID-19.  https://t.co/CFyYEjxwc8	en	[{'screen_name': 'boeing', 'name': 'the boeing company', 'id': '25103967'}, {'screen_name': 'atlasairww', 'name': 'atlas air worldwide', 'id': '582276522'}, {'screen_name': 'gspairport', 'name': 'gsp airport', 'id': '170032330'}, {'screen_name': 'boeing', 'name': 'the boeing company', 'id': '25103967'}]	[]	['https://pbs.twimg.com/media/EWi3ci-XgAEpq-f.jpg', 'https://pbs.twimg.com/media/EWi3ci-XYAEp15R.jpg', 'https://pbs.twimg.com/media/EWi3ci9WkAID9rd.jpg', 'https://pbs.twimg.com/media/EWi3cjCXYAAd_2W.jpg']	7	24	96	[]	[]	https://twitter.com/RepTimmons/status/1254454464020393984	False		1	https://pbs.twimg.com/media/EWi3ci-XgAEpq-f.jpg							[]				
1253789803138727936	1253789803138727936	2020-04-24 16:55:58 EDT	2020-04-24	16:55:58	-0400	1079770852302958592	reptimmons	Congressman William Timmons		Pandemic Unemployment Assistance is now available from @SCDEWinfo. If you were found ineligible for state benefits, you should have received an email from SCDEW. Here is how to apply:  https://t.co/dh4tzc21Hc	en	[{'screen_name': 'scdewinfo', 'name': 'scdew', 'id': '269862240'}]	['https://dew.sc.gov/docs/default-source/default-document-library/pua-claim-pdf-tutorial.pdf?sfvrsn=cd7de3eb_0']	[]	2	1	0	[]	[]	https://twitter.com/RepTimmons/status/1253789803138727936	False		0								[]				
1253710635520667655	1253710635520667655	2020-04-24 11:41:22 EDT	2020-04-24	11:41:22	-0400	1079770852302958592	reptimmons	Congressman William Timmons		Thank you to @UPS for providing All About Change in Greenville with grant funding. This grant will allow All About Change to purchase laptops and computer equipment to continue providing services to at-risk youth in the Upstate during the COVID-19 pandemic.	en	[{'screen_name': 'ups', 'name': 'ups', 'id': '158129535'}]	[]	[]	2	3	20	[]	[]	https://twitter.com/RepTimmons/status/1253710635520667655	False		0								[]				
1253454982990487552	1253454982990487552	2020-04-23 18:45:30 EDT	2020-04-23	18:45:30	-0400	1079770852302958592	reptimmons	Congressman William Timmons		The Paycheck Protection Program has been a lifeline for America’s small businesses and workers. I am disappointed it took Congress over two weeks to pass this legislation, but more relief for small businesses is finally on the way. Read my full statement⬇️  https://t.co/MbC7cYKKXi	en	[]	['https://timmons.house.gov/media/press-releases/timmons-statement-additional-funding-coronavirus-relief']	[]	3	4	3	[]	[]	https://twitter.com/RepTimmons/status/1253454982990487552	False		0								[]				
1253424455033864193	1253424455033864193	2020-04-23 16:44:12 EDT	2020-04-23	16:44:12	-0400	1079770852302958592	reptimmons	Congressman William Timmons		Anyone who needs Unemployment Insurance should get it, but an unintended consequence of expanding UI benefits is that some workers make more by not working. Reopening businesses cannot compete. @LindseyGrahamSC and @SenatorTimScott called this weeks ago.  https://t.co/QKLLF4nVUl	en	[{'screen_name': 'lindseygrahamsc', 'name': 'lindsey graham', 'id': '432895323'}, {'screen_name': 'senatortimscott', 'name': 'tim scott', 'id': '217543151'}]	['https://www.wsj.com/articles/paying-americans-not-to-work-11587597150?mod=hp_opin_pos_3']	[]	13	3	10	[]	[]	https://twitter.com/RepTimmons/status/1253424455033864193	False		0								[]				
