id	conversation_id	created_at	date	time	timezone	user_id	username	name	place	tweet	language	mentions	urls	photos	replies_count	retweets_count	likes_count	hashtags	cashtags	link	retweet	quote_url	video	thumbnail	near	geo	source	user_rt_id	user_rt	retweet_id	reply_to	retweet_date	translate	trans_src	trans_dest
1230893096415760384	1230893096415760384	2020-02-21 11:32:37 EST	2020-02-21	11:32:37	-0400	1079770852302958592	reptimmons	Congressman William Timmons		Great event this morning in Cowpens with @RepRalphNorman. Next up: the Grapevine Restaurant in Boiling Springs. Look forward to seeing you there!  https://t.co/NiKkpr7AhX	en	[{'screen_name': 'repralphnorman', 'name': 'rep. ralph norman', 'id': '880480631108644864'}]	[]	['https://pbs.twimg.com/media/ERUCvy6X0AIEv3D.png']	1	1	6	[]	[]	https://twitter.com/RepTimmons/status/1230893096415760384	False		1	https://pbs.twimg.com/media/ERUCvy6X0AIEv3D.png							[]				
1230876577191387140	1230595509024428032	2020-02-21 10:26:59 EST	2020-02-21	10:26:59	-0400	1079770852302958592	reptimmons	Congressman William Timmons		@ColieWhitaker @CFATS @NACD_RD Thank you for having me!	en	[]	[]	[]	0	0	0	[]	[]	https://twitter.com/RepTimmons/status/1230876577191387140	False		0								[{'screen_name': 'ColieWhitaker', 'name': 'Colie Whitaker', 'id': '2256950706'}, {'screen_name': 'CFATS', 'name': 'Chemical Security', 'id': '46692927'}, {'screen_name': 'NACD_RD', 'name': 'NACD', 'id': '92570028'}]				
1230611635225661440	1230611635225661440	2020-02-20 16:54:12 EST	2020-02-20	16:54:12	-0400	1079770852302958592	reptimmons	Congressman William Timmons		I enjoyed spending time at Whitaker Oil this week in Spartanburg, learning more about what they do and their legislative priorities. Thank you for taking the time to host me!  https://t.co/pgZuqlBuFy	en	[]	[]	['https://pbs.twimg.com/media/ERQCurcXYAAJSvO.jpg', 'https://pbs.twimg.com/media/ERQCuriW4AEGr9z.jpg', 'https://pbs.twimg.com/media/ERQCurUWkAAViD_.jpg']	0	2	8	[]	[]	https://twitter.com/RepTimmons/status/1230611635225661440	False		1	https://pbs.twimg.com/media/ERQCurcXYAAJSvO.jpg							[]				
1230551658670764032	1230551658670764032	2020-02-20 12:55:52 EST	2020-02-20	12:55:52	-0400	1079770852302958592	reptimmons	Congressman William Timmons		Thank you everyone for coming out to my second Coffee and Conversation series today in Travelers Rest and at North Greenville University, despite the sleet and the snow in the Upstate! I enjoyed our conversations, and we are looking forward to tomorrow.  https://t.co/tb9WpPfMLa	en	[]	[]	['https://pbs.twimg.com/media/ERPMNVwWsAAwuth.jpg', 'https://pbs.twimg.com/media/ERPMNVuXkAcQ_Vz.jpg', 'https://pbs.twimg.com/media/ERPMNVuXkAA3RqA.jpg', 'https://pbs.twimg.com/media/ERPMNVvXUAAESPs.jpg']	0	3	9	[]	[]	https://twitter.com/RepTimmons/status/1230551658670764032	False		1	https://pbs.twimg.com/media/ERPMNVwWsAAwuth.jpg							[]				
1230512514309480449	1230512514309480449	2020-02-20 10:20:19 EST	2020-02-20	10:20:19	-0400	1079770852302958592	reptimmons	Congressman William Timmons		Great crowd and conversation at the Travelers Restaurant in TR. Looking forward to our next stop, @ngucrusaders. See you there!	en	[]	[]	[]	1	1	4	[]	[]	https://twitter.com/RepTimmons/status/1230512514309480449	False		0								[]				
1230239565526511626	1230239565526511626	2020-02-19 16:15:43 EST	2020-02-19	16:15:43	-0400	1079770852302958592	reptimmons	Congressman William Timmons		I am looking forward to beginning our second Coffee and Conversation series events tomorrow morning in TR and at @ngucrusaders. You can register for both events below. I hope to see you there!   https://t.co/ZjBuTIQd8N  https://t.co/EXVAH37Oja  https://t.co/1cZU8h6aeP	en	[]	['https://www.facebook.com/events/128246448505897/', 'https://www.facebook.com/events/812560959156133/']	['https://pbs.twimg.com/media/ERKwXTsW4AEQrKG.png']	0	2	4	[]	[]	https://twitter.com/RepTimmons/status/1230239565526511626	False		1	https://pbs.twimg.com/media/ERKwXTsW4AEQrKG.png							[]				
1230178062970630151	1230178062970630151	2020-02-19 12:11:20 EST	2020-02-19	12:11:20	-0400	1079770852302958592	reptimmons	Congressman William Timmons		I had a great time speaking with so many people at last night’s Business and Brews event in Greenville and thoroughly enjoyed the conversation we had. Thank you for having me!  https://t.co/IVBRD0FFH1	en	[]	[]	['https://pbs.twimg.com/media/ERJ4bOrWAAE09Gj.jpg', 'https://pbs.twimg.com/media/ERJ4bOsW4AEpExO.jpg', 'https://pbs.twimg.com/media/ERJ4bOsWAAE2k-z.jpg']	0	1	8	[]	[]	https://twitter.com/RepTimmons/status/1230178062970630151	False		1	https://pbs.twimg.com/media/ERJ4bOrWAAE09Gj.jpg							[]				
1229851862007975936	1229851862007975936	2020-02-18 14:35:08 EST	2020-02-18	14:35:08	-0400	1079770852302958592	reptimmons	Congressman William Timmons		Hate has no place in our community or country. Everyone is entitled to their own political opinions, but we are never going to solve our nation’s biggest issues without collaboration. We must work together and return to civility.	en	[]	[]	[]	8	4	19	[]	[]	https://twitter.com/RepTimmons/status/1229851862007975936	False	https://twitter.com/wyffnews4/status/1229576284939997186	0								[]				
1229794010144874496	1229794010144874496	2020-02-18 10:45:15 EST	2020-02-18	10:45:15	-0400	1079770852302958592	reptimmons	Congressman William Timmons		Excited to be back in the Upstate this week! A reminder that I will be at the Business and Brews event this evening in Greenville. You can register for it below. Look forward to seeing you there!   https://t.co/o6MJ6QAUZi  https://t.co/jtosAqrzuS	en	[]	['https://www.facebook.com/events/146284846821978/']	['https://pbs.twimg.com/media/EREbIiXXUAA3VT5.jpg']	2	5	8	[]	[]	https://twitter.com/RepTimmons/status/1229794010144874496	False		1	https://pbs.twimg.com/media/EREbIiXXUAA3VT5.jpg							[]				
1228425568724627457	1228425568724627457	2020-02-14 16:07:33 EST	2020-02-14	16:07:33	-0400	1079770852302958592	reptimmons	Congressman William Timmons		Last week, my team sent legislative updates to constituents across the Upstate. You can view the update here, or if you would like a hard copy sent to you, please call my Greenville office at 864-241-0175.   https://t.co/p18Kakzj97  https://t.co/zzxEF7e201	en	[]	['https://timmons.house.gov/sites/timmons.house.gov/files/TimmonsLegUpdateMailer%20-%20%201.21.20.pdf']	['https://pbs.twimg.com/media/EQw-ix1XsAI1KWQ.jpg']	1	2	1	[]	[]	https://twitter.com/RepTimmons/status/1228425568724627457	False		1	https://pbs.twimg.com/media/EQw-ix1XsAI1KWQ.jpg							[]				
1228358621110710272	1228358333750530053	2020-02-14 11:41:31 EST	2020-02-14	11:41:31	-0400	1079770852302958592	reptimmons	Congressman William Timmons		Click below to read more about what I am doing to combat China’s aggression.   https://t.co/oY32onC0bq	en	[]	['https://timmons.house.gov/media/press-releases/timmons-introduces-bill-counter-china-s-efforts-expand-5g-influence']	[]	0	2	6	[]	[]	https://twitter.com/RepTimmons/status/1228358621110710272	False		0								[]				
1228358333750530053	1228358333750530053	2020-02-14 11:40:23 EST	2020-02-14	11:40:23	-0400	1079770852302958592	reptimmons	Congressman William Timmons		Huawei has been ripping off U.S. companies for decades. We cannot let them do the same to our 5G networks.   https://t.co/V7rbL2pd2D	en	[]	['https://www.politico.com/news/2020/02/13/us-charges-huawei-with-racketeering-and-theft-114912']	[]	5	41	54	[]	[]	https://twitter.com/RepTimmons/status/1228358333750530053	False		0								[]				
1228106722075648000	1228106722075648000	2020-02-13 19:00:34 EST	2020-02-13	19:00:34	-0400	1079770852302958592	reptimmons	Congressman William Timmons		Today I had the opportunity to host a Valentines for Veterans event with @RepDeanPhillips. Several members and staff came by to write a note to our veterans for Valentine’s Day and thank them for their service. I will always be grateful for our veterans' service to the nation.  https://t.co/GGTFLHBgMP	en	[{'screen_name': 'repdeanphillips', 'name': 'rep. dean phillips 🇺🇸', 'id': '1061310112013434882'}]	[]	['https://pbs.twimg.com/media/EQscjewXYAARXIk.jpg', 'https://pbs.twimg.com/media/EQscjewXYAEPvi9.jpg', 'https://pbs.twimg.com/media/EQscjewW4AQzj6s.jpg', 'https://pbs.twimg.com/media/EQscjewXsAAhLYj.jpg']	1	5	15	[]	[]	https://twitter.com/RepTimmons/status/1228106722075648000	False		1	https://pbs.twimg.com/media/EQscjewXYAARXIk.jpg							[]				
1228067497754189831	1228067497754189831	2020-02-13 16:24:42 EST	2020-02-13	16:24:42	-0400	1079770852302958592	reptimmons	Congressman William Timmons		Great news for South Carolina, including the Upstate! I was proud to work with my colleagues and support this grant from @USDOT.	en	[{'screen_name': 'usdot', 'name': 'transportationgov', 'id': '393562221'}]	[]	[]	3	10	31	[]	[]	https://twitter.com/RepTimmons/status/1228067497754189831	False	https://twitter.com/SCPorts/status/1227354878009278465	0								[]				
1228044079935651841	1228044079935651841	2020-02-13 14:51:39 EST	2020-02-13	14:51:39	-0400	1079770852302958592	reptimmons	Congressman William Timmons		Next Tuesday at 5:30pm, I am looking forward to being at the Business and Brews event in Greenville to catch up with some local young professionals. You can learn more about the event and register for it below. Hope to see you there!  https://t.co/o6MJ6QAUZi	en	[]	['https://www.facebook.com/events/146284846821978/']	[]	2	4	10	[]	[]	https://twitter.com/RepTimmons/status/1228044079935651841	False		0								[]				
1227710731363246087	1227710731363246087	2020-02-12 16:47:02 EST	2020-02-12	16:47:02	-0400	1079770852302958592	reptimmons	Congressman William Timmons		China’s aggression in building out the world’s 5G platforms is a direct threat to American national security. Allowing the CCP to surveil the world through Huawei is unacceptable. I have introduced legislation to combat this — read up on it below ⬇️   https://t.co/oY32onC0bq	en	[]	['https://timmons.house.gov/media/press-releases/timmons-introduces-bill-counter-china-s-efforts-expand-5g-influence']	[]	67	788	1131	[]	[]	https://twitter.com/RepTimmons/status/1227710731363246087	False		0								[]				
1227337093984157698	1227337093984157698	2020-02-11 16:02:20 EST	2020-02-11	16:02:20	-0400	1079770852302958592	reptimmons	Congressman William Timmons		Congress should be working together to ensure the government is working for the American people. That starts by enacting reforms necessary to make government more efficient and accountable.	en	[]	[]	[]	4	5	15	[]	[]	https://twitter.com/RepTimmons/status/1227337093984157698	False	https://twitter.com/RepublicanStudy/status/1227327506883149825	0								[]				
1227235254244708352	1227235254244708352	2020-02-11 09:17:40 EST	2020-02-11	09:17:40	-0400	1079770852302958592	reptimmons	Congressman William Timmons		The Equifax hack was an attack on American consumers and the U.S. as a whole. I applaud the DOJ and their efforts to uncover that China was responsible for this attack. I look forward to continuing to work with my colleagues to take steps in protecting Americans’ information.	en	[]	[]	[]	33	598	627	[]	[]	https://twitter.com/RepTimmons/status/1227235254244708352	False	https://twitter.com/WSJ/status/1226893150779854848	0								[]				
1225908838219616256	1225908838219616256	2020-02-07 17:26:57 EST	2020-02-07	17:26:57	-0400	1079770852302958592	reptimmons	Congressman William Timmons		Thanks for the ride home, Mr. President! 🇺🇸🛫  It was such an awesome experience to fly to Charlotte today for the President’s #OpportunityNOW Summit on Air Force One. @realDonaldTrump and his team are doing amazing work to create economic opportunity for all Americans.  https://t.co/cO5ek7S0jC	en	[{'screen_name': 'realdonaldtrump', 'name': 'donald j. trump', 'id': '25073877'}]	[]	['https://pbs.twimg.com/media/EQNNla1U4AEHJpw.jpg', 'https://pbs.twimg.com/media/EQNNlaWWAAARvXc.jpg', 'https://pbs.twimg.com/media/EQNNlaVXsAEjhLK.jpg']	10	4	56	['opportunitynow']	[]	https://twitter.com/RepTimmons/status/1225908838219616256	False		1	https://pbs.twimg.com/media/EQNNla1U4AEHJpw.jpg							[]				
1225880797724446721	1225880797724446721	2020-02-07 15:35:32 EST	2020-02-07	15:35:32	-0400	1079770852302958592	reptimmons	Congressman William Timmons		I enjoyed talking with @CFPBDirector yesterday in @FinancialCmte. I am glad to hear the Bureau’s proposed small-dollar lending rule will be finalized soon and look forward to continuing to work with her on behalf on consumers. See my full questioning here:  https://t.co/g6chNiniwB  https://t.co/P1Cqrb0GCb	en	[{'screen_name': 'cfpbdirector', 'name': 'david uejio, acting director, cfpb', 'id': '1352287382129815552'}, {'screen_name': 'financialcmte', 'name': 'financial services gop', 'id': '42924141'}]	['https://youtu.be/MZ5Uv_iHh9E?t=5127']	['https://pbs.twimg.com/media/EQM0FieWoAILnWG.jpg']	1	2	3	[]	[]	https://twitter.com/RepTimmons/status/1225880797724446721	False		1	https://pbs.twimg.com/media/EQM0FieWoAILnWG.jpg							[]				
1225798259907670017	1225798259907670017	2020-02-07 10:07:34 EST	2020-02-07	10:07:34	-0400	1079770852302958592	reptimmons	Congressman William Timmons		Continuing proof that @realDonaldTrump’s pro-growth economic policies are working for the American people!	en	[{'screen_name': 'realdonaldtrump', 'name': 'donald j. trump', 'id': '25073877'}]	[]	[]	8	4	11	[]	[]	https://twitter.com/RepTimmons/status/1225798259907670017	False	https://twitter.com/CNBC/status/1225776559346397184	0								[]				
1225532019498766336	1225532019498766336	2020-02-06 16:29:37 EST	2020-02-06	16:29:37	-0400	1079770852302958592	reptimmons	Congressman William Timmons		The PRO Act would give labor unions almost unlimited power, increase costs for employers, and repeal states’ right-to-work laws, like those in South Carolina. This bill is an egregious overreach of the federal government — something we need less of, not more of, in the country.  https://t.co/wNZXz6hbXw	en	[]	[]	['https://pbs.twimg.com/media/EQH24C5WAAINb-X.jpg']	1	5	7	[]	[]	https://twitter.com/RepTimmons/status/1225532019498766336	False		1	https://pbs.twimg.com/media/EQH24C5WAAINb-X.jpg							[]				
1225519290339774465	1225519290339774465	2020-02-06 15:39:02 EST	2020-02-06	15:39:02	-0400	1079770852302958592	reptimmons	Congressman William Timmons		Great to chat with you, @KellieMeyerNews!	en	[{'screen_name': 'kelliemeyernews', 'name': 'kellie meyer', 'id': '1286925638'}]	[]	[]	1	2	4	[]	[]	https://twitter.com/RepTimmons/status/1225519290339774465	False	https://twitter.com/KellieMeyerNews/status/1225489399552659456	0								[]				
1225468041477206016	1225468041477206016	2020-02-06 12:15:23 EST	2020-02-06	12:15:23	-0400	1079770852302958592	reptimmons	Congressman William Timmons		Everyone please be safe! Listen to your local weather stations.	en	[]	[]	[]	1	2	7	[]	[]	https://twitter.com/RepTimmons/status/1225468041477206016	False	https://twitter.com/ParellaLewis/status/1225460863928283138	0								[]				
1225462466659962881	1225462361076719626	2020-02-06 11:53:14 EST	2020-02-06	11:53:14	-0400	1079770852302958592	reptimmons	Congressman William Timmons		.@RepublicanStudy’s GEAR Task Force report outlines our conservative vision and proposes key reforms to make government more accountable, transparent, and reins in federal overreach.   Read the full report below ⬇️  https://t.co/Bsm5cGreyF	en	[{'screen_name': 'republicanstudy', 'name': 'rsc', 'id': '22528309'}]	['https://rsc-johnson.house.gov/news/press-releases/johnson-gianforte-unveil-rsc-bureaucracy-reform-plan']	[]	1	8	19	[]	[]	https://twitter.com/RepTimmons/status/1225462466659962881	False		0								[]				
1225462361076719626	1225462361076719626	2020-02-06 11:52:49 EST	2020-02-06	11:52:49	-0400	1079770852302958592	reptimmons	Congressman William Timmons		One of the reasons I ran for Congress was to increase government accountability and transparency in Washington. I am proud to be a member of @RepublicanStudy’s Government Efficiency, Accountability, and Reform (GEAR) Task Force.	en	[{'screen_name': 'republicanstudy', 'name': 'rsc', 'id': '22528309'}]	[]	[]	4	2	9	[]	[]	https://twitter.com/RepTimmons/status/1225462361076719626	False		0								[]				
1225186912199172098	1225186912199172098	2020-02-05 17:38:17 EST	2020-02-05	17:38:17	-0400	1079770852302958592	reptimmons	Congressman William Timmons		Now that @realDonaldTrump has been acquitted, I am looking forward to getting back to work on the issues that are important to the American people.   Read my full statement here ⬇️  https://t.co/yRBFCGyeYn	en	[{'screen_name': 'realdonaldtrump', 'name': 'donald j. trump', 'id': '25073877'}]	['https://timmons.house.gov/media/press-releases/timmons-praises-acquittal-president-donald-j-trump']	[]	4	1	14	[]	[]	https://twitter.com/RepTimmons/status/1225186912199172098	False		0								[]				
1225109276206780416	1224907635738267649	2020-02-05 12:29:47 EST	2020-02-05	12:29:47	-0400	1079770852302958592	reptimmons	Congressman William Timmons		Read my full statement here ⬇️    https://t.co/tYZ4DqVzIG	en	[]	['https://timmons.house.gov/media/press-releases/timmons-responds-trump-sotu-best-yet-come']	[]	0	0	0	[]	[]	https://twitter.com/RepTimmons/status/1225109276206780416	False		0								[]				
1224907635738267649	1224907635738267649	2020-02-04 23:08:32 EST	2020-02-04	23:08:32	-0400	1079770852302958592	reptimmons	Congressman William Timmons		Tonight, the President delivered a strong and optimistic agenda for our country. @realdonaldtrump has kept his promises to the American people and is focused on an agenda that will keep America safe, provide a better future for working families, and continue to grow our economy.	en	[{'screen_name': 'realdonaldtrump', 'name': 'donald j. trump', 'id': '25073877'}]	[]	[]	7	5	28	[]	[]	https://twitter.com/RepTimmons/status/1224907635738267649	False		0								[]				
1224894484401487873	1224747356463292419	2020-02-04 22:16:17 EST	2020-02-04	22:16:17	-0400	1079770852302958592	reptimmons	Congressman William Timmons		@wmorin @Genghis_Juan Sorry you missed the last dozen opportunities...  https://t.co/551EWpViDA I hope that you can make one of these!	en	[]	['https://timmons.house.gov/services/coffee-and-conversation-congressman-timmons']	[]	0	0	2	[]	[]	https://twitter.com/RepTimmons/status/1224894484401487873	False		0								[{'screen_name': 'wmorin', 'name': 'Will Morin, M.P.A. 🌎', 'id': '15548511'}, {'screen_name': 'Genghis_Juan', 'name': 'Jack Sterling IV', 'id': '1037081917823361024'}]				
1224786968212537345	1224747356463292419	2020-02-04 15:09:03 EST	2020-02-04	15:09:03	-0400	1079770852302958592	reptimmons	Congressman William Timmons		@Genghis_Juan Happy to get together for a cup of coffee or a beer next time I am in town. Love to catch up!	en	[]	[]	[]	1	0	1	[]	[]	https://twitter.com/RepTimmons/status/1224786968212537345	False		0								[{'screen_name': 'Genghis_Juan', 'name': 'Jack Sterling IV', 'id': '1037081917823361024'}]				
1224786766789599232	1224747356463292419	2020-02-04 15:08:15 EST	2020-02-04	15:08:15	-0400	1079770852302958592	reptimmons	Congressman William Timmons		@Genghis_Juan Hi Jack. There is no data which suggests we are “hurting.” The fundamentals of our economy remain strong. While business investment did slow in 2019, with USMCA and a preliminary deal with China now in place, the business community is getting the stability it needs.	en	[]	[]	[]	3	0	2	[]	[]	https://twitter.com/RepTimmons/status/1224786766789599232	False		0								[{'screen_name': 'Genghis_Juan', 'name': 'Jack Sterling IV', 'id': '1037081917823361024'}]				
1224747475455631360	1224747356463292419	2020-02-04 12:32:07 EST	2020-02-04	12:32:07	-0400	1079770852302958592	reptimmons	Congressman William Timmons		.@realDonaldTrump has delivered on the promises he has made — whether it be growing the economy, keeping America safe, or fighting for free and fair global trade deals — and I am looking forward to hearing his vision that will keep America great. #SOTU2020  https://t.co/SzrCP9K3t6	en	[{'screen_name': 'realdonaldtrump', 'name': 'donald j. trump', 'id': '25073877'}]	[]	['https://pbs.twimg.com/media/EP8tVmxX0AAuaVb.jpg']	5	2	5	['sotu2020']	[]	https://twitter.com/RepTimmons/status/1224747475455631360	False		1	https://pbs.twimg.com/media/EP8tVmxX0AAuaVb.jpg							[]				
1224747356463292419	1224747356463292419	2020-02-04 12:31:39 EST	2020-02-04	12:31:39	-0400	1079770852302958592	reptimmons	Congressman William Timmons		In America we are seeing the effects of the President’s pro-growth policies since his election:  ◼️ Over 500,000 manufacturing jobs have been created ◼️ Record wage growth for Americans of all income levels ◼️ Unemployment is at a record low nationwide at 3.5% and at 2.3% in SC	en	[]	[]	[]	4	5	10	[]	[]	https://twitter.com/RepTimmons/status/1224747356463292419	False		0								[]				
1223007091679473665	1223007091679473665	2020-01-30 17:16:27 EST	2020-01-30	17:16:27	-0400	1079770852302958592	reptimmons	Congressman William Timmons		It was great to meet with the Slovak Ambassador, @IvanKorcok, yesterday and discuss the U.S.-Slovak relationship. Slovakia has purchased @LockheedMartin’s F-16’s that will be manufactured in the Upstate. I look forward to continuing to build on our relationship! 🇺🇸🇸🇰  https://t.co/bP0E0F8iuu	en	[{'screen_name': 'ivankorcok', 'name': 'ivan korcok', 'id': '4771118357'}, {'screen_name': 'lockheedmartin', 'name': 'lockheed martin', 'id': '42871498'}]	[]	['https://pbs.twimg.com/media/EPj-dtAXsAAzrio.jpg', 'https://pbs.twimg.com/media/EPj-dtBXkAEJOFQ.jpg']	3	2	21	[]	[]	https://twitter.com/RepTimmons/status/1223007091679473665	False		1	https://pbs.twimg.com/media/EPj-dtAXsAAzrio.jpg							[]				
1222944292563496963	1222944292563496963	2020-01-30 13:06:55 EST	2020-01-30	13:06:55	-0400	1079770852302958592	reptimmons	Congressman William Timmons		House Democrats just pushed through two dangerous war powers bills. Read my full statement here ⬇️   https://t.co/vQpsEy0zie	en	[]	['https://timmons.house.gov/media/press-releases/timmons-votes-preserve-presidents-power-commander-chief']	[]	3	3	2	[]	[]	https://twitter.com/RepTimmons/status/1222944292563496963	False		0								[]				
1222632042313191427	1222632042313191427	2020-01-29 16:26:08 EST	2020-01-29	16:26:08	-0400	1079770852302958592	reptimmons	Congressman William Timmons		.@realDonaldTrump has put forward an aggressive, yet realistic, peace proposal for the Middle East. I hope leaders across the region continue to give the plan serious consideration. ⬇️    https://t.co/w96ieMRyqy	en	[{'screen_name': 'realdonaldtrump', 'name': 'donald j. trump', 'id': '25073877'}]	['https://www.whitehouse.gov/peacetoprosperity/']	[]	2	1	11	[]	[]	https://twitter.com/RepTimmons/status/1222632042313191427	False		0								[]				
1222567398882119682	1222567398882119682	2020-01-29 12:09:16 EST	2020-01-29	12:09:16	-0400	1079770852302958592	reptimmons	Congressman William Timmons		.@POTUS delivered on his promise of a better deal for American workers by signing #USMCA today. The deal puts South Carolina workers first and will better serve manufacturers, farmers, and businesses throughout the Upstate and the country. I was proud to support the agreement.  https://t.co/aJb2nphrtU	en	[{'screen_name': 'potus', 'name': 'president biden', 'id': '1349149096909668363'}]	[]	['https://pbs.twimg.com/media/EPdukUzX4AEYPyk.jpg']	0	11	21	['usmca']	[]	https://twitter.com/RepTimmons/status/1222567398882119682	False		1	https://pbs.twimg.com/media/EPdukUzX4AEYPyk.jpg							[]				
1222297741549764608	1222297741549764608	2020-01-28 18:17:45 EST	2020-01-28	18:17:45	-0400	1079770852302958592	reptimmons	Congressman William Timmons		Four new Coffee and Conversation event locations and times have been confirmed for February. Click here for more information:  https://t.co/551EWpViDA	en	[]	['https://timmons.house.gov/services/coffee-and-conversation-congressman-timmons']	[]	0	5	11	[]	[]	https://twitter.com/RepTimmons/status/1222297741549764608	False		0								[]				
1220820918873792513	1220820918873792513	2020-01-24 16:29:23 EST	2020-01-24	16:29:23	-0400	1079770852302958592	reptimmons	Congressman William Timmons		This week I had the opportunity to sit down with students from my former school, Christ Church Middle School, and from Byrnes High School. These students have bright futures ahead of them!  https://t.co/XS7087qQtx	en	[]	[]	['https://pbs.twimg.com/media/EPE6JwmWAAQ_lsV.jpg', 'https://pbs.twimg.com/media/EPE6JwmW4AELHro.jpg']	3	2	14	[]	[]	https://twitter.com/RepTimmons/status/1220820918873792513	False		1	https://pbs.twimg.com/media/EPE6JwmWAAQ_lsV.jpg							[]				
1220769132733435906	1220769132733435906	2020-01-24 13:03:36 EST	2020-01-24	13:03:36	-0400	1079770852302958592	reptimmons	Congressman William Timmons		The unemployment rate for SC-04 has dropped and continues to drop, even below the overall South Carolina unemployment rate. Great news for SC and the Upstate!	en	[]	[]	[]	0	3	10	[]	[]	https://twitter.com/RepTimmons/status/1220769132733435906	False	https://twitter.com/SCDEWinfo/status/1220715261873065984	0								[]				
1220723895852064771	1220723895852064771	2020-01-24 10:03:51 EST	2020-01-24	10:03:51	-0400	1079770852302958592	reptimmons	Congressman William Timmons		Today, thousands will descend on DC to proclaim their support for life. Thank you to those from SC-04 and from all over the country for using your voice today and every day to advocate for the most vulnerable in our society. #WhyWeMarch  https://t.co/T1p5MyO0g4	en	[]	[]	['https://pbs.twimg.com/media/EPDh6bSX0AsEKn5.jpg']	24	37	139	['whywemarch']	[]	https://twitter.com/RepTimmons/status/1220723895852064771	False		1	https://pbs.twimg.com/media/EPDh6bSX0AsEKn5.jpg							[]				
